1527891334.304258 IP (tos 0x0, ttl 64, id 60863, offset 0, flags [DF], proto TCP (6), length 60)
    rpi33.lan.43620 > rpi37.lan.46656: Flags [S], cksum 0x848d (incorrect -> 0x43e7), seq 2856076056, win 29200, options [mss 1460,sackOK,TS val 285781671 ecr 0,nop,wscale 7], length 0
1527891334.305017 IP (tos 0x0, ttl 64, id 0, offset 0, flags [DF], proto TCP (6), length 60)
    rpi37.lan.46656 > rpi33.lan.43620: Flags [S.], cksum 0x9bc1 (correct), seq 1729987143, ack 2856076057, win 28960, options [mss 1460,sackOK,TS val 285781655 ecr 285781671,nop,wscale 7], length 0
1527891334.305179 IP (tos 0x0, ttl 64, id 60864, offset 0, flags [DF], proto TCP (6), length 52)
    rpi33.lan.43620 > rpi37.lan.46656: Flags [.], cksum 0x8485 (incorrect -> 0x3ac8), ack 1, win 229, options [nop,nop,TS val 285781672 ecr 285781655], length 0
1527891334.318417 IP (tos 0x0, ttl 64, id 11487, offset 0, flags [DF], proto TCP (6), length 86)
    rpi37.lan.46656 > rpi33.lan.43620: Flags [P.], cksum 0x41e3 (correct), seq 1:35, ack 1, win 227, options [nop,nop,TS val 285781657 ecr 285781672], length 34
1527891334.318512 IP (tos 0x0, ttl 64, id 60865, offset 0, flags [DF], proto TCP (6), length 52)
    rpi33.lan.43620 > rpi37.lan.46656: Flags [.], cksum 0x8485 (incorrect -> 0x3aa3), ack 35, win 229, options [nop,nop,TS val 285781673 ecr 285781657], length 0
1527891334.321622 IP (tos 0x0, ttl 64, id 60866, offset 0, flags [DF], proto TCP (6), length 86)
    rpi33.lan.43620 > rpi37.lan.46656: Flags [P.], cksum 0x84a7 (incorrect -> 0x7f13), seq 1:35, ack 35, win 229, options [nop,nop,TS val 285781673 ecr 285781657], length 34
1527891334.322173 IP (tos 0x0, ttl 64, id 11488, offset 0, flags [DF], proto TCP (6), length 52)
    rpi37.lan.46656 > rpi33.lan.43620: Flags [.], cksum 0x3a83 (correct), ack 35, win 227, options [nop,nop,TS val 285781657 ecr 285781673], length 0
1527891334.330931 IP (tos 0x0, ttl 64, id 26062, offset 0, flags [DF], proto TCP (6), length 60)
    rpi33.lan.54402 > rpi39.lan.46656: Flags [S], cksum 0x848f (incorrect -> 0x1371), seq 675531620, win 29200, options [mss 1460,sackOK,TS val 285781674 ecr 0,nop,wscale 7], length 0
1527891334.331622 IP (tos 0x0, ttl 64, id 0, offset 0, flags [DF], proto TCP (6), length 60)
    rpi39.lan.46656 > rpi33.lan.54402: Flags [S.], cksum 0x8ab3 (correct), seq 2994280305, ack 675531621, win 28960, options [mss 1460,sackOK,TS val 285781673 ecr 285781674,nop,wscale 7], length 0
1527891334.331742 IP (tos 0x0, ttl 64, id 26063, offset 0, flags [DF], proto TCP (6), length 52)
    rpi33.lan.54402 > rpi39.lan.46656: Flags [.], cksum 0x8487 (incorrect -> 0x29bb), ack 1, win 229, options [nop,nop,TS val 285781674 ecr 285781673], length 0
1527891334.335269 IP (tos 0x0, ttl 64, id 11489, offset 0, flags [DF], proto TCP (6), length 1096)
    rpi37.lan.46656 > rpi33.lan.43620: Flags [P.], cksum 0xc0ca (correct), seq 35:1079, ack 35, win 227, options [nop,nop,TS val 285781658 ecr 285781673], length 1044
1527891334.338555 IP (tos 0x0, ttl 64, id 60867, offset 0, flags [DF], proto TCP (6), length 1096)
    rpi33.lan.43620 > rpi37.lan.46656: Flags [P.], cksum 0x8899 (incorrect -> 0x1259), seq 35:1079, ack 1079, win 245, options [nop,nop,TS val 285781675 ecr 285781658], length 1044
1527891334.344620 IP (tos 0x0, ttl 64, id 26064, offset 0, flags [DF], proto TCP (6), length 86)
    rpi33.lan.54402 > rpi39.lan.46656: Flags [P.], cksum 0x84a9 (incorrect -> 0xc4be), seq 1:35, ack 1, win 229, options [nop,nop,TS val 285781676 ecr 285781673], length 34
1527891334.345030 IP (tos 0x0, ttl 64, id 47576, offset 0, flags [DF], proto TCP (6), length 86)
    rpi39.lan.46656 > rpi33.lan.54402: Flags [P.], cksum 0x4120 (correct), seq 1:35, ack 1, win 227, options [nop,nop,TS val 285781675 ecr 285781674], length 34
1527891334.345122 IP (tos 0x0, ttl 64, id 26065, offset 0, flags [DF], proto TCP (6), length 52)
    rpi33.lan.54402 > rpi39.lan.46656: Flags [.], cksum 0x8487 (incorrect -> 0x2973), ack 35, win 229, options [nop,nop,TS val 285781676 ecr 285781675], length 0
1527891334.345202 IP (tos 0x0, ttl 64, id 47577, offset 0, flags [DF], proto TCP (6), length 52)
    rpi39.lan.46656 > rpi33.lan.54402: Flags [.], cksum 0x2975 (correct), ack 35, win 227, options [nop,nop,TS val 285781675 ecr 285781676], length 0
1527891334.348842 IP (tos 0x0, ttl 64, id 60868, offset 0, flags [DF], proto TCP (6), length 1096)
    rpi33.lan.43620 > rpi37.lan.46656: Flags [P.], cksum 0x8899 (incorrect -> 0xb23a), seq 1079:2123, ack 1079, win 245, options [nop,nop,TS val 285781676 ecr 285781658], length 1044
1527891334.349725 IP (tos 0x0, ttl 64, id 11490, offset 0, flags [DF], proto TCP (6), length 1096)
    rpi37.lan.46656 > rpi33.lan.43620: Flags [P.], cksum 0x8b9e (correct), seq 1079:2123, ack 1079, win 243, options [nop,nop,TS val 285781660 ecr 285781675], length 1044
1527891334.358366 IP (tos 0x0, ttl 64, id 47578, offset 0, flags [DF], proto TCP (6), length 1096)
    rpi39.lan.46656 > rpi33.lan.54402: Flags [P.], cksum 0x24e8 (correct), seq 35:1079, ack 35, win 227, options [nop,nop,TS val 285781676 ecr 285781676], length 1044
1527891334.358517 IP (tos 0x0, ttl 64, id 26066, offset 0, flags [DF], proto TCP (6), length 52)
    rpi33.lan.54402 > rpi39.lan.46656: Flags [.], cksum 0x8487 (incorrect -> 0x254d), ack 1079, win 245, options [nop,nop,TS val 285781677 ecr 285781676], length 0
1527891334.364761 IP (tos 0x0, ttl 64, id 26067, offset 0, flags [DF], proto TCP (6), length 1096)
    rpi33.lan.54402 > rpi39.lan.46656: Flags [P.], cksum 0x889b (incorrect -> 0xdd13), seq 35:1079, ack 1079, win 245, options [nop,nop,TS val 285781678 ecr 285781676], length 1044
1527891334.375945 IP (tos 0x0, ttl 64, id 47579, offset 0, flags [DF], proto TCP (6), length 1096)
    rpi39.lan.46656 > rpi33.lan.54402: Flags [P.], cksum 0xd97f (correct), seq 1079:2123, ack 1079, win 243, options [nop,nop,TS val 285781678 ecr 285781678], length 1044
1527891334.378683 IP (tos 0x0, ttl 64, id 26068, offset 0, flags [DF], proto TCP (6), length 1096)
    rpi33.lan.54402 > rpi39.lan.46656: Flags [P.], cksum 0x889b (incorrect -> 0xee4f), seq 1079:2123, ack 2123, win 261, options [nop,nop,TS val 285781679 ecr 285781678], length 1044
1527891334.394545 IP (tos 0x0, ttl 64, id 60869, offset 0, flags [DF], proto TCP (6), length 52)
    rpi33.lan.43620 > rpi37.lan.46656: Flags [.], cksum 0x8485 (incorrect -> 0x2a06), ack 2123, win 261, options [nop,nop,TS val 285781681 ecr 285781660], length 0
1527891334.395229 IP (tos 0x0, ttl 64, id 11491, offset 0, flags [DF], proto TCP (6), length 52)
    rpi37.lan.46656 > rpi33.lan.43620: Flags [.], cksum 0x2a09 (correct), ack 2123, win 259, options [nop,nop,TS val 285781664 ecr 285781676], length 0
1527891334.421494 IP (tos 0x0, ttl 64, id 47580, offset 0, flags [DF], proto TCP (6), length 52)
    rpi39.lan.46656 > rpi33.lan.54402: Flags [.], cksum 0x18fa (correct), ack 2123, win 259, options [nop,nop,TS val 285781683 ecr 285781679], length 0
1527891334.456920 IP (tos 0x0, ttl 64, id 11492, offset 0, flags [DF], proto TCP (6), length 1096)
    rpi37.lan.46656 > rpi33.lan.43620: Flags [P.], cksum 0x2b5e (correct), seq 2123:3167, ack 2123, win 259, options [nop,nop,TS val 285781671 ecr 285781676], length 1044
1527891334.457055 IP (tos 0x0, ttl 64, id 60870, offset 0, flags [DF], proto TCP (6), length 52)
    rpi33.lan.43620 > rpi37.lan.46656: Flags [.], cksum 0x8485 (incorrect -> 0x25d0), ack 3167, win 278, options [nop,nop,TS val 285781687 ecr 285781671], length 0
1527891334.468838 IP (tos 0x0, ttl 64, id 60871, offset 0, flags [DF], proto TCP (6), length 1096)
    rpi33.lan.43620 > rpi37.lan.46656: Flags [P.], cksum 0x8899 (incorrect -> 0x6296), seq 2123:3167, ack 3167, win 278, options [nop,nop,TS val 285781688 ecr 285781671], length 1044
1527891334.484265 IP (tos 0x0, ttl 64, id 26069, offset 0, flags [DF], proto TCP (6), length 1096)
    rpi33.lan.54402 > rpi39.lan.46656: Flags [P.], cksum 0x889b (incorrect -> 0xb62a), seq 2123:3167, ack 2123, win 261, options [nop,nop,TS val 285781689 ecr 285781683], length 1044
1527891334.485113 IP (tos 0x0, ttl 64, id 47581, offset 0, flags [DF], proto TCP (6), length 52)
    rpi39.lan.46656 > rpi33.lan.54402: Flags [.], cksum 0x14c5 (correct), ack 3167, win 276, options [nop,nop,TS val 285781689 ecr 285781689], length 0
1527891334.486145 IP (tos 0x0, ttl 64, id 47582, offset 0, flags [DF], proto TCP (6), length 1096)
    rpi39.lan.46656 > rpi33.lan.54402: Flags [P.], cksum 0xb818 (correct), seq 2123:3167, ack 3167, win 276, options [nop,nop,TS val 285781689 ecr 285781689], length 1044
1527891334.515924 IP (tos 0x0, ttl 64, id 11493, offset 0, flags [DF], proto TCP (6), length 52)
    rpi37.lan.46656 > rpi33.lan.43620: Flags [.], cksum 0x21b7 (correct), ack 3167, win 276, options [nop,nop,TS val 285781677 ecr 285781688], length 0
1527891334.534505 IP (tos 0x0, ttl 64, id 26070, offset 0, flags [DF], proto TCP (6), length 52)
    rpi33.lan.54402 > rpi39.lan.46656: Flags [.], cksum 0x8487 (incorrect -> 0x10a9), ack 3167, win 278, options [nop,nop,TS val 285781695 ecr 285781689], length 0
1527891334.569683 IP (tos 0x0, ttl 64, id 60872, offset 0, flags [DF], proto TCP (6), length 1096)
    rpi33.lan.43620 > rpi37.lan.46656: Flags [P.], cksum 0x8899 (incorrect -> 0x27fd), seq 3167:4211, ack 3167, win 278, options [nop,nop,TS val 285781698 ecr 285781677], length 1044
1527891334.570555 IP (tos 0x0, ttl 64, id 11494, offset 0, flags [DF], proto TCP (6), length 52)
    rpi37.lan.46656 > rpi33.lan.43620: Flags [.], cksum 0x1d84 (correct), ack 4211, win 292, options [nop,nop,TS val 285781682 ecr 285781698], length 0
1527891334.633086 IP (tos 0x0, ttl 64, id 30567, offset 0, flags [DF], proto TCP (6), length 60)
    rpi33.lan.43670 > rpi38.lan.46656: Flags [S], cksum 0x848e (incorrect -> 0x4ca3), seq 177592751, win 29200, options [mss 1460,sackOK,TS val 285781704 ecr 0,nop,wscale 7], length 0
1527891334.633848 IP (tos 0x0, ttl 64, id 0, offset 0, flags [DF], proto TCP (6), length 60)
    rpi38.lan.46656 > rpi33.lan.43670: Flags [S.], cksum 0x1959 (correct), seq 364274781, ack 177592752, win 28960, options [mss 1460,sackOK,TS val 285780237 ecr 285781704,nop,wscale 7], length 0
1527891334.633973 IP (tos 0x0, ttl 64, id 30568, offset 0, flags [DF], proto TCP (6), length 52)
    rpi33.lan.43670 > rpi38.lan.46656: Flags [.], cksum 0x8486 (incorrect -> 0xb860), ack 1, win 229, options [nop,nop,TS val 285781704 ecr 285780237], length 0
1527891334.646743 IP (tos 0x0, ttl 64, id 30569, offset 0, flags [DF], proto TCP (6), length 86)
    rpi33.lan.43670 > rpi38.lan.46656: Flags [P.], cksum 0x84a8 (incorrect -> 0xede0), seq 1:35, ack 1, win 229, options [nop,nop,TS val 285781706 ecr 285780237], length 34
1527891334.647356 IP (tos 0x0, ttl 64, id 52563, offset 0, flags [DF], proto TCP (6), length 52)
    rpi38.lan.46656 > rpi33.lan.43670: Flags [.], cksum 0xb83d (correct), ack 35, win 227, options [nop,nop,TS val 285780238 ecr 285781706], length 0
1527891334.649610 IP (tos 0x0, ttl 64, id 26071, offset 0, flags [DF], proto TCP (6), length 1096)
    rpi33.lan.54402 > rpi39.lan.46656: Flags [P.], cksum 0x889b (incorrect -> 0xeffd), seq 3167:4211, ack 3167, win 278, options [nop,nop,TS val 285781706 ecr 285781689], length 1044
1527891334.649649 IP (tos 0x0, ttl 64, id 52564, offset 0, flags [DF], proto TCP (6), length 86)
    rpi38.lan.46656 > rpi33.lan.43670: Flags [P.], cksum 0xebe3 (correct), seq 1:35, ack 35, win 227, options [nop,nop,TS val 285780238 ecr 285781706], length 34
1527891334.649734 IP (tos 0x0, ttl 64, id 30570, offset 0, flags [DF], proto TCP (6), length 52)
    rpi33.lan.43670 > rpi38.lan.46656: Flags [.], cksum 0x8486 (incorrect -> 0xb819), ack 35, win 229, options [nop,nop,TS val 285781706 ecr 285780238], length 0
1527891334.663372 IP (tos 0x0, ttl 64, id 52565, offset 0, flags [DF], proto TCP (6), length 1096)
    rpi38.lan.46656 > rpi33.lan.43670: Flags [P.], cksum 0x5078 (correct), seq 35:1079, ack 35, win 227, options [nop,nop,TS val 285780240 ecr 285781706], length 1044
1527891334.663513 IP (tos 0x0, ttl 64, id 30571, offset 0, flags [DF], proto TCP (6), length 52)
    rpi33.lan.43670 > rpi38.lan.46656: Flags [.], cksum 0x8486 (incorrect -> 0xb3f2), ack 1079, win 245, options [nop,nop,TS val 285781707 ecr 285780240], length 0
1527891334.665789 IP (tos 0x0, ttl 64, id 30572, offset 0, flags [DF], proto TCP (6), length 1096)
    rpi33.lan.43670 > rpi38.lan.46656: Flags [P.], cksum 0x889a (incorrect -> 0x79ee), seq 35:1079, ack 1079, win 245, options [nop,nop,TS val 285781708 ecr 285780240], length 1044
1527891334.676579 IP (tos 0x0, ttl 64, id 30573, offset 0, flags [DF], proto TCP (6), length 1096)
    rpi33.lan.43670 > rpi38.lan.46656: Flags [P.], cksum 0x889a (incorrect -> 0x2f1e), seq 1079:2123, ack 1079, win 245, options [nop,nop,TS val 285781709 ecr 285780240], length 1044
1527891334.676771 IP (tos 0x0, ttl 64, id 52566, offset 0, flags [DF], proto TCP (6), length 1096)
    rpi38.lan.46656 > rpi33.lan.43670: Flags [P.], cksum 0xb64f (correct), seq 1079:2123, ack 1079, win 243, options [nop,nop,TS val 285780241 ecr 285781708], length 1044
1527891334.676947 IP (tos 0x0, ttl 64, id 11495, offset 0, flags [DF], proto TCP (6), length 1096)
    rpi37.lan.46656 > rpi33.lan.43620: Flags [P.], cksum 0x1f40 (correct), seq 3167:4211, ack 4211, win 292, options [nop,nop,TS val 285781693 ecr 285781698], length 1044
1527891334.677047 IP (tos 0x0, ttl 64, id 11496, offset 0, flags [DF], proto TCP (6), length 1096)
    rpi37.lan.46656 > rpi33.lan.43620: Flags [P.], cksum 0xd26b (correct), seq 4211:5255, ack 4211, win 292, options [nop,nop,TS val 285781693 ecr 285781698], length 1044
1527891334.677103 IP (tos 0x0, ttl 64, id 60873, offset 0, flags [DF], proto TCP (6), length 52)
    rpi33.lan.43620 > rpi37.lan.46656: Flags [.], cksum 0x8485 (incorrect -> 0x1534), ack 5255, win 310, options [nop,nop,TS val 285781709 ecr 285781693], length 0
1527891334.677199 IP (tos 0x0, ttl 64, id 11497, offset 0, flags [DF], proto TCP (6), length 1096)
    rpi37.lan.46656 > rpi33.lan.43620: Flags [P.], cksum 0xb55c (correct), seq 5255:6299, ack 4211, win 292, options [nop,nop,TS val 285781693 ecr 285781698], length 1044
1527891334.677352 IP (tos 0x0, ttl 64, id 11498, offset 0, flags [DF], proto TCP (6), length 1096)
    rpi37.lan.46656 > rpi33.lan.43620: Flags [P.], cksum 0x14b0 (correct), seq 6299:7343, ack 4211, win 292, options [nop,nop,TS val 285781693 ecr 285781698], length 1044
1527891334.677408 IP (tos 0x0, ttl 64, id 60874, offset 0, flags [DF], proto TCP (6), length 52)
    rpi33.lan.43620 > rpi37.lan.46656: Flags [.], cksum 0x8485 (incorrect -> 0x0ceb), ack 7343, win 343, options [nop,nop,TS val 285781709 ecr 285781693], length 0
1527891334.677498 IP (tos 0x0, ttl 64, id 11499, offset 0, flags [DF], proto TCP (6), length 1096)
    rpi37.lan.46656 > rpi33.lan.43620: Flags [P.], cksum 0xf00f (correct), seq 7343:8387, ack 4211, win 292, options [nop,nop,TS val 285781693 ecr 285781698], length 1044
1527891334.677634 IP (tos 0x0, ttl 64, id 11500, offset 0, flags [DF], proto TCP (6), length 1096)
    rpi37.lan.46656 > rpi33.lan.43620: Flags [P.], cksum 0xc477 (correct), seq 8387:9431, ack 4211, win 292, options [nop,nop,TS val 285781693 ecr 285781698], length 1044
1527891334.677687 IP (tos 0x0, ttl 64, id 60875, offset 0, flags [DF], proto TCP (6), length 52)
    rpi33.lan.43620 > rpi37.lan.46656: Flags [.], cksum 0x8485 (incorrect -> 0x04a3), ack 9431, win 375, options [nop,nop,TS val 285781709 ecr 285781693], length 0
1527891334.677822 IP (tos 0x0, ttl 64, id 11501, offset 0, flags [DF], proto TCP (6), length 1096)
    rpi37.lan.46656 > rpi33.lan.43620: Flags [P.], cksum 0x8482 (correct), seq 9431:10475, ack 4211, win 292, options [nop,nop,TS val 285781693 ecr 285781698], length 1044
1527891334.678030 IP (tos 0x0, ttl 64, id 11502, offset 0, flags [DF], proto TCP (6), length 1096)
    rpi37.lan.46656 > rpi33.lan.43620: Flags [P.], cksum 0x60e4 (correct), seq 10475:11519, ack 4211, win 292, options [nop,nop,TS val 285781693 ecr 285781709], length 1044
1527891334.678126 IP (tos 0x0, ttl 64, id 60876, offset 0, flags [DF], proto TCP (6), length 52)
    rpi33.lan.43620 > rpi37.lan.46656: Flags [.], cksum 0x8485 (incorrect -> 0xfc59), ack 11519, win 408, options [nop,nop,TS val 285781709 ecr 285781693], length 0
1527891334.678235 IP (tos 0x0, ttl 64, id 11503, offset 0, flags [DF], proto TCP (6), length 1096)
    rpi37.lan.46656 > rpi33.lan.43620: Flags [P.], cksum 0x3d46 (correct), seq 11519:12563, ack 4211, win 292, options [nop,nop,TS val 285781693 ecr 285781709], length 1044
1527891334.678239 IP (tos 0x0, ttl 64, id 11504, offset 0, flags [DF], proto TCP (6), length 1096)
    rpi37.lan.46656 > rpi33.lan.43620: Flags [P.], cksum 0xbcef (correct), seq 12563:13607, ack 4211, win 292, options [nop,nop,TS val 285781693 ecr 285781709], length 1044
1527891334.678361 IP (tos 0x0, ttl 64, id 60877, offset 0, flags [DF], proto TCP (6), length 52)
    rpi33.lan.43620 > rpi37.lan.46656: Flags [.], cksum 0x8485 (incorrect -> 0xf410), ack 13607, win 441, options [nop,nop,TS val 285781709 ecr 285781693], length 0
1527891334.678419 IP (tos 0x0, ttl 64, id 11505, offset 0, flags [DF], proto TCP (6), length 1096)
    rpi37.lan.46656 > rpi33.lan.43620: Flags [P.], cksum 0xba0a (correct), seq 13607:14651, ack 4211, win 292, options [nop,nop,TS val 285781693 ecr 285781709], length 1044
1527891334.678531 IP (tos 0x0, ttl 64, id 11506, offset 0, flags [DF], proto TCP (6), length 1096)
    rpi37.lan.46656 > rpi33.lan.43620: Flags [P.], cksum 0xfd2a (correct), seq 14651:15695, ack 4211, win 292, options [nop,nop,TS val 285781693 ecr 285781709], length 1044
1527891334.678621 IP (tos 0x0, ttl 64, id 60878, offset 0, flags [DF], proto TCP (6), length 52)
    rpi33.lan.43620 > rpi37.lan.46656: Flags [.], cksum 0x8485 (incorrect -> 0xebc8), ack 15695, win 473, options [nop,nop,TS val 285781709 ecr 285781693], length 0
1527891334.678679 IP (tos 0x0, ttl 64, id 11507, offset 0, flags [DF], proto TCP (6), length 1096)
    rpi37.lan.46656 > rpi33.lan.43620: Flags [P.], cksum 0x5bd0 (correct), seq 15695:16739, ack 4211, win 292, options [nop,nop,TS val 285781693 ecr 285781709], length 1044
1527891334.678775 IP (tos 0x0, ttl 64, id 11508, offset 0, flags [DF], proto TCP (6), length 1096)
    rpi37.lan.46656 > rpi33.lan.43620: Flags [P.], cksum 0x0524 (correct), seq 16739:17783, ack 4211, win 292, options [nop,nop,TS val 285781693 ecr 285781709], length 1044
1527891334.678826 IP (tos 0x0, ttl 64, id 60879, offset 0, flags [DF], proto TCP (6), length 52)
    rpi33.lan.43620 > rpi37.lan.46656: Flags [.], cksum 0x8485 (incorrect -> 0xe37f), ack 17783, win 506, options [nop,nop,TS val 285781709 ecr 285781693], length 0
1527891334.678939 IP (tos 0x0, ttl 64, id 11509, offset 0, flags [DF], proto TCP (6), length 1096)
    rpi37.lan.46656 > rpi33.lan.43620: Flags [P.], cksum 0xf1fc (correct), seq 17783:18827, ack 4211, win 292, options [nop,nop,TS val 285781693 ecr 285781709], length 1044
1527891334.679100 IP (tos 0x0, ttl 64, id 11510, offset 0, flags [DF], proto TCP (6), length 1096)
    rpi37.lan.46656 > rpi33.lan.43620: Flags [P.], cksum 0x7649 (correct), seq 18827:19871, ack 4211, win 292, options [nop,nop,TS val 285781693 ecr 285781709], length 1044
1527891334.679148 IP (tos 0x0, ttl 64, id 60880, offset 0, flags [DF], proto TCP (6), length 52)
    rpi33.lan.43620 > rpi37.lan.46656: Flags [.], cksum 0x8485 (incorrect -> 0xdb36), ack 19871, win 539, options [nop,nop,TS val 285781709 ecr 285781693], length 0
1527891334.679260 IP (tos 0x0, ttl 64, id 11511, offset 0, flags [DF], proto TCP (6), length 1096)
    rpi37.lan.46656 > rpi33.lan.43620: Flags [P.], cksum 0xb2db (correct), seq 19871:20915, ack 4211, win 292, options [nop,nop,TS val 285781693 ecr 285781709], length 1044
1527891334.679407 IP (tos 0x0, ttl 64, id 11512, offset 0, flags [DF], proto TCP (6), length 1096)
    rpi37.lan.46656 > rpi33.lan.43620: Flags [P.], cksum 0x9d9d (correct), seq 20915:21959, ack 4211, win 292, options [nop,nop,TS val 285781693 ecr 285781709], length 1044
1527891334.679464 IP (tos 0x0, ttl 64, id 60881, offset 0, flags [DF], proto TCP (6), length 52)
    rpi33.lan.43620 > rpi37.lan.46656: Flags [.], cksum 0x8485 (incorrect -> 0xd2ee), ack 21959, win 571, options [nop,nop,TS val 285781709 ecr 285781693], length 0
1527891334.679580 IP (tos 0x0, ttl 64, id 11513, offset 0, flags [DF], proto TCP (6), length 1096)
    rpi37.lan.46656 > rpi33.lan.43620: Flags [P.], cksum 0x9af0 (correct), seq 21959:23003, ack 4211, win 292, options [nop,nop,TS val 285781693 ecr 285781709], length 1044
1527891334.679727 IP (tos 0x0, ttl 64, id 11514, offset 0, flags [DF], proto TCP (6), length 1096)
    rpi37.lan.46656 > rpi33.lan.43620: Flags [P.], cksum 0xc84f (correct), seq 23003:24047, ack 4211, win 292, options [nop,nop,TS val 285781693 ecr 285781709], length 1044
1527891334.679776 IP (tos 0x0, ttl 64, id 60882, offset 0, flags [DF], proto TCP (6), length 52)
    rpi33.lan.43620 > rpi37.lan.46656: Flags [.], cksum 0x8485 (incorrect -> 0xcaa5), ack 24047, win 604, options [nop,nop,TS val 285781709 ecr 285781693], length 0
1527891334.679871 IP (tos 0x0, ttl 64, id 11515, offset 0, flags [DF], proto TCP (6), length 1096)
    rpi37.lan.46656 > rpi33.lan.43620: Flags [P.], cksum 0x0ba6 (correct), seq 24047:25091, ack 4211, win 292, options [nop,nop,TS val 285781693 ecr 285781709], length 1044
1527891334.680040 IP (tos 0x0, ttl 64, id 11516, offset 0, flags [DF], proto TCP (6), length 1096)
    rpi37.lan.46656 > rpi33.lan.43620: Flags [P.], cksum 0x4245 (correct), seq 25091:26135, ack 4211, win 292, options [nop,nop,TS val 285781693 ecr 285781709], length 1044
1527891334.680096 IP (tos 0x0, ttl 64, id 60883, offset 0, flags [DF], proto TCP (6), length 52)
    rpi33.lan.43620 > rpi37.lan.46656: Flags [.], cksum 0x8485 (incorrect -> 0xc25d), ack 26135, win 636, options [nop,nop,TS val 285781709 ecr 285781693], length 0
1527891334.680232 IP (tos 0x0, ttl 64, id 11517, offset 0, flags [DF], proto TCP (6), length 1096)
    rpi37.lan.46656 > rpi33.lan.43620: Flags [P.], cksum 0x43f6 (correct), seq 26135:27179, ack 4211, win 292, options [nop,nop,TS val 285781693 ecr 285781709], length 1044
1527891334.681280 IP (tos 0x0, ttl 64, id 11518, offset 0, flags [DF], proto TCP (6), length 1096)
    rpi37.lan.46656 > rpi33.lan.43620: Flags [P.], cksum 0xa67b (correct), seq 27179:28223, ack 4211, win 292, options [nop,nop,TS val 285781693 ecr 285781709], length 1044
1527891334.681338 IP (tos 0x0, ttl 64, id 60884, offset 0, flags [DF], proto TCP (6), length 52)
    rpi33.lan.43620 > rpi37.lan.46656: Flags [.], cksum 0x8485 (incorrect -> 0xba14), ack 28223, win 669, options [nop,nop,TS val 285781709 ecr 285781693], length 0
1527891334.681455 IP (tos 0x0, ttl 64, id 11519, offset 0, flags [DF], proto TCP (6), length 1096)
    rpi37.lan.46656 > rpi33.lan.43620: Flags [P.], cksum 0x45bf (correct), seq 28223:29267, ack 4211, win 292, options [nop,nop,TS val 285781693 ecr 285781709], length 1044
1527891334.681557 IP (tos 0x0, ttl 64, id 11520, offset 0, flags [DF], proto TCP (6), length 1096)
    rpi37.lan.46656 > rpi33.lan.43620: Flags [P.], cksum 0x3a40 (correct), seq 29267:30311, ack 4211, win 292, options [nop,nop,TS val 285781693 ecr 285781709], length 1044
1527891334.681605 IP (tos 0x0, ttl 64, id 60885, offset 0, flags [DF], proto TCP (6), length 52)
    rpi33.lan.43620 > rpi37.lan.46656: Flags [.], cksum 0x8485 (incorrect -> 0xb1cb), ack 30311, win 702, options [nop,nop,TS val 285781709 ecr 285781693], length 0
1527891334.681694 IP (tos 0x0, ttl 64, id 11521, offset 0, flags [DF], proto TCP (6), length 1096)
    rpi37.lan.46656 > rpi33.lan.43620: Flags [P.], cksum 0xee28 (correct), seq 30311:31355, ack 4211, win 292, options [nop,nop,TS val 285781693 ecr 285781709], length 1044
1527891334.681850 IP (tos 0x0, ttl 64, id 11522, offset 0, flags [DF], proto TCP (6), length 1096)
    rpi37.lan.46656 > rpi33.lan.43620: Flags [P.], cksum 0xbc7b (correct), seq 31355:32399, ack 4211, win 292, options [nop,nop,TS val 285781693 ecr 285781709], length 1044
1527891334.681895 IP (tos 0x0, ttl 64, id 60886, offset 0, flags [DF], proto TCP (6), length 52)
    rpi33.lan.43620 > rpi37.lan.46656: Flags [.], cksum 0x8485 (incorrect -> 0xa983), ack 32399, win 734, options [nop,nop,TS val 285781709 ecr 285781693], length 0
1527891334.682000 IP (tos 0x0, ttl 64, id 11523, offset 0, flags [DF], proto TCP (6), length 1096)
    rpi37.lan.46656 > rpi33.lan.43620: Flags [P.], cksum 0x21bf (correct), seq 32399:33443, ack 4211, win 292, options [nop,nop,TS val 285781693 ecr 285781709], length 1044
1527891334.682203 IP (tos 0x0, ttl 64, id 11524, offset 0, flags [DF], proto TCP (6), length 1096)
    rpi37.lan.46656 > rpi33.lan.43620: Flags [P.], cksum 0x5e3c (correct), seq 33443:34487, ack 4211, win 292, options [nop,nop,TS val 285781693 ecr 285781709], length 1044
1527891334.682293 IP (tos 0x0, ttl 64, id 60887, offset 0, flags [DF], proto TCP (6), length 52)
    rpi33.lan.43620 > rpi37.lan.46656: Flags [.], cksum 0x8485 (incorrect -> 0xa13a), ack 34487, win 767, options [nop,nop,TS val 285781709 ecr 285781693], length 0
1527891334.682353 IP (tos 0x0, ttl 64, id 11525, offset 0, flags [DF], proto TCP (6), length 1096)
    rpi37.lan.46656 > rpi33.lan.43620: Flags [P.], cksum 0xd23f (correct), seq 34487:35531, ack 4211, win 292, options [nop,nop,TS val 285781693 ecr 285781709], length 1044
1527891334.682438 IP (tos 0x0, ttl 64, id 11526, offset 0, flags [DF], proto TCP (6), length 1096)
    rpi37.lan.46656 > rpi33.lan.43620: Flags [P.], cksum 0xe133 (correct), seq 35531:36575, ack 4211, win 292, options [nop,nop,TS val 285781693 ecr 285781709], length 1044
1527891334.682485 IP (tos 0x0, ttl 64, id 60888, offset 0, flags [DF], proto TCP (6), length 52)
    rpi33.lan.43620 > rpi37.lan.46656: Flags [.], cksum 0x8485 (incorrect -> 0x98f1), ack 36575, win 800, options [nop,nop,TS val 285781709 ecr 285781693], length 0
1527891334.682569 IP (tos 0x0, ttl 64, id 11527, offset 0, flags [DF], proto TCP (6), length 1096)
    rpi37.lan.46656 > rpi33.lan.43620: Flags [P.], cksum 0x96f5 (correct), seq 36575:37619, ack 4211, win 292, options [nop,nop,TS val 285781693 ecr 285781709], length 1044
1527891334.682711 IP (tos 0x0, ttl 64, id 11528, offset 0, flags [DF], proto TCP (6), length 1096)
    rpi37.lan.46656 > rpi33.lan.43620: Flags [P.], cksum 0xf91a (correct), seq 37619:38663, ack 4211, win 292, options [nop,nop,TS val 285781693 ecr 285781709], length 1044
1527891334.682763 IP (tos 0x0, ttl 64, id 60889, offset 0, flags [DF], proto TCP (6), length 52)
    rpi33.lan.43620 > rpi37.lan.46656: Flags [.], cksum 0x8485 (incorrect -> 0x90a9), ack 38663, win 832, options [nop,nop,TS val 285781709 ecr 285781693], length 0
1527891334.682887 IP (tos 0x0, ttl 64, id 11529, offset 0, flags [DF], proto TCP (6), length 1096)
    rpi37.lan.46656 > rpi33.lan.43620: Flags [P.], cksum 0x9546 (correct), seq 38663:39707, ack 4211, win 292, options [nop,nop,TS val 285781693 ecr 285781709], length 1044
1527891334.683001 IP (tos 0x0, ttl 64, id 11530, offset 0, flags [DF], proto TCP (6), length 1096)
    rpi37.lan.46656 > rpi33.lan.43620: Flags [P.], cksum 0x0dbb (correct), seq 39707:40751, ack 4211, win 292, options [nop,nop,TS val 285781693 ecr 285781709], length 1044
1527891334.683048 IP (tos 0x0, ttl 64, id 60890, offset 0, flags [DF], proto TCP (6), length 52)
    rpi33.lan.43620 > rpi37.lan.46656: Flags [.], cksum 0x8485 (incorrect -> 0x8860), ack 40751, win 865, options [nop,nop,TS val 285781709 ecr 285781693], length 0
1527891334.683134 IP (tos 0x0, ttl 64, id 11531, offset 0, flags [DF], proto TCP (6), length 1096)
    rpi37.lan.46656 > rpi33.lan.43620: Flags [P.], cksum 0x05f6 (correct), seq 40751:41795, ack 4211, win 292, options [nop,nop,TS val 285781693 ecr 285781709], length 1044
1527891334.683224 IP (tos 0x0, ttl 64, id 11532, offset 0, flags [DF], proto TCP (6), length 1096)
    rpi37.lan.46656 > rpi33.lan.43620: Flags [P.], cksum 0x15b0 (correct), seq 41795:42839, ack 4211, win 292, options [nop,nop,TS val 285781693 ecr 285781709], length 1044
1527891334.683293 IP (tos 0x0, ttl 64, id 60891, offset 0, flags [DF], proto TCP (6), length 52)
    rpi33.lan.43620 > rpi37.lan.46656: Flags [.], cksum 0x8485 (incorrect -> 0x8018), ack 42839, win 897, options [nop,nop,TS val 285781709 ecr 285781693], length 0
1527891334.683413 IP (tos 0x0, ttl 64, id 11533, offset 0, flags [DF], proto TCP (6), length 1096)
    rpi37.lan.46656 > rpi33.lan.43620: Flags [P.], cksum 0x0f9d (correct), seq 42839:43883, ack 4211, win 292, options [nop,nop,TS val 285781693 ecr 285781709], length 1044
1527891334.683499 IP (tos 0x0, ttl 64, id 11534, offset 0, flags [DF], proto TCP (6), length 1096)
    rpi37.lan.46656 > rpi33.lan.43620: Flags [P.], cksum 0xe04f (correct), seq 43883:44927, ack 4211, win 292, options [nop,nop,TS val 285781693 ecr 285781709], length 1044
1527891334.683543 IP (tos 0x0, ttl 64, id 60892, offset 0, flags [DF], proto TCP (6), length 52)
    rpi33.lan.43620 > rpi37.lan.46656: Flags [.], cksum 0x8485 (incorrect -> 0x77cf), ack 44927, win 930, options [nop,nop,TS val 285781709 ecr 285781693], length 0
1527891334.683644 IP (tos 0x0, ttl 64, id 11535, offset 0, flags [DF], proto TCP (6), length 1096)
    rpi37.lan.46656 > rpi33.lan.43620: Flags [P.], cksum 0xf96c (correct), seq 44927:45971, ack 4211, win 292, options [nop,nop,TS val 285781693 ecr 285781709], length 1044
1527891334.683838 IP (tos 0x0, ttl 64, id 11536, offset 0, flags [DF], proto TCP (6), length 1096)
    rpi37.lan.46656 > rpi33.lan.43620: Flags [P.], cksum 0xbc22 (correct), seq 45971:47015, ack 4211, win 292, options [nop,nop,TS val 285781693 ecr 285781709], length 1044
1527891334.683894 IP (tos 0x0, ttl 64, id 60893, offset 0, flags [DF], proto TCP (6), length 52)
    rpi33.lan.43620 > rpi37.lan.46656: Flags [.], cksum 0x8485 (incorrect -> 0x6f86), ack 47015, win 963, options [nop,nop,TS val 285781709 ecr 285781693], length 0
1527891334.691525 IP (tos 0x0, ttl 64, id 47583, offset 0, flags [DF], proto TCP (6), length 52)
    rpi39.lan.46656 > rpi33.lan.54402: Flags [.], cksum 0x0c67 (correct), ack 4211, win 292, options [nop,nop,TS val 285781710 ecr 285781706], length 0
1527891334.721772 IP (tos 0x0, ttl 64, id 52567, offset 0, flags [DF], proto TCP (6), length 52)
    rpi38.lan.46656 > rpi33.lan.43670: Flags [.], cksum 0xa7a0 (correct), ack 2123, win 259, options [nop,nop,TS val 285780246 ecr 285781709], length 0
1527891334.721941 IP (tos 0x0, ttl 64, id 30574, offset 0, flags [DF], proto TCP (6), length 52)
    rpi33.lan.43670 > rpi38.lan.46656: Flags [.], cksum 0x8486 (incorrect -> 0xa79f), ack 2123, win 261, options [nop,nop,TS val 285781713 ecr 285780241], length 0
1527891334.754269 IP (tos 0x0, ttl 64, id 47584, offset 0, flags [DF], proto TCP (6), length 1096)
    rpi39.lan.46656 > rpi33.lan.54402: Flags [P.], cksum 0x193c (correct), seq 3167:4211, ack 4211, win 292, options [nop,nop,TS val 285781716 ecr 285781706], length 1044
1527891334.754348 IP (tos 0x0, ttl 64, id 26072, offset 0, flags [DF], proto TCP (6), length 52)
    rpi33.lan.54402 > rpi39.lan.46656: Flags [.], cksum 0x8487 (incorrect -> 0x0841), ack 4211, win 294, options [nop,nop,TS val 285781716 ecr 285781716], length 0
1527891334.754446 IP (tos 0x0, ttl 64, id 47585, offset 0, flags [DF], proto TCP (6), length 1096)
    rpi39.lan.46656 > rpi33.lan.54402: Flags [P.], cksum 0xafc0 (correct), seq 4211:5255, ack 4211, win 292, options [nop,nop,TS val 285781716 ecr 285781706], length 1044
1527891334.754546 IP (tos 0x0, ttl 64, id 26073, offset 0, flags [DF], proto TCP (6), length 52)
    rpi33.lan.54402 > rpi39.lan.46656: Flags [.], cksum 0x8487 (incorrect -> 0x041c), ack 5255, win 310, options [nop,nop,TS val 285781717 ecr 285781716], length 0
1527891334.754781 IP (tos 0x0, ttl 64, id 47586, offset 0, flags [DF], proto TCP (6), length 1096)
    rpi39.lan.46656 > rpi33.lan.54402: Flags [P.], cksum 0x42f8 (correct), seq 5255:6299, ack 4211, win 292, options [nop,nop,TS val 285781716 ecr 285781706], length 1044
1527891334.754875 IP (tos 0x0, ttl 64, id 26074, offset 0, flags [DF], proto TCP (6), length 52)
    rpi33.lan.54402 > rpi39.lan.46656: Flags [.], cksum 0x8487 (incorrect -> 0xfff7), ack 6299, win 326, options [nop,nop,TS val 285781717 ecr 285781716], length 0
1527891334.754786 IP (tos 0x0, ttl 64, id 47587, offset 0, flags [DF], proto TCP (6), length 1096)
    rpi39.lan.46656 > rpi33.lan.54402: Flags [P.], cksum 0x8591 (correct), seq 6299:7343, ack 4211, win 292, options [nop,nop,TS val 285781716 ecr 285781706], length 1044
1527891334.754963 IP (tos 0x0, ttl 64, id 26075, offset 0, flags [DF], proto TCP (6), length 52)
    rpi33.lan.54402 > rpi39.lan.46656: Flags [.], cksum 0x8487 (incorrect -> 0xfbd2), ack 7343, win 343, options [nop,nop,TS val 285781717 ecr 285781716], length 0
1527891334.755065 IP (tos 0x0, ttl 64, id 47588, offset 0, flags [DF], proto TCP (6), length 1096)
    rpi39.lan.46656 > rpi33.lan.54402: Flags [P.], cksum 0x4798 (correct), seq 7343:8387, ack 4211, win 292, options [nop,nop,TS val 285781716 ecr 285781706], length 1044
1527891334.755125 IP (tos 0x0, ttl 64, id 26076, offset 0, flags [DF], proto TCP (6), length 52)
    rpi33.lan.54402 > rpi39.lan.46656: Flags [.], cksum 0x8487 (incorrect -> 0xf7ae), ack 8387, win 359, options [nop,nop,TS val 285781717 ecr 285781716], length 0
1527891334.755152 IP (tos 0x0, ttl 64, id 47589, offset 0, flags [DF], proto TCP (6), length 1096)
    rpi39.lan.46656 > rpi33.lan.54402: Flags [P.], cksum 0x0de3 (correct), seq 8387:9431, ack 4211, win 292, options [nop,nop,TS val 285781716 ecr 285781706], length 1044
1527891334.755225 IP (tos 0x0, ttl 64, id 26077, offset 0, flags [DF], proto TCP (6), length 52)
    rpi33.lan.54402 > rpi39.lan.46656: Flags [.], cksum 0x8487 (incorrect -> 0xf38a), ack 9431, win 375, options [nop,nop,TS val 285781717 ecr 285781716], length 0
1527891334.787602 IP (tos 0x0, ttl 64, id 30575, offset 0, flags [DF], proto TCP (6), length 1096)
    rpi33.lan.43670 > rpi38.lan.46656: Flags [P.], cksum 0x889a (incorrect -> 0xdc43), seq 2123:3167, ack 2123, win 261, options [nop,nop,TS val 285781720 ecr 285780241], length 1044
1527891334.788484 IP (tos 0x0, ttl 64, id 52568, offset 0, flags [DF], proto TCP (6), length 52)
    rpi38.lan.46656 > rpi33.lan.43670: Flags [.], cksum 0xa36a (correct), ack 3167, win 276, options [nop,nop,TS val 285780252 ecr 285781720], length 0
1527891334.791763 IP (tos 0x0, ttl 64, id 52569, offset 0, flags [DF], proto TCP (6), length 1096)
    rpi38.lan.46656 > rpi33.lan.43670: Flags [P.], cksum 0xac81 (correct), seq 2123:3167, ack 3167, win 276, options [nop,nop,TS val 285780252 ecr 285781720], length 1044
1527891334.834573 IP (tos 0x0, ttl 64, id 30576, offset 0, flags [DF], proto TCP (6), length 52)
    rpi33.lan.43670 > rpi38.lan.46656: Flags [.], cksum 0x8486 (incorrect -> 0x9f4f), ack 3167, win 278, options [nop,nop,TS val 285781725 ecr 285780252], length 0
1527891334.835168 IP (tos 0x0, ttl 64, id 16304, offset 0, flags [DF], proto TCP (6), length 60)
    rpi33.lan.45142 > rpi44.lan.46656: Flags [S], cksum 0x8494 (incorrect -> 0x5fd9), seq 969314669, win 29200, options [mss 1460,sackOK,TS val 285781725 ecr 0,nop,wscale 7], length 0
1527891334.835830 IP (tos 0x0, ttl 64, id 17161, offset 0, flags [DF], proto TCP (6), length 40)
    rpi44.lan.46656 > rpi33.lan.45142: Flags [R.], cksum 0xf99e (correct), seq 0, ack 969314670, win 0, length 0
1527891334.837645 IP (tos 0x0, ttl 64, id 1960, offset 0, flags [DF], proto TCP (6), length 60)
    rpi33.lan.45144 > rpi44.lan.46656: Flags [S], cksum 0x8494 (incorrect -> 0x3211), seq 1334094197, win 29200, options [mss 1460,sackOK,TS val 285781725 ecr 0,nop,wscale 7], length 0
1527891334.838198 IP (tos 0x0, ttl 64, id 17162, offset 0, flags [DF], proto TCP (6), length 40)
    rpi44.lan.46656 > rpi33.lan.45144: Flags [R.], cksum 0xcbd6 (correct), seq 0, ack 1334094198, win 0, length 0
1527891334.988063 IP (tos 0x0, ttl 64, id 30577, offset 0, flags [DF], proto TCP (6), length 1096)
    rpi33.lan.43670 > rpi38.lan.46656: Flags [P.], cksum 0x889a (incorrect -> 0x1bc3), seq 3167:4211, ack 3167, win 278, options [nop,nop,TS val 285781740 ecr 285780252], length 1044
1527891335.023659 IP (tos 0x0, ttl 64, id 14974, offset 0, flags [DF], proto TCP (6), length 60)
    rpi33.lan.58274 > rpi35.lan.46656: Flags [S], cksum 0x848b (incorrect -> 0xf1ee), seq 1899467921, win 29200, options [mss 1460,sackOK,TS val 285781743 ecr 0,nop,wscale 7], length 0
1527891335.024375 IP (tos 0x0, ttl 64, id 0, offset 0, flags [DF], proto TCP (6), length 60)
    rpi35.lan.46656 > rpi33.lan.58274: Flags [S.], cksum 0xae73 (correct), seq 2669931268, ack 1899467922, win 28960, options [mss 1460,sackOK,TS val 285780265 ecr 285781743,nop,wscale 7], length 0
1527891335.024604 IP (tos 0x0, ttl 64, id 14975, offset 0, flags [DF], proto TCP (6), length 52)
    rpi33.lan.58274 > rpi35.lan.46656: Flags [.], cksum 0x8483 (incorrect -> 0x4d7a), ack 1, win 229, options [nop,nop,TS val 285781744 ecr 285780265], length 0
1527891335.031667 IP (tos 0x0, ttl 64, id 52570, offset 0, flags [DF], proto TCP (6), length 52)
    rpi38.lan.46656 > rpi33.lan.43670: Flags [.], cksum 0x9b05 (correct), ack 4211, win 292, options [nop,nop,TS val 285780277 ecr 285781740], length 0
1527891335.035986 IP (tos 0x0, ttl 64, id 49577, offset 0, flags [DF], proto TCP (6), length 60)
    rpi33.lan.34908 > rpi45.lan.46656: Flags [S], cksum 0x8495 (incorrect -> 0xff3b), seq 3831328600, win 29200, options [mss 1460,sackOK,TS val 285781745 ecr 0,nop,wscale 7], length 0
1527891335.036678 IP (tos 0x0, ttl 64, id 32553, offset 0, flags [DF], proto TCP (6), length 40)
    rpi45.lan.46656 > rpi33.lan.34908: Flags [R.], cksum 0x9915 (correct), seq 0, ack 3831328601, win 0, length 0
1527891335.037697 IP (tos 0x0, ttl 64, id 24571, offset 0, flags [DF], proto TCP (6), length 60)
    rpi33.lan.34910 > rpi45.lan.46656: Flags [S], cksum 0x8495 (incorrect -> 0x8d42), seq 3567448330, win 29200, options [mss 1460,sackOK,TS val 285781745 ecr 0,nop,wscale 7], length 0
1527891335.037940 IP (tos 0x0, ttl 64, id 16940, offset 0, flags [DF], proto TCP (6), length 86)
    rpi35.lan.46656 > rpi33.lan.58274: Flags [P.], cksum 0x5e10 (correct), seq 1:35, ack 1, win 227, options [nop,nop,TS val 285780266 ecr 285781744], length 34
1527891335.038039 IP (tos 0x0, ttl 64, id 14976, offset 0, flags [DF], proto TCP (6), length 52)
    rpi33.lan.58274 > rpi35.lan.46656: Flags [.], cksum 0x8483 (incorrect -> 0x4d56), ack 35, win 229, options [nop,nop,TS val 285781745 ecr 285780266], length 0
1527891335.038259 IP (tos 0x0, ttl 64, id 32554, offset 0, flags [DF], proto TCP (6), length 40)
    rpi45.lan.46656 > rpi33.lan.34910: Flags [R.], cksum 0x271c (correct), seq 0, ack 3567448331, win 0, length 0
1527891335.039675 IP (tos 0x0, ttl 64, id 59619, offset 0, flags [DF], proto TCP (6), length 60)
    rpi33.lan.46274 > rpi40.lan.46656: Flags [S], cksum 0x8490 (incorrect -> 0x5b03), seq 2239448594, win 29200, options [mss 1460,sackOK,TS val 285781745 ecr 0,nop,wscale 7], length 0
1527891335.040110 IP (tos 0x0, ttl 64, id 14977, offset 0, flags [DF], proto TCP (6), length 86)
    rpi33.lan.58274 > rpi35.lan.46656: Flags [P.], cksum 0x84a5 (incorrect -> 0x467a), seq 1:35, ack 35, win 229, options [nop,nop,TS val 285781745 ecr 285780266], length 34
1527891335.040310 IP (tos 0x0, ttl 64, id 0, offset 0, flags [DF], proto TCP (6), length 60)
    rpi40.lan.46656 > rpi33.lan.46274: Flags [S.], cksum 0x5f40 (correct), seq 3488773428, ack 2239448595, win 28960, options [mss 1460,sackOK,TS val 285779570 ecr 285781745,nop,wscale 7], length 0
1527891335.040428 IP (tos 0x0, ttl 64, id 59620, offset 0, flags [DF], proto TCP (6), length 52)
    rpi33.lan.46274 > rpi40.lan.46656: Flags [.], cksum 0x8488 (incorrect -> 0xfe47), ack 1, win 229, options [nop,nop,TS val 285781745 ecr 285779570], length 0
