1527830626.705105 IP (tos 0x0, ttl 64, id 63996, offset 0, flags [DF], proto TCP (6), length 60)
    rpi33.lan.32924 > rpi43.lan.46656: Flags [S], cksum 0x8493 (incorrect -> 0x4d55), seq 3132093756, win 29200, options [mss 1460,sackOK,TS val 279710912 ecr 0,nop,wscale 7], length 0
1527830626.705810 IP (tos 0x0, ttl 64, id 9893, offset 0, flags [DF], proto TCP (6), length 40)
    rpi43.lan.46656 > rpi33.lan.32924: Flags [R.], cksum 0x44a1 (correct), seq 0, ack 3132093757, win 0, length 0
1527830626.920190 IP (tos 0x0, ttl 64, id 3953, offset 0, flags [DF], proto TCP (6), length 1096)
    rpi33.lan.46656 > rpi36.lan.52404: Flags [P.], cksum 0x69b5 (correct), seq 2846831508:2846832552, ack 765525933, win 1332, options [nop,nop,TS val 279710933 ecr 279710732], length 1044
1527830626.920287 IP (tos 0x0, ttl 64, id 12810, offset 0, flags [DF], proto TCP (6), length 1096)
    rpi33.lan.51354 > rpi34.lan.46656: Flags [P.], cksum 0x8896 (incorrect -> 0x80c8), seq 1518214622:1518215666, ack 135491476, win 1324, options [nop,nop,TS val 279710933 ecr 279710742], length 1044
1527830626.920308 IP (tos 0x0, ttl 64, id 38804, offset 0, flags [DF], proto TCP (6), length 1096)
    rpi33.lan.46656 > rpi40.lan.35100: Flags [P.], cksum 0x7d5a (correct), seq 4023926217:4023927261, ack 1145526164, win 1075, options [nop,nop,TS val 279710933 ecr 279708558], length 1044
1527830626.920300 IP (tos 0x0, ttl 64, id 14371, offset 0, flags [DF], proto TCP (6), length 1096)
    rpi38.lan.46656 > rpi33.lan.55368: Flags [P.], cksum 0xad0f (correct), seq 3947841332:3947842376, ack 2732460404, win 1332, options [nop,nop,TS val 279709465 ecr 279710733], length 1044
1527830626.920328 IP (tos 0x0, ttl 64, id 41394, offset 0, flags [DF], proto TCP (6), length 1096)
    rpi33.lan.46656 > rpi39.lan.50408: Flags [P.], cksum 0xb33f (correct), seq 3834557364:3834558408, ack 2267988594, win 1332, options [nop,nop,TS val 279710933 ecr 279710733], length 1044
1527830626.920410 IP (tos 0x0, ttl 64, id 51940, offset 0, flags [DF], proto TCP (6), length 1096)
    rpi33.lan.46656 > rpi35.lan.36908: Flags [P.], cksum 0x3b9b (correct), seq 1337169743:1337170787, ack 375746245, win 1332, options [nop,nop,TS val 279710933 ecr 279709255], length 1044
1527830626.920615 IP (tos 0x0, ttl 64, id 40362, offset 0, flags [DF], proto TCP (6), length 1096)
    rpi33.lan.46656 > rpi42.lan.49208: Flags [P.], cksum 0xd8cf (correct), seq 2631799987:2631801031, ack 237674170, win 683, options [nop,nop,TS val 279710933 ecr 279710814], length 1044
1527830626.920644 IP (tos 0x0, ttl 64, id 31525, offset 0, flags [DF], proto TCP (6), length 1096)
    rpi33.lan.55368 > rpi38.lan.46656: Flags [P.], cksum 0x889a (incorrect -> 0x17f5), seq 1:1045, ack 1044, win 1323, options [nop,nop,TS val 279710933 ecr 279709465], length 1044
1527830626.920661 IP (tos 0x0, ttl 64, id 59044, offset 0, flags [DF], proto TCP (6), length 1096)
    rpi33.lan.55238 > rpi37.lan.46656: Flags [P.], cksum 0x8899 (incorrect -> 0x80f8), seq 3070795243:3070796287, ack 128708536, win 1324, options [nop,nop,TS val 279710933 ecr 279710717], length 1044
1527830626.920804 IP (tos 0x0, ttl 64, id 39769, offset 0, flags [DF], proto TCP (6), length 1096)
    rpi33.lan.46656 > rpi41.lan.48084: Flags [P.], cksum 0x286c (correct), seq 3141342442:3141343486, ack 2246876568, win 896, options [nop,nop,TS val 279710933 ecr 1581977938], length 1044
1527830626.920943 IP (tos 0x0, ttl 64, id 23258, offset 0, flags [DF], proto TCP (6), length 1096)
    rpi36.lan.52404 > rpi33.lan.46656: Flags [P.], cksum 0x013f (correct), seq 1:1045, ack 0, win 1324, options [nop,nop,TS val 279710932 ecr 279710738], length 1044
1527830626.921057 IP (tos 0x0, ttl 64, id 3954, offset 0, flags [DF], proto TCP (6), length 52)
    rpi33.lan.46656 > rpi36.lan.52404: Flags [.], cksum 0x8484 (incorrect -> 0x1c7c), ack 1045, win 1331, options [nop,nop,TS val 279710933 ecr 279710932], length 0
1527830626.921119 IP (tos 0x0, ttl 64, id 23259, offset 0, flags [DF], proto TCP (6), length 52)
    rpi36.lan.52404 > rpi33.lan.46656: Flags [.], cksum 0x1c84 (correct), ack 1044, win 1323, options [nop,nop,TS val 279710932 ecr 279710933], length 0
1527830626.921485 IP (tos 0x0, ttl 64, id 12165, offset 0, flags [DF], proto TCP (6), length 52)
    rpi42.lan.49208 > rpi33.lan.46656: Flags [.], cksum 0xdb99 (correct), ack 1044, win 718, options [nop,nop,TS val 279710913 ecr 279710933], length 0
1527830626.921486 IP (tos 0x0, ttl 64, id 14372, offset 0, flags [DF], proto TCP (6), length 52)
    rpi38.lan.46656 > rpi33.lan.55368: Flags [.], cksum 0x425b (correct), ack 1045, win 1331, options [nop,nop,TS val 279709466 ecr 279710933], length 0
1527830626.925248 IP (tos 0x0, ttl 64, id 21560, offset 0, flags [DF], proto TCP (6), length 1096)
    rpi37.lan.46656 > rpi33.lan.55238: Flags [P.], cksum 0x83b9 (correct), seq 1:1045, ack 1044, win 1332, options [nop,nop,TS val 279710917 ecr 279710933], length 1044
1527830626.925321 IP (tos 0x0, ttl 64, id 59045, offset 0, flags [DF], proto TCP (6), length 52)
    rpi33.lan.55238 > rpi37.lan.46656: Flags [.], cksum 0x8485 (incorrect -> 0xcfb8), ack 1045, win 1323, options [nop,nop,TS val 279710934 ecr 279710917], length 0
1527830626.928899 IP (tos 0x0, ttl 64, id 19807, offset 0, flags [DF], proto TCP (6), length 1096)
    rpi34.lan.46656 > rpi33.lan.51354: Flags [P.], cksum 0x72c6 (correct), seq 1:1045, ack 1044, win 1332, options [nop,nop,TS val 279710942 ecr 279710933], length 1044
1527830626.928980 IP (tos 0x0, ttl 64, id 12811, offset 0, flags [DF], proto TCP (6), length 52)
    rpi33.lan.51354 > rpi34.lan.46656: Flags [.], cksum 0x8482 (incorrect -> 0x3b23), ack 1045, win 1323, options [nop,nop,TS val 279710934 ecr 279710942], length 0
1527830626.930097 IP (tos 0x0, ttl 64, id 27049, offset 0, flags [DF], proto TCP (6), length 1096)
    rpi40.lan.35100 > rpi33.lan.46656: Flags [P.], cksum 0xc3de (correct), seq 1:1045, ack 1044, win 1109, options [nop,nop,TS val 279708758 ecr 279710933], length 1044
1527830626.930181 IP (tos 0x0, ttl 64, id 38805, offset 0, flags [DF], proto TCP (6), length 52)
    rpi33.lan.46656 > rpi40.lan.35100: Flags [.], cksum 0x8488 (incorrect -> 0xaa91), ack 1045, win 1091, options [nop,nop,TS val 279710934 ecr 279708758], length 0
1527830626.932042 IP (tos 0x0, ttl 64, id 19775, offset 0, flags [DF], proto TCP (6), length 1096)
    rpi35.lan.36908 > rpi33.lan.46656: Flags [P.], cksum 0xc06a (correct), seq 1:1045, ack 1044, win 1324, options [nop,nop,TS val 279709455 ecr 279710933], length 1044
1527830626.932124 IP (tos 0x0, ttl 64, id 51941, offset 0, flags [DF], proto TCP (6), length 52)
    rpi33.lan.46656 > rpi35.lan.36908: Flags [.], cksum 0x8483 (incorrect -> 0xfd2d), ack 1045, win 1331, options [nop,nop,TS val 279710934 ecr 279709455], length 0
1527830626.932339 IP (tos 0x0, ttl 64, id 3160, offset 0, flags [DF], proto TCP (6), length 1096)
    rpi41.lan.48084 > rpi33.lan.46656: Flags [P.], cksum 0xb4e4 (correct), seq 1:1045, ack 1044, win 963, options [nop,nop,TS val 1581979941 ecr 279710933], length 1044
1527830626.932402 IP (tos 0x0, ttl 64, id 39770, offset 0, flags [DF], proto TCP (6), length 52)
    rpi33.lan.46656 > rpi41.lan.48084: Flags [.], cksum 0x8489 (incorrect -> 0xebed), ack 1045, win 912, options [nop,nop,TS val 279710934 ecr 1581979941], length 0
1527830626.935176 IP (tos 0x0, ttl 64, id 33446, offset 0, flags [DF], proto TCP (6), length 1096)
    rpi39.lan.50408 > rpi33.lan.46656: Flags [P.], cksum 0x0ce0 (correct), seq 1:1045, ack 1044, win 1324, options [nop,nop,TS val 279710934 ecr 279710933], length 1044
1527830626.935252 IP (tos 0x0, ttl 64, id 41395, offset 0, flags [DF], proto TCP (6), length 52)
    rpi33.lan.46656 > rpi39.lan.50408: Flags [.], cksum 0x8487 (incorrect -> 0x4cee), ack 1045, win 1331, options [nop,nop,TS val 279710935 ecr 279710934], length 0
1527830627.940259 IP (tos 0x0, ttl 64, id 12166, offset 0, flags [DF], proto TCP (6), length 1096)
    rpi42.lan.49208 > rpi33.lan.46656: Flags [P.], cksum 0x17cc (correct), seq 1:1045, ack 1044, win 718, options [nop,nop,TS val 279711015 ecr 279710933], length 1044
1527830627.940398 IP (tos 0x0, ttl 64, id 40363, offset 0, flags [DF], proto TCP (6), length 52)
    rpi33.lan.46656 > rpi42.lan.49208: Flags [.], cksum 0x848a (incorrect -> 0xd6cb), ack 1045, win 700, options [nop,nop,TS val 279711035 ecr 279711015], length 0
1527830628.923644 IP (tos 0x0, ttl 64, id 12812, offset 0, flags [DF], proto TCP (6), length 1096)
    rpi33.lan.51354 > rpi34.lan.46656: Flags [P.], cksum 0x8896 (incorrect -> 0x70cc), seq 1044:2088, ack 1045, win 1324, options [nop,nop,TS val 279711133 ecr 279710942], length 1044
1527830628.923783 IP (tos 0x0, ttl 64, id 3955, offset 0, flags [DF], proto TCP (6), length 1096)
    rpi33.lan.46656 > rpi36.lan.52404: Flags [P.], cksum 0x95ea (correct), seq 1044:2088, ack 1045, win 1332, options [nop,nop,TS val 279711133 ecr 279710932], length 1044
1527830628.923871 IP (tos 0x0, ttl 64, id 14373, offset 0, flags [DF], proto TCP (6), length 1096)
    rpi38.lan.46656 > rpi33.lan.55368: Flags [P.], cksum 0x7a2f (correct), seq 1044:2088, ack 1045, win 1332, options [nop,nop,TS val 279709666 ecr 279710933], length 1044
1527830628.923943 IP (tos 0x0, ttl 64, id 51942, offset 0, flags [DF], proto TCP (6), length 1096)
    rpi33.lan.46656 > rpi35.lan.36908: Flags [P.], cksum 0x8a33 (correct), seq 1044:2088, ack 1045, win 1332, options [nop,nop,TS val 279711133 ecr 279709455], length 1044
1527830628.924080 IP (tos 0x0, ttl 64, id 23260, offset 0, flags [DF], proto TCP (6), length 1096)
    rpi36.lan.52404 > rpi33.lan.46656: Flags [P.], cksum 0xacdf (correct), seq 1045:2089, ack 1044, win 1324, options [nop,nop,TS val 279711133 ecr 279710933], length 1044
1527830628.924148 IP (tos 0x0, ttl 64, id 3956, offset 0, flags [DF], proto TCP (6), length 52)
    rpi33.lan.46656 > rpi36.lan.52404: Flags [.], cksum 0x8484 (incorrect -> 0x12c3), ack 2089, win 1331, options [nop,nop,TS val 279711133 ecr 279711133], length 0
1527830628.924172 IP (tos 0x0, ttl 64, id 59046, offset 0, flags [DF], proto TCP (6), length 1096)
    rpi33.lan.55238 > rpi37.lan.46656: Flags [P.], cksum 0x8899 (incorrect -> 0x6d8d), seq 1044:2088, ack 1045, win 1324, options [nop,nop,TS val 279711133 ecr 279710917], length 1044
1527830628.924214 IP (tos 0x0, ttl 64, id 41396, offset 0, flags [DF], proto TCP (6), length 1096)
    rpi33.lan.46656 > rpi39.lan.50408: Flags [P.], cksum 0x4944 (correct), seq 1044:2088, ack 1045, win 1332, options [nop,nop,TS val 279711133 ecr 279710934], length 1044
1527830628.924360 IP (tos 0x0, ttl 64, id 31526, offset 0, flags [DF], proto TCP (6), length 1096)
    rpi33.lan.55368 > rpi38.lan.46656: Flags [P.], cksum 0x889a (incorrect -> 0xd733), seq 1045:2089, ack 2088, win 1323, options [nop,nop,TS val 279711133 ecr 279709666], length 1044
1527830628.924586 IP (tos 0x0, ttl 64, id 23261, offset 0, flags [DF], proto TCP (6), length 52)
    rpi36.lan.52404 > rpi33.lan.46656: Flags [.], cksum 0x12cb (correct), ack 2088, win 1323, options [nop,nop,TS val 279711133 ecr 279711133], length 0
1527830628.924671 IP (tos 0x0, ttl 64, id 38806, offset 0, flags [DF], proto TCP (6), length 1096)
    rpi33.lan.46656 > rpi40.lan.35100: Flags [P.], cksum 0x43d6 (correct), seq 1044:2088, ack 1045, win 1091, options [nop,nop,TS val 279711134 ecr 279708758], length 1044
1527830628.924913 IP (tos 0x0, ttl 64, id 39771, offset 0, flags [DF], proto TCP (6), length 1096)
    rpi33.lan.46656 > rpi41.lan.48084: Flags [P.], cksum 0x526b (correct), seq 1044:2088, ack 1045, win 912, options [nop,nop,TS val 279711134 ecr 1581979941], length 1044
1527830628.925129 IP (tos 0x0, ttl 64, id 14374, offset 0, flags [DF], proto TCP (6), length 52)
    rpi38.lan.46656 > rpi33.lan.55368: Flags [.], cksum 0x38a3 (correct), ack 2089, win 1331, options [nop,nop,TS val 279709666 ecr 279711133], length 0
1527830628.925219 IP (tos 0x0, ttl 64, id 40364, offset 0, flags [DF], proto TCP (6), length 1096)
    rpi33.lan.46656 > rpi42.lan.49208: Flags [P.], cksum 0x453a (correct), seq 1044:2088, ack 1045, win 700, options [nop,nop,TS val 279711134 ecr 279711015], length 1044
1527830628.926019 IP (tos 0x0, ttl 64, id 12167, offset 0, flags [DF], proto TCP (6), length 52)
    rpi42.lan.49208 > rpi33.lan.46656: Flags [.], cksum 0xd1d0 (correct), ack 2088, win 734, options [nop,nop,TS val 279711113 ecr 279711134], length 0
1527830628.929110 IP (tos 0x0, ttl 64, id 21561, offset 0, flags [DF], proto TCP (6), length 1096)
    rpi37.lan.46656 > rpi33.lan.55238: Flags [P.], cksum 0x7110 (correct), seq 1045:2089, ack 2088, win 1332, options [nop,nop,TS val 279711118 ecr 279711133], length 1044
1527830628.929182 IP (tos 0x0, ttl 64, id 59047, offset 0, flags [DF], proto TCP (6), length 52)
    rpi33.lan.55238 > rpi37.lan.46656: Flags [.], cksum 0x8485 (incorrect -> 0xc5ff), ack 2089, win 1323, options [nop,nop,TS val 279711134 ecr 279711118], length 0
1527830628.931652 IP (tos 0x0, ttl 64, id 19808, offset 0, flags [DF], proto TCP (6), length 1096)
    rpi34.lan.46656 > rpi33.lan.51354: Flags [P.], cksum 0x09fe (correct), seq 1045:2089, ack 2088, win 1332, options [nop,nop,TS val 279711143 ecr 279711133], length 1044
1527830628.931720 IP (tos 0x0, ttl 64, id 12813, offset 0, flags [DF], proto TCP (6), length 52)
    rpi33.lan.51354 > rpi34.lan.46656: Flags [.], cksum 0x8482 (incorrect -> 0x316a), ack 2089, win 1323, options [nop,nop,TS val 279711134 ecr 279711143], length 0
1527830628.933708 IP (tos 0x0, ttl 64, id 27050, offset 0, flags [DF], proto TCP (6), length 1096)
    rpi40.lan.35100 > rpi33.lan.46656: Flags [P.], cksum 0xba7c (correct), seq 1045:2089, ack 2088, win 1126, options [nop,nop,TS val 279708959 ecr 279711134], length 1044
1527830628.933771 IP (tos 0x0, ttl 64, id 38807, offset 0, flags [DF], proto TCP (6), length 52)
    rpi33.lan.46656 > rpi40.lan.35100: Flags [.], cksum 0x8488 (incorrect -> 0xa0c7), ack 2089, win 1108, options [nop,nop,TS val 279711134 ecr 279708959], length 0
1527830628.934529 IP (tos 0x0, ttl 64, id 33447, offset 0, flags [DF], proto TCP (6), length 1096)
    rpi39.lan.50408 > rpi33.lan.46656: Flags [P.], cksum 0x65f6 (correct), seq 1045:2089, ack 2088, win 1324, options [nop,nop,TS val 279711134 ecr 279711133], length 1044
1527830628.934597 IP (tos 0x0, ttl 64, id 41397, offset 0, flags [DF], proto TCP (6), length 52)
    rpi33.lan.46656 > rpi39.lan.50408: Flags [.], cksum 0x8487 (incorrect -> 0x4336), ack 2089, win 1331, options [nop,nop,TS val 279711135 ecr 279711134], length 0
1527830628.935108 IP (tos 0x0, ttl 64, id 3161, offset 0, flags [DF], proto TCP (6), length 1096)
    rpi41.lan.48084 > rpi33.lan.46656: Flags [P.], cksum 0xfa50 (correct), seq 1045:2089, ack 2088, win 979, options [nop,nop,TS val 1581981944 ecr 279711134], length 1044
1527830628.935174 IP (tos 0x0, ttl 64, id 39772, offset 0, flags [DF], proto TCP (6), length 52)
    rpi33.lan.46656 > rpi41.lan.48084: Flags [.], cksum 0x8489 (incorrect -> 0xdb19), ack 2089, win 928, options [nop,nop,TS val 279711135 ecr 1581981944], length 0
1527830628.935799 IP (tos 0x0, ttl 64, id 19776, offset 0, flags [DF], proto TCP (6), length 1096)
    rpi35.lan.36908 > rpi33.lan.46656: Flags [P.], cksum 0x9662 (correct), seq 1045:2089, ack 2088, win 1324, options [nop,nop,TS val 279709656 ecr 279711133], length 1044
1527830628.935860 IP (tos 0x0, ttl 64, id 51943, offset 0, flags [DF], proto TCP (6), length 52)
    rpi33.lan.46656 > rpi35.lan.36908: Flags [.], cksum 0x8483 (incorrect -> 0xf373), ack 2089, win 1331, options [nop,nop,TS val 279711135 ecr 279709656], length 0
1527830629.306421 IP (tos 0x0, ttl 64, id 65348, offset 0, flags [DF], proto TCP (6), length 60)
    rpi33.lan.56892 > rpi44.lan.46656: Flags [S], cksum 0x8494 (incorrect -> 0x9850), seq 332132992, win 29200, options [mss 1460,sackOK,TS val 279711172 ecr 0,nop,wscale 7], length 0
1527830629.307038 IP (tos 0x0, ttl 64, id 45301, offset 0, flags [DF], proto TCP (6), length 40)
    rpi44.lan.46656 > rpi33.lan.56892: Flags [R.], cksum 0x90a0 (correct), seq 0, ack 332132993, win 0, length 0
1527830629.943586 IP (tos 0x0, ttl 64, id 12168, offset 0, flags [DF], proto TCP (6), length 1096)
    rpi42.lan.49208 > rpi33.lan.46656: Flags [P.], cksum 0xbbd8 (correct), seq 1045:2089, ack 2088, win 734, options [nop,nop,TS val 279711215 ecr 279711134], length 1044
1527830629.943716 IP (tos 0x0, ttl 64, id 40365, offset 0, flags [DF], proto TCP (6), length 52)
    rpi33.lan.46656 > rpi42.lan.49208: Flags [.], cksum 0x848a (incorrect -> 0xcd03), ack 2089, win 716, options [nop,nop,TS val 279711235 ecr 279711215], length 0
1527830630.927266 IP (tos 0x0, ttl 64, id 31527, offset 0, flags [DF], proto TCP (6), length 1096)
    rpi33.lan.55368 > rpi38.lan.46656: Flags [P.], cksum 0x889a (incorrect -> 0xf31f), seq 2089:3133, ack 2088, win 1324, options [nop,nop,TS val 279711334 ecr 279709666], length 1044
1527830630.927334 IP (tos 0x0, ttl 64, id 3957, offset 0, flags [DF], proto TCP (6), length 1096)
    rpi33.lan.46656 > rpi36.lan.52404: Flags [P.], cksum 0xc546 (correct), seq 2088:3132, ack 2089, win 1332, options [nop,nop,TS val 279711334 ecr 279711133], length 1044
1527830630.927351 IP (tos 0x0, ttl 64, id 41398, offset 0, flags [DF], proto TCP (6), length 1096)
    rpi33.lan.46656 > rpi39.lan.50408: Flags [P.], cksum 0x0051 (correct), seq 2088:3132, ack 2089, win 1332, options [nop,nop,TS val 279711334 ecr 279711134], length 1044
1527830630.927572 IP (tos 0x0, ttl 64, id 12814, offset 0, flags [DF], proto TCP (6), length 1096)
    rpi33.lan.51354 > rpi34.lan.46656: Flags [P.], cksum 0x8896 (incorrect -> 0x7ed4), seq 2088:3132, ack 2089, win 1324, options [nop,nop,TS val 279711334 ecr 279711143], length 1044
1527830630.927668 IP (tos 0x0, ttl 64, id 14375, offset 0, flags [DF], proto TCP (6), length 1096)
    rpi38.lan.46656 > rpi33.lan.55368: Flags [P.], cksum 0x133d (correct), seq 2088:3132, ack 2089, win 1332, options [nop,nop,TS val 279709866 ecr 279711133], length 1044
1527830630.927715 IP (tos 0x0, ttl 64, id 39773, offset 0, flags [DF], proto TCP (6), length 1096)
    rpi33.lan.46656 > rpi41.lan.48084: Flags [P.], cksum 0x1524 (correct), seq 2088:3132, ack 2089, win 928, options [nop,nop,TS val 279711334 ecr 1581981944], length 1044
1527830630.927793 IP (tos 0x0, ttl 64, id 40366, offset 0, flags [DF], proto TCP (6), length 1096)
    rpi33.lan.46656 > rpi42.lan.49208: Flags [P.], cksum 0x9c02 (correct), seq 2088:3132, ack 2089, win 716, options [nop,nop,TS val 279711334 ecr 279711215], length 1044
1527830630.927863 IP (tos 0x0, ttl 64, id 23262, offset 0, flags [DF], proto TCP (6), length 1096)
    rpi36.lan.52404 > rpi33.lan.46656: Flags [P.], cksum 0xe5a4 (correct), seq 2089:3133, ack 2088, win 1324, options [nop,nop,TS val 279711333 ecr 279711133], length 1044
1527830630.927942 IP (tos 0x0, ttl 64, id 3958, offset 0, flags [DF], proto TCP (6), length 52)
    rpi33.lan.46656 > rpi36.lan.52404: Flags [.], cksum 0x8484 (incorrect -> 0x090a), ack 3133, win 1331, options [nop,nop,TS val 279711334 ecr 279711333], length 0
1527830630.927964 IP (tos 0x0, ttl 64, id 38808, offset 0, flags [DF], proto TCP (6), length 1096)
    rpi33.lan.46656 > rpi40.lan.35100: Flags [P.], cksum 0xed0c (correct), seq 2088:3132, ack 2089, win 1108, options [nop,nop,TS val 279711334 ecr 279708959], length 1044
1527830630.928094 IP (tos 0x0, ttl 64, id 14376, offset 0, flags [DF], proto TCP (6), length 52)
    rpi38.lan.46656 > rpi33.lan.55368: Flags [.], cksum 0x2eea (correct), ack 3133, win 1331, options [nop,nop,TS val 279709866 ecr 279711334], length 0
1527830630.928199 IP (tos 0x0, ttl 64, id 59048, offset 0, flags [DF], proto TCP (6), length 1096)
    rpi33.lan.55238 > rpi37.lan.46656: Flags [P.], cksum 0x8899 (incorrect -> 0xe5e9), seq 2088:3132, ack 2089, win 1324, options [nop,nop,TS val 279711334 ecr 279711118], length 1044
1527830630.928307 IP (tos 0x0, ttl 64, id 23263, offset 0, flags [DF], proto TCP (6), length 52)
    rpi36.lan.52404 > rpi33.lan.46656: Flags [.], cksum 0x0912 (correct), ack 3132, win 1323, options [nop,nop,TS val 279711333 ecr 279711334], length 0
1527830630.928610 IP (tos 0x0, ttl 64, id 12169, offset 0, flags [DF], proto TCP (6), length 52)
    rpi42.lan.49208 > rpi33.lan.46656: Flags [.], cksum 0xc806 (correct), ack 3132, win 751, options [nop,nop,TS val 279711314 ecr 279711334], length 0
1527830630.928673 IP (tos 0x0, ttl 64, id 51944, offset 0, flags [DF], proto TCP (6), length 1096)
    rpi33.lan.46656 > rpi35.lan.36908: Flags [P.], cksum 0x7360 (correct), seq 2088:3132, ack 2089, win 1332, options [nop,nop,TS val 279711334 ecr 279709656], length 1044
1527830630.932123 IP (tos 0x0, ttl 64, id 21562, offset 0, flags [DF], proto TCP (6), length 1096)
    rpi37.lan.46656 > rpi33.lan.55238: Flags [P.], cksum 0xe43a (correct), seq 2089:3133, ack 3132, win 1332, options [nop,nop,TS val 279711318 ecr 279711334], length 1044
1527830630.932199 IP (tos 0x0, ttl 64, id 59049, offset 0, flags [DF], proto TCP (6), length 52)
    rpi33.lan.55238 > rpi37.lan.46656: Flags [.], cksum 0x8485 (incorrect -> 0xbc47), ack 3133, win 1323, options [nop,nop,TS val 279711334 ecr 279711318], length 0
1527830630.935644 IP (tos 0x0, ttl 64, id 19809, offset 0, flags [DF], proto TCP (6), length 1096)
    rpi34.lan.46656 > rpi33.lan.51354: Flags [P.], cksum 0x894f (correct), seq 2089:3133, ack 3132, win 1332, options [nop,nop,TS val 279711343 ecr 279711334], length 1044
1527830630.935710 IP (tos 0x0, ttl 64, id 12815, offset 0, flags [DF], proto TCP (6), length 52)
    rpi33.lan.51354 > rpi34.lan.46656: Flags [.], cksum 0x8482 (incorrect -> 0x27b1), ack 3133, win 1323, options [nop,nop,TS val 279711335 ecr 279711343], length 0
1527830630.938382 IP (tos 0x0, ttl 64, id 33448, offset 0, flags [DF], proto TCP (6), length 1096)
    rpi39.lan.50408 > rpi33.lan.46656: Flags [P.], cksum 0x5f85 (correct), seq 2089:3133, ack 3132, win 1324, options [nop,nop,TS val 279711334 ecr 279711334], length 1044
1527830630.938461 IP (tos 0x0, ttl 64, id 41399, offset 0, flags [DF], proto TCP (6), length 52)
    rpi33.lan.46656 > rpi39.lan.50408: Flags [.], cksum 0x8487 (incorrect -> 0x397e), ack 3133, win 1331, options [nop,nop,TS val 279711335 ecr 279711334], length 0
1527830630.938587 IP (tos 0x0, ttl 64, id 19777, offset 0, flags [DF], proto TCP (6), length 1096)
    rpi35.lan.36908 > rpi33.lan.46656: Flags [P.], cksum 0x0862 (correct), seq 2089:3133, ack 3132, win 1324, options [nop,nop,TS val 279709856 ecr 279711334], length 1044
1527830630.938646 IP (tos 0x0, ttl 64, id 51945, offset 0, flags [DF], proto TCP (6), length 52)
    rpi33.lan.46656 > rpi35.lan.36908: Flags [.], cksum 0x8483 (incorrect -> 0xe9bb), ack 3133, win 1331, options [nop,nop,TS val 279711335 ecr 279709856], length 0
1527830630.938999 IP (tos 0x0, ttl 64, id 3162, offset 0, flags [DF], proto TCP (6), length 1096)
    rpi41.lan.48084 > rpi33.lan.46656: Flags [P.], cksum 0x2a88 (correct), seq 2089:3133, ack 3132, win 995, options [nop,nop,TS val 1581983948 ecr 279711334], length 1044
1527830630.939064 IP (tos 0x0, ttl 64, id 39774, offset 0, flags [DF], proto TCP (6), length 52)
    rpi33.lan.46656 > rpi41.lan.48084: Flags [.], cksum 0x8489 (incorrect -> 0xca45), ack 3133, win 944, options [nop,nop,TS val 279711335 ecr 1581983948], length 0
1527830630.942691 IP (tos 0x0, ttl 64, id 27051, offset 0, flags [DF], proto TCP (6), length 1096)
    rpi40.lan.35100 > rpi33.lan.46656: Flags [P.], cksum 0x1f5e (correct), seq 2089:3133, ack 3132, win 1142, options [nop,nop,TS val 279709160 ecr 279711334], length 1044
1527830630.942759 IP (tos 0x0, ttl 64, id 38809, offset 0, flags [DF], proto TCP (6), length 52)
    rpi33.lan.46656 > rpi40.lan.35100: Flags [.], cksum 0x8488 (incorrect -> 0x96fd), ack 3133, win 1124, options [nop,nop,TS val 279711335 ecr 279709160], length 0
1527830630.974500 IP (tos 0x0, ttl 64, id 31528, offset 0, flags [DF], proto TCP (6), length 52)
    rpi33.lan.55368 > rpi38.lan.46656: Flags [.], cksum 0x8486 (incorrect -> 0x2eec), ack 3132, win 1324, options [nop,nop,TS val 279711339 ecr 279709866], length 0
1527830631.530667 IP (tos 0x0, ttl 64, id 681, offset 0, flags [DF], proto TCP (6), length 60)
    rpi33.lan.41790 > rpi35.lan.46656: Flags [S], cksum 0x848b (incorrect -> 0xe6ad), seq 3859549195, win 29200, options [mss 1460,sackOK,TS val 279711394 ecr 0,nop,wscale 7], length 0
1527830631.531432 IP (tos 0x0, ttl 64, id 0, offset 0, flags [DF], proto TCP (6), length 60)
    rpi35.lan.46656 > rpi33.lan.41790: Flags [S.], cksum 0x68b3 (correct), seq 1446383388, ack 3859549196, win 28960, options [mss 1460,sackOK,TS val 279709915 ecr 279711394,nop,wscale 7], length 0
1527830631.531521 IP (tos 0x0, ttl 64, id 682, offset 0, flags [DF], proto TCP (6), length 52)
    rpi33.lan.41790 > rpi35.lan.46656: Flags [.], cksum 0x8483 (incorrect -> 0x07bb), ack 1, win 229, options [nop,nop,TS val 279711394 ecr 279709915], length 0
1527830631.544060 IP (tos 0x0, ttl 64, id 683, offset 0, flags [DF], proto TCP (6), length 86)
    rpi33.lan.41790 > rpi35.lan.46656: Flags [P.], cksum 0x84a5 (incorrect -> 0x841e), seq 1:35, ack 1, win 229, options [nop,nop,TS val 279711395 ecr 279709915], length 34
1527830631.544679 IP (tos 0x0, ttl 64, id 1990, offset 0, flags [DF], proto TCP (6), length 52)
    rpi35.lan.46656 > rpi33.lan.41790: Flags [.], cksum 0x0798 (correct), ack 35, win 227, options [nop,nop,TS val 279709917 ecr 279711395], length 0
1527830631.545130 IP (tos 0x0, ttl 64, id 1991, offset 0, flags [DF], proto TCP (6), length 86)
    rpi35.lan.46656 > rpi33.lan.41790: Flags [P.], cksum 0x8a03 (correct), seq 1:35, ack 35, win 227, options [nop,nop,TS val 279709917 ecr 279711395], length 34
1527830631.545177 IP (tos 0x0, ttl 64, id 684, offset 0, flags [DF], proto TCP (6), length 52)
    rpi33.lan.41790 > rpi35.lan.46656: Flags [.], cksum 0x8483 (incorrect -> 0x0773), ack 35, win 229, options [nop,nop,TS val 279711396 ecr 279709917], length 0
1527830631.558244 IP (tos 0x0, ttl 64, id 685, offset 0, flags [DF], proto TCP (6), length 1096)
    rpi33.lan.41790 > rpi35.lan.46656: Flags [P.], cksum 0x8897 (incorrect -> 0xec5b), seq 35:1079, ack 35, win 229, options [nop,nop,TS val 279711397 ecr 279709917], length 1044
1527830631.558402 IP (tos 0x0, ttl 64, id 1992, offset 0, flags [DF], proto TCP (6), length 1096)
    rpi35.lan.46656 > rpi33.lan.41790: Flags [P.], cksum 0xc1da (correct), seq 35:1079, ack 35, win 227, options [nop,nop,TS val 279709918 ecr 279711396], length 1044
1527830631.568541 IP (tos 0x0, ttl 64, id 686, offset 0, flags [DF], proto TCP (6), length 1096)
    rpi33.lan.41790 > rpi35.lan.46656: Flags [P.], cksum 0x8897 (incorrect -> 0xe174), seq 1079:2123, ack 1079, win 245, options [nop,nop,TS val 279711398 ecr 279709918], length 1044
1527830631.569279 IP (tos 0x0, ttl 64, id 1993, offset 0, flags [DF], proto TCP (6), length 1096)
    rpi35.lan.46656 > rpi33.lan.41790: Flags [P.], cksum 0x5413 (correct), seq 1079:2123, ack 1079, win 243, options [nop,nop,TS val 279709919 ecr 279711397], length 1044
1527830631.572812 IP (tos 0x0, ttl 64, id 1994, offset 0, flags [DF], proto TCP (6), length 52)
    rpi35.lan.46656 > rpi33.lan.41790: Flags [F.], cksum 0xf6ff (correct), seq 2123, ack 2123, win 259, options [nop,nop,TS val 279709919 ecr 279711398], length 0
1527830631.572872 IP (tos 0x0, ttl 64, id 687, offset 0, flags [DF], proto TCP (6), length 52)
    rpi33.lan.41790 > rpi35.lan.46656: Flags [F.], cksum 0x8483 (incorrect -> 0xf6fd), seq 2123, ack 2123, win 261, options [nop,nop,TS val 279711398 ecr 279709919], length 0
1527830631.572965 IP (tos 0x0, ttl 64, id 688, offset 0, flags [DF], proto TCP (6), length 52)
    rpi33.lan.41790 > rpi35.lan.46656: Flags [.], cksum 0x8483 (incorrect -> 0xf6fc), ack 2124, win 261, options [nop,nop,TS val 279711398 ecr 279709919], length 0
1527830631.573466 IP (tos 0x0, ttl 64, id 1995, offset 0, flags [DF], proto TCP (6), length 52)
    rpi35.lan.46656 > rpi33.lan.41790: Flags [.], cksum 0xf6fe (correct), ack 2124, win 259, options [nop,nop,TS val 279709919 ecr 279711398], length 0
1527830631.947662 IP (tos 0x0, ttl 64, id 12170, offset 0, flags [DF], proto TCP (6), length 1096)
    rpi42.lan.49208 > rpi33.lan.46656: Flags [P.], cksum 0xf072 (correct), seq 2089:3133, ack 3132, win 751, options [nop,nop,TS val 279711416 ecr 279711334], length 1044
1527830631.947823 IP (tos 0x0, ttl 64, id 40367, offset 0, flags [DF], proto TCP (6), length 52)
    rpi33.lan.46656 > rpi42.lan.49208: Flags [.], cksum 0x848a (incorrect -> 0xc339), ack 3133, win 732, options [nop,nop,TS val 279711436 ecr 279711416], length 0
1527830632.102845 IP (tos 0x0, ttl 64, id 21685, offset 0, flags [DF], proto TCP (6), length 60)
    rpi33.lan.47542 > rpi36.lan.46656: Flags [S], cksum 0x848c (incorrect -> 0x28ad), seq 1056463470, win 29200, options [mss 1460,sackOK,TS val 279711451 ecr 0,nop,wscale 7], length 0
1527830632.103580 IP (tos 0x0, ttl 64, id 0, offset 0, flags [DF], proto TCP (6), length 60)
    rpi36.lan.46656 > rpi33.lan.47542: Flags [S.], cksum 0x6514 (correct), seq 1628521439, ack 1056463471, win 28960, options [mss 1460,sackOK,TS val 279711451 ecr 279711451,nop,wscale 7], length 0
1527830632.103696 IP (tos 0x0, ttl 64, id 21686, offset 0, flags [DF], proto TCP (6), length 52)
    rpi33.lan.47542 > rpi36.lan.46656: Flags [.], cksum 0x8484 (incorrect -> 0x041c), ack 1, win 229, options [nop,nop,TS val 279711451 ecr 279711451], length 0
1527830632.117031 IP (tos 0x0, ttl 64, id 19771, offset 0, flags [DF], proto TCP (6), length 86)
    rpi36.lan.46656 > rpi33.lan.47542: Flags [P.], cksum 0x3ae6 (correct), seq 1:35, ack 1, win 227, options [nop,nop,TS val 279711452 ecr 279711451], length 34
1527830632.117126 IP (tos 0x0, ttl 64, id 21687, offset 0, flags [DF], proto TCP (6), length 52)
    rpi33.lan.47542 > rpi36.lan.46656: Flags [.], cksum 0x8484 (incorrect -> 0x03f7), ack 35, win 229, options [nop,nop,TS val 279711453 ecr 279711452], length 0
1527830632.118115 IP (tos 0x0, ttl 64, id 21688, offset 0, flags [DF], proto TCP (6), length 86)
    rpi33.lan.47542 > rpi36.lan.46656: Flags [P.], cksum 0x84a6 (incorrect -> 0x22d1), seq 1:35, ack 35, win 229, options [nop,nop,TS val 279711453 ecr 279711452], length 34
1527830632.118674 IP (tos 0x0, ttl 64, id 19772, offset 0, flags [DF], proto TCP (6), length 52)
    rpi36.lan.46656 > rpi33.lan.47542: Flags [.], cksum 0x03d7 (correct), ack 35, win 227, options [nop,nop,TS val 279711452 ecr 279711453], length 0
1527830632.131180 IP (tos 0x0, ttl 64, id 21689, offset 0, flags [DF], proto TCP (6), length 1096)
    rpi33.lan.47542 > rpi36.lan.46656: Flags [P.], cksum 0x8898 (incorrect -> 0x76ab), seq 35:1079, ack 35, win 229, options [nop,nop,TS val 279711454 ecr 279711452], length 1044
1527830632.131784 IP (tos 0x0, ttl 64, id 19773, offset 0, flags [DF], proto TCP (6), length 1096)
    rpi36.lan.46656 > rpi33.lan.47542: Flags [P.], cksum 0x92e4 (correct), seq 35:1079, ack 35, win 227, options [nop,nop,TS val 279711453 ecr 279711453], length 1044
1527830632.141746 IP (tos 0x0, ttl 64, id 21690, offset 0, flags [DF], proto TCP (6), length 1096)
    rpi33.lan.47542 > rpi36.lan.46656: Flags [P.], cksum 0x8898 (incorrect -> 0x53b3), seq 1079:2123, ack 1079, win 245, options [nop,nop,TS val 279711455 ecr 279711453], length 1044
1527830632.142050 IP (tos 0x0, ttl 64, id 19774, offset 0, flags [DF], proto TCP (6), length 1096)
    rpi36.lan.46656 > rpi33.lan.47542: Flags [P.], cksum 0x260d (correct), seq 1079:2123, ack 1079, win 243, options [nop,nop,TS val 279711454 ecr 279711454], length 1044
1527830632.145631 IP (tos 0x0, ttl 64, id 21691, offset 0, flags [DF], proto TCP (6), length 52)
    rpi33.lan.47542 > rpi36.lan.46656: Flags [F.], cksum 0x8484 (incorrect -> 0xf35e), seq 2123, ack 2123, win 261, options [nop,nop,TS val 279711456 ecr 279711454], length 0
1527830632.146059 IP (tos 0x0, ttl 64, id 19775, offset 0, flags [DF], proto TCP (6), length 52)
    rpi36.lan.46656 > rpi33.lan.47542: Flags [F.], cksum 0xf360 (correct), seq 2123, ack 2123, win 259, options [nop,nop,TS val 279711455 ecr 279711455], length 0
1527830632.146158 IP (tos 0x0, ttl 64, id 21692, offset 0, flags [DF], proto TCP (6), length 52)
    rpi33.lan.47542 > rpi36.lan.46656: Flags [.], cksum 0x8484 (incorrect -> 0xf35c), ack 2124, win 261, options [nop,nop,TS val 279711456 ecr 279711455], length 0
1527830632.146236 IP (tos 0x0, ttl 64, id 19776, offset 0, flags [DF], proto TCP (6), length 52)
    rpi36.lan.46656 > rpi33.lan.47542: Flags [.], cksum 0xf35e (correct), ack 2124, win 259, options [nop,nop,TS val 279711455 ecr 279711456], length 0
1527830632.574134 IP (tos 0x0, ttl 64, id 43643, offset 0, flags [DF], proto TCP (6), length 60)
    rpi33.lan.46660 > rpi45.lan.46656: Flags [S], cksum 0x8495 (incorrect -> 0xb8fd), seq 1725867377, win 29200, options [mss 1460,sackOK,TS val 279711498 ecr 0,nop,wscale 7], length 0
1527830632.574730 IP (tos 0x0, ttl 64, id 24442, offset 0, flags [DF], proto TCP (6), length 40)
    rpi45.lan.46656 > rpi33.lan.46660: Flags [R.], cksum 0xb293 (correct), seq 0, ack 1725867378, win 0, length 0
1527830632.878371 IP (tos 0x0, ttl 64, id 1969, offset 0, flags [DF], proto TCP (6), length 60)
    rpi33.lan.53788 > rpi41.lan.46656: Flags [S], cksum 0x8491 (incorrect -> 0xa25f), seq 4267837592, win 29200, options [mss 1460,sackOK,TS val 279711529 ecr 0,nop,wscale 7], length 0
1527830632.879036 IP (tos 0x0, ttl 64, id 0, offset 0, flags [DF], proto TCP (6), length 60)
    rpi41.lan.46656 > rpi33.lan.53788: Flags [S.], cksum 0xc9ce (correct), seq 762518865, ack 4267837593, win 28960, options [mss 1460,sackOK,TS val 1581985888 ecr 279711529,nop,wscale 7], length 0
1527830632.879158 IP (tos 0x0, ttl 64, id 1970, offset 0, flags [DF], proto TCP (6), length 52)
    rpi33.lan.53788 > rpi41.lan.46656: Flags [.], cksum 0x8489 (incorrect -> 0x68d6), ack 1, win 229, options [nop,nop,TS val 279711529 ecr 1581985888], length 0
1527830632.891674 IP (tos 0x0, ttl 64, id 1971, offset 0, flags [DF], proto TCP (6), length 86)
    rpi33.lan.53788 > rpi41.lan.46656: Flags [P.], cksum 0x84ab (incorrect -> 0xfd3b), seq 1:35, ack 1, win 229, options [nop,nop,TS val 279711530 ecr 1581985888], length 34
1527830632.892227 IP (tos 0x0, ttl 64, id 4677, offset 0, flags [DF], proto TCP (6), length 52)
    rpi41.lan.46656 > rpi33.lan.53788: Flags [.], cksum 0x68a8 (correct), ack 35, win 227, options [nop,nop,TS val 1581985901 ecr 279711530], length 0
1527830632.892742 IP (tos 0x0, ttl 64, id 4678, offset 0, flags [DF], proto TCP (6), length 86)
    rpi41.lan.46656 > rpi33.lan.53788: Flags [P.], cksum 0x470f (correct), seq 1:35, ack 35, win 227, options [nop,nop,TS val 1581985902 ecr 279711530], length 34
1527830632.892792 IP (tos 0x0, ttl 64, id 1972, offset 0, flags [DF], proto TCP (6), length 52)
    rpi33.lan.53788 > rpi41.lan.46656: Flags [.], cksum 0x8489 (incorrect -> 0x6883), ack 35, win 229, options [nop,nop,TS val 279711530 ecr 1581985902], length 0
1527830632.906313 IP (tos 0x0, ttl 64, id 1973, offset 0, flags [DF], proto TCP (6), length 1096)
    rpi33.lan.53788 > rpi41.lan.46656: Flags [P.], cksum 0x889d (incorrect -> 0x92d9), seq 35:1079, ack 35, win 229, options [nop,nop,TS val 279711532 ecr 1581985902], length 1044
1527830632.906603 IP (tos 0x0, ttl 64, id 4679, offset 0, flags [DF], proto TCP (6), length 1096)
    rpi41.lan.46656 > rpi33.lan.53788: Flags [P.], cksum 0x3c33 (correct), seq 35:1079, ack 35, win 227, options [nop,nop,TS val 1581985915 ecr 279711530], length 1044
1527830632.916420 IP (tos 0x0, ttl 64, id 1974, offset 0, flags [DF], proto TCP (6), length 1096)
    rpi33.lan.53788 > rpi41.lan.46656: Flags [P.], cksum 0x889d (incorrect -> 0xef1d), seq 1079:2123, ack 1079, win 245, options [nop,nop,TS val 279711533 ecr 1581985915], length 1044
1527830632.917288 IP (tos 0x0, ttl 64, id 4680, offset 0, flags [DF], proto TCP (6), length 1096)
    rpi41.lan.46656 > rpi33.lan.53788: Flags [P.], cksum 0x9b10 (correct), seq 1079:2123, ack 1079, win 243, options [nop,nop,TS val 1581985926 ecr 279711532], length 1044
1527830632.920692 IP (tos 0x0, ttl 64, id 4681, offset 0, flags [DF], proto TCP (6), length 52)
    rpi41.lan.46656 > rpi33.lan.53788: Flags [F.], cksum 0x57f5 (correct), seq 2123, ack 2123, win 259, options [nop,nop,TS val 1581985930 ecr 279711533], length 0
1527830632.920797 IP (tos 0x0, ttl 64, id 1975, offset 0, flags [DF], proto TCP (6), length 52)
    rpi33.lan.53788 > rpi41.lan.46656: Flags [.], cksum 0x8489 (incorrect -> 0x57f7), ack 2124, win 261, options [nop,nop,TS val 279711533 ecr 1581985926], length 0
1527830632.920975 IP (tos 0x0, ttl 64, id 1976, offset 0, flags [DF], proto TCP (6), length 52)
    rpi33.lan.53788 > rpi41.lan.46656: Flags [F.], cksum 0x8489 (incorrect -> 0x57f6), seq 2123, ack 2124, win 261, options [nop,nop,TS val 279711533 ecr 1581985926], length 0
1527830632.921501 IP (tos 0x0, ttl 64, id 7126, offset 0, flags [DF], proto TCP (6), length 52)
    rpi41.lan.46656 > rpi33.lan.53788: Flags [.], cksum 0x57f3 (correct), ack 2124, win 259, options [nop,nop,TS val 1581985931 ecr 279711533], length 0
1527830632.930580 IP (tos 0x0, ttl 64, id 23264, offset 0, flags [DF], proto TCP (6), length 1096)
    rpi36.lan.52404 > rpi33.lan.46656: Flags [P.], cksum 0x8ccb (correct), seq 3133:4177, ack 3132, win 1324, options [nop,nop,TS val 279711533 ecr 279711334], length 1044
1527830632.930623 IP (tos 0x0, ttl 64, id 51946, offset 0, flags [DF], proto TCP (6), length 1096)
    rpi33.lan.46656 > rpi35.lan.36908: Flags [P.], cksum 0x8860 (correct), seq 3132:4176, ack 3133, win 1332, options [nop,nop,TS val 279711534 ecr 279709856], length 1044
1527830632.930676 IP (tos 0x0, ttl 64, id 3959, offset 0, flags [DF], proto TCP (6), length 52)
    rpi33.lan.46656 > rpi36.lan.52404: Flags [.], cksum 0x8484 (incorrect -> 0x0366), ack 4177, win 1331, options [nop,nop,TS val 279711534 ecr 279711533], length 0
1527830632.930975 IP (tos 0x0, ttl 64, id 12816, offset 0, flags [DF], proto TCP (6), length 1096)
    rpi33.lan.51354 > rpi34.lan.46656: Flags [P.], cksum 0x8896 (incorrect -> 0x64f7), seq 3132:4176, ack 3133, win 1324, options [nop,nop,TS val 279711534 ecr 279711343], length 1044
1527830632.931043 IP (tos 0x0, ttl 64, id 31529, offset 0, flags [DF], proto TCP (6), length 1096)
    rpi33.lan.55368 > rpi38.lan.46656: Flags [P.], cksum 0x889a (incorrect -> 0x2523), seq 3133:4177, ack 3132, win 1324, options [nop,nop,TS val 279711534 ecr 279709866], length 1044
1527830632.931255 IP (tos 0x0, ttl 64, id 3960, offset 0, flags [DF], proto TCP (6), length 1096)
    rpi33.lan.46656 > rpi36.lan.52404: Flags [P.], cksum 0xd281 (correct), seq 3132:4176, ack 4177, win 1332, options [nop,nop,TS val 279711534 ecr 279711533], length 1044
1527830632.931349 IP (tos 0x0, ttl 64, id 39775, offset 0, flags [DF], proto TCP (6), length 1096)
    rpi33.lan.46656 > rpi41.lan.48084: Flags [P.], cksum 0xd235 (correct), seq 3132:4176, ack 3133, win 944, options [nop,nop,TS val 279711534 ecr 1581983948], length 1044
1527830632.931397 IP (tos 0x0, ttl 64, id 59050, offset 0, flags [DF], proto TCP (6), length 1096)
    rpi33.lan.55238 > rpi37.lan.46656: Flags [P.], cksum 0x8899 (incorrect -> 0xf02d), seq 3132:4176, ack 3133, win 1324, options [nop,nop,TS val 279711534 ecr 279711318], length 1044
1527830632.931487 IP (tos 0x0, ttl 64, id 41400, offset 0, flags [DF], proto TCP (6), length 1096)
    rpi33.lan.46656 > rpi39.lan.50408: Flags [P.], cksum 0xe323 (correct), seq 3132:4176, ack 3133, win 1332, options [nop,nop,TS val 279711534 ecr 279711334], length 1044
1527830632.931643 IP (tos 0x0, ttl 64, id 38810, offset 0, flags [DF], proto TCP (6), length 1096)
    rpi33.lan.46656 > rpi40.lan.35100: Flags [P.], cksum 0x7eee (correct), seq 3132:4176, ack 3133, win 1124, options [nop,nop,TS val 279711534 ecr 279709160], length 1044
1527830632.931838 IP (tos 0x0, ttl 64, id 14377, offset 0, flags [DF], proto TCP (6), length 52)
