1527816962.674328 IP (tos 0x0, ttl 64, id 32673, offset 0, flags [DF], proto TCP (6), length 1096)
    rpi41.lan.45408 > rpi33.lan.46656: Flags [P.], cksum 0xc0ed (correct), seq 1833132394:1833133438, ack 3957114369, win 1322, options [nop,nop,TS val 1568315570 ecr 278344434], length 1044
1527816962.674454 IP (tos 0x0, ttl 64, id 42985, offset 0, flags [DF], proto TCP (6), length 52)
    rpi33.lan.46656 > rpi41.lan.45408: Flags [.], cksum 0x8489 (incorrect -> 0xc752), ack 1044, win 1222, options [nop,nop,TS val 278344508 ecr 1568315570], length 0
1527816963.390304 IP (tos 0x0, ttl 64, id 32882, offset 0, flags [DF], proto TCP (6), length 1096)
    rpi42.lan.46788 > rpi33.lan.46656: Flags [P.], cksum 0x5b65 (correct), seq 2339655794:2339656838, ack 4122586549, win 946, options [nop,nop,TS val 278344560 ecr 278344435], length 1044
1527816963.390462 IP (tos 0x0, ttl 64, id 59259, offset 0, flags [DF], proto TCP (6), length 52)
    rpi33.lan.46656 > rpi42.lan.46788: Flags [.], cksum 0x848a (incorrect -> 0x7606), ack 1044, win 961, options [nop,nop,TS val 278344580 ecr 278344560], length 0
1527816963.933658 IP (tos 0x0, ttl 64, id 40045, offset 0, flags [DF], proto TCP (6), length 1096)
    rpi33.lan.37298 > rpi37.lan.46656: Flags [P.], cksum 0x8899 (incorrect -> 0xdd35), seq 207954017:207955061, ack 1232263678, win 1324, options [nop,nop,TS val 278344634 ecr 278344420], length 1044
1527816963.933731 IP (tos 0x0, ttl 64, id 10390, offset 0, flags [DF], proto TCP (6), length 1096)
    rpi33.lan.57566 > rpi36.lan.46656: Flags [P.], cksum 0x8898 (incorrect -> 0xb9c9), seq 2001635119:2001636163, ack 237290101, win 1324, options [nop,nop,TS val 278344634 ecr 278344435], length 1044
1527816963.933749 IP (tos 0x0, ttl 64, id 59735, offset 0, flags [DF], proto TCP (6), length 1096)
    rpi33.lan.37416 > rpi38.lan.46656: Flags [P.], cksum 0x889a (incorrect -> 0x6dda), seq 302041258:302042302, ack 1429927676, win 1324, options [nop,nop,TS val 278344634 ecr 278342968], length 1044
1527816963.933856 IP (tos 0x0, ttl 64, id 2062, offset 0, flags [DF], proto TCP (6), length 1096)
    rpi33.lan.33422 > rpi34.lan.46656: Flags [P.], cksum 0x8896 (incorrect -> 0xb5d0), seq 829860335:829861379, ack 1296431435, win 1324, options [nop,nop,TS val 278344634 ecr 278344444], length 1044
1527816963.933923 IP (tos 0x0, ttl 64, id 13257, offset 0, flags [DF], proto TCP (6), length 1096)
    rpi33.lan.51742 > rpi35.lan.46656: Flags [P.], cksum 0x8897 (incorrect -> 0x8c8b), seq 1568653915:1568654959, ack 1212290434, win 1324, options [nop,nop,TS val 278344634 ecr 278342956], length 1044
1527816963.933951 IP (tos 0x0, ttl 64, id 46627, offset 0, flags [DF], proto TCP (6), length 1096)
    rpi33.lan.46656 > rpi39.lan.47132: Flags [P.], cksum 0x5eb7 (correct), seq 4184303763:4184304807, ack 3667332295, win 1332, options [nop,nop,TS val 278344634 ecr 278344436], length 1044
1527816963.934341 IP (tos 0x0, ttl 64, id 30506, offset 0, flags [DF], proto TCP (6), length 1096)
    rpi33.lan.40078 > rpi40.lan.46656: Flags [P.], cksum 0x889c (incorrect -> 0x0378), seq 1725938644:1725939688, ack 2656703178, win 1324, options [nop,nop,TS val 278344634 ecr 278342260], length 1044
1527816963.934370 IP (tos 0x0, ttl 64, id 59260, offset 0, flags [DF], proto TCP (6), length 1096)
    rpi33.lan.46656 > rpi42.lan.46788: Flags [P.], cksum 0xd0f7 (correct), seq 1:1045, ack 1044, win 961, options [nop,nop,TS val 278344634 ecr 278344560], length 1044
1527816963.934387 IP (tos 0x0, ttl 64, id 42986, offset 0, flags [DF], proto TCP (6), length 1096)
    rpi33.lan.46656 > rpi41.lan.45408: Flags [P.], cksum 0xb5c0 (correct), seq 1:1045, ack 1044, win 1222, options [nop,nop,TS val 278344634 ecr 1568315570], length 1044
1527816963.935297 IP (tos 0x0, ttl 64, id 32674, offset 0, flags [DF], proto TCP (6), length 52)
    rpi41.lan.45408 > rpi33.lan.46656: Flags [.], cksum 0xbd6e (correct), ack 1045, win 1323, options [nop,nop,TS val 1568316831 ecr 278344634], length 0
1527816963.939175 IP (tos 0x0, ttl 64, id 36157, offset 0, flags [DF], proto TCP (6), length 1096)
    rpi35.lan.46656 > rpi33.lan.51742: Flags [P.], cksum 0x03d3 (correct), seq 1:1045, ack 1044, win 1332, options [nop,nop,TS val 278343157 ecr 278344634], length 1044
1527816963.939246 IP (tos 0x0, ttl 64, id 13258, offset 0, flags [DF], proto TCP (6), length 52)
    rpi33.lan.51742 > rpi35.lan.46656: Flags [.], cksum 0x8483 (incorrect -> 0x6430), ack 1045, win 1323, options [nop,nop,TS val 278344635 ecr 278343157], length 0
1527816963.941229 IP (tos 0x0, ttl 64, id 7433, offset 0, flags [DF], proto TCP (6), length 1096)
    rpi36.lan.46656 > rpi33.lan.57566: Flags [P.], cksum 0x4661 (correct), seq 1:1045, ack 1044, win 1332, options [nop,nop,TS val 278344635 ecr 278344634], length 1044
1527816963.941316 IP (tos 0x0, ttl 64, id 10391, offset 0, flags [DF], proto TCP (6), length 52)
    rpi33.lan.57566 > rpi36.lan.46656: Flags [.], cksum 0x8484 (incorrect -> 0xf630), ack 1045, win 1323, options [nop,nop,TS val 278344635 ecr 278344635], length 0
1527816963.943036 IP (tos 0x0, ttl 64, id 50544, offset 0, flags [DF], proto TCP (6), length 1096)
    rpi38.lan.46656 > rpi33.lan.37416: Flags [P.], cksum 0x0e11 (correct), seq 1:1045, ack 1044, win 1332, options [nop,nop,TS val 278343168 ecr 278344634], length 1044
1527816963.943114 IP (tos 0x0, ttl 64, id 59736, offset 0, flags [DF], proto TCP (6), length 52)
    rpi33.lan.37416 > rpi38.lan.46656: Flags [.], cksum 0x8486 (incorrect -> 0xf2d5), ack 1045, win 1323, options [nop,nop,TS val 278344635 ecr 278343168], length 0
1527816963.945706 IP (tos 0x0, ttl 64, id 32883, offset 0, flags [DF], proto TCP (6), length 1096)
    rpi42.lan.46788 > rpi33.lan.46656: Flags [P.], cksum 0xf2c2 (correct), seq 1044:2088, ack 1045, win 963, options [nop,nop,TS val 278344616 ecr 278344634], length 1044
1527816963.945778 IP (tos 0x0, ttl 64, id 59261, offset 0, flags [DF], proto TCP (6), length 52)
    rpi33.lan.46656 > rpi42.lan.46788: Flags [.], cksum 0x848a (incorrect -> 0x6d5e), ack 2088, win 977, options [nop,nop,TS val 278344636 ecr 278344616], length 0
1527816963.945903 IP (tos 0x0, ttl 64, id 60561, offset 0, flags [DF], proto TCP (6), length 1096)
    rpi34.lan.46656 > rpi33.lan.33422: Flags [P.], cksum 0x1cbe (correct), seq 1:1045, ack 1044, win 1332, options [nop,nop,TS val 278344644 ecr 278344634], length 1044
1527816963.945963 IP (tos 0x0, ttl 64, id 2063, offset 0, flags [DF], proto TCP (6), length 52)
    rpi33.lan.33422 > rpi34.lan.46656: Flags [.], cksum 0x8482 (incorrect -> 0x019a), ack 1045, win 1323, options [nop,nop,TS val 278344636 ecr 278344644], length 0
1527816963.946281 IP (tos 0x0, ttl 64, id 61435, offset 0, flags [DF], proto TCP (6), length 1096)
    rpi40.lan.46656 > rpi33.lan.40078: Flags [P.], cksum 0x127c (correct), seq 1:1045, ack 1044, win 1332, options [nop,nop,TS val 278342460 ecr 278344634], length 1044
1527816963.946347 IP (tos 0x0, ttl 64, id 30507, offset 0, flags [DF], proto TCP (6), length 52)
    rpi33.lan.40078 > rpi40.lan.46656: Flags [.], cksum 0x8488 (incorrect -> 0x3e3a), ack 1045, win 1323, options [nop,nop,TS val 278344636 ecr 278342460], length 0
1527816963.947717 IP (tos 0x0, ttl 64, id 57018, offset 0, flags [DF], proto TCP (6), length 1096)
    rpi37.lan.46656 > rpi33.lan.37298: Flags [P.], cksum 0x9b44 (correct), seq 1:1045, ack 1044, win 1332, options [nop,nop,TS val 278344620 ecr 278344634], length 1044
1527816963.947787 IP (tos 0x0, ttl 64, id 40046, offset 0, flags [DF], proto TCP (6), length 52)
    rpi33.lan.37298 > rpi37.lan.46656: Flags [.], cksum 0x8485 (incorrect -> 0xc44a), ack 1045, win 1323, options [nop,nop,TS val 278344636 ecr 278344620], length 0
1527816963.953231 IP (tos 0x0, ttl 64, id 22023, offset 0, flags [DF], proto TCP (6), length 1096)
    rpi39.lan.47132 > rpi33.lan.46656: Flags [P.], cksum 0x6e2b (correct), seq 1:1045, ack 1044, win 1324, options [nop,nop,TS val 278344636 ecr 278344634], length 1044
1527816963.953300 IP (tos 0x0, ttl 64, id 46628, offset 0, flags [DF], proto TCP (6), length 52)
    rpi33.lan.46656 > rpi39.lan.47132: Flags [.], cksum 0x8487 (incorrect -> 0xa4a3), ack 1045, win 1331, options [nop,nop,TS val 278344636 ecr 278344636], length 0
1527816964.679715 IP (tos 0x0, ttl 64, id 32675, offset 0, flags [DF], proto TCP (6), length 1096)
    rpi41.lan.45408 > rpi33.lan.46656: Flags [P.], cksum 0xe302 (correct), seq 1044:2088, ack 1045, win 1324, options [nop,nop,TS val 1568317575 ecr 278344634], length 1044
1527816964.679845 IP (tos 0x0, ttl 64, id 42987, offset 0, flags [DF], proto TCP (6), length 52)
    rpi33.lan.46656 > rpi41.lan.45408: Flags [.], cksum 0x8489 (incorrect -> 0xb67c), ack 2088, win 1238, options [nop,nop,TS val 278344709 ecr 1568317575], length 0
1527816965.848896 IP (tos 0x0, ttl 64, id 59262, offset 0, flags [DF], proto TCP (6), length 1096)
    rpi33.lan.46656 > rpi42.lan.46788: Flags [P.], cksum 0xc15c (correct), seq 1045:2089, ack 2088, win 977, options [nop,nop,TS val 278344826 ecr 278344616], length 1044
1527816965.848969 IP (tos 0x0, ttl 64, id 32884, offset 0, flags [DF], proto TCP (6), length 1096)
    rpi42.lan.46788 > rpi33.lan.46656: Flags [P.], cksum 0xab8a (correct), seq 2088:3132, ack 1045, win 963, options [nop,nop,TS val 278344806 ecr 278344636], length 1044
1527816965.849101 IP (tos 0x0, ttl 64, id 59263, offset 0, flags [DF], proto TCP (6), length 52)
    rpi33.lan.46656 > rpi42.lan.46788: Flags [.], cksum 0x848a (incorrect -> 0x63aa), ack 3132, win 993, options [nop,nop,TS val 278344826 ecr 278344806], length 0
1527816965.849780 IP (tos 0x0, ttl 64, id 59264, offset 0, flags [DF], proto TCP (6), length 1096)
    rpi33.lan.46656 > rpi42.lan.46788: Flags [P.], cksum 0x190a (correct), seq 2089:3133, ack 3132, win 993, options [nop,nop,TS val 278344826 ecr 278344806], length 1044
1527816965.850559 IP (tos 0x0, ttl 64, id 32885, offset 0, flags [DF], proto TCP (6), length 52)
    rpi42.lan.46788 > rpi33.lan.46656: Flags [.], cksum 0x5f94 (correct), ack 3133, win 995, options [nop,nop,TS val 278344806 ecr 278344826], length 0
1527816965.851332 IP (tos 0x0, ttl 64, id 32886, offset 0, flags [DF], proto TCP (6), length 1096)
    rpi42.lan.46788 > rpi33.lan.46656: Flags [P.], cksum 0x1084 (correct), seq 3132:4176, ack 3133, win 995, options [nop,nop,TS val 278344806 ecr 278344826], length 1044
1527816965.894509 IP (tos 0x0, ttl 64, id 59265, offset 0, flags [DF], proto TCP (6), length 52)
    rpi33.lan.46656 > rpi42.lan.46788: Flags [.], cksum 0x848a (incorrect -> 0x5b6c), ack 4176, win 1010, options [nop,nop,TS val 278344831 ecr 278344806], length 0
1527816965.937063 IP (tos 0x0, ttl 64, id 46629, offset 0, flags [DF], proto TCP (6), length 1096)
    rpi33.lan.46656 > rpi39.lan.47132: Flags [P.], cksum 0xaa2d (correct), seq 1044:2088, ack 1045, win 1332, options [nop,nop,TS val 278344835 ecr 278344636], length 1044
1527816965.937120 IP (tos 0x0, ttl 64, id 30508, offset 0, flags [DF], proto TCP (6), length 1096)
    rpi33.lan.40078 > rpi40.lan.46656: Flags [P.], cksum 0x889c (incorrect -> 0x4892), seq 1044:2088, ack 1045, win 1324, options [nop,nop,TS val 278344835 ecr 278342460], length 1044
1527816965.937149 IP (tos 0x0, ttl 64, id 10392, offset 0, flags [DF], proto TCP (6), length 1096)
    rpi33.lan.57566 > rpi36.lan.46656: Flags [P.], cksum 0x8898 (incorrect -> 0x7b56), seq 1044:2088, ack 1045, win 1324, options [nop,nop,TS val 278344835 ecr 278344635], length 1044
1527816965.937446 IP (tos 0x0, ttl 64, id 40047, offset 0, flags [DF], proto TCP (6), length 1096)
    rpi33.lan.37298 > rpi37.lan.46656: Flags [P.], cksum 0x8899 (incorrect -> 0x97af), seq 1044:2088, ack 1045, win 1324, options [nop,nop,TS val 278344835 ecr 278344620], length 1044
1527816965.937474 IP (tos 0x0, ttl 64, id 2064, offset 0, flags [DF], proto TCP (6), length 1096)
    rpi33.lan.33422 > rpi34.lan.46656: Flags [P.], cksum 0x8896 (incorrect -> 0x891a), seq 1044:2088, ack 1045, win 1324, options [nop,nop,TS val 278344835 ecr 278344644], length 1044
1527816965.937535 IP (tos 0x0, ttl 64, id 59737, offset 0, flags [DF], proto TCP (6), length 1096)
    rpi33.lan.37416 > rpi38.lan.46656: Flags [P.], cksum 0x889a (incorrect -> 0x0064), seq 1044:2088, ack 1045, win 1324, options [nop,nop,TS val 278344835 ecr 278343168], length 1044
1527816965.937688 IP (tos 0x0, ttl 64, id 13259, offset 0, flags [DF], proto TCP (6), length 1096)
    rpi33.lan.51742 > rpi35.lan.46656: Flags [P.], cksum 0x8897 (incorrect -> 0x1592), seq 1044:2088, ack 1045, win 1324, options [nop,nop,TS val 278344835 ecr 278343157], length 1044
1527816965.938025 IP (tos 0x0, ttl 64, id 42988, offset 0, flags [DF], proto TCP (6), length 1096)
    rpi33.lan.46656 > rpi41.lan.45408: Flags [P.], cksum 0xd1b4 (correct), seq 1045:2089, ack 2088, win 1238, options [nop,nop,TS val 278344835 ecr 1568317575], length 1044
1527816965.938845 IP (tos 0x0, ttl 64, id 32676, offset 0, flags [DF], proto TCP (6), length 52)
    rpi41.lan.45408 > rpi33.lan.46656: Flags [.], cksum 0xacaa (correct), ack 2089, win 1323, options [nop,nop,TS val 1568318834 ecr 278344835], length 0
1527816965.942665 IP (tos 0x0, ttl 64, id 36158, offset 0, flags [DF], proto TCP (6), length 1096)
    rpi35.lan.46656 > rpi33.lan.51742: Flags [P.], cksum 0x2a1c (correct), seq 1045:2089, ack 2088, win 1332, options [nop,nop,TS val 278343357 ecr 278344835], length 1044
1527816965.942737 IP (tos 0x0, ttl 64, id 13260, offset 0, flags [DF], proto TCP (6), length 52)
    rpi33.lan.51742 > rpi35.lan.46656: Flags [.], cksum 0x8483 (incorrect -> 0x5a78), ack 2089, win 1323, options [nop,nop,TS val 278344835 ecr 278343357], length 0
1527816965.944692 IP (tos 0x0, ttl 64, id 7434, offset 0, flags [DF], proto TCP (6), length 1096)
    rpi36.lan.46656 > rpi33.lan.57566: Flags [P.], cksum 0xe931 (correct), seq 1045:2089, ack 2088, win 1332, options [nop,nop,TS val 278344835 ecr 278344835], length 1044
1527816965.944767 IP (tos 0x0, ttl 64, id 10393, offset 0, flags [DF], proto TCP (6), length 52)
    rpi33.lan.57566 > rpi36.lan.46656: Flags [.], cksum 0x8484 (incorrect -> 0xec77), ack 2089, win 1323, options [nop,nop,TS val 278344836 ecr 278344835], length 0
1527816965.946665 IP (tos 0x0, ttl 64, id 50545, offset 0, flags [DF], proto TCP (6), length 1096)
    rpi38.lan.46656 > rpi33.lan.37416: Flags [P.], cksum 0x6dad (correct), seq 1045:2089, ack 2088, win 1332, options [nop,nop,TS val 278343368 ecr 278344835], length 1044
1527816965.946730 IP (tos 0x0, ttl 64, id 59738, offset 0, flags [DF], proto TCP (6), length 52)
    rpi33.lan.37416 > rpi38.lan.46656: Flags [.], cksum 0x8486 (incorrect -> 0xe91c), ack 2089, win 1323, options [nop,nop,TS val 278344836 ecr 278343368], length 0
1527816965.949130 IP (tos 0x0, ttl 64, id 61436, offset 0, flags [DF], proto TCP (6), length 1096)
    rpi40.lan.46656 > rpi33.lan.40078: Flags [P.], cksum 0x8232 (correct), seq 1045:2089, ack 2088, win 1332, options [nop,nop,TS val 278342660 ecr 278344835], length 1044
1527816965.949195 IP (tos 0x0, ttl 64, id 30509, offset 0, flags [DF], proto TCP (6), length 52)
    rpi33.lan.40078 > rpi40.lan.46656: Flags [.], cksum 0x8488 (incorrect -> 0x3482), ack 2089, win 1323, options [nop,nop,TS val 278344836 ecr 278342660], length 0
1527816965.949567 IP (tos 0x0, ttl 64, id 60562, offset 0, flags [DF], proto TCP (6), length 1096)
    rpi34.lan.46656 > rpi33.lan.33422: Flags [P.], cksum 0xa933 (correct), seq 1045:2089, ack 2088, win 1332, options [nop,nop,TS val 278344845 ecr 278344835], length 1044
1527816965.949631 IP (tos 0x0, ttl 64, id 2065, offset 0, flags [DF], proto TCP (6), length 52)
    rpi33.lan.33422 > rpi34.lan.46656: Flags [.], cksum 0x8482 (incorrect -> 0xf7e0), ack 2089, win 1323, options [nop,nop,TS val 278344836 ecr 278344845], length 0
1527816965.952019 IP (tos 0x0, ttl 64, id 57019, offset 0, flags [DF], proto TCP (6), length 1096)
    rpi37.lan.46656 > rpi33.lan.37298: Flags [P.], cksum 0xecaa (correct), seq 1045:2089, ack 2088, win 1332, options [nop,nop,TS val 278344821 ecr 278344835], length 1044
1527816965.952085 IP (tos 0x0, ttl 64, id 40048, offset 0, flags [DF], proto TCP (6), length 52)
    rpi33.lan.37298 > rpi37.lan.46656: Flags [.], cksum 0x8485 (incorrect -> 0xba91), ack 2089, win 1323, options [nop,nop,TS val 278344836 ecr 278344821], length 0
1527816965.957501 IP (tos 0x0, ttl 64, id 22024, offset 0, flags [DF], proto TCP (6), length 1096)
    rpi39.lan.47132 > rpi33.lan.46656: Flags [P.], cksum 0xe64b (correct), seq 1045:2089, ack 2088, win 1324, options [nop,nop,TS val 278344837 ecr 278344835], length 1044
1527816965.957568 IP (tos 0x0, ttl 64, id 46630, offset 0, flags [DF], proto TCP (6), length 52)
    rpi33.lan.46656 > rpi39.lan.47132: Flags [.], cksum 0x8487 (incorrect -> 0x9ae9), ack 2089, win 1331, options [nop,nop,TS val 278344837 ecr 278344837], length 0
1527816966.682666 IP (tos 0x0, ttl 64, id 32677, offset 0, flags [DF], proto TCP (6), length 1096)
    rpi41.lan.45408 > rpi33.lan.46656: Flags [P.], cksum 0x0efb (correct), seq 2088:3132, ack 2089, win 1324, options [nop,nop,TS val 1568319578 ecr 278344835], length 1044
1527816966.682800 IP (tos 0x0, ttl 64, id 42989, offset 0, flags [DF], proto TCP (6), length 52)
    rpi33.lan.46656 > rpi41.lan.45408: Flags [.], cksum 0x8489 (incorrect -> 0xa5a9), ack 3132, win 1254, options [nop,nop,TS val 278344909 ecr 1568319578], length 0
1527816967.940540 IP (tos 0x0, ttl 64, id 13261, offset 0, flags [DF], proto TCP (6), length 1096)
    rpi33.lan.51742 > rpi35.lan.46656: Flags [P.], cksum 0x8897 (incorrect -> 0xaabc), seq 2088:3132, ack 2089, win 1324, options [nop,nop,TS val 278345035 ecr 278343357], length 1044
1527816967.940609 IP (tos 0x0, ttl 64, id 46631, offset 0, flags [DF], proto TCP (6), length 1096)
    rpi33.lan.46656 > rpi39.lan.47132: Flags [P.], cksum 0x049c (correct), seq 2088:3132, ack 2089, win 1332, options [nop,nop,TS val 278345035 ecr 278344837], length 1044
1527816967.940630 IP (tos 0x0, ttl 64, id 10394, offset 0, flags [DF], proto TCP (6), length 1096)
    rpi33.lan.57566 > rpi36.lan.46656: Flags [P.], cksum 0x8898 (incorrect -> 0x5356), seq 2088:3132, ack 2089, win 1324, options [nop,nop,TS val 278345035 ecr 278344835], length 1044
1527816967.940683 IP (tos 0x0, ttl 64, id 30510, offset 0, flags [DF], proto TCP (6), length 1096)
    rpi33.lan.40078 > rpi40.lan.46656: Flags [P.], cksum 0x889c (incorrect -> 0x75f7), seq 2088:3132, ack 2089, win 1324, options [nop,nop,TS val 278345035 ecr 278342660], length 1044
1527816967.940807 IP (tos 0x0, ttl 64, id 2066, offset 0, flags [DF], proto TCP (6), length 1096)
    rpi33.lan.33422 > rpi34.lan.46656: Flags [P.], cksum 0x8896 (incorrect -> 0x854f), seq 2088:3132, ack 2089, win 1324, options [nop,nop,TS val 278345035 ecr 278344845], length 1044
1527816967.940876 IP (tos 0x0, ttl 64, id 42990, offset 0, flags [DF], proto TCP (6), length 1096)
    rpi33.lan.46656 > rpi41.lan.45408: Flags [P.], cksum 0xf0dc (correct), seq 2089:3133, ack 3132, win 1254, options [nop,nop,TS val 278345035 ecr 1568319578], length 1044
1527816967.941104 IP (tos 0x0, ttl 64, id 40049, offset 0, flags [DF], proto TCP (6), length 1096)
    rpi33.lan.37298 > rpi37.lan.46656: Flags [P.], cksum 0x8899 (incorrect -> 0x6b59), seq 2088:3132, ack 2089, win 1324, options [nop,nop,TS val 278345035 ecr 278344821], length 1044
1527816967.941197 IP (tos 0x0, ttl 64, id 59739, offset 0, flags [DF], proto TCP (6), length 1096)
    rpi33.lan.37416 > rpi38.lan.46656: Flags [P.], cksum 0x889a (incorrect -> 0xb121), seq 2088:3132, ack 2089, win 1324, options [nop,nop,TS val 278345035 ecr 278343368], length 1044
1527816967.941313 IP (tos 0x0, ttl 64, id 59266, offset 0, flags [DF], proto TCP (6), length 1096)
    rpi33.lan.46656 > rpi42.lan.46788: Flags [P.], cksum 0x74b9 (correct), seq 3133:4177, ack 4176, win 1010, options [nop,nop,TS val 278345035 ecr 278344806], length 1044
1527816967.941874 IP (tos 0x0, ttl 64, id 32678, offset 0, flags [DF], proto TCP (6), length 52)
    rpi41.lan.45408 > rpi33.lan.46656: Flags [.], cksum 0x9be6 (correct), ack 3133, win 1323, options [nop,nop,TS val 1568320838 ecr 278345035], length 0
1527816967.946550 IP (tos 0x0, ttl 64, id 36159, offset 0, flags [DF], proto TCP (6), length 1096)
    rpi35.lan.46656 > rpi33.lan.51742: Flags [P.], cksum 0xaf78 (correct), seq 2089:3133, ack 3132, win 1332, options [nop,nop,TS val 278343557 ecr 278345035], length 1044
1527816967.946626 IP (tos 0x0, ttl 64, id 13262, offset 0, flags [DF], proto TCP (6), length 52)
    rpi33.lan.51742 > rpi35.lan.46656: Flags [.], cksum 0x8483 (incorrect -> 0x50bf), ack 3133, win 1323, options [nop,nop,TS val 278345036 ecr 278343557], length 0
1527816967.948062 IP (tos 0x0, ttl 64, id 7435, offset 0, flags [DF], proto TCP (6), length 1096)
    rpi36.lan.46656 > rpi33.lan.57566: Flags [P.], cksum 0x3e07 (correct), seq 2089:3133, ack 3132, win 1332, options [nop,nop,TS val 278345036 ecr 278345035], length 1044
1527816967.948130 IP (tos 0x0, ttl 64, id 10395, offset 0, flags [DF], proto TCP (6), length 52)
    rpi33.lan.57566 > rpi36.lan.46656: Flags [.], cksum 0x8484 (incorrect -> 0xe2be), ack 3133, win 1323, options [nop,nop,TS val 278345036 ecr 278345036], length 0
1527816967.949997 IP (tos 0x0, ttl 64, id 50546, offset 0, flags [DF], proto TCP (6), length 1096)
    rpi38.lan.46656 > rpi33.lan.37416: Flags [P.], cksum 0xd030 (correct), seq 2089:3133, ack 3132, win 1332, options [nop,nop,TS val 278343569 ecr 278345035], length 1044
1527816967.950060 IP (tos 0x0, ttl 64, id 59740, offset 0, flags [DF], proto TCP (6), length 52)
    rpi33.lan.37416 > rpi38.lan.46656: Flags [.], cksum 0x8486 (incorrect -> 0xdf63), ack 3133, win 1323, options [nop,nop,TS val 278345036 ecr 278343569], length 0
1527816967.952972 IP (tos 0x0, ttl 64, id 32887, offset 0, flags [DF], proto TCP (6), length 1096)
    rpi42.lan.46788 > rpi33.lan.46656: Flags [P.], cksum 0x141f (correct), seq 4176:5220, ack 4177, win 1012, options [nop,nop,TS val 278345017 ecr 278345035], length 1044
1527816967.953036 IP (tos 0x0, ttl 64, id 59267, offset 0, flags [DF], proto TCP (6), length 52)
    rpi33.lan.46656 > rpi42.lan.46788: Flags [.], cksum 0x848a (incorrect -> 0x5194), ack 5220, win 1026, options [nop,nop,TS val 278345036 ecr 278345017], length 0
1527816967.953194 IP (tos 0x0, ttl 64, id 60563, offset 0, flags [DF], proto TCP (6), length 1096)
    rpi34.lan.46656 > rpi33.lan.33422: Flags [P.], cksum 0xb211 (correct), seq 2089:3133, ack 3132, win 1332, options [nop,nop,TS val 278345045 ecr 278345035], length 1044
1527816967.953255 IP (tos 0x0, ttl 64, id 2067, offset 0, flags [DF], proto TCP (6), length 52)
    rpi33.lan.33422 > rpi34.lan.46656: Flags [.], cksum 0x8482 (incorrect -> 0xee28), ack 3133, win 1323, options [nop,nop,TS val 278345036 ecr 278345045], length 0
1527816967.953414 IP (tos 0x0, ttl 64, id 61437, offset 0, flags [DF], proto TCP (6), length 1096)
    rpi40.lan.46656 > rpi33.lan.40078: Flags [P.], cksum 0xcd34 (correct), seq 2089:3133, ack 3132, win 1332, options [nop,nop,TS val 278342861 ecr 278345035], length 1044
1527816967.953476 IP (tos 0x0, ttl 64, id 30511, offset 0, flags [DF], proto TCP (6), length 52)
    rpi33.lan.40078 > rpi40.lan.46656: Flags [.], cksum 0x8488 (incorrect -> 0x2ac9), ack 3133, win 1323, options [nop,nop,TS val 278345036 ecr 278342861], length 0
1527816967.954393 IP (tos 0x0, ttl 64, id 57020, offset 0, flags [DF], proto TCP (6), length 1096)
    rpi37.lan.46656 > rpi33.lan.37298: Flags [P.], cksum 0x6deb (correct), seq 2089:3133, ack 3132, win 1332, options [nop,nop,TS val 278345021 ecr 278345035], length 1044
1527816967.954484 IP (tos 0x0, ttl 64, id 40050, offset 0, flags [DF], proto TCP (6), length 52)
    rpi33.lan.37298 > rpi37.lan.46656: Flags [.], cksum 0x8485 (incorrect -> 0xb0d8), ack 3133, win 1323, options [nop,nop,TS val 278345037 ecr 278345021], length 0
1527816967.960178 IP (tos 0x0, ttl 64, id 22025, offset 0, flags [DF], proto TCP (6), length 1096)
    rpi39.lan.47132 > rpi33.lan.46656: Flags [P.], cksum 0x4450 (correct), seq 2089:3133, ack 3132, win 1324, options [nop,nop,TS val 278345037 ecr 278345035], length 1044
1527816967.960242 IP (tos 0x0, ttl 64, id 46632, offset 0, flags [DF], proto TCP (6), length 52)
    rpi33.lan.46656 > rpi39.lan.47132: Flags [.], cksum 0x8487 (incorrect -> 0x9131), ack 3133, win 1331, options [nop,nop,TS val 278345037 ecr 278345037], length 0
1527816968.685962 IP (tos 0x0, ttl 64, id 32679, offset 0, flags [DF], proto TCP (6), length 1096)
    rpi41.lan.45408 > rpi33.lan.46656: Flags [P.], cksum 0xc337 (correct), seq 3132:4176, ack 3133, win 1324, options [nop,nop,TS val 1568321581 ecr 278345035], length 1044
1527816968.686062 IP (tos 0x0, ttl 64, id 42991, offset 0, flags [DF], proto TCP (6), length 52)
    rpi33.lan.46656 > rpi41.lan.45408: Flags [.], cksum 0x8489 (incorrect -> 0x94d4), ack 4176, win 1271, options [nop,nop,TS val 278345110 ecr 1568321581], length 0
1527816969.944172 IP (tos 0x0, ttl 64, id 30512, offset 0, flags [DF], proto TCP (6), length 1096)
    rpi33.lan.40078 > rpi40.lan.46656: Flags [P.], cksum 0x889c (incorrect -> 0x3975), seq 3132:4176, ack 3133, win 1324, options [nop,nop,TS val 278345235 ecr 278342861], length 1044
1527816969.944222 IP (tos 0x0, ttl 64, id 42992, offset 0, flags [DF], proto TCP (6), length 1096)
    rpi33.lan.46656 > rpi41.lan.45408: Flags [P.], cksum 0x254d (correct), seq 3133:4177, ack 4176, win 1271, options [nop,nop,TS val 278345235 ecr 1568321581], length 1044
1527816969.944240 IP (tos 0x0, ttl 64, id 59741, offset 0, flags [DF], proto TCP (6), length 1096)
    rpi33.lan.37416 > rpi38.lan.46656: Flags [P.], cksum 0x889a (incorrect -> 0xbefe), seq 3132:4176, ack 3133, win 1324, options [nop,nop,TS val 278345235 ecr 278343569], length 1044
1527816969.944695 IP (tos 0x0, ttl 64, id 13263, offset 0, flags [DF], proto TCP (6), length 1096)
    rpi33.lan.51742 > rpi35.lan.46656: Flags [P.], cksum 0x8897 (incorrect -> 0x4c4a), seq 3132:4176, ack 3133, win 1324, options [nop,nop,TS val 278345236 ecr 278343557], length 1044
1527816969.944728 IP (tos 0x0, ttl 64, id 10396, offset 0, flags [DF], proto TCP (6), length 1096)
    rpi33.lan.57566 > rpi36.lan.46656: Flags [P.], cksum 0x8898 (incorrect -> 0x2030), seq 3132:4176, ack 3133, win 1324, options [nop,nop,TS val 278345236 ecr 278345036], length 1044
1527816969.944745 IP (tos 0x0, ttl 64, id 2068, offset 0, flags [DF], proto TCP (6), length 1096)
    rpi33.lan.33422 > rpi34.lan.46656: Flags [P.], cksum 0x8896 (incorrect -> 0x9ba5), seq 3132:4176, ack 3133, win 1324, options [nop,nop,TS val 278345236 ecr 278345045], length 1044
1527816969.944906 IP (tos 0x0, ttl 64, id 46633, offset 0, flags [DF], proto TCP (6), length 1096)
    rpi33.lan.46656 > rpi39.lan.47132: Flags [P.], cksum 0x93bd (correct), seq 3132:4176, ack 3133, win 1332, options [nop,nop,TS val 278345236 ecr 278345037], length 1044
1527816969.944949 IP (tos 0x0, ttl 64, id 40051, offset 0, flags [DF], proto TCP (6), length 1096)
    rpi33.lan.37298 > rpi37.lan.46656: Flags [P.], cksum 0x8899 (incorrect -> 0xf2cc), seq 3132:4176, ack 3133, win 1324, options [nop,nop,TS val 278345236 ecr 278345021], length 1044
1527816969.945106 IP (tos 0x0, ttl 64, id 32680, offset 0, flags [DF], proto TCP (6), length 52)
    rpi41.lan.45408 > rpi33.lan.46656: Flags [.], cksum 0x8b23 (correct), ack 4177, win 1323, options [nop,nop,TS val 1568322841 ecr 278345235], length 0
1527816969.945186 IP (tos 0x0, ttl 64, id 59268, offset 0, flags [DF], proto TCP (6), length 1096)
    rpi33.lan.46656 > rpi42.lan.46788: Flags [P.], cksum 0xc6c3 (correct), seq 4177:5221, ack 5220, win 1026, options [nop,nop,TS val 278345236 ecr 278345017], length 1044
1527816969.949968 IP (tos 0x0, ttl 64, id 36160, offset 0, flags [DF], proto TCP (6), length 1096)
    rpi35.lan.46656 > rpi33.lan.51742: Flags [P.], cksum 0x3991 (correct), seq 3133:4177, ack 4176, win 1332, options [nop,nop,TS val 278343758 ecr 278345236], length 1044
1527816969.950041 IP (tos 0x0, ttl 64, id 13264, offset 0, flags [DF], proto TCP (6), length 52)
    rpi33.lan.51742 > rpi35.lan.46656: Flags [.], cksum 0x8483 (incorrect -> 0x4706), ack 4177, win 1323, options [nop,nop,TS val 278345236 ecr 278343758], length 0
1527816969.951328 IP (tos 0x0, ttl 64, id 7436, offset 0, flags [DF], proto TCP (6), length 1096)
    rpi36.lan.46656 > rpi33.lan.57566: Flags [P.], cksum 0x72f9 (correct), seq 3133:4177, ack 4176, win 1332, options [nop,nop,TS val 278345236 ecr 278345236], length 1044
1527816969.951397 IP (tos 0x0, ttl 64, id 10397, offset 0, flags [DF], proto TCP (6), length 52)
    rpi33.lan.57566 > rpi36.lan.46656: Flags [.], cksum 0x8484 (incorrect -> 0xd906), ack 4177, win 1323, options [nop,nop,TS val 278345236 ecr 278345236], length 0
1527816969.953320 IP (tos 0x0, ttl 64, id 50547, offset 0, flags [DF], proto TCP (6), length 1096)
    rpi38.lan.46656 > rpi33.lan.37416: Flags [P.], cksum 0x76d7 (correct), seq 3133:4177, ack 4176, win 1332, options [nop,nop,TS val 278343769 ecr 278345235], length 1044
1527816969.953385 IP (tos 0x0, ttl 64, id 59742, offset 0, flags [DF], proto TCP (6), length 52)
    rpi33.lan.37416 > rpi38.lan.46656: Flags [.], cksum 0x8486 (incorrect -> 0xd5ab), ack 4177, win 1323, options [nop,nop,TS val 278345236 ecr 278343769], length 0
1527816969.955674 IP (tos 0x0, ttl 64, id 61438, offset 0, flags [DF], proto TCP (6), length 1096)
    rpi40.lan.46656 > rpi33.lan.40078: Flags [P.], cksum 0x7c01 (correct), seq 3133:4177, ack 4176, win 1332, options [nop,nop,TS val 278343061 ecr 278345235], length 1044
1527816969.955741 IP (tos 0x0, ttl 64, id 30513, offset 0, flags [DF], proto TCP (6), length 52)
    rpi33.lan.40078 > rpi40.lan.46656: Flags [.], cksum 0x8488 (incorrect -> 0x2110), ack 4177, win 1323, options [nop,nop,TS val 278345237 ecr 278343061], length 0
1527816969.956678 IP (tos 0x0, ttl 64, id 60564, offset 0, flags [DF], proto TCP (6), length 1096)
    rpi34.lan.46656 > rpi33.lan.33422: Flags [P.], cksum 0x8aa1 (correct), seq 3133:4177, ack 4176, win 1332, options [nop,nop,TS val 278345245 ecr 278345236], length 1044
1527816969.956738 IP (tos 0x0, ttl 64, id 2069, offset 0, flags [DF], proto TCP (6), length 52)
    rpi33.lan.33422 > rpi34.lan.46656: Flags [.], cksum 0x8482 (incorrect -> 0xe46f), ack 4177, win 1323, options [nop,nop,TS val 278345237 ecr 278345245], length 0
1527816969.956883 IP (tos 0x0, ttl 64, id 32888, offset 0, flags [DF], proto TCP (6), length 1096)
    rpi42.lan.46788 > rpi33.lan.46656: Flags [P.], cksum 0xa36a (correct), seq 5220:6264, ack 5221, win 1028, options [nop,nop,TS val 278345217 ecr 278345236], length 1044
1527816969.956942 IP (tos 0x0, ttl 64, id 59269, offset 0, flags [DF], proto TCP (6), length 52)
    rpi33.lan.46656 > rpi42.lan.46788: Flags [.], cksum 0x848a (incorrect -> 0x47cb), ack 6264, win 1042, options [nop,nop,TS val 278345237 ecr 278345217], length 0
1527816969.959234 IP (tos 0x0, ttl 64, id 57021, offset 0, flags [DF], proto TCP (6), length 1096)
    rpi37.lan.46656 > rpi33.lan.37298: Flags [P.], cksum 0x756b (correct), seq 3133:4177, ack 4176, win 1332, options [nop,nop,TS val 278345221 ecr 278345236], length 1044
1527816969.959299 IP (tos 0x0, ttl 64, id 40052, offset 0, flags [DF], proto TCP (6), length 52)
    rpi33.lan.37298 > rpi37.lan.46656: Flags [.], cksum 0x8485 (incorrect -> 0xa720), ack 4177, win 1323, options [nop,nop,TS val 278345237 ecr 278345221], length 0
1527816969.963862 IP (tos 0x0, ttl 64, id 22026, offset 0, flags [DF], proto TCP (6), length 1096)
    rpi39.lan.47132 > rpi33.lan.46656: Flags [P.], cksum 0xf4d0 (correct), seq 3133:4177, ack 4176, win 1324, options [nop,nop,TS val 278345237 ecr 278345236], length 1044
1527816969.963923 IP (tos 0x0, ttl 64, id 46634, offset 0, flags [DF], proto TCP (6), length 52)
    rpi33.lan.46656 > rpi39.lan.47132: Flags [.], cksum 0x8487 (incorrect -> 0x8779), ack 4177, win 1331, options [nop,nop,TS val 278345237 ecr 278345237], length 0
1527816970.691031 IP (tos 0x0, ttl 64, id 32681, offset 0, flags [DF], proto TCP (6), length 1096)
    rpi41.lan.45408 > rpi33.lan.46656: Flags [P.], cksum 0xf7b8 (correct), seq 4176:5220, ack 4177, win 1324, options [nop,nop,TS val 1568323586 ecr 278345235], length 1044
1527816970.691118 IP (tos 0x0, ttl 64, id 42993, offset 0, flags [DF], proto TCP (6), length 52)
    rpi33.lan.46656 > rpi41.lan.45408: Flags [.], cksum 0x8489 (incorrect -> 0x83ff), ack 5220, win 1287, options [nop,nop,TS val 278345310 ecr 1568323586], length 0
1527816971.947826 IP (tos 0x0, ttl 64, id 59743, offset 0, flags [DF], proto TCP (6), length 1096)
    rpi33.lan.37416 > rpi38.lan.46656: Flags [P.], cksum 0x889a (incorrect -> 0xded5), seq 4176:5220, ack 4177, win 1324, options [nop,nop,TS val 278345436 ecr 278343769], length 1044
1527816971.948113 IP (tos 0x0, ttl 64, id 46635, offset 0, flags [DF], proto TCP (6), length 1096)
    rpi33.lan.46656 > rpi39.lan.47132: Flags [P.], cksum 0xf69c (correct), seq 4176:5220, ack 4177, win 1332, options [nop,nop,TS val 278345436 ecr 278345237], length 1044
1527816971.948540 IP (tos 0x0, ttl 64, id 2070, offset 0, flags [DF], proto TCP (6), length 1096)
    rpi33.lan.33422 > rpi34.lan.46656: Flags [P.], cksum 0x8896 (incorrect -> 0xa30e), seq 4176:5220, ack 4177, win 1324, options [nop,nop,TS val 278345436 ecr 278345245], length 1044
1527816971.948572 IP (tos 0x0, ttl 64, id 40053, offset 0, flags [DF], proto TCP (6), length 1096)
    rpi33.lan.37298 > rpi37.lan.46656: Flags [P.], cksum 0x8899 (incorrect -> 0xa011), seq 4176:5220, ack 4177, win 1324, options [nop,nop,TS val 278345436 ecr 278345221], length 1044
1527816971.948751 IP (tos 0x0, ttl 64, id 30514, offset 0, flags [DF], proto TCP (6), length 1096)
    rpi33.lan.40078 > rpi40.lan.46656: Flags [P.], cksum 0x889c (incorrect -> 0xed4b), seq 4176:5220, ack 4177, win 1324, options [nop,nop,TS val 278345436 ecr 278343061], length 1044
1527816971.948788 IP (tos 0x0, ttl 64, id 42994, offset 0, flags [DF], proto TCP (6), length 1096)
    rpi33.lan.46656 > rpi41.lan.45408: Flags [P.], cksum 0xa59d (correct), seq 4177:5221, ack 5220, win 1287, options [nop,nop,TS val 278345436 ecr 1568323586], length 1044
1527816971.948964 IP (tos 0x0, ttl 64, id 10398, offset 0, flags [DF], proto TCP (6), length 1096)
    rpi33.lan.57566 > rpi36.lan.46656: Flags [P.], cksum 0x8898 (incorrect -> 0x427e), seq 4176:5220, ack 4177, win 1324, options [nop,nop,TS val 278345436 ecr 278345236], length 1044
1527816971.948995 IP (tos 0x0, ttl 64, id 13265, offset 0, flags [DF], proto TCP (6), length 1096)
    rpi33.lan.51742 > rpi35.lan.46656: Flags [P.], cksum 0x8897 (incorrect -> 0x0969), seq 4176:5220, ack 4177, win 1324, options [nop,nop,TS val 278345436 ecr 278343758], length 1044
1527816971.949175 IP (tos 0x0, ttl 64, id 59270, offset 0, flags [DF], proto TCP (6), length 1096)
    rpi33.lan.46656 > rpi42.lan.46788: Flags [P.], cksum 0x0e54 (correct), seq 5221:6265, ack 6264, win 1042, options [nop,nop,TS val 278345436 ecr 278345217], length 1044
1527816971.949694 IP (tos 0x0, ttl 64, id 32682, offset 0, flags [DF], proto TCP (6), length 52)
    rpi41.lan.45408 > rpi33.lan.46656: Flags [.], cksum 0x7a5e (correct), ack 5221, win 1323, options [nop,nop,TS val 1568324845 ecr 278345436], length 0
1527816971.954167 IP (tos 0x0, ttl 64, id 36161, offset 0, flags [DF], proto TCP (6), length 1096)
    rpi35.lan.46656 > rpi33.lan.51742: Flags [P.], cksum 0x06a7 (correct), seq 4177:5221, ack 5220, win 1332, options [nop,nop,TS val 278343958 ecr 278345436], length 1044
1527816971.954372 IP (tos 0x0, ttl 64, id 13266, offset 0, flags [DF], proto TCP (6), length 52)
    rpi33.lan.51742 > rpi35.lan.46656: Flags [.], cksum 0x8483 (incorrect -> 0x3d4e), ack 5221, win 1323, options [nop,nop,TS val 278345436 ecr 278343958], length 0
1527816971.956437 IP (tos 0x0, ttl 64, id 7437, offset 0, flags [DF], proto TCP (6), length 1096)
    rpi36.lan.46656 > rpi33.lan.57566: Flags [P.], cksum 0x3e32 (correct), seq 4177:5221, ack 5220, win 1332, options [nop,nop,TS val 278345436 ecr 278345436], length 1044
1527816971.956638 IP (tos 0x0, ttl 64, id 10399, offset 0, flags [DF], proto TCP (6), length 52)
    rpi33.lan.57566 > rpi36.lan.46656: Flags [.], cksum 0x8484 (incorrect -> 0xcf4d), ack 5221, win 1323, options [nop,nop,TS val 278345437 ecr 278345436], length 0
1527816971.957867 IP (tos 0x0, ttl 64, id 50548, offset 0, flags [DF], proto TCP (6), length 1096)
    rpi38.lan.46656 > rpi33.lan.37416: Flags [P.], cksum 0xa2f1 (correct), seq 4177:5221, ack 5220, win 1332, options [nop,nop,TS val 278343970 ecr 278345436], length 1044
1527816971.958000 IP (tos 0x0, ttl 64, id 59744, offset 0, flags [DF], proto TCP (6), length 52)
    rpi33.lan.37416 > rpi38.lan.46656: Flags [.], cksum 0x8486 (incorrect -> 0xcbf1), ack 5221, win 1323, options [nop,nop,TS val 278345437 ecr 278343970], length 0
1527816971.959357 IP (tos 0x0, ttl 64, id 61439, offset 0, flags [DF], proto TCP (6), length 1096)
    rpi40.lan.46656 > rpi33.lan.40078: Flags [P.], cksum 0xc7e1 (correct), seq 4177:5221, ack 5220, win 1332, options [nop,nop,TS val 278343262 ecr 278345436], length 1044
1527816971.959509 IP (tos 0x0, ttl 64, id 30515, offset 0, flags [DF], proto TCP (6), length 52)
    rpi33.lan.40078 > rpi40.lan.46656: Flags [.], cksum 0x8488 (incorrect -> 0x1757), ack 5221, win 1323, options [nop,nop,TS val 278345437 ecr 278343262], length 0
1527816971.961331 IP (tos 0x0, ttl 64, id 32889, offset 0, flags [DF], proto TCP (6), length 1096)
    rpi42.lan.46788 > rpi33.lan.46656: Flags [P.], cksum 0x1951 (correct), seq 6264:7308, ack 6265, win 1044, options [nop,nop,TS val 278345417 ecr 278345436], length 1044
1527816971.961539 IP (tos 0x0, ttl 64, id 59271, offset 0, flags [DF], proto TCP (6), length 52)
    rpi33.lan.46656 > rpi42.lan.46788: Flags [.], cksum 0x848a (incorrect -> 0x3e02), ack 7308, win 1059, options [nop,nop,TS val 278345437 ecr 278345417], length 0
1527816971.962015 IP (tos 0x0, ttl 64, id 60565, offset 0, flags [DF], proto TCP (6), length 1096)
    rpi34.lan.46656 > rpi33.lan.33422: Flags [P.], cksum 0x19ad (correct), seq 4177:5221, ack 5220, win 1332, options [nop,nop,TS val 278345446 ecr 278345436], length 1044
1527816971.962125 IP (tos 0x0, ttl 64, id 2071, offset 0, flags [DF], proto TCP (6), length 52)
    rpi33.lan.33422 > rpi34.lan.46656: Flags [.], cksum 0x8482 (incorrect -> 0xdab6), ack 5221, win 1323, options [nop,nop,TS val 278345437 ecr 278345446], length 0
1527816971.963944 IP (tos 0x0, ttl 64, id 57022, offset 0, flags [DF], proto TCP (6), length 1096)
    rpi37.lan.46656 > rpi33.lan.37298: Flags [P.], cksum 0xc9d1 (correct), seq 4177:5221, ack 5220, win 1332, options [nop,nop,TS val 278345422 ecr 278345436], length 1044
1527816971.964117 IP (tos 0x0, ttl 64, id 40054, offset 0, flags [DF], proto TCP (6), length 52)
    rpi33.lan.37298 > rpi37.lan.46656: Flags [.], cksum 0x8485 (incorrect -> 0x9d67), ack 5221, win 1323, options [nop,nop,TS val 278345437 ecr 278345422], length 0
1527816971.968874 IP (tos 0x0, ttl 64, id 22027, offset 0, flags [DF], proto TCP (6), length 1096)
    rpi39.lan.47132 > rpi33.lan.46656: Flags [P.], cksum 0x5ee5 (correct), seq 4177:5221, ack 5220, win 1324, options [nop,nop,TS val 278345438 ecr 278345436], length 1044
1527816971.969085 IP (tos 0x0, ttl 64, id 46636, offset 0, flags [DF], proto TCP (6), length 52)
    rpi33.lan.46656 > rpi39.lan.47132: Flags [.], cksum 0x8487 (incorrect -> 0x7dbf), ack 5221, win 1331, options [nop,nop,TS val 278345438 ecr 278345438], length 0
1527816972.076800 IP (tos 0x0, ttl 64, id 40055, offset 0, flags [DF], proto TCP (6), length 1096)
    rpi33.lan.37298 > rpi37.lan.46656: Flags [P.], cksum 0x8899 (incorrect -> 0xdd38), seq 5220:6264, ack 5221, win 1324, options [nop,nop,TS val 278345449 ecr 278345422], length 1044
1527816972.078324 IP (tos 0x0, ttl 64, id 57023, offset 0, flags [DF], proto TCP (6), length 1096)
