1527817402.442098 IP (tos 0x0, ttl 64, id 49236, offset 0, flags [DF], proto TCP (6), length 52)
    rpi33.lan.46656 > rpi39.lan.47132: Flags [.], cksum 0x8487 (incorrect -> 0x5ecc), ack 3668919175, win 1331, options [nop,nop,TS val 278388485 ecr 278388485], length 0
1527817402.442204 IP (tos 0x0, ttl 64, id 63913, offset 0, flags [DF], proto TCP (6), length 1096)
    rpi40.lan.46656 > rpi33.lan.40078: Flags [P.], cksum 0x8033 (correct), seq 2658017574:2658018618, ack 1727552668, win 1332, options [nop,nop,TS val 278386310 ecr 278388482], length 1044
1527817402.442272 IP (tos 0x0, ttl 64, id 33142, offset 0, flags [DF], proto TCP (6), length 52)
    rpi33.lan.40078 > rpi40.lan.46656: Flags [.], cksum 0x8488 (incorrect -> 0x3c69), ack 1044, win 1323, options [nop,nop,TS val 278388485 ecr 278386310], length 0
1527817402.443876 IP (tos 0x0, ttl 64, id 59766, offset 0, flags [DF], proto TCP (6), length 1096)
    rpi37.lan.46656 > rpi33.lan.37298: Flags [P.], cksum 0xbafe (correct), seq 1233862042:1233863086, ack 209503313, win 1332, options [nop,nop,TS val 278388470 ecr 278388482], length 1044
1527817402.443975 IP (tos 0x0, ttl 64, id 42623, offset 0, flags [DF], proto TCP (6), length 52)
    rpi33.lan.37298 > rpi37.lan.46656: Flags [.], cksum 0x8485 (incorrect -> 0x6a0e), ack 1044, win 1323, options [nop,nop,TS val 278388485 ecr 278388470], length 0
1527817402.449635 IP (tos 0x0, ttl 64, id 38940, offset 0, flags [DF], proto TCP (6), length 1096)
    rpi35.lan.46656 > rpi33.lan.51742: Flags [P.], cksum 0xe241 (correct), seq 1213883578:1213884622, ack 1570216783, win 1332, options [nop,nop,TS val 278387008 ecr 278388482], length 1044
1527817402.449722 IP (tos 0x0, ttl 64, id 15804, offset 0, flags [DF], proto TCP (6), length 52)
    rpi33.lan.51742 > rpi35.lan.46656: Flags [.], cksum 0x8483 (incorrect -> 0xe950), ack 1044, win 1323, options [nop,nop,TS val 278388486 ecr 278387008], length 0
1527817402.454808 IP (tos 0x0, ttl 64, id 10206, offset 0, flags [DF], proto TCP (6), length 1096)
    rpi36.lan.46656 > rpi33.lan.57566: Flags [P.], cksum 0xdbc9 (correct), seq 238898905:238899949, ack 2003167711, win 1332, options [nop,nop,TS val 278388486 ecr 278388482], length 1044
1527817402.454871 IP (tos 0x0, ttl 64, id 12935, offset 0, flags [DF], proto TCP (6), length 52)
    rpi33.lan.57566 > rpi36.lan.46656: Flags [.], cksum 0x8484 (incorrect -> 0xb468), ack 1044, win 1323, options [nop,nop,TS val 278388487 ecr 278388486], length 0
1527817402.460321 IP (tos 0x0, ttl 64, id 35152, offset 0, flags [DF], proto TCP (6), length 1096)
    rpi41.lan.45408 > rpi33.lan.46656: Flags [P.], cksum 0x2095 (correct), seq 1834432174:1834433218, ack 3958741965, win 1324, options [nop,nop,TS val 1568755359 ecr 278388482], length 1044
1527817402.460401 IP (tos 0x0, ttl 64, id 45585, offset 0, flags [DF], proto TCP (6), length 52)
    rpi33.lan.46656 > rpi41.lan.45408: Flags [.], cksum 0x8489 (incorrect -> 0xb9e9), ack 1044, win 1331, options [nop,nop,TS val 278388487 ecr 1568755359], length 0
1527817402.490131 IP (tos 0x0, ttl 64, id 53306, offset 0, flags [DF], proto TCP (6), length 1096)
    rpi38.lan.46656 > rpi33.lan.37416: Flags [P.], cksum 0xf5a0 (correct), seq 1431526040:1431527084, ack 303594730, win 1332, options [nop,nop,TS val 278387023 ecr 278388482], length 1044
1527817402.490230 IP (tos 0x0, ttl 64, id 62301, offset 0, flags [DF], proto TCP (6), length 52)
    rpi33.lan.37416 > rpi38.lan.46656: Flags [.], cksum 0x8486 (incorrect -> 0x883e), ack 1044, win 1323, options [nop,nop,TS val 278388490 ecr 278387023], length 0
1527817404.413793 IP (tos 0x0, ttl 64, id 62302, offset 0, flags [DF], proto TCP (6), length 1096)
    rpi33.lan.37416 > rpi38.lan.46656: Flags [P.], cksum 0x889a (incorrect -> 0xbd66), seq 1:1045, ack 1044, win 1324, options [nop,nop,TS val 278388682 ecr 278387023], length 1044
1527817404.413867 IP (tos 0x0, ttl 64, id 42624, offset 0, flags [DF], proto TCP (6), length 1096)
    rpi33.lan.37298 > rpi37.lan.46656: Flags [P.], cksum 0x8899 (incorrect -> 0xe7b7), seq 1:1045, ack 1044, win 1324, options [nop,nop,TS val 278388682 ecr 278388470], length 1044
1527817404.413886 IP (tos 0x0, ttl 64, id 12936, offset 0, flags [DF], proto TCP (6), length 1096)
    rpi33.lan.57566 > rpi36.lan.46656: Flags [P.], cksum 0x8898 (incorrect -> 0x39aa), seq 1:1045, ack 1044, win 1324, options [nop,nop,TS val 278388682 ecr 278388486], length 1044
1527817404.413990 IP (tos 0x0, ttl 64, id 33143, offset 0, flags [DF], proto TCP (6), length 1096)
    rpi33.lan.40078 > rpi40.lan.46656: Flags [P.], cksum 0x889c (incorrect -> 0xeff2), seq 1:1045, ack 1044, win 1324, options [nop,nop,TS val 278388682 ecr 278386310], length 1044
1527817404.414350 IP (tos 0x0, ttl 64, id 15805, offset 0, flags [DF], proto TCP (6), length 1096)
    rpi33.lan.51742 > rpi35.lan.46656: Flags [P.], cksum 0x8897 (incorrect -> 0x904d), seq 1:1045, ack 1044, win 1324, options [nop,nop,TS val 278388682 ecr 278387008], length 1044
1527817404.414408 IP (tos 0x0, ttl 64, id 4696, offset 0, flags [DF], proto TCP (6), length 1096)
    rpi33.lan.33422 > rpi34.lan.46656: Flags [P.], cksum 0x8896 (incorrect -> 0xdbd6), seq 831432599:831433643, ack 1297997435, win 1324, options [nop,nop,TS val 278388682 ecr 278388491], length 1044
1527817404.414440 IP (tos 0x0, ttl 64, id 61882, offset 0, flags [DF], proto TCP (6), length 1096)
    rpi33.lan.46656 > rpi42.lan.46788: Flags [P.], cksum 0x691f (correct), seq 4124190133:4124191177, ack 2341081898, win 1332, options [nop,nop,TS val 278388682 ecr 278388464], length 1044
1527817404.414646 IP (tos 0x0, ttl 64, id 49237, offset 0, flags [DF], proto TCP (6), length 1096)
    rpi33.lan.46656 > rpi39.lan.47132: Flags [P.], cksum 0xdeb8 (correct), seq 0:1044, ack 1, win 1332, options [nop,nop,TS val 278388683 ecr 278388485], length 1044
1527817404.414699 IP (tos 0x0, ttl 64, id 45586, offset 0, flags [DF], proto TCP (6), length 1096)
    rpi33.lan.46656 > rpi41.lan.45408: Flags [P.], cksum 0x61a6 (correct), seq 1:1045, ack 1044, win 1332, options [nop,nop,TS val 278388683 ecr 1568755359], length 1044
1527817404.414767 IP (tos 0x0, ttl 64, id 53307, offset 0, flags [DF], proto TCP (6), length 52)
    rpi38.lan.46656 > rpi33.lan.37416: Flags [.], cksum 0x82a2 (correct), ack 1045, win 1331, options [nop,nop,TS val 278387215 ecr 278388682], length 0
1527817404.414920 IP (tos 0x0, ttl 64, id 10207, offset 0, flags [DF], proto TCP (6), length 52)
    rpi36.lan.46656 > rpi33.lan.57566: Flags [.], cksum 0xaec5 (correct), ack 1045, win 1331, options [nop,nop,TS val 278388682 ecr 278388682], length 0
1527817404.415577 IP (tos 0x0, ttl 64, id 35153, offset 0, flags [DF], proto TCP (6), length 52)
    rpi41.lan.45408 > rpi33.lan.46656: Flags [.], cksum 0xad75 (correct), ack 1045, win 1323, options [nop,nop,TS val 1568757315 ecr 278388683], length 0
1527817404.418531 IP (tos 0x0, ttl 64, id 63205, offset 0, flags [DF], proto TCP (6), length 1096)
    rpi34.lan.46656 > rpi33.lan.33422: Flags [P.], cksum 0x9bca (correct), seq 1:1045, ack 1044, win 1332, options [nop,nop,TS val 278388692 ecr 278388682], length 1044
1527817404.418602 IP (tos 0x0, ttl 64, id 4697, offset 0, flags [DF], proto TCP (6), length 52)
    rpi33.lan.33422 > rpi34.lan.46656: Flags [.], cksum 0x8482 (incorrect -> 0xc671), ack 1045, win 1323, options [nop,nop,TS val 278388683 ecr 278388692], length 0
1527817404.426125 IP (tos 0x0, ttl 64, id 35449, offset 0, flags [DF], proto TCP (6), length 1096)
    rpi42.lan.46788 > rpi33.lan.46656: Flags [P.], cksum 0xa0e4 (correct), seq 1:1045, ack 1044, win 1324, options [nop,nop,TS val 278388664 ecr 278388682], length 1044
1527817404.426194 IP (tos 0x0, ttl 64, id 61883, offset 0, flags [DF], proto TCP (6), length 52)
    rpi33.lan.46656 > rpi42.lan.46788: Flags [.], cksum 0x848a (incorrect -> 0xdd08), ack 1045, win 1331, options [nop,nop,TS val 278388684 ecr 278388664], length 0
1527817404.445195 IP (tos 0x0, ttl 64, id 63914, offset 0, flags [DF], proto TCP (6), length 1096)
    rpi40.lan.46656 > rpi33.lan.40078: Flags [P.], cksum 0x335d (correct), seq 1044:2088, ack 1045, win 1332, options [nop,nop,TS val 278386510 ecr 278388682], length 1044
1527817404.445279 IP (tos 0x0, ttl 64, id 33144, offset 0, flags [DF], proto TCP (6), length 52)
    rpi33.lan.40078 > rpi40.lan.46656: Flags [.], cksum 0x8488 (incorrect -> 0x32b0), ack 2088, win 1323, options [nop,nop,TS val 278388686 ecr 278386510], length 0
1527817404.445487 IP (tos 0x0, ttl 64, id 24706, offset 0, flags [DF], proto TCP (6), length 1096)
    rpi39.lan.47132 > rpi33.lan.46656: Flags [P.], cksum 0xfdce (correct), seq 1:1045, ack 1044, win 1324, options [nop,nop,TS val 278388686 ecr 278388683], length 1044
1527817404.445550 IP (tos 0x0, ttl 64, id 49238, offset 0, flags [DF], proto TCP (6), length 52)
    rpi33.lan.46656 > rpi39.lan.47132: Flags [.], cksum 0x8487 (incorrect -> 0x5512), ack 1045, win 1331, options [nop,nop,TS val 278388686 ecr 278388686], length 0
1527817404.447668 IP (tos 0x0, ttl 64, id 59767, offset 0, flags [DF], proto TCP (6), length 1096)
    rpi37.lan.46656 > rpi33.lan.37298: Flags [P.], cksum 0x55d9 (correct), seq 1044:2088, ack 1045, win 1332, options [nop,nop,TS val 278388670 ecr 278388682], length 1044
1527817404.447732 IP (tos 0x0, ttl 64, id 42625, offset 0, flags [DF], proto TCP (6), length 52)
    rpi33.lan.37298 > rpi37.lan.46656: Flags [.], cksum 0x8485 (incorrect -> 0x6055), ack 2088, win 1323, options [nop,nop,TS val 278388686 ecr 278388670], length 0
1527817404.453426 IP (tos 0x0, ttl 64, id 38941, offset 0, flags [DF], proto TCP (6), length 1096)
    rpi35.lan.46656 > rpi33.lan.51742: Flags [P.], cksum 0x5002 (correct), seq 1044:2088, ack 1045, win 1332, options [nop,nop,TS val 278387208 ecr 278388682], length 1044
1527817404.453489 IP (tos 0x0, ttl 64, id 15806, offset 0, flags [DF], proto TCP (6), length 52)
    rpi33.lan.51742 > rpi35.lan.46656: Flags [.], cksum 0x8483 (incorrect -> 0xdf98), ack 2088, win 1323, options [nop,nop,TS val 278388686 ecr 278387208], length 0
1527817404.458744 IP (tos 0x0, ttl 64, id 10208, offset 0, flags [DF], proto TCP (6), length 1096)
    rpi36.lan.46656 > rpi33.lan.57566: Flags [P.], cksum 0x5bd4 (correct), seq 1044:2088, ack 1045, win 1332, options [nop,nop,TS val 278388687 ecr 278388682], length 1044
1527817404.458803 IP (tos 0x0, ttl 64, id 12937, offset 0, flags [DF], proto TCP (6), length 52)
    rpi33.lan.57566 > rpi36.lan.46656: Flags [.], cksum 0x8484 (incorrect -> 0xaaaf), ack 2088, win 1323, options [nop,nop,TS val 278388687 ecr 278388687], length 0
1527817404.463556 IP (tos 0x0, ttl 64, id 35154, offset 0, flags [DF], proto TCP (6), length 1096)
    rpi41.lan.45408 > rpi33.lan.46656: Flags [P.], cksum 0x85f3 (correct), seq 1044:2088, ack 1045, win 1324, options [nop,nop,TS val 1568757363 ecr 278388683], length 1044
1527817404.463624 IP (tos 0x0, ttl 64, id 45587, offset 0, flags [DF], proto TCP (6), length 52)
    rpi33.lan.46656 > rpi41.lan.45408: Flags [.], cksum 0x8489 (incorrect -> 0xa925), ack 2088, win 1331, options [nop,nop,TS val 278388687 ecr 1568757363], length 0
1527817404.492661 IP (tos 0x0, ttl 64, id 53308, offset 0, flags [DF], proto TCP (6), length 1096)
    rpi38.lan.46656 > rpi33.lan.37416: Flags [P.], cksum 0xab75 (correct), seq 1044:2088, ack 1045, win 1332, options [nop,nop,TS val 278387223 ecr 278388682], length 1044
1527817404.492777 IP (tos 0x0, ttl 64, id 62303, offset 0, flags [DF], proto TCP (6), length 52)
    rpi33.lan.37416 > rpi38.lan.46656: Flags [.], cksum 0x8486 (incorrect -> 0x7e86), ack 2088, win 1323, options [nop,nop,TS val 278388690 ecr 278387223], length 0
1527817406.417011 IP (tos 0x0, ttl 64, id 49239, offset 0, flags [DF], proto TCP (6), length 1096)
    rpi33.lan.46656 > rpi39.lan.47132: Flags [P.], cksum 0x9837 (correct), seq 1044:2088, ack 1045, win 1332, options [nop,nop,TS val 278388883 ecr 278388686], length 1044
1527817406.417252 IP (tos 0x0, ttl 64, id 33145, offset 0, flags [DF], proto TCP (6), length 1096)
    rpi33.lan.40078 > rpi40.lan.46656: Flags [P.], cksum 0x889c (incorrect -> 0x64ea), seq 1045:2089, ack 2088, win 1324, options [nop,nop,TS val 278388883 ecr 278386510], length 1044
1527817406.417460 IP (tos 0x0, ttl 64, id 42626, offset 0, flags [DF], proto TCP (6), length 1096)
    rpi33.lan.37298 > rpi37.lan.46656: Flags [P.], cksum 0x8899 (incorrect -> 0xbe30), seq 1045:2089, ack 2088, win 1324, options [nop,nop,TS val 278388883 ecr 278388670], length 1044
1527817406.417728 IP (tos 0x0, ttl 64, id 62304, offset 0, flags [DF], proto TCP (6), length 1096)
    rpi33.lan.37416 > rpi38.lan.46656: Flags [P.], cksum 0x889a (incorrect -> 0xf072), seq 1045:2089, ack 2088, win 1324, options [nop,nop,TS val 278388883 ecr 278387223], length 1044
1527817406.417936 IP (tos 0x0, ttl 64, id 45588, offset 0, flags [DF], proto TCP (6), length 1096)
    rpi33.lan.46656 > rpi41.lan.45408: Flags [P.], cksum 0x061c (correct), seq 1045:2089, ack 2088, win 1332, options [nop,nop,TS val 278388883 ecr 1568757363], length 1044
1527817406.418398 IP (tos 0x0, ttl 64, id 4698, offset 0, flags [DF], proto TCP (6), length 1096)
    rpi33.lan.33422 > rpi34.lan.46656: Flags [P.], cksum 0x8896 (incorrect -> 0x4ff3), seq 1044:2088, ack 1045, win 1324, options [nop,nop,TS val 278388883 ecr 278388692], length 1044
1527817406.418628 IP (tos 0x0, ttl 64, id 15807, offset 0, flags [DF], proto TCP (6), length 1096)
    rpi33.lan.51742 > rpi35.lan.46656: Flags [P.], cksum 0x8897 (incorrect -> 0xb1af), seq 1045:2089, ack 2088, win 1324, options [nop,nop,TS val 278388883 ecr 278387208], length 1044
1527817406.418641 IP (tos 0x0, ttl 64, id 53309, offset 0, flags [DF], proto TCP (6), length 52)
    rpi38.lan.46656 > rpi33.lan.37416: Flags [.], cksum 0x78e8 (correct), ack 2089, win 1331, options [nop,nop,TS val 278387416 ecr 278388883], length 0
1527817406.418645 IP (tos 0x0, ttl 64, id 35155, offset 0, flags [DF], proto TCP (6), length 52)
    rpi41.lan.45408 > rpi33.lan.46656: Flags [.], cksum 0x9cb2 (correct), ack 2089, win 1323, options [nop,nop,TS val 1568759318 ecr 278388883], length 0
1527817406.418836 IP (tos 0x0, ttl 64, id 61884, offset 0, flags [DF], proto TCP (6), length 1096)
    rpi33.lan.46656 > rpi42.lan.46788: Flags [P.], cksum 0x5731 (correct), seq 1044:2088, ack 1045, win 1332, options [nop,nop,TS val 278388883 ecr 278388664], length 1044
1527817406.419038 IP (tos 0x0, ttl 64, id 12938, offset 0, flags [DF], proto TCP (6), length 1096)
    rpi33.lan.57566 > rpi36.lan.46656: Flags [P.], cksum 0x8898 (incorrect -> 0xadca), seq 1045:2089, ack 2088, win 1324, options [nop,nop,TS val 278388883 ecr 278388687], length 1044
1527817406.419928 IP (tos 0x0, ttl 64, id 10209, offset 0, flags [DF], proto TCP (6), length 52)
    rpi36.lan.46656 > rpi33.lan.57566: Flags [.], cksum 0xa50b (correct), ack 2089, win 1331, options [nop,nop,TS val 278388883 ecr 278388883], length 0
1527817406.421957 IP (tos 0x0, ttl 64, id 63206, offset 0, flags [DF], proto TCP (6), length 1096)
    rpi34.lan.46656 > rpi33.lan.33422: Flags [P.], cksum 0x5ae9 (correct), seq 1045:2089, ack 2088, win 1332, options [nop,nop,TS val 278388892 ecr 278388883], length 1044
1527817406.422027 IP (tos 0x0, ttl 64, id 4699, offset 0, flags [DF], proto TCP (6), length 52)
    rpi33.lan.33422 > rpi34.lan.46656: Flags [.], cksum 0x8482 (incorrect -> 0xbcb9), ack 2089, win 1323, options [nop,nop,TS val 278388883 ecr 278388892], length 0
1527817406.430387 IP (tos 0x0, ttl 64, id 35450, offset 0, flags [DF], proto TCP (6), length 1096)
    rpi42.lan.46788 > rpi33.lan.46656: Flags [P.], cksum 0x5914 (correct), seq 1045:2089, ack 2088, win 1324, options [nop,nop,TS val 278388864 ecr 278388883], length 1044
1527817406.430457 IP (tos 0x0, ttl 64, id 61885, offset 0, flags [DF], proto TCP (6), length 52)
    rpi33.lan.46656 > rpi42.lan.46788: Flags [.], cksum 0x848a (incorrect -> 0xd350), ack 2089, win 1331, options [nop,nop,TS val 278388884 ecr 278388864], length 0
1527817406.448049 IP (tos 0x0, ttl 64, id 24707, offset 0, flags [DF], proto TCP (6), length 1096)
    rpi39.lan.47132 > rpi33.lan.46656: Flags [P.], cksum 0xe913 (correct), seq 1045:2089, ack 2088, win 1324, options [nop,nop,TS val 278388886 ecr 278388883], length 1044
1527817406.448126 IP (tos 0x0, ttl 64, id 49240, offset 0, flags [DF], proto TCP (6), length 52)
    rpi33.lan.46656 > rpi39.lan.47132: Flags [.], cksum 0x8487 (incorrect -> 0x4b5a), ack 2089, win 1331, options [nop,nop,TS val 278388886 ecr 278388886], length 0
1527817406.449044 IP (tos 0x0, ttl 64, id 63915, offset 0, flags [DF], proto TCP (6), length 1096)
    rpi40.lan.46656 > rpi33.lan.40078: Flags [P.], cksum 0x3686 (correct), seq 2088:3132, ack 2089, win 1332, options [nop,nop,TS val 278386711 ecr 278388883], length 1044
1527817406.449119 IP (tos 0x0, ttl 64, id 33146, offset 0, flags [DF], proto TCP (6), length 52)
    rpi33.lan.40078 > rpi40.lan.46656: Flags [.], cksum 0x8488 (incorrect -> 0x28f7), ack 3132, win 1323, options [nop,nop,TS val 278388886 ecr 278386711], length 0
1527817406.451713 IP (tos 0x0, ttl 64, id 59768, offset 0, flags [DF], proto TCP (6), length 1096)
    rpi37.lan.46656 > rpi33.lan.37298: Flags [P.], cksum 0x76b3 (correct), seq 2088:3132, ack 2089, win 1332, options [nop,nop,TS val 278388871 ecr 278388883], length 1044
1527817406.451779 IP (tos 0x0, ttl 64, id 42627, offset 0, flags [DF], proto TCP (6), length 52)
    rpi33.lan.37298 > rpi37.lan.46656: Flags [.], cksum 0x8485 (incorrect -> 0x569c), ack 3132, win 1323, options [nop,nop,TS val 278388886 ecr 278388871], length 0
1527817406.456424 IP (tos 0x0, ttl 64, id 38942, offset 0, flags [DF], proto TCP (6), length 1096)
    rpi35.lan.46656 > rpi33.lan.51742: Flags [P.], cksum 0x4309 (correct), seq 2088:3132, ack 2089, win 1332, options [nop,nop,TS val 278387408 ecr 278388883], length 1044
1527817406.456485 IP (tos 0x0, ttl 64, id 15808, offset 0, flags [DF], proto TCP (6), length 52)
    rpi33.lan.51742 > rpi35.lan.46656: Flags [.], cksum 0x8483 (incorrect -> 0xd5df), ack 3132, win 1323, options [nop,nop,TS val 278388887 ecr 278387408], length 0
1527817406.461670 IP (tos 0x0, ttl 64, id 10210, offset 0, flags [DF], proto TCP (6), length 1096)
    rpi36.lan.46656 > rpi33.lan.57566: Flags [P.], cksum 0xbf7c (correct), seq 2088:3132, ack 2089, win 1332, options [nop,nop,TS val 278388887 ecr 278388883], length 1044
1527817406.461727 IP (tos 0x0, ttl 64, id 12939, offset 0, flags [DF], proto TCP (6), length 52)
    rpi33.lan.57566 > rpi36.lan.46656: Flags [.], cksum 0x8484 (incorrect -> 0xa0f7), ack 3132, win 1323, options [nop,nop,TS val 278388887 ecr 278388887], length 0
1527817406.467311 IP (tos 0x0, ttl 64, id 35156, offset 0, flags [DF], proto TCP (6), length 1096)
    rpi41.lan.45408 > rpi33.lan.46656: Flags [P.], cksum 0xa330 (correct), seq 2088:3132, ack 2089, win 1324, options [nop,nop,TS val 1568759367 ecr 278388883], length 1044
1527817406.467372 IP (tos 0x0, ttl 64, id 45589, offset 0, flags [DF], proto TCP (6), length 52)
    rpi33.lan.46656 > rpi41.lan.45408: Flags [.], cksum 0x8489 (incorrect -> 0x9860), ack 3132, win 1331, options [nop,nop,TS val 278388888 ecr 1568759367], length 0
1527817406.497091 IP (tos 0x0, ttl 64, id 53310, offset 0, flags [DF], proto TCP (6), length 1096)
    rpi38.lan.46656 > rpi33.lan.37416: Flags [P.], cksum 0x219d (correct), seq 2088:3132, ack 2089, win 1332, options [nop,nop,TS val 278387424 ecr 278388883], length 1044
1527817406.497182 IP (tos 0x0, ttl 64, id 62305, offset 0, flags [DF], proto TCP (6), length 52)
    rpi33.lan.37416 > rpi38.lan.46656: Flags [.], cksum 0x8486 (incorrect -> 0x74cc), ack 3132, win 1323, options [nop,nop,TS val 278388891 ecr 278387424], length 0
1527817408.420230 IP (tos 0x0, ttl 64, id 12940, offset 0, flags [DF], proto TCP (6), length 1096)
    rpi33.lan.57566 > rpi36.lan.46656: Flags [P.], cksum 0x8898 (incorrect -> 0xcebf), seq 2089:3133, ack 3132, win 1324, options [nop,nop,TS val 278389083 ecr 278388887], length 1044
1527817408.420298 IP (tos 0x0, ttl 64, id 49241, offset 0, flags [DF], proto TCP (6), length 1096)
    rpi33.lan.46656 > rpi39.lan.47132: Flags [P.], cksum 0x71a3 (correct), seq 2088:3132, ack 2089, win 1332, options [nop,nop,TS val 278389083 ecr 278388886], length 1044
1527817408.420679 IP (tos 0x0, ttl 64, id 42628, offset 0, flags [DF], proto TCP (6), length 1096)
    rpi33.lan.37298 > rpi37.lan.46656: Flags [P.], cksum 0x8899 (incorrect -> 0x9796), seq 2089:3133, ack 3132, win 1324, options [nop,nop,TS val 278389083 ecr 278388871], length 1044
1527817408.420710 IP (tos 0x0, ttl 64, id 15809, offset 0, flags [DF], proto TCP (6), length 1096)
    rpi33.lan.51742 > rpi35.lan.46656: Flags [P.], cksum 0x8897 (incorrect -> 0xf1ca), seq 2089:3133, ack 3132, win 1324, options [nop,nop,TS val 278389083 ecr 278387408], length 1044
1527817408.420869 IP (tos 0x0, ttl 64, id 33147, offset 0, flags [DF], proto TCP (6), length 1096)
    rpi33.lan.40078 > rpi40.lan.46656: Flags [P.], cksum 0x889c (incorrect -> 0x4494), seq 2089:3133, ack 3132, win 1324, options [nop,nop,TS val 278389083 ecr 278386711], length 1044
1527817408.420954 IP (tos 0x0, ttl 64, id 4700, offset 0, flags [DF], proto TCP (6), length 1096)
    rpi33.lan.33422 > rpi34.lan.46656: Flags [P.], cksum 0x8896 (incorrect -> 0xebec), seq 2088:3132, ack 2089, win 1324, options [nop,nop,TS val 278389083 ecr 278388892], length 1044
1527817408.421111 IP (tos 0x0, ttl 64, id 62306, offset 0, flags [DF], proto TCP (6), length 1096)
    rpi33.lan.37416 > rpi38.lan.46656: Flags [P.], cksum 0x889a (incorrect -> 0xd919), seq 2089:3133, ack 3132, win 1324, options [nop,nop,TS val 278389083 ecr 278387424], length 1044
1527817408.421196 IP (tos 0x0, ttl 64, id 10211, offset 0, flags [DF], proto TCP (6), length 52)
    rpi36.lan.46656 > rpi33.lan.57566: Flags [.], cksum 0x9b53 (correct), ack 3133, win 1331, options [nop,nop,TS val 278389083 ecr 278389083], length 0
1527817408.421416 IP (tos 0x0, ttl 64, id 61886, offset 0, flags [DF], proto TCP (6), length 1096)
    rpi33.lan.46656 > rpi42.lan.46788: Flags [P.], cksum 0x61c8 (correct), seq 2088:3132, ack 2089, win 1332, options [nop,nop,TS val 278389083 ecr 278388864], length 1044
1527817408.421552 IP (tos 0x0, ttl 64, id 45590, offset 0, flags [DF], proto TCP (6), length 1096)
    rpi33.lan.46656 > rpi41.lan.45408: Flags [P.], cksum 0x86b7 (correct), seq 2089:3133, ack 3132, win 1332, options [nop,nop,TS val 278389083 ecr 1568759367], length 1044
1527817408.421994 IP (tos 0x0, ttl 64, id 53311, offset 0, flags [DF], proto TCP (6), length 52)
    rpi38.lan.46656 > rpi33.lan.37416: Flags [.], cksum 0x6f30 (correct), ack 3133, win 1331, options [nop,nop,TS val 278387616 ecr 278389083], length 0
1527817408.422382 IP (tos 0x0, ttl 64, id 35157, offset 0, flags [DF], proto TCP (6), length 52)
    rpi41.lan.45408 > rpi33.lan.46656: Flags [.], cksum 0x8bee (correct), ack 3133, win 1323, options [nop,nop,TS val 1568761322 ecr 278389083], length 0
1527817408.425479 IP (tos 0x0, ttl 64, id 63207, offset 0, flags [DF], proto TCP (6), length 1096)
    rpi34.lan.46656 > rpi33.lan.33422: Flags [P.], cksum 0xa86c (correct), seq 2089:3133, ack 3132, win 1332, options [nop,nop,TS val 278389092 ecr 278389083], length 1044
1527817408.425553 IP (tos 0x0, ttl 64, id 4701, offset 0, flags [DF], proto TCP (6), length 52)
    rpi33.lan.33422 > rpi34.lan.46656: Flags [.], cksum 0x8482 (incorrect -> 0xb300), ack 3133, win 1323, options [nop,nop,TS val 278389084 ecr 278389092], length 0
1527817408.432820 IP (tos 0x0, ttl 64, id 35451, offset 0, flags [DF], proto TCP (6), length 1096)
    rpi42.lan.46788 > rpi33.lan.46656: Flags [P.], cksum 0x4ffb (correct), seq 2089:3133, ack 3132, win 1324, options [nop,nop,TS val 278389065 ecr 278389083], length 1044
1527817408.432895 IP (tos 0x0, ttl 64, id 61887, offset 0, flags [DF], proto TCP (6), length 52)
    rpi33.lan.46656 > rpi42.lan.46788: Flags [.], cksum 0x848a (incorrect -> 0xc997), ack 3133, win 1331, options [nop,nop,TS val 278389084 ecr 278389065], length 0
1527817408.452305 IP (tos 0x0, ttl 64, id 63916, offset 0, flags [DF], proto TCP (6), length 1096)
    rpi40.lan.46656 > rpi33.lan.40078: Flags [P.], cksum 0x35cf (correct), seq 3132:4176, ack 3133, win 1332, options [nop,nop,TS val 278386911 ecr 278389083], length 1044
1527817408.452397 IP (tos 0x0, ttl 64, id 33148, offset 0, flags [DF], proto TCP (6), length 52)
    rpi33.lan.40078 > rpi40.lan.46656: Flags [.], cksum 0x8488 (incorrect -> 0x1f3f), ack 4176, win 1323, options [nop,nop,TS val 278389086 ecr 278386911], length 0
1527817408.454194 IP (tos 0x0, ttl 64, id 59769, offset 0, flags [DF], proto TCP (6), length 1096)
    rpi37.lan.46656 > rpi33.lan.37298: Flags [P.], cksum 0x08c4 (correct), seq 3132:4176, ack 3133, win 1332, options [nop,nop,TS val 278389071 ecr 278389083], length 1044
1527817408.454275 IP (tos 0x0, ttl 64, id 42629, offset 0, flags [DF], proto TCP (6), length 52)
    rpi33.lan.37298 > rpi37.lan.46656: Flags [.], cksum 0x8485 (incorrect -> 0x4ce4), ack 4176, win 1323, options [nop,nop,TS val 278389086 ecr 278389071], length 0
1527817408.456135 IP (tos 0x0, ttl 64, id 24708, offset 0, flags [DF], proto TCP (6), length 1096)
    rpi39.lan.47132 > rpi33.lan.46656: Flags [P.], cksum 0x933c (correct), seq 2089:3133, ack 3132, win 1324, options [nop,nop,TS val 278389087 ecr 278389083], length 1044
1527817408.456211 IP (tos 0x0, ttl 64, id 49242, offset 0, flags [DF], proto TCP (6), length 52)
    rpi33.lan.46656 > rpi39.lan.47132: Flags [.], cksum 0x8487 (incorrect -> 0x41a0), ack 3133, win 1331, options [nop,nop,TS val 278389087 ecr 278389087], length 0
1527817408.459502 IP (tos 0x0, ttl 64, id 38943, offset 0, flags [DF], proto TCP (6), length 1096)
    rpi35.lan.46656 > rpi33.lan.51742: Flags [P.], cksum 0x9042 (correct), seq 3132:4176, ack 3133, win 1332, options [nop,nop,TS val 278387609 ecr 278389083], length 1044
1527817408.459569 IP (tos 0x0, ttl 64, id 15810, offset 0, flags [DF], proto TCP (6), length 52)
    rpi33.lan.51742 > rpi35.lan.46656: Flags [.], cksum 0x8483 (incorrect -> 0xcc26), ack 4176, win 1323, options [nop,nop,TS val 278389087 ecr 278387609], length 0
1527817408.465098 IP (tos 0x0, ttl 64, id 10212, offset 0, flags [DF], proto TCP (6), length 1096)
    rpi36.lan.46656 > rpi33.lan.57566: Flags [P.], cksum 0xaf14 (correct), seq 3132:4176, ack 3133, win 1332, options [nop,nop,TS val 278389087 ecr 278389083], length 1044
1527817408.465167 IP (tos 0x0, ttl 64, id 12941, offset 0, flags [DF], proto TCP (6), length 52)
    rpi33.lan.57566 > rpi36.lan.46656: Flags [.], cksum 0x8484 (incorrect -> 0x973e), ack 4176, win 1323, options [nop,nop,TS val 278389088 ecr 278389087], length 0
1527817408.470702 IP (tos 0x0, ttl 64, id 35158, offset 0, flags [DF], proto TCP (6), length 1096)
    rpi41.lan.45408 > rpi33.lan.46656: Flags [P.], cksum 0x9918 (correct), seq 3132:4176, ack 3133, win 1324, options [nop,nop,TS val 1568761370 ecr 278389083], length 1044
1527817408.470764 IP (tos 0x0, ttl 64, id 45591, offset 0, flags [DF], proto TCP (6), length 52)
    rpi33.lan.46656 > rpi41.lan.45408: Flags [.], cksum 0x8489 (incorrect -> 0x879d), ack 4176, win 1331, options [nop,nop,TS val 278389088 ecr 1568761370], length 0
1527817408.498829 IP (tos 0x0, ttl 64, id 53312, offset 0, flags [DF], proto TCP (6), length 1096)
    rpi38.lan.46656 > rpi33.lan.37416: Flags [P.], cksum 0xda5b (correct), seq 3132:4176, ack 3133, win 1332, options [nop,nop,TS val 278387624 ecr 278389083], length 1044
1527817408.498923 IP (tos 0x0, ttl 64, id 62307, offset 0, flags [DF], proto TCP (6), length 52)
    rpi33.lan.37416 > rpi38.lan.46656: Flags [.], cksum 0x8486 (incorrect -> 0x6b14), ack 4176, win 1323, options [nop,nop,TS val 278389091 ecr 278387624], length 0
1527817409.839705 IP (tos 0x0, ttl 64, id 15811, offset 0, flags [DF], proto TCP (6), length 1096)
    rpi33.lan.51742 > rpi35.lan.46656: Flags [P.], cksum 0x8897 (incorrect -> 0x67a7), seq 3133:4177, ack 4176, win 1324, options [nop,nop,TS val 278389225 ecr 278387609], length 1044
1527817409.839854 IP (tos 0x0, ttl 64, id 4702, offset 0, flags [DF], proto TCP (6), length 1096)
    rpi33.lan.33422 > rpi34.lan.46656: Flags [P.], cksum 0x8896 (incorrect -> 0x9473), seq 3132:4176, ack 3133, win 1324, options [nop,nop,TS val 278389225 ecr 278389092], length 1044
1527817409.839928 IP (tos 0x0, ttl 64, id 42630, offset 0, flags [DF], proto TCP (6), length 1096)
    rpi33.lan.37298 > rpi37.lan.46656: Flags [P.], cksum 0x8899 (incorrect -> 0x2232), seq 3133:4177, ack 4176, win 1324, options [nop,nop,TS val 278389225 ecr 278389071], length 1044
1527817409.840119 IP (tos 0x0, ttl 64, id 12942, offset 0, flags [DF], proto TCP (6), length 1096)
    rpi33.lan.57566 > rpi36.lan.46656: Flags [P.], cksum 0x8898 (incorrect -> 0x3697), seq 3133:4177, ack 4176, win 1324, options [nop,nop,TS val 278389225 ecr 278389087], length 1044
1527817409.840857 IP (tos 0x0, ttl 64, id 61888, offset 0, flags [DF], proto TCP (6), length 1096)
    rpi33.lan.46656 > rpi42.lan.46788: Flags [P.], cksum 0x7764 (correct), seq 3132:4176, ack 3133, win 1332, options [nop,nop,TS val 278389225 ecr 278389065], length 1044
1527817409.840992 IP (tos 0x0, ttl 64, id 10213, offset 0, flags [DF], proto TCP (6), length 52)
    rpi36.lan.46656 > rpi33.lan.57566: Flags [.], cksum 0x920f (correct), ack 4177, win 1331, options [nop,nop,TS val 278389225 ecr 278389225], length 0
1527817409.841080 IP (tos 0x0, ttl 64, id 62308, offset 0, flags [DF], proto TCP (6), length 1096)
    rpi33.lan.37416 > rpi38.lan.46656: Flags [P.], cksum 0x889a (incorrect -> 0xdd67), seq 3133:4177, ack 4176, win 1324, options [nop,nop,TS val 278389225 ecr 278387624], length 1044
1527817409.841291 IP (tos 0x0, ttl 64, id 49243, offset 0, flags [DF], proto TCP (6), length 1096)
    rpi33.lan.46656 > rpi39.lan.47132: Flags [P.], cksum 0xc77c (correct), seq 3132:4176, ack 3133, win 1332, options [nop,nop,TS val 278389225 ecr 278389087], length 1044
1527817409.841499 IP (tos 0x0, ttl 64, id 33149, offset 0, flags [DF], proto TCP (6), length 1096)
    rpi33.lan.40078 > rpi40.lan.46656: Flags [P.], cksum 0x889c (incorrect -> 0x3492), seq 3133:4177, ack 4176, win 1324, options [nop,nop,TS val 278389225 ecr 278386911], length 1044
1527817409.841706 IP (tos 0x0, ttl 64, id 45592, offset 0, flags [DF], proto TCP (6), length 1096)
    rpi33.lan.46656 > rpi41.lan.45408: Flags [P.], cksum 0x49ac (correct), seq 3133:4177, ack 4176, win 1332, options [nop,nop,TS val 278389225 ecr 1568761370], length 1044
1527817409.841914 IP (tos 0x0, ttl 64, id 53313, offset 0, flags [DF], proto TCP (6), length 52)
    rpi38.lan.46656 > rpi33.lan.37416: Flags [.], cksum 0x65ec (correct), ack 4177, win 1331, options [nop,nop,TS val 278387758 ecr 278389225], length 0
1527817409.842529 IP (tos 0x0, ttl 64, id 35159, offset 0, flags [DF], proto TCP (6), length 52)
    rpi41.lan.45408 > rpi33.lan.46656: Flags [.], cksum 0x7dac (correct), ack 4177, win 1323, options [nop,nop,TS val 1568762742 ecr 278389225], length 0
1527817409.881085 IP (tos 0x0, ttl 64, id 59770, offset 0, flags [DF], proto TCP (6), length 52)
    rpi37.lan.46656 > rpi33.lan.37298: Flags [.], cksum 0x47ad (correct), ack 4177, win 1332, options [nop,nop,TS val 278389214 ecr 278389225], length 0
1527817409.882047 IP (tos 0x0, ttl 64, id 35452, offset 0, flags [DF], proto TCP (6), length 52)
    rpi42.lan.46788 > rpi33.lan.46656: Flags [.], cksum 0xc46c (correct), ack 4176, win 1324, options [nop,nop,TS val 278389210 ecr 278389225], length 0
1527817409.884291 IP (tos 0x0, ttl 64, id 24709, offset 0, flags [DF], proto TCP (6), length 52)
    rpi39.lan.47132 > rpi33.lan.46656: Flags [.], cksum 0x3c7a (correct), ack 4176, win 1324, options [nop,nop,TS val 278389230 ecr 278389225], length 0
1527817409.886240 IP (tos 0x0, ttl 64, id 38944, offset 0, flags [DF], proto TCP (6), length 52)
    rpi35.lan.46656 > rpi33.lan.51742: Flags [.], cksum 0xc6f0 (correct), ack 4177, win 1332, options [nop,nop,TS val 278387752 ecr 278389225], length 0
1527817409.887359 IP (tos 0x0, ttl 64, id 63208, offset 0, flags [DF], proto TCP (6), length 52)
    rpi34.lan.46656 > rpi33.lan.33422: Flags [.], cksum 0xadc3 (correct), ack 4176, win 1332, options [nop,nop,TS val 278389239 ecr 278389225], length 0
1527817409.888423 IP (tos 0x0, ttl 64, id 63917, offset 0, flags [DF], proto TCP (6), length 52)
    rpi40.lan.46656 > rpi33.lan.40078: Flags [.], cksum 0x1a07 (correct), ack 4177, win 1332, options [nop,nop,TS val 278387055 ecr 278389225], length 0
1527817410.425583 IP (tos 0x0, ttl 64, id 42631, offset 0, flags [DF], proto TCP (6), length 1096)
    rpi33.lan.37298 > rpi37.lan.46656: Flags [P.], cksum 0x8899 (incorrect -> 0xcf80), seq 4177:5221, ack 4176, win 1324, options [nop,nop,TS val 278389284 ecr 278389214], length 1044
1527817410.425626 IP (tos 0x0, ttl 64, id 12943, offset 0, flags [DF], proto TCP (6), length 1096)
    rpi33.lan.57566 > rpi36.lan.46656: Flags [P.], cksum 0x8898 (incorrect -> 0x5d73), seq 4177:5221, ack 4176, win 1324, options [nop,nop,TS val 278389284 ecr 278389225], length 1044
1527817410.425871 IP (tos 0x0, ttl 64, id 4703, offset 0, flags [DF], proto TCP (6), length 1096)
    rpi33.lan.33422 > rpi34.lan.46656: Flags [P.], cksum 0x8896 (incorrect -> 0x59f9), seq 4176:5220, ack 3133, win 1324, options [nop,nop,TS val 278389284 ecr 278389239], length 1044
1527817410.425963 IP (tos 0x0, ttl 64, id 61889, offset 0, flags [DF], proto TCP (6), length 1096)
    rpi33.lan.46656 > rpi42.lan.46788: Flags [P.], cksum 0xdff5 (correct), seq 4176:5220, ack 3133, win 1332, options [nop,nop,TS val 278389284 ecr 278389210], length 1044
1527817410.426087 IP (tos 0x0, ttl 64, id 49244, offset 0, flags [DF], proto TCP (6), length 1096)
    rpi33.lan.46656 > rpi39.lan.47132: Flags [P.], cksum 0xaa4e (correct), seq 4176:5220, ack 3133, win 1332, options [nop,nop,TS val 278389284 ecr 278389230], length 1044
1527817410.426181 IP (tos 0x0, ttl 64, id 45593, offset 0, flags [DF], proto TCP (6), length 1096)
    rpi33.lan.46656 > rpi41.lan.45408: Flags [P.], cksum 0xf0d4 (correct), seq 4177:5221, ack 4176, win 1332, options [nop,nop,TS val 278389284 ecr 1568762742], length 1044
1527817410.426292 IP (tos 0x0, ttl 64, id 33150, offset 0, flags [DF], proto TCP (6), length 1096)
    rpi33.lan.40078 > rpi40.lan.46656: Flags [P.], cksum 0x889c (incorrect -> 0xd723), seq 4177:5221, ack 4176, win 1324, options [nop,nop,TS val 278389284 ecr 278387055], length 1044
1527817410.426396 IP (tos 0x0, ttl 64, id 15812, offset 0, flags [DF], proto TCP (6), length 1096)
    rpi33.lan.51742 > rpi35.lan.46656: Flags [P.], cksum 0x8897 (incorrect -> 0xcd9f), seq 4177:5221, ack 4176, win 1324, options [nop,nop,TS val 278389284 ecr 278387752], length 1044
1527817410.426463 IP (tos 0x0, ttl 64, id 62309, offset 0, flags [DF], proto TCP (6), length 1096)
    rpi33.lan.37416 > rpi38.lan.46656: Flags [P.], cksum 0x889a (incorrect -> 0x84aa), seq 4177:5221, ack 4176, win 1324, options [nop,nop,TS val 278389284 ecr 278387758], length 1044
1527817410.426493 IP (tos 0x0, ttl 64, id 59771, offset 0, flags [DF], proto TCP (6), length 52)
    rpi37.lan.46656 > rpi33.lan.37298: Flags [.], cksum 0x4329 (correct), ack 5221, win 1331, options [nop,nop,TS val 278389268 ecr 278389284], length 0
1527817410.426650 IP (tos 0x0, ttl 64, id 10214, offset 0, flags [DF], proto TCP (6), length 52)
    rpi36.lan.46656 > rpi33.lan.57566: Flags [.], cksum 0x8d86 (correct), ack 5221, win 1331, options [nop,nop,TS val 278389283 ecr 278389284], length 0
1527817410.426761 IP (tos 0x0, ttl 64, id 63209, offset 0, flags [DF], proto TCP (6), length 52)
    rpi34.lan.46656 > rpi33.lan.33422: Flags [.], cksum 0xa940 (correct), ack 5220, win 1331, options [nop,nop,TS val 278389292 ecr 278389284], length 0
1527817410.426763 IP (tos 0x0, ttl 64, id 35453, offset 0, flags [DF], proto TCP (6), length 52)
    rpi42.lan.46788 > rpi33.lan.46656: Flags [.], cksum 0xbfe8 (correct), ack 5220, win 1323, options [nop,nop,TS val 278389264 ecr 278389284], length 0
1527817410.426951 IP (tos 0x0, ttl 64, id 24710, offset 0, flags [DF], proto TCP (6), length 52)
    rpi39.lan.47132 > rpi33.lan.46656: Flags [.], cksum 0x37f6 (correct), ack 5220, win 1323, options [nop,nop,TS val 278389284 ecr 278389284], length 0
1527817410.426953 IP (tos 0x0, ttl 64, id 35160, offset 0, flags [DF], proto TCP (6), length 52)
    rpi41.lan.45408 > rpi33.lan.46656: Flags [.], cksum 0x7715 (correct), ack 5221, win 1323, options [nop,nop,TS val 1568763326 ecr 278389284], length 0
1527817410.427135 IP (tos 0x0, ttl 64, id 63918, offset 0, flags [DF], proto TCP (6), length 52)
    rpi40.lan.46656 > rpi33.lan.40078: Flags [.], cksum 0x1584 (correct), ack 5221, win 1331, options [nop,nop,TS val 278387108 ecr 278389284], length 0
1527817410.427137 IP (tos 0x0, ttl 64, id 38945, offset 0, flags [DF], proto TCP (6), length 52)
    rpi35.lan.46656 > rpi33.lan.51742: Flags [.], cksum 0xc26c (correct), ack 5221, win 1331, options [nop,nop,TS val 278387806 ecr 278389284], length 0
1527817410.427353 IP (tos 0x0, ttl 64, id 53314, offset 0, flags [DF], proto TCP (6), length 52)
    rpi38.lan.46656 > rpi33.lan.37416: Flags [.], cksum 0x6162 (correct), ack 5221, win 1331, options [nop,nop,TS val 278387817 ecr 278389284], length 0
1527817410.429245 IP (tos 0x0, ttl 64, id 63210, offset 0, flags [DF], proto TCP (6), length 1096)
    rpi34.lan.46656 > rpi33.lan.33422: Flags [P.], cksum 0x2574 (correct), seq 3133:4177, ack 5220, win 1332, options [nop,nop,TS val 278389293 ecr 278389284], length 1044
1527817410.429308 IP (tos 0x0, ttl 64, id 4704, offset 0, flags [DF], proto TCP (6), length 52)
    rpi33.lan.33422 > rpi34.lan.46656: Flags [.], cksum 0x8482 (incorrect -> 0xa533), ack 4177, win 1323, options [nop,nop,TS val 278389284 ecr 278389293], length 0
1527817410.436640 IP (tos 0x0, ttl 64, id 35454, offset 0, flags [DF], proto TCP (6), length 1096)
    rpi42.lan.46788 > rpi33.lan.46656: Flags [P.], cksum 0xa0ce (correct), seq 3133:4177, ack 5220, win 1324, options [nop,nop,TS val 278389265 ecr 278389284], length 1044
1527817410.436699 IP (tos 0x0, ttl 64, id 61890, offset 0, flags [DF], proto TCP (6), length 52)
    rpi33.lan.46656 > rpi42.lan.46788: Flags [.], cksum 0x848a (incorrect -> 0xbbca), ack 4177, win 1331, options [nop,nop,TS val 278389285 ecr 278389265], length 0
1527817410.455180 IP (tos 0x0, ttl 64, id 24711, offset 0, flags [DF], proto TCP (6), length 1096)
    rpi39.lan.47132 > rpi33.lan.46656: Flags [P.], cksum 0xeb0e (correct), seq 3133:4177, ack 5220, win 1324, options [nop,nop,TS val 278389287 ecr 278389284], length 1044
1527817410.455270 IP (tos 0x0, ttl 64, id 49245, offset 0, flags [DF], proto TCP (6), length 52)
    rpi33.lan.46656 > rpi39.lan.47132: Flags [.], cksum 0x8487 (incorrect -> 0x33d4), ack 4177, win 1331, options [nop,nop,TS val 278389287 ecr 278389287], length 0
1527817410.455393 IP (tos 0x0, ttl 64, id 63919, offset 0, flags [DF], proto TCP (6), length 1096)
    rpi40.lan.46656 > rpi33.lan.40078: Flags [P.], cksum 0x7745 (correct), seq 4176:5220, ack 5221, win 1332, options [nop,nop,TS val 278387111 ecr 278389284], length 1044
1527817410.455452 IP (tos 0x0, ttl 64, id 33151, offset 0, flags [DF], proto TCP (6), length 52)
    rpi33.lan.40078 > rpi40.lan.46656: Flags [.], cksum 0x8488 (incorrect -> 0x1172), ack 5220, win 1323, options [nop,nop,TS val 278389287 ecr 278387111], length 0
1527817410.457516 IP (tos 0x0, ttl 64, id 59772, offset 0, flags [DF], proto TCP (6), length 1096)
    rpi37.lan.46656 > rpi33.lan.37298: Flags [P.], cksum 0xd9b9 (correct), seq 4176:5220, ack 5221, win 1332, options [nop,nop,TS val 278389271 ecr 278389284], length 1044
1527817410.457578 IP (tos 0x0, ttl 64, id 42632, offset 0, flags [DF], proto TCP (6), length 52)
    rpi33.lan.37298 > rpi37.lan.46656: Flags [.], cksum 0x8485 (incorrect -> 0x3f17), ack 5220, win 1323, options [nop,nop,TS val 278389287 ecr 278389271], length 0
