1527817624.265548 IP (tos 0x0, ttl 64, id 12484, offset 0, flags [DF], proto TCP (6), length 52)
    rpi41.lan.45768 > rpi33.lan.46656: Flags [F.], cksum 0x1be2 (correct), seq 3973324075, ack 855564929, win 229, options [nop,nop,TS val 1568977167 ecr 278408669], length 0
1527817624.314517 IP (tos 0x0, ttl 64, id 53086, offset 0, flags [DF], proto TCP (6), length 52)
    rpi33.lan.46656 > rpi41.lan.45768: Flags [.], cksum 0x8489 (incorrect -> 0x1410), ack 1, win 227, options [nop,nop,TS val 278410673 ecr 1568977167], length 0
1527817626.797110 IP (tos 0x0, ttl 64, id 43862, offset 0, flags [DF], proto TCP (6), length 60)
    rpi33.lan.39774 > rpi37.lan.46656: Flags [S], cksum 0x848d (incorrect -> 0x357d), seq 3845365247, win 29200, options [mss 1460,sackOK,TS val 278410921 ecr 0,nop,wscale 7], length 0
1527817626.797800 IP (tos 0x0, ttl 64, id 0, offset 0, flags [DF], proto TCP (6), length 60)
    rpi37.lan.46656 > rpi33.lan.39774: Flags [S.], cksum 0x4234 (correct), seq 1872772438, ack 3845365248, win 28960, options [mss 1460,sackOK,TS val 278410905 ecr 278410921,nop,wscale 7], length 0
1527817626.797926 IP (tos 0x0, ttl 64, id 43863, offset 0, flags [DF], proto TCP (6), length 52)
    rpi33.lan.39774 > rpi37.lan.46656: Flags [.], cksum 0x8485 (incorrect -> 0xe13b), ack 1, win 229, options [nop,nop,TS val 278410921 ecr 278410905], length 0
1527817626.811679 IP (tos 0x0, ttl 64, id 43864, offset 0, flags [DF], proto TCP (6), length 86)
    rpi33.lan.39774 > rpi37.lan.46656: Flags [P.], cksum 0x84a7 (incorrect -> 0x1167), seq 1:35, ack 1, win 229, options [nop,nop,TS val 278410922 ecr 278410905], length 34
1527817626.812260 IP (tos 0x0, ttl 64, id 3022, offset 0, flags [DF], proto TCP (6), length 52)
    rpi37.lan.46656 > rpi33.lan.39774: Flags [.], cksum 0xe118 (correct), ack 35, win 227, options [nop,nop,TS val 278410907 ecr 278410922], length 0
1527817628.048711 IP (tos 0x0, ttl 64, id 54257, offset 0, flags [DF], proto TCP (6), length 60)
    rpi42.lan.47062 > rpi33.lan.46656: Flags [S], cksum 0xadb7 (correct), seq 154133731, win 29200, options [mss 1460,sackOK,TS val 278411026 ecr 0,nop,wscale 7], length 0
1527817628.048934 IP (tos 0x0, ttl 64, id 0, offset 0, flags [DF], proto TCP (6), length 60)
    rpi33.lan.46656 > rpi42.lan.47062: Flags [S.], cksum 0x8492 (incorrect -> 0xc32b), seq 2513571290, ack 154133732, win 28960, options [mss 1460,sackOK,TS val 278411046 ecr 278411026,nop,wscale 7], length 0
1527817628.049529 IP (tos 0x0, ttl 64, id 54258, offset 0, flags [DF], proto TCP (6), length 52)
    rpi42.lan.47062 > rpi33.lan.46656: Flags [.], cksum 0x6233 (correct), ack 1, win 229, options [nop,nop,TS val 278411026 ecr 278411046], length 0
1527817628.062268 IP (tos 0x0, ttl 64, id 54259, offset 0, flags [DF], proto TCP (6), length 86)
    rpi42.lan.47062 > rpi33.lan.46656: Flags [P.], cksum 0x5f70 (correct), seq 1:35, ack 1, win 229, options [nop,nop,TS val 278411028 ecr 278411046], length 34
1527817628.062341 IP (tos 0x0, ttl 64, id 15101, offset 0, flags [DF], proto TCP (6), length 52)
    rpi33.lan.46656 > rpi42.lan.47062: Flags [.], cksum 0x848a (incorrect -> 0x6210), ack 35, win 227, options [nop,nop,TS val 278411047 ecr 278411028], length 0
1527817628.515747 IP (tos 0x0, ttl 64, id 63774, offset 0, flags [DF], proto TCP (6), length 60)
    rpi33.lan.60170 > rpi36.lan.46656: Flags [S], cksum 0x848c (incorrect -> 0xd8ad), seq 3244281419, win 29200, options [mss 1460,sackOK,TS val 278411093 ecr 0,nop,wscale 7], length 0
1527817628.516457 IP (tos 0x0, ttl 64, id 0, offset 0, flags [DF], proto TCP (6), length 60)
    rpi36.lan.46656 > rpi33.lan.60170: Flags [S.], cksum 0x9628 (correct), seq 2039120365, ack 3244281420, win 28960, options [mss 1460,sackOK,TS val 278411092 ecr 278411093,nop,wscale 7], length 0
1527817628.516583 IP (tos 0x0, ttl 64, id 63775, offset 0, flags [DF], proto TCP (6), length 52)
    rpi33.lan.60170 > rpi36.lan.46656: Flags [.], cksum 0x8484 (incorrect -> 0x3530), ack 1, win 229, options [nop,nop,TS val 278411093 ecr 278411092], length 0
1527817628.529132 IP (tos 0x0, ttl 64, id 63776, offset 0, flags [DF], proto TCP (6), length 86)
    rpi33.lan.60170 > rpi36.lan.46656: Flags [P.], cksum 0x84a6 (incorrect -> 0xdd87), seq 1:35, ack 1, win 229, options [nop,nop,TS val 278411094 ecr 278411092], length 34
1527817628.529668 IP (tos 0x0, ttl 64, id 46779, offset 0, flags [DF], proto TCP (6), length 52)
    rpi36.lan.46656 > rpi33.lan.60170: Flags [.], cksum 0x350d (correct), ack 35, win 227, options [nop,nop,TS val 278411094 ecr 278411094], length 0
1527817629.178283 IP (tos 0x0, ttl 64, id 54260, offset 0, flags [DF], proto TCP (6), length 52)
    rpi33.lan.54412 > rpi35.lan.46656: Flags [F.], cksum 0x8483 (incorrect -> 0xd4aa), seq 3573152857, ack 980681585, win 229, options [nop,nop,TS val 278411159 ecr 278407682], length 0
1527817629.226218 IP (tos 0x0, ttl 64, id 10609, offset 0, flags [DF], proto TCP (6), length 52)
    rpi35.lan.46656 > rpi33.lan.54412: Flags [.], cksum 0xccd8 (correct), ack 1, win 227, options [nop,nop,TS val 278409686 ecr 278411159], length 0
1527817631.135434 IP (tos 0x0, ttl 64, id 12063, offset 0, flags [DF], proto TCP (6), length 52)
    rpi33.lan.42408 > rpi40.lan.46656: Flags [F.], cksum 0x8488 (incorrect -> 0x714e), seq 3174244281, ack 3736332037, win 229, options [nop,nop,TS val 278411355 ecr 278407180], length 0
1527817631.178237 IP (tos 0x0, ttl 64, id 53007, offset 0, flags [DF], proto TCP (6), length 52)
    rpi40.lan.46656 > rpi33.lan.42408: Flags [.], cksum 0x697c (correct), ack 1, win 227, options [nop,nop,TS val 278409184 ecr 278411355], length 0
1527817631.851146 IP (tos 0x0, ttl 64, id 29372, offset 0, flags [DF], proto TCP (6), length 60)
    rpi41.lan.45778 > rpi33.lan.46656: Flags [S], cksum 0x8a3b (correct), seq 3889973804, win 29200, options [mss 1460,sackOK,TS val 1568984752 ecr 0,nop,wscale 7], length 0
1527817631.851361 IP (tos 0x0, ttl 64, id 0, offset 0, flags [DF], proto TCP (6), length 60)
    rpi33.lan.46656 > rpi41.lan.45778: Flags [S.], cksum 0x8491 (incorrect -> 0xc176), seq 2363487113, ack 3889973805, win 28960, options [mss 1460,sackOK,TS val 278411426 ecr 1568984752,nop,wscale 7], length 0
1527817631.851923 IP (tos 0x0, ttl 64, id 29373, offset 0, flags [DF], proto TCP (6), length 52)
    rpi41.lan.45778 > rpi33.lan.46656: Flags [.], cksum 0x607d (correct), ack 1, win 229, options [nop,nop,TS val 1568984753 ecr 278411426], length 0
1527817631.864438 IP (tos 0x0, ttl 64, id 29374, offset 0, flags [DF], proto TCP (6), length 86)
    rpi41.lan.45778 > rpi33.lan.46656: Flags [P.], cksum 0x136f (correct), seq 1:35, ack 1, win 229, options [nop,nop,TS val 1568984766 ecr 278411426], length 34
1527817631.864528 IP (tos 0x0, ttl 64, id 52008, offset 0, flags [DF], proto TCP (6), length 52)
    rpi33.lan.46656 > rpi41.lan.45778: Flags [.], cksum 0x8489 (incorrect -> 0x604e), ack 35, win 227, options [nop,nop,TS val 278411428 ecr 1568984766], length 0
1527817634.885874 IP (tos 0x0, ttl 64, id 837, offset 0, flags [DF], proto TCP (6), length 60)
    rpi33.lan.54422 > rpi35.lan.46656: Flags [S], cksum 0x848b (incorrect -> 0x8cb7), seq 3036822167, win 29200, options [mss 1460,sackOK,TS val 278411730 ecr 0,nop,wscale 7], length 0
1527817634.886642 IP (tos 0x0, ttl 64, id 0, offset 0, flags [DF], proto TCP (6), length 60)
    rpi35.lan.46656 > rpi33.lan.54422: Flags [S.], cksum 0xc863 (correct), seq 1483221030, ack 3036822168, win 28960, options [mss 1460,sackOK,TS val 278410252 ecr 278411730,nop,wscale 7], length 0
1527817634.886797 IP (tos 0x0, ttl 64, id 838, offset 0, flags [DF], proto TCP (6), length 52)
    rpi33.lan.54422 > rpi35.lan.46656: Flags [.], cksum 0x8483 (incorrect -> 0x676b), ack 1, win 229, options [nop,nop,TS val 278411730 ecr 278410252], length 0
1527817634.899764 IP (tos 0x0, ttl 64, id 839, offset 0, flags [DF], proto TCP (6), length 86)
    rpi33.lan.54422 > rpi35.lan.46656: Flags [P.], cksum 0x84a5 (incorrect -> 0x453c), seq 1:35, ack 1, win 229, options [nop,nop,TS val 278411731 ecr 278410252], length 34
1527817634.900352 IP (tos 0x0, ttl 64, id 7211, offset 0, flags [DF], proto TCP (6), length 52)
    rpi35.lan.46656 > rpi33.lan.54422: Flags [.], cksum 0x6749 (correct), ack 35, win 227, options [nop,nop,TS val 278410253 ecr 278411731], length 0
1527817636.702899 IP (tos 0x0, ttl 64, id 48476, offset 0, flags [DF], proto TCP (6), length 60)
    rpi33.lan.42424 > rpi40.lan.46656: Flags [S], cksum 0x8490 (incorrect -> 0x318d), seq 4044130267, win 29200, options [mss 1460,sackOK,TS val 278411911 ecr 0,nop,wscale 7], length 0
1527817636.703531 IP (tos 0x0, ttl 64, id 0, offset 0, flags [DF], proto TCP (6), length 60)
    rpi40.lan.46656 > rpi33.lan.42424: Flags [S.], cksum 0x60af (correct), seq 4288909176, ack 4044130268, win 28960, options [mss 1460,sackOK,TS val 278409736 ecr 278411911,nop,wscale 7], length 0
1527817636.703645 IP (tos 0x0, ttl 64, id 48477, offset 0, flags [DF], proto TCP (6), length 52)
    rpi33.lan.42424 > rpi40.lan.46656: Flags [.], cksum 0x8488 (incorrect -> 0xffb6), ack 1, win 229, options [nop,nop,TS val 278411911 ecr 278409736], length 0
1527817636.716130 IP (tos 0x0, ttl 64, id 48478, offset 0, flags [DF], proto TCP (6), length 86)
    rpi33.lan.42424 > rpi40.lan.46656: Flags [P.], cksum 0x84aa (incorrect -> 0x18bd), seq 1:35, ack 1, win 229, options [nop,nop,TS val 278411913 ecr 278409736], length 34
1527817636.716658 IP (tos 0x0, ttl 64, id 48497, offset 0, flags [DF], proto TCP (6), length 52)
    rpi40.lan.46656 > rpi33.lan.42424: Flags [.], cksum 0xff93 (correct), ack 35, win 227, options [nop,nop,TS val 278409737 ecr 278411913], length 0
1527817641.232297 IP (tos 0x0, ttl 64, id 19932, offset 0, flags [DF], proto TCP (6), length 52)
    rpi33.lan.39818 > rpi38.lan.46656: Flags [F.], cksum 0x8486 (incorrect -> 0xb74b), seq 3610999240, ack 3366077051, win 229, options [nop,nop,TS val 278412364 ecr 278408898], length 0
1527817641.276452 IP (tos 0x0, ttl 64, id 27835, offset 0, flags [DF], proto TCP (6), length 52)
    rpi38.lan.46656 > rpi33.lan.39818: Flags [.], cksum 0xaf79 (correct), ack 1, win 227, options [nop,nop,TS val 278410902 ecr 278412364], length 0
1527817646.798561 IP (tos 0x0, ttl 64, id 43865, offset 0, flags [DF], proto TCP (6), length 52)
    rpi33.lan.39774 > rpi37.lan.46656: Flags [F.], cksum 0x8485 (incorrect -> 0xd946), seq 35, ack 1, win 229, options [nop,nop,TS val 278412921 ecr 278410907], length 0
1527817646.841036 IP (tos 0x0, ttl 64, id 3023, offset 0, flags [DF], proto TCP (6), length 52)
    rpi37.lan.46656 > rpi33.lan.39774: Flags [.], cksum 0xd175 (correct), ack 36, win 227, options [nop,nop,TS val 278412910 ecr 278412921], length 0
1527817648.047863 IP (tos 0x0, ttl 64, id 20511, offset 0, flags [DF], proto TCP (6), length 60)
    rpi33.lan.39856 > rpi38.lan.46656: Flags [S], cksum 0x848e (incorrect -> 0x815e), seq 3217583849, win 29200, options [mss 1460,sackOK,TS val 278413046 ecr 0,nop,wscale 7], length 0
1527817648.048556 IP (tos 0x0, ttl 64, id 0, offset 0, flags [DF], proto TCP (6), length 60)
    rpi38.lan.46656 > rpi33.lan.39856: Flags [S.], cksum 0x63af (correct), seq 764323628, ack 3217583850, win 28960, options [mss 1460,sackOK,TS val 278411579 ecr 278413046,nop,wscale 7], length 0
1527817648.048685 IP (tos 0x0, ttl 64, id 20512, offset 0, flags [DF], proto TCP (6), length 52)
    rpi33.lan.39856 > rpi38.lan.46656: Flags [.], cksum 0x8486 (incorrect -> 0x02b7), ack 1, win 229, options [nop,nop,TS val 278413046 ecr 278411579], length 0
1527817648.050382 IP (tos 0x0, ttl 64, id 54260, offset 0, flags [DF], proto TCP (6), length 52)
    rpi42.lan.47062 > rpi33.lan.46656: Flags [F.], cksum 0x5a3f (correct), seq 35, ack 1, win 229, options [nop,nop,TS val 278413026 ecr 278411047], length 0
1527817648.061215 IP (tos 0x0, ttl 64, id 20513, offset 0, flags [DF], proto TCP (6), length 86)
    rpi33.lan.39856 > rpi38.lan.46656: Flags [P.], cksum 0x84a8 (incorrect -> 0x7ccf), seq 1:35, ack 1, win 229, options [nop,nop,TS val 278413047 ecr 278411579], length 34
1527817648.061747 IP (tos 0x0, ttl 64, id 40470, offset 0, flags [DF], proto TCP (6), length 52)
    rpi38.lan.46656 > rpi33.lan.39856: Flags [.], cksum 0x0295 (correct), ack 35, win 227, options [nop,nop,TS val 278411580 ecr 278413047], length 0
1527817648.094494 IP (tos 0x0, ttl 64, id 15102, offset 0, flags [DF], proto TCP (6), length 52)
    rpi33.lan.46656 > rpi42.lan.47062: Flags [.], cksum 0x848a (incorrect -> 0x526d), ack 36, win 227, options [nop,nop,TS val 278413051 ecr 278413026], length 0
1527817648.517086 IP (tos 0x0, ttl 64, id 63777, offset 0, flags [DF], proto TCP (6), length 52)
    rpi33.lan.60170 > rpi36.lan.46656: Flags [F.], cksum 0x8484 (incorrect -> 0x2d3b), seq 35, ack 1, win 229, options [nop,nop,TS val 278413093 ecr 278411094], length 0
1527817648.566793 IP (tos 0x0, ttl 64, id 46780, offset 0, flags [DF], proto TCP (6), length 52)
    rpi36.lan.46656 > rpi33.lan.60170: Flags [.], cksum 0x2569 (correct), ack 36, win 227, options [nop,nop,TS val 278413098 ecr 278413093], length 0
1527817651.852501 IP (tos 0x0, ttl 64, id 29375, offset 0, flags [DF], proto TCP (6), length 52)
    rpi41.lan.45778 > rpi33.lan.46656: Flags [F.], cksum 0x1237 (correct), seq 35, ack 1, win 229, options [nop,nop,TS val 1569004754 ecr 278411428], length 0
1527817651.894515 IP (tos 0x0, ttl 64, id 52009, offset 0, flags [DF], proto TCP (6), length 52)
    rpi33.lan.46656 > rpi41.lan.45778: Flags [.], cksum 0x8489 (incorrect -> 0x0a66), ack 36, win 227, options [nop,nop,TS val 278413431 ecr 1569004754], length 0
1527817653.294521 IP (tos 0x0, ttl 64, id 62777, offset 0, flags [DF], proto TCP (6), length 60)
    rpi42.lan.47084 > rpi33.lan.46656: Flags [S], cksum 0xe188 (correct), seq 4202149334, win 29200, options [mss 1460,sackOK,TS val 278413551 ecr 0,nop,wscale 7], length 0
1527817653.294704 IP (tos 0x0, ttl 64, id 0, offset 0, flags [DF], proto TCP (6), length 60)
    rpi33.lan.46656 > rpi42.lan.47084: Flags [S.], cksum 0x8492 (incorrect -> 0xa0fa), seq 3628799878, ack 4202149335, win 28960, options [mss 1460,sackOK,TS val 278413571 ecr 278413551,nop,wscale 7], length 0
1527817653.295276 IP (tos 0x0, ttl 64, id 62778, offset 0, flags [DF], proto TCP (6), length 52)
    rpi42.lan.47084 > rpi33.lan.46656: Flags [.], cksum 0x4002 (correct), ack 1, win 229, options [nop,nop,TS val 278413551 ecr 278413571], length 0
1527817653.307828 IP (tos 0x0, ttl 64, id 62779, offset 0, flags [DF], proto TCP (6), length 86)
    rpi42.lan.47084 > rpi33.lan.46656: Flags [P.], cksum 0x8591 (correct), seq 1:35, ack 1, win 229, options [nop,nop,TS val 278413552 ecr 278413571], length 34
1527817653.307897 IP (tos 0x0, ttl 64, id 22148, offset 0, flags [DF], proto TCP (6), length 52)
    rpi33.lan.46656 > rpi42.lan.47084: Flags [.], cksum 0x848a (incorrect -> 0x3fe0), ack 35, win 227, options [nop,nop,TS val 278413572 ecr 278413552], length 0
1527817653.887656 IP (tos 0x0, ttl 64, id 24450, offset 0, flags [DF], proto TCP (6), length 60)
    rpi33.lan.39824 > rpi37.lan.46656: Flags [S], cksum 0x848d (incorrect -> 0x7b56), seq 332865212, win 29200, options [mss 1460,sackOK,TS val 278413630 ecr 0,nop,wscale 7], length 0
1527817653.888345 IP (tos 0x0, ttl 64, id 0, offset 0, flags [DF], proto TCP (6), length 60)
    rpi37.lan.46656 > rpi33.lan.39824: Flags [S.], cksum 0x56d9 (correct), seq 2494906080, ack 332865213, win 28960, options [mss 1460,sackOK,TS val 278413614 ecr 278413630,nop,wscale 7], length 0
1527817653.888463 IP (tos 0x0, ttl 64, id 24451, offset 0, flags [DF], proto TCP (6), length 52)
    rpi33.lan.39824 > rpi37.lan.46656: Flags [.], cksum 0x8485 (incorrect -> 0xf5e0), ack 1, win 229, options [nop,nop,TS val 278413630 ecr 278413614], length 0
1527817653.901082 IP (tos 0x0, ttl 64, id 24452, offset 0, flags [DF], proto TCP (6), length 86)
    rpi33.lan.39824 > rpi37.lan.46656: Flags [P.], cksum 0x84a7 (incorrect -> 0x179c), seq 1:35, ack 1, win 229, options [nop,nop,TS val 278413631 ecr 278413614], length 34
1527817653.901617 IP (tos 0x0, ttl 64, id 32719, offset 0, flags [DF], proto TCP (6), length 52)
    rpi37.lan.46656 > rpi33.lan.39824: Flags [.], cksum 0xf5bd (correct), ack 35, win 227, options [nop,nop,TS val 278413616 ecr 278413631], length 0
1527817653.913011 IP (tos 0x0, ttl 64, id 49850, offset 0, flags [DF], proto TCP (6), length 1096)
    rpi34.lan.46656 > rpi33.lan.35744: Flags [P.], cksum 0x9bf4 (correct), seq 3496891655:3496892699, ack 1347949763, win 341, options [nop,nop,TS val 278413641 ecr 278407638], length 1044
1527817653.913088 IP (tos 0x0, ttl 64, id 776, offset 0, flags [DF], proto TCP (6), length 52)
    rpi33.lan.35744 > rpi34.lan.46656: Flags [.], cksum 0x8482 (incorrect -> 0x7cba), ack 1044, win 359, options [nop,nop,TS val 278413632 ecr 278413641], length 0
1527817653.913611 IP (tos 0x0, ttl 64, id 777, offset 0, flags [DF], proto TCP (6), length 1096)
    rpi33.lan.35744 > rpi34.lan.46656: Flags [P.], cksum 0x8896 (incorrect -> 0xdc74), seq 1:1045, ack 1044, win 359, options [nop,nop,TS val 278413632 ecr 278413641], length 1044
1527817653.913872 IP (tos 0x0, ttl 64, id 778, offset 0, flags [DF], proto TCP (6), length 1096)
    rpi33.lan.35744 > rpi34.lan.46656: Flags [P.], cksum 0x8896 (incorrect -> 0x8f44), seq 1045:2089, ack 1044, win 359, options [nop,nop,TS val 278413632 ecr 278413641], length 1044
1527817653.914613 IP (tos 0x0, ttl 64, id 49851, offset 0, flags [DF], proto TCP (6), length 52)
    rpi34.lan.46656 > rpi33.lan.35744: Flags [.], cksum 0x7483 (correct), ack 2089, win 374, options [nop,nop,TS val 278413641 ecr 278413632], length 0
1527817653.915252 IP (tos 0x0, ttl 64, id 49852, offset 0, flags [DF], proto TCP (6), length 1096)
    rpi34.lan.46656 > rpi33.lan.35744: Flags [P.], cksum 0xc73a (correct), seq 1044:2088, ack 2089, win 374, options [nop,nop,TS val 278413641 ecr 278413632], length 1044
1527817653.964491 IP (tos 0x0, ttl 64, id 779, offset 0, flags [DF], proto TCP (6), length 52)
    rpi33.lan.35744 > rpi34.lan.46656: Flags [.], cksum 0x8482 (incorrect -> 0x7068), ack 2088, win 375, options [nop,nop,TS val 278413638 ecr 278413641], length 0
1527817654.037155 IP (tos 0x0, ttl 64, id 50277, offset 0, flags [DF], proto TCP (6), length 60)
    rpi33.lan.60220 > rpi36.lan.46656: Flags [S], cksum 0x848c (incorrect -> 0x3bce), seq 2637727016, win 29200, options [mss 1460,sackOK,TS val 278413645 ecr 0,nop,wscale 7], length 0
1527817654.037844 IP (tos 0x0, ttl 64, id 0, offset 0, flags [DF], proto TCP (6), length 60)
    rpi36.lan.46656 > rpi33.lan.60220: Flags [S.], cksum 0xf996 (correct), seq 677169364, ack 2637727017, win 28960, options [mss 1460,sackOK,TS val 278413645 ecr 278413645,nop,wscale 7], length 0
1527817654.037961 IP (tos 0x0, ttl 64, id 50278, offset 0, flags [DF], proto TCP (6), length 52)
    rpi33.lan.60220 > rpi36.lan.46656: Flags [.], cksum 0x8484 (incorrect -> 0x989e), ack 1, win 229, options [nop,nop,TS val 278413645 ecr 278413645], length 0
1527817654.050908 IP (tos 0x0, ttl 64, id 50279, offset 0, flags [DF], proto TCP (6), length 86)
    rpi33.lan.60220 > rpi36.lan.46656: Flags [P.], cksum 0x84a6 (incorrect -> 0xfcfb), seq 1:35, ack 1, win 229, options [nop,nop,TS val 278413646 ecr 278413645], length 34
1527817654.051444 IP (tos 0x0, ttl 64, id 35224, offset 0, flags [DF], proto TCP (6), length 52)
    rpi36.lan.46656 > rpi33.lan.60220: Flags [.], cksum 0x987c (correct), ack 35, win 227, options [nop,nop,TS val 278413646 ecr 278413646], length 0
1527817654.887467 IP (tos 0x0, ttl 64, id 840, offset 0, flags [DF], proto TCP (6), length 52)
    rpi33.lan.54422 > rpi35.lan.46656: Flags [F.], cksum 0x8483 (incorrect -> 0x5f77), seq 35, ack 1, win 229, options [nop,nop,TS val 278413730 ecr 278410253], length 0
1527817654.936200 IP (tos 0x0, ttl 64, id 7212, offset 0, flags [DF], proto TCP (6), length 52)
    rpi35.lan.46656 > rpi33.lan.54422: Flags [.], cksum 0x57a5 (correct), ack 36, win 227, options [nop,nop,TS val 278412257 ecr 278413730], length 0
1527817656.704095 IP (tos 0x0, ttl 64, id 48479, offset 0, flags [DF], proto TCP (6), length 52)
    rpi33.lan.42424 > rpi40.lan.46656: Flags [F.], cksum 0x8488 (incorrect -> 0xf7c2), seq 35, ack 1, win 229, options [nop,nop,TS val 278413911 ecr 278409737], length 0
1527817656.748237 IP (tos 0x0, ttl 64, id 48498, offset 0, flags [DF], proto TCP (6), length 52)
    rpi40.lan.46656 > rpi33.lan.42424: Flags [.], cksum 0xeff0 (correct), ack 36, win 227, options [nop,nop,TS val 278411741 ecr 278413911], length 0
1527817658.553647 IP (tos 0x0, ttl 64, id 10506, offset 0, flags [DF], proto TCP (6), length 60)
    rpi41.lan.45790 > rpi33.lan.46656: Flags [S], cksum 0x34da (correct), seq 3004853236, win 29200, options [mss 1460,sackOK,TS val 1569011455 ecr 0,nop,wscale 7], length 0
1527817658.553870 IP (tos 0x0, ttl 64, id 0, offset 0, flags [DF], proto TCP (6), length 60)
    rpi33.lan.46656 > rpi41.lan.45790: Flags [S.], cksum 0x8491 (incorrect -> 0x4d39), seq 1395933603, ack 3004853237, win 28960, options [mss 1460,sackOK,TS val 278414096 ecr 1569011455,nop,wscale 7], length 0
1527817658.554411 IP (tos 0x0, ttl 64, id 10507, offset 0, flags [DF], proto TCP (6), length 52)
    rpi41.lan.45790 > rpi33.lan.46656: Flags [.], cksum 0xec3f (correct), ack 1, win 229, options [nop,nop,TS val 1569011456 ecr 278414096], length 0
1527817658.566939 IP (tos 0x0, ttl 64, id 10508, offset 0, flags [DF], proto TCP (6), length 86)
    rpi41.lan.45790 > rpi33.lan.46656: Flags [P.], cksum 0x7ab9 (correct), seq 1:35, ack 1, win 229, options [nop,nop,TS val 1569011469 ecr 278414096], length 34
1527817658.567013 IP (tos 0x0, ttl 64, id 693, offset 0, flags [DF], proto TCP (6), length 52)
    rpi33.lan.46656 > rpi41.lan.45790: Flags [.], cksum 0x8489 (incorrect -> 0xec10), ack 35, win 227, options [nop,nop,TS val 278414098 ecr 1569011469], length 0
1527817660.041963 IP (tos 0x0, ttl 64, id 16263, offset 0, flags [DF], proto TCP (6), length 1096)
    rpi33.lan.46656 > rpi39.lan.47498: Flags [P.], cksum 0x61b6 (correct), seq 955113174:955114218, ack 3487535548, win 341, options [nop,nop,TS val 278414245 ecr 278408245], length 1044
1527817660.042791 IP (tos 0x0, ttl 64, id 34924, offset 0, flags [DF], proto TCP (6), length 1096)
    rpi39.lan.47498 > rpi33.lan.46656: Flags [P.], cksum 0x11fd (correct), seq 1:1045, ack 0, win 343, options [nop,nop,TS val 278414245 ecr 278408249], length 1044
1527817660.042794 IP (tos 0x0, ttl 64, id 34925, offset 0, flags [DF], proto TCP (6), length 52)
    rpi39.lan.47498 > rpi33.lan.46656: Flags [.], cksum 0x5727 (correct), ack 1044, win 359, options [nop,nop,TS val 278414245 ecr 278414245], length 0
1527817660.043368 IP (tos 0x0, ttl 64, id 16264, offset 0, flags [DF], proto TCP (6), length 1096)
    rpi33.lan.46656 > rpi39.lan.47498: Flags [P.], cksum 0x7a76 (correct), seq 1044:2088, ack 1045, win 357, options [nop,nop,TS val 278414245 ecr 278414245], length 1044
1527817660.043532 IP (tos 0x0, ttl 64, id 34926, offset 0, flags [DF], proto TCP (6), length 1096)
    rpi39.lan.47498 > rpi33.lan.46656: Flags [P.], cksum 0x534b (correct), seq 1045:2089, ack 1044, win 359, options [nop,nop,TS val 278414245 ecr 278414245], length 1044
1527817660.084218 IP (tos 0x0, ttl 64, id 34927, offset 0, flags [DF], proto TCP (6), length 52)
    rpi39.lan.47498 > rpi33.lan.46656: Flags [.], cksum 0x4eea (correct), ack 2088, win 375, options [nop,nop,TS val 278414250 ecr 278414245], length 0
1527817660.084309 IP (tos 0x0, ttl 64, id 16265, offset 0, flags [DF], proto TCP (6), length 52)
    rpi33.lan.46656 > rpi39.lan.47498: Flags [.], cksum 0x8487 (incorrect -> 0x4eec), ack 2089, win 374, options [nop,nop,TS val 278414249 ecr 278414245], length 0
1527817660.704715 IP (tos 0x0, ttl 64, id 24429, offset 0, flags [DF], proto TCP (6), length 60)
    rpi33.lan.54486 > rpi35.lan.46656: Flags [S], cksum 0x848b (incorrect -> 0xfb45), seq 1513102469, win 29200, options [mss 1460,sackOK,TS val 278414312 ecr 0,nop,wscale 7], length 0
1527817660.705433 IP (tos 0x0, ttl 64, id 0, offset 0, flags [DF], proto TCP (6), length 60)
    rpi35.lan.46656 > rpi33.lan.54486: Flags [S.], cksum 0x63f3 (correct), seq 763239418, ack 1513102470, win 28960, options [mss 1460,sackOK,TS val 278412833 ecr 278414312,nop,wscale 7], length 0
1527817660.705562 IP (tos 0x0, ttl 64, id 24430, offset 0, flags [DF], proto TCP (6), length 52)
    rpi33.lan.54486 > rpi35.lan.46656: Flags [.], cksum 0x8483 (incorrect -> 0x02fb), ack 1, win 229, options [nop,nop,TS val 278414312 ecr 278412833], length 0
1527817660.718119 IP (tos 0x0, ttl 64, id 24431, offset 0, flags [DF], proto TCP (6), length 86)
    rpi33.lan.54486 > rpi35.lan.46656: Flags [P.], cksum 0x84a5 (incorrect -> 0xa69e), seq 1:35, ack 1, win 229, options [nop,nop,TS val 278414313 ecr 278412833], length 34
1527817660.718662 IP (tos 0x0, ttl 64, id 9690, offset 0, flags [DF], proto TCP (6), length 52)
    rpi35.lan.46656 > rpi33.lan.54486: Flags [.], cksum 0x02d8 (correct), ack 35, win 227, options [nop,nop,TS val 278412835 ecr 278414313], length 0
1527817664.552246 IP (tos 0x0, ttl 64, id 10575, offset 0, flags [DF], proto TCP (6), length 60)
    rpi33.lan.42490 > rpi40.lan.46656: Flags [S], cksum 0x8490 (incorrect -> 0x59c3), seq 3647433767, win 29200, options [mss 1460,sackOK,TS val 278414696 ecr 0,nop,wscale 7], length 0
1527817664.552900 IP (tos 0x0, ttl 64, id 0, offset 0, flags [DF], proto TCP (6), length 60)
    rpi40.lan.46656 > rpi33.lan.42490: Flags [S.], cksum 0x7b7e (correct), seq 1712401297, ack 3647433768, win 28960, options [mss 1460,sackOK,TS val 278412521 ecr 278414696,nop,wscale 7], length 0
1527817664.553028 IP (tos 0x0, ttl 64, id 10576, offset 0, flags [DF], proto TCP (6), length 52)
    rpi33.lan.42490 > rpi40.lan.46656: Flags [.], cksum 0x8488 (incorrect -> 0x1a86), ack 1, win 229, options [nop,nop,TS val 278414696 ecr 278412521], length 0
1527817664.565623 IP (tos 0x0, ttl 64, id 10577, offset 0, flags [DF], proto TCP (6), length 86)
    rpi33.lan.42490 > rpi40.lan.46656: Flags [P.], cksum 0x84aa (incorrect -> 0x8a4c), seq 1:35, ack 1, win 229, options [nop,nop,TS val 278414698 ecr 278412521], length 34
1527817664.566147 IP (tos 0x0, ttl 64, id 6011, offset 0, flags [DF], proto TCP (6), length 52)
    rpi40.lan.46656 > rpi33.lan.42490: Flags [.], cksum 0x1a63 (correct), ack 35, win 227, options [nop,nop,TS val 278412522 ecr 278414698], length 0
1527817668.049222 IP (tos 0x0, ttl 64, id 20514, offset 0, flags [DF], proto TCP (6), length 52)
    rpi33.lan.39856 > rpi38.lan.46656: Flags [F.], cksum 0x8486 (incorrect -> 0xfac2), seq 35, ack 1, win 229, options [nop,nop,TS val 278415046 ecr 278411580], length 0
1527817668.096465 IP (tos 0x0, ttl 64, id 40471, offset 0, flags [DF], proto TCP (6), length 52)
    rpi38.lan.46656 > rpi33.lan.39856: Flags [.], cksum 0xf2f0 (correct), ack 36, win 227, options [nop,nop,TS val 278413584 ecr 278415046], length 0
1527817673.295922 IP (tos 0x0, ttl 64, id 62780, offset 0, flags [DF], proto TCP (6), length 52)
    rpi42.lan.47084 > rpi33.lan.46656: Flags [F.], cksum 0x380e (correct), seq 35, ack 1, win 229, options [nop,nop,TS val 278415551 ecr 278413572], length 0
1527817673.344505 IP (tos 0x0, ttl 64, id 22149, offset 0, flags [DF], proto TCP (6), length 52)
    rpi33.lan.46656 > rpi42.lan.47084: Flags [.], cksum 0x848a (incorrect -> 0x303c), ack 36, win 227, options [nop,nop,TS val 278415576 ecr 278415551], length 0
1527817673.888955 IP (tos 0x0, ttl 64, id 24453, offset 0, flags [DF], proto TCP (6), length 52)
    rpi33.lan.39824 > rpi37.lan.46656: Flags [F.], cksum 0x8485 (incorrect -> 0xedeb), seq 35, ack 1, win 229, options [nop,nop,TS val 278415630 ecr 278413616], length 0
1527817673.931051 IP (tos 0x0, ttl 64, id 32720, offset 0, flags [DF], proto TCP (6), length 52)
    rpi37.lan.46656 > rpi33.lan.39824: Flags [.], cksum 0xe61a (correct), ack 36, win 227, options [nop,nop,TS val 278415619 ecr 278415630], length 0
1527817674.038545 IP (tos 0x0, ttl 64, id 50280, offset 0, flags [DF], proto TCP (6), length 52)
    rpi33.lan.60220 > rpi36.lan.46656: Flags [F.], cksum 0x8484 (incorrect -> 0x90aa), seq 35, ack 1, win 229, options [nop,nop,TS val 278415645 ecr 278413646], length 0
1527817674.086783 IP (tos 0x0, ttl 64, id 35225, offset 0, flags [DF], proto TCP (6), length 52)
    rpi36.lan.46656 > rpi33.lan.60220: Flags [.], cksum 0x88d8 (correct), ack 36, win 227, options [nop,nop,TS val 278415650 ecr 278415645], length 0
1527817674.445573 IP (tos 0x0, ttl 64, id 17698, offset 0, flags [DF], proto TCP (6), length 60)
    rpi33.lan.39920 > rpi38.lan.46656: Flags [S], cksum 0x848e (incorrect -> 0xe33b), seq 3051359332, win 29200, options [mss 1460,sackOK,TS val 278415686 ecr 0,nop,wscale 7], length 0
1527817674.446294 IP (tos 0x0, ttl 64, id 0, offset 0, flags [DF], proto TCP (6), length 60)
    rpi38.lan.46656 > rpi33.lan.39920: Flags [S.], cksum 0xf0d1 (correct), seq 131700557, ack 3051359333, win 28960, options [mss 1460,sackOK,TS val 278414218 ecr 278415686,nop,wscale 7], length 0
1527817674.446415 IP (tos 0x0, ttl 64, id 17699, offset 0, flags [DF], proto TCP (6), length 52)
    rpi33.lan.39920 > rpi38.lan.46656: Flags [.], cksum 0x8486 (incorrect -> 0x8fd9), ack 1, win 229, options [nop,nop,TS val 278415686 ecr 278414218], length 0
1527817674.458869 IP (tos 0x0, ttl 64, id 17700, offset 0, flags [DF], proto TCP (6), length 86)
    rpi33.lan.39920 > rpi38.lan.46656: Flags [P.], cksum 0x84a8 (incorrect -> 0x957b), seq 1:35, ack 1, win 229, options [nop,nop,TS val 278415687 ecr 278414218], length 34
1527817674.459409 IP (tos 0x0, ttl 64, id 54469, offset 0, flags [DF], proto TCP (6), length 52)
    rpi38.lan.46656 > rpi33.lan.39920: Flags [.], cksum 0x8fb6 (correct), ack 35, win 227, options [nop,nop,TS val 278414220 ecr 278415687], length 0
1527817678.554855 IP (tos 0x0, ttl 64, id 10509, offset 0, flags [DF], proto TCP (6), length 52)
    rpi41.lan.45790 > rpi33.lan.46656: Flags [F.], cksum 0x9df9 (correct), seq 35, ack 1, win 229, options [nop,nop,TS val 1569031457 ecr 278414098], length 0
1527817678.604513 IP (tos 0x0, ttl 64, id 694, offset 0, flags [DF], proto TCP (6), length 52)
    rpi33.lan.46656 > rpi41.lan.45790: Flags [.], cksum 0x8489 (incorrect -> 0x9627), ack 36, win 227, options [nop,nop,TS val 278416102 ecr 1569031457], length 0
1527817680.297048 IP (tos 0x0, ttl 64, id 55276, offset 0, flags [DF], proto TCP (6), length 60)
    rpi42.lan.47088 > rpi33.lan.46656: Flags [S], cksum 0xf36b (correct), seq 4148403351, win 29200, options [mss 1460,sackOK,TS val 278416251 ecr 0,nop,wscale 7], length 0
1527817680.297240 IP (tos 0x0, ttl 64, id 0, offset 0, flags [DF], proto TCP (6), length 60)
    rpi33.lan.46656 > rpi42.lan.47088: Flags [S.], cksum 0x8492 (incorrect -> 0xa7ec), seq 3565296564, ack 4148403352, win 28960, options [mss 1460,sackOK,TS val 278416271 ecr 278416251,nop,wscale 7], length 0
1527817680.297843 IP (tos 0x0, ttl 64, id 55277, offset 0, flags [DF], proto TCP (6), length 52)
    rpi42.lan.47088 > rpi33.lan.46656: Flags [.], cksum 0x46f4 (correct), ack 1, win 229, options [nop,nop,TS val 278416251 ecr 278416271], length 0
1527817680.310437 IP (tos 0x0, ttl 64, id 55278, offset 0, flags [DF], proto TCP (6), length 86)
    rpi42.lan.47088 > rpi33.lan.46656: Flags [P.], cksum 0xf29a (correct), seq 1:35, ack 1, win 229, options [nop,nop,TS val 278416252 ecr 278416271], length 34
1527817680.310498 IP (tos 0x0, ttl 64, id 20538, offset 0, flags [DF], proto TCP (6), length 52)
    rpi33.lan.46656 > rpi42.lan.47088: Flags [.], cksum 0x848a (incorrect -> 0x46d2), ack 35, win 227, options [nop,nop,TS val 278416272 ecr 278416252], length 0
1527817680.706123 IP (tos 0x0, ttl 64, id 24432, offset 0, flags [DF], proto TCP (6), length 52)
    rpi33.lan.54486 > rpi35.lan.46656: Flags [F.], cksum 0x8483 (incorrect -> 0xfb05), seq 35, ack 1, win 229, options [nop,nop,TS val 278416312 ecr 278412835], length 0
1527817680.756210 IP (tos 0x0, ttl 64, id 9691, offset 0, flags [DF], proto TCP (6), length 52)
    rpi35.lan.46656 > rpi33.lan.54486: Flags [.], cksum 0xf333 (correct), ack 36, win 227, options [nop,nop,TS val 278414839 ecr 278416312], length 0
1527817680.899114 IP (tos 0x0, ttl 64, id 38262, offset 0, flags [DF], proto TCP (6), length 60)
    rpi33.lan.39888 > rpi37.lan.46656: Flags [S], cksum 0x848d (incorrect -> 0xe318), seq 3779452605, win 29200, options [mss 1460,sackOK,TS val 278416331 ecr 0,nop,wscale 7], length 0
1527817680.899843 IP (tos 0x0, ttl 64, id 0, offset 0, flags [DF], proto TCP (6), length 60)
    rpi37.lan.46656 > rpi33.lan.39888: Flags [S.], cksum 0xaced (correct), seq 421314970, ack 3779452606, win 28960, options [mss 1460,sackOK,TS val 278416315 ecr 278416331,nop,wscale 7], length 0
1527817680.899971 IP (tos 0x0, ttl 64, id 38263, offset 0, flags [DF], proto TCP (6), length 52)
    rpi33.lan.39888 > rpi37.lan.46656: Flags [.], cksum 0x8485 (incorrect -> 0x4bf5), ack 1, win 229, options [nop,nop,TS val 278416331 ecr 278416315], length 0
1527817680.912488 IP (tos 0x0, ttl 64, id 38264, offset 0, flags [DF], proto TCP (6), length 86)
    rpi33.lan.39888 > rpi37.lan.46656: Flags [P.], cksum 0x84a7 (incorrect -> 0x25c0), seq 1:35, ack 1, win 229, options [nop,nop,TS val 278416332 ecr 278416315], length 34
1527817680.913012 IP (tos 0x0, ttl 64, id 35360, offset 0, flags [DF], proto TCP (6), length 52)
    rpi37.lan.46656 > rpi33.lan.39888: Flags [.], cksum 0x4bd2 (correct), ack 35, win 227, options [nop,nop,TS val 278416317 ecr 278416332], length 0
1527817681.555892 IP (tos 0x0, ttl 64, id 52436, offset 0, flags [DF], proto TCP (6), length 60)
    rpi33.lan.60286 > rpi36.lan.46656: Flags [S], cksum 0x848c (incorrect -> 0x6a75), seq 1742635225, win 29200, options [mss 1460,sackOK,TS val 278416397 ecr 0,nop,wscale 7], length 0
1527817681.556626 IP (tos 0x0, ttl 64, id 0, offset 0, flags [DF], proto TCP (6), length 60)
    rpi36.lan.46656 > rpi33.lan.60286: Flags [S.], cksum 0x72e9 (correct), seq 1182160208, ack 1742635226, win 28960, options [mss 1460,sackOK,TS val 278416396 ecr 278416397,nop,wscale 7], length 0
1527817681.556753 IP (tos 0x0, ttl 64, id 52437, offset 0, flags [DF], proto TCP (6), length 52)
    rpi33.lan.60286 > rpi36.lan.46656: Flags [.], cksum 0x8484 (incorrect -> 0x11f1), ack 1, win 229, options [nop,nop,TS val 278416397 ecr 278416396], length 0
1527817681.569473 IP (tos 0x0, ttl 64, id 52438, offset 0, flags [DF], proto TCP (6), length 86)
    rpi33.lan.60286 > rpi36.lan.46656: Flags [P.], cksum 0x84a6 (incorrect -> 0x4433), seq 1:35, ack 1, win 229, options [nop,nop,TS val 278416398 ecr 278416396], length 34
1527817681.570003 IP (tos 0x0, ttl 64, id 6492, offset 0, flags [DF], proto TCP (6), length 52)
    rpi36.lan.46656 > rpi33.lan.60286: Flags [.], cksum 0x11ce (correct), ack 35, win 227, options [nop,nop,TS val 278416398 ecr 278416398], length 0
1527817684.319073 IP (tos 0x0, ttl 64, id 55955, offset 0, flags [DF], proto TCP (6), length 60)
    rpi41.lan.45800 > rpi33.lan.46656: Flags [S], cksum 0x9620 (correct), seq 3246102428, win 29200, options [mss 1460,sackOK,TS val 1569037221 ecr 0,nop,wscale 7], length 0
1527817684.319263 IP (tos 0x0, ttl 64, id 0, offset 0, flags [DF], proto TCP (6), length 60)
    rpi33.lan.46656 > rpi41.lan.45800: Flags [S.], cksum 0x8491 (incorrect -> 0xd1cd), seq 1781464393, ack 3246102429, win 28960, options [mss 1460,sackOK,TS val 278416673 ecr 1569037221,nop,wscale 7], length 0
1527817684.319815 IP (tos 0x0, ttl 64, id 55956, offset 0, flags [DF], proto TCP (6), length 52)
    rpi41.lan.45800 > rpi33.lan.46656: Flags [.], cksum 0x70d4 (correct), ack 1, win 229, options [nop,nop,TS val 1569037222 ecr 278416673], length 0
1527817684.332336 IP (tos 0x0, ttl 64, id 55957, offset 0, flags [DF], proto TCP (6), length 86)
    rpi41.lan.45800 > rpi33.lan.46656: Flags [P.], cksum 0x6a68 (correct), seq 1:35, ack 1, win 229, options [nop,nop,TS val 1569037234 ecr 278416673], length 34
1527817684.332405 IP (tos 0x0, ttl 64, id 45163, offset 0, flags [DF], proto TCP (6), length 52)
    rpi33.lan.46656 > rpi41.lan.45800: Flags [.], cksum 0x8489 (incorrect -> 0x70a7), ack 35, win 227, options [nop,nop,TS val 278416674 ecr 1569037234], length 0
1527817684.553614 IP (tos 0x0, ttl 64, id 10578, offset 0, flags [DF], proto TCP (6), length 52)
    rpi33.lan.42490 > rpi40.lan.46656: Flags [F.], cksum 0x8488 (incorrect -> 0x1292), seq 35, ack 1, win 229, options [nop,nop,TS val 278416696 ecr 278412522], length 0
1527817684.598203 IP (tos 0x0, ttl 64, id 6012, offset 0, flags [DF], proto TCP (6), length 52)
    rpi40.lan.46656 > rpi33.lan.42490: Flags [.], cksum 0x0ac0 (correct), ack 36, win 227, options [nop,nop,TS val 278414526 ecr 278416696], length 0
1527817687.722406 IP (tos 0x0, ttl 64, id 31222, offset 0, flags [DF], proto TCP (6), length 60)
    rpi33.lan.54550 > rpi35.lan.46656: Flags [S], cksum 0x848b (incorrect -> 0x1e79), seq 288503683, win 29200, options [mss 1460,sackOK,TS val 278417013 ecr 0,nop,wscale 7], length 0
1527817687.723077 IP (tos 0x0, ttl 64, id 0, offset 0, flags [DF], proto TCP (6), length 60)
    rpi35.lan.46656 > rpi33.lan.54550: Flags [S.], cksum 0x3a67 (correct), seq 2162887358, ack 288503684, win 28960, options [mss 1460,sackOK,TS val 278415535 ecr 278417013,nop,wscale 7], length 0
1527817687.723206 IP (tos 0x0, ttl 64, id 31223, offset 0, flags [DF], proto TCP (6), length 52)
    rpi33.lan.54550 > rpi35.lan.46656: Flags [.], cksum 0x8483 (incorrect -> 0xd96e), ack 1, win 229, options [nop,nop,TS val 278417013 ecr 278415535], length 0
1527817687.735883 IP (tos 0x0, ttl 64, id 31224, offset 0, flags [DF], proto TCP (6), length 86)
    rpi33.lan.54550 > rpi35.lan.46656: Flags [P.], cksum 0x84a5 (incorrect -> 0xd508), seq 1:35, ack 1, win 229, options [nop,nop,TS val 278417015 ecr 278415535], length 34
1527817687.736428 IP (tos 0x0, ttl 64, id 16912, offset 0, flags [DF], proto TCP (6), length 52)
    rpi35.lan.46656 > rpi33.lan.54550: Flags [.], cksum 0xd94a (correct), ack 35, win 227, options [nop,nop,TS val 278415537 ecr 278417015], length 0
1527817691.733897 IP (tos 0x0, ttl 64, id 39206, offset 0, flags [DF], proto TCP (6), length 60)
    rpi33.lan.42554 > rpi40.lan.46656: Flags [S], cksum 0x8490 (incorrect -> 0x527b), seq 2027473184, win 29200, options [mss 1460,sackOK,TS val 278417414 ecr 0,nop,wscale 7], length 0
1527817691.734588 IP (tos 0x0, ttl 64, id 0, offset 0, flags [DF], proto TCP (6), length 60)
    rpi40.lan.46656 > rpi33.lan.42554: Flags [S.], cksum 0x2040 (correct), seq 3065717823, ack 2027473185, win 28960, options [mss 1460,sackOK,TS val 278415239 ecr 278417414,nop,wscale 7], length 0
1527817691.734715 IP (tos 0x0, ttl 64, id 39207, offset 0, flags [DF], proto TCP (6), length 52)
    rpi33.lan.42554 > rpi40.lan.46656: Flags [.], cksum 0x8488 (incorrect -> 0xbf46), ack 1, win 229, options [nop,nop,TS val 278417415 ecr 278415239], length 0
1527817691.748965 IP (tos 0x0, ttl 64, id 39208, offset 0, flags [DF], proto TCP (6), length 86)
    rpi33.lan.42554 > rpi40.lan.46656: Flags [P.], cksum 0x84aa (incorrect -> 0x94ee), seq 1:35, ack 1, win 229, options [nop,nop,TS val 278417416 ecr 278415239], length 34
1527817691.749525 IP (tos 0x0, ttl 64, id 25543, offset 0, flags [DF], proto TCP (6), length 52)
    rpi40.lan.46656 > rpi33.lan.42554: Flags [.], cksum 0xbf23 (correct), ack 35, win 227, options [nop,nop,TS val 278415241 ecr 278417416], length 0
1527817694.446951 IP (tos 0x0, ttl 64, id 17701, offset 0, flags [DF], proto TCP (6), length 52)
    rpi33.lan.39920 > rpi38.lan.46656: Flags [F.], cksum 0x8486 (incorrect -> 0x87e4), seq 35, ack 1, win 229, options [nop,nop,TS val 278417686 ecr 278414220], length 0
1527817694.496493 IP (tos 0x0, ttl 64, id 54470, offset 0, flags [DF], proto TCP (6), length 52)
    rpi38.lan.46656 > rpi33.lan.39920: Flags [.], cksum 0x8012 (correct), ack 36, win 227, options [nop,nop,TS val 278416224 ecr 278417686], length 0
1527817700.298577 IP (tos 0x0, ttl 64, id 55279, offset 0, flags [DF], proto TCP (6), length 52)
    rpi42.lan.47088 > rpi33.lan.46656: Flags [F.], cksum 0x3f00 (correct), seq 35, ack 1, win 229, options [nop,nop,TS val 278418251 ecr 278416272], length 0
1527817700.344497 IP (tos 0x0, ttl 64, id 20539, offset 0, flags [DF], proto TCP (6), length 52)
    rpi33.lan.46656 > rpi42.lan.47088: Flags [.], cksum 0x848a (incorrect -> 0x372e), ack 36, win 227, options [nop,nop,TS val 278418276 ecr 278418251], length 0
1527817700.900648 IP (tos 0x0, ttl 64, id 38265, offset 0, flags [DF], proto TCP (6), length 52)
    rpi33.lan.39888 > rpi37.lan.46656: Flags [F.], cksum 0x8485 (incorrect -> 0x4400), seq 35, ack 1, win 229, options [nop,nop,TS val 278418331 ecr 278416317], length 0
1527817700.951044 IP (tos 0x0, ttl 64, id 35361, offset 0, flags [DF], proto TCP (6), length 52)
    rpi37.lan.46656 > rpi33.lan.39888: Flags [.], cksum 0x3c2e (correct), ack 36, win 227, options [nop,nop,TS val 278418321 ecr 278418331], length 0
1527817701.557380 IP (tos 0x0, ttl 64, id 52439, offset 0, flags [DF], proto TCP (6), length 52)
    rpi33.lan.60286 > rpi36.lan.46656: Flags [F.], cksum 0x8484 (incorrect -> 0x09fc), seq 35, ack 1, win 229, options [nop,nop,TS val 278418397 ecr 278416398], length 0
1527817701.606816 IP (tos 0x0, ttl 64, id 6493, offset 0, flags [DF], proto TCP (6), length 52)
    rpi36.lan.46656 > rpi33.lan.60286: Flags [.], cksum 0x022a (correct), ack 36, win 227, options [nop,nop,TS val 278418402 ecr 278418397], length 0
1527817701.686485 IP (tos 0x0, ttl 64, id 24631, offset 0, flags [DF], proto TCP (6), length 60)
    rpi33.lan.39984 > rpi38.lan.46656: Flags [S], cksum 0x848e (incorrect -> 0x26a4), seq 1075524573, win 29200, options [mss 1460,sackOK,TS val 278418410 ecr 0,nop,wscale 7], length 0
1527817701.687196 IP (tos 0x0, ttl 64, id 0, offset 0, flags [DF], proto TCP (6), length 60)
    rpi38.lan.46656 > rpi33.lan.39984: Flags [S.], cksum 0xcc25 (correct), seq 1778619026, ack 1075524574, win 28960, options [mss 1460,sackOK,TS val 278416943 ecr 278418410,nop,wscale 7], length 0
1527817701.687316 IP (tos 0x0, ttl 64, id 24632, offset 0, flags [DF], proto TCP (6), length 52)
    rpi33.lan.39984 > rpi38.lan.46656: Flags [.], cksum 0x8486 (incorrect -> 0x6b2d), ack 1, win 229, options [nop,nop,TS val 278418410 ecr 278416943], length 0
1527817701.699749 IP (tos 0x0, ttl 64, id 24633, offset 0, flags [DF], proto TCP (6), length 86)
    rpi33.lan.39984 > rpi38.lan.46656: Flags [P.], cksum 0x84a8 (incorrect -> 0x34f4), seq 1:35, ack 1, win 229, options [nop,nop,TS val 278418411 ecr 278416943], length 34
1527817701.700293 IP (tos 0x0, ttl 64, id 56508, offset 0, flags [DF], proto TCP (6), length 52)
    rpi38.lan.46656 > rpi33.lan.39984: Flags [.], cksum 0x6b0b (correct), ack 35, win 227, options [nop,nop,TS val 278416944 ecr 278418411], length 0
1527817704.320300 IP (tos 0x0, ttl 64, id 55958, offset 0, flags [DF], proto TCP (6), length 52)
    rpi41.lan.45800 > rpi33.lan.46656: Flags [F.], cksum 0x2290 (correct), seq 35, ack 1, win 229, options [nop,nop,TS val 1569057222 ecr 278416674], length 0
1527817704.364504 IP (tos 0x0, ttl 64, id 45164, offset 0, flags [DF], proto TCP (6), length 52)
    rpi33.lan.46656 > rpi41.lan.45800: Flags [.], cksum 0x8489 (incorrect -> 0x1abe), ack 36, win 227, options [nop,nop,TS val 278418678 ecr 1569057222], length 0
1527817706.842674 IP (tos 0x0, ttl 64, id 28733, offset 0, flags [DF], proto TCP (6), length 60)
    rpi42.lan.47092 > rpi33.lan.46656: Flags [S], cksum 0xac38 (correct), seq 2864981479, win 29200, options [mss 1460,sackOK,TS val 278418906 ecr 0,nop,wscale 7], length 0
1527817706.842836 IP (tos 0x0, ttl 64, id 0, offset 0, flags [DF], proto TCP (6), length 60)
    rpi33.lan.46656 > rpi42.lan.47092: Flags [S.], cksum 0x8492 (incorrect -> 0x1ae6), seq 4043586215, ack 2864981480, win 28960, options [mss 1460,sackOK,TS val 278418925 ecr 278418906,nop,wscale 7], length 0
1527817706.843415 IP (tos 0x0, ttl 64, id 28734, offset 0, flags [DF], proto TCP (6), length 52)
    rpi42.lan.47092 > rpi33.lan.46656: Flags [.], cksum 0xb9ed (correct), ack 1, win 229, options [nop,nop,TS val 278418906 ecr 278418925], length 0
1527817706.855999 IP (tos 0x0, ttl 64, id 28735, offset 0, flags [DF], proto TCP (6), length 86)
    rpi42.lan.47092 > rpi33.lan.46656: Flags [P.], cksum 0x29c3 (correct), seq 1:35, ack 1, win 229, options [nop,nop,TS val 278418907 ecr 278418925], length 34
1527817706.856061 IP (tos 0x0, ttl 64, id 28485, offset 0, flags [DF], proto TCP (6), length 52)
    rpi33.lan.46656 > rpi42.lan.47092: Flags [.], cksum 0x848a (incorrect -> 0xb9ca), ack 35, win 227, options [nop,nop,TS val 278418927 ecr 278418907], length 0
1527817707.723926 IP (tos 0x0, ttl 64, id 31225, offset 0, flags [DF], proto TCP (6), length 52)
    rpi33.lan.54550 > rpi35.lan.46656: Flags [F.], cksum 0x8483 (incorrect -> 0xd179), seq 35, ack 1, win 229, options [nop,nop,TS val 278419013 ecr 278415537], length 0
1527817707.766233 IP (tos 0x0, ttl 64, id 16913, offset 0, flags [DF], proto TCP (6), length 52)
    rpi35.lan.46656 > rpi33.lan.54550: Flags [.], cksum 0xc9a8 (correct), ack 36, win 227, options [nop,nop,TS val 278417540 ecr 278419013], length 0
1527817708.434861 IP (tos 0x0, ttl 64, id 53200, offset 0, flags [DF], proto TCP (6), length 60)
    rpi33.lan.60348 > rpi36.lan.46656: Flags [S], cksum 0x848c (incorrect -> 0x1284), seq 2626525533, win 29200, options [mss 1460,sackOK,TS val 278419085 ecr 0,nop,wscale 7], length 0
1527817708.435555 IP (tos 0x0, ttl 64, id 0, offset 0, flags [DF], proto TCP (6), length 60)
    rpi36.lan.46656 > rpi33.lan.60348: Flags [S.], cksum 0xda33 (correct), seq 3423536635, ack 2626525534, win 28960, options [mss 1460,sackOK,TS val 278419084 ecr 278419085,nop,wscale 7], length 0
1527817708.435685 IP (tos 0x0, ttl 64, id 53201, offset 0, flags [DF], proto TCP (6), length 52)
    rpi33.lan.60348 > rpi36.lan.46656: Flags [.], cksum 0x8484 (incorrect -> 0x793b), ack 1, win 229, options [nop,nop,TS val 278419085 ecr 278419084], length 0
1527817708.448268 IP (tos 0x0, ttl 64, id 53202, offset 0, flags [DF], proto TCP (6), length 86)
    rpi33.lan.60348 > rpi36.lan.46656: Flags [P.], cksum 0x84a6 (incorrect -> 0x0575), seq 1:35, ack 1, win 229, options [nop,nop,TS val 278419086 ecr 278419084], length 34
1527817708.448798 IP (tos 0x0, ttl 64, id 21360, offset 0, flags [DF], proto TCP (6), length 52)
    rpi36.lan.46656 > rpi33.lan.60348: Flags [.], cksum 0x7918 (correct), ack 35, win 227, options [nop,nop,TS val 278419086 ecr 278419086], length 0
1527817708.594904 IP (tos 0x0, ttl 64, id 58952, offset 0, flags [DF], proto TCP (6), length 60)
    rpi33.lan.39956 > rpi37.lan.46656: Flags [S], cksum 0x848d (incorrect -> 0x97d5), seq 1331409109, win 29200, options [mss 1460,sackOK,TS val 278419101 ecr 0,nop,wscale 7], length 0
1527817708.595595 IP (tos 0x0, ttl 64, id 0, offset 0, flags [DF], proto TCP (6), length 60)
    rpi37.lan.46656 > rpi33.lan.39956: Flags [S.], cksum 0xf751 (correct), seq 964821179, ack 1331409110, win 28960, options [mss 1460,sackOK,TS val 278419085 ecr 278419101,nop,wscale 7], length 0
1527817708.595712 IP (tos 0x0, ttl 64, id 58953, offset 0, flags [DF], proto TCP (6), length 52)
    rpi33.lan.39956 > rpi37.lan.46656: Flags [.], cksum 0x8485 (incorrect -> 0x9659), ack 1, win 229, options [nop,nop,TS val 278419101 ecr 278419085], length 0
1527817708.609827 IP (tos 0x0, ttl 64, id 58954, offset 0, flags [DF], proto TCP (6), length 86)
    rpi33.lan.39956 > rpi37.lan.46656: Flags [P.], cksum 0x84a7 (incorrect -> 0x220f), seq 1:35, ack 1, win 229, options [nop,nop,TS val 278419102 ecr 278419085], length 34
1527817708.610373 IP (tos 0x0, ttl 64, id 22065, offset 0, flags [DF], proto TCP (6), length 52)
    rpi37.lan.46656 > rpi33.lan.39956: Flags [.], cksum 0x9637 (correct), ack 35, win 227, options [nop,nop,TS val 278419086 ecr 278419102], length 0
1527817709.731503 IP (tos 0x0, ttl 64, id 16124, offset 0, flags [DF], proto TCP (6), length 60)
    rpi41.lan.45810 > rpi33.lan.46656: Flags [S], cksum 0xf18b (correct), seq 845047808, win 29200, options [mss 1460,sackOK,TS val 1569062633 ecr 0,nop,wscale 7], length 0
1527817709.731726 IP (tos 0x0, ttl 64, id 0, offset 0, flags [DF], proto TCP (6), length 60)
    rpi33.lan.46656 > rpi41.lan.45810: Flags [S.], cksum 0x8491 (incorrect -> 0xa5aa), seq 2502905834, ack 845047809, win 28960, options [mss 1460,sackOK,TS val 278419214 ecr 1569062633,nop,wscale 7], length 0
1527817709.732255 IP (tos 0x0, ttl 64, id 16125, offset 0, flags [DF], proto TCP (6), length 52)
    rpi41.lan.45810 > rpi33.lan.46656: Flags [.], cksum 0x44b1 (correct), ack 1, win 229, options [nop,nop,TS val 1569062634 ecr 278419214], length 0
1527817709.744973 IP (tos 0x0, ttl 64, id 16126, offset 0, flags [DF], proto TCP (6), length 86)
    rpi41.lan.45810 > rpi33.lan.46656: Flags [P.], cksum 0x07a4 (correct), seq 1:35, ack 1, win 229, options [nop,nop,TS val 1569062647 ecr 278419214], length 34
1527817709.745069 IP (tos 0x0, ttl 64, id 6373, offset 0, flags [DF], proto TCP (6), length 52)
    rpi33.lan.46656 > rpi41.lan.45810: Flags [.], cksum 0x8489 (incorrect -> 0x4482), ack 35, win 227, options [nop,nop,TS val 278419216 ecr 1569062647], length 0
1527817711.735396 IP (tos 0x0, ttl 64, id 39209, offset 0, flags [DF], proto TCP (6), length 52)
    rpi33.lan.42554 > rpi40.lan.46656: Flags [F.], cksum 0x8488 (incorrect -> 0xb751), seq 35, ack 1, win 229, options [nop,nop,TS val 278419415 ecr 278415241], length 0
1527817711.778170 IP (tos 0x0, ttl 64, id 25544, offset 0, flags [DF], proto TCP (6), length 52)
    rpi40.lan.46656 > rpi33.lan.42554: Flags [.], cksum 0xaf80 (correct), ack 36, win 227, options [nop,nop,TS val 278417244 ecr 278419415], length 0
1527817712.807623 IP (tos 0x0, ttl 64, id 24729, offset 0, flags [DF], proto TCP (6), length 60)
    rpi33.lan.54610 > rpi35.lan.46656: Flags [S], cksum 0x848b (incorrect -> 0x4dd9), seq 3597678811, win 29200, options [mss 1460,sackOK,TS val 278419522 ecr 0,nop,wscale 7], length 0
1527817712.808323 IP (tos 0x0, ttl 64, id 0, offset 0, flags [DF], proto TCP (6), length 60)
    rpi35.lan.46656 > rpi33.lan.54610: Flags [S.], cksum 0xdee2 (correct), seq 2531227105, ack 3597678812, win 28960, options [mss 1460,sackOK,TS val 278418044 ecr 278419522,nop,wscale 7], length 0
1527817712.808451 IP (tos 0x0, ttl 64, id 24730, offset 0, flags [DF], proto TCP (6), length 52)
    rpi33.lan.54610 > rpi35.lan.46656: Flags [.], cksum 0x8483 (incorrect -> 0x7dea), ack 1, win 229, options [nop,nop,TS val 278419522 ecr 278418044], length 0
1527817712.820978 IP (tos 0x0, ttl 64, id 24731, offset 0, flags [DF], proto TCP (6), length 86)
    rpi33.lan.54610 > rpi35.lan.46656: Flags [P.], cksum 0x84a5 (incorrect -> 0xec7d), seq 1:35, ack 1, win 229, options [nop,nop,TS val 278419523 ecr 278418044], length 34
1527817712.821550 IP (tos 0x0, ttl 64, id 10142, offset 0, flags [DF], proto TCP (6), length 52)
    rpi35.lan.46656 > rpi33.lan.54610: Flags [.], cksum 0x7dc8 (correct), ack 35, win 227, options [nop,nop,TS val 278418045 ecr 278419523], length 0
1527817713.913015 IP (tos 0x0, ttl 64, id 49853, offset 0, flags [DF], proto TCP (6), length 1096)
    rpi34.lan.46656 > rpi33.lan.35744: Flags [P.], cksum 0x16ff (correct), seq 2088:3132, ack 2089, win 374, options [nop,nop,TS val 278419641 ecr 278413638], length 1044
1527817713.913188 IP (tos 0x0, ttl 64, id 780, offset 0, flags [DF], proto TCP (6), length 52)
    rpi33.lan.35744 > rpi34.lan.46656: Flags [.], cksum 0x8482 (incorrect -> 0x3d69), ack 3132, win 392, options [nop,nop,TS val 278419632 ecr 278419641], length 0
1527817713.913783 IP (tos 0x0, ttl 64, id 781, offset 0, flags [DF], proto TCP (6), length 1096)
    rpi33.lan.35744 > rpi34.lan.46656: Flags [P.], cksum 0x8896 (incorrect -> 0xc46f), seq 2089:3133, ack 3132, win 392, options [nop,nop,TS val 278419632 ecr 278419641], length 1044
1527817713.914031 IP (tos 0x0, ttl 64, id 782, offset 0, flags [DF], proto TCP (6), length 1096)
    rpi33.lan.35744 > rpi34.lan.46656: Flags [P.], cksum 0x8896 (incorrect -> 0x3c4e), seq 3133:4177, ack 3132, win 392, options [nop,nop,TS val 278419632 ecr 278419641], length 1044
1527817713.914787 IP (tos 0x0, ttl 64, id 49854, offset 0, flags [DF], proto TCP (6), length 52)
    rpi34.lan.46656 > rpi33.lan.35744: Flags [.], cksum 0x3533 (correct), ack 4177, win 406, options [nop,nop,TS val 278419641 ecr 278419632], length 0
1527817713.915420 IP (tos 0x0, ttl 64, id 49855, offset 0, flags [DF], proto TCP (6), length 1096)
    rpi34.lan.46656 > rpi33.lan.35744: Flags [P.], cksum 0x5347 (correct), seq 3132:4176, ack 4177, win 406, options [nop,nop,TS val 278419641 ecr 278419632], length 1044
1527817713.964493 IP (tos 0x0, ttl 64, id 783, offset 0, flags [DF], proto TCP (6), length 52)
    rpi33.lan.35744 > rpi34.lan.46656: Flags [.], cksum 0x8482 (incorrect -> 0x3117), ack 4176, win 408, options [nop,nop,TS val 278419638 ecr 278419641], length 0
1527817718.012626 IP (tos 0x0, ttl 64, id 41781, offset 0, flags [DF], proto TCP (6), length 60)
    rpi33.lan.42616 > rpi40.lan.46656: Flags [S], cksum 0x8490 (incorrect -> 0x6f34), seq 557775231, win 29200, options [mss 1460,sackOK,TS val 278420042 ecr 0,nop,wscale 7], length 0
1527817718.013276 IP (tos 0x0, ttl 64, id 0, offset 0, flags [DF], proto TCP (6), length 60)
    rpi40.lan.46656 > rpi33.lan.42616: Flags [S.], cksum 0xc6a0 (correct), seq 3445651886, ack 557775232, win 28960, options [mss 1460,sackOK,TS val 278417867 ecr 278420042,nop,wscale 7], length 0
1527817718.013402 IP (tos 0x0, ttl 64, id 41782, offset 0, flags [DF], proto TCP (6), length 52)
    rpi33.lan.42616 > rpi40.lan.46656: Flags [.], cksum 0x8488 (incorrect -> 0x65a8), ack 1, win 229, options [nop,nop,TS val 278420042 ecr 278417867], length 0
1527817718.025885 IP (tos 0x0, ttl 64, id 41783, offset 0, flags [DF], proto TCP (6), length 86)
    rpi33.lan.42616 > rpi40.lan.46656: Flags [P.], cksum 0x84aa (incorrect -> 0x038a), seq 1:35, ack 1, win 229, options [nop,nop,TS val 278420044 ecr 278417867], length 34
1527817718.026421 IP (tos 0x0, ttl 64, id 10340, offset 0, flags [DF], proto TCP (6), length 52)
    rpi40.lan.46656 > rpi33.lan.42616: Flags [.], cksum 0x6585 (correct), ack 35, win 227, options [nop,nop,TS val 278417868 ecr 278420044], length 0
1527817720.041982 IP (tos 0x0, ttl 64, id 16266, offset 0, flags [DF], proto TCP (6), length 1096)
    rpi33.lan.46656 > rpi39.lan.47498: Flags [P.], cksum 0x6fb0 (correct), seq 2088:3132, ack 2089, win 374, options [nop,nop,TS val 278420245 ecr 278414245], length 1044
1527817720.042900 IP (tos 0x0, ttl 64, id 34928, offset 0, flags [DF], proto TCP (6), length 1096)
    rpi39.lan.47498 > rpi33.lan.46656: Flags [P.], cksum 0xf5a9 (correct), seq 2089:3133, ack 2088, win 375, options [nop,nop,TS val 278420245 ecr 278414249], length 1044
1527817720.042903 IP (tos 0x0, ttl 64, id 34929, offset 0, flags [DF], proto TCP (6), length 52)
    rpi39.lan.47498 > rpi33.lan.46656: Flags [.], cksum 0x17d6 (correct), ack 3132, win 392, options [nop,nop,TS val 278420245 ecr 278420245], length 0
1527817720.043499 IP (tos 0x0, ttl 64, id 16267, offset 0, flags [DF], proto TCP (6), length 1096)
    rpi33.lan.46656 > rpi39.lan.47498: Flags [P.], cksum 0x8af4 (correct), seq 3132:4176, ack 3133, win 390, options [nop,nop,TS val 278420245 ecr 278420245], length 1044
1527817720.043663 IP (tos 0x0, ttl 64, id 34930, offset 0, flags [DF], proto TCP (6), length 1096)
    rpi39.lan.47498 > rpi33.lan.46656: Flags [P.], cksum 0xb881 (correct), seq 3133:4177, ack 3132, win 392, options [nop,nop,TS val 278420245 ecr 278420245], length 1044
1527817720.084500 IP (tos 0x0, ttl 64, id 16268, offset 0, flags [DF], proto TCP (6), length 52)
    rpi33.lan.46656 > rpi39.lan.47498: Flags [.], cksum 0x8487 (incorrect -> 0x0f9b), ack 4177, win 406, options [nop,nop,TS val 278420250 ecr 278420245], length 0
1527817720.085030 IP (tos 0x0, ttl 64, id 34931, offset 0, flags [DF], proto TCP (6), length 52)
    rpi39.lan.47498 > rpi33.lan.46656: Flags [.], cksum 0x0f99 (correct), ack 4176, win 408, options [nop,nop,TS val 278420250 ecr 278420245], length 0
1527817721.687882 IP (tos 0x0, ttl 64, id 24634, offset 0, flags [DF], proto TCP (6), length 52)
    rpi33.lan.39984 > rpi38.lan.46656: Flags [F.], cksum 0x8486 (incorrect -> 0x6339), seq 35, ack 1, win 229, options [nop,nop,TS val 278420410 ecr 278416944], length 0
1527817721.736470 IP (tos 0x0, ttl 64, id 56509, offset 0, flags [DF], proto TCP (6), length 52)
    rpi38.lan.46656 > rpi33.lan.39984: Flags [.], cksum 0x5b67 (correct), ack 36, win 227, options [nop,nop,TS val 278418948 ecr 278420410], length 0
1527817726.844002 IP (tos 0x0, ttl 64, id 28736, offset 0, flags [DF], proto TCP (6), length 52)
    rpi42.lan.47092 > rpi33.lan.46656: Flags [F.], cksum 0xb1f8 (correct), seq 35, ack 1, win 229, options [nop,nop,TS val 278420906 ecr 278418927], length 0
1527817726.884507 IP (tos 0x0, ttl 64, id 28486, offset 0, flags [DF], proto TCP (6), length 52)
    rpi33.lan.46656 > rpi42.lan.47092: Flags [.], cksum 0x848a (incorrect -> 0xaa27), ack 36, win 227, options [nop,nop,TS val 278420930 ecr 278420906], length 0
1527817728.436348 IP (tos 0x0, ttl 64, id 53203, offset 0, flags [DF], proto TCP (6), length 52)
    rpi33.lan.60348 > rpi36.lan.46656: Flags [F.], cksum 0x8484 (incorrect -> 0x7146), seq 35, ack 1, win 229, options [nop,nop,TS val 278421085 ecr 278419086], length 0
1527817728.486778 IP (tos 0x0, ttl 64, id 21361, offset 0, flags [DF], proto TCP (6), length 52)
    rpi36.lan.46656 > rpi33.lan.60348: Flags [.], cksum 0x6974 (correct), ack 36, win 227, options [nop,nop,TS val 278421090 ecr 278421085], length 0
1527817728.596253 IP (tos 0x0, ttl 64, id 58955, offset 0, flags [DF], proto TCP (6), length 52)
    rpi33.lan.39956 > rpi37.lan.46656: Flags [F.], cksum 0x8485 (incorrect -> 0x8e65), seq 35, ack 1, win 229, options [nop,nop,TS val 278421101 ecr 278419086], length 0
1527817728.641044 IP (tos 0x0, ttl 64, id 22066, offset 0, flags [DF], proto TCP (6), length 52)
    rpi37.lan.46656 > rpi33.lan.39956: Flags [.], cksum 0x8693 (correct), ack 36, win 227, options [nop,nop,TS val 278421090 ecr 278421101], length 0
1527817728.794098 IP (tos 0x0, ttl 64, id 51007, offset 0, flags [DF], proto TCP (6), length 60)
    rpi33.lan.40048 > rpi38.lan.46656: Flags [S], cksum 0x848e (incorrect -> 0xfff2), seq 4128479679, win 29200, options [mss 1460,sackOK,TS val 278421120 ecr 0,nop,wscale 7], length 0
1527817728.794813 IP (tos 0x0, ttl 64, id 0, offset 0, flags [DF], proto TCP (6), length 60)
    rpi38.lan.46656 > rpi33.lan.40048: Flags [S.], cksum 0xe21d (correct), seq 1881425202, ack 4128479680, win 28960, options [mss 1460,sackOK,TS val 278419653 ecr 278421120,nop,wscale 7], length 0
1527817728.794941 IP (tos 0x0, ttl 64, id 51008, offset 0, flags [DF], proto TCP (6), length 52)
    rpi33.lan.40048 > rpi38.lan.46656: Flags [.], cksum 0x8486 (incorrect -> 0x8124), ack 1, win 229, options [nop,nop,TS val 278421121 ecr 278419653], length 0
1527817728.809358 IP (tos 0x0, ttl 64, id 51009, offset 0, flags [DF], proto TCP (6), length 86)
    rpi33.lan.40048 > rpi38.lan.46656: Flags [P.], cksum 0x84a8 (incorrect -> 0xe8ce), seq 1:35, ack 1, win 229, options [nop,nop,TS val 278421122 ecr 278419653], length 34
1527817728.809895 IP (tos 0x0, ttl 64, id 7670, offset 0, flags [DF], proto TCP (6), length 52)
    rpi38.lan.46656 > rpi33.lan.40048: Flags [.], cksum 0x8101 (correct), ack 35, win 227, options [nop,nop,TS val 278419655 ecr 278421122], length 0
1527817729.733481 IP (tos 0x0, ttl 64, id 16127, offset 0, flags [DF], proto TCP (6), length 52)
    rpi41.lan.45810 > rpi33.lan.46656: Flags [F.], cksum 0xf669 (correct), seq 35, ack 1, win 229, options [nop,nop,TS val 1569082636 ecr 278419216], length 0
1527817729.774519 IP (tos 0x0, ttl 64, id 6374, offset 0, flags [DF], proto TCP (6), length 52)
    rpi33.lan.46656 > rpi41.lan.45810: Flags [.], cksum 0x8489 (incorrect -> 0xee98), ack 36, win 227, options [nop,nop,TS val 278421219 ecr 1569082636], length 0
1527817732.808961 IP (tos 0x0, ttl 64, id 24732, offset 0, flags [DF], proto TCP (6), length 52)
    rpi33.lan.54610 > rpi35.lan.46656: Flags [F.], cksum 0x8483 (incorrect -> 0x75f6), seq 35, ack 1, win 229, options [nop,nop,TS val 278421522 ecr 278418045], length 0
1527817732.856209 IP (tos 0x0, ttl 64, id 10143, offset 0, flags [DF], proto TCP (6), length 52)
    rpi35.lan.46656 > rpi33.lan.54610: Flags [.], cksum 0x6e24 (correct), ack 36, win 227, options [nop,nop,TS val 278420049 ecr 278421522], length 0
1527817733.985364 IP (tos 0x0, ttl 64, id 47352, offset 0, flags [DF], proto TCP (6), length 60)
    rpi42.lan.47096 > rpi33.lan.46656: Flags [S], cksum 0xae15 (correct), seq 3953383564, win 29200, options [mss 1460,sackOK,TS val 278421620 ecr 0,nop,wscale 7], length 0
1527817733.985611 IP (tos 0x0, ttl 64, id 0, offset 0, flags [DF], proto TCP (6), length 60)
    rpi33.lan.46656 > rpi42.lan.47096: Flags [S.], cksum 0x8492 (incorrect -> 0xf09c), seq 3394208487, ack 3953383565, win 28960, options [mss 1460,sackOK,TS val 278421640 ecr 278421620,nop,wscale 7], length 0
1527817733.986210 IP (tos 0x0, ttl 64, id 47353, offset 0, flags [DF], proto TCP (6), length 52)
    rpi42.lan.47096 > rpi33.lan.46656: Flags [.], cksum 0x8fa4 (correct), ack 1, win 229, options [nop,nop,TS val 278421620 ecr 278421640], length 0
1527817733.998861 IP (tos 0x0, ttl 64, id 47354, offset 0, flags [DF], proto TCP (6), length 86)
    rpi42.lan.47096 > rpi33.lan.46656: Flags [P.], cksum 0xbb03 (correct), seq 1:35, ack 1, win 229, options [nop,nop,TS val 278421621 ecr 278421640], length 34
1527817733.998926 IP (tos 0x0, ttl 64, id 57952, offset 0, flags [DF], proto TCP (6), length 52)
    rpi33.lan.46656 > rpi42.lan.47096: Flags [.], cksum 0x848a (incorrect -> 0x8f82), ack 35, win 227, options [nop,nop,TS val 278421641 ecr 278421621], length 0
1527817734.518581 IP (tos 0x0, ttl 64, id 42715, offset 0, flags [DF], proto TCP (6), length 60)
    rpi33.lan.40016 > rpi37.lan.46656: Flags [S], cksum 0x848d (incorrect -> 0x1df2), seq 2840708710, win 29200, options [mss 1460,sackOK,TS val 278421693 ecr 0,nop,wscale 7], length 0
1527817734.519233 IP (tos 0x0, ttl 64, id 0, offset 0, flags [DF], proto TCP (6), length 60)
    rpi37.lan.46656 > rpi33.lan.40016: Flags [S.], cksum 0x0b71 (correct), seq 349932863, ack 2840708711, win 28960, options [mss 1460,sackOK,TS val 278421677 ecr 278421693,nop,wscale 7], length 0
1527817734.519351 IP (tos 0x0, ttl 64, id 42716, offset 0, flags [DF], proto TCP (6), length 52)
    rpi33.lan.40016 > rpi37.lan.46656: Flags [.], cksum 0x8485 (incorrect -> 0xaa78), ack 1, win 229, options [nop,nop,TS val 278421693 ecr 278421677], length 0
1527817734.531904 IP (tos 0x0, ttl 64, id 42717, offset 0, flags [DF], proto TCP (6), length 86)
    rpi33.lan.40016 > rpi37.lan.46656: Flags [P.], cksum 0x84a7 (incorrect -> 0xaa0c), seq 1:35, ack 1, win 229, options [nop,nop,TS val 278421694 ecr 278421677], length 34
1527817734.532424 IP (tos 0x0, ttl 64, id 60909, offset 0, flags [DF], proto TCP (6), length 52)
    rpi37.lan.46656 > rpi33.lan.40016: Flags [.], cksum 0xaa55 (correct), ack 35, win 227, options [nop,nop,TS val 278421679 ecr 278421694], length 0
1527817735.107580 IP (tos 0x0, ttl 64, id 27287, offset 0, flags [DF], proto TCP (6), length 60)
    rpi41.lan.45818 > rpi33.lan.46656: Flags [S], cksum 0xff74 (correct), seq 517671537, win 29200, options [mss 1460,sackOK,TS val 1569088010 ecr 0,nop,wscale 7], length 0
1527817735.107800 IP (tos 0x0, ttl 64, id 0, offset 0, flags [DF], proto TCP (6), length 60)
    rpi33.lan.46656 > rpi41.lan.45818: Flags [S.], cksum 0x8491 (incorrect -> 0x8511), seq 3366338827, ack 517671538, win 28960, options [mss 1460,sackOK,TS val 278421752 ecr 1569088010,nop,wscale 7], length 0
1527817735.108374 IP (tos 0x0, ttl 64, id 27288, offset 0, flags [DF], proto TCP (6), length 52)
    rpi41.lan.45818 > rpi33.lan.46656: Flags [.], cksum 0x2418 (correct), ack 1, win 229, options [nop,nop,TS val 1569088011 ecr 278421752], length 0
1527817735.120900 IP (tos 0x0, ttl 64, id 27289, offset 0, flags [DF], proto TCP (6), length 86)
    rpi41.lan.45818 > rpi33.lan.46656: Flags [P.], cksum 0xb493 (correct), seq 1:35, ack 1, win 229, options [nop,nop,TS val 1569088023 ecr 278421752], length 34
1527817735.120970 IP (tos 0x0, ttl 64, id 8692, offset 0, flags [DF], proto TCP (6), length 52)
    rpi33.lan.46656 > rpi41.lan.45818: Flags [.], cksum 0x8489 (incorrect -> 0x23eb), ack 35, win 227, options [nop,nop,TS val 278421753 ecr 1569088023], length 0
1527817736.304853 IP (tos 0x0, ttl 64, id 30092, offset 0, flags [DF], proto TCP (6), length 60)
    rpi33.lan.60412 > rpi36.lan.46656: Flags [S], cksum 0x848c (incorrect -> 0x9344), seq 2500531452, win 29200, options [mss 1460,sackOK,TS val 278421872 ecr 0,nop,wscale 7], length 0
1527817736.305613 IP (tos 0x0, ttl 64, id 0, offset 0, flags [DF], proto TCP (6), length 60)
    rpi36.lan.46656 > rpi33.lan.60412: Flags [S.], cksum 0x2c1c (correct), seq 3869970260, ack 2500531453, win 28960, options [mss 1460,sackOK,TS val 278421871 ecr 278421872,nop,wscale 7], length 0
1527817736.305748 IP (tos 0x0, ttl 64, id 30093, offset 0, flags [DF], proto TCP (6), length 52)
    rpi33.lan.60412 > rpi36.lan.46656: Flags [.], cksum 0x8484 (incorrect -> 0xcb23), ack 1, win 229, options [nop,nop,TS val 278421872 ecr 278421871], length 0
1527817736.318313 IP (tos 0x0, ttl 64, id 30094, offset 0, flags [DF], proto TCP (6), length 86)
    rpi33.lan.60412 > rpi36.lan.46656: Flags [P.], cksum 0x84a6 (incorrect -> 0x13a1), seq 1:35, ack 1, win 229, options [nop,nop,TS val 278421873 ecr 278421871], length 34
1527817736.318869 IP (tos 0x0, ttl 64, id 28218, offset 0, flags [DF], proto TCP (6), length 52)
    rpi36.lan.46656 > rpi33.lan.60412: Flags [.], cksum 0xcb00 (correct), ack 35, win 227, options [nop,nop,TS val 278421873 ecr 278421873], length 0
1527817738.013929 IP (tos 0x0, ttl 64, id 41784, offset 0, flags [DF], proto TCP (6), length 52)
    rpi33.lan.42616 > rpi40.lan.46656: Flags [F.], cksum 0x8488 (incorrect -> 0x5db4), seq 35, ack 1, win 229, options [nop,nop,TS val 278422042 ecr 278417868], length 0
1527817738.058163 IP (tos 0x0, ttl 64, id 10341, offset 0, flags [DF], proto TCP (6), length 52)
    rpi40.lan.46656 > rpi33.lan.42616: Flags [.], cksum 0x55e2 (correct), ack 36, win 227, options [nop,nop,TS val 278419872 ecr 278422042], length 0
1527817739.215091 IP (tos 0x0, ttl 64, id 48108, offset 0, flags [DF], proto TCP (6), length 60)
    rpi33.lan.54664 > rpi35.lan.46656: Flags [S], cksum 0x848b (incorrect -> 0xd38a), seq 2777930111, win 29200, options [mss 1460,sackOK,TS val 278422163 ecr 0,nop,wscale 7], length 0
1527817739.215692 IP (tos 0x0, ttl 64, id 0, offset 0, flags [DF], proto TCP (6), length 60)
    rpi35.lan.46656 > rpi33.lan.54664: Flags [S.], cksum 0x8621 (correct), seq 3107530666, ack 2777930112, win 28960, options [mss 1460,sackOK,TS val 278420684 ecr 278422163,nop,wscale 7], length 0
1527817739.215819 IP (tos 0x0, ttl 64, id 48109, offset 0, flags [DF], proto TCP (6), length 52)
    rpi33.lan.54664 > rpi35.lan.46656: Flags [.], cksum 0x8483 (incorrect -> 0x2529), ack 1, win 229, options [nop,nop,TS val 278422163 ecr 278420684], length 0
1527817739.228399 IP (tos 0x0, ttl 64, id 48110, offset 0, flags [DF], proto TCP (6), length 86)
    rpi33.lan.54664 > rpi35.lan.46656: Flags [P.], cksum 0x84a5 (incorrect -> 0x15f1), seq 1:35, ack 1, win 229, options [nop,nop,TS val 278422164 ecr 278420684], length 34
1527817739.228930 IP (tos 0x0, ttl 64, id 31590, offset 0, flags [DF], proto TCP (6), length 52)
    rpi35.lan.46656 > rpi33.lan.54664: Flags [.], cksum 0x2506 (correct), ack 35, win 227, options [nop,nop,TS val 278420686 ecr 278422164], length 0
1527817743.760573 IP (tos 0x0, ttl 64, id 22284, offset 0, flags [DF], proto TCP (6), length 60)
    rpi33.lan.42660 > rpi40.lan.46656: Flags [S], cksum 0x8490 (incorrect -> 0xf7b2), seq 1420768085, win 29200, options [mss 1460,sackOK,TS val 278422617 ecr 0,nop,wscale 7], length 0
1527817743.761267 IP (tos 0x0, ttl 64, id 0, offset 0, flags [DF], proto TCP (6), length 60)
    rpi40.lan.46656 > rpi33.lan.42660: Flags [S.], cksum 0x0ad2 (correct), seq 2191457966, ack 1420768086, win 28960, options [mss 1460,sackOK,TS val 278420442 ecr 278422617,nop,wscale 7], length 0
1527817743.761417 IP (tos 0x0, ttl 64, id 22285, offset 0, flags [DF], proto TCP (6), length 52)
    rpi33.lan.42660 > rpi40.lan.46656: Flags [.], cksum 0x8488 (incorrect -> 0xa9d9), ack 1, win 229, options [nop,nop,TS val 278422617 ecr 278420442], length 0
1527817743.773997 IP (tos 0x0, ttl 64, id 22286, offset 0, flags [DF], proto TCP (6), length 86)
    rpi33.lan.42660 > rpi40.lan.46656: Flags [P.], cksum 0x84aa (incorrect -> 0xfcba), seq 1:35, ack 1, win 229, options [nop,nop,TS val 278422618 ecr 278420442], length 34
1527817743.774533 IP (tos 0x0, ttl 64, id 42357, offset 0, flags [DF], proto TCP (6), length 52)
    rpi40.lan.46656 > rpi33.lan.42660: Flags [.], cksum 0xa9b7 (correct), ack 35, win 227, options [nop,nop,TS val 278420443 ecr 278422618], length 0

