1527817543.801144 IP (tos 0x0, ttl 64, id 49607, offset 0, flags [DF], proto TCP (6), length 60)
    rpi33.lan.39586 > rpi38.lan.46656: Flags [S], cksum 0x848e (incorrect -> 0x956f), seq 1819138042, win 29200, options [mss 1460,sackOK,TS val 278402621 ecr 0,nop,wscale 7], length 0
1527817543.801885 IP (tos 0x0, ttl 64, id 0, offset 0, flags [DF], proto TCP (6), length 60)
    rpi38.lan.46656 > rpi33.lan.39586: Flags [S.], cksum 0x887b (correct), seq 3797682780, ack 1819138043, win 28960, options [mss 1460,sackOK,TS val 278401154 ecr 278402621,nop,wscale 7], length 0
1527817543.802006 IP (tos 0x0, ttl 64, id 49608, offset 0, flags [DF], proto TCP (6), length 52)
    rpi33.lan.39586 > rpi38.lan.46656: Flags [.], cksum 0x8486 (incorrect -> 0x2783), ack 1, win 229, options [nop,nop,TS val 278402621 ecr 278401154], length 0
1527817543.814671 IP (tos 0x0, ttl 64, id 49609, offset 0, flags [DF], proto TCP (6), length 86)
    rpi33.lan.39586 > rpi38.lan.46656: Flags [P.], cksum 0x84a8 (incorrect -> 0xce1d), seq 1:35, ack 1, win 229, options [nop,nop,TS val 278402623 ecr 278401154], length 34
1527817543.815210 IP (tos 0x0, ttl 64, id 6879, offset 0, flags [DF], proto TCP (6), length 52)
    rpi38.lan.46656 > rpi33.lan.39586: Flags [.], cksum 0x2760 (correct), ack 35, win 227, options [nop,nop,TS val 278401155 ecr 278402623], length 0
1527817546.964412 IP (tos 0x0, ttl 64, id 23536, offset 0, flags [DF], proto TCP (6), length 52)
    rpi33.lan.54180 > rpi35.lan.46656: Flags [F.], cksum 0x8483 (incorrect -> 0x7f6a), seq 2271499367, ack 2359508269, win 229, options [nop,nop,TS val 278402937 ecr 278399461], length 0
1527817547.006198 IP (tos 0x0, ttl 64, id 13519, offset 0, flags [DF], proto TCP (6), length 52)
    rpi35.lan.46656 > rpi33.lan.54180: Flags [.], cksum 0x7799 (correct), ack 1, win 227, options [nop,nop,TS val 278401464 ecr 278402937], length 0
1527817547.197410 IP (tos 0x0, ttl 64, id 36826, offset 0, flags [DF], proto TCP (6), length 52)
    rpi41.lan.45742 > rpi33.lan.46656: Flags [F.], cksum 0x0b93 (correct), seq 2508357787, ack 24011654, win 229, options [nop,nop,TS val 1568900098 ecr 278400962], length 0
1527817547.244513 IP (tos 0x0, ttl 64, id 27720, offset 0, flags [DF], proto TCP (6), length 52)
    rpi33.lan.46656 > rpi41.lan.45742: Flags [.], cksum 0x8489 (incorrect -> 0x03c1), ack 1, win 227, options [nop,nop,TS val 278402966 ecr 1568900098], length 0
1527817547.656872 IP (tos 0x0, ttl 64, id 38124, offset 0, flags [DF], proto TCP (6), length 60)
    rpi33.lan.59936 > rpi36.lan.46656: Flags [S], cksum 0x848c (incorrect -> 0xb750), seq 1312129875, win 29200, options [mss 1460,sackOK,TS val 278403007 ecr 0,nop,wscale 7], length 0
1527817547.657490 IP (tos 0x0, ttl 64, id 0, offset 0, flags [DF], proto TCP (6), length 60)
    rpi36.lan.46656 > rpi33.lan.59936: Flags [S.], cksum 0x90cb (correct), seq 3541052412, ack 1312129876, win 28960, options [mss 1460,sackOK,TS val 278403007 ecr 278403007,nop,wscale 7], length 0
1527817547.657617 IP (tos 0x0, ttl 64, id 38125, offset 0, flags [DF], proto TCP (6), length 52)
    rpi33.lan.59936 > rpi36.lan.46656: Flags [.], cksum 0x8484 (incorrect -> 0x2fd3), ack 1, win 229, options [nop,nop,TS val 278403007 ecr 278403007], length 0
1527817547.670090 IP (tos 0x0, ttl 64, id 38126, offset 0, flags [DF], proto TCP (6), length 86)
    rpi33.lan.59936 > rpi36.lan.46656: Flags [P.], cksum 0x84a6 (incorrect -> 0xc9b9), seq 1:35, ack 1, win 229, options [nop,nop,TS val 278403008 ecr 278403007], length 34
1527817547.670645 IP (tos 0x0, ttl 64, id 15426, offset 0, flags [DF], proto TCP (6), length 52)
    rpi36.lan.46656 > rpi33.lan.59936: Flags [.], cksum 0x2fb1 (correct), ack 35, win 227, options [nop,nop,TS val 278403008 ecr 278403008], length 0
1527817547.860923 IP (tos 0x0, ttl 64, id 62185, offset 0, flags [DF], proto TCP (6), length 60)
    rpi33.lan.39544 > rpi37.lan.46656: Flags [S], cksum 0x848d (incorrect -> 0x0116), seq 4061914426, win 29200, options [mss 1460,sackOK,TS val 278403027 ecr 0,nop,wscale 7], length 0
1527817547.861644 IP (tos 0x0, ttl 64, id 0, offset 0, flags [DF], proto TCP (6), length 60)
    rpi37.lan.46656 > rpi33.lan.39544: Flags [S.], cksum 0x4bce (correct), seq 2902646983, ack 4061914427, win 28960, options [mss 1460,sackOK,TS val 278403012 ecr 278403027,nop,wscale 7], length 0
1527817547.861775 IP (tos 0x0, ttl 64, id 62186, offset 0, flags [DF], proto TCP (6), length 52)
    rpi33.lan.39544 > rpi37.lan.46656: Flags [.], cksum 0x8485 (incorrect -> 0xead5), ack 1, win 229, options [nop,nop,TS val 278403027 ecr 278403012], length 0
1527817547.874512 IP (tos 0x0, ttl 64, id 62187, offset 0, flags [DF], proto TCP (6), length 86)
    rpi33.lan.39544 > rpi37.lan.46656: Flags [P.], cksum 0x84a7 (incorrect -> 0x26c0), seq 1:35, ack 1, win 229, options [nop,nop,TS val 278403028 ecr 278403012], length 34
1527817547.875078 IP (tos 0x0, ttl 64, id 63244, offset 0, flags [DF], proto TCP (6), length 52)
    rpi37.lan.46656 > rpi33.lan.39544: Flags [.], cksum 0xeab3 (correct), ack 35, win 227, options [nop,nop,TS val 278403013 ecr 278403028], length 0
1527817550.104077 IP (tos 0x0, ttl 64, id 61207, offset 0, flags [DF], proto TCP (6), length 52)
    rpi33.lan.42176 > rpi40.lan.46656: Flags [F.], cksum 0x8488 (incorrect -> 0xcd36), seq 319553562, ack 2396185852, win 229, options [nop,nop,TS val 278403251 ecr 278399077], length 0
1527817550.148328 IP (tos 0x0, ttl 64, id 60569, offset 0, flags [DF], proto TCP (6), length 52)
    rpi40.lan.46656 > rpi33.lan.42176: Flags [.], cksum 0xc564 (correct), ack 1, win 227, options [nop,nop,TS val 278401081 ecr 278403251], length 0
1527817550.849414 IP (tos 0x0, ttl 64, id 35692, offset 0, flags [DF], proto TCP (6), length 52)
    rpi42.lan.46788 > rpi33.lan.46656: Flags [R.], cksum 0x5ed8 (correct), seq 2341152890, ack 4124388493, win 1324, options [nop,nop,TS val 278403306 ecr 278401225], length 0
1527817550.852600 IP (tos 0x0, ttl 64, id 43817, offset 0, flags [DF], proto TCP (6), length 60)
    rpi42.lan.47050 > rpi33.lan.46656: Flags [S], cksum 0x9329 (correct), seq 1930539970, win 29200, options [mss 1460,sackOK,TS val 278403307 ecr 0,nop,wscale 7], length 0
1527817550.852812 IP (tos 0x0, ttl 64, id 0, offset 0, flags [DF], proto TCP (6), length 60)
    rpi33.lan.46656 > rpi42.lan.47050: Flags [S.], cksum 0x8492 (incorrect -> 0x8ff5), seq 891200862, ack 1930539971, win 28960, options [mss 1460,sackOK,TS val 278403326 ecr 278403307,nop,wscale 7], length 0
1527817550.853426 IP (tos 0x0, ttl 64, id 43818, offset 0, flags [DF], proto TCP (6), length 52)
    rpi42.lan.47050 > rpi33.lan.46656: Flags [.], cksum 0x2efd (correct), ack 1, win 229, options [nop,nop,TS val 278403307 ecr 278403326], length 0
1527817550.866143 IP (tos 0x0, ttl 64, id 43819, offset 0, flags [DF], proto TCP (6), length 86)
    rpi42.lan.47050 > rpi33.lan.46656: Flags [P.], cksum 0x6179 (correct), seq 1:35, ack 1, win 229, options [nop,nop,TS val 278403308 ecr 278403326], length 34
1527817550.866224 IP (tos 0x0, ttl 64, id 48545, offset 0, flags [DF], proto TCP (6), length 52)
    rpi33.lan.46656 > rpi42.lan.47050: Flags [.], cksum 0x848a (incorrect -> 0x2eda), ack 35, win 227, options [nop,nop,TS val 278403328 ecr 278403308], length 0
1527817552.386368 IP (tos 0x0, ttl 64, id 64792, offset 0, flags [DF], proto TCP (6), length 60)
    rpi41.lan.45748 > rpi33.lan.46656: Flags [S], cksum 0x66bd (correct), seq 2809193630, win 29200, options [mss 1460,sackOK,TS val 1568905287 ecr 0,nop,wscale 7], length 0
1527817552.386543 IP (tos 0x0, ttl 64, id 0, offset 0, flags [DF], proto TCP (6), length 60)
    rpi33.lan.46656 > rpi41.lan.45748: Flags [S.], cksum 0x8491 (incorrect -> 0x80a4), seq 2888175777, ack 2809193631, win 28960, options [mss 1460,sackOK,TS val 278403480 ecr 1568905287,nop,wscale 7], length 0
1527817552.387071 IP (tos 0x0, ttl 64, id 64793, offset 0, flags [DF], proto TCP (6), length 52)
    rpi41.lan.45748 > rpi33.lan.46656: Flags [.], cksum 0x1fab (correct), ack 1, win 229, options [nop,nop,TS val 1568905288 ecr 278403480], length 0
1527817552.399675 IP (tos 0x0, ttl 64, id 64794, offset 0, flags [DF], proto TCP (6), length 86)
    rpi41.lan.45748 > rpi33.lan.46656: Flags [P.], cksum 0xc0bb (correct), seq 1:35, ack 1, win 229, options [nop,nop,TS val 1568905300 ecr 278403480], length 34
1527817552.399750 IP (tos 0x0, ttl 64, id 2362, offset 0, flags [DF], proto TCP (6), length 52)
    rpi33.lan.46656 > rpi41.lan.45748: Flags [.], cksum 0x8489 (incorrect -> 0x1f7e), ack 35, win 227, options [nop,nop,TS val 278403481 ecr 1568905300], length 0
1527817554.227183 IP (tos 0x0, ttl 64, id 19273, offset 0, flags [DF], proto TCP (6), length 60)
    rpi33.lan.54190 > rpi35.lan.46656: Flags [S], cksum 0x848b (incorrect -> 0xabea), seq 2679591193, win 29200, options [mss 1460,sackOK,TS val 278403664 ecr 0,nop,wscale 7], length 0
1527817554.227895 IP (tos 0x0, ttl 64, id 0, offset 0, flags [DF], proto TCP (6), length 60)
    rpi35.lan.46656 > rpi33.lan.54190: Flags [S.], cksum 0x1f91 (correct), seq 2356468641, ack 2679591194, win 28960, options [mss 1460,sackOK,TS val 278402186 ecr 278403664,nop,wscale 7], length 0
1527817554.228041 IP (tos 0x0, ttl 64, id 19274, offset 0, flags [DF], proto TCP (6), length 52)
    rpi33.lan.54190 > rpi35.lan.46656: Flags [.], cksum 0x8483 (incorrect -> 0xbe98), ack 1, win 229, options [nop,nop,TS val 278403664 ecr 278402186], length 0
1527817554.242714 IP (tos 0x0, ttl 64, id 19275, offset 0, flags [DF], proto TCP (6), length 86)
    rpi33.lan.54190 > rpi35.lan.46656: Flags [P.], cksum 0x84a5 (incorrect -> 0xc3c0), seq 1:35, ack 1, win 229, options [nop,nop,TS val 278403665 ecr 278402186], length 34
1527817554.243297 IP (tos 0x0, ttl 64, id 53032, offset 0, flags [DF], proto TCP (6), length 52)
    rpi35.lan.46656 > rpi33.lan.54190: Flags [.], cksum 0xbe76 (correct), ack 35, win 227, options [nop,nop,TS val 278402187 ecr 278403665], length 0
1527817557.994273 IP (tos 0x0, ttl 64, id 22079, offset 0, flags [DF], proto TCP (6), length 60)
    rpi33.lan.42200 > rpi40.lan.46656: Flags [S], cksum 0x8490 (incorrect -> 0xe441), seq 2547731959, win 29200, options [mss 1460,sackOK,TS val 278404040 ecr 0,nop,wscale 7], length 0
1527817557.994954 IP (tos 0x0, ttl 64, id 0, offset 0, flags [DF], proto TCP (6), length 60)
    rpi40.lan.46656 > rpi33.lan.42200: Flags [S.], cksum 0x4322 (correct), seq 175600550, ack 2547731960, win 28960, options [mss 1460,sackOK,TS val 278401865 ecr 278404040,nop,wscale 7], length 0
1527817557.995081 IP (tos 0x0, ttl 64, id 22080, offset 0, flags [DF], proto TCP (6), length 52)
    rpi33.lan.42200 > rpi40.lan.46656: Flags [.], cksum 0x8488 (incorrect -> 0xe228), ack 1, win 229, options [nop,nop,TS val 278404041 ecr 278401865], length 0
1527817558.007616 IP (tos 0x0, ttl 64, id 22081, offset 0, flags [DF], proto TCP (6), length 86)
    rpi33.lan.42200 > rpi40.lan.46656: Flags [P.], cksum 0x84aa (incorrect -> 0x10e5), seq 1:35, ack 1, win 229, options [nop,nop,TS val 278404042 ecr 278401865], length 34
1527817558.008175 IP (tos 0x0, ttl 64, id 24814, offset 0, flags [DF], proto TCP (6), length 52)
    rpi40.lan.46656 > rpi33.lan.42200: Flags [.], cksum 0xe206 (correct), ack 35, win 227, options [nop,nop,TS val 278401866 ecr 278404042], length 0
1527817563.802560 IP (tos 0x0, ttl 64, id 49610, offset 0, flags [DF], proto TCP (6), length 52)
    rpi33.lan.39586 > rpi38.lan.46656: Flags [F.], cksum 0x8486 (incorrect -> 0x1f8f), seq 35, ack 1, win 229, options [nop,nop,TS val 278404621 ecr 278401155], length 0
1527817563.846461 IP (tos 0x0, ttl 64, id 6880, offset 0, flags [DF], proto TCP (6), length 52)
    rpi38.lan.46656 > rpi33.lan.39586: Flags [.], cksum 0x17bd (correct), ack 36, win 227, options [nop,nop,TS val 278403159 ecr 278404621], length 0
1527817567.658160 IP (tos 0x0, ttl 64, id 38127, offset 0, flags [DF], proto TCP (6), length 52)
    rpi33.lan.59936 > rpi36.lan.46656: Flags [F.], cksum 0x8484 (incorrect -> 0x27df), seq 35, ack 1, win 229, options [nop,nop,TS val 278405007 ecr 278403008], length 0
1527817567.706771 IP (tos 0x0, ttl 64, id 15427, offset 0, flags [DF], proto TCP (6), length 52)
    rpi36.lan.46656 > rpi33.lan.59936: Flags [.], cksum 0x200d (correct), ack 36, win 227, options [nop,nop,TS val 278405012 ecr 278405007], length 0
1527817567.862377 IP (tos 0x0, ttl 64, id 62188, offset 0, flags [DF], proto TCP (6), length 52)
    rpi33.lan.39544 > rpi37.lan.46656: Flags [F.], cksum 0x8485 (incorrect -> 0xe2e1), seq 35, ack 1, win 229, options [nop,nop,TS val 278405027 ecr 278403013], length 0
1527817567.911063 IP (tos 0x0, ttl 64, id 63245, offset 0, flags [DF], proto TCP (6), length 52)
    rpi37.lan.46656 > rpi33.lan.39544: Flags [.], cksum 0xdb0f (correct), ack 36, win 227, options [nop,nop,TS val 278405017 ecr 278405027], length 0
1527817570.134796 IP (tos 0x0, ttl 64, id 10798, offset 0, flags [DF], proto TCP (6), length 60)
    rpi33.lan.39660 > rpi38.lan.46656: Flags [S], cksum 0x848e (incorrect -> 0x23b7), seq 2699233961, win 29200, options [mss 1460,sackOK,TS val 278405255 ecr 0,nop,wscale 7], length 0
1527817570.135440 IP (tos 0x0, ttl 64, id 0, offset 0, flags [DF], proto TCP (6), length 60)
    rpi38.lan.46656 > rpi33.lan.39660: Flags [S.], cksum 0x1f30 (correct), seq 539343325, ack 2699233962, win 28960, options [mss 1460,sackOK,TS val 278403787 ecr 278405255,nop,wscale 7], length 0
1527817570.135557 IP (tos 0x0, ttl 64, id 10799, offset 0, flags [DF], proto TCP (6), length 52)
    rpi33.lan.39660 > rpi38.lan.46656: Flags [.], cksum 0x8486 (incorrect -> 0xbe37), ack 1, win 229, options [nop,nop,TS val 278405255 ecr 278403787], length 0
1527817570.148117 IP (tos 0x0, ttl 64, id 10800, offset 0, flags [DF], proto TCP (6), length 86)
    rpi33.lan.39660 > rpi38.lan.46656: Flags [P.], cksum 0x84a8 (incorrect -> 0xfc0b), seq 1:35, ack 1, win 229, options [nop,nop,TS val 278405256 ecr 278403787], length 34
1527817570.148650 IP (tos 0x0, ttl 64, id 41749, offset 0, flags [DF], proto TCP (6), length 52)
    rpi38.lan.46656 > rpi33.lan.39660: Flags [.], cksum 0xbe14 (correct), ack 35, win 227, options [nop,nop,TS val 278403789 ecr 278405256], length 0
1527817570.853979 IP (tos 0x0, ttl 64, id 43820, offset 0, flags [DF], proto TCP (6), length 52)
    rpi42.lan.47050 > rpi33.lan.46656: Flags [F.], cksum 0x2708 (correct), seq 35, ack 1, win 229, options [nop,nop,TS val 278405307 ecr 278403328], length 0
1527817570.894518 IP (tos 0x0, ttl 64, id 48546, offset 0, flags [DF], proto TCP (6), length 52)
    rpi33.lan.46656 > rpi42.lan.47050: Flags [.], cksum 0x848a (incorrect -> 0x1f37), ack 36, win 227, options [nop,nop,TS val 278405331 ecr 278405307], length 0
1527817572.387543 IP (tos 0x0, ttl 64, id 64795, offset 0, flags [DF], proto TCP (6), length 52)
    rpi41.lan.45748 > rpi33.lan.46656: Flags [F.], cksum 0xd166 (correct), seq 35, ack 1, win 229, options [nop,nop,TS val 1568925288 ecr 278403481], length 0
1527817572.434499 IP (tos 0x0, ttl 64, id 2363, offset 0, flags [DF], proto TCP (6), length 52)
    rpi33.lan.46656 > rpi41.lan.45748: Flags [.], cksum 0x8489 (incorrect -> 0xc994), ack 36, win 227, options [nop,nop,TS val 278405485 ecr 1568925288], length 0
1527817574.228581 IP (tos 0x0, ttl 64, id 19276, offset 0, flags [DF], proto TCP (6), length 52)
    rpi33.lan.54190 > rpi35.lan.46656: Flags [F.], cksum 0x8483 (incorrect -> 0xb6a4), seq 35, ack 1, win 229, options [nop,nop,TS val 278405664 ecr 278402187], length 0
1527817574.276173 IP (tos 0x0, ttl 64, id 53033, offset 0, flags [DF], proto TCP (6), length 52)
    rpi35.lan.46656 > rpi33.lan.54190: Flags [.], cksum 0xaed2 (correct), ack 36, win 227, options [nop,nop,TS val 278404191 ecr 278405664], length 0
1527817574.543321 IP (tos 0x0, ttl 64, id 33060, offset 0, flags [DF], proto TCP (6), length 60)
    rpi33.lan.60026 > rpi36.lan.46656: Flags [S], cksum 0x848c (incorrect -> 0x0a65), seq 3497960219, win 29200, options [mss 1460,sackOK,TS val 278405695 ecr 0,nop,wscale 7], length 0
1527817574.543937 IP (tos 0x0, ttl 64, id 0, offset 0, flags [DF], proto TCP (6), length 60)
    rpi36.lan.46656 > rpi33.lan.60026: Flags [S.], cksum 0xb731 (correct), seq 3186713417, ack 3497960220, win 28960, options [mss 1460,sackOK,TS val 278405695 ecr 278405695,nop,wscale 7], length 0
1527817574.544056 IP (tos 0x0, ttl 64, id 33061, offset 0, flags [DF], proto TCP (6), length 52)
    rpi33.lan.60026 > rpi36.lan.46656: Flags [.], cksum 0x8484 (incorrect -> 0x5639), ack 1, win 229, options [nop,nop,TS val 278405695 ecr 278405695], length 0
1527817574.561337 IP (tos 0x0, ttl 64, id 33062, offset 0, flags [DF], proto TCP (6), length 86)
    rpi33.lan.60026 > rpi36.lan.46656: Flags [P.], cksum 0x84a6 (incorrect -> 0xe275), seq 1:35, ack 1, win 229, options [nop,nop,TS val 278405697 ecr 278405695], length 34
1527817574.561931 IP (tos 0x0, ttl 64, id 16757, offset 0, flags [DF], proto TCP (6), length 52)
    rpi36.lan.46656 > rpi33.lan.60026: Flags [.], cksum 0x5615 (correct), ack 35, win 227, options [nop,nop,TS val 278405697 ecr 278405697], length 0
1527817575.665599 IP (tos 0x0, ttl 64, id 43660, offset 0, flags [DF], proto TCP (6), length 60)
    rpi33.lan.39640 > rpi37.lan.46656: Flags [S], cksum 0x848d (incorrect -> 0x2344), seq 565151804, win 29200, options [mss 1460,sackOK,TS val 278405808 ecr 0,nop,wscale 7], length 0
1527817575.666325 IP (tos 0x0, ttl 64, id 0, offset 0, flags [DF], proto TCP (6), length 60)
    rpi37.lan.46656 > rpi33.lan.39640: Flags [S.], cksum 0x2e9e (correct), seq 376155105, ack 565151805, win 28960, options [mss 1460,sackOK,TS val 278405792 ecr 278405808,nop,wscale 7], length 0
1527817575.666464 IP (tos 0x0, ttl 64, id 43661, offset 0, flags [DF], proto TCP (6), length 52)
    rpi33.lan.39640 > rpi37.lan.46656: Flags [.], cksum 0x8485 (incorrect -> 0xcda5), ack 1, win 229, options [nop,nop,TS val 278405808 ecr 278405792], length 0
1527817575.679036 IP (tos 0x0, ttl 64, id 43662, offset 0, flags [DF], proto TCP (6), length 86)
    rpi33.lan.39640 > rpi37.lan.46656: Flags [P.], cksum 0x84a7 (incorrect -> 0x491d), seq 1:35, ack 1, win 229, options [nop,nop,TS val 278405809 ecr 278405792], length 34
1527817575.679564 IP (tos 0x0, ttl 64, id 35138, offset 0, flags [DF], proto TCP (6), length 52)
    rpi37.lan.46656 > rpi33.lan.39640: Flags [.], cksum 0xcd83 (correct), ack 35, win 227, options [nop,nop,TS val 278405793 ecr 278405809], length 0
1527817575.979302 IP (tos 0x0, ttl 64, id 52824, offset 0, flags [DF], proto TCP (6), length 60)
    rpi42.lan.47054 > rpi33.lan.46656: Flags [S], cksum 0x9191 (correct), seq 833940707, win 29200, options [mss 1460,sackOK,TS val 278405819 ecr 0,nop,wscale 7], length 0
1527817575.979485 IP (tos 0x0, ttl 64, id 0, offset 0, flags [DF], proto TCP (6), length 60)
    rpi33.lan.46656 > rpi42.lan.47054: Flags [S.], cksum 0x8492 (incorrect -> 0x2573), seq 651563712, ack 833940708, win 28960, options [mss 1460,sackOK,TS val 278405839 ecr 278405819,nop,wscale 7], length 0
1527817575.980065 IP (tos 0x0, ttl 64, id 52825, offset 0, flags [DF], proto TCP (6), length 52)
    rpi42.lan.47054 > rpi33.lan.46656: Flags [.], cksum 0xc47a (correct), ack 1, win 229, options [nop,nop,TS val 278405819 ecr 278405839], length 0
1527817575.992567 IP (tos 0x0, ttl 64, id 52826, offset 0, flags [DF], proto TCP (6), length 86)
    rpi42.lan.47054 > rpi33.lan.46656: Flags [P.], cksum 0x607f (correct), seq 1:35, ack 1, win 229, options [nop,nop,TS val 278405821 ecr 278405839], length 34
1527817575.992653 IP (tos 0x0, ttl 64, id 12302, offset 0, flags [DF], proto TCP (6), length 52)
    rpi33.lan.46656 > rpi42.lan.47054: Flags [.], cksum 0x848a (incorrect -> 0xc457), ack 35, win 227, options [nop,nop,TS val 278405840 ecr 278405821], length 0
1527817577.583512 IP (tos 0x0, ttl 64, id 41887, offset 0, flags [DF], proto TCP (6), length 60)
    rpi41.lan.45758 > rpi33.lan.46656: Flags [S], cksum 0x73c0 (correct), seq 2614264002, win 29200, options [mss 1460,sackOK,TS val 1568930484 ecr 0,nop,wscale 7], length 0
1527817577.583684 IP (tos 0x0, ttl 64, id 0, offset 0, flags [DF], proto TCP (6), length 60)
    rpi33.lan.46656 > rpi41.lan.45758: Flags [S.], cksum 0x8491 (incorrect -> 0x40b2), seq 2894746459, ack 2614264003, win 28960, options [mss 1460,sackOK,TS val 278405999 ecr 1568930484,nop,wscale 7], length 0
1527817577.584252 IP (tos 0x0, ttl 64, id 41888, offset 0, flags [DF], proto TCP (6), length 52)
    rpi41.lan.45758 > rpi33.lan.46656: Flags [.], cksum 0xdfb8 (correct), ack 1, win 229, options [nop,nop,TS val 1568930485 ecr 278405999], length 0
1527817577.596838 IP (tos 0x0, ttl 64, id 41889, offset 0, flags [DF], proto TCP (6), length 86)
    rpi41.lan.45758 > rpi33.lan.46656: Flags [P.], cksum 0x7a02 (correct), seq 1:35, ack 1, win 229, options [nop,nop,TS val 1568930498 ecr 278405999], length 34
1527817577.596925 IP (tos 0x0, ttl 64, id 28723, offset 0, flags [DF], proto TCP (6), length 52)
    rpi33.lan.46656 > rpi41.lan.45758: Flags [.], cksum 0x8489 (incorrect -> 0xdf89), ack 35, win 227, options [nop,nop,TS val 278406001 ecr 1568930498], length 0
1527817577.995605 IP (tos 0x0, ttl 64, id 22082, offset 0, flags [DF], proto TCP (6), length 52)
    rpi33.lan.42200 > rpi40.lan.46656: Flags [F.], cksum 0x8488 (incorrect -> 0xda34), seq 35, ack 1, win 229, options [nop,nop,TS val 278406041 ecr 278401866], length 0
1527817578.038283 IP (tos 0x0, ttl 64, id 24815, offset 0, flags [DF], proto TCP (6), length 52)
    rpi40.lan.46656 > rpi33.lan.42200: Flags [.], cksum 0xd262 (correct), ack 36, win 227, options [nop,nop,TS val 278403870 ecr 278406041], length 0
1527817582.138948 IP (tos 0x0, ttl 64, id 44837, offset 0, flags [DF], proto TCP (6), length 60)
    rpi33.lan.54312 > rpi35.lan.46656: Flags [S], cksum 0x848b (incorrect -> 0x9b25), seq 1814202898, win 29200, options [mss 1460,sackOK,TS val 278406455 ecr 0,nop,wscale 7], length 0
1527817582.139663 IP (tos 0x0, ttl 64, id 0, offset 0, flags [DF], proto TCP (6), length 60)
    rpi35.lan.46656 > rpi33.lan.54312: Flags [S.], cksum 0x81de (correct), seq 3570996547, ack 1814202899, win 28960, options [mss 1460,sackOK,TS val 278404977 ecr 278406455,nop,wscale 7], length 0
1527817582.139785 IP (tos 0x0, ttl 64, id 44838, offset 0, flags [DF], proto TCP (6), length 52)
    rpi33.lan.54312 > rpi35.lan.46656: Flags [.], cksum 0x8483 (incorrect -> 0x20e6), ack 1, win 229, options [nop,nop,TS val 278406455 ecr 278404977], length 0
1527817582.152411 IP (tos 0x0, ttl 64, id 44839, offset 0, flags [DF], proto TCP (6), length 86)
    rpi33.lan.54312 > rpi35.lan.46656: Flags [P.], cksum 0x84a5 (incorrect -> 0xf895), seq 1:35, ack 1, win 229, options [nop,nop,TS val 278406456 ecr 278404977], length 34
1527817582.152958 IP (tos 0x0, ttl 64, id 2613, offset 0, flags [DF], proto TCP (6), length 52)
    rpi35.lan.46656 > rpi33.lan.54312: Flags [.], cksum 0x20c4 (correct), ack 35, win 227, options [nop,nop,TS val 278404978 ecr 278406456], length 0
1527817585.172260 IP (tos 0x0, ttl 64, id 59127, offset 0, flags [DF], proto TCP (6), length 60)
    rpi33.lan.42320 > rpi40.lan.46656: Flags [S], cksum 0x8490 (incorrect -> 0x8840), seq 1982644369, win 29200, options [mss 1460,sackOK,TS val 278406758 ecr 0,nop,wscale 7], length 0
1527817585.172925 IP (tos 0x0, ttl 64, id 0, offset 0, flags [DF], proto TCP (6), length 60)
    rpi40.lan.46656 > rpi33.lan.42320: Flags [S.], cksum 0x9a85 (correct), seq 2090681213, ack 1982644370, win 28960, options [mss 1460,sackOK,TS val 278404583 ecr 278406758,nop,wscale 7], length 0
1527817585.173044 IP (tos 0x0, ttl 64, id 59128, offset 0, flags [DF], proto TCP (6), length 52)
    rpi33.lan.42320 > rpi40.lan.46656: Flags [.], cksum 0x8488 (incorrect -> 0x398d), ack 1, win 229, options [nop,nop,TS val 278406758 ecr 278404583], length 0
1527817585.185757 IP (tos 0x0, ttl 64, id 59129, offset 0, flags [DF], proto TCP (6), length 86)
    rpi33.lan.42320 > rpi40.lan.46656: Flags [P.], cksum 0x84aa (incorrect -> 0x5240), seq 1:35, ack 1, win 229, options [nop,nop,TS val 278406760 ecr 278404583], length 34
1527817585.186294 IP (tos 0x0, ttl 64, id 24217, offset 0, flags [DF], proto TCP (6), length 52)
    rpi40.lan.46656 > rpi33.lan.42320: Flags [.], cksum 0x396a (correct), ack 35, win 227, options [nop,nop,TS val 278404584 ecr 278406760], length 0
1527817590.136149 IP (tos 0x0, ttl 64, id 10801, offset 0, flags [DF], proto TCP (6), length 52)
    rpi33.lan.39660 > rpi38.lan.46656: Flags [F.], cksum 0x8486 (incorrect -> 0xb642), seq 35, ack 1, win 229, options [nop,nop,TS val 278407255 ecr 278403789], length 0
1527817590.186472 IP (tos 0x0, ttl 64, id 41750, offset 0, flags [DF], proto TCP (6), length 52)
    rpi38.lan.46656 > rpi33.lan.39660: Flags [.], cksum 0xae70 (correct), ack 36, win 227, options [nop,nop,TS val 278405793 ecr 278407255], length 0
1527817593.912970 IP (tos 0x0, ttl 64, id 49847, offset 0, flags [DF], proto TCP (6), length 1096)
    rpi34.lan.46656 > rpi33.lan.35744: Flags [P.], cksum 0xaa45 (correct), seq 3496889567:3496890611, ack 1347947675, win 308, options [nop,nop,TS val 278407641 ecr 278401638], length 1044
1527817593.913120 IP (tos 0x0, ttl 64, id 772, offset 0, flags [DF], proto TCP (6), length 52)
    rpi33.lan.35744 > rpi34.lan.46656: Flags [.], cksum 0x8482 (incorrect -> 0xbc0b), ack 1044, win 326, options [nop,nop,TS val 278407632 ecr 278407641], length 0
1527817593.913741 IP (tos 0x0, ttl 64, id 773, offset 0, flags [DF], proto TCP (6), length 1096)
    rpi33.lan.35744 > rpi34.lan.46656: Flags [P.], cksum 0x8896 (incorrect -> 0x568c), seq 1:1045, ack 1044, win 326, options [nop,nop,TS val 278407632 ecr 278407641], length 1044
1527817593.914013 IP (tos 0x0, ttl 64, id 774, offset 0, flags [DF], proto TCP (6), length 1096)
    rpi33.lan.35744 > rpi34.lan.46656: Flags [P.], cksum 0x8896 (incorrect -> 0xdee7), seq 1045:2089, ack 1044, win 326, options [nop,nop,TS val 278407632 ecr 278407641], length 1044
1527817593.914781 IP (tos 0x0, ttl 64, id 49848, offset 0, flags [DF], proto TCP (6), length 52)
    rpi34.lan.46656 > rpi33.lan.35744: Flags [.], cksum 0xb3d4 (correct), ack 2089, win 341, options [nop,nop,TS val 278407641 ecr 278407632], length 0
1527817593.915385 IP (tos 0x0, ttl 64, id 49849, offset 0, flags [DF], proto TCP (6), length 1096)
    rpi34.lan.46656 > rpi33.lan.35744: Flags [P.], cksum 0xcfdb (correct), seq 1044:2088, ack 2089, win 341, options [nop,nop,TS val 278407641 ecr 278407632], length 1044
1527817593.964493 IP (tos 0x0, ttl 64, id 775, offset 0, flags [DF], proto TCP (6), length 52)
    rpi33.lan.35744 > rpi34.lan.46656: Flags [.], cksum 0x8482 (incorrect -> 0xafb8), ack 2088, win 343, options [nop,nop,TS val 278407638 ecr 278407641], length 0
1527817594.544667 IP (tos 0x0, ttl 64, id 33063, offset 0, flags [DF], proto TCP (6), length 52)
    rpi33.lan.60026 > rpi36.lan.46656: Flags [F.], cksum 0x8484 (incorrect -> 0x4e43), seq 35, ack 1, win 229, options [nop,nop,TS val 278407696 ecr 278405697], length 0
1527817594.586770 IP (tos 0x0, ttl 64, id 16758, offset 0, flags [DF], proto TCP (6), length 52)
    rpi36.lan.46656 > rpi33.lan.60026: Flags [.], cksum 0x4672 (correct), ack 36, win 227, options [nop,nop,TS val 278407700 ecr 278407696], length 0
1527817595.176307 IP (tos 0x0, ttl 64, id 56116, offset 0, flags [DF], proto TCP (6), length 60)
    rpi33.lan.39770 > rpi38.lan.46656: Flags [S], cksum 0x848e (incorrect -> 0xab45), seq 676131195, win 29200, options [mss 1460,sackOK,TS val 278407759 ecr 0,nop,wscale 7], length 0
1527817595.177001 IP (tos 0x0, ttl 64, id 0, offset 0, flags [DF], proto TCP (6), length 60)
    rpi38.lan.46656 > rpi33.lan.39770: Flags [S.], cksum 0xae3a (correct), seq 3313042244, ack 676131196, win 28960, options [mss 1460,sackOK,TS val 278406292 ecr 278407759,nop,wscale 7], length 0
1527817595.177126 IP (tos 0x0, ttl 64, id 56117, offset 0, flags [DF], proto TCP (6), length 52)
    rpi33.lan.39770 > rpi38.lan.46656: Flags [.], cksum 0x8486 (incorrect -> 0x4d42), ack 1, win 229, options [nop,nop,TS val 278407759 ecr 278406292], length 0
1527817595.189827 IP (tos 0x0, ttl 64, id 56118, offset 0, flags [DF], proto TCP (6), length 86)
    rpi33.lan.39770 > rpi38.lan.46656: Flags [P.], cksum 0x84a8 (incorrect -> 0x3a30), seq 1:35, ack 1, win 229, options [nop,nop,TS val 278407760 ecr 278406292], length 34
1527817595.190388 IP (tos 0x0, ttl 64, id 10193, offset 0, flags [DF], proto TCP (6), length 52)
    rpi38.lan.46656 > rpi33.lan.39770: Flags [.], cksum 0x4d20 (correct), ack 35, win 227, options [nop,nop,TS val 278406293 ecr 278407760], length 0
1527817595.666989 IP (tos 0x0, ttl 64, id 43663, offset 0, flags [DF], proto TCP (6), length 52)
    rpi33.lan.39640 > rpi37.lan.46656: Flags [F.], cksum 0x8485 (incorrect -> 0xc5b1), seq 35, ack 1, win 229, options [nop,nop,TS val 278407808 ecr 278405793], length 0
1527817595.711051 IP (tos 0x0, ttl 64, id 35139, offset 0, flags [DF], proto TCP (6), length 52)
    rpi37.lan.46656 > rpi33.lan.39640: Flags [.], cksum 0xbddf (correct), ack 36, win 227, options [nop,nop,TS val 278407797 ecr 278407808], length 0
1527817595.980729 IP (tos 0x0, ttl 64, id 52827, offset 0, flags [DF], proto TCP (6), length 52)
    rpi42.lan.47054 > rpi33.lan.46656: Flags [F.], cksum 0xbc86 (correct), seq 35, ack 1, win 229, options [nop,nop,TS val 278407819 ecr 278405840], length 0
1527817596.024512 IP (tos 0x0, ttl 64, id 12303, offset 0, flags [DF], proto TCP (6), length 52)
    rpi33.lan.46656 > rpi42.lan.47054: Flags [.], cksum 0x848a (incorrect -> 0xb4b4), ack 36, win 227, options [nop,nop,TS val 278407844 ecr 278407819], length 0
1527817597.584733 IP (tos 0x0, ttl 64, id 41890, offset 0, flags [DF], proto TCP (6), length 52)
    rpi41.lan.45758 > rpi33.lan.46656: Flags [F.], cksum 0x9172 (correct), seq 35, ack 1, win 229, options [nop,nop,TS val 1568950486 ecr 278406001], length 0
1527817597.634531 IP (tos 0x0, ttl 64, id 28724, offset 0, flags [DF], proto TCP (6), length 52)
    rpi33.lan.46656 > rpi41.lan.45758: Flags [.], cksum 0x8489 (incorrect -> 0x89a0), ack 36, win 227, options [nop,nop,TS val 278408005 ecr 1568950486], length 0
1527817600.042023 IP (tos 0x0, ttl 64, id 16260, offset 0, flags [DF], proto TCP (6), length 1096)
    rpi33.lan.46656 > rpi39.lan.47498: Flags [P.], cksum 0x7ed5 (correct), seq 955111086:955112130, ack 3487533460, win 308, options [nop,nop,TS val 278408245 ecr 278402245], length 1044
1527817600.042817 IP (tos 0x0, ttl 64, id 34920, offset 0, flags [DF], proto TCP (6), length 1096)
    rpi39.lan.47498 > rpi33.lan.46656: Flags [P.], cksum 0xfe2b (correct), seq 1:1045, ack 0, win 310, options [nop,nop,TS val 278408245 ecr 278402249], length 1044
1527817600.042821 IP (tos 0x0, ttl 64, id 34921, offset 0, flags [DF], proto TCP (6), length 52)
    rpi39.lan.47498 > rpi33.lan.46656: Flags [.], cksum 0x9678 (correct), ack 1044, win 326, options [nop,nop,TS val 278408245 ecr 278408245], length 0
1527817600.043476 IP (tos 0x0, ttl 64, id 16261, offset 0, flags [DF], proto TCP (6), length 1096)
    rpi33.lan.46656 > rpi39.lan.47498: Flags [P.], cksum 0xa23c (correct), seq 1044:2088, ack 1045, win 325, options [nop,nop,TS val 278408245 ecr 278408245], length 1044
1527817600.043617 IP (tos 0x0, ttl 64, id 34922, offset 0, flags [DF], proto TCP (6), length 1096)
    rpi39.lan.47498 > rpi33.lan.46656: Flags [P.], cksum 0x8956 (correct), seq 1045:2089, ack 1044, win 326, options [nop,nop,TS val 278408245 ecr 278408245], length 1044
1527817600.084222 IP (tos 0x0, ttl 64, id 34923, offset 0, flags [DF], proto TCP (6), length 52)
    rpi39.lan.47498 > rpi33.lan.46656: Flags [.], cksum 0x8e3a (correct), ack 2088, win 343, options [nop,nop,TS val 278408250 ecr 278408245], length 0
1527817600.084307 IP (tos 0x0, ttl 64, id 16262, offset 0, flags [DF], proto TCP (6), length 52)
    rpi33.lan.46656 > rpi39.lan.47498: Flags [.], cksum 0x8487 (incorrect -> 0x8e3d), ack 2089, win 341, options [nop,nop,TS val 278408249 ecr 278408245], length 0
1527817601.067044 IP (tos 0x0, ttl 64, id 57073, offset 0, flags [DF], proto TCP (6), length 60)
    rpi42.lan.47058 > rpi33.lan.46656: Flags [S], cksum 0x1487 (correct), seq 2673341049, win 29200, options [mss 1460,sackOK,TS val 278408328 ecr 0,nop,wscale 7], length 0
1527817601.067195 IP (tos 0x0, ttl 64, id 0, offset 0, flags [DF], proto TCP (6), length 60)
    rpi33.lan.46656 > rpi42.lan.47058: Flags [S.], cksum 0x8492 (incorrect -> 0xccea), seq 1596435487, ack 2673341050, win 28960, options [mss 1460,sackOK,TS val 278408348 ecr 278408328,nop,wscale 7], length 0
1527817601.067771 IP (tos 0x0, ttl 64, id 57074, offset 0, flags [DF], proto TCP (6), length 52)
    rpi42.lan.47058 > rpi33.lan.46656: Flags [.], cksum 0x6bf2 (correct), ack 1, win 229, options [nop,nop,TS val 278408328 ecr 278408348], length 0
1527817601.080411 IP (tos 0x0, ttl 64, id 57075, offset 0, flags [DF], proto TCP (6), length 86)
    rpi42.lan.47058 > rpi33.lan.46656: Flags [P.], cksum 0xd03c (correct), seq 1:35, ack 1, win 229, options [nop,nop,TS val 278408329 ecr 278408348], length 34
1527817601.080489 IP (tos 0x0, ttl 64, id 32956, offset 0, flags [DF], proto TCP (6), length 52)
    rpi33.lan.46656 > rpi42.lan.47058: Flags [.], cksum 0x848a (incorrect -> 0x6bd0), ack 35, win 227, options [nop,nop,TS val 278408349 ecr 278408329], length 0
1527817601.224099 IP (tos 0x0, ttl 64, id 19992, offset 0, flags [DF], proto TCP (6), length 60)
    rpi33.lan.39750 > rpi37.lan.46656: Flags [S], cksum 0x848d (incorrect -> 0x5763), seq 145777331, win 29200, options [mss 1460,sackOK,TS val 278408363 ecr 0,nop,wscale 7], length 0
1527817601.224788 IP (tos 0x0, ttl 64, id 0, offset 0, flags [DF], proto TCP (6), length 60)
    rpi37.lan.46656 > rpi33.lan.39750: Flags [S.], cksum 0x3afc (correct), seq 397592671, ack 145777332, win 28960, options [mss 1460,sackOK,TS val 278408348 ecr 278408363,nop,wscale 7], length 0
1527817601.224911 IP (tos 0x0, ttl 64, id 19993, offset 0, flags [DF], proto TCP (6), length 52)
    rpi33.lan.39750 > rpi37.lan.46656: Flags [.], cksum 0x8485 (incorrect -> 0xda02), ack 1, win 229, options [nop,nop,TS val 278408364 ecr 278408348], length 0
1527817601.237385 IP (tos 0x0, ttl 64, id 19994, offset 0, flags [DF], proto TCP (6), length 86)
    rpi33.lan.39750 > rpi37.lan.46656: Flags [P.], cksum 0x84a7 (incorrect -> 0xc0b8), seq 1:35, ack 1, win 229, options [nop,nop,TS val 278408365 ecr 278408348], length 34
1527817601.237916 IP (tos 0x0, ttl 64, id 58620, offset 0, flags [DF], proto TCP (6), length 52)
    rpi37.lan.46656 > rpi33.lan.39750: Flags [.], cksum 0xd9e0 (correct), ack 35, win 227, options [nop,nop,TS val 278408349 ecr 278408365], length 0
1527817601.779092 IP (tos 0x0, ttl 64, id 55659, offset 0, flags [DF], proto TCP (6), length 60)
    rpi33.lan.60148 > rpi36.lan.46656: Flags [S], cksum 0x848c (incorrect -> 0x0872), seq 1961293192, win 29200, options [mss 1460,sackOK,TS val 278408419 ecr 0,nop,wscale 7], length 0
1527817601.779763 IP (tos 0x0, ttl 64, id 0, offset 0, flags [DF], proto TCP (6), length 60)
    rpi36.lan.46656 > rpi33.lan.60148: Flags [S.], cksum 0x4ea0 (correct), seq 1515070183, ack 1961293193, win 28960, options [mss 1460,sackOK,TS val 278408419 ecr 278408419,nop,wscale 7], length 0
1527817601.779895 IP (tos 0x0, ttl 64, id 55660, offset 0, flags [DF], proto TCP (6), length 52)
    rpi33.lan.60148 > rpi36.lan.46656: Flags [.], cksum 0x8484 (incorrect -> 0xeda7), ack 1, win 229, options [nop,nop,TS val 278408419 ecr 278408419], length 0
1527817601.792482 IP (tos 0x0, ttl 64, id 55661, offset 0, flags [DF], proto TCP (6), length 86)
    rpi33.lan.60148 > rpi36.lan.46656: Flags [P.], cksum 0x84a6 (incorrect -> 0xd35f), seq 1:35, ack 1, win 229, options [nop,nop,TS val 278408420 ecr 278408419], length 34
1527817601.793019 IP (tos 0x0, ttl 64, id 3595, offset 0, flags [DF], proto TCP (6), length 52)
    rpi36.lan.46656 > rpi33.lan.60148: Flags [.], cksum 0xed85 (correct), ack 35, win 227, options [nop,nop,TS val 278408420 ecr 278408420], length 0
1527817602.140397 IP (tos 0x0, ttl 64, id 44840, offset 0, flags [DF], proto TCP (6), length 52)
    rpi33.lan.54312 > rpi35.lan.46656: Flags [F.], cksum 0x8483 (incorrect -> 0x18f2), seq 35, ack 1, win 229, options [nop,nop,TS val 278408455 ecr 278404978], length 0
1527817602.186197 IP (tos 0x0, ttl 64, id 2614, offset 0, flags [DF], proto TCP (6), length 52)
    rpi35.lan.46656 > rpi33.lan.54312: Flags [.], cksum 0x1120 (correct), ack 36, win 227, options [nop,nop,TS val 278406982 ecr 278408455], length 0
1527817604.264330 IP (tos 0x0, ttl 64, id 12481, offset 0, flags [DF], proto TCP (6), length 60)
    rpi41.lan.45768 > rpi33.lan.46656: Flags [S], cksum 0x1e35 (correct), seq 3973324040, win 29200, options [mss 1460,sackOK,TS val 1568957165 ecr 0,nop,wscale 7], length 0
1527817604.264516 IP (tos 0x0, ttl 64, id 0, offset 0, flags [DF], proto TCP (6), length 60)
    rpi33.lan.46656 > rpi41.lan.45768: Flags [S.], cksum 0x8491 (incorrect -> 0xcb21), seq 855564928, ack 3973324041, win 28960, options [mss 1460,sackOK,TS val 278408667 ecr 1568957165,nop,wscale 7], length 0
1527817604.265074 IP (tos 0x0, ttl 64, id 12482, offset 0, flags [DF], proto TCP (6), length 52)
    rpi41.lan.45768 > rpi33.lan.46656: Flags [.], cksum 0x6a28 (correct), ack 1, win 229, options [nop,nop,TS val 1568957166 ecr 278408667], length 0
1527817604.277537 IP (tos 0x0, ttl 64, id 12483, offset 0, flags [DF], proto TCP (6), length 86)
    rpi41.lan.45768 > rpi33.lan.46656: Flags [P.], cksum 0xee1c (correct), seq 1:35, ack 1, win 229, options [nop,nop,TS val 1568957179 ecr 278408667], length 34
1527817604.277611 IP (tos 0x0, ttl 64, id 53085, offset 0, flags [DF], proto TCP (6), length 52)
    rpi33.lan.46656 > rpi41.lan.45768: Flags [.], cksum 0x8489 (incorrect -> 0x69f9), ack 35, win 227, options [nop,nop,TS val 278408669 ecr 1568957179], length 0
1527817605.173564 IP (tos 0x0, ttl 64, id 59130, offset 0, flags [DF], proto TCP (6), length 52)
    rpi33.lan.42320 > rpi40.lan.46656: Flags [F.], cksum 0x8488 (incorrect -> 0x3199), seq 35, ack 1, win 229, options [nop,nop,TS val 278408758 ecr 278404584], length 0
1527817605.218260 IP (tos 0x0, ttl 64, id 24218, offset 0, flags [DF], proto TCP (6), length 52)
    rpi40.lan.46656 > rpi33.lan.42320: Flags [.], cksum 0x29c7 (correct), ack 36, win 227, options [nop,nop,TS val 278406588 ecr 278408758], length 0
1527817609.176977 IP (tos 0x0, ttl 64, id 54257, offset 0, flags [DF], proto TCP (6), length 60)
    rpi33.lan.54412 > rpi35.lan.46656: Flags [S], cksum 0x848b (incorrect -> 0xb535), seq 3573152822, win 29200, options [mss 1460,sackOK,TS val 278409159 ecr 0,nop,wscale 7], length 0
1527817609.177687 IP (tos 0x0, ttl 64, id 0, offset 0, flags [DF], proto TCP (6), length 60)
    rpi35.lan.46656 > rpi33.lan.54412: Flags [S.], cksum 0x3d97 (correct), seq 980681584, ack 3573152823, win 28960, options [mss 1460,sackOK,TS val 278407681 ecr 278409159,nop,wscale 7], length 0
1527817609.177810 IP (tos 0x0, ttl 64, id 54258, offset 0, flags [DF], proto TCP (6), length 52)
    rpi33.lan.54412 > rpi35.lan.46656: Flags [.], cksum 0x8483 (incorrect -> 0xdc9e), ack 1, win 229, options [nop,nop,TS val 278409159 ecr 278407681], length 0
1527817609.190346 IP (tos 0x0, ttl 64, id 54259, offset 0, flags [DF], proto TCP (6), length 86)
    rpi33.lan.54412 > rpi35.lan.46656: Flags [P.], cksum 0x84a5 (incorrect -> 0x13c0), seq 1:35, ack 1, win 229, options [nop,nop,TS val 278409160 ecr 278407681], length 34
1527817609.190888 IP (tos 0x0, ttl 64, id 10608, offset 0, flags [DF], proto TCP (6), length 52)
    rpi35.lan.46656 > rpi33.lan.54412: Flags [.], cksum 0xdc7c (correct), ack 35, win 227, options [nop,nop,TS val 278407682 ecr 278409160], length 0
1527817611.134044 IP (tos 0x0, ttl 64, id 12060, offset 0, flags [DF], proto TCP (6), length 60)
    rpi33.lan.42408 > rpi40.lan.46656: Flags [S], cksum 0x8490 (incorrect -> 0xd7b8), seq 3174244246, win 29200, options [mss 1460,sackOK,TS val 278409354 ecr 0,nop,wscale 7], length 0
1527817611.134766 IP (tos 0x0, ttl 64, id 0, offset 0, flags [DF], proto TCP (6), length 60)
    rpi40.lan.46656 > rpi33.lan.42408: Flags [S.], cksum 0xda3b (correct), seq 3736332036, ack 3174244247, win 28960, options [mss 1460,sackOK,TS val 278407179 ecr 278409354,nop,wscale 7], length 0
1527817611.134896 IP (tos 0x0, ttl 64, id 12061, offset 0, flags [DF], proto TCP (6), length 52)
    rpi33.lan.42408 > rpi40.lan.46656: Flags [.], cksum 0x8488 (incorrect -> 0x7942), ack 1, win 229, options [nop,nop,TS val 278409355 ecr 278407179], length 0
1527817611.147457 IP (tos 0x0, ttl 64, id 12062, offset 0, flags [DF], proto TCP (6), length 86)
    rpi33.lan.42408 > rpi40.lan.46656: Flags [P.], cksum 0x84aa (incorrect -> 0x6e76), seq 1:35, ack 1, win 229, options [nop,nop,TS val 278409356 ecr 278407179], length 34
1527817611.147984 IP (tos 0x0, ttl 64, id 53006, offset 0, flags [DF], proto TCP (6), length 52)
    rpi40.lan.46656 > rpi33.lan.42408: Flags [.], cksum 0x7920 (correct), ack 35, win 227, options [nop,nop,TS val 278407180 ecr 278409356], length 0
1527817615.177736 IP (tos 0x0, ttl 64, id 56119, offset 0, flags [DF], proto TCP (6), length 52)
    rpi33.lan.39770 > rpi38.lan.46656: Flags [F.], cksum 0x8486 (incorrect -> 0x454e), seq 35, ack 1, win 229, options [nop,nop,TS val 278409759 ecr 278406293], length 0
1527817615.226471 IP (tos 0x0, ttl 64, id 10194, offset 0, flags [DF], proto TCP (6), length 52)
    rpi38.lan.46656 > rpi33.lan.39770: Flags [.], cksum 0x3d7c (correct), ack 36, win 227, options [nop,nop,TS val 278408297 ecr 278409759], length 0

