1527830776.787606 IP (tos 0x0, ttl 64, id 42017, offset 0, flags [DF], proto TCP (6), length 1096)
    rpi33.lan.46656 > rpi39.lan.50408: Flags [P.], cksum 0x8864 (correct), seq 3834939468:3834940512, ack 2268342510, win 1332, options [nop,nop,TS val 279725920 ecr 279725808], length 1044
1527830776.788520 IP (tos 0x0, ttl 64, id 34039, offset 0, flags [DF], proto TCP (6), length 52)
    rpi39.lan.50408 > rpi33.lan.46656: Flags [.], cksum 0xa0d8 (correct), ack 1044, win 1323, options [nop,nop,TS val 279725919 ecr 279725920], length 0
1527830776.789302 IP (tos 0x0, ttl 64, id 34040, offset 0, flags [DF], proto TCP (6), length 1096)
    rpi39.lan.50408 > rpi33.lan.46656: Flags [P.], cksum 0x937e (correct), seq 1:1045, ack 1044, win 1324, options [nop,nop,TS val 279725919 ecr 279725920], length 1044
1527830776.789368 IP (tos 0x0, ttl 64, id 42018, offset 0, flags [DF], proto TCP (6), length 52)
    rpi33.lan.46656 > rpi39.lan.50408: Flags [.], cksum 0x8487 (incorrect -> 0x9cbc), ack 1045, win 1331, options [nop,nop,TS val 279725920 ecr 279725919], length 0
1527830776.790680 IP (tos 0x0, ttl 64, id 34041, offset 0, flags [DF], proto TCP (6), length 1096)
    rpi39.lan.50408 > rpi33.lan.46656: Flags [P.], cksum 0x6dad (correct), seq 1045:2089, ack 1044, win 1324, options [nop,nop,TS val 279725920 ecr 279725920], length 1044
1527830776.790735 IP (tos 0x0, ttl 64, id 42019, offset 0, flags [DF], proto TCP (6), length 52)
    rpi33.lan.46656 > rpi39.lan.50408: Flags [.], cksum 0x8487 (incorrect -> 0x98a7), ack 2089, win 1331, options [nop,nop,TS val 279725920 ecr 279725920], length 0
1527830776.791231 IP (tos 0x0, ttl 64, id 42020, offset 0, flags [DF], proto TCP (6), length 1096)
    rpi33.lan.46656 > rpi39.lan.50408: Flags [P.], cksum 0x4b24 (correct), seq 1044:2088, ack 2089, win 1332, options [nop,nop,TS val 279725920 ecr 279725920], length 1044
1527830776.840304 IP (tos 0x0, ttl 64, id 34042, offset 0, flags [DF], proto TCP (6), length 52)
    rpi39.lan.50408 > rpi33.lan.46656: Flags [.], cksum 0x9495 (correct), ack 2088, win 1324, options [nop,nop,TS val 279725925 ecr 279725920], length 0
1527830777.613587 IP (tos 0x0, ttl 64, id 12725, offset 0, flags [DF], proto TCP (6), length 1096)
    rpi42.lan.49208 > rpi33.lan.46656: Flags [P.], cksum 0x8fda (correct), seq 237979018:237980062, ack 2632189399, win 1324, options [nop,nop,TS val 279725982 ecr 279725803], length 1044
1527830777.618299 IP (tos 0x0, ttl 64, id 23901, offset 0, flags [DF], proto TCP (6), length 1096)
    rpi36.lan.52404 > rpi33.lan.46656: Flags [P.], cksum 0x356b (correct), seq 765902817:765903861, ack 2847214656, win 1324, options [nop,nop,TS val 279726002 ecr 279725803], length 1044
1527830777.625125 IP (tos 0x0, ttl 64, id 15023, offset 0, flags [DF], proto TCP (6), length 1096)
    rpi38.lan.46656 > rpi33.lan.55368: Flags [P.], cksum 0x0e3f (correct), seq 3948215084:3948216128, ack 2732850860, win 1332, options [nop,nop,TS val 279724536 ecr 279725804], length 1044
1527830777.626118 IP (tos 0x0, ttl 64, id 42021, offset 0, flags [DF], proto TCP (6), length 1096)
    rpi33.lan.46656 > rpi39.lan.50408: Flags [P.], cksum 0x3b7d (correct), seq 2088:3132, ack 2089, win 1332, options [nop,nop,TS val 279726004 ecr 279725925], length 1044
1527830777.626162 IP (tos 0x0, ttl 64, id 52532, offset 0, flags [DF], proto TCP (6), length 1096)
    rpi33.lan.46656 > rpi35.lan.36908: Flags [P.], cksum 0x1161 (correct), seq 1337548715:1337549759, ack 376117909, win 1332, options [nop,nop,TS val 279726004 ecr 279724325], length 1044
1527830777.626260 IP (tos 0x0, ttl 64, id 32139, offset 0, flags [DF], proto TCP (6), length 1096)
    rpi33.lan.55368 > rpi38.lan.46656: Flags [P.], cksum 0x889a (incorrect -> 0xc8bd), seq 1:1045, ack 1044, win 1324, options [nop,nop,TS val 279726004 ecr 279724536], length 1044
1527830777.626606 IP (tos 0x0, ttl 64, id 40980, offset 0, flags [DF], proto TCP (6), length 1096)
    rpi33.lan.46656 > rpi42.lan.49208: Flags [P.], cksum 0x3f31 (correct), seq 1:1045, ack 1044, win 1332, options [nop,nop,TS val 279726004 ecr 279725982], length 1044
1527830777.626651 IP (tos 0x0, ttl 64, id 40397, offset 0, flags [DF], proto TCP (6), length 1096)
    rpi33.lan.46656 > rpi41.lan.48084: Flags [P.], cksum 0x7e7f (correct), seq 3141730810:3141731854, ack 2247224220, win 1332, options [nop,nop,TS val 279726004 ecr 1582128679], length 1044
1527830777.626676 IP (tos 0x0, ttl 64, id 59670, offset 0, flags [DF], proto TCP (6), length 1096)
    rpi33.lan.55238 > rpi37.lan.46656: Flags [P.], cksum 0x8899 (incorrect -> 0xc612), seq 3071179435:3071180479, ack 129066628, win 1324, options [nop,nop,TS val 279726004 ecr 279725788], length 1044
1527830777.626871 IP (tos 0x0, ttl 64, id 13466, offset 0, flags [DF], proto TCP (6), length 1096)
    rpi33.lan.51354 > rpi34.lan.46656: Flags [P.], cksum 0x8896 (incorrect -> 0xdee9), seq 1518601946:1518602990, ack 135837040, win 1324, options [nop,nop,TS val 279726004 ecr 279725813], length 1044
1527830777.626883 IP (tos 0x0, ttl 64, id 34043, offset 0, flags [DF], proto TCP (6), length 52)
    rpi39.lan.50408 > rpi33.lan.46656: Flags [.], cksum 0x8fe0 (correct), ack 3132, win 1323, options [nop,nop,TS val 279726003 ecr 279726004], length 0
1527830777.627059 IP (tos 0x0, ttl 64, id 15024, offset 0, flags [DF], proto TCP (6), length 52)
    rpi38.lan.46656 > rpi33.lan.55368: Flags [.], cksum 0x2362 (correct), ack 1045, win 1331, options [nop,nop,TS val 279724536 ecr 279726004], length 0
1527830777.627100 IP (tos 0x0, ttl 64, id 39400, offset 0, flags [DF], proto TCP (6), length 1096)
    rpi33.lan.46656 > rpi40.lan.35100: Flags [P.], cksum 0x57f9 (correct), seq 4024313541:4024314585, ack 1145844584, win 1332, options [nop,nop,TS val 279726004 ecr 279723630], length 1044
1527830777.627124 IP (tos 0x0, ttl 64, id 4555, offset 0, flags [DF], proto TCP (6), length 1096)
    rpi33.lan.46656 > rpi36.lan.52404: Flags [P.], cksum 0x2a32 (correct), seq 1:1045, ack 1044, win 1332, options [nop,nop,TS val 279726004 ecr 279726002], length 1044
1527830777.627414 IP (tos 0x0, ttl 64, id 12726, offset 0, flags [DF], proto TCP (6), length 52)
    rpi42.lan.49208 > rpi33.lan.46656: Flags [.], cksum 0xc76b (correct), ack 1045, win 1323, options [nop,nop,TS val 279725984 ecr 279726004], length 0
1527830777.627416 IP (tos 0x0, ttl 64, id 3764, offset 0, flags [DF], proto TCP (6), length 52)
    rpi41.lan.48084 > rpi33.lan.46656: Flags [.], cksum 0x2bbe (correct), ack 1044, win 1323, options [nop,nop,TS val 1582130638 ecr 279726004], length 0
1527830777.627937 IP (tos 0x0, ttl 64, id 23902, offset 0, flags [DF], proto TCP (6), length 52)
    rpi36.lan.52404 > rpi33.lan.46656: Flags [.], cksum 0x0dda (correct), ack 1045, win 1323, options [nop,nop,TS val 279726003 ecr 279726004], length 0
1527830777.628171 IP (tos 0x0, ttl 64, id 3765, offset 0, flags [DF], proto TCP (6), length 1096)
    rpi41.lan.48084 > rpi33.lan.46656: Flags [P.], cksum 0x1144 (correct), seq 1:1045, ack 1044, win 1324, options [nop,nop,TS val 1582130638 ecr 279726004], length 1044
1527830777.632872 IP (tos 0x0, ttl 64, id 20398, offset 0, flags [DF], proto TCP (6), length 1096)
    rpi35.lan.36908 > rpi33.lan.46656: Flags [P.], cksum 0x03f5 (correct), seq 1:1045, ack 1044, win 1324, options [nop,nop,TS val 279724525 ecr 279726004], length 1044
1527830777.632948 IP (tos 0x0, ttl 64, id 52533, offset 0, flags [DF], proto TCP (6), length 52)
    rpi33.lan.46656 > rpi35.lan.36908: Flags [.], cksum 0x8483 (incorrect -> 0x133a), ack 1045, win 1331, options [nop,nop,TS val 279726004 ecr 279724525], length 0
1527830777.636862 IP (tos 0x0, ttl 64, id 20386, offset 0, flags [DF], proto TCP (6), length 1096)
    rpi34.lan.46656 > rpi33.lan.51354: Flags [P.], cksum 0x8fe0 (correct), seq 1:1045, ack 1044, win 1332, options [nop,nop,TS val 279726013 ecr 279726004], length 1044
1527830777.636938 IP (tos 0x0, ttl 64, id 13467, offset 0, flags [DF], proto TCP (6), length 52)
    rpi33.lan.51354 > rpi34.lan.46656: Flags [.], cksum 0x8482 (incorrect -> 0x9681), ack 1045, win 1323, options [nop,nop,TS val 279726005 ecr 279726013], length 0
1527830777.638793 IP (tos 0x0, ttl 64, id 34044, offset 0, flags [DF], proto TCP (6), length 1096)
    rpi39.lan.50408 > rpi33.lan.46656: Flags [P.], cksum 0xbfae (correct), seq 2089:3133, ack 3132, win 1324, options [nop,nop,TS val 279726004 ecr 279726004], length 1044
1527830777.641300 IP (tos 0x0, ttl 64, id 22148, offset 0, flags [DF], proto TCP (6), length 1096)
    rpi37.lan.46656 > rpi33.lan.55238: Flags [P.], cksum 0xe49c (correct), seq 1:1045, ack 1044, win 1332, options [nop,nop,TS val 279725989 ecr 279726004], length 1044
1527830777.641374 IP (tos 0x0, ttl 64, id 59671, offset 0, flags [DF], proto TCP (6), length 52)
    rpi33.lan.55238 > rpi37.lan.46656: Flags [.], cksum 0x8485 (incorrect -> 0x0662), ack 1045, win 1323, options [nop,nop,TS val 279726005 ecr 279725989], length 0
1527830777.650540 IP (tos 0x0, ttl 64, id 27621, offset 0, flags [DF], proto TCP (6), length 1096)
    rpi40.lan.35100 > rpi33.lan.46656: Flags [P.], cksum 0xd0d7 (correct), seq 1:1045, ack 1044, win 1324, options [nop,nop,TS val 279723830 ecr 279726004], length 1044
1527830777.650621 IP (tos 0x0, ttl 64, id 39401, offset 0, flags [DF], proto TCP (6), length 52)
    rpi33.lan.46656 > rpi40.lan.35100: Flags [.], cksum 0x8488 (incorrect -> 0x6f06), ack 1045, win 1331, options [nop,nop,TS val 279726006 ecr 279723830], length 0
1527830777.674512 IP (tos 0x0, ttl 64, id 40398, offset 0, flags [DF], proto TCP (6), length 52)
    rpi33.lan.46656 > rpi41.lan.48084: Flags [.], cksum 0x8489 (incorrect -> 0x279c), ack 1045, win 1332, options [nop,nop,TS val 279726009 ecr 1582130638], length 0
1527830777.684492 IP (tos 0x0, ttl 64, id 42022, offset 0, flags [DF], proto TCP (6), length 52)
    rpi33.lan.46656 > rpi39.lan.50408: Flags [.], cksum 0x8487 (incorrect -> 0x8bbc), ack 3133, win 1332, options [nop,nop,TS val 279726010 ecr 279726004], length 0
1527830779.615517 IP (tos 0x0, ttl 64, id 12727, offset 0, flags [DF], proto TCP (6), length 1096)
    rpi42.lan.49208 > rpi33.lan.46656: Flags [P.], cksum 0x7b6f (correct), seq 1044:2088, ack 1045, win 1324, options [nop,nop,TS val 279726182 ecr 279726004], length 1044
1527830779.620941 IP (tos 0x0, ttl 64, id 23903, offset 0, flags [DF], proto TCP (6), length 1096)
    rpi36.lan.52404 > rpi33.lan.46656: Flags [P.], cksum 0xd2b6 (correct), seq 1044:2088, ack 1045, win 1324, options [nop,nop,TS val 279726202 ecr 279726004], length 1044
1527830779.628104 IP (tos 0x0, ttl 64, id 15025, offset 0, flags [DF], proto TCP (6), length 1096)
    rpi38.lan.46656 > rpi33.lan.55368: Flags [P.], cksum 0xa976 (correct), seq 1044:2088, ack 1045, win 1332, options [nop,nop,TS val 279724736 ecr 279726004], length 1044
1527830779.629724 IP (tos 0x0, ttl 64, id 13468, offset 0, flags [DF], proto TCP (6), length 1096)
    rpi33.lan.51354 > rpi34.lan.46656: Flags [P.], cksum 0x8896 (incorrect -> 0x40f2), seq 1044:2088, ack 1045, win 1324, options [nop,nop,TS val 279726204 ecr 279726013], length 1044
1527830779.630104 IP (tos 0x0, ttl 64, id 32140, offset 0, flags [DF], proto TCP (6), length 1096)
    rpi33.lan.55368 > rpi38.lan.46656: Flags [P.], cksum 0x889a (incorrect -> 0x1056), seq 1045:2089, ack 2088, win 1324, options [nop,nop,TS val 279726204 ecr 279724736], length 1044
1527830779.630403 IP (tos 0x0, ttl 64, id 52534, offset 0, flags [DF], proto TCP (6), length 1096)
    rpi33.lan.46656 > rpi35.lan.36908: Flags [P.], cksum 0x3cda (correct), seq 1044:2088, ack 1045, win 1332, options [nop,nop,TS val 279726204 ecr 279724525], length 1044
1527830779.630609 IP (tos 0x0, ttl 64, id 4556, offset 0, flags [DF], proto TCP (6), length 1096)
    rpi33.lan.46656 > rpi36.lan.52404: Flags [P.], cksum 0x7bf4 (correct), seq 1045:2089, ack 2088, win 1332, options [nop,nop,TS val 279726204 ecr 279726202], length 1044
1527830779.630817 IP (tos 0x0, ttl 64, id 59672, offset 0, flags [DF], proto TCP (6), length 1096)
    rpi33.lan.55238 > rpi37.lan.46656: Flags [P.], cksum 0x8899 (incorrect -> 0x3f69), seq 1044:2088, ack 1045, win 1324, options [nop,nop,TS val 279726204 ecr 279725989], length 1044
1527830779.630894 IP (tos 0x0, ttl 64, id 15026, offset 0, flags [DF], proto TCP (6), length 52)
    rpi38.lan.46656 > rpi33.lan.55368: Flags [.], cksum 0x19a9 (correct), ack 2089, win 1331, options [nop,nop,TS val 279724737 ecr 279726204], length 0
1527830779.631190 IP (tos 0x0, ttl 64, id 39402, offset 0, flags [DF], proto TCP (6), length 1096)
    rpi33.lan.46656 > rpi40.lan.35100: Flags [P.], cksum 0xa3ed (correct), seq 1044:2088, ack 1045, win 1332, options [nop,nop,TS val 279726204 ecr 279723830], length 1044
1527830779.631245 IP (tos 0x0, ttl 64, id 42023, offset 0, flags [DF], proto TCP (6), length 1096)
    rpi33.lan.46656 > rpi39.lan.50408: Flags [P.], cksum 0x1cd0 (correct), seq 3132:4176, ack 3133, win 1332, options [nop,nop,TS val 279726204 ecr 279726004], length 1044
1527830779.631453 IP (tos 0x0, ttl 64, id 40981, offset 0, flags [DF], proto TCP (6), length 1096)
    rpi33.lan.46656 > rpi42.lan.49208: Flags [P.], cksum 0xd123 (correct), seq 1045:2089, ack 2088, win 1332, options [nop,nop,TS val 279726204 ecr 279726182], length 1044
1527830779.631510 IP (tos 0x0, ttl 64, id 40399, offset 0, flags [DF], proto TCP (6), length 1096)
    rpi33.lan.46656 > rpi41.lan.48084: Flags [P.], cksum 0xd017 (correct), seq 1044:2088, ack 1045, win 1332, options [nop,nop,TS val 279726204 ecr 1582130638], length 1044
1527830779.631581 IP (tos 0x0, ttl 64, id 23904, offset 0, flags [DF], proto TCP (6), length 52)
    rpi36.lan.52404 > rpi33.lan.46656: Flags [.], cksum 0x0422 (correct), ack 2089, win 1323, options [nop,nop,TS val 279726203 ecr 279726204], length 0
1527830779.631582 IP (tos 0x0, ttl 64, id 3766, offset 0, flags [DF], proto TCP (6), length 1096)
    rpi41.lan.48084 > rpi33.lan.46656: Flags [P.], cksum 0xcce6 (correct), seq 1045:2089, ack 1044, win 1324, options [nop,nop,TS val 1582132642 ecr 279726009], length 1044
1527830779.631708 IP (tos 0x0, ttl 64, id 40400, offset 0, flags [DF], proto TCP (6), length 52)
    rpi33.lan.46656 > rpi41.lan.48084: Flags [.], cksum 0x8489 (incorrect -> 0x16de), ack 2089, win 1331, options [nop,nop,TS val 279726204 ecr 1582132642], length 0
1527830779.632220 IP (tos 0x0, ttl 64, id 12728, offset 0, flags [DF], proto TCP (6), length 52)
    rpi42.lan.49208 > rpi33.lan.46656: Flags [.], cksum 0xbdb3 (correct), ack 2089, win 1323, options [nop,nop,TS val 279726184 ecr 279726204], length 0
1527830779.636146 IP (tos 0x0, ttl 64, id 20399, offset 0, flags [DF], proto TCP (6), length 1096)
    rpi35.lan.36908 > rpi33.lan.46656: Flags [P.], cksum 0x6459 (correct), seq 1045:2089, ack 2088, win 1324, options [nop,nop,TS val 279724726 ecr 279726204], length 1044
1527830779.636213 IP (tos 0x0, ttl 64, id 52535, offset 0, flags [DF], proto TCP (6), length 52)
    rpi33.lan.46656 > rpi35.lan.36908: Flags [.], cksum 0x8483 (incorrect -> 0x0980), ack 2089, win 1331, options [nop,nop,TS val 279726205 ecr 279724726], length 0
1527830779.640001 IP (tos 0x0, ttl 64, id 20387, offset 0, flags [DF], proto TCP (6), length 1096)
    rpi34.lan.46656 > rpi33.lan.51354: Flags [P.], cksum 0x37af (correct), seq 1045:2089, ack 2088, win 1332, options [nop,nop,TS val 279726214 ecr 279726204], length 1044
1527830779.640067 IP (tos 0x0, ttl 64, id 13469, offset 0, flags [DF], proto TCP (6), length 52)
    rpi33.lan.51354 > rpi34.lan.46656: Flags [.], cksum 0x8482 (incorrect -> 0x8cc8), ack 2089, win 1323, options [nop,nop,TS val 279726205 ecr 279726214], length 0
1527830779.642376 IP (tos 0x0, ttl 64, id 34045, offset 0, flags [DF], proto TCP (6), length 1096)
    rpi39.lan.50408 > rpi33.lan.46656: Flags [P.], cksum 0xa541 (correct), seq 3133:4177, ack 4176, win 1324, options [nop,nop,TS val 279726205 ecr 279726204], length 1044
1527830779.642441 IP (tos 0x0, ttl 64, id 42024, offset 0, flags [DF], proto TCP (6), length 52)
    rpi33.lan.46656 > rpi39.lan.50408: Flags [.], cksum 0x8487 (incorrect -> 0x8209), ack 4177, win 1331, options [nop,nop,TS val 279726205 ecr 279726205], length 0
1527830779.644460 IP (tos 0x0, ttl 64, id 22149, offset 0, flags [DF], proto TCP (6), length 1096)
    rpi37.lan.46656 > rpi33.lan.55238: Flags [P.], cksum 0x9cb3 (correct), seq 1045:2089, ack 2088, win 1332, options [nop,nop,TS val 279726189 ecr 279726204], length 1044
1527830779.644523 IP (tos 0x0, ttl 64, id 59673, offset 0, flags [DF], proto TCP (6), length 52)
    rpi33.lan.55238 > rpi37.lan.46656: Flags [.], cksum 0x8485 (incorrect -> 0xfca8), ack 2089, win 1323, options [nop,nop,TS val 279726206 ecr 279726189], length 0
1527830779.654723 IP (tos 0x0, ttl 64, id 27622, offset 0, flags [DF], proto TCP (6), length 1096)
    rpi40.lan.35100 > rpi33.lan.46656: Flags [P.], cksum 0xaf35 (correct), seq 1045:2089, ack 2088, win 1324, options [nop,nop,TS val 279724031 ecr 279726204], length 1044
1527830779.654788 IP (tos 0x0, ttl 64, id 39403, offset 0, flags [DF], proto TCP (6), length 52)
    rpi33.lan.46656 > rpi40.lan.35100: Flags [.], cksum 0x8488 (incorrect -> 0x654c), ack 2089, win 1331, options [nop,nop,TS val 279726207 ecr 279724031], length 0
1527830779.678526 IP (tos 0x0, ttl 64, id 3767, offset 0, flags [DF], proto TCP (6), length 52)
    rpi41.lan.48084 > rpi33.lan.46656: Flags [.], cksum 0x16b6 (correct), ack 2088, win 1324, options [nop,nop,TS val 1582132689 ecr 279726204], length 0
1527830781.622270 IP (tos 0x0, ttl 64, id 12729, offset 0, flags [DF], proto TCP (6), length 1096)
    rpi42.lan.49208 > rpi33.lan.46656: Flags [P.], cksum 0x7230 (correct), seq 2088:3132, ack 2089, win 1324, options [nop,nop,TS val 279726383 ecr 279726204], length 1044
1527830781.624432 IP (tos 0x0, ttl 64, id 23905, offset 0, flags [DF], proto TCP (6), length 1096)
    rpi36.lan.52404 > rpi33.lan.46656: Flags [P.], cksum 0xe02f (correct), seq 2088:3132, ack 2089, win 1324, options [nop,nop,TS val 279726403 ecr 279726204], length 1044
1527830781.631309 IP (tos 0x0, ttl 64, id 15027, offset 0, flags [DF], proto TCP (6), length 1096)
    rpi38.lan.46656 > rpi33.lan.55368: Flags [P.], cksum 0x1a33 (correct), seq 2088:3132, ack 2089, win 1332, options [nop,nop,TS val 279724937 ecr 279726204], length 1044
1527830781.633171 IP (tos 0x0, ttl 64, id 13470, offset 0, flags [DF], proto TCP (6), length 1096)
    rpi33.lan.51354 > rpi34.lan.46656: Flags [P.], cksum 0x8896 (incorrect -> 0xc5db), seq 2088:3132, ack 2089, win 1324, options [nop,nop,TS val 279726404 ecr 279726214], length 1044
1527830781.633213 IP (tos 0x0, ttl 64, id 4557, offset 0, flags [DF], proto TCP (6), length 1096)
    rpi33.lan.46656 > rpi36.lan.52404: Flags [P.], cksum 0x5e56 (correct), seq 2089:3133, ack 3132, win 1332, options [nop,nop,TS val 279726404 ecr 279726403], length 1044
1527830781.633364 IP (tos 0x0, ttl 64, id 40982, offset 0, flags [DF], proto TCP (6), length 1096)
    rpi33.lan.46656 > rpi42.lan.49208: Flags [P.], cksum 0x1214 (correct), seq 2089:3133, ack 3132, win 1332, options [nop,nop,TS val 279726404 ecr 279726383], length 1044
1527830781.633390 IP (tos 0x0, ttl 64, id 40401, offset 0, flags [DF], proto TCP (6), length 1096)
    rpi33.lan.46656 > rpi41.lan.48084: Flags [P.], cksum 0x94ce (correct), seq 2088:3132, ack 2089, win 1332, options [nop,nop,TS val 279726404 ecr 1582132689], length 1044
1527830781.633426 IP (tos 0x0, ttl 64, id 52536, offset 0, flags [DF], proto TCP (6), length 1096)
    rpi33.lan.46656 > rpi35.lan.36908: Flags [P.], cksum 0x6977 (correct), seq 2088:3132, ack 2089, win 1332, options [nop,nop,TS val 279726404 ecr 279724726], length 1044
1527830781.633637 IP (tos 0x0, ttl 64, id 32141, offset 0, flags [DF], proto TCP (6), length 1096)
    rpi33.lan.55368 > rpi38.lan.46656: Flags [P.], cksum 0x889a (incorrect -> 0xc72f), seq 2089:3133, ack 3132, win 1324, options [nop,nop,TS val 279726404 ecr 279724937], length 1044
1527830781.633759 IP (tos 0x0, ttl 64, id 39404, offset 0, flags [DF], proto TCP (6), length 1096)
    rpi33.lan.46656 > rpi40.lan.35100: Flags [P.], cksum 0x52d3 (correct), seq 2088:3132, ack 2089, win 1332, options [nop,nop,TS val 279726404 ecr 279724031], length 1044
1527830781.634061 IP (tos 0x0, ttl 64, id 23906, offset 0, flags [DF], proto TCP (6), length 52)
    rpi36.lan.52404 > rpi33.lan.46656: Flags [.], cksum 0xfa68 (correct), ack 3133, win 1323, options [nop,nop,TS val 279726404 ecr 279726404], length 0
1527830781.634064 IP (tos 0x0, ttl 64, id 12730, offset 0, flags [DF], proto TCP (6), length 52)
    rpi42.lan.49208 > rpi33.lan.46656: Flags [.], cksum 0xb3fb (correct), ack 3133, win 1323, options [nop,nop,TS val 279726384 ecr 279726404], length 0
1527830781.634142 IP (tos 0x0, ttl 64, id 42025, offset 0, flags [DF], proto TCP (6), length 1096)
    rpi33.lan.46656 > rpi39.lan.50408: Flags [P.], cksum 0x2e33 (correct), seq 4176:5220, ack 4177, win 1332, options [nop,nop,TS val 279726404 ecr 279726205], length 1044
1527830781.634066 IP (tos 0x0, ttl 64, id 3768, offset 0, flags [DF], proto TCP (6), length 52)
    rpi41.lan.48084 > rpi33.lan.46656: Flags [.], cksum 0x0a37 (correct), ack 3132, win 1323, options [nop,nop,TS val 1582134645 ecr 279726404], length 0
1527830781.634169 IP (tos 0x0, ttl 64, id 59674, offset 0, flags [DF], proto TCP (6), length 1096)
    rpi33.lan.55238 > rpi37.lan.46656: Flags [P.], cksum 0x8899 (incorrect -> 0xbe28), seq 2088:3132, ack 2089, win 1324, options [nop,nop,TS val 279726404 ecr 279726189], length 1044
1527830781.634414 IP (tos 0x0, ttl 64, id 15028, offset 0, flags [DF], proto TCP (6), length 52)
    rpi38.lan.46656 > rpi33.lan.55368: Flags [.], cksum 0x0ff1 (correct), ack 3133, win 1331, options [nop,nop,TS val 279724937 ecr 279726404], length 0
1527830781.635256 IP (tos 0x0, ttl 64, id 3769, offset 0, flags [DF], proto TCP (6), length 1096)
    rpi41.lan.48084 > rpi33.lan.46656: Flags [P.], cksum 0x717a (correct), seq 2089:3133, ack 3132, win 1324, options [nop,nop,TS val 1582134645 ecr 279726404], length 1044
1527830781.635317 IP (tos 0x0, ttl 64, id 40402, offset 0, flags [DF], proto TCP (6), length 52)
    rpi33.lan.46656 > rpi41.lan.48084: Flags [.], cksum 0x8489 (incorrect -> 0x061a), ack 3133, win 1331, options [nop,nop,TS val 279726405 ecr 1582134645], length 0
1527830781.640056 IP (tos 0x0, ttl 64, id 20400, offset 0, flags [DF], proto TCP (6), length 1096)
    rpi35.lan.36908 > rpi33.lan.46656: Flags [P.], cksum 0x3c9b (correct), seq 2089:3133, ack 3132, win 1324, options [nop,nop,TS val 279724926 ecr 279726404], length 1044
1527830781.640132 IP (tos 0x0, ttl 64, id 52537, offset 0, flags [DF], proto TCP (6), length 52)
    rpi33.lan.46656 > rpi35.lan.36908: Flags [.], cksum 0x8483 (incorrect -> 0xffc7), ack 3133, win 1331, options [nop,nop,TS val 279726405 ecr 279724926], length 0
1527830781.644152 IP (tos 0x0, ttl 64, id 20388, offset 0, flags [DF], proto TCP (6), length 1096)
    rpi34.lan.46656 > rpi33.lan.51354: Flags [P.], cksum 0xdee2 (correct), seq 2089:3133, ack 3132, win 1332, options [nop,nop,TS val 279726414 ecr 279726404], length 1044
1527830781.644223 IP (tos 0x0, ttl 64, id 13471, offset 0, flags [DF], proto TCP (6), length 52)
    rpi33.lan.51354 > rpi34.lan.46656: Flags [.], cksum 0x8482 (incorrect -> 0x8310), ack 3133, win 1323, options [nop,nop,TS val 279726405 ecr 279726414], length 0
1527830781.645473 IP (tos 0x0, ttl 64, id 34046, offset 0, flags [DF], proto TCP (6), length 1096)
    rpi39.lan.50408 > rpi33.lan.46656: Flags [P.], cksum 0xb826 (correct), seq 4177:5221, ack 5220, win 1324, options [nop,nop,TS val 279726405 ecr 279726404], length 1044
1527830781.645548 IP (tos 0x0, ttl 64, id 42026, offset 0, flags [DF], proto TCP (6), length 52)
    rpi33.lan.46656 > rpi39.lan.50408: Flags [.], cksum 0x8487 (incorrect -> 0x7850), ack 5221, win 1331, options [nop,nop,TS val 279726406 ecr 279726405], length 0
1527830781.648319 IP (tos 0x0, ttl 64, id 22150, offset 0, flags [DF], proto TCP (6), length 1096)
    rpi37.lan.46656 > rpi33.lan.55238: Flags [P.], cksum 0x05a5 (correct), seq 2089:3133, ack 3132, win 1332, options [nop,nop,TS val 279726390 ecr 279726404], length 1044
1527830781.648390 IP (tos 0x0, ttl 64, id 59675, offset 0, flags [DF], proto TCP (6), length 52)
    rpi33.lan.55238 > rpi37.lan.46656: Flags [.], cksum 0x8485 (incorrect -> 0xf2ef), ack 3133, win 1323, options [nop,nop,TS val 279726406 ecr 279726390], length 0
1527830781.657604 IP (tos 0x0, ttl 64, id 27623, offset 0, flags [DF], proto TCP (6), length 1096)
    rpi40.lan.35100 > rpi33.lan.46656: Flags [P.], cksum 0x1cc6 (correct), seq 2089:3133, ack 3132, win 1324, options [nop,nop,TS val 279724231 ecr 279726404], length 1044
1527830781.657681 IP (tos 0x0, ttl 64, id 39405, offset 0, flags [DF], proto TCP (6), length 52)
    rpi33.lan.46656 > rpi40.lan.35100: Flags [.], cksum 0x8488 (incorrect -> 0x5b94), ack 3133, win 1331, options [nop,nop,TS val 279726407 ecr 279724231], length 0
1527830782.402082 IP (tos 0x0, ttl 64, id 40983, offset 0, flags [DF], proto TCP (6), length 1096)
    rpi33.lan.46656 > rpi42.lan.49208: Flags [P.], cksum 0xca7b (correct), seq 3133:4177, ack 3132, win 1332, options [nop,nop,TS val 279726481 ecr 279726384], length 1044
1527830782.402955 IP (tos 0x0, ttl 64, id 12731, offset 0, flags [DF], proto TCP (6), length 52)
    rpi42.lan.49208 > rpi33.lan.46656: Flags [.], cksum 0xaf4d (correct), ack 4177, win 1323, options [nop,nop,TS val 279726461 ecr 279726481], length 0
1527830782.403692 IP (tos 0x0, ttl 64, id 12732, offset 0, flags [DF], proto TCP (6), length 1096)
    rpi42.lan.49208 > rpi33.lan.46656: Flags [P.], cksum 0xfddc (correct), seq 3132:4176, ack 4177, win 1324, options [nop,nop,TS val 279726461 ecr 279726481], length 1044
1527830782.407164 IP (tos 0x0, ttl 64, id 12733, offset 0, flags [DF], proto TCP (6), length 1096)
    rpi42.lan.49208 > rpi33.lan.46656: Flags [P.], cksum 0x4e04 (correct), seq 4176:5220, ack 4177, win 1324, options [nop,nop,TS val 279726461 ecr 279726481], length 1044
1527830782.407299 IP (tos 0x0, ttl 64, id 40984, offset 0, flags [DF], proto TCP (6), length 52)
    rpi33.lan.46656 > rpi42.lan.49208: Flags [.], cksum 0x848a (incorrect -> 0xa71b), ack 5220, win 1332, options [nop,nop,TS val 279726482 ecr 279726461], length 0
1527830782.407735 IP (tos 0x0, ttl 64, id 40985, offset 0, flags [DF], proto TCP (6), length 1096)
    rpi33.lan.46656 > rpi42.lan.49208: Flags [P.], cksum 0x3966 (correct), seq 4177:5221, ack 5220, win 1332, options [nop,nop,TS val 279726482 ecr 279726461], length 1044
1527830782.457233 IP (tos 0x0, ttl 64, id 12734, offset 0, flags [DF], proto TCP (6), length 52)
    rpi42.lan.49208 > rpi33.lan.46656: Flags [.], cksum 0xa309 (correct), ack 5221, win 1324, options [nop,nop,TS val 279726467 ecr 279726482], length 0
1527830783.623550 IP (tos 0x0, ttl 64, id 12735, offset 0, flags [DF], proto TCP (6), length 1096)
    rpi42.lan.49208 > rpi33.lan.46656: Flags [P.], cksum 0x8284 (correct), seq 5220:6264, ack 5221, win 1324, options [nop,nop,TS val 279726583 ecr 279726482], length 1044
1527830783.629051 IP (tos 0x0, ttl 64, id 23907, offset 0, flags [DF], proto TCP (6), length 1096)
    rpi36.lan.52404 > rpi33.lan.46656: Flags [P.], cksum 0x77a6 (correct), seq 3132:4176, ack 3133, win 1324, options [nop,nop,TS val 279726603 ecr 279726404], length 1044
1527830783.634741 IP (tos 0x0, ttl 64, id 15029, offset 0, flags [DF], proto TCP (6), length 1096)
    rpi38.lan.46656 > rpi33.lan.55368: Flags [P.], cksum 0xfe33 (correct), seq 3132:4176, ack 3133, win 1332, options [nop,nop,TS val 279725137 ecr 279726404], length 1044
1527830783.636991 IP (tos 0x0, ttl 64, id 13472, offset 0, flags [DF], proto TCP (6), length 1096)
    rpi33.lan.51354 > rpi34.lan.46656: Flags [P.], cksum 0x8896 (incorrect -> 0x4bb9), seq 3132:4176, ack 3133, win 1324, options [nop,nop,TS val 279726605 ecr 279726414], length 1044
1527830783.637598 IP (tos 0x0, ttl 64, id 52538, offset 0, flags [DF], proto TCP (6), length 1096)
    rpi33.lan.46656 > rpi35.lan.36908: Flags [P.], cksum 0x5dc4 (correct), seq 3132:4176, ack 3133, win 1332, options [nop,nop,TS val 279726605 ecr 279724926], length 1044
1527830783.637897 IP (tos 0x0, ttl 64, id 4558, offset 0, flags [DF], proto TCP (6), length 1096)
    rpi33.lan.46656 > rpi36.lan.52404: Flags [P.], cksum 0xb816 (correct), seq 3133:4177, ack 4176, win 1332, options [nop,nop,TS val 279726605 ecr 279726603], length 1044
1527830783.638207 IP (tos 0x0, ttl 64, id 59676, offset 0, flags [DF], proto TCP (6), length 1096)
    rpi33.lan.55238 > rpi37.lan.46656: Flags [P.], cksum 0x8899 (incorrect -> 0xc1b7), seq 3132:4176, ack 3133, win 1324, options [nop,nop,TS val 279726605 ecr 279726390], length 1044
1527830783.638413 IP (tos 0x0, ttl 64, id 32142, offset 0, flags [DF], proto TCP (6), length 1096)
    rpi33.lan.55368 > rpi38.lan.46656: Flags [P.], cksum 0x889a (incorrect -> 0xa3f2), seq 3133:4177, ack 4176, win 1324, options [nop,nop,TS val 279726605 ecr 279725137], length 1044
1527830783.638719 IP (tos 0x0, ttl 64, id 42027, offset 0, flags [DF], proto TCP (6), length 1096)
    rpi33.lan.46656 > rpi39.lan.50408: Flags [P.], cksum 0xe7ce (correct), seq 5220:6264, ack 5221, win 1332, options [nop,nop,TS val 279726605 ecr 279726405], length 1044
1527830783.638746 IP (tos 0x0, ttl 64, id 39406, offset 0, flags [DF], proto TCP (6), length 1096)
    rpi33.lan.46656 > rpi40.lan.35100: Flags [P.], cksum 0x36a2 (correct), seq 3132:4176, ack 3133, win 1332, options [nop,nop,TS val 279726605 ecr 279724231], length 1044
1527830783.638824 IP (tos 0x0, ttl 64, id 23908, offset 0, flags [DF], proto TCP (6), length 52)
    rpi36.lan.52404 > rpi33.lan.46656: Flags [.], cksum 0xf0af (correct), ack 4177, win 1323, options [nop,nop,TS val 279726604 ecr 279726605], length 0
1527830783.639187 IP (tos 0x0, ttl 64, id 3770, offset 0, flags [DF], proto TCP (6), length 1096)
    rpi41.lan.48084 > rpi33.lan.46656: Flags [P.], cksum 0x233f (correct), seq 3133:4177, ack 3132, win 1324, options [nop,nop,TS val 1582136649 ecr 279726405], length 1044
1527830783.639257 IP (tos 0x0, ttl 64, id 40403, offset 0, flags [DF], proto TCP (6), length 52)
    rpi33.lan.46656 > rpi41.lan.48084: Flags [.], cksum 0x8489 (incorrect -> 0xf969), ack 4177, win 1331, options [nop,nop,TS val 279726605 ecr 1582136649], length 0
1527830783.639189 IP (tos 0x0, ttl 64, id 15030, offset 0, flags [DF], proto TCP (6), length 52)
    rpi38.lan.46656 > rpi33.lan.55368: Flags [.], cksum 0x0638 (correct), ack 4177, win 1331, options [nop,nop,TS val 279725137 ecr 279726605], length 0
1527830783.639324 IP (tos 0x0, ttl 64, id 40986, offset 0, flags [DF], proto TCP (6), length 1096)
    rpi33.lan.46656 > rpi42.lan.49208: Flags [P.], cksum 0xc506 (correct), seq 5221:6265, ack 6264, win 1332, options [nop,nop,TS val 279726605 ecr 279726583], length 1044
1527830783.639936 IP (tos 0x0, ttl 64, id 40404, offset 0, flags [DF], proto TCP (6), length 1096)
    rpi33.lan.46656 > rpi41.lan.48084: Flags [P.], cksum 0x0765 (correct), seq 3132:4176, ack 4177, win 1332, options [nop,nop,TS val 279726605 ecr 1582136649], length 1044
1527830783.640117 IP (tos 0x0, ttl 64, id 12736, offset 0, flags [DF], proto TCP (6), length 52)
    rpi42.lan.49208 > rpi33.lan.46656: Flags [.], cksum 0x99f1 (correct), ack 6265, win 1323, options [nop,nop,TS val 279726585 ecr 279726605], length 0
1527830783.643386 IP (tos 0x0, ttl 64, id 20401, offset 0, flags [DF], proto TCP (6), length 1096)
    rpi35.lan.36908 > rpi33.lan.46656: Flags [P.], cksum 0xa5b4 (correct), seq 3133:4177, ack 4176, win 1324, options [nop,nop,TS val 279725126 ecr 279726605], length 1044
1527830783.643458 IP (tos 0x0, ttl 64, id 52539, offset 0, flags [DF], proto TCP (6), length 52)
    rpi33.lan.46656 > rpi35.lan.36908: Flags [.], cksum 0x8483 (incorrect -> 0xf60f), ack 4177, win 1331, options [nop,nop,TS val 279726605 ecr 279725126], length 0
1527830783.646856 IP (tos 0x0, ttl 64, id 20389, offset 0, flags [DF], proto TCP (6), length 1096)
    rpi34.lan.46656 > rpi33.lan.51354: Flags [P.], cksum 0xf41f (correct), seq 3133:4177, ack 4176, win 1332, options [nop,nop,TS val 279726614 ecr 279726605], length 1044
1527830783.646920 IP (tos 0x0, ttl 64, id 13473, offset 0, flags [DF], proto TCP (6), length 52)
    rpi33.lan.51354 > rpi34.lan.46656: Flags [.], cksum 0x8482 (incorrect -> 0x7957), ack 4177, win 1323, options [nop,nop,TS val 279726606 ecr 279726614], length 0
1527830783.649917 IP (tos 0x0, ttl 64, id 34047, offset 0, flags [DF], proto TCP (6), length 1096)
    rpi39.lan.50408 > rpi33.lan.46656: Flags [P.], cksum 0x59a1 (correct), seq 5221:6265, ack 6264, win 1324, options [nop,nop,TS val 279726605 ecr 279726605], length 1044
1527830783.649981 IP (tos 0x0, ttl 64, id 42028, offset 0, flags [DF], proto TCP (6), length 52)
    rpi33.lan.46656 > rpi39.lan.50408: Flags [.], cksum 0x8487 (incorrect -> 0x6e98), ack 6265, win 1331, options [nop,nop,TS val 279726606 ecr 279726605], length 0
1527830783.651480 IP (tos 0x0, ttl 64, id 22151, offset 0, flags [DF], proto TCP (6), length 1096)
    rpi37.lan.46656 > rpi33.lan.55238: Flags [P.], cksum 0x3473 (correct), seq 3133:4177, ack 4176, win 1332, options [nop,nop,TS val 279726590 ecr 279726605], length 1044
1527830783.651546 IP (tos 0x0, ttl 64, id 59677, offset 0, flags [DF], proto TCP (6), length 52)
    rpi33.lan.55238 > rpi37.lan.46656: Flags [.], cksum 0x8485 (incorrect -> 0xe937), ack 4177, win 1323, options [nop,nop,TS val 279726606 ecr 279726590], length 0
1527830783.661063 IP (tos 0x0, ttl 64, id 27624, offset 0, flags [DF], proto TCP (6), length 1096)
    rpi40.lan.35100 > rpi33.lan.46656: Flags [P.], cksum 0x8f80 (correct), seq 3133:4177, ack 4176, win 1324, options [nop,nop,TS val 279724431 ecr 279726605], length 1044
1527830783.661131 IP (tos 0x0, ttl 64, id 39407, offset 0, flags [DF], proto TCP (6), length 52)
    rpi33.lan.46656 > rpi40.lan.35100: Flags [.], cksum 0x8488 (incorrect -> 0x51dc), ack 4177, win 1331, options [nop,nop,TS val 279726607 ecr 279724431], length 0
1527830783.688537 IP (tos 0x0, ttl 64, id 3771, offset 0, flags [DF], proto TCP (6), length 52)
    rpi41.lan.48084 > rpi33.lan.46656: Flags [.], cksum 0xf52a (correct), ack 4176, win 1324, options [nop,nop,TS val 1582136699 ecr 279726605], length 0
1527830785.626588 IP (tos 0x0, ttl 64, id 12737, offset 0, flags [DF], proto TCP (6), length 1096)
    rpi42.lan.49208 > rpi33.lan.46656: Flags [P.], cksum 0x2bad (correct), seq 6264:7308, ack 6265, win 1324, options [nop,nop,TS val 279726783 ecr 279726605], length 1044
1527830785.631791 IP (tos 0x0, ttl 64, id 23909, offset 0, flags [DF], proto TCP (6), length 1096)
    rpi36.lan.52404 > rpi33.lan.46656: Flags [P.], cksum 0x7a3e (correct), seq 4176:5220, ack 4177, win 1324, options [nop,nop,TS val 279726803 ecr 279726605], length 1044
1527830785.638441 IP (tos 0x0, ttl 64, id 15031, offset 0, flags [DF], proto TCP (6), length 1096)
    rpi38.lan.46656 > rpi33.lan.55368: Flags [P.], cksum 0xa22a (correct), seq 4176:5220, ack 4177, win 1332, options [nop,nop,TS val 279725337 ecr 279726605], length 1044
1527830785.640140 IP (tos 0x0, ttl 64, id 52540, offset 0, flags [DF], proto TCP (6), length 1096)
    rpi33.lan.46656 > rpi35.lan.36908: Flags [P.], cksum 0x151f (correct), seq 4176:5220, ack 4177, win 1332, options [nop,nop,TS val 279726805 ecr 279725126], length 1044
1527830785.640198 IP (tos 0x0, ttl 64, id 4559, offset 0, flags [DF], proto TCP (6), length 1096)
    rpi33.lan.46656 > rpi36.lan.52404: Flags [P.], cksum 0xb7ef (correct), seq 4177:5221, ack 5220, win 1332, options [nop,nop,TS val 279726805 ecr 279726803], length 1044
1527830785.640624 IP (tos 0x0, ttl 64, id 40987, offset 0, flags [DF], proto TCP (6), length 1096)
    rpi33.lan.46656 > rpi42.lan.49208: Flags [P.], cksum 0xd1b9 (correct), seq 6265:7309, ack 7308, win 1332, options [nop,nop,TS val 279726805 ecr 279726783], length 1044
1527830785.640655 IP (tos 0x0, ttl 64, id 59678, offset 0, flags [DF], proto TCP (6), length 1096)
    rpi33.lan.55238 > rpi37.lan.46656: Flags [P.], cksum 0x8899 (incorrect -> 0x71c1), seq 4176:5220, ack 4177, win 1324, options [nop,nop,TS val 279726805 ecr 279726590], length 1044
1527830785.640891 IP (tos 0x0, ttl 64, id 13474, offset 0, flags [DF], proto TCP (6), length 1096)
    rpi33.lan.51354 > rpi34.lan.46656: Flags [P.], cksum 0x8896 (incorrect -> 0xcf11), seq 4176:5220, ack 4177, win 1324, options [nop,nop,TS val 279726805 ecr 279726614], length 1044
1527830785.640917 IP (tos 0x0, ttl 64, id 39408, offset 0, flags [DF], proto TCP (6), length 1096)
    rpi33.lan.46656 > rpi40.lan.35100: Flags [P.], cksum 0xa1eb (correct), seq 4176:5220, ack 4177, win 1332, options [nop,nop,TS val 279726805 ecr 279724431], length 1044
1527830785.641029 IP (tos 0x0, ttl 64, id 23910, offset 0, flags [DF], proto TCP (6), length 52)
    rpi36.lan.52404 > rpi33.lan.46656: Flags [.], cksum 0xe6f7 (correct), ack 5221, win 1323, options [nop,nop,TS val 279726804 ecr 279726805], length 0
1527830785.641069 IP (tos 0x0, ttl 64, id 32143, offset 0, flags [DF], proto TCP (6), length 1096)
    rpi33.lan.55368 > rpi38.lan.46656: Flags [P.], cksum 0x889a (incorrect -> 0x3df8), seq 4177:5221, ack 5220, win 1324, options [nop,nop,TS val 279726805 ecr 279725337], length 1044
1527830785.641281 IP (tos 0x0, ttl 64, id 42029, offset 0, flags [DF], proto TCP (6), length 1096)
    rpi33.lan.46656 > rpi39.lan.50408: Flags [P.], cksum 0x251d (correct), seq 6264:7308, ack 6265, win 1332, options [nop,nop,TS val 279726805 ecr 279726605], length 1044
1527830785.641306 IP (tos 0x0, ttl 64, id 40405, offset 0, flags [DF], proto TCP (6), length 1096)
    rpi33.lan.46656 > rpi41.lan.48084: Flags [P.], cksum 0x54f3 (correct), seq 4176:5220, ack 4177, win 1332, options [nop,nop,TS val 279726805 ecr 1582136699], length 1044
1527830785.641477 IP (tos 0x0, ttl 64, id 12738, offset 0, flags [DF], proto TCP (6), length 52)
    rpi42.lan.49208 > rpi33.lan.46656: Flags [.], cksum 0x9039 (correct), ack 7309, win 1323, options [nop,nop,TS val 279726785 ecr 279726805], length 0
1527830785.641831 IP (tos 0x0, ttl 64, id 15032, offset 0, flags [DF], proto TCP (6), length 52)
    rpi38.lan.46656 > rpi33.lan.55368: Flags [.], cksum 0xfc7e (correct), ack 5221, win 1331, options [nop,nop,TS val 279725338 ecr 279726805], length 0
1527830785.642407 IP (tos 0x0, ttl 64, id 3772, offset 0, flags [DF], proto TCP (6), length 1096)
    rpi41.lan.48084 > rpi33.lan.46656: Flags [P.], cksum 0x8e98 (correct), seq 4177:5221, ack 4176, win 1324, options [nop,nop,TS val 1582138652 ecr 279726605], length 1044
1527830785.642409 IP (tos 0x0, ttl 64, id 3773, offset 0, flags [DF], proto TCP (6), length 52)
    rpi41.lan.48084 > rpi33.lan.46656: Flags [.], cksum 0xe499 (correct), ack 5220, win 1323, options [nop,nop,TS val 1582138653 ecr 279726805], length 0
1527830785.646929 IP (tos 0x0, ttl 64, id 20402, offset 0, flags [DF], proto TCP (6), length 1096)
    rpi35.lan.36908 > rpi33.lan.46656: Flags [P.], cksum 0x5fe7 (correct), seq 4177:5221, ack 5220, win 1324, options [nop,nop,TS val 279725327 ecr 279726805], length 1044
1527830785.646996 IP (tos 0x0, ttl 64, id 52541, offset 0, flags [DF], proto TCP (6), length 52)
    rpi33.lan.46656 > rpi35.lan.36908: Flags [.], cksum 0x8483 (incorrect -> 0xec55), ack 5221, win 1331, options [nop,nop,TS val 279726806 ecr 279725327], length 0
1527830785.650593 IP (tos 0x0, ttl 64, id 20390, offset 0, flags [DF], proto TCP (6), length 1096)
    rpi34.lan.46656 > rpi33.lan.51354: Flags [P.], cksum 0xb1e2 (correct), seq 4177:5221, ack 5220, win 1332, options [nop,nop,TS val 279726815 ecr 279726805], length 1044
1527830785.650655 IP (tos 0x0, ttl 64, id 13475, offset 0, flags [DF], proto TCP (6), length 52)
    rpi33.lan.51354 > rpi34.lan.46656: Flags [.], cksum 0x8482 (incorrect -> 0x6f9e), ack 5221, win 1323, options [nop,nop,TS val 279726806 ecr 279726815], length 0
