1527817170.181952 IP (tos 0x0, ttl 64, id 36959, offset 0, flags [DF], proto TCP (6), length 1096)
    rpi35.lan.46656 > rpi33.lan.51742: Flags [P.], cksum 0x005b (correct), seq 1212748750:1212749794, ack 1569124759, win 1332, options [nop,nop,TS val 278363781 ecr 278365225], length 1044
1527817170.182925 IP (tos 0x0, ttl 64, id 2814, offset 0, flags [DF], proto TCP (6), length 1096)
    rpi33.lan.33422 > rpi34.lan.46656: Flags [P.], cksum 0x8896 (incorrect -> 0xed44), seq 830329091:830330135, ack 1296884531, win 1324, options [nop,nop,TS val 278365259 ecr 278365239], length 1044
1527817170.183144 IP (tos 0x0, ttl 64, id 14008, offset 0, flags [DF], proto TCP (6), length 1096)
    rpi33.lan.51742 > rpi35.lan.46656: Flags [P.], cksum 0x8897 (incorrect -> 0xa1e6), seq 1:1045, ack 1044, win 1324, options [nop,nop,TS val 278365259 ecr 278363781], length 1044
1527817170.183572 IP (tos 0x0, ttl 64, id 11121, offset 0, flags [DF], proto TCP (6), length 1096)
    rpi33.lan.57566 > rpi36.lan.46656: Flags [P.], cksum 0x8898 (incorrect -> 0x3b4d), seq 2002086127:2002087171, ack 237759901, win 1324, options [nop,nop,TS val 278365259 ecr 278365230], length 1044
1527817170.183711 IP (tos 0x0, ttl 64, id 61333, offset 0, flags [DF], proto TCP (6), length 52)
    rpi34.lan.46656 > rpi33.lan.33422: Flags [.], cksum 0x537c (correct), ack 1044, win 1331, options [nop,nop,TS val 278365268 ecr 278365259], length 0
1527817170.183783 IP (tos 0x0, ttl 64, id 40779, offset 0, flags [DF], proto TCP (6), length 1096)
    rpi33.lan.37298 > rpi37.lan.46656: Flags [P.], cksum 0x8899 (incorrect -> 0xdc57), seq 208415465:208416509, ack 1232721994, win 1324, options [nop,nop,TS val 278365259 ecr 278365215], length 1044
1527817170.183902 IP (tos 0x0, ttl 64, id 36960, offset 0, flags [DF], proto TCP (6), length 52)
    rpi35.lan.46656 > rpi33.lan.51742: Flags [.], cksum 0x9571 (correct), ack 1045, win 1331, options [nop,nop,TS val 278363781 ecr 278365259], length 0
1527817170.183988 IP (tos 0x0, ttl 64, id 60477, offset 0, flags [DF], proto TCP (6), length 1096)
    rpi33.lan.37416 > rpi38.lan.46656: Flags [P.], cksum 0x889a (incorrect -> 0xdc3b), seq 302502706:302503750, ack 1430394344, win 1324, options [nop,nop,TS val 278365259 ecr 278363763], length 1044
1527817170.184131 IP (tos 0x0, ttl 64, id 47383, offset 0, flags [DF], proto TCP (6), length 1096)
    rpi33.lan.46656 > rpi39.lan.47132: Flags [P.], cksum 0x208d (correct), seq 4184766255:4184767299, ack 3667793743, win 1332, options [nop,nop,TS val 278365259 ecr 278365230], length 1044
1527817170.184399 IP (tos 0x0, ttl 64, id 8229, offset 0, flags [DF], proto TCP (6), length 52)
    rpi36.lan.46656 > rpi33.lan.57566: Flags [.], cksum 0x4c26 (correct), ack 1044, win 1331, options [nop,nop,TS val 278365259 ecr 278365259], length 0
1527817170.184534 IP (tos 0x0, ttl 64, id 31262, offset 0, flags [DF], proto TCP (6), length 1096)
    rpi33.lan.40078 > rpi40.lan.46656: Flags [P.], cksum 0x889c (incorrect -> 0x2f1b), seq 1726426192:1726427236, ack 2657092590, win 1324, options [nop,nop,TS val 278365260 ecr 278363050], length 1044
1527817170.184647 IP (tos 0x0, ttl 64, id 57807, offset 0, flags [DF], proto TCP (6), length 52)
    rpi37.lan.46656 > rpi33.lan.37298: Flags [.], cksum 0x1e55 (correct), ack 1044, win 1331, options [nop,nop,TS val 278365244 ecr 278365259], length 0
1527817170.184747 IP (tos 0x0, ttl 64, id 43726, offset 0, flags [DF], proto TCP (6), length 1096)
    rpi33.lan.46656 > rpi41.lan.45408: Flags [P.], cksum 0x4eee (correct), seq 3957607137:3957608181, ack 1833517630, win 1332, options [nop,nop,TS val 278365260 ecr 1568522783], length 1044
1527817170.184802 IP (tos 0x0, ttl 64, id 60004, offset 0, flags [DF], proto TCP (6), length 1096)
    rpi33.lan.46656 > rpi42.lan.46788: Flags [P.], cksum 0xacc4 (correct), seq 4123065745:4123066789, ack 2340085922, win 1332, options [nop,nop,TS val 278365260 ecr 278365210], length 1044
1527817170.184828 IP (tos 0x0, ttl 64, id 51323, offset 0, flags [DF], proto TCP (6), length 52)
    rpi38.lan.46656 > rpi33.lan.37416: Flags [.], cksum 0x2c3f (correct), ack 1044, win 1331, options [nop,nop,TS val 278363792 ecr 278365259], length 0
1527817170.184958 IP (tos 0x0, ttl 64, id 22790, offset 0, flags [DF], proto TCP (6), length 52)
    rpi39.lan.47132 > rpi33.lan.46656: Flags [.], cksum 0xee6d (correct), ack 1044, win 1323, options [nop,nop,TS val 278365260 ecr 278365259], length 0
1527817170.185328 IP (tos 0x0, ttl 64, id 62179, offset 0, flags [DF], proto TCP (6), length 52)
    rpi40.lan.46656 > rpi33.lan.40078: Flags [.], cksum 0x3f78 (correct), ack 1044, win 1331, options [nop,nop,TS val 278363084 ecr 278365260], length 0
1527817170.185507 IP (tos 0x0, ttl 64, id 33384, offset 0, flags [DF], proto TCP (6), length 52)
    rpi41.lan.45408 > rpi33.lan.46656: Flags [.], cksum 0xe57f (correct), ack 1044, win 1323, options [nop,nop,TS val 1568523083 ecr 278365260], length 0
1527817170.185509 IP (tos 0x0, ttl 64, id 33639, offset 0, flags [DF], proto TCP (6), length 52)
    rpi42.lan.46788 > rpi33.lan.46656: Flags [.], cksum 0xf2f1 (correct), ack 1044, win 1323, options [nop,nop,TS val 278365240 ecr 278365260], length 0
1527817170.186750 IP (tos 0x0, ttl 64, id 8230, offset 0, flags [DF], proto TCP (6), length 1096)
    rpi36.lan.46656 > rpi33.lan.57566: Flags [P.], cksum 0x7024 (correct), seq 1:1045, ack 1044, win 1332, options [nop,nop,TS val 278365259 ecr 278365259], length 1044
1527817170.186811 IP (tos 0x0, ttl 64, id 11122, offset 0, flags [DF], proto TCP (6), length 52)
    rpi33.lan.57566 > rpi36.lan.46656: Flags [.], cksum 0x8484 (incorrect -> 0x4819), ack 1045, win 1323, options [nop,nop,TS val 278365260 ecr 278365259], length 0
1527817170.188310 IP (tos 0x0, ttl 64, id 33385, offset 0, flags [DF], proto TCP (6), length 1096)
    rpi41.lan.45408 > rpi33.lan.46656: Flags [P.], cksum 0x7301 (correct), seq 1:1045, ack 1044, win 1324, options [nop,nop,TS val 1568523086 ecr 278365260], length 1044
1527817170.188395 IP (tos 0x0, ttl 64, id 43727, offset 0, flags [DF], proto TCP (6), length 52)
    rpi33.lan.46656 > rpi41.lan.45408: Flags [.], cksum 0x8489 (incorrect -> 0xe160), ack 1045, win 1331, options [nop,nop,TS val 278365260 ecr 1568523086], length 0
1527817170.188507 IP (tos 0x0, ttl 64, id 57808, offset 0, flags [DF], proto TCP (6), length 1096)
    rpi37.lan.46656 > rpi33.lan.37298: Flags [P.], cksum 0x37d3 (correct), seq 1:1045, ack 1044, win 1332, options [nop,nop,TS val 278365244 ecr 278365259], length 1044
1527817170.188561 IP (tos 0x0, ttl 64, id 40780, offset 0, flags [DF], proto TCP (6), length 52)
    rpi33.lan.37298 > rpi37.lan.46656: Flags [.], cksum 0x8485 (incorrect -> 0x1a48), ack 1045, win 1323, options [nop,nop,TS val 278365260 ecr 278365244], length 0
1527817170.193025 IP (tos 0x0, ttl 64, id 33640, offset 0, flags [DF], proto TCP (6), length 1096)
    rpi42.lan.46788 > rpi33.lan.46656: Flags [P.], cksum 0x344b (correct), seq 1:1045, ack 1044, win 1324, options [nop,nop,TS val 278365241 ecr 278365260], length 1044
1527817170.193103 IP (tos 0x0, ttl 64, id 60005, offset 0, flags [DF], proto TCP (6), length 52)
    rpi33.lan.46656 > rpi42.lan.46788: Flags [.], cksum 0x848a (incorrect -> 0xeed4), ack 1045, win 1331, options [nop,nop,TS val 278365260 ecr 278365241], length 0
1527817170.198624 IP (tos 0x0, ttl 64, id 51324, offset 0, flags [DF], proto TCP (6), length 1096)
    rpi38.lan.46656 > rpi33.lan.37416: Flags [P.], cksum 0x6552 (correct), seq 1:1045, ack 1044, win 1332, options [nop,nop,TS val 278363794 ecr 278365259], length 1044
1527817170.198697 IP (tos 0x0, ttl 64, id 60478, offset 0, flags [DF], proto TCP (6), length 52)
    rpi33.lan.37416 > rpi38.lan.46656: Flags [.], cksum 0x8486 (incorrect -> 0x282f), ack 1045, win 1323, options [nop,nop,TS val 278365261 ecr 278363794], length 0
1527817170.199721 IP (tos 0x0, ttl 64, id 22791, offset 0, flags [DF], proto TCP (6), length 1096)
    rpi39.lan.47132 > rpi33.lan.46656: Flags [P.], cksum 0x769a (correct), seq 1:1045, ack 1044, win 1324, options [nop,nop,TS val 278365261 ecr 278365259], length 1044
1527817170.199781 IP (tos 0x0, ttl 64, id 47384, offset 0, flags [DF], proto TCP (6), length 52)
    rpi33.lan.46656 > rpi39.lan.47132: Flags [.], cksum 0x8487 (incorrect -> 0xea4e), ack 1045, win 1331, options [nop,nop,TS val 278365261 ecr 278365261], length 0
1527817170.222930 IP (tos 0x0, ttl 64, id 61334, offset 0, flags [DF], proto TCP (6), length 1096)
    rpi34.lan.46656 > rpi33.lan.33422: Flags [P.], cksum 0x2f68 (correct), seq 1:1045, ack 1044, win 1332, options [nop,nop,TS val 278365272 ecr 278365259], length 1044
1527817170.223019 IP (tos 0x0, ttl 64, id 2815, offset 0, flags [DF], proto TCP (6), length 52)
    rpi33.lan.33422 > rpi34.lan.46656: Flags [.], cksum 0x8482 (incorrect -> 0x4f68), ack 1045, win 1323, options [nop,nop,TS val 278365263 ecr 278365272], length 0
1527817171.267903 IP (tos 0x0, ttl 64, id 62180, offset 0, flags [DF], proto TCP (6), length 1096)
    rpi40.lan.46656 > rpi33.lan.40078: Flags [P.], cksum 0xee31 (correct), seq 1:1045, ack 1044, win 1332, options [nop,nop,TS val 278363192 ecr 278365260], length 1044
1527817171.268066 IP (tos 0x0, ttl 64, id 31263, offset 0, flags [DF], proto TCP (6), length 52)
    rpi33.lan.40078 > rpi40.lan.46656: Flags [.], cksum 0x8488 (incorrect -> 0x3a94), ack 1045, win 1323, options [nop,nop,TS val 278365368 ecr 278363192], length 0
1527817172.185051 IP (tos 0x0, ttl 64, id 36961, offset 0, flags [DF], proto TCP (6), length 1096)
    rpi35.lan.46656 > rpi33.lan.51742: Flags [P.], cksum 0xe53e (correct), seq 1044:2088, ack 1045, win 1332, options [nop,nop,TS val 278363981 ecr 278365259], length 1044
1527817172.186599 IP (tos 0x0, ttl 64, id 47385, offset 0, flags [DF], proto TCP (6), length 1096)
    rpi33.lan.46656 > rpi39.lan.47132: Flags [P.], cksum 0x7b0c (correct), seq 1044:2088, ack 1045, win 1332, options [nop,nop,TS val 278365460 ecr 278365261], length 1044
1527817172.186655 IP (tos 0x0, ttl 64, id 2816, offset 0, flags [DF], proto TCP (6), length 1096)
    rpi33.lan.33422 > rpi34.lan.46656: Flags [P.], cksum 0x8896 (incorrect -> 0xd85e), seq 1044:2088, ack 1045, win 1324, options [nop,nop,TS val 278365460 ecr 278365272], length 1044
1527817172.186950 IP (tos 0x0, ttl 64, id 11123, offset 0, flags [DF], proto TCP (6), length 1096)
    rpi33.lan.57566 > rpi36.lan.46656: Flags [P.], cksum 0x8898 (incorrect -> 0x7245), seq 1044:2088, ack 1045, win 1324, options [nop,nop,TS val 278365460 ecr 278365259], length 1044
1527817172.187164 IP (tos 0x0, ttl 64, id 43728, offset 0, flags [DF], proto TCP (6), length 1096)
    rpi33.lan.46656 > rpi41.lan.45408: Flags [P.], cksum 0x4a39 (correct), seq 1044:2088, ack 1045, win 1332, options [nop,nop,TS val 278365460 ecr 1568523086], length 1044
1527817172.187191 IP (tos 0x0, ttl 64, id 60479, offset 0, flags [DF], proto TCP (6), length 1096)
    rpi33.lan.37416 > rpi38.lan.46656: Flags [P.], cksum 0x889a (incorrect -> 0x14ad), seq 1044:2088, ack 1045, win 1324, options [nop,nop,TS val 278365460 ecr 278363794], length 1044
1527817172.187380 IP (tos 0x0, ttl 64, id 40781, offset 0, flags [DF], proto TCP (6), length 1096)
    rpi33.lan.37298 > rpi37.lan.46656: Flags [P.], cksum 0x8899 (incorrect -> 0x7db5), seq 1044:2088, ack 1045, win 1324, options [nop,nop,TS val 278365460 ecr 278365244], length 1044
1527817172.187498 IP (tos 0x0, ttl 64, id 61335, offset 0, flags [DF], proto TCP (6), length 52)
    rpi34.lan.46656 > rpi33.lan.33422: Flags [.], cksum 0x49c2 (correct), ack 2088, win 1331, options [nop,nop,TS val 278365469 ecr 278365460], length 0
1527817172.187583 IP (tos 0x0, ttl 64, id 14009, offset 0, flags [DF], proto TCP (6), length 1096)
    rpi33.lan.51742 > rpi35.lan.46656: Flags [P.], cksum 0x8897 (incorrect -> 0x5394), seq 1045:2089, ack 2088, win 1324, options [nop,nop,TS val 278365460 ecr 278363981], length 1044
1527817172.187607 IP (tos 0x0, ttl 64, id 31264, offset 0, flags [DF], proto TCP (6), length 1096)
    rpi33.lan.40078 > rpi40.lan.46656: Flags [P.], cksum 0x889c (incorrect -> 0x9cdd), seq 1044:2088, ack 1045, win 1324, options [nop,nop,TS val 278365460 ecr 278363192], length 1044
1527817172.188355 IP (tos 0x0, ttl 64, id 36962, offset 0, flags [DF], proto TCP (6), length 52)
    rpi35.lan.46656 > rpi33.lan.51742: Flags [.], cksum 0x8bb7 (correct), ack 2089, win 1331, options [nop,nop,TS val 278363982 ecr 278365460], length 0
1527817172.188368 IP (tos 0x0, ttl 64, id 62181, offset 0, flags [DF], proto TCP (6), length 52)
    rpi40.lan.46656 > rpi33.lan.40078: Flags [.], cksum 0x35c0 (correct), ack 2088, win 1331, options [nop,nop,TS val 278363284 ecr 278365460], length 0
1527817172.188667 IP (tos 0x0, ttl 64, id 60006, offset 0, flags [DF], proto TCP (6), length 1096)
    rpi33.lan.46656 > rpi42.lan.46788: Flags [P.], cksum 0xae93 (correct), seq 1044:2088, ack 1045, win 1332, options [nop,nop,TS val 278365460 ecr 278365241], length 1044
1527817172.190260 IP (tos 0x0, ttl 64, id 8231, offset 0, flags [DF], proto TCP (6), length 1096)
    rpi36.lan.46656 > rpi33.lan.57566: Flags [P.], cksum 0x8658 (correct), seq 1045:2089, ack 2088, win 1332, options [nop,nop,TS val 278365460 ecr 278365460], length 1044
1527817172.190337 IP (tos 0x0, ttl 64, id 11124, offset 0, flags [DF], proto TCP (6), length 52)
    rpi33.lan.57566 > rpi36.lan.46656: Flags [.], cksum 0x8484 (incorrect -> 0x3e60), ack 2089, win 1323, options [nop,nop,TS val 278365460 ecr 278365460], length 0
1527817172.192581 IP (tos 0x0, ttl 64, id 57809, offset 0, flags [DF], proto TCP (6), length 1096)
    rpi37.lan.46656 > rpi33.lan.37298: Flags [P.], cksum 0xd4bf (correct), seq 1045:2089, ack 2088, win 1332, options [nop,nop,TS val 278365445 ecr 278365460], length 1044
1527817172.192670 IP (tos 0x0, ttl 64, id 40782, offset 0, flags [DF], proto TCP (6), length 52)
    rpi33.lan.37298 > rpi37.lan.46656: Flags [.], cksum 0x8485 (incorrect -> 0x108f), ack 2089, win 1323, options [nop,nop,TS val 278365460 ecr 278365445], length 0
1527817172.192796 IP (tos 0x0, ttl 64, id 33386, offset 0, flags [DF], proto TCP (6), length 1096)
    rpi41.lan.45408 > rpi33.lan.46656: Flags [P.], cksum 0xf96b (correct), seq 1045:2089, ack 2088, win 1324, options [nop,nop,TS val 1568525090 ecr 278365460], length 1044
1527817172.192858 IP (tos 0x0, ttl 64, id 43729, offset 0, flags [DF], proto TCP (6), length 52)
    rpi33.lan.46656 > rpi41.lan.45408: Flags [.], cksum 0x8489 (incorrect -> 0xd09c), ack 2089, win 1331, options [nop,nop,TS val 278365460 ecr 1568525090], length 0
1527817172.197077 IP (tos 0x0, ttl 64, id 33641, offset 0, flags [DF], proto TCP (6), length 1096)
    rpi42.lan.46788 > rpi33.lan.46656: Flags [P.], cksum 0x11ee (correct), seq 1045:2089, ack 2088, win 1324, options [nop,nop,TS val 278365441 ecr 278365460], length 1044
1527817172.197155 IP (tos 0x0, ttl 64, id 60007, offset 0, flags [DF], proto TCP (6), length 52)
    rpi33.lan.46656 > rpi42.lan.46788: Flags [.], cksum 0x848a (incorrect -> 0xe51b), ack 2089, win 1331, options [nop,nop,TS val 278365461 ecr 278365441], length 0
1527817172.202475 IP (tos 0x0, ttl 64, id 51325, offset 0, flags [DF], proto TCP (6), length 1096)
    rpi38.lan.46656 > rpi33.lan.37416: Flags [P.], cksum 0xd004 (correct), seq 1045:2089, ack 2088, win 1332, options [nop,nop,TS val 278363994 ecr 278365460], length 1044
1527817172.202577 IP (tos 0x0, ttl 64, id 60480, offset 0, flags [DF], proto TCP (6), length 52)
    rpi33.lan.37416 > rpi38.lan.46656: Flags [.], cksum 0x8486 (incorrect -> 0x1e77), ack 2089, win 1323, options [nop,nop,TS val 278365461 ecr 278363994], length 0
1527817172.203571 IP (tos 0x0, ttl 64, id 22792, offset 0, flags [DF], proto TCP (6), length 1096)
    rpi39.lan.47132 > rpi33.lan.46656: Flags [P.], cksum 0xf82f (correct), seq 1045:2089, ack 2088, win 1324, options [nop,nop,TS val 278365461 ecr 278365460], length 1044
1527817172.203656 IP (tos 0x0, ttl 64, id 47386, offset 0, flags [DF], proto TCP (6), length 52)
    rpi33.lan.46656 > rpi39.lan.47132: Flags [.], cksum 0x8487 (incorrect -> 0xe096), ack 2089, win 1331, options [nop,nop,TS val 278365461 ecr 278365461], length 0
1527817172.226065 IP (tos 0x0, ttl 64, id 61336, offset 0, flags [DF], proto TCP (6), length 1096)
    rpi34.lan.46656 > rpi33.lan.33422: Flags [P.], cksum 0xa15e (correct), seq 1045:2089, ack 2088, win 1332, options [nop,nop,TS val 278365472 ecr 278365460], length 1044
1527817172.226190 IP (tos 0x0, ttl 64, id 2817, offset 0, flags [DF], proto TCP (6), length 52)
    rpi33.lan.33422 > rpi34.lan.46656: Flags [.], cksum 0x8482 (incorrect -> 0x45af), ack 2089, win 1323, options [nop,nop,TS val 278365464 ecr 278365472], length 0
1527817172.636962 IP (tos 0x0, ttl 64, id 51326, offset 0, flags [DF], proto TCP (6), length 1096)
    rpi38.lan.46656 > rpi33.lan.37416: Flags [P.], cksum 0x9fbe (correct), seq 2089:3133, ack 2088, win 1332, options [nop,nop,TS val 278364038 ecr 278365461], length 1044
1527817172.637056 IP (tos 0x0, ttl 64, id 60481, offset 0, flags [DF], proto TCP (6), length 52)
    rpi33.lan.37416 > rpi38.lan.46656: Flags [.], cksum 0x8486 (incorrect -> 0x1a0b), ack 3133, win 1323, options [nop,nop,TS val 278365505 ecr 278364038], length 0
1527817172.897261 IP (tos 0x0, ttl 64, id 51327, offset 0, flags [DF], proto TCP (6), length 1096)
    rpi38.lan.46656 > rpi33.lan.37416: Flags [P.], cksum 0xb589 (correct), seq 3133:4177, ack 2088, win 1332, options [nop,nop,TS val 278364064 ecr 278365505], length 1044
1527817172.897386 IP (tos 0x0, ttl 64, id 60482, offset 0, flags [DF], proto TCP (6), length 52)
    rpi33.lan.37416 > rpi38.lan.46656: Flags [.], cksum 0x8486 (incorrect -> 0x15c3), ack 4177, win 1323, options [nop,nop,TS val 278365531 ecr 278364064], length 0
1527817172.897643 IP (tos 0x0, ttl 64, id 60483, offset 0, flags [DF], proto TCP (6), length 1096)
    rpi33.lan.37416 > rpi38.lan.46656: Flags [P.], cksum 0x889a (incorrect -> 0x1223), seq 2088:3132, ack 4177, win 1324, options [nop,nop,TS val 278365531 ecr 278364064], length 1044
1527817172.898050 IP (tos 0x0, ttl 64, id 60484, offset 0, flags [DF], proto TCP (6), length 1096)
    rpi33.lan.37416 > rpi38.lan.46656: Flags [P.], cksum 0x889a (incorrect -> 0x8f53), seq 3132:4176, ack 4177, win 1324, options [nop,nop,TS val 278365531 ecr 278364064], length 1044
1527817172.898861 IP (tos 0x0, ttl 64, id 51328, offset 0, flags [DF], proto TCP (6), length 52)
    rpi38.lan.46656 > rpi33.lan.37416: Flags [.], cksum 0x0d92 (correct), ack 4176, win 1332, options [nop,nop,TS val 278364064 ecr 278365531], length 0
1527817172.899227 IP (tos 0x0, ttl 64, id 51329, offset 0, flags [DF], proto TCP (6), length 1096)
    rpi38.lan.46656 > rpi33.lan.37416: Flags [P.], cksum 0x0b92 (correct), seq 4177:5221, ack 4176, win 1332, options [nop,nop,TS val 278364064 ecr 278365531], length 1044
1527817172.944515 IP (tos 0x0, ttl 64, id 60485, offset 0, flags [DF], proto TCP (6), length 52)
    rpi33.lan.37416 > rpi38.lan.46656: Flags [.], cksum 0x8486 (incorrect -> 0x0981), ack 5221, win 1324, options [nop,nop,TS val 278365536 ecr 278364064], length 0
1527817173.271862 IP (tos 0x0, ttl 64, id 62182, offset 0, flags [DF], proto TCP (6), length 1096)
    rpi40.lan.46656 > rpi33.lan.40078: Flags [P.], cksum 0x75b9 (correct), seq 1045:2089, ack 2088, win 1332, options [nop,nop,TS val 278363393 ecr 278365460], length 1044
1527817173.272025 IP (tos 0x0, ttl 64, id 31265, offset 0, flags [DF], proto TCP (6), length 52)
    rpi33.lan.40078 > rpi40.lan.46656: Flags [.], cksum 0x8488 (incorrect -> 0x30db), ack 2089, win 1323, options [nop,nop,TS val 278365568 ecr 278363393], length 0
1527817174.188514 IP (tos 0x0, ttl 64, id 36963, offset 0, flags [DF], proto TCP (6), length 1096)
    rpi35.lan.46656 > rpi33.lan.51742: Flags [P.], cksum 0x5f32 (correct), seq 2088:3132, ack 2089, win 1332, options [nop,nop,TS val 278364182 ecr 278365460], length 1044
1527817174.189793 IP (tos 0x0, ttl 64, id 14010, offset 0, flags [DF], proto TCP (6), length 1096)
    rpi33.lan.51742 > rpi35.lan.46656: Flags [P.], cksum 0x8897 (incorrect -> 0x6b59), seq 2089:3133, ack 3132, win 1324, options [nop,nop,TS val 278365660 ecr 278364182], length 1044
1527817174.189857 IP (tos 0x0, ttl 64, id 40783, offset 0, flags [DF], proto TCP (6), length 1096)
    rpi33.lan.37298 > rpi37.lan.46656: Flags [P.], cksum 0x8899 (incorrect -> 0x01a3), seq 2088:3132, ack 2089, win 1324, options [nop,nop,TS val 278365660 ecr 278365445], length 1044
1527817174.189898 IP (tos 0x0, ttl 64, id 11125, offset 0, flags [DF], proto TCP (6), length 1096)
    rpi33.lan.57566 > rpi36.lan.46656: Flags [P.], cksum 0x8898 (incorrect -> 0x25a4), seq 2088:3132, ack 2089, win 1324, options [nop,nop,TS val 278365660 ecr 278365460], length 1044
1527817174.190268 IP (tos 0x0, ttl 64, id 47387, offset 0, flags [DF], proto TCP (6), length 1096)
    rpi33.lan.46656 > rpi39.lan.47132: Flags [P.], cksum 0x76c3 (correct), seq 2088:3132, ack 2089, win 1332, options [nop,nop,TS val 278365660 ecr 278365461], length 1044
1527817174.190295 IP (tos 0x0, ttl 64, id 60008, offset 0, flags [DF], proto TCP (6), length 1096)
    rpi33.lan.46656 > rpi42.lan.46788: Flags [P.], cksum 0x6008 (correct), seq 2088:3132, ack 2089, win 1332, options [nop,nop,TS val 278365660 ecr 278365441], length 1044
1527817174.190312 IP (tos 0x0, ttl 64, id 60486, offset 0, flags [DF], proto TCP (6), length 1096)
    rpi33.lan.37416 > rpi38.lan.46656: Flags [P.], cksum 0x889a (incorrect -> 0x05e7), seq 4176:5220, ack 5221, win 1324, options [nop,nop,TS val 278365660 ecr 278364064], length 1044
1527817174.190460 IP (tos 0x0, ttl 64, id 2818, offset 0, flags [DF], proto TCP (6), length 1096)
    rpi33.lan.33422 > rpi34.lan.46656: Flags [P.], cksum 0x8896 (incorrect -> 0x5de9), seq 2088:3132, ack 2089, win 1324, options [nop,nop,TS val 278365660 ecr 278365472], length 1044
1527817174.190488 IP (tos 0x0, ttl 64, id 31266, offset 0, flags [DF], proto TCP (6), length 1096)
    rpi33.lan.40078 > rpi40.lan.46656: Flags [P.], cksum 0x889c (incorrect -> 0xf7e6), seq 2088:3132, ack 2089, win 1324, options [nop,nop,TS val 278365660 ecr 278363393], length 1044
1527817174.190652 IP (tos 0x0, ttl 64, id 36964, offset 0, flags [DF], proto TCP (6), length 52)
    rpi35.lan.46656 > rpi33.lan.51742: Flags [.], cksum 0x81ff (correct), ack 3133, win 1331, options [nop,nop,TS val 278364182 ecr 278365660], length 0
1527817174.190746 IP (tos 0x0, ttl 64, id 43730, offset 0, flags [DF], proto TCP (6), length 1096)
    rpi33.lan.46656 > rpi41.lan.45408: Flags [P.], cksum 0xaf8c (correct), seq 2088:3132, ack 2089, win 1332, options [nop,nop,TS val 278365660 ecr 1568525090], length 1044
1527817174.191413 IP (tos 0x0, ttl 64, id 62183, offset 0, flags [DF], proto TCP (6), length 52)
    rpi40.lan.46656 > rpi33.lan.40078: Flags [.], cksum 0x2c07 (correct), ack 3132, win 1331, options [nop,nop,TS val 278363485 ecr 278365660], length 0
1527817174.193586 IP (tos 0x0, ttl 64, id 8232, offset 0, flags [DF], proto TCP (6), length 1096)
    rpi36.lan.46656 > rpi33.lan.57566: Flags [P.], cksum 0x7c15 (correct), seq 2089:3133, ack 3132, win 1332, options [nop,nop,TS val 278365660 ecr 278365660], length 1044
1527817174.193663 IP (tos 0x0, ttl 64, id 11126, offset 0, flags [DF], proto TCP (6), length 52)
    rpi33.lan.57566 > rpi36.lan.46656: Flags [.], cksum 0x8484 (incorrect -> 0x34a8), ack 3133, win 1323, options [nop,nop,TS val 278365660 ecr 278365660], length 0
1527817174.195218 IP (tos 0x0, ttl 64, id 57810, offset 0, flags [DF], proto TCP (6), length 1096)
    rpi37.lan.46656 > rpi33.lan.37298: Flags [P.], cksum 0x5e8f (correct), seq 2089:3133, ack 3132, win 1332, options [nop,nop,TS val 278365645 ecr 278365660], length 1044
1527817174.195294 IP (tos 0x0, ttl 64, id 40784, offset 0, flags [DF], proto TCP (6), length 52)
    rpi33.lan.37298 > rpi37.lan.46656: Flags [.], cksum 0x8485 (incorrect -> 0x06d6), ack 3133, win 1323, options [nop,nop,TS val 278365661 ecr 278365645], length 0
1527817174.195896 IP (tos 0x0, ttl 64, id 33387, offset 0, flags [DF], proto TCP (6), length 1096)
    rpi41.lan.45408 > rpi33.lan.46656: Flags [P.], cksum 0x05b4 (correct), seq 2089:3133, ack 3132, win 1324, options [nop,nop,TS val 1568527093 ecr 278365660], length 1044
1527817174.195967 IP (tos 0x0, ttl 64, id 43731, offset 0, flags [DF], proto TCP (6), length 52)
    rpi33.lan.46656 > rpi41.lan.45408: Flags [.], cksum 0x8489 (incorrect -> 0xbfd8), ack 3133, win 1331, options [nop,nop,TS val 278365661 ecr 1568527093], length 0
1527817174.200015 IP (tos 0x0, ttl 64, id 33642, offset 0, flags [DF], proto TCP (6), length 1096)
    rpi42.lan.46788 > rpi33.lan.46656: Flags [P.], cksum 0xb9b4 (correct), seq 2089:3133, ack 3132, win 1324, options [nop,nop,TS val 278365641 ecr 278365660], length 1044
1527817174.200089 IP (tos 0x0, ttl 64, id 60009, offset 0, flags [DF], proto TCP (6), length 52)
    rpi33.lan.46656 > rpi42.lan.46788: Flags [.], cksum 0x848a (incorrect -> 0xdb63), ack 3133, win 1331, options [nop,nop,TS val 278365661 ecr 278365641], length 0
1527817174.205741 IP (tos 0x0, ttl 64, id 51330, offset 0, flags [DF], proto TCP (6), length 1096)
    rpi38.lan.46656 > rpi33.lan.37416: Flags [P.], cksum 0x9178 (correct), seq 5221:6265, ack 5220, win 1332, options [nop,nop,TS val 278364194 ecr 278365660], length 1044
1527817174.205827 IP (tos 0x0, ttl 64, id 60487, offset 0, flags [DF], proto TCP (6), length 52)
    rpi33.lan.37416 > rpi38.lan.46656: Flags [.], cksum 0x8486 (incorrect -> 0x005a), ack 6265, win 1323, options [nop,nop,TS val 278365662 ecr 278364194], length 0
1527817174.207360 IP (tos 0x0, ttl 64, id 22793, offset 0, flags [DF], proto TCP (6), length 1096)
    rpi39.lan.47132 > rpi33.lan.46656: Flags [P.], cksum 0x74c7 (correct), seq 2089:3133, ack 3132, win 1324, options [nop,nop,TS val 278365662 ecr 278365660], length 1044
1527817174.207433 IP (tos 0x0, ttl 64, id 47388, offset 0, flags [DF], proto TCP (6), length 52)
    rpi33.lan.46656 > rpi39.lan.47132: Flags [.], cksum 0x8487 (incorrect -> 0xd6dc), ack 3133, win 1331, options [nop,nop,TS val 278365662 ecr 278365662], length 0
1527817174.230025 IP (tos 0x0, ttl 64, id 61337, offset 0, flags [DF], proto TCP (6), length 1096)
    rpi34.lan.46656 > rpi33.lan.33422: Flags [P.], cksum 0x65b6 (correct), seq 2089:3133, ack 3132, win 1332, options [nop,nop,TS val 278365673 ecr 278365660], length 1044
1527817174.230127 IP (tos 0x0, ttl 64, id 2819, offset 0, flags [DF], proto TCP (6), length 52)
    rpi33.lan.33422 > rpi34.lan.46656: Flags [.], cksum 0x8482 (incorrect -> 0x3bf6), ack 3133, win 1323, options [nop,nop,TS val 278365664 ecr 278365673], length 0
1527817174.909041 IP (tos 0x0, ttl 64, id 8233, offset 0, flags [DF], proto TCP (6), length 1096)
    rpi36.lan.46656 > rpi33.lan.57566: Flags [P.], cksum 0x4f7d (correct), seq 3133:4177, ack 3132, win 1332, options [nop,nop,TS val 278365732 ecr 278365660], length 1044
1527817174.909184 IP (tos 0x0, ttl 64, id 11127, offset 0, flags [DF], proto TCP (6), length 1096)
    rpi33.lan.57566 > rpi36.lan.46656: Flags [P.], cksum 0x8898 (incorrect -> 0xca16), seq 3132:4176, ack 3133, win 1324, options [nop,nop,TS val 278365732 ecr 278365660], length 1044
1527817174.909304 IP (tos 0x0, ttl 64, id 11128, offset 0, flags [DF], proto TCP (6), length 52)
    rpi33.lan.57566 > rpi36.lan.46656: Flags [.], cksum 0x8484 (incorrect -> 0x2bf0), ack 4177, win 1323, options [nop,nop,TS val 278365732 ecr 278365732], length 0
1527817174.909995 IP (tos 0x0, ttl 64, id 11129, offset 0, flags [DF], proto TCP (6), length 1096)
    rpi33.lan.57566 > rpi36.lan.46656: Flags [P.], cksum 0x8898 (incorrect -> 0x562b), seq 4176:5220, ack 4177, win 1324, options [nop,nop,TS val 278365732 ecr 278365732], length 1044
1527817174.910652 IP (tos 0x0, ttl 64, id 8234, offset 0, flags [DF], proto TCP (6), length 1096)
    rpi36.lan.46656 > rpi33.lan.57566: Flags [P.], cksum 0x2a65 (correct), seq 4177:5221, ack 4176, win 1332, options [nop,nop,TS val 278365732 ecr 278365732], length 1044
1527817174.954508 IP (tos 0x0, ttl 64, id 11130, offset 0, flags [DF], proto TCP (6), length 52)
    rpi33.lan.57566 > rpi36.lan.46656: Flags [.], cksum 0x8484 (incorrect -> 0x23c2), ack 5221, win 1324, options [nop,nop,TS val 278365737 ecr 278365732], length 0
1527817174.956793 IP (tos 0x0, ttl 64, id 8235, offset 0, flags [DF], proto TCP (6), length 52)
    rpi36.lan.46656 > rpi33.lan.57566: Flags [.], cksum 0x23ba (correct), ack 5220, win 1332, options [nop,nop,TS val 278365737 ecr 278365732], length 0
1527817175.274408 IP (tos 0x0, ttl 64, id 62184, offset 0, flags [DF], proto TCP (6), length 1096)
    rpi40.lan.46656 > rpi33.lan.40078: Flags [P.], cksum 0x5f26 (correct), seq 2089:3133, ack 3132, win 1332, options [nop,nop,TS val 278363593 ecr 278365660], length 1044
1527817175.274571 IP (tos 0x0, ttl 64, id 31267, offset 0, flags [DF], proto TCP (6), length 52)
    rpi33.lan.40078 > rpi40.lan.46656: Flags [.], cksum 0x8488 (incorrect -> 0x2722), ack 3133, win 1323, options [nop,nop,TS val 278365769 ecr 278363593], length 0
1527817176.191805 IP (tos 0x0, ttl 64, id 36965, offset 0, flags [DF], proto TCP (6), length 1096)
    rpi35.lan.46656 > rpi33.lan.51742: Flags [P.], cksum 0x5f65 (correct), seq 3132:4176, ack 3133, win 1332, options [nop,nop,TS val 278364382 ecr 278365660], length 1044
1527817176.193079 IP (tos 0x0, ttl 64, id 40785, offset 0, flags [DF], proto TCP (6), length 1096)
    rpi33.lan.37298 > rpi37.lan.46656: Flags [P.], cksum 0x8899 (incorrect -> 0x92a9), seq 3132:4176, ack 3133, win 1324, options [nop,nop,TS val 278365860 ecr 278365645], length 1044
1527817176.193154 IP (tos 0x0, ttl 64, id 14011, offset 0, flags [DF], proto TCP (6), length 1096)
    rpi33.lan.51742 > rpi35.lan.46656: Flags [P.], cksum 0x8897 (incorrect -> 0x1777), seq 3133:4177, ack 4176, win 1324, options [nop,nop,TS val 278365860 ecr 278364382], length 1044
1527817176.193345 IP (tos 0x0, ttl 64, id 11131, offset 0, flags [DF], proto TCP (6), length 1096)
    rpi33.lan.57566 > rpi36.lan.46656: Flags [P.], cksum 0x8898 (incorrect -> 0x409f), seq 5220:6264, ack 5221, win 1324, options [nop,nop,TS val 278365860 ecr 278365737], length 1044
1527817176.193376 IP (tos 0x0, ttl 64, id 2820, offset 0, flags [DF], proto TCP (6), length 1096)
    rpi33.lan.33422 > rpi34.lan.46656: Flags [P.], cksum 0x8896 (incorrect -> 0x43a4), seq 3132:4176, ack 3133, win 1324, options [nop,nop,TS val 278365860 ecr 278365673], length 1044
1527817176.193689 IP (tos 0x0, ttl 64, id 43732, offset 0, flags [DF], proto TCP (6), length 1096)
    rpi33.lan.46656 > rpi41.lan.45408: Flags [P.], cksum 0xb90d (correct), seq 3132:4176, ack 3133, win 1332, options [nop,nop,TS val 278365860 ecr 1568527093], length 1044
1527817176.193721 IP (tos 0x0, ttl 64, id 60488, offset 0, flags [DF], proto TCP (6), length 1096)
    rpi33.lan.37416 > rpi38.lan.46656: Flags [P.], cksum 0x889a (incorrect -> 0xcb55), seq 5220:6264, ack 6265, win 1324, options [nop,nop,TS val 278365860 ecr 278364194], length 1044
1527817176.193753 IP (tos 0x0, ttl 64, id 60010, offset 0, flags [DF], proto TCP (6), length 1096)
    rpi33.lan.46656 > rpi42.lan.46788: Flags [P.], cksum 0x19e7 (correct), seq 3132:4176, ack 3133, win 1332, options [nop,nop,TS val 278365860 ecr 278365641], length 1044
1527817176.193779 IP (tos 0x0, ttl 64, id 47389, offset 0, flags [DF], proto TCP (6), length 1096)
    rpi33.lan.46656 > rpi39.lan.47132: Flags [P.], cksum 0xc56a (correct), seq 3132:4176, ack 3133, win 1332, options [nop,nop,TS val 278365860 ecr 278365662], length 1044
1527817176.193915 IP (tos 0x0, ttl 64, id 31268, offset 0, flags [DF], proto TCP (6), length 1096)
    rpi33.lan.40078 > rpi40.lan.46656: Flags [P.], cksum 0x889c (incorrect -> 0x427a), seq 3132:4176, ack 3133, win 1324, options [nop,nop,TS val 278365860 ecr 278363593], length 1044
1527817176.194062 IP (tos 0x0, ttl 64, id 36966, offset 0, flags [DF], proto TCP (6), length 52)
    rpi35.lan.46656 > rpi33.lan.51742: Flags [.], cksum 0x7847 (correct), ack 4177, win 1331, options [nop,nop,TS val 278364382 ecr 278365860], length 0
1527817176.194179 IP (tos 0x0, ttl 64, id 8236, offset 0, flags [DF], proto TCP (6), length 52)
    rpi36.lan.46656 > rpi33.lan.57566: Flags [.], cksum 0x1eac (correct), ack 6264, win 1331, options [nop,nop,TS val 278365860 ecr 278365860], length 0
1527817176.194859 IP (tos 0x0, ttl 64, id 62185, offset 0, flags [DF], proto TCP (6), length 52)
    rpi40.lan.46656 > rpi33.lan.40078: Flags [.], cksum 0x224f (correct), ack 4176, win 1331, options [nop,nop,TS val 278363685 ecr 278365860], length 0
1527817176.197404 IP (tos 0x0, ttl 64, id 8237, offset 0, flags [DF], proto TCP (6), length 1096)
    rpi36.lan.46656 > rpi33.lan.57566: Flags [P.], cksum 0x2ba3 (correct), seq 5221:6265, ack 6264, win 1332, options [nop,nop,TS val 278365861 ecr 278365860], length 1044
1527817176.197475 IP (tos 0x0, ttl 64, id 11132, offset 0, flags [DF], proto TCP (6), length 52)
    rpi33.lan.57566 > rpi36.lan.46656: Flags [.], cksum 0x8484 (incorrect -> 0x1a9e), ack 6265, win 1323, options [nop,nop,TS val 278365861 ecr 278365861], length 0
1527817176.198611 IP (tos 0x0, ttl 64, id 57811, offset 0, flags [DF], proto TCP (6), length 1096)
    rpi37.lan.46656 > rpi33.lan.37298: Flags [P.], cksum 0xe1cc (correct), seq 3133:4177, ack 4176, win 1332, options [nop,nop,TS val 278365845 ecr 278365860], length 1044
1527817176.198695 IP (tos 0x0, ttl 64, id 40786, offset 0, flags [DF], proto TCP (6), length 52)
    rpi33.lan.37298 > rpi37.lan.46656: Flags [.], cksum 0x8485 (incorrect -> 0xfd1d), ack 4177, win 1323, options [nop,nop,TS val 278365861 ecr 278365845], length 0
1527817176.199873 IP (tos 0x0, ttl 64, id 33388, offset 0, flags [DF], proto TCP (6), length 1096)
    rpi41.lan.45408 > rpi33.lan.46656: Flags [P.], cksum 0x8042 (correct), seq 3133:4177, ack 4176, win 1324, options [nop,nop,TS val 1568529097 ecr 278365860], length 1044
1527817176.199954 IP (tos 0x0, ttl 64, id 43733, offset 0, flags [DF], proto TCP (6), length 52)
    rpi33.lan.46656 > rpi41.lan.45408: Flags [.], cksum 0x8489 (incorrect -> 0xaf14), ack 4177, win 1331, options [nop,nop,TS val 278365861 ecr 1568529097], length 0
1527817176.203647 IP (tos 0x0, ttl 64, id 33643, offset 0, flags [DF], proto TCP (6), length 1096)
    rpi42.lan.46788 > rpi33.lan.46656: Flags [P.], cksum 0xcd44 (correct), seq 3133:4177, ack 4176, win 1324, options [nop,nop,TS val 278365842 ecr 278365860], length 1044
1527817176.203727 IP (tos 0x0, ttl 64, id 60011, offset 0, flags [DF], proto TCP (6), length 52)
    rpi33.lan.46656 > rpi42.lan.46788: Flags [.], cksum 0x848a (incorrect -> 0xd1aa), ack 4177, win 1331, options [nop,nop,TS val 278365861 ecr 278365842], length 0
1527817176.209613 IP (tos 0x0, ttl 64, id 51331, offset 0, flags [DF], proto TCP (6), length 1096)
    rpi38.lan.46656 > rpi33.lan.37416: Flags [P.], cksum 0xa46b (correct), seq 6265:7309, ack 6264, win 1332, options [nop,nop,TS val 278364395 ecr 278365860], length 1044
1527817176.209701 IP (tos 0x0, ttl 64, id 60489, offset 0, flags [DF], proto TCP (6), length 52)
    rpi33.lan.37416 > rpi38.lan.46656: Flags [.], cksum 0x8486 (incorrect -> 0xf6a0), ack 7309, win 1323, options [nop,nop,TS val 278365862 ecr 278364395], length 0
1527817176.210895 IP (tos 0x0, ttl 64, id 22794, offset 0, flags [DF], proto TCP (6), length 1096)
    rpi39.lan.47132 > rpi33.lan.46656: Flags [P.], cksum 0x2627 (correct), seq 3133:4177, ack 4176, win 1324, options [nop,nop,TS val 278365862 ecr 278365860], length 1044
1527817176.210976 IP (tos 0x0, ttl 64, id 47390, offset 0, flags [DF], proto TCP (6), length 52)
    rpi33.lan.46656 > rpi39.lan.47132: Flags [.], cksum 0x8487 (incorrect -> 0xcd24), ack 4177, win 1331, options [nop,nop,TS val 278365862 ecr 278365862], length 0
1527817176.233116 IP (tos 0x0, ttl 64, id 61338, offset 0, flags [DF], proto TCP (6), length 1096)
    rpi34.lan.46656 > rpi33.lan.33422: Flags [P.], cksum 0x89d5 (correct), seq 3133:4177, ack 4176, win 1332, options [nop,nop,TS val 278365873 ecr 278365860], length 1044
1527817176.233203 IP (tos 0x0, ttl 64, id 2821, offset 0, flags [DF], proto TCP (6), length 52)
    rpi33.lan.33422 > rpi34.lan.46656: Flags [.], cksum 0x8482 (incorrect -> 0x323e), ack 4177, win 1323, options [nop,nop,TS val 278365864 ecr 278365873], length 0
1527817177.277856 IP (tos 0x0, ttl 64, id 62186, offset 0, flags [DF], proto TCP (6), length 1096)
    rpi40.lan.46656 > rpi33.lan.40078: Flags [P.], cksum 0x9f18 (correct), seq 3133:4177, ack 4176, win 1332, options [nop,nop,TS val 278363793 ecr 278365860], length 1044
1527817177.277996 IP (tos 0x0, ttl 64, id 31269, offset 0, flags [DF], proto TCP (6), length 52)
    rpi33.lan.40078 > rpi40.lan.46656: Flags [.], cksum 0x8488 (incorrect -> 0x1d6a), ack 4177, win 1323, options [nop,nop,TS val 278365969 ecr 278363793], length 0
1527817178.195910 IP (tos 0x0, ttl 64, id 36967, offset 0, flags [DF], proto TCP (6), length 1096)
    rpi35.lan.46656 > rpi33.lan.51742: Flags [P.], cksum 0x5932 (correct), seq 4176:5220, ack 4177, win 1332, options [nop,nop,TS val 278364582 ecr 278365860], length 1044
1527817178.196601 IP (tos 0x0, ttl 64, id 43734, offset 0, flags [DF], proto TCP (6), length 1096)
    rpi33.lan.46656 > rpi41.lan.45408: Flags [P.], cksum 0xb7e8 (correct), seq 4176:5220, ack 4177, win 1332, options [nop,nop,TS val 278366061 ecr 1568529097], length 1044
1527817178.196656 IP (tos 0x0, ttl 64, id 60490, offset 0, flags [DF], proto TCP (6), length 1096)
    rpi33.lan.37416 > rpi38.lan.46656: Flags [P.], cksum 0x889a (incorrect -> 0x62d0), seq 6264:7308, ack 7309, win 1324, options [nop,nop,TS val 278366061 ecr 278364395], length 1044
1527817178.196806 IP (tos 0x0, ttl 64, id 47391, offset 0, flags [DF], proto TCP (6), length 1096)
    rpi33.lan.46656 > rpi39.lan.47132: Flags [P.], cksum 0x0794 (correct), seq 4176:5220, ack 4177, win 1332, options [nop,nop,TS val 278366061 ecr 278365862], length 1044
1527817178.196840 IP (tos 0x0, ttl 64, id 14012, offset 0, flags [DF], proto TCP (6), length 1096)
    rpi33.lan.51742 > rpi35.lan.46656: Flags [P.], cksum 0x8897 (incorrect -> 0x8aac), seq 4177:5221, ack 5220, win 1324, options [nop,nop,TS val 278366061 ecr 278364582], length 1044
1527817178.197001 IP (tos 0x0, ttl 64, id 60012, offset 0, flags [DF], proto TCP (6), length 1096)
    rpi33.lan.46656 > rpi42.lan.46788: Flags [P.], cksum 0xfe41 (correct), seq 4176:5220, ack 4177, win 1332, options [nop,nop,TS val 278366061 ecr 278365842], length 1044
1527817178.197176 IP (tos 0x0, ttl 64, id 2822, offset 0, flags [DF], proto TCP (6), length 1096)
    rpi33.lan.33422 > rpi34.lan.46656: Flags [P.], cksum 0x8896 (incorrect -> 0xf9a3), seq 4176:5220, ack 4177, win 1324, options [nop,nop,TS val 278366061 ecr 278365873], length 1044
1527817178.197221 IP (tos 0x0, ttl 64, id 31270, offset 0, flags [DF], proto TCP (6), length 1096)
    rpi33.lan.40078 > rpi40.lan.46656: Flags [P.], cksum 0x889c (incorrect -> 0x9a66), seq 4176:5220, ack 4177, win 1324, options [nop,nop,TS val 278366061 ecr 278363793], length 1044
1527817178.197443 IP (tos 0x0, ttl 64, id 11133, offset 0, flags [DF], proto TCP (6), length 1096)
    rpi33.lan.57566 > rpi36.lan.46656: Flags [P.], cksum 0x8898 (incorrect -> 0x86d2), seq 6264:7308, ack 6265, win 1324, options [nop,nop,TS val 278366061 ecr 278365861], length 1044
1527817178.197496 IP (tos 0x0, ttl 64, id 40787, offset 0, flags [DF], proto TCP (6), length 1096)
    rpi33.lan.37298 > rpi37.lan.46656: Flags [P.], cksum 0x8899 (incorrect -> 0x4571), seq 4176:5220, ack 4177, win 1324, options [nop,nop,TS val 278366061 ecr 278365845], length 1044
1527817178.197675 IP (tos 0x0, ttl 64, id 36968, offset 0, flags [DF], proto TCP (6), length 52)
    rpi35.lan.46656 > rpi33.lan.51742: Flags [.], cksum 0x6e8d (correct), ack 5221, win 1331, options [nop,nop,TS val 278364583 ecr 278366061], length 0
1527817178.198082 IP (tos 0x0, ttl 64, id 62187, offset 0, flags [DF], proto TCP (6), length 52)
