1527817049.839920 IP (tos 0x0, ttl 64, id 30835, offset 0, flags [DF], proto TCP (6), length 1096)
    rpi33.lan.40078 > rpi40.lan.46656: Flags [P.], cksum 0x889c (incorrect -> 0x786c), seq 1726148488:1726149532, ack 2656879614, win 1324, options [nop,nop,TS val 278353225 ecr 278350854], length 1044
1527817049.840251 IP (tos 0x0, ttl 64, id 10703, offset 0, flags [DF], proto TCP (6), length 1096)
    rpi33.lan.57566 > rpi36.lan.46656: Flags [P.], cksum 0x8898 (incorrect -> 0x59f5), seq 2001829303:2001830347, ack 237498901, win 1324, options [nop,nop,TS val 278353225 ecr 278353029], length 1044
1527817049.840466 IP (tos 0x0, ttl 64, id 60054, offset 0, flags [DF], proto TCP (6), length 1096)
    rpi33.lan.37416 > rpi38.lan.46656: Flags [P.], cksum 0x889a (incorrect -> 0xaf55), seq 302236486:302237530, ack 1430135432, win 1324, options [nop,nop,TS val 278353225 ecr 278351562], length 1044
1527817049.840682 IP (tos 0x0, ttl 64, id 13579, offset 0, flags [DF], proto TCP (6), length 1096)
    rpi33.lan.51742 > rpi35.lan.46656: Flags [P.], cksum 0x8897 (incorrect -> 0x48d3), seq 1568855407:1568856451, ack 1212499234, win 1324, options [nop,nop,TS val 278353225 ecr 278351551], length 1044
1527817049.840850 IP (tos 0x0, ttl 64, id 61737, offset 0, flags [DF], proto TCP (6), length 52)
    rpi40.lan.46656 > rpi33.lan.40078: Flags [.], cksum 0x1a3d (correct), ack 1044, win 1331, options [nop,nop,TS val 278351050 ecr 278353225], length 0
1527817049.840907 IP (tos 0x0, ttl 64, id 40377, offset 0, flags [DF], proto TCP (6), length 1096)
    rpi33.lan.37298 > rpi37.lan.46656: Flags [P.], cksum 0x8899 (incorrect -> 0xe5ef), seq 208156553:208157597, ack 1232470390, win 1324, options [nop,nop,TS val 278353225 ecr 278353014], length 1044
1527817049.841133 IP (tos 0x0, ttl 64, id 43306, offset 0, flags [DF], proto TCP (6), length 1096)
    rpi33.lan.46656 > rpi41.lan.45408: Flags [P.], cksum 0xacbe (correct), seq 3957326301:3957327345, ack 1833304654, win 1332, options [nop,nop,TS val 278353225 ecr 1568400781], length 1044
1527817049.841138 IP (tos 0x0, ttl 64, id 7773, offset 0, flags [DF], proto TCP (6), length 52)
    rpi36.lan.46656 > rpi33.lan.57566: Flags [.], cksum 0x90f2 (correct), ack 1044, win 1331, options [nop,nop,TS val 278353225 ecr 278353225], length 0
1527817049.841164 IP (tos 0x0, ttl 64, id 59578, offset 0, flags [DF], proto TCP (6), length 1096)
    rpi33.lan.46656 > rpi42.lan.46788: Flags [P.], cksum 0x6986 (correct), seq 4122792217:4122793261, ack 2339842670, win 1332, options [nop,nop,TS val 278353225 ecr 278353010], length 1044
1527817049.841293 IP (tos 0x0, ttl 64, id 2383, offset 0, flags [DF], proto TCP (6), length 1096)
    rpi33.lan.33422 > rpi34.lan.46656: Flags [P.], cksum 0x8896 (incorrect -> 0x5c56), seq 830057651:830058695, ack 1296638147, win 1324, options [nop,nop,TS val 278353225 ecr 278353038], length 1044
1527817049.841380 IP (tos 0x0, ttl 64, id 46952, offset 0, flags [DF], proto TCP (6), length 1096)
    rpi33.lan.46656 > rpi39.lan.47132: Flags [P.], cksum 0xa435 (correct), seq 4184504211:4184505255, ack 3667532743, win 1332, options [nop,nop,TS val 278353225 ecr 278353029], length 1044
1527817049.841401 IP (tos 0x0, ttl 64, id 50877, offset 0, flags [DF], proto TCP (6), length 52)
    rpi38.lan.46656 > rpi33.lan.37416: Flags [.], cksum 0x8d97 (correct), ack 1044, win 1331, options [nop,nop,TS val 278351758 ecr 278353225], length 0
1527817049.841566 IP (tos 0x0, ttl 64, id 36502, offset 0, flags [DF], proto TCP (6), length 52)
    rpi35.lan.46656 > rpi33.lan.51742: Flags [.], cksum 0xe265 (correct), ack 1044, win 1331, options [nop,nop,TS val 278351747 ecr 278353225], length 0
1527817049.841787 IP (tos 0x0, ttl 64, id 57352, offset 0, flags [DF], proto TCP (6), length 52)
    rpi37.lan.46656 > rpi33.lan.37298: Flags [.], cksum 0x4695 (correct), ack 1044, win 1331, options [nop,nop,TS val 278353210 ecr 278353225], length 0
1527817049.841981 IP (tos 0x0, ttl 64, id 32986, offset 0, flags [DF], proto TCP (6), length 52)
    rpi41.lan.45408 > rpi33.lan.46656: Flags [.], cksum 0x7399 (correct), ack 1044, win 1323, options [nop,nop,TS val 1568402738 ecr 278353225], length 0
1527817049.842151 IP (tos 0x0, ttl 64, id 33201, offset 0, flags [DF], proto TCP (6), length 52)
    rpi42.lan.46788 > rpi33.lan.46656: Flags [.], cksum 0x33ac (correct), ack 1044, win 1323, options [nop,nop,TS val 278353205 ecr 278353225], length 0
1527817049.842153 IP (tos 0x0, ttl 64, id 60890, offset 0, flags [DF], proto TCP (6), length 52)
    rpi34.lan.46656 > rpi33.lan.33422: Flags [.], cksum 0x9848 (correct), ack 1044, win 1331, options [nop,nop,TS val 278353234 ecr 278353225], length 0
1527817049.842303 IP (tos 0x0, ttl 64, id 22353, offset 0, flags [DF], proto TCP (6), length 52)
    rpi39.lan.47132 > rpi33.lan.46656: Flags [.], cksum 0x479f (correct), ack 1044, win 1323, options [nop,nop,TS val 278353225 ecr 278353225], length 0
1527817049.851376 IP (tos 0x0, ttl 64, id 61738, offset 0, flags [DF], proto TCP (6), length 1096)
    rpi40.lan.46656 > rpi33.lan.40078: Flags [P.], cksum 0x9250 (correct), seq 1:1045, ack 1044, win 1332, options [nop,nop,TS val 278351051 ecr 278353225], length 1044
1527817049.867309 IP (tos 0x0, ttl 64, id 50878, offset 0, flags [DF], proto TCP (6), length 1096)
    rpi38.lan.46656 > rpi33.lan.37416: Flags [P.], cksum 0x4d44 (correct), seq 1:1045, ack 1044, win 1332, options [nop,nop,TS val 278351761 ecr 278353225], length 1044
1527817049.867917 IP (tos 0x0, ttl 64, id 36503, offset 0, flags [DF], proto TCP (6), length 1096)
    rpi35.lan.46656 > rpi33.lan.51742: Flags [P.], cksum 0x13df (correct), seq 1:1045, ack 1044, win 1332, options [nop,nop,TS val 278351750 ecr 278353225], length 1044
1527817049.868821 IP (tos 0x0, ttl 64, id 22354, offset 0, flags [DF], proto TCP (6), length 1096)
    rpi39.lan.47132 > rpi33.lan.46656: Flags [P.], cksum 0x653e (correct), seq 1:1045, ack 1044, win 1324, options [nop,nop,TS val 278353228 ecr 278353225], length 1044
1527817049.869015 IP (tos 0x0, ttl 64, id 32987, offset 0, flags [DF], proto TCP (6), length 1096)
    rpi41.lan.45408 > rpi33.lan.46656: Flags [P.], cksum 0x5e01 (correct), seq 1:1045, ack 1044, win 1324, options [nop,nop,TS val 1568402765 ecr 278353225], length 1044
1527817049.869287 IP (tos 0x0, ttl 64, id 33202, offset 0, flags [DF], proto TCP (6), length 1096)
    rpi42.lan.46788 > rpi33.lan.46656: Flags [P.], cksum 0x4618 (correct), seq 1:1045, ack 1044, win 1324, options [nop,nop,TS val 278353208 ecr 278353225], length 1044
1527817049.872448 IP (tos 0x0, ttl 64, id 57353, offset 0, flags [DF], proto TCP (6), length 1096)
    rpi37.lan.46656 > rpi33.lan.37298: Flags [P.], cksum 0x26c2 (correct), seq 1:1045, ack 1044, win 1332, options [nop,nop,TS val 278353213 ecr 278353225], length 1044
1527817049.872928 IP (tos 0x0, ttl 64, id 60891, offset 0, flags [DF], proto TCP (6), length 1096)
    rpi34.lan.46656 > rpi33.lan.33422: Flags [P.], cksum 0xf8c0 (correct), seq 1:1045, ack 1044, win 1332, options [nop,nop,TS val 278353237 ecr 278353225], length 1044
1527817049.877979 IP (tos 0x0, ttl 64, id 7774, offset 0, flags [DF], proto TCP (6), length 1096)
    rpi36.lan.46656 > rpi33.lan.57566: Flags [P.], cksum 0xec78 (correct), seq 1:1045, ack 1044, win 1332, options [nop,nop,TS val 278353229 ecr 278353225], length 1044
1527817049.894520 IP (tos 0x0, ttl 64, id 30836, offset 0, flags [DF], proto TCP (6), length 52)
    rpi33.lan.40078 > rpi40.lan.46656: Flags [.], cksum 0x8488 (incorrect -> 0x1629), ack 1045, win 1324, options [nop,nop,TS val 278353231 ecr 278351051], length 0
1527817049.914501 IP (tos 0x0, ttl 64, id 2384, offset 0, flags [DF], proto TCP (6), length 52)
    rpi33.lan.33422 > rpi34.lan.46656: Flags [.], cksum 0x8482 (incorrect -> 0x9430), ack 1045, win 1324, options [nop,nop,TS val 278353233 ecr 278353237], length 0
1527817049.914566 IP (tos 0x0, ttl 64, id 40378, offset 0, flags [DF], proto TCP (6), length 52)
    rpi33.lan.37298 > rpi37.lan.46656: Flags [.], cksum 0x8485 (incorrect -> 0x427d), ack 1045, win 1324, options [nop,nop,TS val 278353233 ecr 278353213], length 0
1527817049.914622 IP (tos 0x0, ttl 64, id 59579, offset 0, flags [DF], proto TCP (6), length 52)
    rpi33.lan.46656 > rpi42.lan.46788: Flags [.], cksum 0x848a (incorrect -> 0x2f84), ack 1045, win 1332, options [nop,nop,TS val 278353233 ecr 278353208], length 0
1527817049.914660 IP (tos 0x0, ttl 64, id 43307, offset 0, flags [DF], proto TCP (6), length 52)
    rpi33.lan.46656 > rpi41.lan.45408: Flags [.], cksum 0x8489 (incorrect -> 0x6f59), ack 1045, win 1332, options [nop,nop,TS val 278353233 ecr 1568402765], length 0
1527817049.914728 IP (tos 0x0, ttl 64, id 46953, offset 0, flags [DF], proto TCP (6), length 52)
    rpi33.lan.46656 > rpi39.lan.47132: Flags [.], cksum 0x8487 (incorrect -> 0x4377), ack 1045, win 1332, options [nop,nop,TS val 278353233 ecr 278353228], length 0
1527817049.914781 IP (tos 0x0, ttl 64, id 13580, offset 0, flags [DF], proto TCP (6), length 52)
    rpi33.lan.51742 > rpi35.lan.46656: Flags [.], cksum 0x8483 (incorrect -> 0xde4d), ack 1045, win 1324, options [nop,nop,TS val 278353233 ecr 278351750], length 0
1527817049.914836 IP (tos 0x0, ttl 64, id 60055, offset 0, flags [DF], proto TCP (6), length 52)
    rpi33.lan.37416 > rpi38.lan.46656: Flags [.], cksum 0x8486 (incorrect -> 0x897f), ack 1045, win 1324, options [nop,nop,TS val 278353233 ecr 278351761], length 0
1527817049.924483 IP (tos 0x0, ttl 64, id 10704, offset 0, flags [DF], proto TCP (6), length 52)
    rpi33.lan.57566 > rpi36.lan.46656: Flags [.], cksum 0x8484 (incorrect -> 0x8cd8), ack 1045, win 1324, options [nop,nop,TS val 278353234 ecr 278353229], length 0
1527817051.855300 IP (tos 0x0, ttl 64, id 61739, offset 0, flags [DF], proto TCP (6), length 1096)
    rpi40.lan.46656 > rpi33.lan.40078: Flags [P.], cksum 0x1a47 (correct), seq 1045:2089, ack 1044, win 1332, options [nop,nop,TS val 278351251 ecr 278353231], length 1044
1527817051.855442 IP (tos 0x0, ttl 64, id 30837, offset 0, flags [DF], proto TCP (6), length 52)
    rpi33.lan.40078 > rpi40.lan.46656: Flags [.], cksum 0x8488 (incorrect -> 0x108a), ack 2089, win 1323, options [nop,nop,TS val 278353427 ecr 278351251], length 0
1527817051.870677 IP (tos 0x0, ttl 64, id 50879, offset 0, flags [DF], proto TCP (6), length 1096)
    rpi38.lan.46656 > rpi33.lan.37416: Flags [P.], cksum 0x1468 (correct), seq 1045:2089, ack 1044, win 1332, options [nop,nop,TS val 278351961 ecr 278353233], length 1044
1527817051.870801 IP (tos 0x0, ttl 64, id 60056, offset 0, flags [DF], proto TCP (6), length 52)
    rpi33.lan.37416 > rpi38.lan.46656: Flags [.], cksum 0x8486 (incorrect -> 0x83e1), ack 2089, win 1323, options [nop,nop,TS val 278353428 ecr 278351961], length 0
1527817051.870911 IP (tos 0x0, ttl 64, id 33203, offset 0, flags [DF], proto TCP (6), length 1096)
    rpi42.lan.46788 > rpi33.lan.46656: Flags [P.], cksum 0xece3 (correct), seq 1045:2089, ack 1044, win 1324, options [nop,nop,TS val 278353408 ecr 278353233], length 1044
1527817051.870972 IP (tos 0x0, ttl 64, id 59580, offset 0, flags [DF], proto TCP (6), length 52)
    rpi33.lan.46656 > rpi42.lan.46788: Flags [.], cksum 0x848a (incorrect -> 0x29e6), ack 2089, win 1331, options [nop,nop,TS val 278353428 ecr 278353408], length 0
1527817051.871176 IP (tos 0x0, ttl 64, id 36504, offset 0, flags [DF], proto TCP (6), length 1096)
    rpi35.lan.46656 > rpi33.lan.51742: Flags [P.], cksum 0x1339 (correct), seq 1045:2089, ack 1044, win 1332, options [nop,nop,TS val 278351950 ecr 278353233], length 1044
1527817051.871229 IP (tos 0x0, ttl 64, id 13581, offset 0, flags [DF], proto TCP (6), length 52)
    rpi33.lan.51742 > rpi35.lan.46656: Flags [.], cksum 0x8483 (incorrect -> 0xd8af), ack 2089, win 1323, options [nop,nop,TS val 278353428 ecr 278351950], length 0
1527817051.871405 IP (tos 0x0, ttl 64, id 22355, offset 0, flags [DF], proto TCP (6), length 1096)
    rpi39.lan.47132 > rpi33.lan.46656: Flags [P.], cksum 0x9e3b (correct), seq 1045:2089, ack 1044, win 1324, options [nop,nop,TS val 278353428 ecr 278353233], length 1044
1527817051.871458 IP (tos 0x0, ttl 64, id 46954, offset 0, flags [DF], proto TCP (6), length 52)
    rpi33.lan.46656 > rpi39.lan.47132: Flags [.], cksum 0x8487 (incorrect -> 0x3dd9), ack 2089, win 1331, options [nop,nop,TS val 278353428 ecr 278353428], length 0
1527817051.874379 IP (tos 0x0, ttl 64, id 32988, offset 0, flags [DF], proto TCP (6), length 1096)
    rpi41.lan.45408 > rpi33.lan.46656: Flags [P.], cksum 0x2548 (correct), seq 1045:2089, ack 1044, win 1324, options [nop,nop,TS val 1568404771 ecr 278353233], length 1044
1527817051.874463 IP (tos 0x0, ttl 64, id 43308, offset 0, flags [DF], proto TCP (6), length 52)
    rpi33.lan.46656 > rpi41.lan.45408: Flags [.], cksum 0x8489 (incorrect -> 0x62ad), ack 2089, win 1331, options [nop,nop,TS val 278353428 ecr 1568404771], length 0
1527817051.875924 IP (tos 0x0, ttl 64, id 57354, offset 0, flags [DF], proto TCP (6), length 1096)
    rpi37.lan.46656 > rpi33.lan.37298: Flags [P.], cksum 0xffda (correct), seq 1045:2089, ack 1044, win 1332, options [nop,nop,TS val 278353413 ecr 278353233], length 1044
1527817051.876016 IP (tos 0x0, ttl 64, id 40379, offset 0, flags [DF], proto TCP (6), length 52)
    rpi33.lan.37298 > rpi37.lan.46656: Flags [.], cksum 0x8485 (incorrect -> 0x3cde), ack 2089, win 1323, options [nop,nop,TS val 278353429 ecr 278353413], length 0
1527817051.876220 IP (tos 0x0, ttl 64, id 60892, offset 0, flags [DF], proto TCP (6), length 1096)
    rpi34.lan.46656 > rpi33.lan.33422: Flags [P.], cksum 0x6854 (correct), seq 1045:2089, ack 1044, win 1332, options [nop,nop,TS val 278353437 ecr 278353233], length 1044
1527817051.876278 IP (tos 0x0, ttl 64, id 2385, offset 0, flags [DF], proto TCP (6), length 52)
    rpi33.lan.33422 > rpi34.lan.46656: Flags [.], cksum 0x8482 (incorrect -> 0x8e91), ack 2089, win 1323, options [nop,nop,TS val 278353429 ecr 278353437], length 0
1527817051.881080 IP (tos 0x0, ttl 64, id 7775, offset 0, flags [DF], proto TCP (6), length 1096)
    rpi36.lan.46656 > rpi33.lan.57566: Flags [P.], cksum 0x5678 (correct), seq 1045:2089, ack 1044, win 1332, options [nop,nop,TS val 278353429 ecr 278353234], length 1044
1527817051.881162 IP (tos 0x0, ttl 64, id 10705, offset 0, flags [DF], proto TCP (6), length 52)
    rpi33.lan.57566 > rpi36.lan.46656: Flags [.], cksum 0x8484 (incorrect -> 0x873a), ack 2089, win 1323, options [nop,nop,TS val 278353429 ecr 278353429], length 0
1527817051.889239 IP (tos 0x0, ttl 64, id 2386, offset 0, flags [DF], proto TCP (6), length 1096)
    rpi33.lan.33422 > rpi34.lan.46656: Flags [P.], cksum 0x8896 (incorrect -> 0x9160), seq 1044:2088, ack 2089, win 1324, options [nop,nop,TS val 278353430 ecr 278353437], length 1044
1527817051.889284 IP (tos 0x0, ttl 64, id 13582, offset 0, flags [DF], proto TCP (6), length 1096)
    rpi33.lan.51742 > rpi35.lan.46656: Flags [P.], cksum 0x8897 (incorrect -> 0x2fe8), seq 1044:2088, ack 2089, win 1324, options [nop,nop,TS val 278353430 ecr 278351950], length 1044
1527817051.889378 IP (tos 0x0, ttl 64, id 10706, offset 0, flags [DF], proto TCP (6), length 1096)
    rpi33.lan.57566 > rpi36.lan.46656: Flags [P.], cksum 0x8898 (incorrect -> 0x278f), seq 1044:2088, ack 2089, win 1324, options [nop,nop,TS val 278353430 ecr 278353429], length 1044
1527817051.889599 IP (tos 0x0, ttl 64, id 40380, offset 0, flags [DF], proto TCP (6), length 1096)
    rpi33.lan.37298 > rpi37.lan.46656: Flags [P.], cksum 0x8899 (incorrect -> 0xa543), seq 1044:2088, ack 2089, win 1324, options [nop,nop,TS val 278353430 ecr 278353413], length 1044
1527817051.889633 IP (tos 0x0, ttl 64, id 46955, offset 0, flags [DF], proto TCP (6), length 1096)
    rpi33.lan.46656 > rpi39.lan.47132: Flags [P.], cksum 0x803d (correct), seq 1044:2088, ack 2089, win 1332, options [nop,nop,TS val 278353430 ecr 278353428], length 1044
1527817051.889658 IP (tos 0x0, ttl 64, id 60057, offset 0, flags [DF], proto TCP (6), length 1096)
    rpi33.lan.37416 > rpi38.lan.46656: Flags [P.], cksum 0x889a (incorrect -> 0xa42c), seq 1044:2088, ack 2089, win 1324, options [nop,nop,TS val 278353430 ecr 278351961], length 1044
1527817051.889955 IP (tos 0x0, ttl 64, id 30838, offset 0, flags [DF], proto TCP (6), length 1096)
    rpi33.lan.40078 > rpi40.lan.46656: Flags [P.], cksum 0x889c (incorrect -> 0x7989), seq 1044:2088, ack 2089, win 1324, options [nop,nop,TS val 278353430 ecr 278351251], length 1044
1527817051.889984 IP (tos 0x0, ttl 64, id 59581, offset 0, flags [DF], proto TCP (6), length 1096)
    rpi33.lan.46656 > rpi42.lan.46788: Flags [P.], cksum 0xe87e (correct), seq 1044:2088, ack 2089, win 1332, options [nop,nop,TS val 278353430 ecr 278353408], length 1044
1527817051.890000 IP (tos 0x0, ttl 64, id 43309, offset 0, flags [DF], proto TCP (6), length 1096)
    rpi33.lan.46656 > rpi41.lan.45408: Flags [P.], cksum 0xb4e6 (correct), seq 1044:2088, ack 2089, win 1332, options [nop,nop,TS val 278353430 ecr 1568404771], length 1044
1527817051.890213 IP (tos 0x0, ttl 64, id 7776, offset 0, flags [DF], proto TCP (6), length 52)
    rpi36.lan.46656 > rpi33.lan.57566: Flags [.], cksum 0x831c (correct), ack 2088, win 1331, options [nop,nop,TS val 278353430 ecr 278353430], length 0
1527817051.931143 IP (tos 0x0, ttl 64, id 57355, offset 0, flags [DF], proto TCP (6), length 52)
    rpi37.lan.46656 > rpi33.lan.37298: Flags [.], cksum 0x38ba (correct), ack 2088, win 1332, options [nop,nop,TS val 278353419 ecr 278353430], length 0
1527817051.932107 IP (tos 0x0, ttl 64, id 33204, offset 0, flags [DF], proto TCP (6), length 52)
    rpi42.lan.46788 > rpi33.lan.46656: Flags [.], cksum 0x25d0 (correct), ack 2088, win 1324, options [nop,nop,TS val 278353415 ecr 278353430], length 0
1527817051.934381 IP (tos 0x0, ttl 64, id 22356, offset 0, flags [DF], proto TCP (6), length 52)
    rpi39.lan.47132 > rpi33.lan.46656: Flags [.], cksum 0x39c3 (correct), ack 2088, win 1324, options [nop,nop,TS val 278353435 ecr 278353430], length 0
1527817051.935347 IP (tos 0x0, ttl 64, id 32989, offset 0, flags [DF], proto TCP (6), length 52)
    rpi41.lan.45408 > rpi33.lan.46656: Flags [.], cksum 0x5e61 (correct), ack 2088, win 1324, options [nop,nop,TS val 1568404832 ecr 278353430], length 0
1527817051.936399 IP (tos 0x0, ttl 64, id 36505, offset 0, flags [DF], proto TCP (6), length 52)
    rpi35.lan.46656 > rpi33.lan.51742: Flags [.], cksum 0xd489 (correct), ack 2088, win 1332, options [nop,nop,TS val 278351957 ecr 278353430], length 0
1527817051.936401 IP (tos 0x0, ttl 64, id 50880, offset 0, flags [DF], proto TCP (6), length 52)
    rpi38.lan.46656 > rpi33.lan.37416: Flags [.], cksum 0x7fbb (correct), ack 2088, win 1332, options [nop,nop,TS val 278351968 ecr 278353430], length 0
1527817051.937311 IP (tos 0x0, ttl 64, id 60893, offset 0, flags [DF], proto TCP (6), length 52)
    rpi34.lan.46656 > rpi33.lan.33422: Flags [.], cksum 0x8a6c (correct), ack 2088, win 1332, options [nop,nop,TS val 278353444 ecr 278353430], length 0
1527817051.938725 IP (tos 0x0, ttl 64, id 61740, offset 0, flags [DF], proto TCP (6), length 52)
    rpi40.lan.46656 > rpi33.lan.40078: Flags [.], cksum 0x0c61 (correct), ack 2088, win 1332, options [nop,nop,TS val 278351260 ecr 278353430], length 0
1527817052.637166 IP (tos 0x0, ttl 64, id 50881, offset 0, flags [DF], proto TCP (6), length 1096)
    rpi38.lan.46656 > rpi33.lan.37416: Flags [P.], cksum 0xb623 (correct), seq 2089:3133, ack 2088, win 1332, options [nop,nop,TS val 278352038 ecr 278353430], length 1044
1527817052.684529 IP (tos 0x0, ttl 64, id 60058, offset 0, flags [DF], proto TCP (6), length 52)
    rpi33.lan.37416 > rpi38.lan.46656: Flags [.], cksum 0x8486 (incorrect -> 0x7b19), ack 3133, win 1324, options [nop,nop,TS val 278353510 ecr 278352038], length 0
1527817052.897200 IP (tos 0x0, ttl 64, id 60059, offset 0, flags [DF], proto TCP (6), length 1096)
    rpi33.lan.37416 > rpi38.lan.46656: Flags [P.], cksum 0x889a (incorrect -> 0x7c3d), seq 2088:3132, ack 3133, win 1324, options [nop,nop,TS val 278353531 ecr 278352038], length 1044
1527817052.897390 IP (tos 0x0, ttl 64, id 50882, offset 0, flags [DF], proto TCP (6), length 1096)
    rpi38.lan.46656 > rpi33.lan.37416: Flags [P.], cksum 0x15ba (correct), seq 3133:4177, ack 2088, win 1332, options [nop,nop,TS val 278352064 ecr 278353510], length 1044
1527817052.897502 IP (tos 0x0, ttl 64, id 60060, offset 0, flags [DF], proto TCP (6), length 52)
    rpi33.lan.37416 > rpi38.lan.46656: Flags [.], cksum 0x8486 (incorrect -> 0x72c3), ack 4177, win 1323, options [nop,nop,TS val 278353531 ecr 278352064], length 0
1527817052.898060 IP (tos 0x0, ttl 64, id 50883, offset 0, flags [DF], proto TCP (6), length 52)
    rpi38.lan.46656 > rpi33.lan.37416: Flags [.], cksum 0x72bb (correct), ack 3132, win 1331, options [nop,nop,TS val 278352064 ecr 278353531], length 0
1527817052.898178 IP (tos 0x0, ttl 64, id 60061, offset 0, flags [DF], proto TCP (6), length 1096)
    rpi33.lan.37416 > rpi38.lan.46656: Flags [P.], cksum 0x889a (incorrect -> 0xca87), seq 3132:4176, ack 4177, win 1324, options [nop,nop,TS val 278353531 ecr 278352064], length 1044
1527817052.898913 IP (tos 0x0, ttl 64, id 50884, offset 0, flags [DF], proto TCP (6), length 1096)
    rpi38.lan.46656 > rpi33.lan.37416: Flags [P.], cksum 0xc269 (correct), seq 4177:5221, ack 3132, win 1332, options [nop,nop,TS val 278352064 ecr 278353531], length 1044
1527817052.944501 IP (tos 0x0, ttl 64, id 60062, offset 0, flags [DF], proto TCP (6), length 52)
    rpi33.lan.37416 > rpi38.lan.46656: Flags [.], cksum 0x8486 (incorrect -> 0x6a95), ack 5221, win 1324, options [nop,nop,TS val 278353536 ecr 278352064], length 0
1527817052.946440 IP (tos 0x0, ttl 64, id 50885, offset 0, flags [DF], proto TCP (6), length 52)
    rpi38.lan.46656 > rpi33.lan.37416: Flags [.], cksum 0x6a8d (correct), ack 4176, win 1332, options [nop,nop,TS val 278352069 ecr 278353531], length 0
1527817053.860389 IP (tos 0x0, ttl 64, id 61741, offset 0, flags [DF], proto TCP (6), length 1096)
    rpi40.lan.46656 > rpi33.lan.40078: Flags [P.], cksum 0xbd9d (correct), seq 2089:3133, ack 2088, win 1332, options [nop,nop,TS val 278351452 ecr 278353430], length 1044
1527817053.874228 IP (tos 0x0, ttl 64, id 50886, offset 0, flags [DF], proto TCP (6), length 1096)
    rpi38.lan.46656 > rpi33.lan.37416: Flags [P.], cksum 0xbc2f (correct), seq 5221:6265, ack 4176, win 1332, options [nop,nop,TS val 278352161 ecr 278353531], length 1044
1527817053.874332 IP (tos 0x0, ttl 64, id 60063, offset 0, flags [DF], proto TCP (6), length 52)
    rpi33.lan.37416 > rpi38.lan.46656: Flags [.], cksum 0x8486 (incorrect -> 0x65c5), ack 6265, win 1323, options [nop,nop,TS val 278353628 ecr 278352161], length 0
1527817053.874612 IP (tos 0x0, ttl 64, id 33205, offset 0, flags [DF], proto TCP (6), length 1096)
    rpi42.lan.46788 > rpi33.lan.46656: Flags [P.], cksum 0xacbe (correct), seq 2089:3133, ack 2088, win 1324, options [nop,nop,TS val 278353609 ecr 278353430], length 1044
1527817053.875093 IP (tos 0x0, ttl 64, id 22357, offset 0, flags [DF], proto TCP (6), length 1096)
    rpi39.lan.47132 > rpi33.lan.46656: Flags [P.], cksum 0x3433 (correct), seq 2089:3133, ack 2088, win 1324, options [nop,nop,TS val 278353629 ecr 278353430], length 1044
1527817053.875283 IP (tos 0x0, ttl 64, id 36506, offset 0, flags [DF], proto TCP (6), length 1096)
    rpi35.lan.46656 > rpi33.lan.51742: Flags [P.], cksum 0xdfd2 (correct), seq 2089:3133, ack 2088, win 1332, options [nop,nop,TS val 278352150 ecr 278353430], length 1044
1527817053.878646 IP (tos 0x0, ttl 64, id 32990, offset 0, flags [DF], proto TCP (6), length 1096)
    rpi41.lan.45408 > rpi33.lan.46656: Flags [P.], cksum 0x42d0 (correct), seq 2089:3133, ack 2088, win 1324, options [nop,nop,TS val 1568406775 ecr 278353430], length 1044
1527817053.878842 IP (tos 0x0, ttl 64, id 57356, offset 0, flags [DF], proto TCP (6), length 1096)
    rpi37.lan.46656 > rpi33.lan.37298: Flags [P.], cksum 0x1679 (correct), seq 2089:3133, ack 2088, win 1332, options [nop,nop,TS val 278353613 ecr 278353430], length 1044
1527817053.880253 IP (tos 0x0, ttl 64, id 60894, offset 0, flags [DF], proto TCP (6), length 1096)
    rpi34.lan.46656 > rpi33.lan.33422: Flags [P.], cksum 0x7133 (correct), seq 2089:3133, ack 2088, win 1332, options [nop,nop,TS val 278353638 ecr 278353430], length 1044
1527817053.884285 IP (tos 0x0, ttl 64, id 7777, offset 0, flags [DF], proto TCP (6), length 1096)
    rpi36.lan.46656 > rpi33.lan.57566: Flags [P.], cksum 0x3643 (correct), seq 2089:3133, ack 2088, win 1332, options [nop,nop,TS val 278353629 ecr 278353430], length 1044
1527817053.892346 IP (tos 0x0, ttl 64, id 60064, offset 0, flags [DF], proto TCP (6), length 1096)
    rpi33.lan.37416 > rpi38.lan.46656: Flags [P.], cksum 0x889a (incorrect -> 0x7ce5), seq 4176:5220, ack 6265, win 1324, options [nop,nop,TS val 278353630 ecr 278352161], length 1044
1527817053.892390 IP (tos 0x0, ttl 64, id 2387, offset 0, flags [DF], proto TCP (6), length 1096)
    rpi33.lan.33422 > rpi34.lan.46656: Flags [P.], cksum 0x8896 (incorrect -> 0x9f22), seq 2088:3132, ack 3133, win 1324, options [nop,nop,TS val 278353630 ecr 278353638], length 1044
1527817053.892471 IP (tos 0x0, ttl 64, id 46956, offset 0, flags [DF], proto TCP (6), length 1096)
    rpi33.lan.46656 > rpi39.lan.47132: Flags [P.], cksum 0xdae9 (correct), seq 2088:3132, ack 3133, win 1332, options [nop,nop,TS val 278353630 ecr 278353629], length 1044
1527817053.892654 IP (tos 0x0, ttl 64, id 13583, offset 0, flags [DF], proto TCP (6), length 1096)
    rpi33.lan.51742 > rpi35.lan.46656: Flags [P.], cksum 0x8897 (incorrect -> 0xabd1), seq 2088:3132, ack 3133, win 1324, options [nop,nop,TS val 278353630 ecr 278352150], length 1044
1527817053.892833 IP (tos 0x0, ttl 64, id 59582, offset 0, flags [DF], proto TCP (6), length 1096)
    rpi33.lan.46656 > rpi42.lan.46788: Flags [P.], cksum 0xcb8a (correct), seq 2088:3132, ack 3133, win 1332, options [nop,nop,TS val 278353630 ecr 278353609], length 1044
1527817053.892935 IP (tos 0x0, ttl 64, id 30839, offset 0, flags [DF], proto TCP (6), length 1096)
    rpi33.lan.40078 > rpi40.lan.46656: Flags [P.], cksum 0x889c (incorrect -> 0x34fd), seq 2088:3132, ack 3133, win 1324, options [nop,nop,TS val 278353630 ecr 278351452], length 1044
1527817053.893052 IP (tos 0x0, ttl 64, id 40381, offset 0, flags [DF], proto TCP (6), length 1096)
    rpi33.lan.37298 > rpi37.lan.46656: Flags [P.], cksum 0x8899 (incorrect -> 0x18c6), seq 2088:3132, ack 3133, win 1324, options [nop,nop,TS val 278353630 ecr 278353613], length 1044
1527817053.893157 IP (tos 0x0, ttl 64, id 50887, offset 0, flags [DF], proto TCP (6), length 52)
    rpi38.lan.46656 > rpi33.lan.37416: Flags [.], cksum 0x61a5 (correct), ack 5220, win 1331, options [nop,nop,TS val 278352163 ecr 278353630], length 0
1527817053.893160 IP (tos 0x0, ttl 64, id 60895, offset 0, flags [DF], proto TCP (6), length 52)
    rpi34.lan.46656 > rpi33.lan.33422: Flags [.], cksum 0x80ba (correct), ack 3132, win 1331, options [nop,nop,TS val 278353639 ecr 278353630], length 0
1527817053.893325 IP (tos 0x0, ttl 64, id 43310, offset 0, flags [DF], proto TCP (6), length 1096)
    rpi33.lan.46656 > rpi41.lan.45408: Flags [P.], cksum 0xe90a (correct), seq 2088:3132, ack 3133, win 1332, options [nop,nop,TS val 278353630 ecr 1568406775], length 1044
1527817053.893337 IP (tos 0x0, ttl 64, id 22358, offset 0, flags [DF], proto TCP (6), length 52)
    rpi39.lan.47132 > rpi33.lan.46656: Flags [.], cksum 0x3011 (correct), ack 3132, win 1323, options [nop,nop,TS val 278353630 ecr 278353630], length 0
1527817053.893339 IP (tos 0x0, ttl 64, id 36507, offset 0, flags [DF], proto TCP (6), length 52)
    rpi35.lan.46656 > rpi33.lan.51742: Flags [.], cksum 0xcad7 (correct), ack 3132, win 1331, options [nop,nop,TS val 278352152 ecr 278353630], length 0
1527817053.893527 IP (tos 0x0, ttl 64, id 10707, offset 0, flags [DF], proto TCP (6), length 1096)
    rpi33.lan.57566 > rpi36.lan.46656: Flags [P.], cksum 0x8898 (incorrect -> 0xdab9), seq 2088:3132, ack 3133, win 1324, options [nop,nop,TS val 278353630 ecr 278353629], length 1044
1527817053.893642 IP (tos 0x0, ttl 64, id 33206, offset 0, flags [DF], proto TCP (6), length 52)
    rpi42.lan.46788 > rpi33.lan.46656: Flags [.], cksum 0x1c1d (correct), ack 3132, win 1323, options [nop,nop,TS val 278353611 ecr 278353630], length 0
1527817053.893646 IP (tos 0x0, ttl 64, id 61742, offset 0, flags [DF], proto TCP (6), length 52)
    rpi40.lan.46656 > rpi33.lan.40078: Flags [.], cksum 0x02af (correct), ack 3132, win 1331, options [nop,nop,TS val 278351455 ecr 278353630], length 0
1527817053.893815 IP (tos 0x0, ttl 64, id 57357, offset 0, flags [DF], proto TCP (6), length 52)
    rpi37.lan.46656 > rpi33.lan.37298: Flags [.], cksum 0x2f07 (correct), ack 3132, win 1331, options [nop,nop,TS val 278353615 ecr 278353630], length 0
1527817053.894071 IP (tos 0x0, ttl 64, id 32991, offset 0, flags [DF], proto TCP (6), length 52)
    rpi41.lan.45408 > rpi33.lan.46656: Flags [.], cksum 0x4dcc (correct), ack 3132, win 1323, options [nop,nop,TS val 1568406790 ecr 278353630], length 0
1527817053.894270 IP (tos 0x0, ttl 64, id 7778, offset 0, flags [DF], proto TCP (6), length 52)
    rpi36.lan.46656 > rpi33.lan.57566: Flags [.], cksum 0x7964 (correct), ack 3132, win 1331, options [nop,nop,TS val 278353630 ecr 278353630], length 0
1527817054.908993 IP (tos 0x0, ttl 64, id 7779, offset 0, flags [DF], proto TCP (6), length 1096)
    rpi36.lan.46656 > rpi33.lan.57566: Flags [P.], cksum 0xadc3 (correct), seq 3133:4177, ack 3132, win 1332, options [nop,nop,TS val 278353732 ecr 278353630], length 1044
1527817054.909010 IP (tos 0x0, ttl 64, id 10708, offset 0, flags [DF], proto TCP (6), length 1096)
    rpi33.lan.57566 > rpi36.lan.46656: Flags [P.], cksum 0x8898 (incorrect -> 0x988e), seq 3132:4176, ack 3133, win 1324, options [nop,nop,TS val 278353732 ecr 278353630], length 1044
1527817054.909716 IP (tos 0x0, ttl 64, id 10709, offset 0, flags [DF], proto TCP (6), length 1096)
    rpi33.lan.57566 > rpi36.lan.46656: Flags [P.], cksum 0x8898 (incorrect -> 0x8b7b), seq 4176:5220, ack 4177, win 1324, options [nop,nop,TS val 278353732 ecr 278353732], length 1044
1527817054.909776 IP (tos 0x0, ttl 64, id 7780, offset 0, flags [DF], proto TCP (6), length 52)
    rpi36.lan.46656 > rpi33.lan.57566: Flags [.], cksum 0x7070 (correct), ack 4176, win 1331, options [nop,nop,TS val 278353732 ecr 278353732], length 0
1527817054.910461 IP (tos 0x0, ttl 64, id 7781, offset 0, flags [DF], proto TCP (6), length 1096)
    rpi36.lan.46656 > rpi33.lan.57566: Flags [P.], cksum 0x068c (correct), seq 4177:5221, ack 4176, win 1332, options [nop,nop,TS val 278353732 ecr 278353732], length 1044
1527817054.954504 IP (tos 0x0, ttl 64, id 10710, offset 0, flags [DF], proto TCP (6), length 52)
    rpi33.lan.57566 > rpi36.lan.46656: Flags [.], cksum 0x8484 (incorrect -> 0x684a), ack 5221, win 1324, options [nop,nop,TS val 278353737 ecr 278353732], length 0
1527817054.956793 IP (tos 0x0, ttl 64, id 7782, offset 0, flags [DF], proto TCP (6), length 52)
    rpi36.lan.46656 > rpi33.lan.57566: Flags [.], cksum 0x6842 (correct), ack 5220, win 1332, options [nop,nop,TS val 278353737 ecr 278353732], length 0
1527817055.863509 IP (tos 0x0, ttl 64, id 61743, offset 0, flags [DF], proto TCP (6), length 1096)
    rpi40.lan.46656 > rpi33.lan.40078: Flags [P.], cksum 0x56dd (correct), seq 3133:4177, ack 3132, win 1332, options [nop,nop,TS val 278351652 ecr 278353630], length 1044
1527817055.877847 IP (tos 0x0, ttl 64, id 33207, offset 0, flags [DF], proto TCP (6), length 1096)
    rpi42.lan.46788 > rpi33.lan.46656: Flags [P.], cksum 0x842c (correct), seq 3133:4177, ack 3132, win 1324, options [nop,nop,TS val 278353809 ecr 278353630], length 1044
1527817055.878467 IP (tos 0x0, ttl 64, id 22359, offset 0, flags [DF], proto TCP (6), length 1096)
    rpi39.lan.47132 > rpi33.lan.46656: Flags [P.], cksum 0x221a (correct), seq 3133:4177, ack 3132, win 1324, options [nop,nop,TS val 278353829 ecr 278353630], length 1044
1527817055.878653 IP (tos 0x0, ttl 64, id 36508, offset 0, flags [DF], proto TCP (6), length 1096)
    rpi35.lan.46656 > rpi33.lan.51742: Flags [P.], cksum 0x193a (correct), seq 3133:4177, ack 3132, win 1332, options [nop,nop,TS val 278352351 ecr 278353630], length 1044
1527817055.880510 IP (tos 0x0, ttl 64, id 50888, offset 0, flags [DF], proto TCP (6), length 1096)
    rpi38.lan.46656 > rpi33.lan.37416: Flags [P.], cksum 0x9b9c (correct), seq 6265:7309, ack 5220, win 1332, options [nop,nop,TS val 278352362 ecr 278353630], length 1044
1527817055.881293 IP (tos 0x0, ttl 64, id 32992, offset 0, flags [DF], proto TCP (6), length 1096)
    rpi41.lan.45408 > rpi33.lan.46656: Flags [P.], cksum 0xe5af (correct), seq 3133:4177, ack 3132, win 1324, options [nop,nop,TS val 1568408777 ecr 278353630], length 1044
1527817055.882752 IP (tos 0x0, ttl 64, id 57358, offset 0, flags [DF], proto TCP (6), length 1096)
    rpi37.lan.46656 > rpi33.lan.37298: Flags [P.], cksum 0x1cdb (correct), seq 3133:4177, ack 3132, win 1332, options [nop,nop,TS val 278353814 ecr 278353630], length 1044
1527817055.883633 IP (tos 0x0, ttl 64, id 60896, offset 0, flags [DF], proto TCP (6), length 1096)
    rpi34.lan.46656 > rpi33.lan.33422: Flags [P.], cksum 0xe710 (correct), seq 3133:4177, ack 3132, win 1332, options [nop,nop,TS val 278353838 ecr 278353630], length 1044
1527817055.888571 IP (tos 0x0, ttl 64, id 7783, offset 0, flags [DF], proto TCP (6), length 1096)
    rpi36.lan.46656 > rpi33.lan.57566: Flags [P.], cksum 0xf5dd (correct), seq 5221:6265, ack 5220, win 1332, options [nop,nop,TS val 278353830 ecr 278353732], length 1044
1527817055.888723 IP (tos 0x0, ttl 64, id 10711, offset 0, flags [DF], proto TCP (6), length 52)
    rpi33.lan.57566 > rpi36.lan.46656: Flags [.], cksum 0x8484 (incorrect -> 0x6378), ack 6265, win 1323, options [nop,nop,TS val 278353830 ecr 278353830], length 0
1527817055.896441 IP (tos 0x0, ttl 64, id 2388, offset 0, flags [DF], proto TCP (6), length 1096)
    rpi33.lan.33422 > rpi34.lan.46656: Flags [P.], cksum 0x8896 (incorrect -> 0x89b6), seq 3132:4176, ack 4177, win 1324, options [nop,nop,TS val 278353831 ecr 278353838], length 1044
1527817055.897074 IP (tos 0x0, ttl 64, id 40382, offset 0, flags [DF], proto TCP (6), length 1096)
    rpi33.lan.37298 > rpi37.lan.46656: Flags [P.], cksum 0x8899 (incorrect -> 0x6799), seq 3132:4176, ack 4177, win 1324, options [nop,nop,TS val 278353831 ecr 278353814], length 1044
1527817055.897127 IP (tos 0x0, ttl 64, id 60065, offset 0, flags [DF], proto TCP (6), length 1096)
    rpi33.lan.37416 > rpi38.lan.46656: Flags [P.], cksum 0x889a (incorrect -> 0x1b1d), seq 5220:6264, ack 7309, win 1324, options [nop,nop,TS val 278353831 ecr 278352362], length 1044
1527817055.897268 IP (tos 0x0, ttl 64, id 13584, offset 0, flags [DF], proto TCP (6), length 1096)
    rpi33.lan.51742 > rpi35.lan.46656: Flags [P.], cksum 0x8897 (incorrect -> 0xca24), seq 3132:4176, ack 4177, win 1324, options [nop,nop,TS val 278353831 ecr 278352351], length 1044
1527817055.897280 IP (tos 0x0, ttl 64, id 60897, offset 0, flags [DF], proto TCP (6), length 52)
    rpi34.lan.46656 > rpi33.lan.33422: Flags [.], cksum 0x7701 (correct), ack 4176, win 1331, options [nop,nop,TS val 278353839 ecr 278353831], length 0
1527817055.897363 IP (tos 0x0, ttl 64, id 10712, offset 0, flags [DF], proto TCP (6), length 1096)
    rpi33.lan.57566 > rpi36.lan.46656: Flags [P.], cksum 0x8898 (incorrect -> 0x9b7b), seq 5220:6264, ack 6265, win 1324, options [nop,nop,TS val 278353831 ecr 278353830], length 1044
1527817055.897515 IP (tos 0x0, ttl 64, id 46957, offset 0, flags [DF], proto TCP (6), length 1096)
    rpi33.lan.46656 > rpi39.lan.47132: Flags [P.], cksum 0x9c75 (correct), seq 3132:4176, ack 4177, win 1332, options [nop,nop,TS val 278353831 ecr 278353829], length 1044
1527817055.897740 IP (tos 0x0, ttl 64, id 30840, offset 0, flags [DF], proto TCP (6), length 1096)
    rpi33.lan.40078 > rpi40.lan.46656: Flags [P.], cksum 0x889c (incorrect -> 0x2069), seq 3132:4176, ack 4177, win 1324, options [nop,nop,TS val 278353831 ecr 278351652], length 1044
1527817055.897859 IP (tos 0x0, ttl 64, id 57359, offset 0, flags [DF], proto TCP (6), length 52)
    rpi37.lan.46656 > rpi33.lan.37298: Flags [.], cksum 0x254e (correct), ack 4176, win 1331, options [nop,nop,TS val 278353815 ecr 278353831], length 0
1527817055.897861 IP (tos 0x0, ttl 64, id 50889, offset 0, flags [DF], proto TCP (6), length 52)
    rpi38.lan.46656 > rpi33.lan.37416: Flags [.], cksum 0x57eb (correct), ack 6264, win 1331, options [nop,nop,TS val 278352364 ecr 278353831], length 0
1527817055.898068 IP (tos 0x0, ttl 64, id 36509, offset 0, flags [DF], proto TCP (6), length 52)
    rpi35.lan.46656 > rpi33.lan.51742: Flags [.], cksum 0xc11d (correct), ack 4176, win 1331, options [nop,nop,TS val 278352353 ecr 278353831], length 0
1527817055.898069 IP (tos 0x0, ttl 64, id 7784, offset 0, flags [DF], proto TCP (6), length 52)
    rpi36.lan.46656 > rpi33.lan.57566: Flags [.], cksum 0x5f5a (correct), ack 6264, win 1331, options [nop,nop,TS val 278353831 ecr 278353831], length 0
1527817055.898188 IP (tos 0x0, ttl 64, id 59583, offset 0, flags [DF], proto TCP (6), length 1096)
    rpi33.lan.46656 > rpi42.lan.46788: Flags [P.], cksum 0xd910 (correct), seq 3132:4176, ack 4177, win 1332, options [nop,nop,TS val 278353831 ecr 278353809], length 1044
1527817055.898214 IP (tos 0x0, ttl 64, id 43311, offset 0, flags [DF], proto TCP (6), length 1096)
    rpi33.lan.46656 > rpi41.lan.45408: Flags [P.], cksum 0xd730 (correct), seq 3132:4176, ack 4177, win 1332, options [nop,nop,TS val 278353831 ecr 1568408777], length 1044
1527817055.898323 IP (tos 0x0, ttl 64, id 22360, offset 0, flags [DF], proto TCP (6), length 52)
    rpi39.lan.47132 > rpi33.lan.46656: Flags [.], cksum 0x2657 (correct), ack 4176, win 1323, options [nop,nop,TS val 278353831 ecr 278353831], length 0
1527817055.898505 IP (tos 0x0, ttl 64, id 61744, offset 0, flags [DF], proto TCP (6), length 52)
    rpi40.lan.46656 > rpi33.lan.40078: Flags [.], cksum 0xf8f5 (correct), ack 4176, win 1331, options [nop,nop,TS val 278351655 ecr 278353831], length 0
1527817055.898962 IP (tos 0x0, ttl 64, id 33208, offset 0, flags [DF], proto TCP (6), length 52)
    rpi42.lan.46788 > rpi33.lan.46656: Flags [.], cksum 0x1264 (correct), ack 4176, win 1323, options [nop,nop,TS val 278353811 ecr 278353831], length 0
1527817055.898964 IP (tos 0x0, ttl 64, id 32993, offset 0, flags [DF], proto TCP (6), length 52)
    rpi41.lan.45408 > rpi33.lan.46656: Flags [.], cksum 0x3d06 (correct), ack 4176, win 1323, options [nop,nop,TS val 1568408795 ecr 278353831], length 0
1527817056.877865 IP (tos 0x0, ttl 64, id 30841, offset 0, flags [DF], proto TCP (6), length 1096)
    rpi33.lan.40078 > rpi40.lan.46656: Flags [P.], cksum 0x889c (incorrect -> 0x5648), seq 4176:5220, ack 4177, win 1324, options [nop,nop,TS val 278353929 ecr 278351655], length 1044
1527817056.878248 IP (tos 0x0, ttl 64, id 46958, offset 0, flags [DF], proto TCP (6), length 1096)
    rpi33.lan.46656 > rpi39.lan.47132: Flags [P.], cksum 0x5d20 (correct), seq 4176:5220, ack 4177, win 1332, options [nop,nop,TS val 278353929 ecr 278353831], length 1044
1527817056.878283 IP (tos 0x0, ttl 64, id 43312, offset 0, flags [DF], proto TCP (6), length 1096)
    rpi33.lan.46656 > rpi41.lan.45408: Flags [P.], cksum 0x8acc (correct), seq 4176:5220, ack 4177, win 1332, options [nop,nop,TS val 278353929 ecr 1568408795], length 1044
1527817056.878539 IP (tos 0x0, ttl 64, id 40383, offset 0, flags [DF], proto TCP (6), length 1096)
    rpi33.lan.37298 > rpi37.lan.46656: Flags [P.], cksum 0x8899 (incorrect -> 0x1fa6), seq 4176:5220, ack 4177, win 1324, options [nop,nop,TS val 278353929 ecr 278353815], length 1044
1527817056.878570 IP (tos 0x0, ttl 64, id 59584, offset 0, flags [DF], proto TCP (6), length 1096)
