1527830707.246855 IP (tos 0x0, ttl 64, id 3403, offset 0, flags [DF], proto TCP (6), length 1096)
    rpi41.lan.48084 > rpi33.lan.46656: Flags [P.], cksum 0xd78f (correct), seq 2247014376:2247015420, ack 3141509482, win 1324, options [nop,nop,TS val 1582060256 ecr 279718769], length 1044
1527830707.254460 IP (tos 0x0, ttl 64, id 20022, offset 0, flags [DF], proto TCP (6), length 1096)
    rpi35.lan.36908 > rpi33.lan.46656: Flags [P.], cksum 0xa5d0 (correct), seq 375894493:375895537, ack 1337329475, win 1324, options [nop,nop,TS val 279717488 ecr 279718769], length 1044
1527830707.260154 IP (tos 0x0, ttl 64, id 27278, offset 0, flags [DF], proto TCP (6), length 1096)
    rpi40.lan.35100 > rpi33.lan.46656: Flags [P.], cksum 0x811d (correct), seq 1145648312:1145649356, ack 4024090125, win 1324, options [nop,nop,TS val 279716791 ecr 279718769], length 1044
1527830707.270229 IP (tos 0x0, ttl 64, id 14638, offset 0, flags [DF], proto TCP (6), length 1096)
    rpi38.lan.46656 > rpi33.lan.55368: Flags [P.], cksum 0x6a16 (correct), seq 3947993756:3947994800, ack 2732624312, win 1332, options [nop,nop,TS val 279717500 ecr 279718769], length 1044
1527830707.272063 IP (tos 0x0, ttl 64, id 33682, offset 0, flags [DF], proto TCP (6), length 1096)
    rpi39.lan.50408 > rpi33.lan.46656: Flags [P.], cksum 0xc53b (correct), seq 2268135798:2268136842, ack 3834719184, win 1324, options [nop,nop,TS val 279718968 ecr 279718769], length 1044
1527830707.272957 IP (tos 0x0, ttl 64, id 13073, offset 0, flags [DF], proto TCP (6), length 1096)
    rpi33.lan.51354 > rpi34.lan.46656: Flags [P.], cksum 0x8896 (incorrect -> 0x2634), seq 1518374354:1518375398, ack 135627196, win 1324, options [nop,nop,TS val 279718968 ecr 279718782], length 1044
1527830707.273137 IP (tos 0x0, ttl 64, id 4202, offset 0, flags [DF], proto TCP (6), length 1096)
    rpi33.lan.46656 > rpi36.lan.52404: Flags [P.], cksum 0x7e5b (correct), seq 2846993328:2846994372, ack 765677313, win 1332, options [nop,nop,TS val 279718968 ecr 279718854], length 1044
1527830707.273171 IP (tos 0x0, ttl 64, id 52177, offset 0, flags [DF], proto TCP (6), length 1096)
    rpi33.lan.46656 > rpi35.lan.36908: Flags [P.], cksum 0x54ed (correct), seq 1:1045, ack 1044, win 1332, options [nop,nop,TS val 279718968 ecr 279717488], length 1044
1527830707.273322 IP (tos 0x0, ttl 64, id 31772, offset 0, flags [DF], proto TCP (6), length 1096)
    rpi33.lan.55368 > rpi38.lan.46656: Flags [P.], cksum 0x889a (incorrect -> 0x6629), seq 1:1045, ack 1044, win 1324, options [nop,nop,TS val 279718968 ecr 279717500], length 1044
1527830707.273448 IP (tos 0x0, ttl 64, id 59305, offset 0, flags [DF], proto TCP (6), length 1096)
    rpi33.lan.55238 > rpi37.lan.46656: Flags [P.], cksum 0x8899 (incorrect -> 0x81d6), seq 3070956019:3070957063, ack 128857828, win 1324, options [nop,nop,TS val 279718968 ecr 279718753], length 1044
1527830707.273717 IP (tos 0x0, ttl 64, id 20030, offset 0, flags [DF], proto TCP (6), length 52)
    rpi34.lan.46656 > rpi33.lan.51354: Flags [.], cksum 0x7e49 (correct), ack 1044, win 1331, options [nop,nop,TS val 279718977 ecr 279718968], length 0
1527830707.273764 IP (tos 0x0, ttl 64, id 40018, offset 0, flags [DF], proto TCP (6), length 1096)
    rpi33.lan.46656 > rpi41.lan.48084: Flags [P.], cksum 0x9171 (correct), seq 1:1045, ack 1044, win 1332, options [nop,nop,TS val 279718968 ecr 1582060256], length 1044
1527830707.273809 IP (tos 0x0, ttl 64, id 39031, offset 0, flags [DF], proto TCP (6), length 1096)
    rpi33.lan.46656 > rpi40.lan.35100: Flags [P.], cksum 0x2939 (correct), seq 1:1045, ack 1044, win 1332, options [nop,nop,TS val 279718968 ecr 279716791], length 1044
1527830707.273869 IP (tos 0x0, ttl 64, id 40622, offset 0, flags [DF], proto TCP (6), length 1096)
    rpi33.lan.46656 > rpi42.lan.49208: Flags [P.], cksum 0xd55a (correct), seq 2631965983:2631967027, ack 237802582, win 1332, options [nop,nop,TS val 279718968 ecr 279718750], length 1044
1527830707.273949 IP (tos 0x0, ttl 64, id 41644, offset 0, flags [DF], proto TCP (6), length 1096)
    rpi33.lan.46656 > rpi39.lan.50408: Flags [P.], cksum 0xadc0 (correct), seq 1:1045, ack 1044, win 1332, options [nop,nop,TS val 279718968 ecr 279718968], length 1044
1527830707.273963 IP (tos 0x0, ttl 64, id 23508, offset 0, flags [DF], proto TCP (6), length 52)
    rpi36.lan.52404 > rpi33.lan.46656: Flags [.], cksum 0x1a5c (correct), ack 1044, win 1323, options [nop,nop,TS val 279718968 ecr 279718968], length 0
1527830707.273965 IP (tos 0x0, ttl 64, id 20023, offset 0, flags [DF], proto TCP (6), length 52)
    rpi35.lan.36908 > rpi33.lan.46656: Flags [.], cksum 0x0b60 (correct), ack 1045, win 1323, options [nop,nop,TS val 279717490 ecr 279718968], length 0
1527830707.274116 IP (tos 0x0, ttl 64, id 14639, offset 0, flags [DF], proto TCP (6), length 52)
    rpi38.lan.46656 > rpi33.lan.55368: Flags [.], cksum 0x2fe4 (correct), ack 1045, win 1331, options [nop,nop,TS val 279717501 ecr 279718968], length 0
1527830707.274528 IP (tos 0x0, ttl 64, id 3404, offset 0, flags [DF], proto TCP (6), length 52)
    rpi41.lan.48084 > rpi33.lan.46656: Flags [.], cksum 0xea43 (correct), ack 1045, win 1323, options [nop,nop,TS val 1582060284 ecr 279718968], length 0
1527830707.274530 IP (tos 0x0, ttl 64, id 27279, offset 0, flags [DF], proto TCP (6), length 52)
    rpi40.lan.35100 > rpi33.lan.46656: Flags [.], cksum 0x0d78 (correct), ack 1045, win 1323, options [nop,nop,TS val 279716793 ecr 279718968], length 0
1527830707.274785 IP (tos 0x0, ttl 64, id 33683, offset 0, flags [DF], proto TCP (6), length 52)
    rpi39.lan.50408 > rpi33.lan.46656: Flags [.], cksum 0x570e (correct), ack 1045, win 1323, options [nop,nop,TS val 279718968 ecr 279718968], length 0
1527830707.279806 IP (tos 0x0, ttl 64, id 23509, offset 0, flags [DF], proto TCP (6), length 1096)
    rpi36.lan.52404 > rpi33.lan.46656: Flags [P.], cksum 0xec17 (correct), seq 1:1045, ack 1044, win 1324, options [nop,nop,TS val 279718968 ecr 279718968], length 1044
1527830707.279868 IP (tos 0x0, ttl 64, id 4203, offset 0, flags [DF], proto TCP (6), length 52)
    rpi33.lan.46656 > rpi36.lan.52404: Flags [.], cksum 0x8484 (incorrect -> 0x163f), ack 1045, win 1331, options [nop,nop,TS val 279718969 ecr 279718968], length 0
1527830707.286850 IP (tos 0x0, ttl 64, id 21788, offset 0, flags [DF], proto TCP (6), length 1096)
    rpi37.lan.46656 > rpi33.lan.55238: Flags [P.], cksum 0xd11b (correct), seq 1:1045, ack 1044, win 1332, options [nop,nop,TS val 279718953 ecr 279718968], length 1044
1527830707.286958 IP (tos 0x0, ttl 64, id 59306, offset 0, flags [DF], proto TCP (6), length 52)
    rpi33.lan.55238 > rpi37.lan.46656: Flags [.], cksum 0x8485 (incorrect -> 0xd5b7), ack 1045, win 1323, options [nop,nop,TS val 279718970 ecr 279718953], length 0
1527830707.295822 IP (tos 0x0, ttl 64, id 12394, offset 0, flags [DF], proto TCP (6), length 1096)
    rpi42.lan.49208 > rpi33.lan.46656: Flags [P.], cksum 0xa034 (correct), seq 1:1045, ack 1044, win 1324, options [nop,nop,TS val 279718950 ecr 279718968], length 1044
1527830707.295923 IP (tos 0x0, ttl 64, id 40623, offset 0, flags [DF], proto TCP (6), length 52)
    rpi33.lan.46656 > rpi42.lan.49208: Flags [.], cksum 0x848a (incorrect -> 0x1849), ack 1045, win 1331, options [nop,nop,TS val 279718971 ecr 279718950], length 0
1527830707.326163 IP (tos 0x0, ttl 64, id 20031, offset 0, flags [DF], proto TCP (6), length 1096)
    rpi34.lan.46656 > rpi33.lan.51354: Flags [P.], cksum 0xba48 (correct), seq 1:1045, ack 1044, win 1332, options [nop,nop,TS val 279718982 ecr 279718968], length 1044
1527830707.326245 IP (tos 0x0, ttl 64, id 13074, offset 0, flags [DF], proto TCP (6), length 52)
    rpi33.lan.51354 > rpi34.lan.46656: Flags [.], cksum 0x8482 (incorrect -> 0x7a32), ack 1045, win 1323, options [nop,nop,TS val 279718974 ecr 279718982], length 0
1527830707.989978 IP (tos 0x0, ttl 64, id 4204, offset 0, flags [DF], proto TCP (6), length 1096)
    rpi33.lan.46656 > rpi36.lan.52404: Flags [P.], cksum 0x082b (correct), seq 1044:2088, ack 1045, win 1332, options [nop,nop,TS val 279719040 ecr 279718968], length 1044
1527830707.991566 IP (tos 0x0, ttl 64, id 23510, offset 0, flags [DF], proto TCP (6), length 1096)
    rpi36.lan.52404 > rpi33.lan.46656: Flags [P.], cksum 0xc530 (correct), seq 1045:2089, ack 2088, win 1324, options [nop,nop,TS val 279719039 ecr 279719040], length 1044
1527830707.991673 IP (tos 0x0, ttl 64, id 4205, offset 0, flags [DF], proto TCP (6), length 52)
    rpi33.lan.46656 > rpi36.lan.52404: Flags [.], cksum 0x8484 (incorrect -> 0x0d89), ack 2089, win 1331, options [nop,nop,TS val 279719040 ecr 279719039], length 0
1527830707.991784 IP (tos 0x0, ttl 64, id 23511, offset 0, flags [DF], proto TCP (6), length 1096)
    rpi36.lan.52404 > rpi33.lan.46656: Flags [P.], cksum 0x52cc (correct), seq 2089:3133, ack 2088, win 1324, options [nop,nop,TS val 279719039 ecr 279719040], length 1044
1527830707.991834 IP (tos 0x0, ttl 64, id 4206, offset 0, flags [DF], proto TCP (6), length 52)
    rpi33.lan.46656 > rpi36.lan.52404: Flags [.], cksum 0x8484 (incorrect -> 0x0975), ack 3133, win 1331, options [nop,nop,TS val 279719040 ecr 279719039], length 0
1527830707.992330 IP (tos 0x0, ttl 64, id 4207, offset 0, flags [DF], proto TCP (6), length 1096)
    rpi33.lan.46656 > rpi36.lan.52404: Flags [P.], cksum 0x2d48 (correct), seq 2088:3132, ack 3133, win 1332, options [nop,nop,TS val 279719040 ecr 279719039], length 1044
1527830708.042519 IP (tos 0x0, ttl 64, id 23512, offset 0, flags [DF], proto TCP (6), length 52)
    rpi36.lan.52404 > rpi33.lan.46656: Flags [.], cksum 0x0562 (correct), ack 3132, win 1324, options [nop,nop,TS val 279719045 ecr 279719040], length 0
1527830709.250048 IP (tos 0x0, ttl 64, id 3405, offset 0, flags [DF], proto TCP (6), length 1096)
    rpi41.lan.48084 > rpi33.lan.46656: Flags [P.], cksum 0x845c (correct), seq 1044:2088, ack 1045, win 1324, options [nop,nop,TS val 1582062260 ecr 279718968], length 1044
1527830709.257318 IP (tos 0x0, ttl 64, id 20024, offset 0, flags [DF], proto TCP (6), length 1096)
    rpi35.lan.36908 > rpi33.lan.46656: Flags [P.], cksum 0xbd04 (correct), seq 1044:2088, ack 1045, win 1324, options [nop,nop,TS val 279717688 ecr 279718968], length 1044
1527830709.264129 IP (tos 0x0, ttl 64, id 27280, offset 0, flags [DF], proto TCP (6), length 1096)
    rpi40.lan.35100 > rpi33.lan.46656: Flags [P.], cksum 0xce59 (correct), seq 1044:2088, ack 1045, win 1324, options [nop,nop,TS val 279716992 ecr 279718968], length 1044
1527830709.273816 IP (tos 0x0, ttl 64, id 14640, offset 0, flags [DF], proto TCP (6), length 1096)
    rpi38.lan.46656 > rpi33.lan.55368: Flags [P.], cksum 0xd12d (correct), seq 1044:2088, ack 1045, win 1332, options [nop,nop,TS val 279717701 ecr 279718968], length 1044
1527830709.275465 IP (tos 0x0, ttl 64, id 33684, offset 0, flags [DF], proto TCP (6), length 1096)
    rpi39.lan.50408 > rpi33.lan.46656: Flags [P.], cksum 0x2373 (correct), seq 1044:2088, ack 1045, win 1324, options [nop,nop,TS val 279719168 ecr 279718968], length 1044
1527830709.276564 IP (tos 0x0, ttl 64, id 13075, offset 0, flags [DF], proto TCP (6), length 1096)
    rpi33.lan.51354 > rpi34.lan.46656: Flags [P.], cksum 0x8896 (incorrect -> 0x2e29), seq 1044:2088, ack 1045, win 1324, options [nop,nop,TS val 279719169 ecr 279718982], length 1044
1527830709.277035 IP (tos 0x0, ttl 64, id 52178, offset 0, flags [DF], proto TCP (6), length 1096)
    rpi33.lan.46656 > rpi35.lan.36908: Flags [P.], cksum 0xb233 (correct), seq 1045:2089, ack 2088, win 1332, options [nop,nop,TS val 279719169 ecr 279717688], length 1044
1527830709.277068 IP (tos 0x0, ttl 64, id 59307, offset 0, flags [DF], proto TCP (6), length 1096)
    rpi33.lan.55238 > rpi37.lan.46656: Flags [P.], cksum 0x8899 (incorrect -> 0xece1), seq 1044:2088, ack 1045, win 1324, options [nop,nop,TS val 279719169 ecr 279718953], length 1044
1527830709.277282 IP (tos 0x0, ttl 64, id 41645, offset 0, flags [DF], proto TCP (6), length 1096)
    rpi33.lan.46656 > rpi39.lan.50408: Flags [P.], cksum 0xb7af (correct), seq 1045:2089, ack 2088, win 1332, options [nop,nop,TS val 279719169 ecr 279719168], length 1044
1527830709.277308 IP (tos 0x0, ttl 64, id 31773, offset 0, flags [DF], proto TCP (6), length 1096)
    rpi33.lan.55368 > rpi38.lan.46656: Flags [P.], cksum 0x889a (incorrect -> 0xedc6), seq 1045:2089, ack 2088, win 1324, options [nop,nop,TS val 279719169 ecr 279717701], length 1044
1527830709.277368 IP (tos 0x0, ttl 64, id 20032, offset 0, flags [DF], proto TCP (6), length 52)
    rpi34.lan.46656 > rpi33.lan.51354: Flags [.], cksum 0x7490 (correct), ack 2088, win 1331, options [nop,nop,TS val 279719177 ecr 279719169], length 0
1527830709.277576 IP (tos 0x0, ttl 64, id 4208, offset 0, flags [DF], proto TCP (6), length 1096)
    rpi33.lan.46656 > rpi36.lan.52404: Flags [P.], cksum 0xdf71 (correct), seq 3132:4176, ack 3133, win 1332, options [nop,nop,TS val 279719169 ecr 279719045], length 1044
1527830709.277648 IP (tos 0x0, ttl 64, id 40624, offset 0, flags [DF], proto TCP (6), length 1096)
    rpi33.lan.46656 > rpi42.lan.49208: Flags [P.], cksum 0x7147 (correct), seq 1044:2088, ack 1045, win 1332, options [nop,nop,TS val 279719169 ecr 279718950], length 1044
1527830709.277815 IP (tos 0x0, ttl 64, id 20025, offset 0, flags [DF], proto TCP (6), length 52)
    rpi35.lan.36908 > rpi33.lan.46656: Flags [.], cksum 0x01a7 (correct), ack 2089, win 1323, options [nop,nop,TS val 279717690 ecr 279719169], length 0
1527830709.277826 IP (tos 0x0, ttl 64, id 39032, offset 0, flags [DF], proto TCP (6), length 1096)
    rpi33.lan.46656 > rpi40.lan.35100: Flags [P.], cksum 0xbabf (correct), seq 1045:2089, ack 2088, win 1332, options [nop,nop,TS val 279719169 ecr 279716992], length 1044
1527830709.277863 IP (tos 0x0, ttl 64, id 40019, offset 0, flags [DF], proto TCP (6), length 1096)
    rpi33.lan.46656 > rpi41.lan.48084: Flags [P.], cksum 0x9376 (correct), seq 1045:2089, ack 2088, win 1332, options [nop,nop,TS val 279719169 ecr 1582062260], length 1044
1527830709.278025 IP (tos 0x0, ttl 64, id 33685, offset 0, flags [DF], proto TCP (6), length 52)
    rpi39.lan.50408 > rpi33.lan.46656: Flags [.], cksum 0x4d55 (correct), ack 2089, win 1323, options [nop,nop,TS val 279719168 ecr 279719169], length 0
1527830709.278026 IP (tos 0x0, ttl 64, id 14641, offset 0, flags [DF], proto TCP (6), length 52)
    rpi38.lan.46656 > rpi33.lan.55368: Flags [.], cksum 0x262b (correct), ack 2089, win 1331, options [nop,nop,TS val 279717701 ecr 279719169], length 0
1527830709.278340 IP (tos 0x0, ttl 64, id 23513, offset 0, flags [DF], proto TCP (6), length 52)
    rpi36.lan.52404 > rpi33.lan.46656: Flags [.], cksum 0x0053 (correct), ack 4176, win 1323, options [nop,nop,TS val 279719168 ecr 279719169], length 0
1527830709.278582 IP (tos 0x0, ttl 64, id 27281, offset 0, flags [DF], proto TCP (6), length 52)
    rpi40.lan.35100 > rpi33.lan.46656: Flags [.], cksum 0x03bf (correct), ack 2089, win 1323, options [nop,nop,TS val 279716993 ecr 279719169], length 0
1527830709.278584 IP (tos 0x0, ttl 64, id 3406, offset 0, flags [DF], proto TCP (6), length 52)
    rpi41.lan.48084 > rpi33.lan.46656: Flags [.], cksum 0xd97e (correct), ack 2089, win 1323, options [nop,nop,TS val 1582062288 ecr 279719169], length 0
1527830709.283569 IP (tos 0x0, ttl 64, id 23514, offset 0, flags [DF], proto TCP (6), length 1096)
    rpi36.lan.52404 > rpi33.lan.46656: Flags [P.], cksum 0xfb16 (correct), seq 3133:4177, ack 4176, win 1324, options [nop,nop,TS val 279719169 ecr 279719169], length 1044
1527830709.290828 IP (tos 0x0, ttl 64, id 21789, offset 0, flags [DF], proto TCP (6), length 1096)
    rpi37.lan.46656 > rpi33.lan.55238: Flags [P.], cksum 0xcdda (correct), seq 1045:2089, ack 2088, win 1332, options [nop,nop,TS val 279719154 ecr 279719169], length 1044
1527830709.290914 IP (tos 0x0, ttl 64, id 59308, offset 0, flags [DF], proto TCP (6), length 52)
    rpi33.lan.55238 > rpi37.lan.46656: Flags [.], cksum 0x8485 (incorrect -> 0xcbfe), ack 2089, win 1323, options [nop,nop,TS val 279719170 ecr 279719154], length 0
1527830709.299449 IP (tos 0x0, ttl 64, id 12395, offset 0, flags [DF], proto TCP (6), length 1096)
    rpi42.lan.49208 > rpi33.lan.46656: Flags [P.], cksum 0xfcbd (correct), seq 1045:2089, ack 2088, win 1324, options [nop,nop,TS val 279719151 ecr 279719169], length 1044
1527830709.299545 IP (tos 0x0, ttl 64, id 40625, offset 0, flags [DF], proto TCP (6), length 52)
    rpi33.lan.46656 > rpi42.lan.49208: Flags [.], cksum 0x848a (incorrect -> 0x0e90), ack 2089, win 1331, options [nop,nop,TS val 279719171 ecr 279719151], length 0
1527830709.324492 IP (tos 0x0, ttl 64, id 4209, offset 0, flags [DF], proto TCP (6), length 52)
    rpi33.lan.46656 > rpi36.lan.52404: Flags [.], cksum 0x8484 (incorrect -> 0xfc2f), ack 4177, win 1332, options [nop,nop,TS val 279719174 ecr 279719169], length 0
1527830709.328544 IP (tos 0x0, ttl 64, id 20033, offset 0, flags [DF], proto TCP (6), length 1096)
    rpi34.lan.46656 > rpi33.lan.51354: Flags [P.], cksum 0x1229 (correct), seq 1045:2089, ack 2088, win 1332, options [nop,nop,TS val 279719182 ecr 279719169], length 1044
1527830709.328616 IP (tos 0x0, ttl 64, id 13076, offset 0, flags [DF], proto TCP (6), length 52)
    rpi33.lan.51354 > rpi34.lan.46656: Flags [.], cksum 0x8482 (incorrect -> 0x707a), ack 2089, win 1323, options [nop,nop,TS val 279719174 ecr 279719182], length 0
1527830711.253404 IP (tos 0x0, ttl 64, id 3407, offset 0, flags [DF], proto TCP (6), length 1096)
    rpi41.lan.48084 > rpi33.lan.46656: Flags [P.], cksum 0xdcb2 (correct), seq 2088:3132, ack 2089, win 1324, options [nop,nop,TS val 1582064263 ecr 279719169], length 1044
1527830711.260864 IP (tos 0x0, ttl 64, id 20026, offset 0, flags [DF], proto TCP (6), length 1096)
    rpi35.lan.36908 > rpi33.lan.46656: Flags [P.], cksum 0x7192 (correct), seq 2088:3132, ack 2089, win 1324, options [nop,nop,TS val 279717888 ecr 279719169], length 1044
1527830711.266932 IP (tos 0x0, ttl 64, id 27282, offset 0, flags [DF], proto TCP (6), length 1096)
    rpi40.lan.35100 > rpi33.lan.46656: Flags [P.], cksum 0xea48 (correct), seq 2088:3132, ack 2089, win 1324, options [nop,nop,TS val 279717192 ecr 279719169], length 1044
1527830711.277307 IP (tos 0x0, ttl 64, id 14642, offset 0, flags [DF], proto TCP (6), length 1096)
    rpi38.lan.46656 > rpi33.lan.55368: Flags [P.], cksum 0x5fa5 (correct), seq 2088:3132, ack 2089, win 1332, options [nop,nop,TS val 279717901 ecr 279719169], length 1044
1527830711.278908 IP (tos 0x0, ttl 64, id 33686, offset 0, flags [DF], proto TCP (6), length 1096)
    rpi39.lan.50408 > rpi33.lan.46656: Flags [P.], cksum 0x8faa (correct), seq 2088:3132, ack 2089, win 1324, options [nop,nop,TS val 279719368 ecr 279719169], length 1044
1527830711.280274 IP (tos 0x0, ttl 64, id 13077, offset 0, flags [DF], proto TCP (6), length 1096)
    rpi33.lan.51354 > rpi34.lan.46656: Flags [P.], cksum 0x8896 (incorrect -> 0xdaae), seq 2088:3132, ack 2089, win 1324, options [nop,nop,TS val 279719369 ecr 279719182], length 1044
1527830711.280323 IP (tos 0x0, ttl 64, id 52179, offset 0, flags [DF], proto TCP (6), length 1096)
    rpi33.lan.46656 > rpi35.lan.36908: Flags [P.], cksum 0x3aeb (correct), seq 2089:3133, ack 3132, win 1332, options [nop,nop,TS val 279719369 ecr 279717888], length 1044
1527830711.280351 IP (tos 0x0, ttl 64, id 39033, offset 0, flags [DF], proto TCP (6), length 1096)
    rpi33.lan.46656 > rpi40.lan.35100: Flags [P.], cksum 0x9dee (correct), seq 2089:3133, ack 3132, win 1332, options [nop,nop,TS val 279719369 ecr 279717192], length 1044
1527830711.280763 IP (tos 0x0, ttl 64, id 40020, offset 0, flags [DF], proto TCP (6), length 1096)
    rpi33.lan.46656 > rpi41.lan.48084: Flags [P.], cksum 0x6923 (correct), seq 2089:3133, ack 3132, win 1332, options [nop,nop,TS val 279719369 ecr 1582064263], length 1044
1527830711.280794 IP (tos 0x0, ttl 64, id 41646, offset 0, flags [DF], proto TCP (6), length 1096)
    rpi33.lan.46656 > rpi39.lan.50408: Flags [P.], cksum 0xae26 (correct), seq 2089:3133, ack 3132, win 1332, options [nop,nop,TS val 279719369 ecr 279719368], length 1044
1527830711.280811 IP (tos 0x0, ttl 64, id 59309, offset 0, flags [DF], proto TCP (6), length 1096)
    rpi33.lan.55238 > rpi37.lan.46656: Flags [P.], cksum 0x8899 (incorrect -> 0xc424), seq 2088:3132, ack 2089, win 1324, options [nop,nop,TS val 279719369 ecr 279719154], length 1044
1527830711.280841 IP (tos 0x0, ttl 64, id 4210, offset 0, flags [DF], proto TCP (6), length 1096)
    rpi33.lan.46656 > rpi36.lan.52404: Flags [P.], cksum 0x104e (correct), seq 4176:5220, ack 4177, win 1332, options [nop,nop,TS val 279719369 ecr 279719169], length 1044
1527830711.280974 IP (tos 0x0, ttl 64, id 31774, offset 0, flags [DF], proto TCP (6), length 1096)
    rpi33.lan.55368 > rpi38.lan.46656: Flags [P.], cksum 0x889a (incorrect -> 0x8dc3), seq 2089:3133, ack 3132, win 1324, options [nop,nop,TS val 279719369 ecr 279717901], length 1044
1527830711.281003 IP (tos 0x0, ttl 64, id 40626, offset 0, flags [DF], proto TCP (6), length 1096)
    rpi33.lan.46656 > rpi42.lan.49208: Flags [P.], cksum 0xf375 (correct), seq 2088:3132, ack 2089, win 1332, options [nop,nop,TS val 279719369 ecr 279719151], length 1044
1527830711.281093 IP (tos 0x0, ttl 64, id 20034, offset 0, flags [DF], proto TCP (6), length 52)
    rpi34.lan.46656 > rpi33.lan.51354: Flags [.], cksum 0x6ad7 (correct), ack 3132, win 1331, options [nop,nop,TS val 279719378 ecr 279719369], length 0
1527830711.281095 IP (tos 0x0, ttl 64, id 20027, offset 0, flags [DF], proto TCP (6), length 52)
    rpi35.lan.36908 > rpi33.lan.46656: Flags [.], cksum 0xf7ee (correct), ack 3133, win 1323, options [nop,nop,TS val 279717890 ecr 279719369], length 0
1527830711.281282 IP (tos 0x0, ttl 64, id 27283, offset 0, flags [DF], proto TCP (6), length 52)
    rpi40.lan.35100 > rpi33.lan.46656: Flags [.], cksum 0xfa06 (correct), ack 3133, win 1323, options [nop,nop,TS val 279717193 ecr 279719369], length 0
1527830711.281506 IP (tos 0x0, ttl 64, id 3408, offset 0, flags [DF], proto TCP (6), length 52)
    rpi41.lan.48084 > rpi33.lan.46656: Flags [.], cksum 0xc8bb (correct), ack 3133, win 1323, options [nop,nop,TS val 1582064291 ecr 279719369], length 0
1527830711.281508 IP (tos 0x0, ttl 64, id 33687, offset 0, flags [DF], proto TCP (6), length 52)
    rpi39.lan.50408 > rpi33.lan.46656: Flags [.], cksum 0x439c (correct), ack 3133, win 1323, options [nop,nop,TS val 279719369 ecr 279719369], length 0
1527830711.281918 IP (tos 0x0, ttl 64, id 14643, offset 0, flags [DF], proto TCP (6), length 52)
    rpi38.lan.46656 > rpi33.lan.55368: Flags [.], cksum 0x1c72 (correct), ack 3133, win 1331, options [nop,nop,TS val 279717902 ecr 279719369], length 0
1527830711.286965 IP (tos 0x0, ttl 64, id 23515, offset 0, flags [DF], proto TCP (6), length 1096)
    rpi36.lan.52404 > rpi33.lan.46656: Flags [P.], cksum 0x4308 (correct), seq 4177:5221, ack 5220, win 1324, options [nop,nop,TS val 279719369 ecr 279719369], length 1044
1527830711.287033 IP (tos 0x0, ttl 64, id 4211, offset 0, flags [DF], proto TCP (6), length 52)
    rpi33.lan.46656 > rpi36.lan.52404: Flags [.], cksum 0x8484 (incorrect -> 0xf27c), ack 5221, win 1331, options [nop,nop,TS val 279719370 ecr 279719369], length 0
1527830711.293987 IP (tos 0x0, ttl 64, id 21790, offset 0, flags [DF], proto TCP (6), length 1096)
    rpi37.lan.46656 > rpi33.lan.55238: Flags [P.], cksum 0x2b27 (correct), seq 2089:3133, ack 3132, win 1332, options [nop,nop,TS val 279719354 ecr 279719369], length 1044
1527830711.294054 IP (tos 0x0, ttl 64, id 59310, offset 0, flags [DF], proto TCP (6), length 52)
    rpi33.lan.55238 > rpi37.lan.46656: Flags [.], cksum 0x8485 (incorrect -> 0xc246), ack 3133, win 1323, options [nop,nop,TS val 279719370 ecr 279719354], length 0
1527830711.303175 IP (tos 0x0, ttl 64, id 12396, offset 0, flags [DF], proto TCP (6), length 1096)
    rpi42.lan.49208 > rpi33.lan.46656: Flags [P.], cksum 0xddd3 (correct), seq 2089:3133, ack 3132, win 1324, options [nop,nop,TS val 279719351 ecr 279719369], length 1044
1527830711.303277 IP (tos 0x0, ttl 64, id 40627, offset 0, flags [DF], proto TCP (6), length 52)
    rpi33.lan.46656 > rpi42.lan.49208: Flags [.], cksum 0x848a (incorrect -> 0x04d8), ack 3133, win 1331, options [nop,nop,TS val 279719371 ecr 279719351], length 0
1527830711.332739 IP (tos 0x0, ttl 64, id 20035, offset 0, flags [DF], proto TCP (6), length 1096)
    rpi34.lan.46656 > rpi33.lan.51354: Flags [P.], cksum 0xfc1e (correct), seq 2089:3133, ack 3132, win 1332, options [nop,nop,TS val 279719383 ecr 279719369], length 1044
1527830711.332818 IP (tos 0x0, ttl 64, id 13078, offset 0, flags [DF], proto TCP (6), length 52)
    rpi33.lan.51354 > rpi34.lan.46656: Flags [.], cksum 0x8482 (incorrect -> 0x66c1), ack 3133, win 1323, options [nop,nop,TS val 279719374 ecr 279719383], length 0
1527830713.257290 IP (tos 0x0, ttl 64, id 3409, offset 0, flags [DF], proto TCP (6), length 1096)
    rpi41.lan.48084 > rpi33.lan.46656: Flags [P.], cksum 0x9a03 (correct), seq 3132:4176, ack 3133, win 1324, options [nop,nop,TS val 1582066267 ecr 279719369], length 1044
1527830713.264430 IP (tos 0x0, ttl 64, id 20028, offset 0, flags [DF], proto TCP (6), length 1096)
    rpi35.lan.36908 > rpi33.lan.46656: Flags [P.], cksum 0x3fa9 (correct), seq 3132:4176, ack 3133, win 1324, options [nop,nop,TS val 279718088 ecr 279719369], length 1044
1527830713.270648 IP (tos 0x0, ttl 64, id 27284, offset 0, flags [DF], proto TCP (6), length 1096)
    rpi40.lan.35100 > rpi33.lan.46656: Flags [P.], cksum 0x67c2 (correct), seq 3132:4176, ack 3133, win 1324, options [nop,nop,TS val 279717392 ecr 279719369], length 1044
1527830713.280714 IP (tos 0x0, ttl 64, id 14644, offset 0, flags [DF], proto TCP (6), length 1096)
    rpi38.lan.46656 > rpi33.lan.55368: Flags [P.], cksum 0x6172 (correct), seq 3132:4176, ack 3133, win 1332, options [nop,nop,TS val 279718101 ecr 279719369], length 1044
1527830713.283056 IP (tos 0x0, ttl 64, id 33688, offset 0, flags [DF], proto TCP (6), length 1096)
    rpi39.lan.50408 > rpi33.lan.46656: Flags [P.], cksum 0xe8b5 (correct), seq 3132:4176, ack 3133, win 1324, options [nop,nop,TS val 279719569 ecr 279719369], length 1044
1527830713.283365 IP (tos 0x0, ttl 64, id 52180, offset 0, flags [DF], proto TCP (6), length 1096)
    rpi33.lan.46656 > rpi35.lan.36908: Flags [P.], cksum 0xec22 (correct), seq 3133:4177, ack 4176, win 1332, options [nop,nop,TS val 279719569 ecr 279718088], length 1044
1527830713.283753 IP (tos 0x0, ttl 64, id 40628, offset 0, flags [DF], proto TCP (6), length 1096)
    rpi33.lan.46656 > rpi42.lan.49208: Flags [P.], cksum 0x9054 (correct), seq 3132:4176, ack 3133, win 1332, options [nop,nop,TS val 279719569 ecr 279719351], length 1044
1527830713.283788 IP (tos 0x0, ttl 64, id 41647, offset 0, flags [DF], proto TCP (6), length 1096)
    rpi33.lan.46656 > rpi39.lan.50408: Flags [P.], cksum 0xdd6c (correct), seq 3133:4177, ack 4176, win 1332, options [nop,nop,TS val 279719569 ecr 279719569], length 1044
1527830713.283937 IP (tos 0x0, ttl 64, id 40021, offset 0, flags [DF], proto TCP (6), length 1096)
    rpi33.lan.46656 > rpi41.lan.48084: Flags [P.], cksum 0x7125 (correct), seq 3133:4177, ack 4176, win 1332, options [nop,nop,TS val 279719569 ecr 1582066267], length 1044
1527830713.284010 IP (tos 0x0, ttl 64, id 39034, offset 0, flags [DF], proto TCP (6), length 1096)
    rpi33.lan.46656 > rpi40.lan.35100: Flags [P.], cksum 0x7d54 (correct), seq 3133:4177, ack 4176, win 1332, options [nop,nop,TS val 279719569 ecr 279717392], length 1044
1527830713.284040 IP (tos 0x0, ttl 64, id 59311, offset 0, flags [DF], proto TCP (6), length 1096)
    rpi33.lan.55238 > rpi37.lan.46656: Flags [P.], cksum 0x8899 (incorrect -> 0xf5a4), seq 3132:4176, ack 3133, win 1324, options [nop,nop,TS val 279719569 ecr 279719354], length 1044
1527830713.284150 IP (tos 0x0, ttl 64, id 31775, offset 0, flags [DF], proto TCP (6), length 1096)
    rpi33.lan.55368 > rpi38.lan.46656: Flags [P.], cksum 0x889a (incorrect -> 0x27ba), seq 3133:4177, ack 4176, win 1324, options [nop,nop,TS val 279719569 ecr 279718101], length 1044
1527830713.284197 IP (tos 0x0, ttl 64, id 20029, offset 0, flags [DF], proto TCP (6), length 52)
    rpi35.lan.36908 > rpi33.lan.46656: Flags [.], cksum 0xee35 (correct), ack 4177, win 1323, options [nop,nop,TS val 279718091 ecr 279719569], length 0
1527830713.284223 IP (tos 0x0, ttl 64, id 4212, offset 0, flags [DF], proto TCP (6), length 1096)
    rpi33.lan.46656 > rpi36.lan.52404: Flags [P.], cksum 0xafd5 (correct), seq 5220:6264, ack 5221, win 1332, options [nop,nop,TS val 279719569 ecr 279719369], length 1044
1527830713.284319 IP (tos 0x0, ttl 64, id 13079, offset 0, flags [DF], proto TCP (6), length 1096)
    rpi33.lan.51354 > rpi34.lan.46656: Flags [P.], cksum 0x8896 (incorrect -> 0xa9c2), seq 3132:4176, ack 3133, win 1324, options [nop,nop,TS val 279719569 ecr 279719383], length 1044
1527830713.284618 IP (tos 0x0, ttl 64, id 33689, offset 0, flags [DF], proto TCP (6), length 52)
    rpi39.lan.50408 > rpi33.lan.46656: Flags [.], cksum 0x39e4 (correct), ack 4177, win 1323, options [nop,nop,TS val 279719569 ecr 279719569], length 0
1527830713.284620 IP (tos 0x0, ttl 64, id 3410, offset 0, flags [DF], proto TCP (6), length 52)
    rpi41.lan.48084 > rpi33.lan.46656: Flags [.], cksum 0xb7f8 (correct), ack 4177, win 1323, options [nop,nop,TS val 1582066294 ecr 279719569], length 0
1527830713.284800 IP (tos 0x0, ttl 64, id 27285, offset 0, flags [DF], proto TCP (6), length 52)
    rpi40.lan.35100 > rpi33.lan.46656: Flags [.], cksum 0xf04d (correct), ack 4177, win 1323, options [nop,nop,TS val 279717394 ecr 279719569], length 0
1527830713.284978 IP (tos 0x0, ttl 64, id 14645, offset 0, flags [DF], proto TCP (6), length 52)
    rpi38.lan.46656 > rpi33.lan.55368: Flags [.], cksum 0x12ba (correct), ack 4177, win 1331, options [nop,nop,TS val 279718102 ecr 279719569], length 0
1527830713.285171 IP (tos 0x0, ttl 64, id 20036, offset 0, flags [DF], proto TCP (6), length 52)
    rpi34.lan.46656 > rpi33.lan.51354: Flags [.], cksum 0x611f (correct), ack 4176, win 1331, options [nop,nop,TS val 279719578 ecr 279719569], length 0
1527830713.290334 IP (tos 0x0, ttl 64, id 23516, offset 0, flags [DF], proto TCP (6), length 1096)
    rpi36.lan.52404 > rpi33.lan.46656: Flags [P.], cksum 0x7cb1 (correct), seq 5221:6265, ack 6264, win 1324, options [nop,nop,TS val 279719569 ecr 279719569], length 1044
1527830713.290404 IP (tos 0x0, ttl 64, id 4213, offset 0, flags [DF], proto TCP (6), length 52)
    rpi33.lan.46656 > rpi36.lan.52404: Flags [.], cksum 0x8484 (incorrect -> 0xe8c4), ack 6265, win 1331, options [nop,nop,TS val 279719570 ecr 279719569], length 0
1527830713.302941 IP (tos 0x0, ttl 64, id 21791, offset 0, flags [DF], proto TCP (6), length 1096)
    rpi37.lan.46656 > rpi33.lan.55238: Flags [P.], cksum 0x39de (correct), seq 3133:4177, ack 4176, win 1332, options [nop,nop,TS val 279719555 ecr 279719569], length 1044
1527830713.303017 IP (tos 0x0, ttl 64, id 59312, offset 0, flags [DF], proto TCP (6), length 52)
    rpi33.lan.55238 > rpi37.lan.46656: Flags [.], cksum 0x8485 (incorrect -> 0xb88c), ack 4177, win 1323, options [nop,nop,TS val 279719571 ecr 279719555], length 0
1527830713.307229 IP (tos 0x0, ttl 64, id 12397, offset 0, flags [DF], proto TCP (6), length 1096)
    rpi42.lan.49208 > rpi33.lan.46656: Flags [P.], cksum 0x3087 (correct), seq 3133:4177, ack 4176, win 1324, options [nop,nop,TS val 279719551 ecr 279719569], length 1044
1527830713.307332 IP (tos 0x0, ttl 64, id 40629, offset 0, flags [DF], proto TCP (6), length 52)
    rpi33.lan.46656 > rpi42.lan.49208: Flags [.], cksum 0x848a (incorrect -> 0xfb1e), ack 4177, win 1331, options [nop,nop,TS val 279719572 ecr 279719551], length 0
1527830713.336106 IP (tos 0x0, ttl 64, id 20037, offset 0, flags [DF], proto TCP (6), length 1096)
    rpi34.lan.46656 > rpi33.lan.51354: Flags [P.], cksum 0xa105 (correct), seq 3133:4177, ack 4176, win 1332, options [nop,nop,TS val 279719583 ecr 279719569], length 1044
1527830713.336191 IP (tos 0x0, ttl 64, id 13080, offset 0, flags [DF], proto TCP (6), length 52)
    rpi33.lan.51354 > rpi34.lan.46656: Flags [.], cksum 0x8482 (incorrect -> 0x5d08), ack 4177, win 1323, options [nop,nop,TS val 279719575 ecr 279719583], length 0
1527830713.367031 IP (tos 0x0, ttl 64, id 13081, offset 0, flags [DF], proto TCP (6), length 1096)
    rpi33.lan.51354 > rpi34.lan.46656: Flags [P.], cksum 0x8896 (incorrect -> 0x591b), seq 4176:5220, ack 4177, win 1324, options [nop,nop,TS val 279719578 ecr 279719583], length 1044
1527830713.367498 IP (tos 0x0, ttl 64, id 20038, offset 0, flags [DF], proto TCP (6), length 1096)
    rpi34.lan.46656 > rpi33.lan.51354: Flags [P.], cksum 0x7bf8 (correct), seq 4177:5221, ack 4176, win 1332, options [nop,nop,TS val 279719586 ecr 279719575], length 1044
1527830713.367832 IP (tos 0x0, ttl 64, id 20039, offset 0, flags [DF], proto TCP (6), length 52)
    rpi34.lan.46656 > rpi33.lan.51354: Flags [.], cksum 0x54d2 (correct), ack 5220, win 1331, options [nop,nop,TS val 279719586 ecr 279719578], length 0
1527830713.368025 IP (tos 0x0, ttl 64, id 13082, offset 0, flags [DF], proto TCP (6), length 1096)
    rpi33.lan.51354 > rpi34.lan.46656: Flags [P.], cksum 0x8896 (incorrect -> 0x82f2), seq 5220:6264, ack 5221, win 1324, options [nop,nop,TS val 279719578 ecr 279719586], length 1044
1527830713.368513 IP (tos 0x0, ttl 64, id 20040, offset 0, flags [DF], proto TCP (6), length 1096)
    rpi34.lan.46656 > rpi33.lan.51354: Flags [P.], cksum 0x7428 (correct), seq 5221:6265, ack 5220, win 1332, options [nop,nop,TS val 279719586 ecr 279719578], length 1044
1527830713.409522 IP (tos 0x0, ttl 64, id 20041, offset 0, flags [DF], proto TCP (6), length 52)
    rpi34.lan.46656 > rpi33.lan.51354: Flags [.], cksum 0x4ca4 (correct), ack 6264, win 1332, options [nop,nop,TS val 279719591 ecr 279719578], length 0
1527830713.414504 IP (tos 0x0, ttl 64, id 13083, offset 0, flags [DF], proto TCP (6), length 52)
    rpi33.lan.51354 > rpi34.lan.46656: Flags [.], cksum 0x8482 (incorrect -> 0x4cac), ack 6265, win 1324, options [nop,nop,TS val 279719583 ecr 279719586], length 0
1527830715.260646 IP (tos 0x0, ttl 64, id 3411, offset 0, flags [DF], proto TCP (6), length 1096)
    rpi41.lan.48084 > rpi33.lan.46656: Flags [P.], cksum 0x468d (correct), seq 4176:5220, ack 4177, win 1324, options [nop,nop,TS val 1582068270 ecr 279719569], length 1044
1527830715.268255 IP (tos 0x0, ttl 64, id 20030, offset 0, flags [DF], proto TCP (6), length 1096)
    rpi35.lan.36908 > rpi33.lan.46656: Flags [P.], cksum 0xafc7 (correct), seq 4176:5220, ack 4177, win 1324, options [nop,nop,TS val 279718289 ecr 279719569], length 1044
1527830715.274171 IP (tos 0x0, ttl 64, id 27286, offset 0, flags [DF], proto TCP (6), length 1096)
    rpi40.lan.35100 > rpi33.lan.46656: Flags [P.], cksum 0xd9f9 (correct), seq 4176:5220, ack 4177, win 1324, options [nop,nop,TS val 279717593 ecr 279719569], length 1044
1527830715.284277 IP (tos 0x0, ttl 64, id 14646, offset 0, flags [DF], proto TCP (6), length 1096)
    rpi38.lan.46656 > rpi33.lan.55368: Flags [P.], cksum 0x0297 (correct), seq 4176:5220, ack 4177, win 1332, options [nop,nop,TS val 279718302 ecr 279719569], length 1044
1527830715.284895 IP (tos 0x0, ttl 64, id 33690, offset 0, flags [DF], proto TCP (6), length 1096)
    rpi39.lan.50408 > rpi33.lan.46656: Flags [P.], cksum 0x74da (correct), seq 4176:5220, ack 4177, win 1324, options [nop,nop,TS val 279719769 ecr 279719569], length 1044
1527830715.287144 IP (tos 0x0, ttl 64, id 4214, offset 0, flags [DF], proto TCP (6), length 1096)
    rpi33.lan.46656 > rpi36.lan.52404: Flags [P.], cksum 0x2fa6 (correct), seq 6264:7308, ack 6265, win 1332, options [nop,nop,TS val 279719770 ecr 279719569], length 1044
1527830715.287206 IP (tos 0x0, ttl 64, id 13084, offset 0, flags [DF], proto TCP (6), length 1096)
    rpi33.lan.51354 > rpi34.lan.46656: Flags [P.], cksum 0x8896 (incorrect -> 0x391e), seq 6264:7308, ack 6265, win 1324, options [nop,nop,TS val 279719770 ecr 279719586], length 1044
1527830715.287225 IP (tos 0x0, ttl 64, id 59313, offset 0, flags [DF], proto TCP (6), length 1096)
    rpi33.lan.55238 > rpi37.lan.46656: Flags [P.], cksum 0x8899 (incorrect -> 0x398b), seq 4176:5220, ack 4177, win 1324, options [nop,nop,TS val 279719770 ecr 279719555], length 1044
1527830715.287242 IP (tos 0x0, ttl 64, id 52181, offset 0, flags [DF], proto TCP (6), length 1096)
    rpi33.lan.46656 > rpi35.lan.36908: Flags [P.], cksum 0x6421 (correct), seq 4177:5221, ack 5220, win 1332, options [nop,nop,TS val 279719770 ecr 279718289], length 1044
1527830715.287481 IP (tos 0x0, ttl 64, id 31776, offset 0, flags [DF], proto TCP (6), length 1096)
    rpi33.lan.55368 > rpi38.lan.46656: Flags [P.], cksum 0x889a (incorrect -> 0xc58a), seq 4177:5221, ack 5220, win 1324, options [nop,nop,TS val 279719770 ecr 279718302], length 1044
1527830715.287509 IP (tos 0x0, ttl 64, id 39035, offset 0, flags [DF], proto TCP (6), length 1096)
    rpi33.lan.46656 > rpi40.lan.35100: Flags [P.], cksum 0x73e6 (correct), seq 4177:5221, ack 5220, win 1332, options [nop,nop,TS val 279719770 ecr 279717593], length 1044
1527830715.287525 IP (tos 0x0, ttl 64, id 40630, offset 0, flags [DF], proto TCP (6), length 1096)
    rpi33.lan.46656 > rpi42.lan.49208: Flags [P.], cksum 0x8b41 (correct), seq 4176:5220, ack 4177, win 1332, options [nop,nop,TS val 279719770 ecr 279719551], length 1044
1527830715.287542 IP (tos 0x0, ttl 64, id 41648, offset 0, flags [DF], proto TCP (6), length 1096)
    rpi33.lan.46656 > rpi39.lan.50408: Flags [P.], cksum 0xad24 (correct), seq 4177:5221, ack 5220, win 1332, options [nop,nop,TS val 279719770 ecr 279719769], length 1044
1527830715.287807 IP (tos 0x0, ttl 64, id 40022, offset 0, flags [DF], proto TCP (6), length 1096)
    rpi33.lan.46656 > rpi41.lan.48084: Flags [P.], cksum 0x3e4d (correct), seq 4177:5221, ack 5220, win 1332, options [nop,nop,TS val 279719770 ecr 1582068270], length 1044
1527830715.288016 IP (tos 0x0, ttl 64, id 20042, offset 0, flags [DF], proto TCP (6), length 52)
    rpi34.lan.46656 > rpi33.lan.51354: Flags [.], cksum 0x4716 (correct), ack 7308, win 1331, options [nop,nop,TS val 279719778 ecr 279719770], length 0
1527830715.288228 IP (tos 0x0, ttl 64, id 20031, offset 0, flags [DF], proto TCP (6), length 52)
    rpi35.lan.36908 > rpi33.lan.46656: Flags [.], cksum 0xe47c (correct), ack 5221, win 1323, options [nop,nop,TS val 279718291 ecr 279719770], length 0
1527830715.288230 IP (tos 0x0, ttl 64, id 14647, offset 0, flags [DF], proto TCP (6), length 52)
    rpi38.lan.46656 > rpi33.lan.55368: Flags [.], cksum 0x0901 (correct), ack 5221, win 1331, options [nop,nop,TS val 279718302 ecr 279719770], length 0
1527830715.288390 IP (tos 0x0, ttl 64, id 27287, offset 0, flags [DF], proto TCP (6), length 52)
    rpi40.lan.35100 > rpi33.lan.46656: Flags [.], cksum 0xe694 (correct), ack 5221, win 1323, options [nop,nop,TS val 279717594 ecr 279719770], length 0
1527830715.288563 IP (tos 0x0, ttl 64, id 33691, offset 0, flags [DF], proto TCP (6), length 52)
    rpi39.lan.50408 > rpi33.lan.46656: Flags [.], cksum 0x302b (correct), ack 5221, win 1323, options [nop,nop,TS val 279719769 ecr 279719770], length 0
1527830715.288565 IP (tos 0x0, ttl 64, id 3412, offset 0, flags [DF], proto TCP (6), length 52)
    rpi41.lan.48084 > rpi33.lan.46656: Flags [.], cksum 0xa733 (correct), ack 5221, win 1323, options [nop,nop,TS val 1582068298 ecr 279719770], length 0
1527830715.293683 IP (tos 0x0, ttl 64, id 23517, offset 0, flags [DF], proto TCP (6), length 1096)
    rpi36.lan.52404 > rpi33.lan.46656: Flags [P.], cksum 0x71f1 (correct), seq 6265:7309, ack 7308, win 1324, options [nop,nop,TS val 279719770 ecr 279719770], length 1044
1527830715.293757 IP (tos 0x0, ttl 64, id 4215, offset 0, flags [DF], proto TCP (6), length 52)
