1527817474.909002 IP (tos 0x0, ttl 64, id 10350, offset 0, flags [DF], proto TCP (6), length 1096)
    rpi36.lan.46656 > rpi33.lan.57566: Flags [P.], cksum 0x6548 (correct), seq 238976161:238977205, ack 2003262715, win 1191, options [nop,nop,TS val 278395732 ecr 278395225], length 1044
1527817474.909118 IP (tos 0x0, ttl 64, id 13083, offset 0, flags [DF], proto TCP (6), length 52)
    rpi33.lan.57566 > rpi36.lan.46656: Flags [.], cksum 0x8484 (incorrect -> 0xdb06), ack 1044, win 1291, options [nop,nop,TS val 278395732 ecr 278395732], length 0
1527817474.909225 IP (tos 0x0, ttl 64, id 13084, offset 0, flags [DF], proto TCP (6), length 1096)
    rpi33.lan.57566 > rpi36.lan.46656: Flags [P.], cksum 0x8898 (incorrect -> 0xc7d1), seq 1:1045, ack 1044, win 1291, options [nop,nop,TS val 278395732 ecr 278395732], length 1044
1527817474.909954 IP (tos 0x0, ttl 64, id 10351, offset 0, flags [DF], proto TCP (6), length 52)
    rpi36.lan.46656 > rpi33.lan.57566: Flags [.], cksum 0xd75a (correct), ack 1045, win 1187, options [nop,nop,TS val 278395732 ecr 278395732], length 0
1527817475.993838 IP (tos 0x0, ttl 64, id 35583, offset 0, flags [DF], proto TCP (6), length 1096)
    rpi42.lan.46788 > rpi33.lan.46656: Flags [P.], cksum 0xed29 (correct), seq 2341143494:2341144538, ack 4124283049, win 1324, options [nop,nop,TS val 278395821 ecr 278395640], length 1044
1527817475.993947 IP (tos 0x0, ttl 64, id 62022, offset 0, flags [DF], proto TCP (6), length 52)
    rpi33.lan.46656 > rpi42.lan.46788: Flags [.], cksum 0x848a (incorrect -> 0x4da1), ack 1044, win 1331, options [nop,nop,TS val 278395840 ecr 278395821], length 0
1527817477.997543 IP (tos 0x0, ttl 64, id 35584, offset 0, flags [DF], proto TCP (6), length 1096)
    rpi42.lan.46788 > rpi33.lan.46656: Flags [P.], cksum 0x8b66 (correct), seq 1044:2088, ack 1, win 1324, options [nop,nop,TS val 278396021 ecr 278395840], length 1044
1527817477.997663 IP (tos 0x0, ttl 64, id 62023, offset 0, flags [DF], proto TCP (6), length 52)
    rpi33.lan.46656 > rpi42.lan.46788: Flags [.], cksum 0x848a (incorrect -> 0x47fc), ack 2088, win 1331, options [nop,nop,TS val 278396041 ecr 278396021], length 0
1527817479.993573 IP (tos 0x0, ttl 64, id 49384, offset 0, flags [DF], proto TCP (6), length 52)
    rpi33.lan.46656 > rpi39.lan.47132: Flags [R.], cksum 0x8487 (incorrect -> 0xa9f5), seq 4185955371, ack 3668987035, win 1332, options [nop,nop,TS val 278396240 ecr 278395225], length 0
1527817479.993828 IP (tos 0x0, ttl 64, id 24829, offset 0, flags [DF], proto TCP (6), length 52)
    rpi39.lan.47132 > rpi33.lan.46656: Flags [R.], cksum 0xa9fd (correct), seq 1, ack 0, win 1324, options [nop,nop,TS val 278396240 ecr 278395225], length 0
1527817479.996706 IP (tos 0x0, ttl 64, id 34908, offset 0, flags [DF], proto TCP (6), length 60)
    rpi39.lan.47498 > rpi33.lan.46656: Flags [S], cksum 0x8eed (correct), seq 3487528205, win 29200, options [mss 1460,sackOK,TS val 278396241 ecr 0,nop,wscale 7], length 0
1527817479.996896 IP (tos 0x0, ttl 64, id 0, offset 0, flags [DF], proto TCP (6), length 60)
    rpi33.lan.46656 > rpi39.lan.47498: Flags [S.], cksum 0x848f (incorrect -> 0x86ce), seq 955105831, ack 3487528206, win 28960, options [mss 1460,sackOK,TS val 278396241 ecr 278396241,nop,wscale 7], length 0
1527817479.997498 IP (tos 0x0, ttl 64, id 34909, offset 0, flags [DF], proto TCP (6), length 52)
    rpi39.lan.47498 > rpi33.lan.46656: Flags [.], cksum 0x25d6 (correct), ack 1, win 229, options [nop,nop,TS val 278396241 ecr 278396241], length 0
1527817480.000806 IP (tos 0x0, ttl 64, id 35585, offset 0, flags [DF], proto TCP (6), length 1096)
    rpi42.lan.46788 > rpi33.lan.46656: Flags [P.], cksum 0xa3e3 (correct), seq 2088:3132, ack 1, win 1324, options [nop,nop,TS val 278396221 ecr 278396041], length 1044
1527817480.000879 IP (tos 0x0, ttl 64, id 62024, offset 0, flags [DF], proto TCP (6), length 52)
    rpi33.lan.46656 > rpi42.lan.46788: Flags [.], cksum 0x848a (incorrect -> 0x4258), ack 3132, win 1331, options [nop,nop,TS val 278396241 ecr 278396221], length 0
1527817480.010218 IP (tos 0x0, ttl 64, id 16249, offset 0, flags [DF], proto TCP (6), length 86)
    rpi33.lan.46656 > rpi39.lan.47498: Flags [P.], cksum 0xd461 (correct), seq 1:35, ack 1, win 227, options [nop,nop,TS val 278396242 ecr 278396241], length 34
1527817480.010766 IP (tos 0x0, ttl 64, id 34910, offset 0, flags [DF], proto TCP (6), length 52)
    rpi39.lan.47498 > rpi33.lan.46656: Flags [.], cksum 0x25b2 (correct), ack 35, win 229, options [nop,nop,TS val 278396242 ecr 278396242], length 0
1527817480.011800 IP (tos 0x0, ttl 64, id 34911, offset 0, flags [DF], proto TCP (6), length 86)
    rpi39.lan.47498 > rpi33.lan.46656: Flags [P.], cksum 0x996c (correct), seq 1:35, ack 35, win 229, options [nop,nop,TS val 278396242 ecr 278396242], length 34
1527817480.011848 IP (tos 0x0, ttl 64, id 16250, offset 0, flags [DF], proto TCP (6), length 52)
    rpi33.lan.46656 > rpi39.lan.47498: Flags [.], cksum 0x8487 (incorrect -> 0x2592), ack 35, win 227, options [nop,nop,TS val 278396242 ecr 278396242], length 0
1527817480.025098 IP (tos 0x0, ttl 64, id 34912, offset 0, flags [DF], proto TCP (6), length 1096)
    rpi39.lan.47498 > rpi33.lan.46656: Flags [P.], cksum 0x417a (correct), seq 35:1079, ack 35, win 229, options [nop,nop,TS val 278396244 ecr 278396242], length 1044
1527817480.025224 IP (tos 0x0, ttl 64, id 16251, offset 0, flags [DF], proto TCP (6), length 1096)
    rpi33.lan.46656 > rpi39.lan.47498: Flags [P.], cksum 0xa030 (correct), seq 35:1079, ack 35, win 227, options [nop,nop,TS val 278396244 ecr 278396242], length 1044
1527817480.035279 IP (tos 0x0, ttl 64, id 16252, offset 0, flags [DF], proto TCP (6), length 1096)
    rpi33.lan.46656 > rpi39.lan.47498: Flags [P.], cksum 0x42c3 (correct), seq 1079:2123, ack 1079, win 243, options [nop,nop,TS val 278396245 ecr 278396244], length 1044
1527817480.036053 IP (tos 0x0, ttl 64, id 34913, offset 0, flags [DF], proto TCP (6), length 1096)
    rpi39.lan.47498 > rpi33.lan.46656: Flags [P.], cksum 0xe3a0 (correct), seq 1079:2123, ack 1079, win 245, options [nop,nop,TS val 278396245 ecr 278396244], length 1044
1527817480.084330 IP (tos 0x0, ttl 64, id 34914, offset 0, flags [DF], proto TCP (6), length 52)
    rpi39.lan.47498 > rpi33.lan.46656: Flags [.], cksum 0x1515 (correct), ack 2123, win 261, options [nop,nop,TS val 278396250 ecr 278396245], length 0
1527817480.084508 IP (tos 0x0, ttl 64, id 16253, offset 0, flags [DF], proto TCP (6), length 52)
    rpi33.lan.46656 > rpi39.lan.47498: Flags [.], cksum 0x8487 (incorrect -> 0x1517), ack 2123, win 259, options [nop,nop,TS val 278396250 ecr 278396245], length 0
1527817480.142222 IP (tos 0x0, ttl 64, id 16254, offset 0, flags [DF], proto TCP (6), length 1096)
    rpi33.lan.46656 > rpi39.lan.47498: Flags [P.], cksum 0x384a (correct), seq 2123:3167, ack 2123, win 259, options [nop,nop,TS val 278396255 ecr 278396245], length 1044
1527817480.143000 IP (tos 0x0, ttl 64, id 34915, offset 0, flags [DF], proto TCP (6), length 52)
    rpi39.lan.47498 > rpi33.lan.46656: Flags [.], cksum 0x10e1 (correct), ack 3167, win 278, options [nop,nop,TS val 278396255 ecr 278396255], length 0
1527817480.143445 IP (tos 0x0, ttl 64, id 34916, offset 0, flags [DF], proto TCP (6), length 1096)
    rpi39.lan.47498 > rpi33.lan.46656: Flags [P.], cksum 0xbbdc (correct), seq 2123:3167, ack 3167, win 278, options [nop,nop,TS val 278396255 ecr 278396255], length 1044
1527817480.184522 IP (tos 0x0, ttl 64, id 16255, offset 0, flags [DF], proto TCP (6), length 52)
    rpi33.lan.46656 > rpi39.lan.47498: Flags [.], cksum 0x8487 (incorrect -> 0x0cca), ack 3167, win 276, options [nop,nop,TS val 278396260 ecr 278396255], length 0
1527817481.232725 IP (tos 0x0, ttl 64, id 35298, offset 0, flags [DF], proto TCP (6), length 1096)
    rpi41.lan.45408 > rpi33.lan.46656: Flags [P.], cksum 0x0e58 (correct), seq 1834509430:1834510474, ack 3958833837, win 1183, options [nop,nop,TS val 1568834133 ecr 278395225], length 1044
1527817481.232877 IP (tos 0x0, ttl 64, id 45723, offset 0, flags [DF], proto TCP (6), length 52)
    rpi33.lan.46656 > rpi41.lan.45408: Flags [.], cksum 0x8489 (incorrect -> 0xd2f2), ack 1044, win 1283, options [nop,nop,TS val 278396364 ecr 1568834133], length 0
1527817482.004268 IP (tos 0x0, ttl 64, id 35586, offset 0, flags [DF], proto TCP (6), length 1096)
    rpi42.lan.46788 > rpi33.lan.46656: Flags [P.], cksum 0x5093 (correct), seq 3132:4176, ack 1, win 1324, options [nop,nop,TS val 278396422 ecr 278396241], length 1044
1527817482.004381 IP (tos 0x0, ttl 64, id 62025, offset 0, flags [DF], proto TCP (6), length 52)
    rpi33.lan.46656 > rpi42.lan.46788: Flags [.], cksum 0x848a (incorrect -> 0x3cb3), ack 4176, win 1331, options [nop,nop,TS val 278396441 ecr 278396422], length 0
1527817482.192171 IP (tos 0x0, ttl 64, id 45724, offset 0, flags [DF], proto TCP (6), length 1096)
    rpi33.lan.46656 > rpi41.lan.45408: Flags [P.], cksum 0xc255 (correct), seq 1:1045, ack 1044, win 1283, options [nop,nop,TS val 278396460 ecr 1568834133], length 1044
1527817482.193218 IP (tos 0x0, ttl 64, id 35299, offset 0, flags [DF], proto TCP (6), length 1096)
    rpi41.lan.45408 > rpi33.lan.46656: Flags [P.], cksum 0x2e1c (correct), seq 1044:2088, ack 1, win 1183, options [nop,nop,TS val 1568835093 ecr 278396364], length 1044
1527817482.193330 IP (tos 0x0, ttl 64, id 45725, offset 0, flags [DF], proto TCP (6), length 52)
    rpi33.lan.46656 > rpi41.lan.45408: Flags [.], cksum 0x8489 (incorrect -> 0xc6b2), ack 2088, win 1275, options [nop,nop,TS val 278396460 ecr 1568835093], length 0
1527817482.193220 IP (tos 0x0, ttl 64, id 35300, offset 0, flags [DF], proto TCP (6), length 52)
    rpi41.lan.45408 > rpi33.lan.46656: Flags [.], cksum 0xc712 (correct), ack 1045, win 1179, options [nop,nop,TS val 1568835093 ecr 278396460], length 0
1527817484.009354 IP (tos 0x0, ttl 64, id 35587, offset 0, flags [DF], proto TCP (6), length 1096)
    rpi42.lan.46788 > rpi33.lan.46656: Flags [P.], cksum 0x98b4 (correct), seq 4176:5220, ack 1, win 1324, options [nop,nop,TS val 278396622 ecr 278396441], length 1044
1527817484.009450 IP (tos 0x0, ttl 64, id 62026, offset 0, flags [DF], proto TCP (6), length 52)
    rpi33.lan.46656 > rpi42.lan.46788: Flags [.], cksum 0x848a (incorrect -> 0x370e), ack 5220, win 1331, options [nop,nop,TS val 278396642 ecr 278396622], length 0
1527817486.011878 IP (tos 0x0, ttl 64, id 35588, offset 0, flags [DF], proto TCP (6), length 1096)
    rpi42.lan.46788 > rpi33.lan.46656: Flags [P.], cksum 0xeac5 (correct), seq 5220:6264, ack 1, win 1324, options [nop,nop,TS val 278396822 ecr 278396642], length 1044
1527817486.011939 IP (tos 0x0, ttl 64, id 62027, offset 0, flags [DF], proto TCP (6), length 52)
    rpi33.lan.46656 > rpi42.lan.46788: Flags [.], cksum 0x848a (incorrect -> 0x316a), ack 6264, win 1331, options [nop,nop,TS val 278396842 ecr 278396822], length 0
1527817488.015579 IP (tos 0x0, ttl 64, id 35589, offset 0, flags [DF], proto TCP (6), length 1096)
    rpi42.lan.46788 > rpi33.lan.46656: Flags [P.], cksum 0x3cf6 (correct), seq 6264:7308, ack 1, win 1324, options [nop,nop,TS val 278397023 ecr 278396842], length 1044
1527817488.015668 IP (tos 0x0, ttl 64, id 62028, offset 0, flags [DF], proto TCP (6), length 52)
    rpi33.lan.46656 > rpi42.lan.46788: Flags [.], cksum 0x848a (incorrect -> 0x2bc4), ack 7308, win 1331, options [nop,nop,TS val 278397043 ecr 278397023], length 0
1527817496.854927 IP (tos 0x0, ttl 64, id 62029, offset 0, flags [DF], proto TCP (6), length 1096)
    rpi33.lan.46656 > rpi42.lan.46788: Flags [P.], cksum 0xa8b8 (correct), seq 1:1045, ack 7308, win 1332, options [nop,nop,TS val 278397927 ecr 278397023], length 1044
1527817496.854992 IP (tos 0x0, ttl 64, id 45726, offset 0, flags [DF], proto TCP (6), length 1096)
    rpi33.lan.46656 > rpi41.lan.45408: Flags [P.], cksum 0x7c17 (correct), seq 1045:2089, ack 2088, win 1275, options [nop,nop,TS val 278397927 ecr 1568835093], length 1044
1527817496.855037 IP (tos 0x0, ttl 64, id 13085, offset 0, flags [DF], proto TCP (6), length 1096)
    rpi33.lan.57566 > rpi36.lan.46656: Flags [P.], cksum 0x8898 (incorrect -> 0x51f4), seq 1045:2089, ack 1044, win 1291, options [nop,nop,TS val 278397927 ecr 278395732], length 1044
1527817496.855196 IP (tos 0x0, ttl 64, id 42758, offset 0, flags [DF], proto TCP (6), length 1096)
    rpi33.lan.37298 > rpi37.lan.46656: Flags [P.], cksum 0x8899 (incorrect -> 0x350b), seq 209589965:209591009, ack 1233926770, win 1323, options [nop,nop,TS val 278397927 ecr 278395214], length 1044
1527817496.855344 IP (tos 0x0, ttl 64, id 62454, offset 0, flags [DF], proto TCP (6), length 1096)
    rpi33.lan.37416 > rpi38.lan.46656: Flags [P.], cksum 0x889a (incorrect -> 0x09fb), seq 303698086:303699130, ack 1431598076, win 1323, options [nop,nop,TS val 278397927 ecr 278394064], length 1044
1527817496.855753 IP (tos 0x0, ttl 64, id 15936, offset 0, flags [DF], proto TCP (6), length 1096)
    rpi33.lan.51742 > rpi35.lan.46656: Flags [P.], cksum 0x8897 (incorrect -> 0x3a92), seq 1570311787:1570312831, ack 1213951438, win 1323, options [nop,nop,TS val 278397927 ecr 278393752], length 1044
1527817496.855820 IP (tos 0x0, ttl 64, id 33280, offset 0, flags [DF], proto TCP (6), length 1096)
    rpi33.lan.40078 > rpi40.lan.46656: Flags [P.], cksum 0x889c (incorrect -> 0xc8a2), seq 1727650804:1727651848, ack 2658082302, win 1311, options [nop,nop,TS val 278397927 ecr 278393050], length 1044
1527817496.855864 IP (tos 0x0, ttl 64, id 35590, offset 0, flags [DF], proto TCP (6), length 52)
    rpi42.lan.46788 > rpi33.lan.46656: Flags [.], cksum 0x20d0 (correct), ack 1045, win 1323, options [nop,nop,TS val 278397907 ecr 278397927], length 0
1527817496.855868 IP (tos 0x0, ttl 64, id 35301, offset 0, flags [DF], proto TCP (6), length 52)
    rpi41.lan.45408 > rpi33.lan.46656: Flags [.], cksum 0x8404 (correct), ack 2089, win 1171, options [nop,nop,TS val 1568849756 ecr 278397927], length 0
1527817496.856040 IP (tos 0x0, ttl 64, id 10352, offset 0, flags [DF], proto TCP (6), length 52)
    rpi36.lan.46656 > rpi33.lan.57566: Flags [.], cksum 0xc229 (correct), ack 2089, win 1179, options [nop,nop,TS val 278397926 ecr 278397927], length 0
1527817496.856042 IP (tos 0x0, ttl 64, id 59888, offset 0, flags [DF], proto TCP (6), length 52)
    rpi37.lan.46656 > rpi33.lan.37298: Flags [.], cksum 0xd188 (correct), ack 1044, win 1175, options [nop,nop,TS val 278397911 ecr 278397927], length 0
1527817496.856164 IP (tos 0x0, ttl 64, id 53450, offset 0, flags [DF], proto TCP (6), length 52)
    rpi38.lan.46656 > rpi33.lan.37416: Flags [.], cksum 0x9202 (correct), ack 1044, win 1163, options [nop,nop,TS val 278396459 ecr 278397927], length 0
1527817496.856605 IP (tos 0x0, ttl 64, id 39075, offset 0, flags [DF], proto TCP (6), length 52)
    rpi35.lan.46656 > rpi33.lan.51742: Flags [.], cksum 0x23ec (correct), ack 1044, win 1179, options [nop,nop,TS val 278396449 ecr 278397927], length 0
1527817496.856607 IP (tos 0x0, ttl 64, id 64041, offset 0, flags [DF], proto TCP (6), length 52)
    rpi40.lan.46656 > rpi33.lan.40078: Flags [.], cksum 0x7703 (correct), ack 1044, win 1179, options [nop,nop,TS val 278395751 ecr 278397927], length 0
1527817497.063087 IP (tos 0x0, ttl 64, id 42759, offset 0, flags [DF], proto TCP (6), length 1096)
    rpi33.lan.37298 > rpi37.lan.46656: Flags [P.], cksum 0x8899 (incorrect -> 0xecfe), seq 1044:2088, ack 1, win 1323, options [nop,nop,TS val 278397947 ecr 278397911], length 1044
1527817497.063454 IP (tos 0x0, ttl 64, id 13086, offset 0, flags [DF], proto TCP (6), length 1096)
    rpi33.lan.57566 > rpi36.lan.46656: Flags [P.], cksum 0x8898 (incorrect -> 0xd62d), seq 2089:3133, ack 1044, win 1291, options [nop,nop,TS val 278397947 ecr 278397926], length 1044
1527817497.063488 IP (tos 0x0, ttl 64, id 45727, offset 0, flags [DF], proto TCP (6), length 1096)
    rpi33.lan.46656 > rpi41.lan.45408: Flags [P.], cksum 0xdc48 (correct), seq 2089:3133, ack 2088, win 1275, options [nop,nop,TS val 278397947 ecr 1568849756], length 1044
1527817497.063880 IP (tos 0x0, ttl 64, id 59889, offset 0, flags [DF], proto TCP (6), length 52)
    rpi37.lan.46656 > rpi33.lan.37298: Flags [.], cksum 0xcd53 (correct), ack 2088, win 1167, options [nop,nop,TS val 278397932 ecr 278397947], length 0
1527817497.064017 IP (tos 0x0, ttl 64, id 33281, offset 0, flags [DF], proto TCP (6), length 1096)
    rpi33.lan.40078 > rpi40.lan.46656: Flags [P.], cksum 0x889c (incorrect -> 0x5d54), seq 1044:2088, ack 1, win 1311, options [nop,nop,TS val 278397947 ecr 278395751], length 1044
1527817497.064229 IP (tos 0x0, ttl 64, id 62030, offset 0, flags [DF], proto TCP (6), length 1096)
    rpi33.lan.46656 > rpi42.lan.46788: Flags [P.], cksum 0x2caa (correct), seq 1045:2089, ack 7308, win 1332, options [nop,nop,TS val 278397947 ecr 278397907], length 1044
1527817497.064233 IP (tos 0x0, ttl 64, id 10353, offset 0, flags [DF], proto TCP (6), length 52)
    rpi36.lan.46656 > rpi33.lan.57566: Flags [.], cksum 0xbdf0 (correct), ack 3133, win 1175, options [nop,nop,TS val 278397947 ecr 278397947], length 0
1527817497.064235 IP (tos 0x0, ttl 64, id 35302, offset 0, flags [DF], proto TCP (6), length 52)
    rpi41.lan.45408 > rpi33.lan.46656: Flags [.], cksum 0x7f0f (correct), ack 3133, win 1167, options [nop,nop,TS val 1568849965 ecr 278397947], length 0
1527817497.064434 IP (tos 0x0, ttl 64, id 62455, offset 0, flags [DF], proto TCP (6), length 1096)
    rpi33.lan.37416 > rpi38.lan.46656: Flags [P.], cksum 0x889a (incorrect -> 0x01b2), seq 1044:2088, ack 1, win 1323, options [nop,nop,TS val 278397947 ecr 278396459], length 1044
1527817497.064707 IP (tos 0x0, ttl 64, id 15937, offset 0, flags [DF], proto TCP (6), length 1096)
    rpi33.lan.51742 > rpi35.lan.46656: Flags [P.], cksum 0x8897 (incorrect -> 0x1a7a), seq 1044:2088, ack 1, win 1323, options [nop,nop,TS val 278397948 ecr 278396449], length 1044
1527817497.064821 IP (tos 0x0, ttl 64, id 64042, offset 0, flags [DF], proto TCP (6), length 52)
    rpi40.lan.46656 > rpi33.lan.40078: Flags [.], cksum 0x72ca (correct), ack 2088, win 1175, options [nop,nop,TS val 278395772 ecr 278397947], length 0
1527817497.065043 IP (tos 0x0, ttl 64, id 35591, offset 0, flags [DF], proto TCP (6), length 52)
    rpi42.lan.46788 > rpi33.lan.46656: Flags [.], cksum 0x1c93 (correct), ack 2089, win 1323, options [nop,nop,TS val 278397928 ecr 278397947], length 0
1527817497.065200 IP (tos 0x0, ttl 64, id 53451, offset 0, flags [DF], proto TCP (6), length 52)
    rpi38.lan.46656 > rpi33.lan.37416: Flags [.], cksum 0x8dcd (correct), ack 2088, win 1155, options [nop,nop,TS val 278396480 ecr 278397947], length 0
1527817497.065491 IP (tos 0x0, ttl 64, id 39076, offset 0, flags [DF], proto TCP (6), length 52)
    rpi35.lan.46656 > rpi33.lan.51742: Flags [.], cksum 0x1fb3 (correct), ack 2088, win 1175, options [nop,nop,TS val 278396469 ecr 278397948], length 0
1527817497.078254 IP (tos 0x0, ttl 64, id 42760, offset 0, flags [DF], proto TCP (6), length 52)
    rpi33.lan.37298 > rpi37.lan.46656: Flags [R.], cksum 0x8485 (incorrect -> 0xccb0), seq 2088, ack 1, win 1324, options [nop,nop,TS val 278397949 ecr 278397932], length 0
1527817497.078755 IP (tos 0x0, ttl 64, id 59890, offset 0, flags [DF], proto TCP (6), length 52)
    rpi37.lan.46656 > rpi33.lan.37298: Flags [R.], cksum 0xcca9 (correct), seq 1, ack 2088, win 1332, options [nop,nop,TS val 278397933 ecr 278397947], length 0
1527817497.080814 IP (tos 0x0, ttl 64, id 37682, offset 0, flags [DF], proto TCP (6), length 60)
    rpi33.lan.39328 > rpi37.lan.46656: Flags [S], cksum 0x848d (incorrect -> 0x98eb), seq 3277820111, win 29200, options [mss 1460,sackOK,TS val 278397949 ecr 0,nop,wscale 7], length 0
1527817497.081508 IP (tos 0x0, ttl 64, id 0, offset 0, flags [DF], proto TCP (6), length 60)
    rpi37.lan.46656 > rpi33.lan.39328: Flags [S.], cksum 0x2e89 (correct), seq 3903090198, ack 3277820112, win 28960, options [mss 1460,sackOK,TS val 278397934 ecr 278397949,nop,wscale 7], length 0
1527817497.081618 IP (tos 0x0, ttl 64, id 37683, offset 0, flags [DF], proto TCP (6), length 52)
    rpi33.lan.39328 > rpi37.lan.46656: Flags [.], cksum 0x8485 (incorrect -> 0xcd90), ack 1, win 229, options [nop,nop,TS val 278397949 ecr 278397934], length 0
1527817497.094347 IP (tos 0x0, ttl 64, id 37684, offset 0, flags [DF], proto TCP (6), length 86)
    rpi33.lan.39328 > rpi37.lan.46656: Flags [P.], cksum 0x84a7 (incorrect -> 0x3629), seq 1:35, ack 1, win 229, options [nop,nop,TS val 278397950 ecr 278397934], length 34
1527817497.094882 IP (tos 0x0, ttl 64, id 28153, offset 0, flags [DF], proto TCP (6), length 52)
    rpi37.lan.46656 > rpi33.lan.39328: Flags [.], cksum 0xcd6e (correct), ack 35, win 227, options [nop,nop,TS val 278397935 ecr 278397950], length 0
1527817497.253496 IP (tos 0x0, ttl 64, id 15938, offset 0, flags [DF], proto TCP (6), length 1096)
    rpi33.lan.51742 > rpi35.lan.46656: Flags [P.], cksum 0x8897 (incorrect -> 0x17b9), seq 2088:3132, ack 1, win 1323, options [nop,nop,TS val 278397966 ecr 278396469], length 1044
1527817497.253834 IP (tos 0x0, ttl 64, id 33282, offset 0, flags [DF], proto TCP (6), length 1096)
    rpi33.lan.40078 > rpi40.lan.46656: Flags [P.], cksum 0x889c (incorrect -> 0x3d1a), seq 2088:3132, ack 1, win 1311, options [nop,nop,TS val 278397966 ecr 278395772], length 1044
1527817497.253983 IP (tos 0x0, ttl 64, id 62031, offset 0, flags [DF], proto TCP (6), length 1096)
    rpi33.lan.46656 > rpi42.lan.46788: Flags [P.], cksum 0xae8e (correct), seq 2089:3133, ack 7308, win 1332, options [nop,nop,TS val 278397966 ecr 278397928], length 1044
1527817497.254012 IP (tos 0x0, ttl 64, id 13087, offset 0, flags [DF], proto TCP (6), length 1096)
    rpi33.lan.57566 > rpi36.lan.46656: Flags [P.], cksum 0x8898 (incorrect -> 0xd5c6), seq 3133:4177, ack 1044, win 1291, options [nop,nop,TS val 278397966 ecr 278397947], length 1044
1527817497.254079 IP (tos 0x0, ttl 64, id 45728, offset 0, flags [DF], proto TCP (6), length 1096)
    rpi33.lan.46656 > rpi41.lan.45408: Flags [P.], cksum 0x1ddd (correct), seq 3133:4177, ack 2088, win 1275, options [nop,nop,TS val 278397966 ecr 1568849965], length 1044
1527817497.254337 IP (tos 0x0, ttl 64, id 62456, offset 0, flags [DF], proto TCP (6), length 1096)
    rpi33.lan.37416 > rpi38.lan.46656: Flags [P.], cksum 0x889a (incorrect -> 0x95a3), seq 2088:3132, ack 1, win 1323, options [nop,nop,TS val 278397966 ecr 278396480], length 1044
1527817497.254331 IP (tos 0x0, ttl 64, id 39077, offset 0, flags [DF], proto TCP (6), length 52)
    rpi35.lan.46656 > rpi33.lan.51742: Flags [.], cksum 0x1b82 (correct), ack 3132, win 1167, options [nop,nop,TS val 278396488 ecr 278397966], length 0
1527817497.254612 IP (tos 0x0, ttl 64, id 64043, offset 0, flags [DF], proto TCP (6), length 52)
    rpi40.lan.46656 > rpi33.lan.40078: Flags [.], cksum 0x6e98 (correct), ack 3132, win 1167, options [nop,nop,TS val 278395791 ecr 278397966], length 0
1527817497.254793 IP (tos 0x0, ttl 64, id 35592, offset 0, flags [DF], proto TCP (6), length 52)
    rpi42.lan.46788 > rpi33.lan.46656: Flags [.], cksum 0x1859 (correct), ack 3133, win 1323, options [nop,nop,TS val 278397947 ecr 278397966], length 0
1527817497.254796 IP (tos 0x0, ttl 64, id 10354, offset 0, flags [DF], proto TCP (6), length 52)
    rpi36.lan.46656 > rpi33.lan.57566: Flags [.], cksum 0xb9be (correct), ack 4177, win 1167, options [nop,nop,TS val 278397966 ecr 278397966], length 0
1527817497.254797 IP (tos 0x0, ttl 64, id 35303, offset 0, flags [DF], proto TCP (6), length 52)
    rpi41.lan.45408 > rpi33.lan.46656: Flags [.], cksum 0x7a32 (correct), ack 4177, win 1159, options [nop,nop,TS val 1568850155 ecr 278397966], length 0
1527817497.255117 IP (tos 0x0, ttl 64, id 53452, offset 0, flags [DF], proto TCP (6), length 52)
    rpi38.lan.46656 > rpi33.lan.37416: Flags [.], cksum 0x8997 (correct), ack 3132, win 1151, options [nop,nop,TS val 278396499 ecr 278397966], length 0
1527817497.454754 IP (tos 0x0, ttl 64, id 62457, offset 0, flags [DF], proto TCP (6), length 1096)
    rpi33.lan.37416 > rpi38.lan.46656: Flags [P.], cksum 0x889a (incorrect -> 0x951a), seq 3132:4176, ack 1, win 1323, options [nop,nop,TS val 278397987 ecr 278396499], length 1044
1527817497.454807 IP (tos 0x0, ttl 64, id 13088, offset 0, flags [DF], proto TCP (6), length 1096)
    rpi33.lan.57566 > rpi36.lan.46656: Flags [P.], cksum 0x8898 (incorrect -> 0x17a1), seq 4177:5221, ack 1044, win 1291, options [nop,nop,TS val 278397987 ecr 278397966], length 1044
1527817497.454971 IP (tos 0x0, ttl 64, id 62032, offset 0, flags [DF], proto TCP (6), length 1096)
    rpi33.lan.46656 > rpi42.lan.46788: Flags [P.], cksum 0xcc4f (correct), seq 3133:4177, ack 7308, win 1332, options [nop,nop,TS val 278397987 ecr 278397947], length 1044
1527817497.455466 IP (tos 0x0, ttl 64, id 45729, offset 0, flags [DF], proto TCP (6), length 1096)
    rpi33.lan.46656 > rpi41.lan.45408: Flags [P.], cksum 0x4ef0 (correct), seq 4177:5221, ack 2088, win 1275, options [nop,nop,TS val 278397987 ecr 1568850155], length 1044
1527817497.455496 IP (tos 0x0, ttl 64, id 15939, offset 0, flags [DF], proto TCP (6), length 1096)
    rpi33.lan.51742 > rpi35.lan.46656: Flags [P.], cksum 0x8897 (incorrect -> 0xb444), seq 3132:4176, ack 1, win 1323, options [nop,nop,TS val 278397987 ecr 278396488], length 1044
1527817497.455644 IP (tos 0x0, ttl 64, id 53453, offset 0, flags [DF], proto TCP (6), length 52)
    rpi38.lan.46656 > rpi33.lan.37416: Flags [.], cksum 0x8562 (correct), ack 4176, win 1143, options [nop,nop,TS val 278396519 ecr 278397987], length 0
1527817497.455674 IP (tos 0x0, ttl 64, id 33283, offset 0, flags [DF], proto TCP (6), length 1096)
    rpi33.lan.40078 > rpi40.lan.46656: Flags [P.], cksum 0x889c (incorrect -> 0xefdb), seq 3132:4176, ack 1, win 1311, options [nop,nop,TS val 278397987 ecr 278395791], length 1044
1527817497.455647 IP (tos 0x0, ttl 64, id 10355, offset 0, flags [DF], proto TCP (6), length 52)
    rpi36.lan.46656 > rpi33.lan.57566: Flags [.], cksum 0xb585 (correct), ack 5221, win 1163, options [nop,nop,TS val 278397986 ecr 278397987], length 0
1527817497.455810 IP (tos 0x0, ttl 64, id 35593, offset 0, flags [DF], proto TCP (6), length 52)
    rpi42.lan.46788 > rpi33.lan.46656: Flags [.], cksum 0x1424 (correct), ack 4177, win 1315, options [nop,nop,TS val 278397967 ecr 278397987], length 0
1527817497.456193 IP (tos 0x0, ttl 64, id 35304, offset 0, flags [DF], proto TCP (6), length 52)
    rpi41.lan.45408 > rpi33.lan.46656: Flags [.], cksum 0x7544 (correct), ack 5221, win 1155, options [nop,nop,TS val 1568850356 ecr 278397987], length 0
1527817497.456195 IP (tos 0x0, ttl 64, id 39078, offset 0, flags [DF], proto TCP (6), length 52)
    rpi35.lan.46656 > rpi33.lan.51742: Flags [.], cksum 0x1748 (correct), ack 4176, win 1163, options [nop,nop,TS val 278396509 ecr 278397987], length 0
1527817497.456437 IP (tos 0x0, ttl 64, id 64044, offset 0, flags [DF], proto TCP (6), length 52)
    rpi40.lan.46656 > rpi33.lan.40078: Flags [.], cksum 0x6a5f (correct), ack 4176, win 1163, options [nop,nop,TS val 278395811 ecr 278397987], length 0
1527817497.655803 IP (tos 0x0, ttl 64, id 15940, offset 0, flags [DF], proto TCP (6), length 1096)
    rpi33.lan.51742 > rpi35.lan.46656: Flags [P.], cksum 0x8897 (incorrect -> 0xfca4), seq 4176:5220, ack 1, win 1323, options [nop,nop,TS val 278398007 ecr 278396509], length 1044
1527817497.655866 IP (tos 0x0, ttl 64, id 45730, offset 0, flags [DF], proto TCP (6), length 1096)
    rpi33.lan.46656 > rpi41.lan.45408: Flags [P.], cksum 0x6860 (correct), seq 5221:6265, ack 2088, win 1275, options [nop,nop,TS val 278398007 ecr 1568850356], length 1044
1527817497.656036 IP (tos 0x0, ttl 64, id 62033, offset 0, flags [DF], proto TCP (6), length 1096)
    rpi33.lan.46656 > rpi42.lan.46788: Flags [P.], cksum 0x430a (correct), seq 4177:5221, ack 7308, win 1332, options [nop,nop,TS val 278398007 ecr 278397967], length 1044
1527817497.656066 IP (tos 0x0, ttl 64, id 33284, offset 0, flags [DF], proto TCP (6), length 1096)
    rpi33.lan.40078 > rpi40.lan.46656: Flags [P.], cksum 0x889c (incorrect -> 0xe9bd), seq 4176:5220, ack 1, win 1311, options [nop,nop,TS val 278398007 ecr 278395811], length 1044
1527817497.656259 IP (tos 0x0, ttl 64, id 62458, offset 0, flags [DF], proto TCP (6), length 1096)
    rpi33.lan.37416 > rpi38.lan.46656: Flags [P.], cksum 0x889a (incorrect -> 0x1b11), seq 4176:5220, ack 1, win 1323, options [nop,nop,TS val 278398007 ecr 278396519], length 1044
1527817497.656289 IP (tos 0x0, ttl 64, id 13089, offset 0, flags [DF], proto TCP (6), length 1096)
    rpi33.lan.57566 > rpi36.lan.46656: Flags [P.], cksum 0x8898 (incorrect -> 0x3cc5), seq 5221:6265, ack 1044, win 1291, options [nop,nop,TS val 278398007 ecr 278397986], length 1044
1527817497.656614 IP (tos 0x0, ttl 64, id 39079, offset 0, flags [DF], proto TCP (6), length 52)
    rpi35.lan.46656 > rpi33.lan.51742: Flags [.], cksum 0x1314 (correct), ack 5220, win 1155, options [nop,nop,TS val 278396529 ecr 278398007], length 0
1527817497.656616 IP (tos 0x0, ttl 64, id 35305, offset 0, flags [DF], proto TCP (6), length 52)
    rpi41.lan.45408 > rpi33.lan.46656: Flags [.], cksum 0x705b (correct), ack 6265, win 1147, options [nop,nop,TS val 1568850557 ecr 278398007], length 0
1527817497.656846 IP (tos 0x0, ttl 64, id 35594, offset 0, flags [DF], proto TCP (6), length 52)
    rpi42.lan.46788 > rpi33.lan.46656: Flags [.], cksum 0x0fec (correct), ack 5221, win 1311, options [nop,nop,TS val 278397987 ecr 278398007], length 0
1527817497.656847 IP (tos 0x0, ttl 64, id 64045, offset 0, flags [DF], proto TCP (6), length 52)
    rpi40.lan.46656 > rpi33.lan.40078: Flags [.], cksum 0x662b (correct), ack 5220, win 1155, options [nop,nop,TS val 278395831 ecr 278398007], length 0
1527817497.657039 IP (tos 0x0, ttl 64, id 53454, offset 0, flags [DF], proto TCP (6), length 52)
    rpi38.lan.46656 > rpi33.lan.37416: Flags [.], cksum 0x8129 (correct), ack 5220, win 1139, options [nop,nop,TS val 278396540 ecr 278398007], length 0
1527817497.657040 IP (tos 0x0, ttl 64, id 10356, offset 0, flags [DF], proto TCP (6), length 52)
    rpi36.lan.46656 > rpi33.lan.57566: Flags [.], cksum 0xb150 (correct), ack 6265, win 1155, options [nop,nop,TS val 278398007 ecr 278398007], length 0
1527817497.857163 IP (tos 0x0, ttl 64, id 62034, offset 0, flags [DF], proto TCP (6), length 1096)
    rpi33.lan.46656 > rpi42.lan.46788: Flags [P.], cksum 0x1589 (correct), seq 5221:6265, ack 7308, win 1332, options [nop,nop,TS val 278398027 ecr 278397987], length 1044
1527817497.857410 IP (tos 0x0, ttl 64, id 62459, offset 0, flags [DF], proto TCP (6), length 1096)
    rpi33.lan.37416 > rpi38.lan.46656: Flags [P.], cksum 0x889a (incorrect -> 0xabf9), seq 5220:6264, ack 1, win 1323, options [nop,nop,TS val 278398027 ecr 278396540], length 1044
1527817497.857585 IP (tos 0x0, ttl 64, id 13090, offset 0, flags [DF], proto TCP (6), length 1096)
    rpi33.lan.57566 > rpi36.lan.46656: Flags [P.], cksum 0x8898 (incorrect -> 0x0186), seq 6265:7309, ack 1044, win 1291, options [nop,nop,TS val 278398027 ecr 278398007], length 1044
1527817497.857761 IP (tos 0x0, ttl 64, id 33285, offset 0, flags [DF], proto TCP (6), length 1096)
    rpi33.lan.40078 > rpi40.lan.46656: Flags [P.], cksum 0x889c (incorrect -> 0xfb6b), seq 5220:6264, ack 1, win 1311, options [nop,nop,TS val 278398027 ecr 278395831], length 1044
1527817497.857835 IP (tos 0x0, ttl 64, id 15941, offset 0, flags [DF], proto TCP (6), length 1096)
    rpi33.lan.51742 > rpi35.lan.46656: Flags [P.], cksum 0x8897 (incorrect -> 0x25f2), seq 5220:6264, ack 1, win 1323, options [nop,nop,TS val 278398027 ecr 278396529], length 1044
1527817497.857980 IP (tos 0x0, ttl 64, id 35595, offset 0, flags [DF], proto TCP (6), length 52)
    rpi42.lan.46788 > rpi33.lan.46656: Flags [.], cksum 0x0bb8 (correct), ack 6265, win 1303, options [nop,nop,TS val 278398007 ecr 278398027], length 0
1527817497.858184 IP (tos 0x0, ttl 64, id 53455, offset 0, flags [DF], proto TCP (6), length 52)
    rpi38.lan.46656 > rpi33.lan.37416: Flags [.], cksum 0x7cf5 (correct), ack 6264, win 1131, options [nop,nop,TS val 278396560 ecr 278398027], length 0
1527817497.858238 IP (tos 0x0, ttl 64, id 45731, offset 0, flags [DF], proto TCP (6), length 1096)
    rpi33.lan.46656 > rpi41.lan.45408: Flags [P.], cksum 0x9856 (correct), seq 6265:7309, ack 2088, win 1275, options [nop,nop,TS val 278398027 ecr 1568850557], length 1044
1527817497.858373 IP (tos 0x0, ttl 64, id 10357, offset 0, flags [DF], proto TCP (6), length 52)
    rpi36.lan.46656 > rpi33.lan.57566: Flags [.], cksum 0xad18 (correct), ack 7309, win 1151, options [nop,nop,TS val 278398027 ecr 278398027], length 0
1527817497.858548 IP (tos 0x0, ttl 64, id 64046, offset 0, flags [DF], proto TCP (6), length 52)
    rpi40.lan.46656 > rpi33.lan.40078: Flags [.], cksum 0x61f2 (correct), ack 6264, win 1151, options [nop,nop,TS val 278395852 ecr 278398027], length 0
1527817497.858550 IP (tos 0x0, ttl 64, id 39080, offset 0, flags [DF], proto TCP (6), length 52)
    rpi35.lan.46656 > rpi33.lan.51742: Flags [.], cksum 0x0edc (correct), ack 6264, win 1151, options [nop,nop,TS val 278396549 ecr 278398027], length 0
1527817497.858965 IP (tos 0x0, ttl 64, id 35306, offset 0, flags [DF], proto TCP (6), length 52)
    rpi41.lan.45408 > rpi33.lan.46656: Flags [.], cksum 0x6b6d (correct), ack 7309, win 1143, options [nop,nop,TS val 1568850759 ecr 278398027], length 0
1527817498.058397 IP (tos 0x0, ttl 64, id 15942, offset 0, flags [DF], proto TCP (6), length 1096)
    rpi33.lan.51742 > rpi35.lan.46656: Flags [P.], cksum 0x8897 (incorrect -> 0x8ab8), seq 6264:7308, ack 1, win 1323, options [nop,nop,TS val 278398047 ecr 278396549], length 1044
1527817498.058545 IP (tos 0x0, ttl 64, id 45732, offset 0, flags [DF], proto TCP (6), length 1096)
    rpi33.lan.46656 > rpi41.lan.45408: Flags [P.], cksum 0x718a (correct), seq 7309:8353, ack 2088, win 1275, options [nop,nop,TS val 278398047 ecr 1568850759], length 1044
1527817498.058576 IP (tos 0x0, ttl 64, id 13091, offset 0, flags [DF], proto TCP (6), length 1096)
    rpi33.lan.57566 > rpi36.lan.46656: Flags [P.], cksum 0x8898 (incorrect -> 0xb19f), seq 7309:8353, ack 1044, win 1291, options [nop,nop,TS val 278398047 ecr 278398027], length 1044
1527817498.058832 IP (tos 0x0, ttl 64, id 62460, offset 0, flags [DF], proto TCP (6), length 1096)
    rpi33.lan.37416 > rpi38.lan.46656: Flags [P.], cksum 0x889a (incorrect -> 0x542d), seq 6264:7308, ack 1, win 1323, options [nop,nop,TS val 278398047 ecr 278396560], length 1044
1527817498.058912 IP (tos 0x0, ttl 64, id 62035, offset 0, flags [DF], proto TCP (6), length 1096)
    rpi33.lan.46656 > rpi42.lan.46788: Flags [P.], cksum 0x2d72 (correct), seq 6265:7309, ack 7308, win 1332, options [nop,nop,TS val 278398047 ecr 278398007], length 1044
1527817498.058964 IP (tos 0x0, ttl 64, id 33286, offset 0, flags [DF], proto TCP (6), length 1096)
    rpi33.lan.40078 > rpi40.lan.46656: Flags [P.], cksum 0x889c (incorrect -> 0xd8ba), seq 6264:7308, ack 1, win 1311, options [nop,nop,TS val 278398047 ecr 278395852], length 1044
1527817498.059179 IP (tos 0x0, ttl 64, id 39081, offset 0, flags [DF], proto TCP (6), length 52)
    rpi35.lan.46656 > rpi33.lan.51742: Flags [.], cksum 0x0aa8 (correct), ack 7308, win 1143, options [nop,nop,TS val 278396569 ecr 278398047], length 0
1527817498.059182 IP (tos 0x0, ttl 64, id 35307, offset 0, flags [DF], proto TCP (6), length 52)
    rpi41.lan.45408 > rpi33.lan.46656: Flags [.], cksum 0x6684 (correct), ack 8353, win 1135, options [nop,nop,TS val 1568850960 ecr 278398047], length 0
1527817498.059409 IP (tos 0x0, ttl 64, id 10358, offset 0, flags [DF], proto TCP (6), length 52)
    rpi36.lan.46656 > rpi33.lan.57566: Flags [.], cksum 0xa8e4 (correct), ack 8353, win 1143, options [nop,nop,TS val 278398047 ecr 278398047], length 0
1527817498.059596 IP (tos 0x0, ttl 64, id 53456, offset 0, flags [DF], proto TCP (6), length 52)
    rpi38.lan.46656 > rpi33.lan.37416: Flags [.], cksum 0x78bd (correct), ack 7308, win 1127, options [nop,nop,TS val 278396580 ecr 278398047], length 0
1527817498.059598 IP (tos 0x0, ttl 64, id 35596, offset 0, flags [DF], proto TCP (6), length 52)
    rpi42.lan.46788 > rpi33.lan.46656: Flags [.], cksum 0x0780 (correct), ack 7309, win 1299, options [nop,nop,TS val 278398027 ecr 278398047], length 0
1527817498.059777 IP (tos 0x0, ttl 64, id 64047, offset 0, flags [DF], proto TCP (6), length 52)
    rpi40.lan.46656 > rpi33.lan.40078: Flags [.], cksum 0x5dbe (correct), ack 7308, win 1143, options [nop,nop,TS val 278395872 ecr 278398047], length 0
1527817498.258399 IP (tos 0x0, ttl 64, id 13092, offset 0, flags [DF], proto TCP (6), length 1096)
    rpi33.lan.57566 > rpi36.lan.46656: Flags [P.], cksum 0x8898 (incorrect -> 0x1917), seq 8353:9397, ack 1044, win 1291, options [nop,nop,TS val 278398067 ecr 278398047], length 1044
1527817498.258460 IP (tos 0x0, ttl 64, id 33287, offset 0, flags [DF], proto TCP (6), length 1096)
    rpi33.lan.40078 > rpi40.lan.46656: Flags [P.], cksum 0x889c (incorrect -> 0x5f68), seq 7308:8352, ack 1, win 1311, options [nop,nop,TS val 278398067 ecr 278395872], length 1044
1527817498.258518 IP (tos 0x0, ttl 64, id 62036, offset 0, flags [DF], proto TCP (6), length 1096)
    rpi33.lan.46656 > rpi42.lan.46788: Flags [P.], cksum 0xc407 (correct), seq 7309:8353, ack 7308, win 1332, options [nop,nop,TS val 278398067 ecr 278398027], length 1044
1527817498.258575 IP (tos 0x0, ttl 64, id 45733, offset 0, flags [DF], proto TCP (6), length 1096)
    rpi33.lan.46656 > rpi41.lan.45408: Flags [P.], cksum 0x1c9b (correct), seq 8353:9397, ack 2088, win 1275, options [nop,nop,TS val 278398067 ecr 1568850960], length 1044
1527817498.258782 IP (tos 0x0, ttl 64, id 62461, offset 0, flags [DF], proto TCP (6), length 1096)
    rpi33.lan.37416 > rpi38.lan.46656: Flags [P.], cksum 0x889a (incorrect -> 0xce0d), seq 7308:8352, ack 1, win 1323, options [nop,nop,TS val 278398067 ecr 278396580], length 1044
1527817498.258894 IP (tos 0x0, ttl 64, id 15943, offset 0, flags [DF], proto TCP (6), length 1096)
    rpi33.lan.51742 > rpi35.lan.46656: Flags [P.], cksum 0x8897 (incorrect -> 0x91ef), seq 7308:8352, ack 1, win 1323, options [nop,nop,TS val 278398067 ecr 278396569], length 1044
1527817498.259187 IP (tos 0x0, ttl 64, id 10359, offset 0, flags [DF], proto TCP (6), length 52)
    rpi36.lan.46656 > rpi33.lan.57566: Flags [.], cksum 0xa4ac (correct), ack 9397, win 1139, options [nop,nop,TS val 278398067 ecr 278398067], length 0
1527817498.259189 IP (tos 0x0, ttl 64, id 64048, offset 0, flags [DF], proto TCP (6), length 52)
    rpi40.lan.46656 > rpi33.lan.40078: Flags [.], cksum 0x5986 (correct), ack 8352, win 1139, options [nop,nop,TS val 278395892 ecr 278398067], length 0
1527817498.259426 IP (tos 0x0, ttl 64, id 35597, offset 0, flags [DF], proto TCP (6), length 52)
    rpi42.lan.46788 > rpi33.lan.46656: Flags [.], cksum 0x034c (correct), ack 8353, win 1291, options [nop,nop,TS val 278398047 ecr 278398067], length 0
1527817498.259430 IP (tos 0x0, ttl 64, id 35308, offset 0, flags [DF], proto TCP (6), length 52)
    rpi41.lan.45408 > rpi33.lan.46656: Flags [.], cksum 0x6198 (correct), ack 9397, win 1131, options [nop,nop,TS val 1568851160 ecr 278398067], length 0
1527817498.259431 IP (tos 0x0, ttl 64, id 53457, offset 0, flags [DF], proto TCP (6), length 52)
    rpi38.lan.46656 > rpi33.lan.37416: Flags [.], cksum 0x7489 (correct), ack 8352, win 1119, options [nop,nop,TS val 278396600 ecr 278398067], length 0
1527817498.259641 IP (tos 0x0, ttl 64, id 39082, offset 0, flags [DF], proto TCP (6), length 52)
    rpi35.lan.46656 > rpi33.lan.51742: Flags [.], cksum 0x0670 (correct), ack 8352, win 1139, options [nop,nop,TS val 278396589 ecr 278398067], length 0
1527817498.459224 IP (tos 0x0, ttl 64, id 62037, offset 0, flags [DF], proto TCP (6), length 1096)
