1527821292.476214 IP (tos 0x0, ttl 64, id 47141, offset 0, flags [DF], proto TCP (6), length 1096)
    rpi40.lan.33420 > rpi33.lan.46656: Flags [P.], cksum 0x43a7 (correct), seq 3626680385:3626681429, ack 1182194585, win 1324, options [nop,nop,TS val 278775313 ecr 278777293], length 1044
1527821292.476342 IP (tos 0x0, ttl 64, id 62526, offset 0, flags [DF], proto TCP (6), length 52)
    rpi33.lan.46656 > rpi40.lan.33420: Flags [.], cksum 0x8488 (incorrect -> 0x3fed), ack 1044, win 1331, options [nop,nop,TS val 278777489 ecr 278775313], length 0
1527821292.478577 IP (tos 0x0, ttl 64, id 59417, offset 0, flags [DF], proto TCP (6), length 1096)
    rpi47.lan.39312 > rpi33.lan.46656: Flags [P.], cksum 0xb10e (correct), seq 1687959876:1687960920, ack 2020636404, win 1224, options [nop,nop,TS val 278777485 ecr 278777293], length 1044
1527821292.479090 IP (tos 0x0, ttl 64, id 16302, offset 0, flags [DF], proto TCP (6), length 1096)
    rpi35.lan.46656 > rpi33.lan.58960: Flags [P.], cksum 0x2d47 (correct), seq 3976653237:3976654281, ack 369365178, win 1332, options [nop,nop,TS val 278776011 ecr 278777293], length 1044
1527821292.479193 IP (tos 0x0, ttl 64, id 1388, offset 0, flags [DF], proto TCP (6), length 52)
    rpi33.lan.58960 > rpi35.lan.46656: Flags [.], cksum 0x8483 (incorrect -> 0x967d), ack 1044, win 1323, options [nop,nop,TS val 278777489 ecr 278776011], length 0
1527821292.481551 IP (tos 0x0, ttl 64, id 27265, offset 0, flags [DF], proto TCP (6), length 1096)
    rpi42.lan.47712 > rpi33.lan.46656: Flags [P.], cksum 0x2fa7 (correct), seq 2824696256:2824697300, ack 3696415199, win 1324, options [nop,nop,TS val 278777469 ecr 278777293], length 1044
1527821292.482760 IP (tos 0x0, ttl 64, id 10121, offset 0, flags [DF], proto TCP (6), length 1096)
    rpi38.lan.46656 > rpi33.lan.44546: Flags [P.], cksum 0x52a2 (correct), seq 3775279666:3775280710, ack 1214580911, win 1332, options [nop,nop,TS val 278776022 ecr 278777293], length 1044
1527821292.482995 IP (tos 0x0, ttl 64, id 16301, offset 0, flags [DF], proto TCP (6), length 1096)
    rpi36.lan.46656 > rpi33.lan.36522: Flags [P.], cksum 0xf3ea (correct), seq 283699457:283700501, ack 866211500, win 1332, options [nop,nop,TS val 278777489 ecr 278777293], length 1044
1527821292.488243 IP (tos 0x0, ttl 64, id 16936, offset 0, flags [DF], proto TCP (6), length 1096)
    rpi44.lan.46656 > rpi33.lan.46328: Flags [P.], cksum 0xe7e4 (correct), seq 3741398121:3741399165, ack 2682023322, win 1332, options [nop,nop,TS val 270920254 ecr 278777293], length 1044
1527821292.490589 IP (tos 0x0, ttl 64, id 43084, offset 0, flags [DF], proto TCP (6), length 1096)
    rpi39.lan.46656 > rpi33.lan.55328: Flags [P.], cksum 0x30d5 (correct), seq 3646665246:3646666290, ack 2976549437, win 1332, options [nop,nop,TS val 278777490 ecr 278777293], length 1044
1527821292.494822 IP (tos 0x0, ttl 64, id 5939, offset 0, flags [DF], proto TCP (6), length 1096)
    rpi46.lan.34468 > rpi33.lan.46656: Flags [P.], cksum 0x46c7 (correct), seq 3583229343:3583230387, ack 2571189748, win 1324, options [nop,nop,TS val 3428268441 ecr 278777293], length 1044
1527821292.497208 IP (tos 0x0, ttl 64, id 33451, offset 0, flags [DF], proto TCP (6), length 1096)
    rpi43.lan.46656 > rpi33.lan.50564: Flags [P.], cksum 0x27de (correct), seq 3011945146:3011946190, ack 3552105222, win 1332, options [nop,nop,TS val 278777479 ecr 278777293], length 1044
1527821292.520825 IP (tos 0x0, ttl 64, id 62527, offset 0, flags [DF], proto TCP (6), length 1096)
    rpi33.lan.46656 > rpi40.lan.33420: Flags [P.], cksum 0xa383 (correct), seq 1:1045, ack 1044, win 1332, options [nop,nop,TS val 278777493 ecr 278775313], length 1044
1527821292.520878 IP (tos 0x0, ttl 64, id 50633, offset 0, flags [DF], proto TCP (6), length 1096)
    rpi33.lan.36522 > rpi36.lan.46656: Flags [P.], cksum 0x8898 (incorrect -> 0xef81), seq 1:1045, ack 1044, win 1324, options [nop,nop,TS val 278777493 ecr 278777489], length 1044
1527821292.521012 IP (tos 0x0, ttl 64, id 35623, offset 0, flags [DF], proto TCP (6), length 1096)
    rpi33.lan.46656 > rpi46.lan.34468: Flags [P.], cksum 0xad43 (correct), seq 1:1045, ack 1044, win 1287, options [nop,nop,TS val 278777493 ecr 3428268441], length 1044
1527821292.521042 IP (tos 0x0, ttl 64, id 1389, offset 0, flags [DF], proto TCP (6), length 1096)
    rpi33.lan.58960 > rpi35.lan.46656: Flags [P.], cksum 0x8897 (incorrect -> 0x1dc2), seq 1:1045, ack 1044, win 1324, options [nop,nop,TS val 278777493 ecr 278776011], length 1044
1527821292.521215 IP (tos 0x0, ttl 64, id 6208, offset 0, flags [DF], proto TCP (6), length 1096)
    rpi33.lan.46656 > rpi34.lan.52044: Flags [P.], cksum 0x538a (correct), seq 3077837454:3077838498, ack 2387674349, win 1332, options [nop,nop,TS val 278777493 ecr 278777497], length 1044
1527821292.521240 IP (tos 0x0, ttl 64, id 16050, offset 0, flags [DF], proto TCP (6), length 1096)
    rpi33.lan.46656 > rpi41.lan.46564: Flags [P.], cksum 0xe47b (correct), seq 1828200787:1828201831, ack 2992622883, win 1332, options [nop,nop,TS val 278777493 ecr 1572645404], length 1044
1527821292.521257 IP (tos 0x0, ttl 64, id 52947, offset 0, flags [DF], proto TCP (6), length 1096)
    rpi33.lan.36124 > rpi45.lan.46656: Flags [P.], cksum 0x88a1 (incorrect -> 0x4e7f), seq 2728365015:2728366059, ack 1424422040, win 1324, options [nop,nop,TS val 278777493 ecr 278775461], length 1044
1527821292.521396 IP (tos 0x0, ttl 64, id 47031, offset 0, flags [DF], proto TCP (6), length 1096)
    rpi33.lan.46656 > rpi37.lan.36362: Flags [P.], cksum 0x84c5 (correct), seq 4041198752:4041199796, ack 2176116951, win 1332, options [nop,nop,TS val 278777493 ecr 278777473], length 1044
1527821292.521429 IP (tos 0x0, ttl 64, id 34744, offset 0, flags [DF], proto TCP (6), length 1096)
    rpi33.lan.55328 > rpi39.lan.46656: Flags [P.], cksum 0x889b (incorrect -> 0x1520), seq 1:1045, ack 1044, win 1324, options [nop,nop,TS val 278777493 ecr 278777490], length 1044
1527821292.521604 IP (tos 0x0, ttl 64, id 65433, offset 0, flags [DF], proto TCP (6), length 1096)
    rpi33.lan.44546 > rpi38.lan.46656: Flags [P.], cksum 0x889a (incorrect -> 0x0247), seq 1:1045, ack 1044, win 1324, options [nop,nop,TS val 278777493 ecr 278776022], length 1044
1527821292.521629 IP (tos 0x0, ttl 64, id 54914, offset 0, flags [DF], proto TCP (6), length 1096)
    rpi33.lan.46656 > rpi42.lan.47712: Flags [P.], cksum 0x619d (correct), seq 1:1045, ack 1044, win 1332, options [nop,nop,TS val 278777493 ecr 278777469], length 1044
1527821292.521719 IP (tos 0x0, ttl 64, id 47142, offset 0, flags [DF], proto TCP (6), length 52)
    rpi40.lan.33420 > rpi33.lan.46656: Flags [.], cksum 0x3bd8 (correct), ack 1045, win 1323, options [nop,nop,TS val 278775318 ecr 278777493], length 0
1527821292.521755 IP (tos 0x0, ttl 64, id 52693, offset 0, flags [DF], proto TCP (6), length 1096)
    rpi33.lan.46656 > rpi47.lan.39312: Flags [P.], cksum 0xaabc (correct), seq 1:1045, ack 1044, win 1157, options [nop,nop,TS val 278777493 ecr 278777485], length 1044
1527821292.521829 IP (tos 0x0, ttl 64, id 52741, offset 0, flags [DF], proto TCP (6), length 1096)
    rpi33.lan.50564 > rpi43.lan.46656: Flags [P.], cksum 0x889f (incorrect -> 0x2880), seq 1:1045, ack 1044, win 1324, options [nop,nop,TS val 278777493 ecr 278777479], length 1044
1527821292.521723 IP (tos 0x0, ttl 64, id 16302, offset 0, flags [DF], proto TCP (6), length 52)
    rpi36.lan.46656 > rpi33.lan.36522: Flags [.], cksum 0x5d7c (correct), ack 1045, win 1331, options [nop,nop,TS val 278777493 ecr 278777493], length 0
1527821292.521725 IP (tos 0x0, ttl 64, id 5940, offset 0, flags [DF], proto TCP (6), length 52)
    rpi46.lan.34468 > rpi33.lan.46656: Flags [.], cksum 0x5875 (correct), ack 1045, win 1323, options [nop,nop,TS val 3428268468 ecr 278777493], length 0
1527821292.521977 IP (tos 0x0, ttl 64, id 16303, offset 0, flags [DF], proto TCP (6), length 52)
    rpi35.lan.46656 > rpi33.lan.58960: Flags [.], cksum 0x9259 (correct), ack 1045, win 1331, options [nop,nop,TS val 278776015 ecr 278777493], length 0
1527821292.521985 IP (tos 0x0, ttl 64, id 35807, offset 0, flags [DF], proto TCP (6), length 1096)
    rpi33.lan.46328 > rpi44.lan.46656: Flags [P.], cksum 0x88a0 (incorrect -> 0x3351), seq 1:1045, ack 1044, win 1324, options [nop,nop,TS val 278777493 ecr 270920254], length 1044
1527821292.521979 IP (tos 0x0, ttl 64, id 6734, offset 0, flags [DF], proto TCP (6), length 52)
    rpi34.lan.52044 > rpi33.lan.46656: Flags [.], cksum 0x4be5 (correct), ack 1044, win 1323, options [nop,nop,TS val 278777502 ecr 278777493], length 0
1527821292.521981 IP (tos 0x0, ttl 64, id 54021, offset 0, flags [DF], proto TCP (6), length 52)
    rpi41.lan.46564 > rpi33.lan.46656: Flags [.], cksum 0x87e9 (correct), ack 1044, win 1323, options [nop,nop,TS val 1572645454 ecr 278777493], length 0
1527821292.522219 IP (tos 0x0, ttl 64, id 31753, offset 0, flags [DF], proto TCP (6), length 52)
    rpi45.lan.46656 > rpi33.lan.36124: Flags [.], cksum 0x7740 (correct), ack 1044, win 1331, options [nop,nop,TS val 278775467 ecr 278777493], length 0
1527821292.522221 IP (tos 0x0, ttl 64, id 48871, offset 0, flags [DF], proto TCP (6), length 52)
    rpi37.lan.36362 > rpi33.lan.46656: Flags [.], cksum 0xbe70 (correct), ack 1044, win 1323, options [nop,nop,TS val 278777478 ecr 278777493], length 0
1527821292.522395 IP (tos 0x0, ttl 64, id 43085, offset 0, flags [DF], proto TCP (6), length 52)
    rpi39.lan.46656 > rpi33.lan.55328: Flags [.], cksum 0xd117 (correct), ack 1045, win 1331, options [nop,nop,TS val 278777493 ecr 278777493], length 0
1527821292.522396 IP (tos 0x0, ttl 64, id 10122, offset 0, flags [DF], proto TCP (6), length 52)
    rpi38.lan.46656 > rpi33.lan.44546: Flags [.], cksum 0x63c7 (correct), ack 1045, win 1331, options [nop,nop,TS val 278776026 ecr 278777493], length 0
1527821292.522590 IP (tos 0x0, ttl 64, id 27266, offset 0, flags [DF], proto TCP (6), length 52)
    rpi42.lan.47712 > rpi33.lan.46656: Flags [.], cksum 0xedc1 (correct), ack 1045, win 1323, options [nop,nop,TS val 278777474 ecr 278777493], length 0
1527821292.522592 IP (tos 0x0, ttl 64, id 59418, offset 0, flags [DF], proto TCP (6), length 52)
    rpi47.lan.39312 > rpi33.lan.46656: Flags [.], cksum 0x49dc (correct), ack 1045, win 1240, options [nop,nop,TS val 278777489 ecr 278777493], length 0
1527821292.522779 IP (tos 0x0, ttl 64, id 33452, offset 0, flags [DF], proto TCP (6), length 52)
    rpi43.lan.46656 > rpi33.lan.50564: Flags [.], cksum 0xaddd (correct), ack 1045, win 1331, options [nop,nop,TS val 278777481 ecr 278777493], length 0
1527821292.522781 IP (tos 0x0, ttl 64, id 16937, offset 0, flags [DF], proto TCP (6), length 52)
    rpi44.lan.46656 > rpi33.lan.46328: Flags [.], cksum 0x7f46 (correct), ack 1045, win 1331, options [nop,nop,TS val 270920258 ecr 278777493], length 0
1527821294.467515 IP (tos 0x0, ttl 64, id 31754, offset 0, flags [DF], proto TCP (6), length 1096)
    rpi45.lan.46656 > rpi33.lan.36124: Flags [P.], cksum 0x221d (correct), seq 1:1045, ack 1044, win 1332, options [nop,nop,TS val 278775662 ecr 278777493], length 1044
1527821294.467662 IP (tos 0x0, ttl 64, id 52948, offset 0, flags [DF], proto TCP (6), length 52)
    rpi33.lan.36124 > rpi45.lan.46656: Flags [.], cksum 0x848d (incorrect -> 0x71ae), ack 1045, win 1323, options [nop,nop,TS val 278777688 ecr 278775662], length 0
1527821294.474420 IP (tos 0x0, ttl 64, id 6735, offset 0, flags [DF], proto TCP (6), length 1096)
    rpi34.lan.52044 > rpi33.lan.46656: Flags [P.], cksum 0x5255 (correct), seq 1:1045, ack 1044, win 1324, options [nop,nop,TS val 278777697 ecr 278777493], length 1044
1527821294.474520 IP (tos 0x0, ttl 64, id 6209, offset 0, flags [DF], proto TCP (6), length 52)
    rpi33.lan.46656 > rpi34.lan.52044: Flags [.], cksum 0x8482 (incorrect -> 0x4642), ack 1045, win 1331, options [nop,nop,TS val 278777689 ecr 278777697], length 0
1527821294.476721 IP (tos 0x0, ttl 64, id 54022, offset 0, flags [DF], proto TCP (6), length 1096)
    rpi41.lan.46564 > rpi33.lan.46656: Flags [P.], cksum 0x44e2 (correct), seq 1:1045, ack 1044, win 1324, options [nop,nop,TS val 1572647408 ecr 278777493], length 1044
1527821294.476819 IP (tos 0x0, ttl 64, id 16051, offset 0, flags [DF], proto TCP (6), length 52)
    rpi33.lan.46656 > rpi41.lan.46564: Flags [.], cksum 0x8489 (incorrect -> 0x7b67), ack 1045, win 1331, options [nop,nop,TS val 278777689 ecr 1572647408], length 0
1527821294.477958 IP (tos 0x0, ttl 64, id 48872, offset 0, flags [DF], proto TCP (6), length 1096)
    rpi37.lan.36362 > rpi33.lan.46656: Flags [P.], cksum 0xdd01 (correct), seq 1:1045, ack 1044, win 1324, options [nop,nop,TS val 278777673 ecr 278777493], length 1044
1527821294.478039 IP (tos 0x0, ttl 64, id 47032, offset 0, flags [DF], proto TCP (6), length 52)
    rpi33.lan.46656 > rpi37.lan.36362: Flags [.], cksum 0x8485 (incorrect -> 0xb8cd), ack 1045, win 1331, options [nop,nop,TS val 278777689 ecr 278777673], length 0
1527821294.480390 IP (tos 0x0, ttl 64, id 47143, offset 0, flags [DF], proto TCP (6), length 1096)
    rpi40.lan.33420 > rpi33.lan.46656: Flags [P.], cksum 0xbb9f (correct), seq 1044:2088, ack 1045, win 1324, options [nop,nop,TS val 278775514 ecr 278777493], length 1044
1527821294.480477 IP (tos 0x0, ttl 64, id 62528, offset 0, flags [DF], proto TCP (6), length 52)
    rpi33.lan.46656 > rpi40.lan.33420: Flags [.], cksum 0x8488 (incorrect -> 0x3634), ack 2088, win 1331, options [nop,nop,TS val 278777689 ecr 278775514], length 0
1527821294.482328 IP (tos 0x0, ttl 64, id 16304, offset 0, flags [DF], proto TCP (6), length 1096)
    rpi35.lan.46656 > rpi33.lan.58960: Flags [P.], cksum 0xa166 (correct), seq 1044:2088, ack 1045, win 1332, options [nop,nop,TS val 278776211 ecr 278777493], length 1044
1527821294.482398 IP (tos 0x0, ttl 64, id 1390, offset 0, flags [DF], proto TCP (6), length 52)
    rpi33.lan.58960 > rpi35.lan.46656: Flags [.], cksum 0x8483 (incorrect -> 0x8cc5), ack 2088, win 1323, options [nop,nop,TS val 278777689 ecr 278776211], length 0
1527821294.482524 IP (tos 0x0, ttl 64, id 59419, offset 0, flags [DF], proto TCP (6), length 1096)
    rpi47.lan.39312 > rpi33.lan.46656: Flags [P.], cksum 0xcf81 (correct), seq 1044:2088, ack 1045, win 1240, options [nop,nop,TS val 278777685 ecr 278777493], length 1044
1527821294.485805 IP (tos 0x0, ttl 64, id 27267, offset 0, flags [DF], proto TCP (6), length 1096)
    rpi42.lan.47712 > rpi33.lan.46656: Flags [P.], cksum 0x0789 (correct), seq 1044:2088, ack 1045, win 1324, options [nop,nop,TS val 278777670 ecr 278777493], length 1044
1527821294.487490 IP (tos 0x0, ttl 64, id 10123, offset 0, flags [DF], proto TCP (6), length 1096)
    rpi38.lan.46656 > rpi33.lan.44546: Flags [P.], cksum 0xcddc (correct), seq 1044:2088, ack 1045, win 1332, options [nop,nop,TS val 278776223 ecr 278777493], length 1044
1527821294.488289 IP (tos 0x0, ttl 64, id 16303, offset 0, flags [DF], proto TCP (6), length 1096)
    rpi36.lan.46656 > rpi33.lan.36522: Flags [P.], cksum 0x676d (correct), seq 1044:2088, ack 1045, win 1332, options [nop,nop,TS val 278777690 ecr 278777493], length 1044
1527821294.491714 IP (tos 0x0, ttl 64, id 16938, offset 0, flags [DF], proto TCP (6), length 1096)
    rpi44.lan.46656 > rpi33.lan.46328: Flags [P.], cksum 0x74b6 (correct), seq 1044:2088, ack 1045, win 1332, options [nop,nop,TS val 270920455 ecr 278777493], length 1044
1527821294.493025 IP (tos 0x0, ttl 64, id 43086, offset 0, flags [DF], proto TCP (6), length 1096)
    rpi39.lan.46656 > rpi33.lan.55328: Flags [P.], cksum 0x84cb (correct), seq 1044:2088, ack 1045, win 1332, options [nop,nop,TS val 278777690 ecr 278777493], length 1044
1527821294.499137 IP (tos 0x0, ttl 64, id 5941, offset 0, flags [DF], proto TCP (6), length 1096)
    rpi46.lan.34468 > rpi33.lan.46656: Flags [P.], cksum 0xa872 (correct), seq 1044:2088, ack 1045, win 1324, options [nop,nop,TS val 3428270445 ecr 278777493], length 1044
1527821294.500367 IP (tos 0x0, ttl 64, id 33453, offset 0, flags [DF], proto TCP (6), length 1096)
    rpi43.lan.46656 > rpi33.lan.50564: Flags [P.], cksum 0xdeb9 (correct), seq 1044:2088, ack 1045, win 1332, options [nop,nop,TS val 278777679 ecr 278777493], length 1044
1527821294.524182 IP (tos 0x0, ttl 64, id 47033, offset 0, flags [DF], proto TCP (6), length 1096)
    rpi33.lan.46656 > rpi37.lan.36362: Flags [P.], cksum 0xa4e0 (correct), seq 1044:2088, ack 1045, win 1332, options [nop,nop,TS val 278777693 ecr 278777673], length 1044
1527821294.524236 IP (tos 0x0, ttl 64, id 6210, offset 0, flags [DF], proto TCP (6), length 1096)
    rpi33.lan.46656 > rpi34.lan.52044: Flags [P.], cksum 0x4789 (correct), seq 1044:2088, ack 1045, win 1332, options [nop,nop,TS val 278777693 ecr 278777697], length 1044
1527821294.524255 IP (tos 0x0, ttl 64, id 50634, offset 0, flags [DF], proto TCP (6), length 1096)
    rpi33.lan.36522 > rpi36.lan.46656: Flags [P.], cksum 0x8898 (incorrect -> 0xc14e), seq 1045:2089, ack 2088, win 1324, options [nop,nop,TS val 278777693 ecr 278777690], length 1044
1527821294.524522 IP (tos 0x0, ttl 64, id 52694, offset 0, flags [DF], proto TCP (6), length 52)
    rpi33.lan.46656 > rpi47.lan.39312: Flags [.], cksum 0x848f (incorrect -> 0x447e), ack 2088, win 1173, options [nop,nop,TS val 278777694 ecr 278777685], length 0
1527821294.524562 IP (tos 0x0, ttl 64, id 1391, offset 0, flags [DF], proto TCP (6), length 1096)
    rpi33.lan.58960 > rpi35.lan.46656: Flags [P.], cksum 0x8897 (incorrect -> 0x6f9c), seq 1045:2089, ack 2088, win 1324, options [nop,nop,TS val 278777694 ecr 278776211], length 1044
1527821294.524598 IP (tos 0x0, ttl 64, id 52695, offset 0, flags [DF], proto TCP (6), length 1096)
    rpi33.lan.46656 > rpi47.lan.39312: Flags [P.], cksum 0x5281 (correct), seq 1045:2089, ack 2088, win 1173, options [nop,nop,TS val 278777694 ecr 278777685], length 1044
1527821294.524780 IP (tos 0x0, ttl 64, id 52742, offset 0, flags [DF], proto TCP (6), length 1096)
    rpi33.lan.50564 > rpi43.lan.46656: Flags [P.], cksum 0x889f (incorrect -> 0x2387), seq 1045:2089, ack 2088, win 1324, options [nop,nop,TS val 278777694 ecr 278777679], length 1044
1527821294.524880 IP (tos 0x0, ttl 64, id 54915, offset 0, flags [DF], proto TCP (6), length 1096)
    rpi33.lan.46656 > rpi42.lan.47712: Flags [P.], cksum 0x13f7 (correct), seq 1045:2089, ack 2088, win 1332, options [nop,nop,TS val 278777694 ecr 278777670], length 1044
1527821294.524999 IP (tos 0x0, ttl 64, id 52949, offset 0, flags [DF], proto TCP (6), length 1096)
    rpi33.lan.36124 > rpi45.lan.46656: Flags [P.], cksum 0x88a1 (incorrect -> 0xd446), seq 1044:2088, ack 1045, win 1324, options [nop,nop,TS val 278777694 ecr 278775662], length 1044
1527821294.524994 IP (tos 0x0, ttl 64, id 48873, offset 0, flags [DF], proto TCP (6), length 52)
    rpi37.lan.36362 > rpi33.lan.46656: Flags [.], cksum 0xb4b8 (correct), ack 2088, win 1323, options [nop,nop,TS val 278777678 ecr 278777693], length 0
1527821294.525092 IP (tos 0x0, ttl 64, id 62529, offset 0, flags [DF], proto TCP (6), length 1096)
    rpi33.lan.46656 > rpi40.lan.33420: Flags [P.], cksum 0xf8aa (correct), seq 1045:2089, ack 2088, win 1332, options [nop,nop,TS val 278777694 ecr 278775514], length 1044
1527821294.525157 IP (tos 0x0, ttl 64, id 6736, offset 0, flags [DF], proto TCP (6), length 52)
    rpi34.lan.52044 > rpi33.lan.46656: Flags [.], cksum 0x422d (correct), ack 2088, win 1323, options [nop,nop,TS val 278777702 ecr 278777693], length 0
1527821294.525159 IP (tos 0x0, ttl 64, id 16304, offset 0, flags [DF], proto TCP (6), length 52)
    rpi36.lan.46656 > rpi33.lan.36522: Flags [.], cksum 0x53c4 (correct), ack 2089, win 1331, options [nop,nop,TS val 278777693 ecr 278777693], length 0
1527821294.525217 IP (tos 0x0, ttl 64, id 35624, offset 0, flags [DF], proto TCP (6), length 1096)
    rpi33.lan.46656 > rpi46.lan.34468: Flags [P.], cksum 0x24ed (correct), seq 1045:2089, ack 2088, win 1303, options [nop,nop,TS val 278777694 ecr 3428270445], length 1044
1527821294.525299 IP (tos 0x0, ttl 64, id 16052, offset 0, flags [DF], proto TCP (6), length 1096)
    rpi33.lan.46656 > rpi41.lan.46564: Flags [P.], cksum 0xc751 (correct), seq 1044:2088, ack 1045, win 1332, options [nop,nop,TS val 278777694 ecr 1572647408], length 1044
1527821294.525396 IP (tos 0x0, ttl 64, id 16305, offset 0, flags [DF], proto TCP (6), length 52)
    rpi35.lan.46656 > rpi33.lan.58960: Flags [.], cksum 0x88a0 (correct), ack 2089, win 1331, options [nop,nop,TS val 278776215 ecr 278777694], length 0
1527821294.525432 IP (tos 0x0, ttl 64, id 34745, offset 0, flags [DF], proto TCP (6), length 1096)
    rpi33.lan.55328 > rpi39.lan.46656: Flags [P.], cksum 0x889b (incorrect -> 0x37b7), seq 1045:2089, ack 2088, win 1324, options [nop,nop,TS val 278777694 ecr 278777690], length 1044
1527821294.525513 IP (tos 0x0, ttl 64, id 35808, offset 0, flags [DF], proto TCP (6), length 1096)
    rpi33.lan.46328 > rpi44.lan.46656: Flags [P.], cksum 0x88a0 (incorrect -> 0x58d6), seq 1045:2089, ack 2088, win 1324, options [nop,nop,TS val 278777694 ecr 270920455], length 1044
1527821294.525534 IP (tos 0x0, ttl 64, id 59420, offset 0, flags [DF], proto TCP (6), length 52)
    rpi47.lan.39312 > rpi33.lan.46656: Flags [.], cksum 0x4012 (correct), ack 2089, win 1256, options [nop,nop,TS val 278777690 ecr 278777694], length 0
1527821294.525536 IP (tos 0x0, ttl 64, id 33454, offset 0, flags [DF], proto TCP (6), length 52)
    rpi43.lan.46656 > rpi33.lan.50564: Flags [.], cksum 0xa423 (correct), ack 2089, win 1331, options [nop,nop,TS val 278777682 ecr 278777694], length 0
1527821294.525696 IP (tos 0x0, ttl 64, id 27268, offset 0, flags [DF], proto TCP (6), length 52)
    rpi42.lan.47712 > rpi33.lan.46656: Flags [.], cksum 0xe408 (correct), ack 2089, win 1323, options [nop,nop,TS val 278777674 ecr 278777694], length 0
1527821294.525709 IP (tos 0x0, ttl 64, id 65434, offset 0, flags [DF], proto TCP (6), length 1096)
    rpi33.lan.44546 > rpi38.lan.46656: Flags [P.], cksum 0x889a (incorrect -> 0x3c68), seq 1045:2089, ack 2088, win 1324, options [nop,nop,TS val 278777694 ecr 278776223], length 1044
1527821294.525698 IP (tos 0x0, ttl 64, id 31755, offset 0, flags [DF], proto TCP (6), length 52)
    rpi45.lan.46656 > rpi33.lan.36124: Flags [.], cksum 0x6d87 (correct), ack 2088, win 1331, options [nop,nop,TS val 278775667 ecr 278777694], length 0
1527821294.525919 IP (tos 0x0, ttl 64, id 47144, offset 0, flags [DF], proto TCP (6), length 52)
    rpi40.lan.33420 > rpi33.lan.46656: Flags [.], cksum 0x321f (correct), ack 2089, win 1323, options [nop,nop,TS val 278775518 ecr 278777694], length 0
1527821294.525921 IP (tos 0x0, ttl 64, id 5942, offset 0, flags [DF], proto TCP (6), length 52)
    rpi46.lan.34468 > rpi33.lan.46656: Flags [.], cksum 0x47b0 (correct), ack 2089, win 1323, options [nop,nop,TS val 3428270472 ecr 278777694], length 0
1527821294.525923 IP (tos 0x0, ttl 64, id 54023, offset 0, flags [DF], proto TCP (6), length 52)
    rpi41.lan.46564 > rpi33.lan.46656: Flags [.], cksum 0x7724 (correct), ack 2088, win 1323, options [nop,nop,TS val 1572647458 ecr 278777694], length 0
1527821294.526227 IP (tos 0x0, ttl 64, id 43087, offset 0, flags [DF], proto TCP (6), length 52)
    rpi39.lan.46656 > rpi33.lan.55328: Flags [.], cksum 0xc75d (correct), ack 2089, win 1331, options [nop,nop,TS val 278777694 ecr 278777694], length 0
1527821294.526229 IP (tos 0x0, ttl 64, id 16939, offset 0, flags [DF], proto TCP (6), length 52)
    rpi44.lan.46656 > rpi33.lan.46328: Flags [.], cksum 0x758d (correct), ack 2089, win 1331, options [nop,nop,TS val 270920458 ecr 278777694], length 0
1527821294.526521 IP (tos 0x0, ttl 64, id 10124, offset 0, flags [DF], proto TCP (6), length 52)
    rpi38.lan.46656 > rpi33.lan.44546: Flags [.], cksum 0x5a0e (correct), ack 2089, win 1331, options [nop,nop,TS val 278776226 ecr 278777694], length 0
1527821295.846936 IP (tos 0x0, ttl 64, id 33455, offset 0, flags [DF], proto TCP (6), length 1096)
    rpi43.lan.46656 > rpi33.lan.50564: Flags [P.], cksum 0xe11c (correct), seq 2088:3132, ack 2089, win 1332, options [nop,nop,TS val 278777814 ecr 278777694], length 1044
1527821295.894535 IP (tos 0x0, ttl 64, id 52743, offset 0, flags [DF], proto TCP (6), length 52)
    rpi33.lan.50564 > rpi43.lan.46656: Flags [.], cksum 0x848b (incorrect -> 0x9f09), ack 3132, win 1324, options [nop,nop,TS val 278777831 ecr 278777814], length 0
1527821296.470893 IP (tos 0x0, ttl 64, id 31756, offset 0, flags [DF], proto TCP (6), length 1096)
    rpi45.lan.46656 > rpi33.lan.36124: Flags [P.], cksum 0x1a0b (correct), seq 1045:2089, ack 2088, win 1332, options [nop,nop,TS val 278775862 ecr 278777694], length 1044
1527821296.470983 IP (tos 0x0, ttl 64, id 52950, offset 0, flags [DF], proto TCP (6), length 52)
    rpi33.lan.36124 > rpi45.lan.46656: Flags [.], cksum 0x848d (incorrect -> 0x67f6), ack 2089, win 1323, options [nop,nop,TS val 278777888 ecr 278775862], length 0
1527821296.477669 IP (tos 0x0, ttl 64, id 6737, offset 0, flags [DF], proto TCP (6), length 1096)
    rpi34.lan.52044 > rpi33.lan.46656: Flags [P.], cksum 0xf663 (correct), seq 1045:2089, ack 2088, win 1324, options [nop,nop,TS val 278777897 ecr 278777693], length 1044
1527821296.477753 IP (tos 0x0, ttl 64, id 6211, offset 0, flags [DF], proto TCP (6), length 52)
    rpi33.lan.46656 > rpi34.lan.52044: Flags [.], cksum 0x8482 (incorrect -> 0x3c8a), ack 2089, win 1331, options [nop,nop,TS val 278777889 ecr 278777897], length 0
1527821296.480175 IP (tos 0x0, ttl 64, id 54024, offset 0, flags [DF], proto TCP (6), length 1096)
    rpi41.lan.46564 > rpi33.lan.46656: Flags [P.], cksum 0x5f00 (correct), seq 1045:2089, ack 2088, win 1324, options [nop,nop,TS val 1572649412 ecr 278777694], length 1044
1527821296.480286 IP (tos 0x0, ttl 64, id 16053, offset 0, flags [DF], proto TCP (6), length 52)
    rpi33.lan.46656 > rpi41.lan.46564: Flags [.], cksum 0x8489 (incorrect -> 0x6aa3), ack 2089, win 1331, options [nop,nop,TS val 278777889 ecr 1572649412], length 0
1527821296.480827 IP (tos 0x0, ttl 64, id 48874, offset 0, flags [DF], proto TCP (6), length 1096)
    rpi37.lan.36362 > rpi33.lan.46656: Flags [P.], cksum 0x5c0d (correct), seq 1045:2089, ack 2088, win 1324, options [nop,nop,TS val 278777873 ecr 278777693], length 1044
1527821296.480898 IP (tos 0x0, ttl 64, id 47034, offset 0, flags [DF], proto TCP (6), length 52)
    rpi33.lan.46656 > rpi37.lan.36362: Flags [.], cksum 0x8485 (incorrect -> 0xaf15), ack 2089, win 1331, options [nop,nop,TS val 278777889 ecr 278777873], length 0
1527821296.483608 IP (tos 0x0, ttl 64, id 47145, offset 0, flags [DF], proto TCP (6), length 1096)
    rpi40.lan.33420 > rpi33.lan.46656: Flags [P.], cksum 0xbab5 (correct), seq 2088:3132, ack 2089, win 1324, options [nop,nop,TS val 278775714 ecr 278777694], length 1044
1527821296.483703 IP (tos 0x0, ttl 64, id 62530, offset 0, flags [DF], proto TCP (6), length 52)
    rpi33.lan.46656 > rpi40.lan.33420: Flags [.], cksum 0x8488 (incorrect -> 0x2c7c), ack 3132, win 1331, options [nop,nop,TS val 278777889 ecr 278775714], length 0
1527821296.485553 IP (tos 0x0, ttl 64, id 59421, offset 0, flags [DF], proto TCP (6), length 1096)
    rpi47.lan.39312 > rpi33.lan.46656: Flags [P.], cksum 0x4325 (correct), seq 2088:3132, ack 2089, win 1256, options [nop,nop,TS val 278777886 ecr 278777694], length 1044
1527821296.485636 IP (tos 0x0, ttl 64, id 52696, offset 0, flags [DF], proto TCP (6), length 52)
    rpi33.lan.46656 > rpi47.lan.39312: Flags [.], cksum 0x848f (incorrect -> 0x3ab9), ack 3132, win 1189, options [nop,nop,TS val 278777890 ecr 278777886], length 0
1527821296.487309 IP (tos 0x0, ttl 64, id 16306, offset 0, flags [DF], proto TCP (6), length 1096)
    rpi35.lan.46656 > rpi33.lan.58960: Flags [P.], cksum 0x30e8 (correct), seq 2088:3132, ack 2089, win 1332, options [nop,nop,TS val 278776412 ecr 278777694], length 1044
1527821296.487394 IP (tos 0x0, ttl 64, id 1392, offset 0, flags [DF], proto TCP (6), length 52)
    rpi33.lan.58960 > rpi35.lan.46656: Flags [.], cksum 0x8483 (incorrect -> 0x830b), ack 3132, win 1323, options [nop,nop,TS val 278777890 ecr 278776412], length 0
1527821296.488521 IP (tos 0x0, ttl 64, id 27269, offset 0, flags [DF], proto TCP (6), length 1096)
    rpi42.lan.47712 > rpi33.lan.46656: Flags [P.], cksum 0x68cd (correct), seq 2088:3132, ack 2089, win 1324, options [nop,nop,TS val 278777870 ecr 278777694], length 1044
1527821296.491250 IP (tos 0x0, ttl 64, id 16305, offset 0, flags [DF], proto TCP (6), length 1096)
    rpi36.lan.46656 > rpi33.lan.36522: Flags [P.], cksum 0x78fd (correct), seq 2088:3132, ack 2089, win 1332, options [nop,nop,TS val 278777890 ecr 278777693], length 1044
1527821296.492260 IP (tos 0x0, ttl 64, id 10125, offset 0, flags [DF], proto TCP (6), length 1096)
    rpi38.lan.46656 > rpi33.lan.44546: Flags [P.], cksum 0x2dbc (correct), seq 2088:3132, ack 2089, win 1332, options [nop,nop,TS val 278776423 ecr 278777694], length 1044
1527821296.494933 IP (tos 0x0, ttl 64, id 16940, offset 0, flags [DF], proto TCP (6), length 1096)
    rpi44.lan.46656 > rpi33.lan.46328: Flags [P.], cksum 0x30e7 (correct), seq 2088:3132, ack 2089, win 1332, options [nop,nop,TS val 270920655 ecr 278777694], length 1044
1527821296.496849 IP (tos 0x0, ttl 64, id 43088, offset 0, flags [DF], proto TCP (6), length 1096)
    rpi39.lan.46656 > rpi33.lan.55328: Flags [P.], cksum 0xea90 (correct), seq 2088:3132, ack 2089, win 1332, options [nop,nop,TS val 278777891 ecr 278777694], length 1044
1527821296.502450 IP (tos 0x0, ttl 64, id 5943, offset 0, flags [DF], proto TCP (6), length 1096)
    rpi46.lan.34468 > rpi33.lan.46656: Flags [P.], cksum 0x1664 (correct), seq 2088:3132, ack 2089, win 1324, options [nop,nop,TS val 3428272448 ecr 278777694], length 1044
1527821296.502896 IP (tos 0x0, ttl 64, id 33456, offset 0, flags [DF], proto TCP (6), length 1096)
    rpi43.lan.46656 > rpi33.lan.50564: Flags [P.], cksum 0xf183 (correct), seq 3132:4176, ack 2089, win 1332, options [nop,nop,TS val 278777879 ecr 278777831], length 1044
1527821296.502969 IP (tos 0x0, ttl 64, id 52744, offset 0, flags [DF], proto TCP (6), length 52)
    rpi33.lan.50564 > rpi43.lan.46656: Flags [.], cksum 0x848b (incorrect -> 0x9a79), ack 4176, win 1323, options [nop,nop,TS val 278777891 ecr 278777879], length 0
1527821296.527581 IP (tos 0x0, ttl 64, id 54916, offset 0, flags [DF], proto TCP (6), length 1096)
    rpi33.lan.46656 > rpi42.lan.47712: Flags [P.], cksum 0xe4fe (correct), seq 2089:3133, ack 3132, win 1332, options [nop,nop,TS val 278777894 ecr 278777870], length 1044
1527821296.527629 IP (tos 0x0, ttl 64, id 6212, offset 0, flags [DF], proto TCP (6), length 1096)
    rpi33.lan.46656 > rpi34.lan.52044: Flags [P.], cksum 0xe554 (correct), seq 2088:3132, ack 2089, win 1332, options [nop,nop,TS val 278777894 ecr 278777897], length 1044
1527821296.527848 IP (tos 0x0, ttl 64, id 65435, offset 0, flags [DF], proto TCP (6), length 1096)
    rpi33.lan.44546 > rpi38.lan.46656: Flags [P.], cksum 0x889a (incorrect -> 0xc793), seq 2089:3133, ack 3132, win 1324, options [nop,nop,TS val 278777894 ecr 278776423], length 1044
1527821296.527912 IP (tos 0x0, ttl 64, id 62531, offset 0, flags [DF], proto TCP (6), length 1096)
    rpi33.lan.46656 > rpi40.lan.33420: Flags [P.], cksum 0x7a5b (correct), seq 2089:3133, ack 3132, win 1332, options [nop,nop,TS val 278777894 ecr 278775714], length 1044
1527821296.528095 IP (tos 0x0, ttl 64, id 47035, offset 0, flags [DF], proto TCP (6), length 1096)
    rpi33.lan.46656 > rpi37.lan.36362: Flags [P.], cksum 0x10e3 (correct), seq 2088:3132, ack 2089, win 1332, options [nop,nop,TS val 278777894 ecr 278777873], length 1044
1527821296.528137 IP (tos 0x0, ttl 64, id 35625, offset 0, flags [DF], proto TCP (6), length 1096)
    rpi33.lan.46656 > rpi46.lan.34468: Flags [P.], cksum 0x465b (correct), seq 2089:3133, ack 3132, win 1320, options [nop,nop,TS val 278777894 ecr 3428272448], length 1044
1527821296.528308 IP (tos 0x0, ttl 64, id 52745, offset 0, flags [DF], proto TCP (6), length 1096)
    rpi33.lan.50564 > rpi43.lan.46656: Flags [P.], cksum 0x889f (incorrect -> 0x1389), seq 2089:3133, ack 4176, win 1324, options [nop,nop,TS val 278777894 ecr 278777879], length 1044
1527821296.528339 IP (tos 0x0, ttl 64, id 35809, offset 0, flags [DF], proto TCP (6), length 1096)
    rpi33.lan.46328 > rpi44.lan.46656: Flags [P.], cksum 0x88a0 (incorrect -> 0x0728), seq 2089:3133, ack 3132, win 1324, options [nop,nop,TS val 278777894 ecr 270920655], length 1044
1527821296.528473 IP (tos 0x0, ttl 64, id 27270, offset 0, flags [DF], proto TCP (6), length 52)
    rpi42.lan.47712 > rpi33.lan.46656: Flags [.], cksum 0xda50 (correct), ack 3133, win 1323, options [nop,nop,TS val 278777874 ecr 278777894], length 0
1527821296.528523 IP (tos 0x0, ttl 64, id 52951, offset 0, flags [DF], proto TCP (6), length 1096)
    rpi33.lan.36124 > rpi45.lan.46656: Flags [P.], cksum 0x88a1 (incorrect -> 0x449f), seq 2088:3132, ack 2089, win 1324, options [nop,nop,TS val 278777894 ecr 278775862], length 1044
1527821296.528476 IP (tos 0x0, ttl 64, id 6738, offset 0, flags [DF], proto TCP (6), length 52)
    rpi34.lan.52044 > rpi33.lan.46656: Flags [.], cksum 0x3873 (correct), ack 3132, win 1323, options [nop,nop,TS val 278777903 ecr 278777894], length 0
1527821296.528560 IP (tos 0x0, ttl 64, id 34746, offset 0, flags [DF], proto TCP (6), length 1096)
    rpi33.lan.55328 > rpi39.lan.46656: Flags [P.], cksum 0x889b (incorrect -> 0x6b7e), seq 2089:3133, ack 3132, win 1324, options [nop,nop,TS val 278777894 ecr 278777891], length 1044
1527821296.528704 IP (tos 0x0, ttl 64, id 10126, offset 0, flags [DF], proto TCP (6), length 52)
    rpi38.lan.46656 > rpi33.lan.44546: Flags [.], cksum 0x5055 (correct), ack 3133, win 1331, options [nop,nop,TS val 278776427 ecr 278777894], length 0
1527821296.528706 IP (tos 0x0, ttl 64, id 47146, offset 0, flags [DF], proto TCP (6), length 52)
    rpi40.lan.33420 > rpi33.lan.46656: Flags [.], cksum 0x2866 (correct), ack 3133, win 1323, options [nop,nop,TS val 278775719 ecr 278777894], length 0
1527821296.528765 IP (tos 0x0, ttl 64, id 52697, offset 0, flags [DF], proto TCP (6), length 1096)
    rpi33.lan.46656 > rpi47.lan.39312: Flags [P.], cksum 0xd8b1 (correct), seq 2089:3133, ack 3132, win 1189, options [nop,nop,TS val 278777894 ecr 278777886], length 1044
1527821296.528871 IP (tos 0x0, ttl 64, id 16054, offset 0, flags [DF], proto TCP (6), length 1096)
    rpi33.lan.46656 > rpi41.lan.46564: Flags [P.], cksum 0xa3b4 (correct), seq 2088:3132, ack 2089, win 1332, options [nop,nop,TS val 278777894 ecr 1572649412], length 1044
1527821296.528905 IP (tos 0x0, ttl 64, id 48875, offset 0, flags [DF], proto TCP (6), length 52)
    rpi37.lan.36362 > rpi33.lan.46656: Flags [.], cksum 0xaaff (correct), ack 3132, win 1323, options [nop,nop,TS val 278777878 ecr 278777894], length 0
1527821296.528906 IP (tos 0x0, ttl 64, id 5944, offset 0, flags [DF], proto TCP (6), length 52)
    rpi46.lan.34468 > rpi33.lan.46656: Flags [.], cksum 0x36ed (correct), ack 3133, win 1323, options [nop,nop,TS val 3428272475 ecr 278777894], length 0
1527821296.528966 IP (tos 0x0, ttl 64, id 50635, offset 0, flags [DF], proto TCP (6), length 1096)
    rpi33.lan.36522 > rpi36.lan.46656: Flags [P.], cksum 0x8898 (incorrect -> 0x0133), seq 2089:3133, ack 3132, win 1324, options [nop,nop,TS val 278777894 ecr 278777890], length 1044
1527821296.529111 IP (tos 0x0, ttl 64, id 33457, offset 0, flags [DF], proto TCP (6), length 52)
    rpi43.lan.46656 > rpi33.lan.50564: Flags [.], cksum 0x9657 (correct), ack 3133, win 1331, options [nop,nop,TS val 278777882 ecr 278777894], length 0
1527821296.529112 IP (tos 0x0, ttl 64, id 16941, offset 0, flags [DF], proto TCP (6), length 52)
    rpi44.lan.46656 > rpi33.lan.46328: Flags [.], cksum 0x6bd5 (correct), ack 3133, win 1331, options [nop,nop,TS val 270920658 ecr 278777894], length 0
1527821296.529272 IP (tos 0x0, ttl 64, id 1393, offset 0, flags [DF], proto TCP (6), length 1096)
    rpi33.lan.58960 > rpi35.lan.46656: Flags [P.], cksum 0x8897 (incorrect -> 0xc3da), seq 2089:3133, ack 3132, win 1324, options [nop,nop,TS val 278777894 ecr 278776412], length 1044
1527821296.529332 IP (tos 0x0, ttl 64, id 31757, offset 0, flags [DF], proto TCP (6), length 52)
    rpi45.lan.46656 > rpi33.lan.36124: Flags [.], cksum 0x63ce (correct), ack 3132, win 1331, options [nop,nop,TS val 278775868 ecr 278777894], length 0
1527821296.529333 IP (tos 0x0, ttl 64, id 43089, offset 0, flags [DF], proto TCP (6), length 52)
    rpi39.lan.46656 > rpi33.lan.55328: Flags [.], cksum 0xbda5 (correct), ack 3133, win 1331, options [nop,nop,TS val 278777894 ecr 278777894], length 0
1527821296.529636 IP (tos 0x0, ttl 64, id 54025, offset 0, flags [DF], proto TCP (6), length 52)
    rpi41.lan.46564 > rpi33.lan.46656: Flags [.], cksum 0x6661 (correct), ack 3132, win 1323, options [nop,nop,TS val 1572649461 ecr 278777894], length 0
1527821296.529638 IP (tos 0x0, ttl 64, id 59422, offset 0, flags [DF], proto TCP (6), length 52)
    rpi47.lan.39312 > rpi33.lan.46656: Flags [.], cksum 0x3649 (correct), ack 3133, win 1273, options [nop,nop,TS val 278777890 ecr 278777894], length 0
1527821296.529775 IP (tos 0x0, ttl 64, id 16306, offset 0, flags [DF], proto TCP (6), length 52)
    rpi36.lan.46656 > rpi33.lan.36522: Flags [.], cksum 0x4a0a (correct), ack 3133, win 1331, options [nop,nop,TS val 278777894 ecr 278777894], length 0
1527821296.530064 IP (tos 0x0, ttl 64, id 16307, offset 0, flags [DF], proto TCP (6), length 52)
    rpi35.lan.46656 > rpi33.lan.58960: Flags [.], cksum 0x7ee7 (correct), ack 3133, win 1331, options [nop,nop,TS val 278776416 ecr 278777894], length 0
1527821296.907815 IP (tos 0x0, ttl 64, id 52746, offset 0, flags [DF], proto TCP (6), length 1096)
    rpi33.lan.50564 > rpi43.lan.46656: Flags [P.], cksum 0x889f (incorrect -> 0x5c34), seq 3133:4177, ack 4176, win 1324, options [nop,nop,TS val 278777932 ecr 278777882], length 1044
1527821296.908619 IP (tos 0x0, ttl 64, id 33458, offset 0, flags [DF], proto TCP (6), length 52)
    rpi43.lan.46656 > rpi33.lan.50564: Flags [.], cksum 0x91f7 (correct), ack 4177, win 1331, options [nop,nop,TS val 278777920 ecr 278777932], length 0
1527821296.908993 IP (tos 0x0, ttl 64, id 10127, offset 0, flags [DF], proto TCP (6), length 1096)
    rpi38.lan.46656 > rpi33.lan.44546: Flags [P.], cksum 0x4e8b (correct), seq 3132:4176, ack 3133, win 1332, options [nop,nop,TS val 278776465 ecr 278777894], length 1044
1527821296.909128 IP (tos 0x0, ttl 64, id 33459, offset 0, flags [DF], proto TCP (6), length 1096)
    rpi43.lan.46656 > rpi33.lan.50564: Flags [P.], cksum 0x2d33 (correct), seq 4176:5220, ack 4177, win 1332, options [nop,nop,TS val 278777920 ecr 278777932], length 1044
1527821296.909317 IP (tos 0x0, ttl 64, id 33460, offset 0, flags [DF], proto TCP (6), length 1096)
    rpi43.lan.46656 > rpi33.lan.50564: Flags [P.], cksum 0xb265 (correct), seq 5220:6264, ack 4177, win 1332, options [nop,nop,TS val 278777920 ecr 278777932], length 1044
1527821296.909601 IP (tos 0x0, ttl 64, id 52747, offset 0, flags [DF], proto TCP (6), length 52)
    rpi33.lan.50564 > rpi43.lan.46656: Flags [.], cksum 0x848b (incorrect -> 0x89d6), ack 6264, win 1324, options [nop,nop,TS val 278777932 ecr 278777920], length 0
1527821296.909937 IP (tos 0x0, ttl 64, id 52748, offset 0, flags [DF], proto TCP (6), length 1096)
    rpi33.lan.50564 > rpi43.lan.46656: Flags [P.], cksum 0x889f (incorrect -> 0xab4b), seq 4177:5221, ack 6264, win 1324, options [nop,nop,TS val 278777932 ecr 278777920], length 1044
1527821296.954505 IP (tos 0x0, ttl 64, id 65436, offset 0, flags [DF], proto TCP (6), length 52)
    rpi33.lan.44546 > rpi38.lan.46656: Flags [.], cksum 0x8486 (incorrect -> 0x4bf7), ack 4176, win 1324, options [nop,nop,TS val 278777937 ecr 278776465], length 0
1527821296.954689 IP (tos 0x0, ttl 64, id 33461, offset 0, flags [DF], proto TCP (6), length 52)
