1527821737.569060 IP (tos 0x0, ttl 64, id 34343, offset 0, flags [DF], proto TCP (6), length 1096)
    rpi45.lan.46656 > rpi33.lan.36124: Flags [P.], cksum 0xda41 (correct), seq 1425884684:1425885728, ack 2730046899, win 1332, options [nop,nop,TS val 278819972 ecr 278821854], length 1044
1527821737.569222 IP (tos 0x0, ttl 64, id 55718, offset 0, flags [DF], proto TCP (6), length 52)
    rpi33.lan.36124 > rpi45.lan.46656: Flags [.], cksum 0x848d (incorrect -> 0x2015), ack 1044, win 1323, options [nop,nop,TS val 278821998 ecr 278819972], length 0
1527821737.569606 IP (tos 0x0, ttl 64, id 55719, offset 0, flags [DF], proto TCP (6), length 1096)
    rpi33.lan.36124 > rpi45.lan.46656: Flags [P.], cksum 0x88a1 (incorrect -> 0xcb34), seq 1:1045, ack 1044, win 1324, options [nop,nop,TS val 278821998 ecr 278819972], length 1044
1527821737.569866 IP (tos 0x0, ttl 64, id 55720, offset 0, flags [DF], proto TCP (6), length 1096)
    rpi33.lan.36124 > rpi45.lan.46656: Flags [P.], cksum 0x88a1 (incorrect -> 0x95f0), seq 1045:2089, ack 1044, win 1324, options [nop,nop,TS val 278821998 ecr 278819972], length 1044
1527821737.570642 IP (tos 0x0, ttl 64, id 34344, offset 0, flags [DF], proto TCP (6), length 52)
    rpi45.lan.46656 > rpi33.lan.36124: Flags [.], cksum 0x17e4 (correct), ack 2089, win 1332, options [nop,nop,TS val 278819972 ecr 278821998], length 0
1527821737.571164 IP (tos 0x0, ttl 64, id 34345, offset 0, flags [DF], proto TCP (6), length 1096)
    rpi45.lan.46656 > rpi33.lan.36124: Flags [P.], cksum 0x909d (correct), seq 1044:2088, ack 2089, win 1332, options [nop,nop,TS val 278819972 ecr 278821998], length 1044
1527821737.614507 IP (tos 0x0, ttl 64, id 55721, offset 0, flags [DF], proto TCP (6), length 52)
    rpi33.lan.36124 > rpi45.lan.46656: Flags [.], cksum 0x848d (incorrect -> 0x13d3), ack 2088, win 1324, options [nop,nop,TS val 278822003 ecr 278819972], length 0
1527821738.081927 IP (tos 0x0, ttl 64, id 19109, offset 0, flags [DF], proto TCP (6), length 1096)
    rpi35.lan.46656 > rpi33.lan.58960: Flags [P.], cksum 0x7522 (correct), seq 3978287097:3978288141, ack 370972938, win 1332, options [nop,nop,TS val 278820571 ecr 278821851], length 1044
1527821738.100079 IP (tos 0x0, ttl 64, id 30001, offset 0, flags [DF], proto TCP (6), length 1096)
    rpi42.lan.47712 > rpi33.lan.46656: Flags [P.], cksum 0x4766 (correct), seq 2826229892:2826230936, ack 3698054279, win 1324, options [nop,nop,TS val 278822031 ecr 278821851], length 1044
1527821738.101376 IP (tos 0x0, ttl 64, id 53262, offset 0, flags [DF], proto TCP (6), length 1096)
    rpi33.lan.36522 > rpi36.lan.46656: Flags [P.], cksum 0x8898 (incorrect -> 0xf919), seq 867810908:867811952, ack 285344801, win 1324, options [nop,nop,TS val 278822051 ecr 278821854], length 1044
1527821738.101423 IP (tos 0x0, ttl 64, id 49698, offset 0, flags [DF], proto TCP (6), length 1096)
    rpi33.lan.46656 > rpi37.lan.36362: Flags [P.], cksum 0x4d31 (correct), seq 4042805468:4042806512, ack 2177757075, win 1332, options [nop,nop,TS val 278822051 ecr 278821838], length 1044
1527821738.101777 IP (tos 0x0, ttl 64, id 38538, offset 0, flags [DF], proto TCP (6), length 1096)
    rpi33.lan.46328 > rpi44.lan.46656: Flags [P.], cksum 0x88a0 (incorrect -> 0x6ef2), seq 2683660314:2683661358, ack 3742947417, win 1324, options [nop,nop,TS val 278822051 ecr 270964618], length 1044
1527821738.101805 IP (tos 0x0, ttl 64, id 38288, offset 0, flags [DF], proto TCP (6), length 1096)
    rpi33.lan.46656 > rpi46.lan.34468: Flags [P.], cksum 0x6517 (correct), seq 2572816300:2572817344, ack 3584822487, win 1332, options [nop,nop,TS val 278822051 ecr 3428712079], length 1044
1527821738.101959 IP (tos 0x0, ttl 64, id 65249, offset 0, flags [DF], proto TCP (6), length 1096)
    rpi33.lan.46656 > rpi40.lan.33420: Flags [P.], cksum 0x0baf (correct), seq 1183845149:1183846193, ack 3628148249, win 1332, options [nop,nop,TS val 278822051 ecr 278819679], length 1044
1527821738.102115 IP (tos 0x0, ttl 64, id 8894, offset 0, flags [DF], proto TCP (6), length 1096)
    rpi33.lan.46656 > rpi34.lan.52044: Flags [P.], cksum 0xc16d (correct), seq 3079436862:3079437906, ack 2389272713, win 1332, options [nop,nop,TS val 278822051 ecr 278821862], length 1044
1527821738.102165 IP (tos 0x0, ttl 64, id 18755, offset 0, flags [DF], proto TCP (6), length 1096)
    rpi33.lan.46656 > rpi41.lan.46564: Flags [P.], cksum 0x9bde (correct), seq 1829811679:1829812723, ack 2994204543, win 1332, options [nop,nop,TS val 278822051 ecr 1573089067], length 1044
1527821738.102380 IP (tos 0x0, ttl 64, id 37453, offset 0, flags [DF], proto TCP (6), length 1096)
    rpi33.lan.55328 > rpi39.lan.46656: Flags [P.], cksum 0x889b (incorrect -> 0xf8cf), seq 2978172857:2978173901, ack 3648260478, win 1324, options [nop,nop,TS val 278822051 ecr 278821855], length 1044
1527821738.102405 IP (tos 0x0, ttl 64, id 4041, offset 0, flags [DF], proto TCP (6), length 1096)
    rpi33.lan.58960 > rpi35.lan.46656: Flags [P.], cksum 0x8897 (incorrect -> 0x2e6b), seq 1:1045, ack 1044, win 1324, options [nop,nop,TS val 278822051 ecr 278820571], length 1044
1527821738.102616 IP (tos 0x0, ttl 64, id 2588, offset 0, flags [DF], proto TCP (6), length 1096)
    rpi33.lan.44546 > rpi38.lan.46656: Flags [P.], cksum 0x889a (incorrect -> 0x78a5), seq 1216180319:1216181363, ack 3776932318, win 1324, options [nop,nop,TS val 278822051 ecr 278820385], length 1044
1527821738.102640 IP (tos 0x0, ttl 64, id 55722, offset 0, flags [DF], proto TCP (6), length 1096)
    rpi33.lan.36124 > rpi45.lan.46656: Flags [P.], cksum 0x88a1 (incorrect -> 0x9c53), seq 2089:3133, ack 2088, win 1324, options [nop,nop,TS val 278822051 ecr 278819972], length 1044
1527821738.102812 IP (tos 0x0, ttl 64, id 57577, offset 0, flags [DF], proto TCP (6), length 1096)
    rpi33.lan.46656 > rpi42.lan.47712: Flags [P.], cksum 0xde18 (correct), seq 1:1045, ack 1044, win 1332, options [nop,nop,TS val 278822051 ecr 278822031], length 1044
1527821738.102951 IP (tos 0x0, ttl 64, id 55492, offset 0, flags [DF], proto TCP (6), length 1096)
    rpi33.lan.50564 > rpi43.lan.46656: Flags [P.], cksum 0x889f (incorrect -> 0xfb55), seq 3553725510:3553726554, ack 3013519498, win 1324, options [nop,nop,TS val 278822051 ecr 278821844], length 1044
1527821738.103124 IP (tos 0x0, ttl 64, id 55461, offset 0, flags [DF], proto TCP (6), length 1096)
    rpi33.lan.46656 > rpi47.lan.39312: Flags [P.], cksum 0xe098 (correct), seq 2022317244:2022318288, ack 1689367188, win 1332, options [nop,nop,TS val 278822051 ecr 278821851], length 1044
1527821738.103247 IP (tos 0x0, ttl 64, id 45874, offset 0, flags [DF], proto TCP (6), length 52)
    rpi39.lan.46656 > rpi33.lan.55328: Flags [.], cksum 0x5c01 (correct), ack 1044, win 1331, options [nop,nop,TS val 278822051 ecr 278822051], length 0
1527821738.103250 IP (tos 0x0, ttl 64, id 19110, offset 0, flags [DF], proto TCP (6), length 52)
    rpi35.lan.46656 > rpi33.lan.58960: Flags [.], cksum 0xbf76 (correct), ack 1045, win 1331, options [nop,nop,TS val 278820573 ecr 278822051], length 0
1527821738.103591 IP (tos 0x0, ttl 64, id 30002, offset 0, flags [DF], proto TCP (6), length 52)
    rpi42.lan.47712 > rpi33.lan.46656: Flags [.], cksum 0x2808 (correct), ack 1045, win 1323, options [nop,nop,TS val 278822032 ecr 278822051], length 0
1527821738.103769 IP (tos 0x0, ttl 64, id 36106, offset 0, flags [DF], proto TCP (6), length 52)
    rpi43.lan.46656 > rpi33.lan.50564: Flags [.], cksum 0x9693 (correct), ack 1044, win 1331, options [nop,nop,TS val 278822039 ecr 278822051], length 0
1527821738.104053 IP (tos 0x0, ttl 64, id 62004, offset 0, flags [DF], proto TCP (6), length 52)
    rpi47.lan.39312 > rpi33.lan.46656: Flags [.], cksum 0xd237 (correct), ack 1044, win 1323, options [nop,nop,TS val 278822048 ecr 278822051], length 0
1527821738.105464 IP (tos 0x0, ttl 64, id 36107, offset 0, flags [DF], proto TCP (6), length 1096)
    rpi43.lan.46656 > rpi33.lan.50564: Flags [P.], cksum 0x412d (correct), seq 1:1045, ack 1044, win 1332, options [nop,nop,TS val 278822040 ecr 278822051], length 1044
1527821738.105532 IP (tos 0x0, ttl 64, id 55493, offset 0, flags [DF], proto TCP (6), length 52)
    rpi33.lan.50564 > rpi43.lan.46656: Flags [.], cksum 0x848b (incorrect -> 0x9285), ack 1045, win 1323, options [nop,nop,TS val 278822052 ecr 278822040], length 0
1527821738.116434 IP (tos 0x0, ttl 64, id 12925, offset 0, flags [DF], proto TCP (6), length 1096)
    rpi38.lan.46656 > rpi33.lan.44546: Flags [P.], cksum 0x59a1 (correct), seq 1:1045, ack 1044, win 1332, options [nop,nop,TS val 278820585 ecr 278822051], length 1044
1527821738.116521 IP (tos 0x0, ttl 64, id 2589, offset 0, flags [DF], proto TCP (6), length 52)
    rpi33.lan.44546 > rpi38.lan.46656: Flags [.], cksum 0x8486 (incorrect -> 0x6821), ack 1045, win 1323, options [nop,nop,TS val 278822053 ecr 278820585], length 0
1527821738.124162 IP (tos 0x0, ttl 64, id 19620, offset 0, flags [DF], proto TCP (6), length 1096)
    rpi44.lan.46656 > rpi33.lan.46328: Flags [P.], cksum 0x328e (correct), seq 1:1045, ack 1044, win 1332, options [nop,nop,TS val 270964818 ecr 278822051], length 1044
1527821738.124247 IP (tos 0x0, ttl 64, id 38539, offset 0, flags [DF], proto TCP (6), length 52)
    rpi33.lan.46328 > rpi44.lan.46656: Flags [.], cksum 0x848c (correct), ack 1045, win 1323, options [nop,nop,TS val 278822053 ecr 270964818], length 0
1527821738.127443 IP (tos 0x0, ttl 64, id 51644, offset 0, flags [DF], proto TCP (6), length 1096)
    rpi37.lan.36362 > rpi33.lan.46656: Flags [P.], cksum 0xfd35 (correct), seq 1:1045, ack 1044, win 1324, options [nop,nop,TS val 278822038 ecr 278822051], length 1044
1527821738.127542 IP (tos 0x0, ttl 64, id 49699, offset 0, flags [DF], proto TCP (6), length 52)
    rpi33.lan.46656 > rpi37.lan.36362: Flags [.], cksum 0x8485 (incorrect -> 0xd308), ack 1045, win 1331, options [nop,nop,TS val 278822054 ecr 278822038], length 0
1527821738.133291 IP (tos 0x0, ttl 64, id 9436, offset 0, flags [DF], proto TCP (6), length 1096)
    rpi34.lan.52044 > rpi33.lan.46656: Flags [P.], cksum 0xa3e2 (correct), seq 1:1045, ack 1044, win 1324, options [nop,nop,TS val 278822063 ecr 278822051], length 1044
1527821738.133377 IP (tos 0x0, ttl 64, id 8895, offset 0, flags [DF], proto TCP (6), length 52)
    rpi33.lan.46656 > rpi34.lan.52044: Flags [.], cksum 0x8482 (incorrect -> 0x2029), ack 1045, win 1331, options [nop,nop,TS val 278822054 ecr 278822063], length 0
1527821738.134217 IP (tos 0x0, ttl 64, id 56711, offset 0, flags [DF], proto TCP (6), length 1096)
    rpi41.lan.46564 > rpi33.lan.46656: Flags [P.], cksum 0x479e (correct), seq 1:1045, ack 1044, win 1324, options [nop,nop,TS val 1573091070 ecr 278822051], length 1044
1527821738.134338 IP (tos 0x0, ttl 64, id 18756, offset 0, flags [DF], proto TCP (6), length 52)
    rpi33.lan.46656 > rpi41.lan.46564: Flags [.], cksum 0x8489 (incorrect -> 0x51ec), ack 1045, win 1331, options [nop,nop,TS val 278822054 ecr 1573091070], length 0
1527821738.134418 IP (tos 0x0, ttl 64, id 34346, offset 0, flags [DF], proto TCP (6), length 1096)
    rpi45.lan.46656 > rpi33.lan.36124: Flags [P.], cksum 0x1ea2 (correct), seq 2088:3132, ack 3133, win 1332, options [nop,nop,TS val 278820028 ecr 278822051], length 1044
1527821738.134553 IP (tos 0x0, ttl 64, id 55723, offset 0, flags [DF], proto TCP (6), length 52)
    rpi33.lan.36124 > rpi45.lan.46656: Flags [.], cksum 0x848d (incorrect -> 0x0b40), ack 3132, win 1323, options [nop,nop,TS val 278822055 ecr 278820028], length 0
1527821738.134639 IP (tos 0x0, ttl 64, id 49746, offset 0, flags [DF], proto TCP (6), length 1096)
    rpi40.lan.33420 > rpi33.lan.46656: Flags [P.], cksum 0xfac2 (correct), seq 1:1045, ack 1044, win 1324, options [nop,nop,TS val 278819879 ecr 278822051], length 1044
1527821738.134700 IP (tos 0x0, ttl 64, id 65250, offset 0, flags [DF], proto TCP (6), length 52)
    rpi33.lan.46656 > rpi40.lan.33420: Flags [.], cksum 0x8488 (incorrect -> 0x4a20), ack 1045, win 1331, options [nop,nop,TS val 278822055 ecr 278819879], length 0
1527821738.134979 IP (tos 0x0, ttl 64, id 19150, offset 0, flags [DF], proto TCP (6), length 1096)
    rpi36.lan.46656 > rpi33.lan.36522: Flags [P.], cksum 0x2cc2 (correct), seq 1:1045, ack 1044, win 1332, options [nop,nop,TS val 278822054 ecr 278822051], length 1044
1527821738.135041 IP (tos 0x0, ttl 64, id 53263, offset 0, flags [DF], proto TCP (6), length 52)
    rpi33.lan.36522 > rpi36.lan.46656: Flags [.], cksum 0x8484 (incorrect -> 0x7e5e), ack 1045, win 1323, options [nop,nop,TS val 278822055 ecr 278822054], length 0
1527821738.136802 IP (tos 0x0, ttl 64, id 8673, offset 0, flags [DF], proto TCP (6), length 1096)
    rpi46.lan.34468 > rpi33.lan.46656: Flags [P.], cksum 0x589f (correct), seq 1:1045, ack 1044, win 1324, options [nop,nop,TS val 3428714084 ecr 278822051], length 1044
1527821738.136898 IP (tos 0x0, ttl 64, id 38289, offset 0, flags [DF], proto TCP (6), length 52)
    rpi33.lan.46656 > rpi46.lan.34468: Flags [.], cksum 0x848e (incorrect -> 0xbc82), ack 1045, win 1331, options [nop,nop,TS val 278822055 ecr 3428714084], length 0
1527821738.144629 IP (tos 0x0, ttl 64, id 45875, offset 0, flags [DF], proto TCP (6), length 1096)
    rpi39.lan.46656 > rpi33.lan.55328: Flags [P.], cksum 0x0fc5 (correct), seq 1:1045, ack 1044, win 1332, options [nop,nop,TS val 278822055 ecr 278822051], length 1044
1527821738.144704 IP (tos 0x0, ttl 64, id 37454, offset 0, flags [DF], proto TCP (6), length 52)
    rpi33.lan.55328 > rpi39.lan.46656: Flags [.], cksum 0x8487 (incorrect -> 0x57ec), ack 1045, win 1323, options [nop,nop,TS val 278822056 ecr 278822055], length 0
1527821738.145104 IP (tos 0x0, ttl 64, id 62005, offset 0, flags [DF], proto TCP (6), length 1096)
    rpi47.lan.39312 > rpi33.lan.46656: Flags [P.], cksum 0x4532 (correct), seq 1:1045, ack 1044, win 1324, options [nop,nop,TS val 278822052 ecr 278822051], length 1044
1527821738.145164 IP (tos 0x0, ttl 64, id 55462, offset 0, flags [DF], proto TCP (6), length 52)
    rpi33.lan.46656 > rpi47.lan.39312: Flags [.], cksum 0x848f (incorrect -> 0xce12), ack 1045, win 1331, options [nop,nop,TS val 278822056 ecr 278822052], length 0
1527821739.285169 IP (tos 0x0, ttl 64, id 49747, offset 0, flags [DF], proto TCP (6), length 1096)
    rpi40.lan.33420 > rpi33.lan.46656: Flags [P.], cksum 0x9139 (correct), seq 1045:2089, ack 1044, win 1324, options [nop,nop,TS val 278819994 ecr 278822055], length 1044
1527821739.285277 IP (tos 0x0, ttl 64, id 65251, offset 0, flags [DF], proto TCP (6), length 52)
    rpi33.lan.46656 > rpi40.lan.33420: Flags [.], cksum 0x8488 (incorrect -> 0x4526), ack 2089, win 1331, options [nop,nop,TS val 278822170 ecr 278819994], length 0
1527821740.086092 IP (tos 0x0, ttl 64, id 19111, offset 0, flags [DF], proto TCP (6), length 1096)
    rpi35.lan.46656 > rpi33.lan.58960: Flags [P.], cksum 0x95b8 (correct), seq 1044:2088, ack 1045, win 1332, options [nop,nop,TS val 278820771 ecr 278822051], length 1044
1527821740.104766 IP (tos 0x0, ttl 64, id 30003, offset 0, flags [DF], proto TCP (6), length 1096)
    rpi42.lan.47712 > rpi33.lan.46656: Flags [P.], cksum 0xe26c (correct), seq 1044:2088, ack 1045, win 1324, options [nop,nop,TS val 278822232 ecr 278822051], length 1044
1527821740.105643 IP (tos 0x0, ttl 64, id 2590, offset 0, flags [DF], proto TCP (6), length 1096)
    rpi33.lan.44546 > rpi38.lan.46656: Flags [P.], cksum 0x889a (incorrect -> 0x1c67), seq 1044:2088, ack 1045, win 1324, options [nop,nop,TS val 278822252 ecr 278820585], length 1044
1527821740.105736 IP (tos 0x0, ttl 64, id 8896, offset 0, flags [DF], proto TCP (6), length 1096)
    rpi33.lan.46656 > rpi34.lan.52044: Flags [P.], cksum 0x785a (correct), seq 1044:2088, ack 1045, win 1332, options [nop,nop,TS val 278822252 ecr 278822063], length 1044
1527821740.105898 IP (tos 0x0, ttl 64, id 49700, offset 0, flags [DF], proto TCP (6), length 1096)
    rpi33.lan.46656 > rpi37.lan.36362: Flags [P.], cksum 0xf3e5 (correct), seq 1044:2088, ack 1045, win 1332, options [nop,nop,TS val 278822252 ecr 278822038], length 1044
1527821740.106077 IP (tos 0x0, ttl 64, id 57578, offset 0, flags [DF], proto TCP (6), length 1096)
    rpi33.lan.46656 > rpi42.lan.47712: Flags [P.], cksum 0xbd2b (correct), seq 1045:2089, ack 2088, win 1332, options [nop,nop,TS val 278822252 ecr 278822232], length 1044
1527821740.106134 IP (tos 0x0, ttl 64, id 65252, offset 0, flags [DF], proto TCP (6), length 1096)
    rpi33.lan.46656 > rpi40.lan.33420: Flags [P.], cksum 0x56e7 (correct), seq 1044:2088, ack 2089, win 1332, options [nop,nop,TS val 278822252 ecr 278819994], length 1044
1527821740.106343 IP (tos 0x0, ttl 64, id 18757, offset 0, flags [DF], proto TCP (6), length 1096)
    rpi33.lan.46656 > rpi41.lan.46564: Flags [P.], cksum 0x25b3 (correct), seq 1044:2088, ack 1045, win 1332, options [nop,nop,TS val 278822252 ecr 1573091070], length 1044
1527821740.106374 IP (tos 0x0, ttl 64, id 37455, offset 0, flags [DF], proto TCP (6), length 1096)
    rpi33.lan.55328 > rpi39.lan.46656: Flags [P.], cksum 0x889b (incorrect -> 0x5939), seq 1044:2088, ack 1045, win 1324, options [nop,nop,TS val 278822252 ecr 278822055], length 1044
1527821740.106610 IP (tos 0x0, ttl 64, id 55494, offset 0, flags [DF], proto TCP (6), length 1096)
    rpi33.lan.50564 > rpi43.lan.46656: Flags [P.], cksum 0x889f (incorrect -> 0x54f0), seq 1044:2088, ack 1045, win 1324, options [nop,nop,TS val 278822252 ecr 278822040], length 1044
1527821740.106705 IP (tos 0x0, ttl 64, id 38290, offset 0, flags [DF], proto TCP (6), length 1096)
    rpi33.lan.46656 > rpi46.lan.34468: Flags [P.], cksum 0xfa90 (correct), seq 1044:2088, ack 1045, win 1332, options [nop,nop,TS val 278822252 ecr 3428714084], length 1044
1527821740.106838 IP (tos 0x0, ttl 64, id 30004, offset 0, flags [DF], proto TCP (6), length 52)
    rpi42.lan.47712 > rpi33.lan.46656: Flags [.], cksum 0x1e4f (correct), ack 2089, win 1323, options [nop,nop,TS val 278822232 ecr 278822252], length 0
1527821740.106872 IP (tos 0x0, ttl 64, id 53264, offset 0, flags [DF], proto TCP (6), length 1096)
    rpi33.lan.36522 > rpi36.lan.46656: Flags [P.], cksum 0x8898 (incorrect -> 0x934d), seq 1044:2088, ack 1045, win 1324, options [nop,nop,TS val 278822252 ecr 278822054], length 1044
1527821740.106922 IP (tos 0x0, ttl 64, id 38540, offset 0, flags [DF], proto TCP (6), length 1096)
    rpi33.lan.46328 > rpi44.lan.46656: Flags [P.], cksum 0x88a0 (incorrect -> 0x2179), seq 1044:2088, ack 1045, win 1324, options [nop,nop,TS val 278822252 ecr 270964818], length 1044
1527821740.107110 IP (tos 0x0, ttl 64, id 55463, offset 0, flags [DF], proto TCP (6), length 1096)
    rpi33.lan.46656 > rpi47.lan.39312: Flags [P.], cksum 0x631e (correct), seq 1044:2088, ack 1045, win 1332, options [nop,nop,TS val 278822252 ecr 278822052], length 1044
1527821740.107136 IP (tos 0x0, ttl 64, id 55724, offset 0, flags [DF], proto TCP (6), length 1096)
    rpi33.lan.36124 > rpi45.lan.46656: Flags [P.], cksum 0x88a1 (incorrect -> 0xc421), seq 3133:4177, ack 3132, win 1324, options [nop,nop,TS val 278822252 ecr 278820028], length 1044
1527821740.107220 IP (tos 0x0, ttl 64, id 4042, offset 0, flags [DF], proto TCP (6), length 1096)
    rpi33.lan.58960 > rpi35.lan.46656: Flags [P.], cksum 0x8897 (incorrect -> 0xc3a0), seq 1045:2089, ack 2088, win 1324, options [nop,nop,TS val 278822252 ecr 278820771], length 1044
1527821740.107259 IP (tos 0x0, ttl 64, id 45876, offset 0, flags [DF], proto TCP (6), length 52)
    rpi39.lan.46656 > rpi33.lan.55328: Flags [.], cksum 0x5247 (correct), ack 2088, win 1331, options [nop,nop,TS val 278822252 ecr 278822252], length 0
1527821740.107989 IP (tos 0x0, ttl 64, id 62006, offset 0, flags [DF], proto TCP (6), length 52)
    rpi47.lan.39312 > rpi33.lan.46656: Flags [.], cksum 0xc87e (correct), ack 2088, win 1323, options [nop,nop,TS val 278822248 ecr 278822252], length 0
1527821740.107991 IP (tos 0x0, ttl 64, id 19112, offset 0, flags [DF], proto TCP (6), length 52)
    rpi35.lan.46656 > rpi33.lan.58960: Flags [.], cksum 0xb5bc (correct), ack 2089, win 1331, options [nop,nop,TS val 278820774 ecr 278822252], length 0
1527821740.108977 IP (tos 0x0, ttl 64, id 36108, offset 0, flags [DF], proto TCP (6), length 1096)
    rpi43.lan.46656 > rpi33.lan.50564: Flags [P.], cksum 0xd9b4 (correct), seq 1045:2089, ack 2088, win 1332, options [nop,nop,TS val 278822240 ecr 278822252], length 1044
1527821740.109049 IP (tos 0x0, ttl 64, id 55495, offset 0, flags [DF], proto TCP (6), length 52)
    rpi33.lan.50564 > rpi43.lan.46656: Flags [.], cksum 0x848b (incorrect -> 0x88cd), ack 2089, win 1323, options [nop,nop,TS val 278822252 ecr 278822240], length 0
1527821740.119357 IP (tos 0x0, ttl 64, id 12926, offset 0, flags [DF], proto TCP (6), length 1096)
    rpi38.lan.46656 > rpi33.lan.44546: Flags [P.], cksum 0xc682 (correct), seq 1045:2089, ack 2088, win 1332, options [nop,nop,TS val 278820786 ecr 278822252], length 1044
1527821740.119436 IP (tos 0x0, ttl 64, id 2591, offset 0, flags [DF], proto TCP (6), length 52)
    rpi33.lan.44546 > rpi38.lan.46656: Flags [.], cksum 0x8486 (incorrect -> 0x5e68), ack 2089, win 1323, options [nop,nop,TS val 278822253 ecr 278820786], length 0
1527821740.126897 IP (tos 0x0, ttl 64, id 19621, offset 0, flags [DF], proto TCP (6), length 1096)
    rpi44.lan.46656 > rpi33.lan.46328: Flags [P.], cksum 0x055e (correct), seq 1045:2089, ack 2088, win 1332, options [nop,nop,TS val 270965018 ecr 278822252], length 1044
1527821740.126965 IP (tos 0x0, ttl 64, id 38541, offset 0, flags [DF], proto TCP (6), length 52)
    rpi33.lan.46328 > rpi44.lan.46656: Flags [.], cksum 0x848c (incorrect -> 0x7ad3), ack 2089, win 1323, options [nop,nop,TS val 278822254 ecr 270965018], length 0
1527821740.131086 IP (tos 0x0, ttl 64, id 51645, offset 0, flags [DF], proto TCP (6), length 1096)
    rpi37.lan.36362 > rpi33.lan.46656: Flags [P.], cksum 0x0c2e (correct), seq 1045:2089, ack 2088, win 1324, options [nop,nop,TS val 278822238 ecr 278822252], length 1044
1527821740.131168 IP (tos 0x0, ttl 64, id 49701, offset 0, flags [DF], proto TCP (6), length 52)
    rpi33.lan.46656 > rpi37.lan.36362: Flags [.], cksum 0x8485 (incorrect -> 0xc950), ack 2089, win 1331, options [nop,nop,TS val 278822254 ecr 278822238], length 0
1527821740.136604 IP (tos 0x0, ttl 64, id 9437, offset 0, flags [DF], proto TCP (6), length 1096)
    rpi34.lan.52044 > rpi33.lan.46656: Flags [P.], cksum 0x27f5 (correct), seq 1045:2089, ack 2088, win 1324, options [nop,nop,TS val 278822263 ecr 278822252], length 1044
1527821740.136687 IP (tos 0x0, ttl 64, id 8897, offset 0, flags [DF], proto TCP (6), length 52)
    rpi33.lan.46656 > rpi34.lan.52044: Flags [.], cksum 0x8482 (incorrect -> 0x1670), ack 2089, win 1331, options [nop,nop,TS val 278822255 ecr 278822263], length 0
1527821740.137572 IP (tos 0x0, ttl 64, id 34347, offset 0, flags [DF], proto TCP (6), length 1096)
    rpi45.lan.46656 > rpi33.lan.36124: Flags [P.], cksum 0x6cbd (correct), seq 3132:4176, ack 4177, win 1332, options [nop,nop,TS val 278820229 ecr 278822252], length 1044
1527821740.137640 IP (tos 0x0, ttl 64, id 55725, offset 0, flags [DF], proto TCP (6), length 52)
    rpi33.lan.36124 > rpi45.lan.46656: Flags [.], cksum 0x848d (incorrect -> 0x0187), ack 4176, win 1323, options [nop,nop,TS val 278822255 ecr 278820229], length 0
1527821740.137771 IP (tos 0x0, ttl 64, id 56712, offset 0, flags [DF], proto TCP (6), length 1096)
    rpi41.lan.46564 > rpi33.lan.46656: Flags [P.], cksum 0xec00 (correct), seq 1045:2089, ack 2088, win 1324, options [nop,nop,TS val 1573093073 ecr 278822252], length 1044
1527821740.137829 IP (tos 0x0, ttl 64, id 18758, offset 0, flags [DF], proto TCP (6), length 52)
    rpi33.lan.46656 > rpi41.lan.46564: Flags [.], cksum 0x8489 (incorrect -> 0x4128), ack 2089, win 1331, options [nop,nop,TS val 278822255 ecr 1573093073], length 0
1527821740.138169 IP (tos 0x0, ttl 64, id 49748, offset 0, flags [DF], proto TCP (6), length 1096)
    rpi40.lan.33420 > rpi33.lan.46656: Flags [P.], cksum 0xbd74 (correct), seq 2089:3133, ack 2088, win 1324, options [nop,nop,TS val 278820080 ecr 278822252], length 1044
1527821740.138228 IP (tos 0x0, ttl 64, id 65253, offset 0, flags [DF], proto TCP (6), length 52)
    rpi33.lan.46656 > rpi40.lan.33420: Flags [.], cksum 0x8488 (incorrect -> 0x3c53), ack 3133, win 1331, options [nop,nop,TS val 278822255 ecr 278820080], length 0
1527821740.138952 IP (tos 0x0, ttl 64, id 19151, offset 0, flags [DF], proto TCP (6), length 1096)
    rpi36.lan.46656 > rpi33.lan.36522: Flags [P.], cksum 0xcb97 (correct), seq 1045:2089, ack 2088, win 1332, options [nop,nop,TS val 278822255 ecr 278822252], length 1044
1527821740.139018 IP (tos 0x0, ttl 64, id 53265, offset 0, flags [DF], proto TCP (6), length 52)
    rpi33.lan.36522 > rpi36.lan.46656: Flags [.], cksum 0x8484 (incorrect -> 0x74a5), ack 2089, win 1323, options [nop,nop,TS val 278822255 ecr 278822255], length 0
1527821740.140397 IP (tos 0x0, ttl 64, id 8674, offset 0, flags [DF], proto TCP (6), length 1096)
    rpi46.lan.34468 > rpi33.lan.46656: Flags [P.], cksum 0x11be (correct), seq 1045:2089, ack 2088, win 1324, options [nop,nop,TS val 3428716088 ecr 278822252], length 1044
1527821740.140461 IP (tos 0x0, ttl 64, id 38291, offset 0, flags [DF], proto TCP (6), length 52)
    rpi33.lan.46656 > rpi46.lan.34468: Flags [.], cksum 0x848e (incorrect -> 0xabbe), ack 2089, win 1331, options [nop,nop,TS val 278822255 ecr 3428716088], length 0
1527821740.148088 IP (tos 0x0, ttl 64, id 45877, offset 0, flags [DF], proto TCP (6), length 1096)
    rpi39.lan.46656 > rpi33.lan.55328: Flags [P.], cksum 0x368e (correct), seq 1045:2089, ack 2088, win 1332, options [nop,nop,TS val 278822256 ecr 278822252], length 1044
1527821740.148157 IP (tos 0x0, ttl 64, id 37456, offset 0, flags [DF], proto TCP (6), length 52)
    rpi33.lan.55328 > rpi39.lan.46656: Flags [.], cksum 0x8487 (incorrect -> 0x4e33), ack 2089, win 1323, options [nop,nop,TS val 278822256 ecr 278822256], length 0
1527821740.149543 IP (tos 0x0, ttl 64, id 62007, offset 0, flags [DF], proto TCP (6), length 1096)
    rpi47.lan.39312 > rpi33.lan.46656: Flags [P.], cksum 0x0430 (correct), seq 1045:2089, ack 2088, win 1324, options [nop,nop,TS val 278822252 ecr 278822252], length 1044
1527821740.149602 IP (tos 0x0, ttl 64, id 55464, offset 0, flags [DF], proto TCP (6), length 52)
    rpi33.lan.46656 > rpi47.lan.39312: Flags [.], cksum 0x848f (incorrect -> 0xc45a), ack 2089, win 1331, options [nop,nop,TS val 278822256 ecr 278822252], length 0
1527821741.878729 IP (tos 0x0, ttl 64, id 65254, offset 0, flags [DF], proto TCP (6), length 1096)
    rpi33.lan.46656 > rpi40.lan.33420: Flags [P.], cksum 0x0a41 (correct), seq 2088:3132, ack 3133, win 1332, options [nop,nop,TS val 278822429 ecr 278820080], length 1044
1527821741.879548 IP (tos 0x0, ttl 64, id 49749, offset 0, flags [DF], proto TCP (6), length 1096)
    rpi40.lan.33420 > rpi33.lan.46656: Flags [P.], cksum 0x397a (correct), seq 3133:4177, ack 2088, win 1324, options [nop,nop,TS val 278820254 ecr 278822255], length 1044
1527821741.879669 IP (tos 0x0, ttl 64, id 65255, offset 0, flags [DF], proto TCP (6), length 52)
    rpi33.lan.46656 > rpi40.lan.33420: Flags [.], cksum 0x8488 (incorrect -> 0x32cf), ack 4177, win 1331, options [nop,nop,TS val 278822429 ecr 278820254], length 0
1527821741.880172 IP (tos 0x0, ttl 64, id 65256, offset 0, flags [DF], proto TCP (6), length 1096)
    rpi33.lan.46656 > rpi40.lan.33420: Flags [P.], cksum 0xa4b4 (correct), seq 3132:4176, ack 4177, win 1332, options [nop,nop,TS val 278822429 ecr 278820254], length 1044
1527821741.880314 IP (tos 0x0, ttl 64, id 49750, offset 0, flags [DF], proto TCP (6), length 1096)
    rpi40.lan.33420 > rpi33.lan.46656: Flags [P.], cksum 0xcb89 (correct), seq 4177:5221, ack 3132, win 1324, options [nop,nop,TS val 278820254 ecr 278822429], length 1044
1527821741.924503 IP (tos 0x0, ttl 64, id 65257, offset 0, flags [DF], proto TCP (6), length 52)
    rpi33.lan.46656 > rpi40.lan.33420: Flags [.], cksum 0x8488 (incorrect -> 0x2aa1), ack 5221, win 1332, options [nop,nop,TS val 278822434 ecr 278820254], length 0
1527821741.926910 IP (tos 0x0, ttl 64, id 49751, offset 0, flags [DF], proto TCP (6), length 52)
    rpi40.lan.33420 > rpi33.lan.46656: Flags [.], cksum 0x2aa9 (correct), ack 4176, win 1324, options [nop,nop,TS val 278820259 ecr 278822429], length 0
1527821742.089709 IP (tos 0x0, ttl 64, id 19113, offset 0, flags [DF], proto TCP (6), length 1096)
    rpi35.lan.46656 > rpi33.lan.58960: Flags [P.], cksum 0xd239 (correct), seq 2088:3132, ack 2089, win 1332, options [nop,nop,TS val 278820972 ecr 278822252], length 1044
1527821742.107115 IP (tos 0x0, ttl 64, id 30005, offset 0, flags [DF], proto TCP (6), length 1096)
    rpi42.lan.47712 > rpi33.lan.46656: Flags [P.], cksum 0xee24 (correct), seq 2088:3132, ack 2089, win 1324, options [nop,nop,TS val 278822432 ecr 278822252], length 1044
1527821742.108488 IP (tos 0x0, ttl 64, id 65258, offset 0, flags [DF], proto TCP (6), length 1096)
    rpi33.lan.46656 > rpi40.lan.33420: Flags [P.], cksum 0xa926 (correct), seq 4176:5220, ack 5221, win 1332, options [nop,nop,TS val 278822452 ecr 278820259], length 1044
1527821742.108536 IP (tos 0x0, ttl 64, id 18759, offset 0, flags [DF], proto TCP (6), length 1096)
    rpi33.lan.46656 > rpi41.lan.46564: Flags [P.], cksum 0x4a78 (correct), seq 2088:3132, ack 2089, win 1332, options [nop,nop,TS val 278822452 ecr 1573093073], length 1044
1527821742.108888 IP (tos 0x0, ttl 64, id 4043, offset 0, flags [DF], proto TCP (6), length 1096)
    rpi33.lan.58960 > rpi35.lan.46656: Flags [P.], cksum 0x8897 (incorrect -> 0x2f55), seq 2089:3133, ack 3132, win 1324, options [nop,nop,TS val 278822452 ecr 278820972], length 1044
1527821742.108952 IP (tos 0x0, ttl 64, id 49702, offset 0, flags [DF], proto TCP (6), length 1096)
    rpi33.lan.46656 > rpi37.lan.36362: Flags [P.], cksum 0x791b (correct), seq 2088:3132, ack 2089, win 1332, options [nop,nop,TS val 278822452 ecr 278822238], length 1044
1527821742.109067 IP (tos 0x0, ttl 64, id 55465, offset 0, flags [DF], proto TCP (6), length 1096)
    rpi33.lan.46656 > rpi47.lan.39312: Flags [P.], cksum 0x315c (correct), seq 2088:3132, ack 2089, win 1332, options [nop,nop,TS val 278822452 ecr 278822252], length 1044
1527821742.109186 IP (tos 0x0, ttl 64, id 38542, offset 0, flags [DF], proto TCP (6), length 1096)
    rpi33.lan.46328 > rpi44.lan.46656: Flags [P.], cksum 0x88a0 (incorrect -> 0xc919), seq 2088:3132, ack 2089, win 1324, options [nop,nop,TS val 278822452 ecr 270965018], length 1044
1527821742.109212 IP (tos 0x0, ttl 64, id 57579, offset 0, flags [DF], proto TCP (6), length 1096)
    rpi33.lan.46656 > rpi42.lan.47712: Flags [P.], cksum 0x01bf (correct), seq 2089:3133, ack 3132, win 1332, options [nop,nop,TS val 278822452 ecr 278822432], length 1044
1527821742.109276 IP (tos 0x0, ttl 64, id 38292, offset 0, flags [DF], proto TCP (6), length 1096)
    rpi33.lan.46656 > rpi46.lan.34468: Flags [P.], cksum 0x7f4c (correct), seq 2088:3132, ack 2089, win 1332, options [nop,nop,TS val 278822452 ecr 3428716088], length 1044
1527821742.109349 IP (tos 0x0, ttl 64, id 49752, offset 0, flags [DF], proto TCP (6), length 52)
    rpi40.lan.33420 > rpi33.lan.46656: Flags [.], cksum 0x266d (correct), ack 5220, win 1323, options [nop,nop,TS val 278820277 ecr 278822452], length 0
1527821742.109414 IP (tos 0x0, ttl 64, id 53266, offset 0, flags [DF], proto TCP (6), length 1096)
    rpi33.lan.36522 > rpi36.lan.46656: Flags [P.], cksum 0x8898 (incorrect -> 0x3270), seq 2088:3132, ack 2089, win 1324, options [nop,nop,TS val 278822452 ecr 278822255], length 1044
1527821742.109480 IP (tos 0x0, ttl 64, id 2592, offset 0, flags [DF], proto TCP (6), length 1096)
    rpi33.lan.44546 > rpi38.lan.46656: Flags [P.], cksum 0x889a (incorrect -> 0x2c96), seq 2088:3132, ack 2089, win 1324, options [nop,nop,TS val 278822452 ecr 278820786], length 1044
1527821742.109664 IP (tos 0x0, ttl 64, id 19114, offset 0, flags [DF], proto TCP (6), length 52)
    rpi35.lan.46656 > rpi33.lan.58960: Flags [.], cksum 0xac04 (correct), ack 3133, win 1331, options [nop,nop,TS val 278820974 ecr 278822452], length 0
1527821742.109776 IP (tos 0x0, ttl 64, id 37457, offset 0, flags [DF], proto TCP (6), length 1096)
    rpi33.lan.55328 > rpi39.lan.46656: Flags [P.], cksum 0x889b (incorrect -> 0xd2ed), seq 2088:3132, ack 2089, win 1324, options [nop,nop,TS val 278822452 ecr 278822256], length 1044
1527821742.109802 IP (tos 0x0, ttl 64, id 8898, offset 0, flags [DF], proto TCP (6), length 1096)
    rpi33.lan.46656 > rpi34.lan.52044: Flags [P.], cksum 0x7936 (correct), seq 2088:3132, ack 2089, win 1332, options [nop,nop,TS val 278822452 ecr 278822263], length 1044
1527821742.109956 IP (tos 0x0, ttl 64, id 55726, offset 0, flags [DF], proto TCP (6), length 1096)
    rpi33.lan.36124 > rpi45.lan.46656: Flags [P.], cksum 0x88a1 (incorrect -> 0x1258), seq 4177:5221, ack 4176, win 1324, options [nop,nop,TS val 278822452 ecr 278820229], length 1044
1527821742.109959 IP (tos 0x0, ttl 64, id 62008, offset 0, flags [DF], proto TCP (6), length 52)
    rpi47.lan.39312 > rpi33.lan.46656: Flags [.], cksum 0xbec6 (correct), ack 3132, win 1323, options [nop,nop,TS val 278822448 ecr 278822452], length 0
1527821742.109960 IP (tos 0x0, ttl 64, id 30006, offset 0, flags [DF], proto TCP (6), length 52)
    rpi42.lan.47712 > rpi33.lan.46656: Flags [.], cksum 0x1497 (correct), ack 3133, win 1323, options [nop,nop,TS val 278822432 ecr 278822452], length 0
1527821742.110176 IP (tos 0x0, ttl 64, id 55496, offset 0, flags [DF], proto TCP (6), length 1096)
    rpi33.lan.50564 > rpi43.lan.46656: Flags [P.], cksum 0x889f (incorrect -> 0x395c), seq 2088:3132, ack 2089, win 1324, options [nop,nop,TS val 278822452 ecr 278822240], length 1044
1527821742.110680 IP (tos 0x0, ttl 64, id 45878, offset 0, flags [DF], proto TCP (6), length 52)
    rpi39.lan.46656 > rpi33.lan.55328: Flags [.], cksum 0x488f (correct), ack 3132, win 1331, options [nop,nop,TS val 278822452 ecr 278822452], length 0
1527821742.114478 IP (tos 0x0, ttl 64, id 36109, offset 0, flags [DF], proto TCP (6), length 1096)
    rpi43.lan.46656 > rpi33.lan.50564: Flags [P.], cksum 0xd253 (correct), seq 2089:3133, ack 3132, win 1332, options [nop,nop,TS val 278822440 ecr 278822452], length 1044
1527821742.114563 IP (tos 0x0, ttl 64, id 55497, offset 0, flags [DF], proto TCP (6), length 52)
    rpi33.lan.50564 > rpi43.lan.46656: Flags [.], cksum 0x848b (incorrect -> 0x7f14), ack 3133, win 1323, options [nop,nop,TS val 278822453 ecr 278822440], length 0
1527821742.122967 IP (tos 0x0, ttl 64, id 12927, offset 0, flags [DF], proto TCP (6), length 1096)
    rpi38.lan.46656 > rpi33.lan.44546: Flags [P.], cksum 0xd1c5 (correct), seq 2089:3133, ack 3132, win 1332, options [nop,nop,TS val 278820986 ecr 278822452], length 1044
1527821742.123046 IP (tos 0x0, ttl 64, id 2593, offset 0, flags [DF], proto TCP (6), length 52)
    rpi33.lan.44546 > rpi38.lan.46656: Flags [.], cksum 0x8486 (incorrect -> 0x54b0), ack 3133, win 1323, options [nop,nop,TS val 278822453 ecr 278820986], length 0
1527821742.130490 IP (tos 0x0, ttl 64, id 19622, offset 0, flags [DF], proto TCP (6), length 1096)
    rpi44.lan.46656 > rpi33.lan.46328: Flags [P.], cksum 0x44b8 (correct), seq 2089:3133, ack 3132, win 1332, options [nop,nop,TS val 270965219 ecr 278822452], length 1044
1527821742.130574 IP (tos 0x0, ttl 64, id 38543, offset 0, flags [DF], proto TCP (6), length 52)
    rpi33.lan.46328 > rpi44.lan.46656: Flags [.], cksum 0x848c (incorrect -> 0x711a), ack 3133, win 1323, options [nop,nop,TS val 278822454 ecr 270965219], length 0
1527821742.137696 IP (tos 0x0, ttl 64, id 51646, offset 0, flags [DF], proto TCP (6), length 1096)
    rpi37.lan.36362 > rpi33.lan.46656: Flags [P.], cksum 0x52dc (correct), seq 2089:3133, ack 3132, win 1324, options [nop,nop,TS val 278822439 ecr 278822452], length 1044
1527821742.137777 IP (tos 0x0, ttl 64, id 49703, offset 0, flags [DF], proto TCP (6), length 52)
    rpi33.lan.46656 > rpi37.lan.36362: Flags [.], cksum 0x8485 (incorrect -> 0xbf96), ack 3133, win 1331, options [nop,nop,TS val 278822455 ecr 278822439], length 0
1527821742.140700 IP (tos 0x0, ttl 64, id 34348, offset 0, flags [DF], proto TCP (6), length 1096)
    rpi45.lan.46656 > rpi33.lan.36124: Flags [P.], cksum 0x5661 (correct), seq 4176:5220, ack 5221, win 1332, options [nop,nop,TS val 278820429 ecr 278822452], length 1044
1527821742.140776 IP (tos 0x0, ttl 64, id 55727, offset 0, flags [DF], proto TCP (6), length 52)
    rpi33.lan.36124 > rpi45.lan.46656: Flags [.], cksum 0x848d (incorrect -> 0xf7ce), ack 5220, win 1323, options [nop,nop,TS val 278822455 ecr 278820429], length 0
1527821742.140898 IP (tos 0x0, ttl 64, id 9438, offset 0, flags [DF], proto TCP (6), length 1096)
    rpi34.lan.52044 > rpi33.lan.46656: Flags [P.], cksum 0x2f76 (correct), seq 2089:3133, ack 3132, win 1324, options [nop,nop,TS val 278822464 ecr 278822452], length 1044
1527821742.140959 IP (tos 0x0, ttl 64, id 8899, offset 0, flags [DF], proto TCP (6), length 52)
    rpi33.lan.46656 > rpi34.lan.52044: Flags [.], cksum 0x8482 (incorrect -> 0x0cb7), ack 3133, win 1331, options [nop,nop,TS val 278822455 ecr 278822464], length 0
1527821742.141264 IP (tos 0x0, ttl 64, id 49753, offset 0, flags [DF], proto TCP (6), length 1096)
    rpi40.lan.33420 > rpi33.lan.46656: Flags [P.], cksum 0x311a (correct), seq 5221:6265, ack 5220, win 1324, options [nop,nop,TS val 278820280 ecr 278822452], length 1044
1527821742.141323 IP (tos 0x0, ttl 64, id 65259, offset 0, flags [DF], proto TCP (6), length 52)
    rpi33.lan.46656 > rpi40.lan.33420: Flags [.], cksum 0x8488 (incorrect -> 0x224b), ack 6265, win 1331, options [nop,nop,TS val 278822455 ecr 278820280], length 0
1527821742.141709 IP (tos 0x0, ttl 64, id 19152, offset 0, flags [DF], proto TCP (6), length 1096)
    rpi36.lan.46656 > rpi33.lan.36522: Flags [P.], cksum 0x8119 (correct), seq 2089:3133, ack 3132, win 1332, options [nop,nop,TS val 278822455 ecr 278822452], length 1044
1527821742.141774 IP (tos 0x0, ttl 64, id 53267, offset 0, flags [DF], proto TCP (6), length 52)
    rpi33.lan.36522 > rpi36.lan.46656: Flags [.], cksum 0x8484 (incorrect -> 0x6aed), ack 3133, win 1323, options [nop,nop,TS val 278822455 ecr 278822455], length 0
1527821742.141885 IP (tos 0x0, ttl 64, id 56713, offset 0, flags [DF], proto TCP (6), length 1096)
    rpi41.lan.46564 > rpi33.lan.46656: Flags [P.], cksum 0x76b0 (correct), seq 2089:3133, ack 3132, win 1324, options [nop,nop,TS val 1573095077 ecr 278822452], length 1044
1527821742.141944 IP (tos 0x0, ttl 64, id 18760, offset 0, flags [DF], proto TCP (6), length 52)
    rpi33.lan.46656 > rpi41.lan.46564: Flags [.], cksum 0x8489 (incorrect -> 0x3064), ack 3133, win 1331, options [nop,nop,TS val 278822455 ecr 1573095077], length 0
1527821742.142792 IP (tos 0x0, ttl 64, id 8675, offset 0, flags [DF], proto TCP (6), length 1096)
    rpi46.lan.34468 > rpi33.lan.46656: Flags [P.], cksum 0xe55f (correct), seq 2089:3133, ack 3132, win 1324, options [nop,nop,TS val 3428718090 ecr 278822452], length 1044
1527821742.142869 IP (tos 0x0, ttl 64, id 38293, offset 0, flags [DF], proto TCP (6), length 52)
    rpi33.lan.46656 > rpi46.lan.34468: Flags [.], cksum 0x848e (incorrect -> 0x9afc), ack 3133, win 1331, options [nop,nop,TS val 278822455 ecr 3428718090], length 0
1527821742.151330 IP (tos 0x0, ttl 64, id 45879, offset 0, flags [DF], proto TCP (6), length 1096)
    rpi39.lan.46656 > rpi33.lan.55328: Flags [P.], cksum 0xb95b (correct), seq 2089:3133, ack 3132, win 1332, options [nop,nop,TS val 278822456 ecr 278822452], length 1044
1527821742.151402 IP (tos 0x0, ttl 64, id 37458, offset 0, flags [DF], proto TCP (6), length 52)
    rpi33.lan.55328 > rpi39.lan.46656: Flags [.], cksum 0x8487 (incorrect -> 0x447b), ack 3133, win 1323, options [nop,nop,TS val 278822456 ecr 278822456], length 0
1527821742.154067 IP (tos 0x0, ttl 64, id 62009, offset 0, flags [DF], proto TCP (6), length 1096)
