1527821366.479765 IP (tos 0x0, ttl 64, id 17230, offset 0, flags [DF], proto TCP (6), length 1096)
    rpi44.lan.46656 > rpi33.lan.46328: Flags [P.], cksum 0x95e4 (correct), seq 3741566205:3741567249, ack 2682211242, win 1332, options [nop,nop,TS val 270927653 ecr 278784821], length 1044
1527821366.479858 IP (tos 0x0, ttl 64, id 36075, offset 0, flags [DF], proto TCP (6), length 1096)
    rpi33.lan.46328 > rpi44.lan.46656: Flags [P.], cksum 0x88a0 (incorrect -> 0x8c0f), seq 1:1045, ack 0, win 1324, options [nop,nop,TS val 278784889 ecr 270927585], length 1044
1527821366.480593 IP (tos 0x0, ttl 64, id 36076, offset 0, flags [DF], proto TCP (6), length 1096)
    rpi33.lan.46328 > rpi44.lan.46656: Flags [P.], cksum 0x88a0 (incorrect -> 0x8c69), seq 1045:2089, ack 1044, win 1324, options [nop,nop,TS val 278784889 ecr 270927653], length 1044
1527821366.480712 IP (tos 0x0, ttl 64, id 17231, offset 0, flags [DF], proto TCP (6), length 52)
    rpi44.lan.46656 > rpi33.lan.46328: Flags [.], cksum 0xd6d4 (correct), ack 1045, win 1331, options [nop,nop,TS val 270927654 ecr 278784889], length 0
1527821366.481386 IP (tos 0x0, ttl 64, id 17232, offset 0, flags [DF], proto TCP (6), length 1096)
    rpi44.lan.46656 > rpi33.lan.46328: Flags [P.], cksum 0xd14b (correct), seq 1044:2088, ack 1045, win 1332, options [nop,nop,TS val 270927654 ecr 278784889], length 1044
1527821366.524506 IP (tos 0x0, ttl 64, id 36077, offset 0, flags [DF], proto TCP (6), length 52)
    rpi33.lan.46328 > rpi44.lan.46656: Flags [.], cksum 0x848c (incorrect -> 0xceae), ack 2088, win 1324, options [nop,nop,TS val 278784894 ecr 270927654], length 0
1527821366.529648 IP (tos 0x0, ttl 64, id 17233, offset 0, flags [DF], proto TCP (6), length 52)
    rpi44.lan.46656 > rpi33.lan.46328: Flags [.], cksum 0xcea6 (correct), ack 2089, win 1332, options [nop,nop,TS val 270927659 ecr 278784889], length 0
1527821367.768834 IP (tos 0x0, ttl 64, id 16612, offset 0, flags [DF], proto TCP (6), length 1096)
    rpi36.lan.46656 > rpi33.lan.36522: Flags [P.], cksum 0x6dcd (correct), seq 283879025:283880069, ack 866399420, win 1332, options [nop,nop,TS val 278785018 ecr 278784821], length 1044
1527821367.772165 IP (tos 0x0, ttl 64, id 54310, offset 0, flags [DF], proto TCP (6), length 1096)
    rpi41.lan.46564 > rpi33.lan.46656: Flags [P.], cksum 0xe375 (correct), seq 2992790967:2992792011, ack 1828385575, win 1324, options [nop,nop,TS val 1572720704 ecr 278784821], length 1044
1527821367.772381 IP (tos 0x0, ttl 64, id 6219, offset 0, flags [DF], proto TCP (6), length 1096)
    rpi46.lan.34468 > rpi33.lan.46656: Flags [P.], cksum 0xd1ad (correct), seq 3583393251:3583394295, ack 2571382888, win 1324, options [nop,nop,TS val 3428343719 ecr 278784821], length 1044
1527821367.778379 IP (tos 0x0, ttl 64, id 47432, offset 0, flags [DF], proto TCP (6), length 1096)
    rpi40.lan.33420 > rpi33.lan.46656: Flags [P.], cksum 0x7261 (correct), seq 3626835941:3626836985, ack 1182382505, win 1324, options [nop,nop,TS val 278782844 ecr 278784821], length 1044
1527821367.784786 IP (tos 0x0, ttl 64, id 7027, offset 0, flags [DF], proto TCP (6), length 1096)
    rpi34.lan.52044 > rpi33.lan.46656: Flags [P.], cksum 0x3369 (correct), seq 2387845565:2387846609, ack 3078025374, win 1324, options [nop,nop,TS val 278785028 ecr 278784821], length 1044
1527821367.787876 IP (tos 0x0, ttl 64, id 59694, offset 0, flags [DF], proto TCP (6), length 1096)
    rpi47.lan.39312 > rpi33.lan.46656: Flags [P.], cksum 0x8a4f (correct), seq 1688118564:1688119608, ack 2020822236, win 1324, options [nop,nop,TS val 278785016 ecr 278784821], length 1044
1527821367.790291 IP (tos 0x0, ttl 64, id 43402, offset 0, flags [DF], proto TCP (6), length 1096)
    rpi39.lan.46656 > rpi33.lan.55328: Flags [P.], cksum 0x85b7 (correct), seq 3646848990:3646850034, ack 2976744665, win 1332, options [nop,nop,TS val 278785020 ecr 278784821], length 1044
1527821367.791021 IP (tos 0x0, ttl 64, id 27561, offset 0, flags [DF], proto TCP (6), length 1096)
    rpi42.lan.47712 > rpi33.lan.46656: Flags [P.], cksum 0xa8e1 (correct), seq 2824863296:2824864340, ack 3696598943, win 1324, options [nop,nop,TS val 278785000 ecr 278784821], length 1044
1527821367.791503 IP (tos 0x0, ttl 64, id 17234, offset 0, flags [DF], proto TCP (6), length 1096)
    rpi44.lan.46656 > rpi33.lan.46328: Flags [P.], cksum 0xd65f (correct), seq 2088:3132, ack 2089, win 1332, options [nop,nop,TS val 270927785 ecr 278784889], length 1044
1527821367.791591 IP (tos 0x0, ttl 64, id 36078, offset 0, flags [DF], proto TCP (6), length 52)
    rpi33.lan.46328 > rpi44.lan.46656: Flags [.], cksum 0x848c (incorrect -> 0xc99a), ack 3132, win 1323, options [nop,nop,TS val 278785020 ecr 270927785], length 0
1527821367.798441 IP (tos 0x0, ttl 64, id 50904, offset 0, flags [DF], proto TCP (6), length 1096)
    rpi33.lan.36522 > rpi36.lan.46656: Flags [P.], cksum 0x8898 (incorrect -> 0x612f), seq 1:1045, ack 1044, win 1324, options [nop,nop,TS val 278785021 ecr 278785018], length 1044
1527821367.798478 IP (tos 0x0, ttl 64, id 53054, offset 0, flags [DF], proto TCP (6), length 1096)
    rpi33.lan.50564 > rpi43.lan.46656: Flags [P.], cksum 0x889f (incorrect -> 0x1e98), seq 3552297318:3552298362, ack 3012127846, win 1324, options [nop,nop,TS val 278785021 ecr 278784811], length 1044
1527821367.798667 IP (tos 0x0, ttl 64, id 6501, offset 0, flags [DF], proto TCP (6), length 1096)
    rpi33.lan.46656 > rpi34.lan.52044: Flags [P.], cksum 0xf9d5 (correct), seq 1:1045, ack 1044, win 1332, options [nop,nop,TS val 278785021 ecr 278785028], length 1044
1527821367.798696 IP (tos 0x0, ttl 64, id 47315, offset 0, flags [DF], proto TCP (6), length 1096)
    rpi33.lan.46656 > rpi37.lan.36362: Flags [P.], cksum 0xd446 (correct), seq 4041387716:4041388760, ack 2176298607, win 1332, options [nop,nop,TS val 278785021 ecr 278784805], length 1044
1527821367.798869 IP (tos 0x0, ttl 64, id 16339, offset 0, flags [DF], proto TCP (6), length 1096)
    rpi33.lan.46656 > rpi41.lan.46564: Flags [P.], cksum 0x4c59 (correct), seq 1:1045, ack 1044, win 1332, options [nop,nop,TS val 278785021 ecr 1572720704], length 1044
1527821367.799050 IP (tos 0x0, ttl 64, id 16594, offset 0, flags [DF], proto TCP (6), length 1096)
    rpi35.lan.46656 > rpi33.lan.58960: Flags [P.], cksum 0x7038 (correct), seq 3976833849:3976834893, ack 369558318, win 1332, options [nop,nop,TS val 278783543 ecr 278784821], length 1044
1527821367.799127 IP (tos 0x0, ttl 64, id 1691, offset 0, flags [DF], proto TCP (6), length 52)
    rpi33.lan.58960 > rpi35.lan.46656: Flags [.], cksum 0x8483 (incorrect -> 0xa7a7), ack 1044, win 1323, options [nop,nop,TS val 278785021 ecr 278783543], length 0
1527821367.799214 IP (tos 0x0, ttl 64, id 55189, offset 0, flags [DF], proto TCP (6), length 1096)
    rpi33.lan.46656 > rpi42.lan.47712: Flags [P.], cksum 0xcd5b (correct), seq 1:1045, ack 1044, win 1332, options [nop,nop,TS val 278785021 ecr 278785000], length 1044
1527821367.799240 IP (tos 0x0, ttl 64, id 62798, offset 0, flags [DF], proto TCP (6), length 1096)
    rpi33.lan.46656 > rpi40.lan.33420: Flags [P.], cksum 0x491e (correct), seq 1:1045, ack 1044, win 1332, options [nop,nop,TS val 278785021 ecr 278782844], length 1044
1527821367.799346 IP (tos 0x0, ttl 64, id 16613, offset 0, flags [DF], proto TCP (6), length 52)
    rpi36.lan.46656 > rpi33.lan.36522: Flags [.], cksum 0x8726 (correct), ack 1045, win 1331, options [nop,nop,TS val 278785021 ecr 278785021], length 0
1527821367.799348 IP (tos 0x0, ttl 64, id 7028, offset 0, flags [DF], proto TCP (6), length 52)
    rpi34.lan.52044 > rpi33.lan.46656: Flags [.], cksum 0x921b (correct), ack 1045, win 1323, options [nop,nop,TS val 278785030 ecr 278785021], length 0
1527821367.799401 IP (tos 0x0, ttl 64, id 35046, offset 0, flags [DF], proto TCP (6), length 1096)
    rpi33.lan.55328 > rpi39.lan.46656: Flags [P.], cksum 0x889b (incorrect -> 0x727a), seq 1:1045, ack 1044, win 1324, options [nop,nop,TS val 278785021 ecr 278785020], length 1044
1527821367.799442 IP (tos 0x0, ttl 64, id 197, offset 0, flags [DF], proto TCP (6), length 1096)
    rpi33.lan.44546 > rpi38.lan.46656: Flags [P.], cksum 0x889a (incorrect -> 0x7ca5), seq 1214773007:1214774051, ack 3775468630, win 1324, options [nop,nop,TS val 278785021 ecr 278783354], length 1044
1527821367.799615 IP (tos 0x0, ttl 64, id 36079, offset 0, flags [DF], proto TCP (6), length 1096)
    rpi33.lan.46328 > rpi44.lan.46656: Flags [P.], cksum 0x88a0 (incorrect -> 0x4623), seq 2089:3133, ack 3132, win 1324, options [nop,nop,TS val 278785021 ecr 270927785], length 1044
1527821367.799641 IP (tos 0x0, ttl 64, id 54311, offset 0, flags [DF], proto TCP (6), length 52)
    rpi41.lan.46564 > rpi33.lan.46656: Flags [.], cksum 0xddf0 (correct), ack 1045, win 1323, options [nop,nop,TS val 1572720732 ecr 278785021], length 0
1527821367.799646 IP (tos 0x0, ttl 64, id 53249, offset 0, flags [DF], proto TCP (6), length 1096)
    rpi33.lan.36124 > rpi45.lan.46656: Flags [P.], cksum 0x88a1 (incorrect -> 0xf031), seq 2728561287:2728562331, ack 1424575508, win 1324, options [nop,nop,TS val 278785021 ecr 278782798], length 1044
1527821367.799921 IP (tos 0x0, ttl 64, id 1692, offset 0, flags [DF], proto TCP (6), length 1096)
    rpi33.lan.58960 > rpi35.lan.46656: Flags [P.], cksum 0x8897 (incorrect -> 0x495e), seq 1:1045, ack 1044, win 1324, options [nop,nop,TS val 278785021 ecr 278783543], length 1044
1527821367.799977 IP (tos 0x0, ttl 64, id 27562, offset 0, flags [DF], proto TCP (6), length 52)
    rpi42.lan.47712 > rpi33.lan.46656: Flags [.], cksum 0x58ad (correct), ack 1045, win 1323, options [nop,nop,TS val 278785001 ecr 278785021], length 0
1527821367.799978 IP (tos 0x0, ttl 64, id 47433, offset 0, flags [DF], proto TCP (6), length 52)
    rpi40.lan.33420 > rpi33.lan.46656: Flags [.], cksum 0xc34e (correct), ack 1045, win 1323, options [nop,nop,TS val 278782846 ecr 278785021], length 0
1527821367.800157 IP (tos 0x0, ttl 64, id 43403, offset 0, flags [DF], proto TCP (6), length 52)
    rpi39.lan.46656 > rpi33.lan.55328: Flags [.], cksum 0xcde5 (correct), ack 1045, win 1331, options [nop,nop,TS val 278785021 ecr 278785021], length 0
1527821367.800395 IP (tos 0x0, ttl 64, id 17235, offset 0, flags [DF], proto TCP (6), length 52)
    rpi44.lan.46656 > rpi33.lan.46328: Flags [.], cksum 0xc57c (correct), ack 3133, win 1331, options [nop,nop,TS val 270927786 ecr 278785021], length 0
1527821367.800548 IP (tos 0x0, ttl 64, id 52982, offset 0, flags [DF], proto TCP (6), length 1096)
    rpi33.lan.46656 > rpi47.lan.39312: Flags [P.], cksum 0x4140 (correct), seq 1:1045, ack 1044, win 1332, options [nop,nop,TS val 278785021 ecr 278785016], length 1044
1527821367.800577 IP (tos 0x0, ttl 64, id 35916, offset 0, flags [DF], proto TCP (6), length 1096)
    rpi33.lan.46656 > rpi46.lan.34468: Flags [P.], cksum 0xba74 (correct), seq 1:1045, ack 1044, win 1332, options [nop,nop,TS val 278785021 ecr 3428343719], length 1044
1527821367.800715 IP (tos 0x0, ttl 64, id 16595, offset 0, flags [DF], proto TCP (6), length 52)
    rpi35.lan.46656 > rpi33.lan.58960: Flags [.], cksum 0xa38b (correct), ack 1045, win 1331, options [nop,nop,TS val 278783543 ecr 278785021], length 0
1527821367.801372 IP (tos 0x0, ttl 64, id 6220, offset 0, flags [DF], proto TCP (6), length 52)
    rpi46.lan.34468 > rpi33.lan.46656: Flags [.], cksum 0xa23e (correct), ack 1045, win 1323, options [nop,nop,TS val 3428343748 ecr 278785021], length 0
1527821367.801373 IP (tos 0x0, ttl 64, id 59695, offset 0, flags [DF], proto TCP (6), length 52)
    rpi47.lan.39312 > rpi33.lan.46656: Flags [.], cksum 0xcceb (correct), ack 1045, win 1323, options [nop,nop,TS val 278785017 ecr 278785021], length 0
1527821367.804018 IP (tos 0x0, ttl 64, id 49182, offset 0, flags [DF], proto TCP (6), length 1096)
    rpi37.lan.36362 > rpi33.lan.46656: Flags [P.], cksum 0xf7f6 (correct), seq 1:1045, ack 1044, win 1324, options [nop,nop,TS val 278785006 ecr 278785021], length 1044
1527821367.804085 IP (tos 0x0, ttl 64, id 47316, offset 0, flags [DF], proto TCP (6), length 52)
    rpi33.lan.46656 > rpi37.lan.36362: Flags [.], cksum 0x8485 (incorrect -> 0xd7c2), ack 1045, win 1331, options [nop,nop,TS val 278785021 ecr 278785006], length 0
1527821367.809301 IP (tos 0x0, ttl 64, id 10422, offset 0, flags [DF], proto TCP (6), length 1096)
    rpi38.lan.46656 > rpi33.lan.44546: Flags [P.], cksum 0x9551 (correct), seq 1:1045, ack 1044, win 1332, options [nop,nop,TS val 278783555 ecr 278785021], length 1044
1527821367.809387 IP (tos 0x0, ttl 64, id 198, offset 0, flags [DF], proto TCP (6), length 52)
    rpi33.lan.44546 > rpi38.lan.46656: Flags [.], cksum 0x8486 (incorrect -> 0x5873), ack 1045, win 1323, options [nop,nop,TS val 278785022 ecr 278783555], length 0
1527821367.821127 IP (tos 0x0, ttl 64, id 33744, offset 0, flags [DF], proto TCP (6), length 1096)
    rpi43.lan.46656 > rpi33.lan.50564: Flags [P.], cksum 0x3b2b (correct), seq 1:1045, ack 1044, win 1332, options [nop,nop,TS val 278785011 ecr 278785021], length 1044
1527821367.821219 IP (tos 0x0, ttl 64, id 53055, offset 0, flags [DF], proto TCP (6), length 52)
    rpi33.lan.50564 > rpi43.lan.46656: Flags [.], cksum 0x848b (incorrect -> 0xbaff), ack 1045, win 1323, options [nop,nop,TS val 278785023 ecr 278785011], length 0
1527821367.834736 IP (tos 0x0, ttl 64, id 32027, offset 0, flags [DF], proto TCP (6), length 1096)
    rpi45.lan.46656 > rpi33.lan.36124: Flags [P.], cksum 0x7c77 (correct), seq 1:1045, ack 1044, win 1332, options [nop,nop,TS val 278782998 ecr 278785021], length 1044
1527821367.834834 IP (tos 0x0, ttl 64, id 53250, offset 0, flags [DF], proto TCP (6), length 52)
    rpi33.lan.36124 > rpi45.lan.46656: Flags [.], cksum 0x848d (incorrect -> 0xe22b), ack 1045, win 1323, options [nop,nop,TS val 278785025 ecr 278782998], length 0
1527821368.319651 IP (tos 0x0, ttl 64, id 35047, offset 0, flags [DF], proto TCP (6), length 1096)
    rpi33.lan.55328 > rpi39.lan.46656: Flags [P.], cksum 0x889b (incorrect -> 0xfce6), seq 1045:2089, ack 1044, win 1324, options [nop,nop,TS val 278785073 ecr 278785021], length 1044
1527821368.320536 IP (tos 0x0, ttl 64, id 43404, offset 0, flags [DF], proto TCP (6), length 1096)
    rpi39.lan.46656 > rpi33.lan.55328: Flags [P.], cksum 0x6bd4 (correct), seq 1044:2088, ack 1045, win 1332, options [nop,nop,TS val 278785073 ecr 278785021], length 1044
1527821368.320539 IP (tos 0x0, ttl 64, id 43405, offset 0, flags [DF], proto TCP (6), length 52)
    rpi39.lan.46656 > rpi33.lan.55328: Flags [.], cksum 0xc555 (correct), ack 2089, win 1331, options [nop,nop,TS val 278785073 ecr 278785073], length 0
1527821368.321209 IP (tos 0x0, ttl 64, id 43406, offset 0, flags [DF], proto TCP (6), length 1096)
    rpi39.lan.46656 > rpi33.lan.55328: Flags [P.], cksum 0x5f17 (correct), seq 2088:3132, ack 2089, win 1332, options [nop,nop,TS val 278785073 ecr 278785073], length 1044
1527821368.321303 IP (tos 0x0, ttl 64, id 35048, offset 0, flags [DF], proto TCP (6), length 1096)
    rpi33.lan.55328 > rpi39.lan.46656: Flags [P.], cksum 0x889b (incorrect -> 0xcd98), seq 2089:3133, ack 3132, win 1323, options [nop,nop,TS val 278785073 ecr 278785073], length 1044
1527821368.364561 IP (tos 0x0, ttl 64, id 43407, offset 0, flags [DF], proto TCP (6), length 52)
    rpi39.lan.46656 > rpi33.lan.55328: Flags [.], cksum 0xbd27 (correct), ack 3133, win 1332, options [nop,nop,TS val 278785078 ecr 278785073], length 0
1527821369.772829 IP (tos 0x0, ttl 64, id 16614, offset 0, flags [DF], proto TCP (6), length 1096)
    rpi36.lan.46656 > rpi33.lan.36522: Flags [P.], cksum 0x1fc6 (correct), seq 1044:2088, ack 1045, win 1332, options [nop,nop,TS val 278785218 ecr 278785021], length 1044
1527821369.775679 IP (tos 0x0, ttl 64, id 6221, offset 0, flags [DF], proto TCP (6), length 1096)
    rpi46.lan.34468 > rpi33.lan.46656: Flags [P.], cksum 0x81d9 (correct), seq 1044:2088, ack 1045, win 1324, options [nop,nop,TS val 3428345722 ecr 278785021], length 1044
1527821369.776012 IP (tos 0x0, ttl 64, id 54312, offset 0, flags [DF], proto TCP (6), length 1096)
    rpi41.lan.46564 > rpi33.lan.46656: Flags [P.], cksum 0xb06b (correct), seq 1044:2088, ack 1045, win 1324, options [nop,nop,TS val 1572722708 ecr 278785021], length 1044
1527821369.782184 IP (tos 0x0, ttl 64, id 47434, offset 0, flags [DF], proto TCP (6), length 1096)
    rpi40.lan.33420 > rpi33.lan.46656: Flags [P.], cksum 0xf95f (correct), seq 1044:2088, ack 1045, win 1324, options [nop,nop,TS val 278783044 ecr 278785021], length 1044
1527821369.788708 IP (tos 0x0, ttl 64, id 7029, offset 0, flags [DF], proto TCP (6), length 1096)
    rpi34.lan.52044 > rpi33.lan.46656: Flags [P.], cksum 0xf083 (correct), seq 1044:2088, ack 1045, win 1324, options [nop,nop,TS val 278785228 ecr 278785021], length 1044
1527821369.793736 IP (tos 0x0, ttl 64, id 43408, offset 0, flags [DF], proto TCP (6), length 1096)
    rpi39.lan.46656 > rpi33.lan.55328: Flags [P.], cksum 0x3fd9 (correct), seq 3132:4176, ack 3133, win 1332, options [nop,nop,TS val 278785220 ecr 278785073], length 1044
1527821369.794219 IP (tos 0x0, ttl 64, id 27563, offset 0, flags [DF], proto TCP (6), length 1096)
    rpi42.lan.47712 > rpi33.lan.46656: Flags [P.], cksum 0x3897 (correct), seq 1044:2088, ack 1045, win 1324, options [nop,nop,TS val 278785201 ecr 278785021], length 1044
1527821369.795755 IP (tos 0x0, ttl 64, id 17236, offset 0, flags [DF], proto TCP (6), length 1096)
    rpi44.lan.46656 > rpi33.lan.46328: Flags [P.], cksum 0x0b8b (correct), seq 3132:4176, ack 3133, win 1332, options [nop,nop,TS val 270927985 ecr 278785021], length 1044
1527821369.796496 IP (tos 0x0, ttl 64, id 59696, offset 0, flags [DF], proto TCP (6), length 1096)
    rpi47.lan.39312 > rpi33.lan.46656: Flags [P.], cksum 0x0ac3 (correct), seq 1044:2088, ack 1045, win 1324, options [nop,nop,TS val 278785217 ecr 278785021], length 1044
1527821369.801686 IP (tos 0x0, ttl 64, id 53056, offset 0, flags [DF], proto TCP (6), length 1096)
    rpi33.lan.50564 > rpi43.lan.46656: Flags [P.], cksum 0x889f (incorrect -> 0xa1b3), seq 1044:2088, ack 1045, win 1324, options [nop,nop,TS val 278785221 ecr 278785011], length 1044
1527821369.801730 IP (tos 0x0, ttl 64, id 6502, offset 0, flags [DF], proto TCP (6), length 1096)
    rpi33.lan.46656 > rpi34.lan.52044: Flags [P.], cksum 0x0cf0 (correct), seq 1045:2089, ack 2088, win 1332, options [nop,nop,TS val 278785221 ecr 278785228], length 1044
1527821369.801749 IP (tos 0x0, ttl 64, id 35049, offset 0, flags [DF], proto TCP (6), length 1096)
    rpi33.lan.55328 > rpi39.lan.46656: Flags [P.], cksum 0x889b (incorrect -> 0x0b35), seq 3133:4177, ack 4176, win 1324, options [nop,nop,TS val 278785221 ecr 278785220], length 1044
1527821369.801937 IP (tos 0x0, ttl 64, id 50905, offset 0, flags [DF], proto TCP (6), length 1096)
    rpi33.lan.36522 > rpi36.lan.46656: Flags [P.], cksum 0x8898 (incorrect -> 0x81b7), seq 1045:2089, ack 2088, win 1324, options [nop,nop,TS val 278785221 ecr 278785218], length 1044
1527821369.802007 IP (tos 0x0, ttl 64, id 16596, offset 0, flags [DF], proto TCP (6), length 1096)
    rpi35.lan.46656 > rpi33.lan.58960: Flags [P.], cksum 0xe917 (correct), seq 1044:2088, ack 1045, win 1332, options [nop,nop,TS val 278783743 ecr 278785021], length 1044
1527821369.802122 IP (tos 0x0, ttl 64, id 52983, offset 0, flags [DF], proto TCP (6), length 1096)
    rpi33.lan.46656 > rpi47.lan.39312: Flags [P.], cksum 0x8461 (correct), seq 1045:2089, ack 2088, win 1332, options [nop,nop,TS val 278785221 ecr 278785217], length 1044
1527821369.802153 IP (tos 0x0, ttl 64, id 16340, offset 0, flags [DF], proto TCP (6), length 1096)
    rpi33.lan.46656 > rpi41.lan.46564: Flags [P.], cksum 0x695e (correct), seq 1045:2089, ack 2088, win 1332, options [nop,nop,TS val 278785221 ecr 1572722708], length 1044
1527821369.802184 IP (tos 0x0, ttl 64, id 53251, offset 0, flags [DF], proto TCP (6), length 1096)
    rpi33.lan.36124 > rpi45.lan.46656: Flags [P.], cksum 0x88a1 (incorrect -> 0x7779), seq 1044:2088, ack 1045, win 1324, options [nop,nop,TS val 278785221 ecr 278782998], length 1044
1527821369.802333 IP (tos 0x0, ttl 64, id 36080, offset 0, flags [DF], proto TCP (6), length 1096)
    rpi33.lan.46328 > rpi44.lan.46656: Flags [P.], cksum 0x88a0 (incorrect -> 0x1b9c), seq 3133:4177, ack 4176, win 1324, options [nop,nop,TS val 278785221 ecr 270927985], length 1044
1527821369.802367 IP (tos 0x0, ttl 64, id 47317, offset 0, flags [DF], proto TCP (6), length 1096)
    rpi33.lan.46656 > rpi37.lan.36362: Flags [P.], cksum 0xfed6 (correct), seq 1044:2088, ack 1045, win 1332, options [nop,nop,TS val 278785221 ecr 278785006], length 1044
1527821369.802399 IP (tos 0x0, ttl 64, id 55190, offset 0, flags [DF], proto TCP (6), length 1096)
    rpi33.lan.46656 > rpi42.lan.47712: Flags [P.], cksum 0x0aca (correct), seq 1045:2089, ack 2088, win 1332, options [nop,nop,TS val 278785221 ecr 278785201], length 1044
1527821369.802541 IP (tos 0x0, ttl 64, id 35917, offset 0, flags [DF], proto TCP (6), length 1096)
    rpi33.lan.46656 > rpi46.lan.34468: Flags [P.], cksum 0x0b66 (correct), seq 1045:2089, ack 2088, win 1332, options [nop,nop,TS val 278785221 ecr 3428345722], length 1044
1527821369.802577 IP (tos 0x0, ttl 64, id 62799, offset 0, flags [DF], proto TCP (6), length 1096)
    rpi33.lan.46656 > rpi40.lan.33420: Flags [P.], cksum 0x9684 (correct), seq 1045:2089, ack 2088, win 1332, options [nop,nop,TS val 278785221 ecr 278783044], length 1044
1527821369.802580 IP (tos 0x0, ttl 64, id 7030, offset 0, flags [DF], proto TCP (6), length 52)
    rpi34.lan.52044 > rpi33.lan.46656: Flags [.], cksum 0x8863 (correct), ack 2089, win 1323, options [nop,nop,TS val 278785230 ecr 278785221], length 0
1527821369.802604 IP (tos 0x0, ttl 64, id 1693, offset 0, flags [DF], proto TCP (6), length 1096)
    rpi33.lan.58960 > rpi35.lan.46656: Flags [P.], cksum 0x8897 (incorrect -> 0xbc1f), seq 1045:2089, ack 2088, win 1323, options [nop,nop,TS val 278785221 ecr 278783743], length 1044
1527821369.802583 IP (tos 0x0, ttl 64, id 43409, offset 0, flags [DF], proto TCP (6), length 52)
    rpi39.lan.46656 > rpi33.lan.55328: Flags [.], cksum 0xb3dd (correct), ack 4177, win 1331, options [nop,nop,TS val 278785221 ecr 278785221], length 0
1527821369.802761 IP (tos 0x0, ttl 64, id 199, offset 0, flags [DF], proto TCP (6), length 1096)
    rpi33.lan.44546 > rpi38.lan.46656: Flags [P.], cksum 0x889a (incorrect -> 0xe774), seq 1044:2088, ack 1045, win 1324, options [nop,nop,TS val 278785221 ecr 278783555], length 1044
1527821369.802797 IP (tos 0x0, ttl 64, id 16615, offset 0, flags [DF], proto TCP (6), length 52)
    rpi36.lan.46656 > rpi33.lan.36522: Flags [.], cksum 0x7d6e (correct), ack 2089, win 1331, options [nop,nop,TS val 278785221 ecr 278785221], length 0
1527821369.802949 IP (tos 0x0, ttl 64, id 54313, offset 0, flags [DF], proto TCP (6), length 52)
    rpi41.lan.46564 > rpi33.lan.46656: Flags [.], cksum 0xcd2d (correct), ack 2089, win 1323, options [nop,nop,TS val 1572722735 ecr 278785221], length 0
1527821369.802951 IP (tos 0x0, ttl 64, id 59697, offset 0, flags [DF], proto TCP (6), length 52)
    rpi47.lan.39312 > rpi33.lan.46656: Flags [.], cksum 0xc333 (correct), ack 2089, win 1323, options [nop,nop,TS val 278785217 ecr 278785221], length 0
1527821369.803156 IP (tos 0x0, ttl 64, id 17237, offset 0, flags [DF], proto TCP (6), length 52)
    rpi44.lan.46656 > rpi33.lan.46328: Flags [.], cksum 0xbbc4 (correct), ack 4177, win 1331, options [nop,nop,TS val 270927986 ecr 278785221], length 0
1527821369.803346 IP (tos 0x0, ttl 64, id 27564, offset 0, flags [DF], proto TCP (6), length 52)
    rpi42.lan.47712 > rpi33.lan.46656: Flags [.], cksum 0x4ef4 (correct), ack 2089, win 1323, options [nop,nop,TS val 278785202 ecr 278785221], length 0
1527821369.803347 IP (tos 0x0, ttl 64, id 6222, offset 0, flags [DF], proto TCP (6), length 52)
    rpi46.lan.34468 > rpi33.lan.46656: Flags [.], cksum 0x917c (correct), ack 2089, win 1323, options [nop,nop,TS val 3428345750 ecr 278785221], length 0
1527821369.803511 IP (tos 0x0, ttl 64, id 47435, offset 0, flags [DF], proto TCP (6), length 52)
    rpi40.lan.33420 > rpi33.lan.46656: Flags [.], cksum 0xb996 (correct), ack 2089, win 1323, options [nop,nop,TS val 278783046 ecr 278785221], length 0
1527821369.803512 IP (tos 0x0, ttl 64, id 16597, offset 0, flags [DF], proto TCP (6), length 52)
    rpi35.lan.46656 > rpi33.lan.58960: Flags [.], cksum 0x99d3 (correct), ack 2089, win 1331, options [nop,nop,TS val 278783743 ecr 278785221], length 0
1527821369.807502 IP (tos 0x0, ttl 64, id 49183, offset 0, flags [DF], proto TCP (6), length 1096)
    rpi37.lan.36362 > rpi33.lan.46656: Flags [P.], cksum 0x2b87 (correct), seq 1045:2089, ack 2088, win 1324, options [nop,nop,TS val 278785206 ecr 278785221], length 1044
1527821369.807577 IP (tos 0x0, ttl 64, id 47318, offset 0, flags [DF], proto TCP (6), length 52)
    rpi33.lan.46656 > rpi37.lan.36362: Flags [.], cksum 0x8485 (incorrect -> 0xce09), ack 2089, win 1331, options [nop,nop,TS val 278785222 ecr 278785206], length 0
1527821369.813626 IP (tos 0x0, ttl 64, id 10423, offset 0, flags [DF], proto TCP (6), length 1096)
    rpi38.lan.46656 > rpi33.lan.44546: Flags [P.], cksum 0xea87 (correct), seq 1045:2089, ack 2088, win 1332, options [nop,nop,TS val 278783755 ecr 278785221], length 1044
1527821369.813700 IP (tos 0x0, ttl 64, id 200, offset 0, flags [DF], proto TCP (6), length 52)
    rpi33.lan.44546 > rpi38.lan.46656: Flags [.], cksum 0x8486 (incorrect -> 0x4ebb), ack 2089, win 1323, options [nop,nop,TS val 278785222 ecr 278783755], length 0
1527821369.824392 IP (tos 0x0, ttl 64, id 33745, offset 0, flags [DF], proto TCP (6), length 1096)
    rpi43.lan.46656 > rpi33.lan.50564: Flags [P.], cksum 0xc4bb (correct), seq 1045:2089, ack 2088, win 1332, options [nop,nop,TS val 278785211 ecr 278785221], length 1044
1527821369.824477 IP (tos 0x0, ttl 64, id 53057, offset 0, flags [DF], proto TCP (6), length 52)
    rpi33.lan.50564 > rpi43.lan.46656: Flags [.], cksum 0x848b (incorrect -> 0xb147), ack 2089, win 1323, options [nop,nop,TS val 278785223 ecr 278785211], length 0
1527821369.838942 IP (tos 0x0, ttl 64, id 32028, offset 0, flags [DF], proto TCP (6), length 1096)
    rpi45.lan.46656 > rpi33.lan.36124: Flags [P.], cksum 0xcf4f (correct), seq 1045:2089, ack 2088, win 1332, options [nop,nop,TS val 278783199 ecr 278785221], length 1044
1527821369.839027 IP (tos 0x0, ttl 64, id 53252, offset 0, flags [DF], proto TCP (6), length 52)
    rpi33.lan.36124 > rpi45.lan.46656: Flags [.], cksum 0x848d (incorrect -> 0xd872), ack 2089, win 1323, options [nop,nop,TS val 278785225 ecr 278783199], length 0
1527821371.776309 IP (tos 0x0, ttl 64, id 16616, offset 0, flags [DF], proto TCP (6), length 1096)
    rpi36.lan.46656 > rpi33.lan.36522: Flags [P.], cksum 0x3460 (correct), seq 2088:3132, ack 2089, win 1332, options [nop,nop,TS val 278785418 ecr 278785221], length 1044
1527821371.777960 IP (tos 0x0, ttl 64, id 6223, offset 0, flags [DF], proto TCP (6), length 1096)
    rpi46.lan.34468 > rpi33.lan.46656: Flags [P.], cksum 0x7c79 (correct), seq 2088:3132, ack 2089, win 1324, options [nop,nop,TS val 3428347724 ecr 278785221], length 1044
1527821371.779133 IP (tos 0x0, ttl 64, id 54314, offset 0, flags [DF], proto TCP (6), length 1096)
    rpi41.lan.46564 > rpi33.lan.46656: Flags [P.], cksum 0x4746 (correct), seq 2088:3132, ack 2089, win 1324, options [nop,nop,TS val 1572724711 ecr 278785221], length 1044
1527821371.785336 IP (tos 0x0, ttl 64, id 47436, offset 0, flags [DF], proto TCP (6), length 1096)
    rpi40.lan.33420 > rpi33.lan.46656: Flags [P.], cksum 0x4c5b (correct), seq 2088:3132, ack 2089, win 1324, options [nop,nop,TS val 278783244 ecr 278785221], length 1044
1527821371.792073 IP (tos 0x0, ttl 64, id 7031, offset 0, flags [DF], proto TCP (6), length 1096)
    rpi34.lan.52044 > rpi33.lan.46656: Flags [P.], cksum 0xefc0 (correct), seq 2088:3132, ack 2089, win 1324, options [nop,nop,TS val 278785429 ecr 278785221], length 1044
1527821371.794817 IP (tos 0x0, ttl 64, id 59698, offset 0, flags [DF], proto TCP (6), length 1096)
    rpi47.lan.39312 > rpi33.lan.46656: Flags [P.], cksum 0x5c1f (correct), seq 2088:3132, ack 2089, win 1324, options [nop,nop,TS val 278785417 ecr 278785221], length 1044
1527821371.796412 IP (tos 0x0, ttl 64, id 27565, offset 0, flags [DF], proto TCP (6), length 1096)
    rpi42.lan.47712 > rpi33.lan.46656: Flags [P.], cksum 0x75e6 (correct), seq 2088:3132, ack 2089, win 1324, options [nop,nop,TS val 278785401 ecr 278785221], length 1044
1527821371.798247 IP (tos 0x0, ttl 64, id 43410, offset 0, flags [DF], proto TCP (6), length 1096)
    rpi39.lan.46656 > rpi33.lan.55328: Flags [P.], cksum 0xe96c (correct), seq 4176:5220, ack 4177, win 1332, options [nop,nop,TS val 278785421 ecr 278785221], length 1044
1527821371.799450 IP (tos 0x0, ttl 64, id 17238, offset 0, flags [DF], proto TCP (6), length 1096)
    rpi44.lan.46656 > rpi33.lan.46328: Flags [P.], cksum 0x5071 (correct), seq 4176:5220, ack 4177, win 1332, options [nop,nop,TS val 270928185 ecr 278785221], length 1044
1527821371.805196 IP (tos 0x0, ttl 64, id 16598, offset 0, flags [DF], proto TCP (6), length 1096)
    rpi35.lan.46656 > rpi33.lan.58960: Flags [P.], cksum 0xa5d3 (correct), seq 2088:3132, ack 2089, win 1332, options [nop,nop,TS val 278783943 ecr 278785221], length 1044
1527821371.805352 IP (tos 0x0, ttl 64, id 201, offset 0, flags [DF], proto TCP (6), length 1096)
    rpi33.lan.44546 > rpi38.lan.46656: Flags [P.], cksum 0x889a (incorrect -> 0xc386), seq 2088:3132, ack 2089, win 1324, options [nop,nop,TS val 278785422 ecr 278783755], length 1044
1527821371.805393 IP (tos 0x0, ttl 64, id 50906, offset 0, flags [DF], proto TCP (6), length 1096)
    rpi33.lan.36522 > rpi36.lan.46656: Flags [P.], cksum 0x8898 (incorrect -> 0x32e3), seq 2089:3133, ack 3132, win 1324, options [nop,nop,TS val 278785422 ecr 278785418], length 1044
1527821371.805539 IP (tos 0x0, ttl 64, id 1694, offset 0, flags [DF], proto TCP (6), length 1096)
    rpi33.lan.58960 > rpi35.lan.46656: Flags [P.], cksum 0x8897 (incorrect -> 0xfdcb), seq 2089:3133, ack 3132, win 1323, options [nop,nop,TS val 278785422 ecr 278783943], length 1044
1527821371.805610 IP (tos 0x0, ttl 64, id 6503, offset 0, flags [DF], proto TCP (6), length 1096)
    rpi33.lan.46656 > rpi34.lan.52044: Flags [P.], cksum 0xe6ef (correct), seq 2089:3133, ack 3132, win 1332, options [nop,nop,TS val 278785422 ecr 278785429], length 1044
1527821371.805755 IP (tos 0x0, ttl 64, id 47319, offset 0, flags [DF], proto TCP (6), length 1096)
    rpi33.lan.46656 > rpi37.lan.36362: Flags [P.], cksum 0x804f (correct), seq 2088:3132, ack 2089, win 1332, options [nop,nop,TS val 278785422 ecr 278785206], length 1044
1527821371.805866 IP (tos 0x0, ttl 64, id 35050, offset 0, flags [DF], proto TCP (6), length 1096)
    rpi33.lan.55328 > rpi39.lan.46656: Flags [P.], cksum 0x889b (incorrect -> 0xad96), seq 4177:5221, ack 5220, win 1324, options [nop,nop,TS val 278785422 ecr 278785421], length 1044
1527821371.806275 IP (tos 0x0, ttl 64, id 16617, offset 0, flags [DF], proto TCP (6), length 52)
    rpi36.lan.46656 > rpi33.lan.36522: Flags [.], cksum 0x73b5 (correct), ack 3133, win 1331, options [nop,nop,TS val 278785421 ecr 278785422], length 0
1527821371.806277 IP (tos 0x0, ttl 64, id 7032, offset 0, flags [DF], proto TCP (6), length 52)
    rpi34.lan.52044 > rpi33.lan.46656: Flags [.], cksum 0x7eaa (correct), ack 3133, win 1323, options [nop,nop,TS val 278785430 ecr 278785422], length 0
1527821371.806426 IP (tos 0x0, ttl 64, id 16599, offset 0, flags [DF], proto TCP (6), length 52)
    rpi35.lan.46656 > rpi33.lan.58960: Flags [.], cksum 0x901a (correct), ack 3133, win 1331, options [nop,nop,TS val 278783943 ecr 278785422], length 0
1527821371.806530 IP (tos 0x0, ttl 64, id 55191, offset 0, flags [DF], proto TCP (6), length 1096)
    rpi33.lan.46656 > rpi42.lan.47712: Flags [P.], cksum 0x2ed2 (correct), seq 2089:3133, ack 3132, win 1332, options [nop,nop,TS val 278785422 ecr 278785401], length 1044
1527821371.806560 IP (tos 0x0, ttl 64, id 52984, offset 0, flags [DF], proto TCP (6), length 1096)
    rpi33.lan.46656 > rpi47.lan.39312: Flags [P.], cksum 0x64f8 (correct), seq 2089:3133, ack 3132, win 1332, options [nop,nop,TS val 278785422 ecr 278785417], length 1044
1527821371.806649 IP (tos 0x0, ttl 64, id 43411, offset 0, flags [DF], proto TCP (6), length 52)
    rpi39.lan.46656 > rpi33.lan.55328: Flags [.], cksum 0xaa23 (correct), ack 5221, win 1331, options [nop,nop,TS val 278785422 ecr 278785422], length 0
1527821371.806748 IP (tos 0x0, ttl 64, id 53058, offset 0, flags [DF], proto TCP (6), length 1096)
    rpi33.lan.50564 > rpi43.lan.46656: Flags [P.], cksum 0x889f (incorrect -> 0x8f21), seq 2088:3132, ack 2089, win 1324, options [nop,nop,TS val 278785422 ecr 278785211], length 1044
1527821371.806775 IP (tos 0x0, ttl 64, id 62800, offset 0, flags [DF], proto TCP (6), length 1096)
    rpi33.lan.46656 > rpi40.lan.33420: Flags [P.], cksum 0x178b (correct), seq 2089:3133, ack 3132, win 1332, options [nop,nop,TS val 278785422 ecr 278783244], length 1044
1527821371.806957 IP (tos 0x0, ttl 64, id 16341, offset 0, flags [DF], proto TCP (6), length 1096)
    rpi33.lan.46656 > rpi41.lan.46564: Flags [P.], cksum 0x9120 (correct), seq 2089:3133, ack 3132, win 1332, options [nop,nop,TS val 278785422 ecr 1572724711], length 1044
1527821371.806981 IP (tos 0x0, ttl 64, id 35918, offset 0, flags [DF], proto TCP (6), length 1096)
    rpi33.lan.46656 > rpi46.lan.34468: Flags [P.], cksum 0x5b60 (correct), seq 2089:3133, ack 3132, win 1332, options [nop,nop,TS val 278785422 ecr 3428347724], length 1044
1527821371.807154 IP (tos 0x0, ttl 64, id 53253, offset 0, flags [DF], proto TCP (6), length 1096)
    rpi33.lan.36124 > rpi45.lan.46656: Flags [P.], cksum 0x88a1 (incorrect -> 0xa511), seq 2088:3132, ack 2089, win 1324, options [nop,nop,TS val 278785422 ecr 278783199], length 1044
1527821371.807187 IP (tos 0x0, ttl 64, id 36081, offset 0, flags [DF], proto TCP (6), length 1096)
    rpi33.lan.46328 > rpi44.lan.46656: Flags [P.], cksum 0x88a0 (incorrect -> 0xa9a6), seq 4177:5221, ack 5220, win 1324, options [nop,nop,TS val 278785422 ecr 270928185], length 1044
1527821371.807321 IP (tos 0x0, ttl 64, id 27566, offset 0, flags [DF], proto TCP (6), length 52)
    rpi42.lan.47712 > rpi33.lan.46656: Flags [.], cksum 0x453b (correct), ack 3133, win 1323, options [nop,nop,TS val 278785402 ecr 278785422], length 0
1527821371.807466 IP (tos 0x0, ttl 64, id 59699, offset 0, flags [DF], proto TCP (6), length 52)
    rpi47.lan.39312 > rpi33.lan.46656: Flags [.], cksum 0xb979 (correct), ack 3133, win 1323, options [nop,nop,TS val 278785418 ecr 278785422], length 0
1527821371.807614 IP (tos 0x0, ttl 64, id 47437, offset 0, flags [DF], proto TCP (6), length 52)
    rpi40.lan.33420 > rpi33.lan.46656: Flags [.], cksum 0xafdc (correct), ack 3133, win 1323, options [nop,nop,TS val 278783247 ecr 278785422], length 0
1527821371.807615 IP (tos 0x0, ttl 64, id 54315, offset 0, flags [DF], proto TCP (6), length 52)
    rpi41.lan.46564 > rpi33.lan.46656: Flags [.], cksum 0xbc67 (correct), ack 3133, win 1323, options [nop,nop,TS val 1572724740 ecr 278785422], length 0
1527821371.807791 IP (tos 0x0, ttl 64, id 6224, offset 0, flags [DF], proto TCP (6), length 52)
    rpi46.lan.34468 > rpi33.lan.46656: Flags [.], cksum 0x80b7 (correct), ack 3133, win 1323, options [nop,nop,TS val 3428347754 ecr 278785422], length 0
1527821371.808007 IP (tos 0x0, ttl 64, id 17239, offset 0, flags [DF], proto TCP (6), length 52)
    rpi44.lan.46656 > rpi33.lan.46328: Flags [.], cksum 0xb20b (correct), ack 5221, win 1331, options [nop,nop,TS val 270928186 ecr 278785422], length 0
1527821371.811043 IP (tos 0x0, ttl 64, id 49184, offset 0, flags [DF], proto TCP (6), length 1096)
    rpi37.lan.36362 > rpi33.lan.46656: Flags [P.], cksum 0x6b08 (correct), seq 2089:3133, ack 3132, win 1324, options [nop,nop,TS val 278785406 ecr 278785422], length 1044
1527821371.811114 IP (tos 0x0, ttl 64, id 47320, offset 0, flags [DF], proto TCP (6), length 52)
    rpi33.lan.46656 > rpi37.lan.36362: Flags [.], cksum 0x8485 (incorrect -> 0xc451), ack 3133, win 1331, options [nop,nop,TS val 278785422 ecr 278785406], length 0
1527821371.817072 IP (tos 0x0, ttl 64, id 10424, offset 0, flags [DF], proto TCP (6), length 1096)
    rpi38.lan.46656 > rpi33.lan.44546: Flags [P.], cksum 0xc998 (correct), seq 2089:3133, ack 3132, win 1332, options [nop,nop,TS val 278783955 ecr 278785422], length 1044
1527821371.817152 IP (tos 0x0, ttl 64, id 202, offset 0, flags [DF], proto TCP (6), length 52)
    rpi33.lan.44546 > rpi38.lan.46656: Flags [.], cksum 0x8486 (incorrect -> 0x4502), ack 3133, win 1323, options [nop,nop,TS val 278785423 ecr 278783955], length 0
1527821371.828007 IP (tos 0x0, ttl 64, id 33746, offset 0, flags [DF], proto TCP (6), length 1096)
    rpi43.lan.46656 > rpi33.lan.50564: Flags [P.], cksum 0x25ca (correct), seq 2089:3133, ack 3132, win 1332, options [nop,nop,TS val 278785412 ecr 278785422], length 1044
1527821371.828094 IP (tos 0x0, ttl 64, id 53059, offset 0, flags [DF], proto TCP (6), length 52)
    rpi33.lan.50564 > rpi43.lan.46656: Flags [.], cksum 0x848b (incorrect -> 0xa78d), ack 3133, win 1323, options [nop,nop,TS val 278785424 ecr 278785412], length 0
1527821371.841655 IP (tos 0x0, ttl 64, id 32029, offset 0, flags [DF], proto TCP (6), length 1096)
    rpi45.lan.46656 > rpi33.lan.36124: Flags [P.], cksum 0x91b9 (correct), seq 2089:3133, ack 3132, win 1332, options [nop,nop,TS val 278783399 ecr 278785422], length 1044
1527821371.841740 IP (tos 0x0, ttl 64, id 53254, offset 0, flags [DF], proto TCP (6), length 52)
    rpi33.lan.36124 > rpi45.lan.46656: Flags [.], cksum 0x848d (incorrect -> 0xceba), ack 3133, win 1323, options [nop,nop,TS val 278785425 ecr 278783399], length 0
1527821372.452152 IP (tos 0x0, ttl 64, id 7033, offset 0, flags [DF], proto TCP (6), length 1096)
    rpi34.lan.52044 > rpi33.lan.46656: Flags [P.], cksum 0xfb2f (correct), seq 3132:4176, ack 3133, win 1324, options [nop,nop,TS val 278785495 ecr 278785422], length 1044
1527821372.494528 IP (tos 0x0, ttl 64, id 6504, offset 0, flags [DF], proto TCP (6), length 52)
    rpi33.lan.46656 > rpi34.lan.52044: Flags [.], cksum 0x8482 (incorrect -> 0x7a07), ack 4176, win 1332, options [nop,nop,TS val 278785491 ecr 278785495], length 0
1527821373.670345 IP (tos 0x0, ttl 64, id 6505, offset 0, flags [DF], proto TCP (6), length 1096)
    rpi33.lan.46656 > rpi34.lan.52044: Flags [P.], cksum 0x96e2 (correct), seq 3133:4177, ack 4176, win 1332, options [nop,nop,TS val 278785608 ecr 278785495], length 1044
1527821373.671131 IP (tos 0x0, ttl 64, id 7034, offset 0, flags [DF], proto TCP (6), length 1096)
    rpi34.lan.52044 > rpi33.lan.46656: Flags [P.], cksum 0x3c47 (correct), seq 4176:5220, ack 3133, win 1324, options [nop,nop,TS val 278785617 ecr 278785491], length 1044
1527821373.671240 IP (tos 0x0, ttl 64, id 6506, offset 0, flags [DF], proto TCP (6), length 52)
    rpi33.lan.46656 > rpi34.lan.52044: Flags [.], cksum 0x8482 (incorrect -> 0x70f1), ack 5220, win 1331, options [nop,nop,TS val 278785608 ecr 278785617], length 0
1527821373.671134 IP (tos 0x0, ttl 64, id 7035, offset 0, flags [DF], proto TCP (6), length 52)
    rpi34.lan.52044 > rpi33.lan.46656: Flags [.], cksum 0x70f9 (correct), ack 4177, win 1323, options [nop,nop,TS val 278785617 ecr 278785608], length 0
1527821373.671720 IP (tos 0x0, ttl 64, id 6507, offset 0, flags [DF], proto TCP (6), length 1096)
    rpi33.lan.46656 > rpi34.lan.52044: Flags [P.], cksum 0x56a4 (correct), seq 4177:5221, ack 5220, win 1332, options [nop,nop,TS val 278785608 ecr 278785617], length 1044
1527821373.671915 IP (tos 0x0, ttl 64, id 7036, offset 0, flags [DF], proto TCP (6), length 1096)
    rpi34.lan.52044 > rpi33.lan.46656: Flags [P.], cksum 0xde59 (correct), seq 5220:6264, ack 4177, win 1324, options [nop,nop,TS val 278785617 ecr 278785608], length 1044
