1527821791.339184 IP (tos 0x0, ttl 64, id 34643, offset 0, flags [DF], proto TCP (6), length 1096)
    rpi45.lan.46656 > rpi33.lan.36124: Flags [P.], cksum 0xdd61 (correct), seq 1426053812:1426054856, ack 2730225423, win 1332, options [nop,nop,TS val 278825349 ecr 278827178], length 1044
1527821791.345273 IP (tos 0x0, ttl 64, id 19442, offset 0, flags [DF], proto TCP (6), length 1096)
    rpi36.lan.46656 > rpi33.lan.36522: Flags [P.], cksum 0x2c9b (correct), seq 285524369:285525413, ack 867980036, win 1332, options [nop,nop,TS val 278827375 ecr 278827178], length 1044
1527821791.350281 IP (tos 0x0, ttl 64, id 36403, offset 0, flags [DF], proto TCP (6), length 1096)
    rpi43.lan.46656 > rpi33.lan.50564: Flags [P.], cksum 0x5b72 (correct), seq 3013698022:3013699066, ack 3553898814, win 1332, options [nop,nop,TS val 278827364 ecr 278827178], length 1044
1527821791.352530 IP (tos 0x0, ttl 64, id 19414, offset 0, flags [DF], proto TCP (6), length 1096)
    rpi35.lan.46656 > rpi33.lan.58960: Flags [P.], cksum 0x024d (correct), seq 3978468753:3978469797, ack 371141022, win 1332, options [nop,nop,TS val 278825898 ecr 278827178], length 1044
1527821791.353183 IP (tos 0x0, ttl 64, id 19912, offset 0, flags [DF], proto TCP (6), length 1096)
    rpi44.lan.46656 > rpi33.lan.46328: Flags [P.], cksum 0xb482 (correct), seq 3743122809:3743123853, ack 2683837794, win 1332, options [nop,nop,TS val 270970141 ecr 278827178], length 1044
1527821791.357677 IP (tos 0x0, ttl 64, id 46170, offset 0, flags [DF], proto TCP (6), length 1096)
    rpi39.lan.46656 > rpi33.lan.55328: Flags [P.], cksum 0xaf38 (correct), seq 3648442134:3648443178, ack 2978348249, win 1332, options [nop,nop,TS val 278827377 ecr 278827178], length 1044
1527821791.357870 IP (tos 0x0, ttl 64, id 9716, offset 0, flags [DF], proto TCP (6), length 1096)
    rpi34.lan.52044 > rpi33.lan.46656: Flags [P.], cksum 0xd2d0 (correct), seq 2389451237:2389452281, ack 3079608078, win 1324, options [nop,nop,TS val 278827385 ecr 278827178], length 1044
1527821791.360062 IP (tos 0x0, ttl 64, id 50031, offset 0, flags [DF], proto TCP (6), length 1096)
    rpi40.lan.33420 > rpi33.lan.46656: Flags [P.], cksum 0x16f4 (correct), seq 3628325729:3628326773, ack 1184019497, win 1324, options [nop,nop,TS val 278825202 ecr 278827178], length 1044
1527821791.363082 IP (tos 0x0, ttl 64, id 8955, offset 0, flags [DF], proto TCP (6), length 1096)
    rpi46.lan.34468 > rpi33.lan.46656: Flags [P.], cksum 0xe232 (correct), seq 3585003099:3585004143, ack 2572994824, win 1324, options [nop,nop,TS val 3428767310 ecr 278827178], length 1044
1527821791.366597 IP (tos 0x0, ttl 64, id 51941, offset 0, flags [DF], proto TCP (6), length 1096)
    rpi37.lan.36362 > rpi33.lan.46656: Flags [P.], cksum 0xb410 (correct), seq 2177939775:2177940819, ack 4042978772, win 1324, options [nop,nop,TS val 278827362 ecr 278827178], length 1044
1527821791.367227 IP (tos 0x0, ttl 64, id 30290, offset 0, flags [DF], proto TCP (6), length 1096)
    rpi42.lan.47712 > rpi33.lan.46656: Flags [P.], cksum 0x22a5 (correct), seq 2826412592:2826413636, ack 3698217143, win 1324, options [nop,nop,TS val 278827358 ecr 278827178], length 1044
1527821791.369027 IP (tos 0x0, ttl 64, id 53540, offset 0, flags [DF], proto TCP (6), length 1096)
    rpi33.lan.36522 > rpi36.lan.46656: Flags [P.], cksum 0x8898 (incorrect -> 0x2b8f), seq 1:1045, ack 1044, win 1324, options [nop,nop,TS val 278827378 ecr 278827375], length 1044
1527821791.369262 IP (tos 0x0, ttl 64, id 9188, offset 0, flags [DF], proto TCP (6), length 1096)
    rpi33.lan.46656 > rpi34.lan.52044: Flags [P.], cksum 0x6f05 (correct), seq 1:1045, ack 1044, win 1332, options [nop,nop,TS val 278827378 ecr 278827385], length 1044
1527821791.369472 IP (tos 0x0, ttl 64, id 4312, offset 0, flags [DF], proto TCP (6), length 1096)
    rpi33.lan.58960 > rpi35.lan.46656: Flags [P.], cksum 0x8897 (incorrect -> 0x2e9f), seq 1:1045, ack 1044, win 1324, options [nop,nop,TS val 278827378 ecr 278825898], length 1044
1527821791.369810 IP (tos 0x0, ttl 64, id 19443, offset 0, flags [DF], proto TCP (6), length 52)
    rpi36.lan.46656 > rpi33.lan.36522: Flags [.], cksum 0x02a2 (correct), ack 1045, win 1331, options [nop,nop,TS val 278827378 ecr 278827378], length 0
1527821791.370000 IP (tos 0x0, ttl 64, id 38826, offset 0, flags [DF], proto TCP (6), length 1096)
    rpi33.lan.46328 > rpi44.lan.46656: Flags [P.], cksum 0x88a0 (incorrect -> 0xfa39), seq 1:1045, ack 1044, win 1324, options [nop,nop,TS val 278827378 ecr 270970141], length 1044
1527821791.370031 IP (tos 0x0, ttl 64, id 9717, offset 0, flags [DF], proto TCP (6), length 52)
    rpi34.lan.52044 > rpi33.lan.46656: Flags [.], cksum 0xa067 (correct), ack 1045, win 1323, options [nop,nop,TS val 278827387 ecr 278827378], length 0
1527821791.370209 IP (tos 0x0, ttl 64, id 19415, offset 0, flags [DF], proto TCP (6), length 52)
    rpi35.lan.46656 > rpi33.lan.58960: Flags [.], cksum 0x3fa7 (correct), ack 1045, win 1331, options [nop,nop,TS val 278825900 ecr 278827378], length 0
1527821791.370242 IP (tos 0x0, ttl 64, id 49986, offset 0, flags [DF], proto TCP (6), length 1096)
    rpi33.lan.46656 > rpi37.lan.36362: Flags [P.], cksum 0xc596 (correct), seq 1:1045, ack 1044, win 1332, options [nop,nop,TS val 278827378 ecr 278827362], length 1044
1527821791.370450 IP (tos 0x0, ttl 64, id 2869, offset 0, flags [DF], proto TCP (6), length 1096)
    rpi33.lan.44546 > rpi38.lan.46656: Flags [P.], cksum 0x889a (incorrect -> 0x3c12), seq 1216348403:1216349447, ack 3777112930, win 1324, options [nop,nop,TS val 278827378 ecr 278825711], length 1044
1527821791.370591 IP (tos 0x0, ttl 64, id 62290, offset 0, flags [DF], proto TCP (6), length 1096)
    rpi47.lan.39312 > rpi33.lan.46656: Flags [P.], cksum 0x2ebb (correct), seq 1689542580:1689543624, ack 2022491592, win 1324, options [nop,nop,TS val 278827374 ecr 278827178], length 1044
1527821791.370661 IP (tos 0x0, ttl 64, id 37742, offset 0, flags [DF], proto TCP (6), length 1096)
    rpi33.lan.55328 > rpi39.lan.46656: Flags [P.], cksum 0x889b (incorrect -> 0xe41e), seq 1:1045, ack 1044, win 1324, options [nop,nop,TS val 278827378 ecr 278827377], length 1044
1527821791.370771 IP (tos 0x0, ttl 64, id 19913, offset 0, flags [DF], proto TCP (6), length 52)
    rpi44.lan.46656 > rpi33.lan.46328: Flags [.], cksum 0xf87c (correct), ack 1045, win 1331, options [nop,nop,TS val 270970143 ecr 278827378], length 0
1527821791.370873 IP (tos 0x0, ttl 64, id 5, offset 0, flags [DF], proto TCP (6), length 1096)
    rpi33.lan.46656 > rpi40.lan.33420: Flags [P.], cksum 0x9ae8 (correct), seq 1:1045, ack 1044, win 1332, options [nop,nop,TS val 278827378 ecr 278825202], length 1044
1527821791.371081 IP (tos 0x0, ttl 64, id 55763, offset 0, flags [DF], proto TCP (6), length 1096)
    rpi33.lan.46656 > rpi47.lan.39312: Flags [P.], cksum 0x3385 (correct), seq 1:1045, ack 1044, win 1332, options [nop,nop,TS val 278827378 ecr 278827374], length 1044
1527821791.371085 IP (tos 0x0, ttl 64, id 51942, offset 0, flags [DF], proto TCP (6), length 52)
    rpi37.lan.36362 > rpi33.lan.46656: Flags [.], cksum 0x3acf (correct), ack 1045, win 1323, options [nop,nop,TS val 278827362 ecr 278827378], length 0
1527821791.371256 IP (tos 0x0, ttl 64, id 57847, offset 0, flags [DF], proto TCP (6), length 1096)
    rpi33.lan.46656 > rpi42.lan.47712: Flags [P.], cksum 0x9782 (correct), seq 1:1045, ack 1044, win 1332, options [nop,nop,TS val 278827378 ecr 278827358], length 1044
1527821791.371293 IP (tos 0x0, ttl 64, id 55774, offset 0, flags [DF], proto TCP (6), length 1096)
    rpi33.lan.50564 > rpi43.lan.46656: Flags [P.], cksum 0x889f (incorrect -> 0xb5e4), seq 1:1045, ack 1044, win 1324, options [nop,nop,TS val 278827378 ecr 278827364], length 1044
1527821791.371430 IP (tos 0x0, ttl 64, id 46171, offset 0, flags [DF], proto TCP (6), length 52)
    rpi39.lan.46656 > rpi33.lan.55328: Flags [.], cksum 0xbb91 (correct), ack 1045, win 1331, options [nop,nop,TS val 278827378 ecr 278827378], length 0
1527821791.371638 IP (tos 0x0, ttl 64, id 50032, offset 0, flags [DF], proto TCP (6), length 52)
    rpi40.lan.33420 > rpi33.lan.46656: Flags [.], cksum 0xc237 (correct), ack 1045, win 1323, options [nop,nop,TS val 278825203 ecr 278827378], length 0
1527821791.371909 IP (tos 0x0, ttl 64, id 55991, offset 0, flags [DF], proto TCP (6), length 1096)
    rpi33.lan.36124 > rpi45.lan.46656: Flags [P.], cksum 0x88a1 (incorrect -> 0x1861), seq 1:1045, ack 1044, win 1324, options [nop,nop,TS val 278827378 ecr 278825349], length 1044
1527821791.371945 IP (tos 0x0, ttl 64, id 38580, offset 0, flags [DF], proto TCP (6), length 1096)
    rpi33.lan.46656 > rpi46.lan.34468: Flags [P.], cksum 0x8a6b (correct), seq 1:1045, ack 1044, win 1332, options [nop,nop,TS val 278827378 ecr 3428767310], length 1044
1527821791.371954 IP (tos 0x0, ttl 64, id 62291, offset 0, flags [DF], proto TCP (6), length 52)
    rpi47.lan.39312 > rpi33.lan.46656: Flags [.], cksum 0x4e55 (correct), ack 1045, win 1323, options [nop,nop,TS val 278827374 ecr 278827378], length 0
1527821791.371956 IP (tos 0x0, ttl 64, id 30291, offset 0, flags [DF], proto TCP (6), length 52)
    rpi42.lan.47712 > rpi33.lan.46656: Flags [.], cksum 0xb889 (correct), ack 1045, win 1323, options [nop,nop,TS val 278827358 ecr 278827378], length 0
1527821791.372110 IP (tos 0x0, ttl 64, id 36404, offset 0, flags [DF], proto TCP (6), length 52)
    rpi43.lan.46656 > rpi33.lan.50564: Flags [.], cksum 0x0a88 (correct), ack 1045, win 1331, options [nop,nop,TS val 278827366 ecr 278827378], length 0
1527821791.372673 IP (tos 0x0, ttl 64, id 34644, offset 0, flags [DF], proto TCP (6), length 52)
    rpi45.lan.46656 > rpi33.lan.36124: Flags [.], cksum 0xa3e7 (correct), ack 1045, win 1331, options [nop,nop,TS val 278825352 ecr 278827378], length 0
1527821791.372674 IP (tos 0x0, ttl 64, id 8956, offset 0, flags [DF], proto TCP (6), length 52)
    rpi46.lan.34468 > rpi33.lan.46656: Flags [.], cksum 0x5ce4 (correct), ack 1045, win 1323, options [nop,nop,TS val 3428767321 ecr 278827378], length 0
1527821791.374751 IP (tos 0x0, ttl 64, id 13201, offset 0, flags [DF], proto TCP (6), length 1096)
    rpi38.lan.46656 > rpi33.lan.44546: Flags [P.], cksum 0xa48a (correct), seq 1:1045, ack 1044, win 1332, options [nop,nop,TS val 278825911 ecr 278827378], length 1044
1527821791.374820 IP (tos 0x0, ttl 64, id 2870, offset 0, flags [DF], proto TCP (6), length 52)
    rpi33.lan.44546 > rpi38.lan.46656: Flags [.], cksum 0x8486 (incorrect -> 0xec67), ack 1045, win 1323, options [nop,nop,TS val 278827379 ecr 278825911], length 0
1527821792.451073 IP (tos 0x0, ttl 64, id 9718, offset 0, flags [DF], proto TCP (6), length 1096)
    rpi34.lan.52044 > rpi33.lan.46656: Flags [P.], cksum 0xacd1 (correct), seq 1044:2088, ack 1045, win 1324, options [nop,nop,TS val 278827495 ecr 278827378], length 1044
1527821792.494521 IP (tos 0x0, ttl 64, id 9189, offset 0, flags [DF], proto TCP (6), length 52)
    rpi33.lan.46656 > rpi34.lan.52044: Flags [.], cksum 0x8482 (incorrect -> 0x9b6d), ack 2088, win 1332, options [nop,nop,TS val 278827491 ecr 278827495], length 0
1527821793.342798 IP (tos 0x0, ttl 64, id 34645, offset 0, flags [DF], proto TCP (6), length 1096)
    rpi45.lan.46656 > rpi33.lan.36124: Flags [P.], cksum 0xb601 (correct), seq 1044:2088, ack 1045, win 1332, options [nop,nop,TS val 278825549 ecr 278827378], length 1044
1527821793.348757 IP (tos 0x0, ttl 64, id 19444, offset 0, flags [DF], proto TCP (6), length 1096)
    rpi36.lan.46656 > rpi33.lan.36522: Flags [P.], cksum 0x580c (correct), seq 1044:2088, ack 1045, win 1332, options [nop,nop,TS val 278827576 ecr 278827378], length 1044
1527821793.355309 IP (tos 0x0, ttl 64, id 36405, offset 0, flags [DF], proto TCP (6), length 1096)
    rpi43.lan.46656 > rpi33.lan.50564: Flags [P.], cksum 0x8f84 (correct), seq 1044:2088, ack 1045, win 1332, options [nop,nop,TS val 278827565 ecr 278827378], length 1044
1527821793.356417 IP (tos 0x0, ttl 64, id 19416, offset 0, flags [DF], proto TCP (6), length 1096)
    rpi35.lan.46656 > rpi33.lan.58960: Flags [P.], cksum 0xb0f0 (correct), seq 1044:2088, ack 1045, win 1332, options [nop,nop,TS val 278826098 ecr 278827378], length 1044
1527821793.356687 IP (tos 0x0, ttl 64, id 19914, offset 0, flags [DF], proto TCP (6), length 1096)
    rpi44.lan.46656 > rpi33.lan.46328: Flags [P.], cksum 0xeeaf (correct), seq 1044:2088, ack 1045, win 1332, options [nop,nop,TS val 270970341 ecr 278827378], length 1044
1527821793.361275 IP (tos 0x0, ttl 64, id 46172, offset 0, flags [DF], proto TCP (6), length 1096)
    rpi39.lan.46656 > rpi33.lan.55328: Flags [P.], cksum 0x3fcb (correct), seq 1044:2088, ack 1045, win 1332, options [nop,nop,TS val 278827577 ecr 278827378], length 1044
1527821793.362922 IP (tos 0x0, ttl 64, id 50033, offset 0, flags [DF], proto TCP (6), length 1096)
    rpi40.lan.33420 > rpi33.lan.46656: Flags [P.], cksum 0x1e4e (correct), seq 1044:2088, ack 1045, win 1324, options [nop,nop,TS val 278825402 ecr 278827378], length 1044
1527821793.363115 IP (tos 0x0, ttl 64, id 9719, offset 0, flags [DF], proto TCP (6), length 1096)
    rpi34.lan.52044 > rpi33.lan.46656: Flags [P.], cksum 0x62b4 (correct), seq 2088:3132, ack 1045, win 1324, options [nop,nop,TS val 278827586 ecr 278827491], length 1044
1527821793.363190 IP (tos 0x0, ttl 64, id 9190, offset 0, flags [DF], proto TCP (6), length 52)
    rpi33.lan.46656 > rpi34.lan.52044: Flags [.], cksum 0x8482 (incorrect -> 0x96a9), ack 3132, win 1331, options [nop,nop,TS val 278827577 ecr 278827586], length 0
1527821793.367044 IP (tos 0x0, ttl 64, id 8957, offset 0, flags [DF], proto TCP (6), length 1096)
    rpi46.lan.34468 > rpi33.lan.46656: Flags [P.], cksum 0x371a (correct), seq 1044:2088, ack 1045, win 1324, options [nop,nop,TS val 3428769315 ecr 278827378], length 1044
1527821793.370112 IP (tos 0x0, ttl 64, id 51943, offset 0, flags [DF], proto TCP (6), length 1096)
    rpi37.lan.36362 > rpi33.lan.46656: Flags [P.], cksum 0xcf24 (correct), seq 1044:2088, ack 1045, win 1324, options [nop,nop,TS val 278827562 ecr 278827378], length 1044
1527821793.371395 IP (tos 0x0, ttl 64, id 30292, offset 0, flags [DF], proto TCP (6), length 1096)
    rpi42.lan.47712 > rpi33.lan.46656: Flags [P.], cksum 0x8f7b (correct), seq 1044:2088, ack 1045, win 1324, options [nop,nop,TS val 278827558 ecr 278827378], length 1044
1527821793.372371 IP (tos 0x0, ttl 64, id 9191, offset 0, flags [DF], proto TCP (6), length 1096)
    rpi33.lan.46656 > rpi34.lan.52044: Flags [P.], cksum 0x4db3 (correct), seq 1045:2089, ack 3132, win 1332, options [nop,nop,TS val 278827578 ecr 278827586], length 1044
1527821793.372419 IP (tos 0x0, ttl 64, id 4313, offset 0, flags [DF], proto TCP (6), length 1096)
    rpi33.lan.58960 > rpi35.lan.46656: Flags [P.], cksum 0x8897 (incorrect -> 0x905c), seq 1045:2089, ack 2088, win 1324, options [nop,nop,TS val 278827578 ecr 278826098], length 1044
1527821793.372627 IP (tos 0x0, ttl 64, id 53541, offset 0, flags [DF], proto TCP (6), length 1096)
    rpi33.lan.36522 > rpi36.lan.46656: Flags [P.], cksum 0x8898 (incorrect -> 0x43ba), seq 1045:2089, ack 2088, win 1324, options [nop,nop,TS val 278827578 ecr 278827576], length 1044
1527821793.372672 IP (tos 0x0, ttl 64, id 2871, offset 0, flags [DF], proto TCP (6), length 1096)
    rpi33.lan.44546 > rpi38.lan.46656: Flags [P.], cksum 0x889a (incorrect -> 0x7c9f), seq 1044:2088, ack 1045, win 1324, options [nop,nop,TS val 278827578 ecr 278825911], length 1044
1527821793.372841 IP (tos 0x0, ttl 64, id 49987, offset 0, flags [DF], proto TCP (6), length 1096)
    rpi33.lan.46656 > rpi37.lan.36362: Flags [P.], cksum 0x27e7 (correct), seq 1045:2089, ack 2088, win 1332, options [nop,nop,TS val 278827578 ecr 278827562], length 1044
1527821793.373139 IP (tos 0x0, ttl 64, id 9720, offset 0, flags [DF], proto TCP (6), length 52)
    rpi34.lan.52044 > rpi33.lan.46656: Flags [.], cksum 0x929b (correct), ack 2089, win 1323, options [nop,nop,TS val 278827587 ecr 278827578], length 0
1527821793.373175 IP (tos 0x0, ttl 64, id 37743, offset 0, flags [DF], proto TCP (6), length 1096)
    rpi33.lan.55328 > rpi39.lan.46656: Flags [P.], cksum 0x889b (incorrect -> 0x6655), seq 1045:2089, ack 2088, win 1324, options [nop,nop,TS val 278827578 ecr 278827577], length 1044
1527821793.373142 IP (tos 0x0, ttl 64, id 19417, offset 0, flags [DF], proto TCP (6), length 52)
    rpi35.lan.46656 > rpi33.lan.58960: Flags [.], cksum 0x35ef (correct), ack 2089, win 1331, options [nop,nop,TS val 278826100 ecr 278827578], length 0
1527821793.373223 IP (tos 0x0, ttl 64, id 57848, offset 0, flags [DF], proto TCP (6), length 1096)
    rpi33.lan.46656 > rpi42.lan.47712: Flags [P.], cksum 0xa770 (correct), seq 1045:2089, ack 2088, win 1332, options [nop,nop,TS val 278827578 ecr 278827558], length 1044
1527821793.373371 IP (tos 0x0, ttl 64, id 19445, offset 0, flags [DF], proto TCP (6), length 52)
    rpi36.lan.46656 > rpi33.lan.36522: Flags [.], cksum 0xf8e9 (correct), ack 2089, win 1331, options [nop,nop,TS val 278827578 ecr 278827578], length 0
1527821793.373390 IP (tos 0x0, ttl 64, id 6, offset 0, flags [DF], proto TCP (6), length 1096)
    rpi33.lan.46656 > rpi40.lan.33420: Flags [P.], cksum 0x33b7 (correct), seq 1045:2089, ack 2088, win 1332, options [nop,nop,TS val 278827578 ecr 278825402], length 1044
1527821793.373439 IP (tos 0x0, ttl 64, id 55764, offset 0, flags [DF], proto TCP (6), length 1096)
    rpi33.lan.46656 > rpi47.lan.39312: Flags [P.], cksum 0xb171 (correct), seq 1045:2089, ack 1044, win 1332, options [nop,nop,TS val 278827578 ecr 278827374], length 1044
1527821793.373613 IP (tos 0x0, ttl 64, id 51944, offset 0, flags [DF], proto TCP (6), length 52)
    rpi37.lan.36362 > rpi33.lan.46656: Flags [.], cksum 0x3116 (correct), ack 2089, win 1323, options [nop,nop,TS val 278827563 ecr 278827578], length 0
1527821793.373818 IP (tos 0x0, ttl 64, id 55992, offset 0, flags [DF], proto TCP (6), length 1096)
    rpi33.lan.36124 > rpi45.lan.46656: Flags [P.], cksum 0x88a1 (incorrect -> 0x7261), seq 1045:2089, ack 2088, win 1324, options [nop,nop,TS val 278827578 ecr 278825549], length 1044
1527821793.373844 IP (tos 0x0, ttl 64, id 55775, offset 0, flags [DF], proto TCP (6), length 1096)
    rpi33.lan.50564 > rpi43.lan.46656: Flags [P.], cksum 0x889f (incorrect -> 0xc3cb), seq 1045:2089, ack 2088, win 1324, options [nop,nop,TS val 278827578 ecr 278827565], length 1044
1527821793.373980 IP (tos 0x0, ttl 64, id 46173, offset 0, flags [DF], proto TCP (6), length 52)
    rpi39.lan.46656 > rpi33.lan.55328: Flags [.], cksum 0xb1d9 (correct), ack 2089, win 1331, options [nop,nop,TS val 278827578 ecr 278827578], length 0
1527821793.373981 IP (tos 0x0, ttl 64, id 30293, offset 0, flags [DF], proto TCP (6), length 52)
    rpi42.lan.47712 > rpi33.lan.46656: Flags [.], cksum 0xaed0 (correct), ack 2089, win 1323, options [nop,nop,TS val 278827559 ecr 278827578], length 0
1527821793.374025 IP (tos 0x0, ttl 64, id 38581, offset 0, flags [DF], proto TCP (6), length 1096)
    rpi33.lan.46656 > rpi46.lan.34468: Flags [P.], cksum 0x30e8 (correct), seq 1045:2089, ack 2088, win 1332, options [nop,nop,TS val 278827578 ecr 3428769315], length 1044
1527821793.374168 IP (tos 0x0, ttl 64, id 50034, offset 0, flags [DF], proto TCP (6), length 52)
    rpi40.lan.33420 > rpi33.lan.46656: Flags [.], cksum 0xb87f (correct), ack 2089, win 1323, options [nop,nop,TS val 278825403 ecr 278827578], length 0
1527821793.374248 IP (tos 0x0, ttl 64, id 38827, offset 0, flags [DF], proto TCP (6), length 1096)
    rpi33.lan.46328 > rpi44.lan.46656: Flags [P.], cksum 0x88a0 (incorrect -> 0x8e84), seq 1045:2089, ack 2088, win 1324, options [nop,nop,TS val 278827578 ecr 270970341], length 1044
1527821793.374446 IP (tos 0x0, ttl 64, id 62292, offset 0, flags [DF], proto TCP (6), length 1096)
    rpi47.lan.39312 > rpi33.lan.46656: Flags [P.], cksum 0xed97 (correct), seq 1044:2088, ack 1045, win 1324, options [nop,nop,TS val 278827575 ecr 278827378], length 1044
1527821793.374448 IP (tos 0x0, ttl 64, id 62293, offset 0, flags [DF], proto TCP (6), length 52)
    rpi47.lan.39312 > rpi33.lan.46656: Flags [.], cksum 0x449c (correct), ack 2089, win 1323, options [nop,nop,TS val 278827575 ecr 278827578], length 0
1527821793.374676 IP (tos 0x0, ttl 64, id 34646, offset 0, flags [DF], proto TCP (6), length 52)
    rpi45.lan.46656 > rpi33.lan.36124: Flags [.], cksum 0x9a2f (correct), ack 2089, win 1331, options [nop,nop,TS val 278825552 ecr 278827578], length 0
1527821793.374679 IP (tos 0x0, ttl 64, id 36406, offset 0, flags [DF], proto TCP (6), length 52)
    rpi43.lan.46656 > rpi33.lan.50564: Flags [.], cksum 0x00d0 (correct), ack 2089, win 1331, options [nop,nop,TS val 278827566 ecr 278827578], length 0
1527821793.374680 IP (tos 0x0, ttl 64, id 8958, offset 0, flags [DF], proto TCP (6), length 52)
    rpi46.lan.34468 > rpi33.lan.46656: Flags [.], cksum 0x4c22 (correct), ack 2089, win 1323, options [nop,nop,TS val 3428769323 ecr 278827578], length 0
1527821793.375011 IP (tos 0x0, ttl 64, id 19915, offset 0, flags [DF], proto TCP (6), length 52)
    rpi44.lan.46656 > rpi33.lan.46328: Flags [.], cksum 0xeec4 (correct), ack 2089, win 1331, options [nop,nop,TS val 270970343 ecr 278827578], length 0
1527821793.378135 IP (tos 0x0, ttl 64, id 13202, offset 0, flags [DF], proto TCP (6), length 1096)
    rpi38.lan.46656 > rpi33.lan.44546: Flags [P.], cksum 0xc18d (correct), seq 1045:2089, ack 2088, win 1332, options [nop,nop,TS val 278826112 ecr 278827578], length 1044
1527821793.378204 IP (tos 0x0, ttl 64, id 2872, offset 0, flags [DF], proto TCP (6), length 52)
    rpi33.lan.44546 > rpi38.lan.46656: Flags [.], cksum 0x8486 (incorrect -> 0xe2ae), ack 2089, win 1323, options [nop,nop,TS val 278827579 ecr 278826112], length 0
1527821793.414513 IP (tos 0x0, ttl 64, id 55765, offset 0, flags [DF], proto TCP (6), length 52)
    rpi33.lan.46656 > rpi47.lan.39312: Flags [.], cksum 0x848f (incorrect -> 0x448e), ack 2088, win 1332, options [nop,nop,TS val 278827583 ecr 278827575], length 0
1527821793.670101 IP (tos 0x0, ttl 64, id 9192, offset 0, flags [DF], proto TCP (6), length 1096)
    rpi33.lan.46656 > rpi34.lan.52044: Flags [P.], cksum 0x6b0c (correct), seq 2089:3133, ack 3132, win 1332, options [nop,nop,TS val 278827608 ecr 278827587], length 1044
1527821793.670964 IP (tos 0x0, ttl 64, id 9721, offset 0, flags [DF], proto TCP (6), length 1096)
    rpi34.lan.52044 > rpi33.lan.46656: Flags [P.], cksum 0x5899 (correct), seq 3132:4176, ack 2089, win 1324, options [nop,nop,TS val 278827617 ecr 278827578], length 1044
1527821793.670967 IP (tos 0x0, ttl 64, id 9722, offset 0, flags [DF], proto TCP (6), length 52)
    rpi34.lan.52044 > rpi33.lan.46656: Flags [.], cksum 0x8a37 (correct), ack 3133, win 1323, options [nop,nop,TS val 278827617 ecr 278827608], length 0
1527821793.671545 IP (tos 0x0, ttl 64, id 9193, offset 0, flags [DF], proto TCP (6), length 1096)
    rpi33.lan.46656 > rpi34.lan.52044: Flags [P.], cksum 0xd181 (correct), seq 3133:4177, ack 4176, win 1332, options [nop,nop,TS val 278827608 ecr 278827617], length 1044
1527821793.671691 IP (tos 0x0, ttl 64, id 9723, offset 0, flags [DF], proto TCP (6), length 1096)
    rpi34.lan.52044 > rpi33.lan.46656: Flags [P.], cksum 0x347c (correct), seq 4176:5220, ack 3133, win 1324, options [nop,nop,TS val 278827617 ecr 278827608], length 1044
1527821793.714513 IP (tos 0x0, ttl 64, id 9194, offset 0, flags [DF], proto TCP (6), length 52)
    rpi33.lan.46656 > rpi34.lan.52044: Flags [.], cksum 0x8482 (incorrect -> 0x8201), ack 5220, win 1332, options [nop,nop,TS val 278827613 ecr 278827617], length 0
1527821793.718384 IP (tos 0x0, ttl 64, id 9724, offset 0, flags [DF], proto TCP (6), length 52)
    rpi34.lan.52044 > rpi33.lan.46656: Flags [.], cksum 0x8209 (correct), ack 4177, win 1324, options [nop,nop,TS val 278827622 ecr 278827608], length 0
1527821795.346042 IP (tos 0x0, ttl 64, id 34647, offset 0, flags [DF], proto TCP (6), length 1096)
    rpi45.lan.46656 > rpi33.lan.36124: Flags [P.], cksum 0xee3a (correct), seq 2088:3132, ack 2089, win 1332, options [nop,nop,TS val 278825749 ecr 278827578], length 1044
1527821795.352993 IP (tos 0x0, ttl 64, id 19446, offset 0, flags [DF], proto TCP (6), length 1096)
    rpi36.lan.46656 > rpi33.lan.36522: Flags [P.], cksum 0xfd4b (correct), seq 2088:3132, ack 2089, win 1332, options [nop,nop,TS val 278827776 ecr 278827578], length 1044
1527821795.358570 IP (tos 0x0, ttl 64, id 36407, offset 0, flags [DF], proto TCP (6), length 1096)
    rpi43.lan.46656 > rpi33.lan.50564: Flags [P.], cksum 0x3160 (correct), seq 2088:3132, ack 2089, win 1332, options [nop,nop,TS val 278827765 ecr 278827578], length 1044
1527821795.358772 IP (tos 0x0, ttl 64, id 19418, offset 0, flags [DF], proto TCP (6), length 1096)
    rpi35.lan.46656 > rpi33.lan.58960: Flags [P.], cksum 0x9ee8 (correct), seq 2088:3132, ack 2089, win 1332, options [nop,nop,TS val 278826299 ecr 278827578], length 1044
1527821795.359555 IP (tos 0x0, ttl 64, id 19916, offset 0, flags [DF], proto TCP (6), length 1096)
    rpi44.lan.46656 > rpi33.lan.46328: Flags [P.], cksum 0xd378 (correct), seq 2088:3132, ack 2089, win 1332, options [nop,nop,TS val 270970541 ecr 278827578], length 1044
1527821795.364672 IP (tos 0x0, ttl 64, id 46174, offset 0, flags [DF], proto TCP (6), length 1096)
    rpi39.lan.46656 > rpi33.lan.55328: Flags [P.], cksum 0x7c32 (correct), seq 2088:3132, ack 2089, win 1332, options [nop,nop,TS val 278827777 ecr 278827578], length 1044
1527821795.366274 IP (tos 0x0, ttl 64, id 50035, offset 0, flags [DF], proto TCP (6), length 1096)
    rpi40.lan.33420 > rpi33.lan.46656: Flags [P.], cksum 0x652d (correct), seq 2088:3132, ack 2089, win 1324, options [nop,nop,TS val 278825602 ecr 278827578], length 1044
1527821795.367801 IP (tos 0x0, ttl 64, id 9725, offset 0, flags [DF], proto TCP (6), length 1096)
    rpi34.lan.52044 > rpi33.lan.46656: Flags [P.], cksum 0x3821 (correct), seq 5220:6264, ack 4177, win 1324, options [nop,nop,TS val 278827786 ecr 278827608], length 1044
1527821795.367887 IP (tos 0x0, ttl 64, id 9195, offset 0, flags [DF], proto TCP (6), length 52)
    rpi33.lan.46656 > rpi34.lan.52044: Flags [.], cksum 0x8482 (incorrect -> 0x7ca0), ack 6264, win 1331, options [nop,nop,TS val 278827778 ecr 278827786], length 0
1527821795.369957 IP (tos 0x0, ttl 64, id 8959, offset 0, flags [DF], proto TCP (6), length 1096)
    rpi46.lan.34468 > rpi33.lan.46656: Flags [P.], cksum 0x870f (correct), seq 2088:3132, ack 2089, win 1324, options [nop,nop,TS val 3428771317 ecr 278827578], length 1044
1527821795.373746 IP (tos 0x0, ttl 64, id 30294, offset 0, flags [DF], proto TCP (6), length 1096)
    rpi42.lan.47712 > rpi33.lan.46656: Flags [P.], cksum 0x706e (correct), seq 2088:3132, ack 2089, win 1324, options [nop,nop,TS val 278827759 ecr 278827578], length 1044
1527821795.375047 IP (tos 0x0, ttl 64, id 51945, offset 0, flags [DF], proto TCP (6), length 1096)
    rpi37.lan.36362 > rpi33.lan.46656: Flags [P.], cksum 0xc90f (correct), seq 2088:3132, ack 2089, win 1324, options [nop,nop,TS val 278827763 ecr 278827578], length 1044
1527821795.375837 IP (tos 0x0, ttl 64, id 49988, offset 0, flags [DF], proto TCP (6), length 1096)
    rpi33.lan.46656 > rpi37.lan.36362: Flags [P.], cksum 0x7fae (correct), seq 2089:3133, ack 3132, win 1332, options [nop,nop,TS val 278827779 ecr 278827763], length 1044
1527821795.375889 IP (tos 0x0, ttl 64, id 53542, offset 0, flags [DF], proto TCP (6), length 1096)
    rpi33.lan.36522 > rpi36.lan.46656: Flags [P.], cksum 0x8898 (incorrect -> 0xad1a), seq 2089:3133, ack 3132, win 1324, options [nop,nop,TS val 278827779 ecr 278827776], length 1044
1527821795.375907 IP (tos 0x0, ttl 64, id 55776, offset 0, flags [DF], proto TCP (6), length 1096)
    rpi33.lan.50564 > rpi43.lan.46656: Flags [P.], cksum 0x889f (incorrect -> 0x0ddd), seq 2089:3133, ack 3132, win 1324, options [nop,nop,TS val 278827779 ecr 278827765], length 1044
1527821795.376039 IP (tos 0x0, ttl 64, id 9196, offset 0, flags [DF], proto TCP (6), length 1096)
    rpi33.lan.46656 > rpi34.lan.52044: Flags [P.], cksum 0xe13f (correct), seq 4177:5221, ack 6264, win 1332, options [nop,nop,TS val 278827779 ecr 278827786], length 1044
1527821795.376070 IP (tos 0x0, ttl 64, id 55766, offset 0, flags [DF], proto TCP (6), length 1096)
    rpi33.lan.46656 > rpi47.lan.39312: Flags [P.], cksum 0xf6d5 (correct), seq 2089:3133, ack 2088, win 1332, options [nop,nop,TS val 278827779 ecr 278827575], length 1044
1527821795.376113 IP (tos 0x0, ttl 64, id 57849, offset 0, flags [DF], proto TCP (6), length 1096)
    rpi33.lan.46656 > rpi42.lan.47712: Flags [P.], cksum 0xad9e (correct), seq 2089:3133, ack 3132, win 1332, options [nop,nop,TS val 278827779 ecr 278827759], length 1044
1527821795.376410 IP (tos 0x0, ttl 64, id 2873, offset 0, flags [DF], proto TCP (6), length 1096)
    rpi33.lan.44546 > rpi38.lan.46656: Flags [P.], cksum 0x889a (incorrect -> 0x5e16), seq 2088:3132, ack 2089, win 1324, options [nop,nop,TS val 278827779 ecr 278826112], length 1044
1527821795.376437 IP (tos 0x0, ttl 64, id 7, offset 0, flags [DF], proto TCP (6), length 1096)
    rpi33.lan.46656 > rpi40.lan.33420: Flags [P.], cksum 0x5b2d (correct), seq 2089:3133, ack 3132, win 1332, options [nop,nop,TS val 278827779 ecr 278825602], length 1044
1527821795.376459 IP (tos 0x0, ttl 64, id 37744, offset 0, flags [DF], proto TCP (6), length 1096)
    rpi33.lan.55328 > rpi39.lan.46656: Flags [P.], cksum 0x889b (incorrect -> 0x6b32), seq 2089:3133, ack 3132, win 1324, options [nop,nop,TS val 278827779 ecr 278827777], length 1044
1527821795.376616 IP (tos 0x0, ttl 64, id 55993, offset 0, flags [DF], proto TCP (6), length 1096)
    rpi33.lan.36124 > rpi45.lan.46656: Flags [P.], cksum 0x88a1 (incorrect -> 0xfe96), seq 2089:3133, ack 3132, win 1324, options [nop,nop,TS val 278827779 ecr 278825749], length 1044
1527821795.376643 IP (tos 0x0, ttl 64, id 38582, offset 0, flags [DF], proto TCP (6), length 1096)
    rpi33.lan.46656 > rpi46.lan.34468: Flags [P.], cksum 0x7292 (correct), seq 2089:3133, ack 3132, win 1332, options [nop,nop,TS val 278827779 ecr 3428771317], length 1044
1527821795.376652 IP (tos 0x0, ttl 64, id 51946, offset 0, flags [DF], proto TCP (6), length 52)
    rpi37.lan.36362 > rpi33.lan.46656: Flags [.], cksum 0x275d (correct), ack 3133, win 1323, options [nop,nop,TS val 278827763 ecr 278827779], length 0
1527821795.376666 IP (tos 0x0, ttl 64, id 4314, offset 0, flags [DF], proto TCP (6), length 1096)
    rpi33.lan.58960 > rpi35.lan.46656: Flags [P.], cksum 0x8897 (incorrect -> 0x9cfb), seq 2089:3133, ack 3132, win 1324, options [nop,nop,TS val 278827779 ecr 278826299], length 1044
1527821795.376655 IP (tos 0x0, ttl 64, id 19447, offset 0, flags [DF], proto TCP (6), length 52)
    rpi36.lan.46656 > rpi33.lan.36522: Flags [.], cksum 0xef30 (correct), ack 3133, win 1331, options [nop,nop,TS val 278827778 ecr 278827779], length 0
1527821795.376828 IP (tos 0x0, ttl 64, id 38828, offset 0, flags [DF], proto TCP (6), length 1096)
    rpi33.lan.46328 > rpi44.lan.46656: Flags [P.], cksum 0x88a0 (incorrect -> 0x3a2a), seq 2089:3133, ack 3132, win 1324, options [nop,nop,TS val 278827779 ecr 270970541], length 1044
1527821795.376907 IP (tos 0x0, ttl 64, id 36408, offset 0, flags [DF], proto TCP (6), length 52)
    rpi43.lan.46656 > rpi33.lan.50564: Flags [.], cksum 0xf715 (correct), ack 3133, win 1331, options [nop,nop,TS val 278827767 ecr 278827779], length 0
1527821795.376909 IP (tos 0x0, ttl 64, id 9726, offset 0, flags [DF], proto TCP (6), length 52)
    rpi34.lan.52044 > rpi33.lan.46656: Flags [.], cksum 0x7892 (correct), ack 5221, win 1323, options [nop,nop,TS val 278827787 ecr 278827779], length 0
1527821795.377118 IP (tos 0x0, ttl 64, id 30295, offset 0, flags [DF], proto TCP (6), length 52)
    rpi42.lan.47712 > rpi33.lan.46656: Flags [.], cksum 0xa517 (correct), ack 3133, win 1323, options [nop,nop,TS val 278827759 ecr 278827779], length 0
1527821795.377120 IP (tos 0x0, ttl 64, id 50036, offset 0, flags [DF], proto TCP (6), length 52)
    rpi40.lan.33420 > rpi33.lan.46656: Flags [.], cksum 0xaec5 (correct), ack 3133, win 1323, options [nop,nop,TS val 278825604 ecr 278827779], length 0
1527821795.377312 IP (tos 0x0, ttl 64, id 62294, offset 0, flags [DF], proto TCP (6), length 52)
    rpi47.lan.39312 > rpi33.lan.46656: Flags [.], cksum 0x3ef7 (correct), ack 3133, win 1323, options [nop,nop,TS val 278827775 ecr 278827779], length 0
1527821795.377314 IP (tos 0x0, ttl 64, id 46175, offset 0, flags [DF], proto TCP (6), length 52)
    rpi39.lan.46656 > rpi33.lan.55328: Flags [.], cksum 0xa81f (correct), ack 3133, win 1331, options [nop,nop,TS val 278827779 ecr 278827779], length 0
1527821795.377315 IP (tos 0x0, ttl 64, id 34648, offset 0, flags [DF], proto TCP (6), length 52)
    rpi45.lan.46656 > rpi33.lan.36124: Flags [.], cksum 0x9075 (correct), ack 3133, win 1331, options [nop,nop,TS val 278825753 ecr 278827779], length 0
1527821795.377505 IP (tos 0x0, ttl 64, id 8960, offset 0, flags [DF], proto TCP (6), length 52)
    rpi46.lan.34468 > rpi33.lan.46656: Flags [.], cksum 0x3b5f (correct), ack 3133, win 1323, options [nop,nop,TS val 3428771325 ecr 278827779], length 0
1527821795.377662 IP (tos 0x0, ttl 64, id 19419, offset 0, flags [DF], proto TCP (6), length 52)
    rpi35.lan.46656 > rpi33.lan.58960: Flags [.], cksum 0x2c35 (correct), ack 3133, win 1331, options [nop,nop,TS val 278826301 ecr 278827779], length 0
1527821795.377663 IP (tos 0x0, ttl 64, id 19917, offset 0, flags [DF], proto TCP (6), length 52)
    rpi44.lan.46656 > rpi33.lan.46328: Flags [.], cksum 0xe50b (correct), ack 3133, win 1331, options [nop,nop,TS val 270970543 ecr 278827779], length 0
1527821795.378038 IP (tos 0x0, ttl 64, id 62295, offset 0, flags [DF], proto TCP (6), length 1096)
    rpi47.lan.39312 > rpi33.lan.46656: Flags [P.], cksum 0x85ef (correct), seq 2088:3132, ack 3133, win 1324, options [nop,nop,TS val 278827775 ecr 278827779], length 1044
1527821795.378098 IP (tos 0x0, ttl 64, id 55767, offset 0, flags [DF], proto TCP (6), length 52)
    rpi33.lan.46656 > rpi47.lan.39312: Flags [.], cksum 0x848f (incorrect -> 0x3adb), ack 3132, win 1331, options [nop,nop,TS val 278827779 ecr 278827775], length 0
1527821795.381731 IP (tos 0x0, ttl 64, id 13203, offset 0, flags [DF], proto TCP (6), length 1096)
    rpi38.lan.46656 > rpi33.lan.44546: Flags [P.], cksum 0xb98c (correct), seq 2089:3133, ack 3132, win 1332, options [nop,nop,TS val 278826312 ecr 278827779], length 1044
1527821795.381817 IP (tos 0x0, ttl 64, id 2874, offset 0, flags [DF], proto TCP (6), length 52)
    rpi33.lan.44546 > rpi38.lan.46656: Flags [.], cksum 0x8486 (incorrect -> 0xd8f6), ack 3133, win 1323, options [nop,nop,TS val 278827779 ecr 278826312], length 0
1527821797.350195 IP (tos 0x0, ttl 64, id 34649, offset 0, flags [DF], proto TCP (6), length 1096)
    rpi45.lan.46656 > rpi33.lan.36124: Flags [P.], cksum 0x0457 (correct), seq 3132:4176, ack 3133, win 1332, options [nop,nop,TS val 278825950 ecr 278827779], length 1044
1527821797.355545 IP (tos 0x0, ttl 64, id 19448, offset 0, flags [DF], proto TCP (6), length 1096)
    rpi36.lan.46656 > rpi33.lan.36522: Flags [P.], cksum 0xe02f (correct), seq 3132:4176, ack 3133, win 1332, options [nop,nop,TS val 278827976 ecr 278827779], length 1044
1527821797.361694 IP (tos 0x0, ttl 64, id 36409, offset 0, flags [DF], proto TCP (6), length 1096)
    rpi43.lan.46656 > rpi33.lan.50564: Flags [P.], cksum 0xd026 (correct), seq 3132:4176, ack 3133, win 1332, options [nop,nop,TS val 278827965 ecr 278827779], length 1044
1527821797.361966 IP (tos 0x0, ttl 64, id 19420, offset 0, flags [DF], proto TCP (6), length 1096)
    rpi35.lan.46656 > rpi33.lan.58960: Flags [P.], cksum 0xfdbc (correct), seq 3132:4176, ack 3133, win 1332, options [nop,nop,TS val 278826499 ecr 278827779], length 1044
1527821797.364261 IP (tos 0x0, ttl 64, id 19918, offset 0, flags [DF], proto TCP (6), length 1096)
    rpi44.lan.46656 > rpi33.lan.46328: Flags [P.], cksum 0xffaa (correct), seq 3132:4176, ack 3133, win 1332, options [nop,nop,TS val 270970742 ecr 278827779], length 1044
1527821797.367999 IP (tos 0x0, ttl 64, id 46176, offset 0, flags [DF], proto TCP (6), length 1096)
    rpi39.lan.46656 > rpi33.lan.55328: Flags [P.], cksum 0x4cf0 (correct), seq 3132:4176, ack 3133, win 1332, options [nop,nop,TS val 278827978 ecr 278827779], length 1044
1527821797.369623 IP (tos 0x0, ttl 64, id 9727, offset 0, flags [DF], proto TCP (6), length 1096)
    rpi34.lan.52044 > rpi33.lan.46656: Flags [P.], cksum 0x2c13 (correct), seq 6264:7308, ack 5221, win 1324, options [nop,nop,TS val 278827987 ecr 278827779], length 1044
1527821797.370049 IP (tos 0x0, ttl 64, id 50037, offset 0, flags [DF], proto TCP (6), length 1096)
    rpi40.lan.33420 > rpi33.lan.46656: Flags [P.], cksum 0xcf36 (correct), seq 3132:4176, ack 3133, win 1324, options [nop,nop,TS val 278825803 ecr 278827779], length 1044
1527821797.373626 IP (tos 0x0, ttl 64, id 8961, offset 0, flags [DF], proto TCP (6), length 1096)
    rpi46.lan.34468 > rpi33.lan.46656: Flags [P.], cksum 0x0e30 (correct), seq 3132:4176, ack 3133, win 1324, options [nop,nop,TS val 3428773321 ecr 278827779], length 1044
1527821797.377209 IP (tos 0x0, ttl 64, id 51947, offset 0, flags [DF], proto TCP (6), length 1096)
    rpi37.lan.36362 > rpi33.lan.46656: Flags [P.], cksum 0x7d6b (correct), seq 3132:4176, ack 3133, win 1324, options [nop,nop,TS val 278827963 ecr 278827779], length 1044
1527821797.377413 IP (tos 0x0, ttl 64, id 30296, offset 0, flags [DF], proto TCP (6), length 1096)
    rpi42.lan.47712 > rpi33.lan.46656: Flags [P.], cksum 0xc928 (correct), seq 3132:4176, ack 3133, win 1324, options [nop,nop,TS val 278827959 ecr 278827779], length 1044
1527821797.379160 IP (tos 0x0, ttl 64, id 9197, offset 0, flags [DF], proto TCP (6), length 1096)
    rpi33.lan.46656 > rpi34.lan.52044: Flags [P.], cksum 0x7d9c (correct), seq 5221:6265, ack 7308, win 1332, options [nop,nop,TS val 278827979 ecr 278827987], length 1044
1527821797.379317 IP (tos 0x0, ttl 64, id 53543, offset 0, flags [DF], proto TCP (6), length 1096)
    rpi33.lan.36522 > rpi36.lan.46656: Flags [P.], cksum 0x8898 (incorrect -> 0x60e8), seq 3133:4177, ack 4176, win 1324, options [nop,nop,TS val 278827979 ecr 278827976], length 1044
1527821797.379349 IP (tos 0x0, ttl 64, id 4315, offset 0, flags [DF], proto TCP (6), length 1096)
    rpi33.lan.58960 > rpi35.lan.46656: Flags [P.], cksum 0x8897 (incorrect -> 0x7d69), seq 3133:4177, ack 4176, win 1324, options [nop,nop,TS val 278827979 ecr 278826499], length 1044
1527821797.379617 IP (tos 0x0, ttl 64, id 49989, offset 0, flags [DF], proto TCP (6), length 1096)
    rpi33.lan.46656 > rpi37.lan.36362: Flags [P.], cksum 0xc0bc (correct), seq 3133:4177, ack 4176, win 1332, options [nop,nop,TS val 278827979 ecr 278827963], length 1044
1527821797.379699 IP (tos 0x0, ttl 64, id 2875, offset 0, flags [DF], proto TCP (6), length 1096)
    rpi33.lan.44546 > rpi38.lan.46656: Flags [P.], cksum 0x889a (incorrect -> 0xd2ab), seq 3132:4176, ack 3133, win 1324, options [nop,nop,TS val 278827979 ecr 278826312], length 1044
1527821797.379779 IP (tos 0x0, ttl 64, id 37745, offset 0, flags [DF], proto TCP (6), length 1096)
    rpi33.lan.55328 > rpi39.lan.46656: Flags [P.], cksum 0x889b (incorrect -> 0xf6e5), seq 3133:4177, ack 4176, win 1324, options [nop,nop,TS val 278827979 ecr 278827978], length 1044
1527821797.379945 IP (tos 0x0, ttl 64, id 9728, offset 0, flags [DF], proto TCP (6), length 52)
    rpi34.lan.52044 > rpi33.lan.46656: Flags [.], cksum 0x6ed9 (correct), ack 6265, win 1323, options [nop,nop,TS val 278827988 ecr 278827979], length 0
1527821797.380000 IP (tos 0x0, ttl 64, id 8, offset 0, flags [DF], proto TCP (6), length 1096)
    rpi33.lan.46656 > rpi40.lan.33420: Flags [P.], cksum 0xce48 (correct), seq 3133:4177, ack 4176, win 1332, options [nop,nop,TS val 278827979 ecr 278825803], length 1044
