1527818635.500959 IP (tos 0x0, ttl 64, id 61138, offset 0, flags [DF], proto TCP (6), length 1096)
    rpi45.lan.42200 > rpi33.lan.46656: Flags [P.], cksum 0x0d10 (correct), seq 2032372036:2032373080, ack 3928942637, win 1324, options [nop,nop,TS val 278509765 ecr 278511594], length 1044
1527818635.508354 IP (tos 0x0, ttl 64, id 58991, offset 0, flags [DF], proto TCP (6), length 1096)
    rpi44.lan.53452 > rpi33.lan.46656: Flags [P.], cksum 0x03e6 (correct), seq 261923145:261924189, ack 2112130771, win 1324, options [nop,nop,TS val 270654556 ecr 278511594], length 1044
1527818635.509152 IP (tos 0x0, ttl 64, id 4018, offset 0, flags [DF], proto TCP (6), length 1096)
    rpi38.lan.46656 > rpi33.lan.40536: Flags [P.], cksum 0x0f5a (correct), seq 1642228213:1642229257, ack 3526477887, win 1332, options [nop,nop,TS val 278510325 ecr 278511594], length 1044
1527818635.511265 IP (tos 0x0, ttl 64, id 8155, offset 0, flags [DF], proto TCP (6), length 1096)
    rpi46.lan.33956 > rpi33.lan.46656: Flags [P.], cksum 0x0046 (correct), seq 275804217:275805261, ack 613016468, win 1126, options [nop,nop,TS val 3425611449 ecr 278511594], length 1044
1527818635.516053 IP (tos 0x0, ttl 64, id 48943, offset 0, flags [DF], proto TCP (6), length 1096)
    rpi40.lan.32772 > rpi33.lan.46656: Flags [P.], cksum 0x64f4 (correct), seq 746568322:746569366, ack 2806814204, win 1324, options [nop,nop,TS val 278509617 ecr 278511594], length 1044
1527818635.516637 IP (tos 0x0, ttl 64, id 20516, offset 0, flags [DF], proto TCP (6), length 1096)
    rpi39.lan.47594 > rpi33.lan.46656: Flags [P.], cksum 0xaa42 (correct), seq 3308850293:3308851337, ack 1190774068, win 1324, options [nop,nop,TS val 278511793 ecr 278511594], length 1044
1527818635.521833 IP (tos 0x0, ttl 64, id 28197, offset 0, flags [DF], proto TCP (6), length 1096)
    rpi42.lan.46656 > rpi33.lan.58064: Flags [P.], cksum 0x64ed (correct), seq 2918894256:2918895300, ack 4237313937, win 1332, options [nop,nop,TS val 278511773 ecr 278511594], length 1044
1527818635.522673 IP (tos 0x0, ttl 64, id 41743, offset 0, flags [DF], proto TCP (6), length 1096)
    rpi37.lan.46656 > rpi33.lan.40414: Flags [P.], cksum 0x96ec (correct), seq 3676548608:3676549652, ack 3329697935, win 1332, options [nop,nop,TS val 278511778 ecr 278511594], length 1044
1527818635.527324 IP (tos 0x0, ttl 64, id 31894, offset 0, flags [DF], proto TCP (6), length 1096)
    rpi41.lan.46656 > rpi33.lan.39064: Flags [P.], cksum 0xe5e8 (correct), seq 2310073630:2310074674, ack 3747661811, win 1332, options [nop,nop,TS val 1569988437 ecr 278511594], length 1044
1527818635.530601 IP (tos 0x0, ttl 64, id 3743, offset 0, flags [DF], proto TCP (6), length 1096)
    rpi47.lan.38764 > rpi33.lan.46656: Flags [P.], cksum 0x9889 (correct), seq 3231990914:3231991958, ack 4139266958, win 800, options [nop,nop,TS val 278511790 ecr 278511594], length 1044
1527818635.531114 IP (tos 0x0, ttl 64, id 5582, offset 0, flags [DF], proto TCP (6), length 1096)
    rpi34.lan.46656 > rpi33.lan.36610: Flags [P.], cksum 0xf96b (correct), seq 1295272788:1295273832, ack 2184188235, win 1332, options [nop,nop,TS val 278511803 ecr 278511594], length 1044
1527818635.531205 IP (tos 0x0, ttl 64, id 44964, offset 0, flags [DF], proto TCP (6), length 52)
    rpi33.lan.36610 > rpi34.lan.46656: Flags [.], cksum 0x8482 (incorrect -> 0xd53a), ack 1044, win 1323, options [nop,nop,TS val 278511794 ecr 278511803], length 0
1527818635.531401 IP (tos 0x0, ttl 64, id 44965, offset 0, flags [DF], proto TCP (6), length 1096)
    rpi33.lan.36610 > rpi34.lan.46656: Flags [P.], cksum 0x8896 (incorrect -> 0xdc38), seq 1:1045, ack 1044, win 1324, options [nop,nop,TS val 278511794 ecr 278511803], length 1044
1527818635.531435 IP (tos 0x0, ttl 64, id 43722, offset 0, flags [DF], proto TCP (6), length 1096)
    rpi33.lan.39064 > rpi41.lan.46656: Flags [P.], cksum 0x889d (incorrect -> 0xf11a), seq 1:1045, ack 1044, win 1324, options [nop,nop,TS val 278511794 ecr 1569988437], length 1044
1527818635.531716 IP (tos 0x0, ttl 64, id 61621, offset 0, flags [DF], proto TCP (6), length 1096)
    rpi33.lan.46656 > rpi40.lan.32772: Flags [P.], cksum 0x7b0e (correct), seq 1:1045, ack 1044, win 1332, options [nop,nop,TS val 278511794 ecr 278509617], length 1044
1527818635.532010 IP (tos 0x0, ttl 64, id 60183, offset 0, flags [DF], proto TCP (6), length 1096)
    rpi33.lan.58064 > rpi42.lan.46656: Flags [P.], cksum 0x889e (incorrect -> 0xe048), seq 1:1045, ack 1044, win 1324, options [nop,nop,TS val 278511794 ecr 278511773], length 1044
1527818635.532180 IP (tos 0x0, ttl 64, id 5583, offset 0, flags [DF], proto TCP (6), length 52)
    rpi34.lan.46656 > rpi33.lan.36610: Flags [.], cksum 0xd11e (correct), ack 1045, win 1331, options [nop,nop,TS val 278511803 ecr 278511794], length 0
1527818635.532182 IP (tos 0x0, ttl 64, id 31895, offset 0, flags [DF], proto TCP (6), length 52)
    rpi41.lan.46656 > rpi33.lan.39064: Flags [.], cksum 0x29c8 (correct), ack 1045, win 1331, options [nop,nop,TS val 1569988442 ecr 278511794], length 0
1527818635.532405 IP (tos 0x0, ttl 64, id 64036, offset 0, flags [DF], proto TCP (6), length 1096)
    rpi33.lan.60752 > rpi36.lan.46656: Flags [P.], cksum 0x8898 (incorrect -> 0x9a0e), seq 2548736262:2548737306, ack 4083987971, win 1324, options [nop,nop,TS val 278511794 ecr 278511594], length 1044
1527818635.532518 IP (tos 0x0, ttl 64, id 48944, offset 0, flags [DF], proto TCP (6), length 52)
    rpi40.lan.32772 > rpi33.lan.46656: Flags [.], cksum 0xf05f (correct), ack 1045, win 1323, options [nop,nop,TS val 278509619 ecr 278511794], length 0
1527818635.532771 IP (tos 0x0, ttl 64, id 28198, offset 0, flags [DF], proto TCP (6), length 52)
    rpi42.lan.46656 > rpi33.lan.58064: Flags [.], cksum 0xec9a (correct), ack 1045, win 1331, options [nop,nop,TS val 278511775 ecr 278511794], length 0
1527818635.532793 IP (tos 0x0, ttl 64, id 47840, offset 0, flags [DF], proto TCP (6), length 1096)
    rpi33.lan.40536 > rpi38.lan.46656: Flags [P.], cksum 0x889a (incorrect -> 0x8098), seq 1:1045, ack 1044, win 1324, options [nop,nop,TS val 278511794 ecr 278510325], length 1044
1527818635.532822 IP (tos 0x0, ttl 64, id 36534, offset 0, flags [DF], proto TCP (6), length 1096)
    rpi33.lan.46656 > rpi43.lan.41016: Flags [P.], cksum 0xa7c0 (correct), seq 4119715756:4119716800, ack 3132245454, win 1332, options [nop,nop,TS val 278511794 ecr 278511582], length 1044
1527818635.532915 IP (tos 0x0, ttl 64, id 47871, offset 0, flags [DF], proto TCP (6), length 1096)
    rpi33.lan.46656 > rpi39.lan.47594: Flags [P.], cksum 0x9aad (correct), seq 1:1045, ack 1044, win 1332, options [nop,nop,TS val 278511794 ecr 278511793], length 1044
1527818635.533208 IP (tos 0x0, ttl 64, id 17589, offset 0, flags [DF], proto TCP (6), length 1096)
    rpi33.lan.40414 > rpi37.lan.46656: Flags [P.], cksum 0x8899 (incorrect -> 0x075b), seq 1:1045, ack 1044, win 1324, options [nop,nop,TS val 278511794 ecr 278511778], length 1044
1527818635.533536 IP (tos 0x0, ttl 64, id 4019, offset 0, flags [DF], proto TCP (6), length 52)
    rpi38.lan.46656 > rpi33.lan.40536: Flags [.], cksum 0x8d43 (correct), ack 1045, win 1331, options [nop,nop,TS val 278510327 ecr 278511794], length 0
1527818635.533595 IP (tos 0x0, ttl 64, id 42021, offset 0, flags [DF], proto TCP (6), length 1096)
    rpi33.lan.46656 > rpi44.lan.53452: Flags [P.], cksum 0x4213 (correct), seq 1:1045, ack 1044, win 1332, options [nop,nop,TS val 278511794 ecr 270654556], length 1044
1527818635.533651 IP (tos 0x0, ttl 64, id 43162, offset 0, flags [DF], proto TCP (6), length 1096)
    rpi33.lan.46656 > rpi46.lan.33956: Flags [P.], cksum 0xf6ce (correct), seq 1:1045, ack 1044, win 993, options [nop,nop,TS val 278511794 ecr 3425611449], length 1044
1527818635.533727 IP (tos 0x0, ttl 64, id 5994, offset 0, flags [DF], proto TCP (6), length 1096)
    rpi33.lan.46656 > rpi47.lan.38764: Flags [P.], cksum 0x38d3 (correct), seq 1:1045, ack 1044, win 781, options [nop,nop,TS val 278511794 ecr 278511790], length 1044
1527818635.533790 IP (tos 0x0, ttl 64, id 20517, offset 0, flags [DF], proto TCP (6), length 52)
    rpi39.lan.47594 > rpi33.lan.46656: Flags [.], cksum 0xf469 (correct), ack 1045, win 1323, options [nop,nop,TS val 278511794 ecr 278511794], length 0
1527818635.533792 IP (tos 0x0, ttl 64, id 41744, offset 0, flags [DF], proto TCP (6), length 52)
    rpi37.lan.46656 > rpi33.lan.40414: Flags [.], cksum 0x7630 (correct), ack 1045, win 1331, options [nop,nop,TS val 278511779 ecr 278511794], length 0
1527818635.533956 IP (tos 0x0, ttl 64, id 26738, offset 0, flags [DF], proto TCP (6), length 1096)
    rpi33.lan.46656 > rpi45.lan.42200: Flags [P.], cksum 0x3f44 (correct), seq 1:1045, ack 1044, win 1332, options [nop,nop,TS val 278511794 ecr 278509765], length 1044
1527818635.534348 IP (tos 0x0, ttl 64, id 0, offset 0, flags [DF], proto TCP (6), length 1096)
    rpi43.lan.41016 > rpi33.lan.46656: Flags [P.], cksum 0x7fd3 (correct), seq 1:1045, ack 1044, win 1324, options [nop,nop,TS val 278511782 ecr 278511794], length 1044
1527818635.534424 IP (tos 0x0, ttl 64, id 36535, offset 0, flags [DF], proto TCP (6), length 52)
    rpi33.lan.46656 > rpi43.lan.41016: Flags [.], cksum 0x848b (incorrect -> 0x163d), ack 1045, win 1331, options [nop,nop,TS val 278511794 ecr 278511782], length 0
1527818635.534351 IP (tos 0x0, ttl 64, id 58992, offset 0, flags [DF], proto TCP (6), length 52)
    rpi44.lan.53452 > rpi33.lan.46656: Flags [.], cksum 0xe28c (correct), ack 1045, win 1323, options [nop,nop,TS val 270654559 ecr 278511794], length 0
1527818635.534353 IP (tos 0x0, ttl 64, id 8156, offset 0, flags [DF], proto TCP (6), length 52)
    rpi46.lan.33956 > rpi33.lan.46656: Flags [.], cksum 0xd5bf (correct), ack 1045, win 1142, options [nop,nop,TS val 3425611472 ecr 278511794], length 0
1527818635.534690 IP (tos 0x0, ttl 64, id 3744, offset 0, flags [DF], proto TCP (6), length 52)
    rpi47.lan.38764 > rpi33.lan.46656: Flags [.], cksum 0xc74c (correct), ack 1045, win 816, options [nop,nop,TS val 278511791 ecr 278511794], length 0
1527818635.534693 IP (tos 0x0, ttl 64, id 61139, offset 0, flags [DF], proto TCP (6), length 52)
    rpi45.lan.42200 > rpi33.lan.46656: Flags [.], cksum 0x1a78 (correct), ack 1045, win 1323, options [nop,nop,TS val 278509768 ecr 278511794], length 0
1527818635.534860 IP (tos 0x0, ttl 64, id 61828, offset 0, flags [DF], proto TCP (6), length 1096)
    rpi33.lan.54900 > rpi35.lan.46656: Flags [P.], cksum 0x8897 (incorrect -> 0x6e44), seq 4034378249:4034379293, ack 2453592990, win 1324, options [nop,nop,TS val 278511795 ecr 278510119], length 1044
1527818635.535345 IP (tos 0x0, ttl 64, id 63060, offset 0, flags [DF], proto TCP (6), length 1096)
    rpi36.lan.46656 > rpi33.lan.60752: Flags [P.], cksum 0xdc77 (correct), seq 1:1045, ack 1044, win 1332, options [nop,nop,TS val 278511794 ecr 278511794], length 1044
1527818635.535420 IP (tos 0x0, ttl 64, id 64037, offset 0, flags [DF], proto TCP (6), length 52)
    rpi33.lan.60752 > rpi36.lan.46656: Flags [.], cksum 0x8484 (incorrect -> 0xbc80), ack 1045, win 1323, options [nop,nop,TS val 278511795 ecr 278511794], length 0
1527818635.571529 IP (tos 0x0, ttl 64, id 45423, offset 0, flags [DF], proto TCP (6), length 1096)
    rpi35.lan.46656 > rpi33.lan.54900: Flags [P.], cksum 0x771b (correct), seq 1:1045, ack 1044, win 1332, options [nop,nop,TS val 278510320 ecr 278511795], length 1044
1527818635.571632 IP (tos 0x0, ttl 64, id 61829, offset 0, flags [DF], proto TCP (6), length 52)
    rpi33.lan.54900 > rpi35.lan.46656: Flags [.], cksum 0x8483 (incorrect -> 0xa31f), ack 1045, win 1323, options [nop,nop,TS val 278511798 ecr 278510320], length 0
1527818636.428739 IP (tos 0x0, ttl 64, id 17590, offset 0, flags [DF], proto TCP (6), length 1096)
    rpi33.lan.40414 > rpi37.lan.46656: Flags [P.], cksum 0x8899 (incorrect -> 0x52d9), seq 1045:2089, ack 1044, win 1324, options [nop,nop,TS val 278511884 ecr 278511779], length 1044
1527818636.429394 IP (tos 0x0, ttl 64, id 41745, offset 0, flags [DF], proto TCP (6), length 1096)
    rpi37.lan.46656 > rpi33.lan.40414: Flags [P.], cksum 0x085f (correct), seq 1044:2088, ack 1045, win 1332, options [nop,nop,TS val 278511868 ecr 278511794], length 1044
1527818636.429584 IP (tos 0x0, ttl 64, id 41746, offset 0, flags [DF], proto TCP (6), length 52)
    rpi37.lan.46656 > rpi33.lan.40414: Flags [.], cksum 0x6d55 (correct), ack 2089, win 1331, options [nop,nop,TS val 278511868 ecr 278511884], length 0
1527818636.430167 IP (tos 0x0, ttl 64, id 17591, offset 0, flags [DF], proto TCP (6), length 1096)
    rpi33.lan.40414 > rpi37.lan.46656: Flags [P.], cksum 0x8899 (incorrect -> 0xd074), seq 2089:3133, ack 2088, win 1324, options [nop,nop,TS val 278511884 ecr 278511868], length 1044
1527818636.430308 IP (tos 0x0, ttl 64, id 41747, offset 0, flags [DF], proto TCP (6), length 1096)
    rpi37.lan.46656 > rpi33.lan.40414: Flags [P.], cksum 0x275c (correct), seq 2088:3132, ack 2089, win 1332, options [nop,nop,TS val 278511868 ecr 278511884], length 1044
1527818636.474534 IP (tos 0x0, ttl 64, id 17592, offset 0, flags [DF], proto TCP (6), length 52)
    rpi33.lan.40414 > rpi37.lan.46656: Flags [.], cksum 0x8485 (incorrect -> 0x652f), ack 3132, win 1324, options [nop,nop,TS val 278511889 ecr 278511868], length 0
1527818636.480906 IP (tos 0x0, ttl 64, id 41748, offset 0, flags [DF], proto TCP (6), length 52)
    rpi37.lan.46656 > rpi33.lan.40414: Flags [.], cksum 0x6526 (correct), ack 3133, win 1332, options [nop,nop,TS val 278511874 ecr 278511884], length 0
1527818637.504106 IP (tos 0x0, ttl 64, id 61140, offset 0, flags [DF], proto TCP (6), length 1096)
    rpi45.lan.42200 > rpi33.lan.46656: Flags [P.], cksum 0xbffc (correct), seq 1044:2088, ack 1045, win 1324, options [nop,nop,TS val 278509965 ecr 278511794], length 1044
1527818637.510817 IP (tos 0x0, ttl 64, id 58993, offset 0, flags [DF], proto TCP (6), length 1096)
    rpi44.lan.53452 > rpi33.lan.46656: Flags [P.], cksum 0xe08f (correct), seq 1044:2088, ack 1045, win 1324, options [nop,nop,TS val 270654757 ecr 278511794], length 1044
1527818637.513181 IP (tos 0x0, ttl 64, id 4020, offset 0, flags [DF], proto TCP (6), length 1096)
    rpi38.lan.46656 > rpi33.lan.40536: Flags [P.], cksum 0x5827 (correct), seq 1044:2088, ack 1045, win 1332, options [nop,nop,TS val 278510525 ecr 278511794], length 1044
1527818637.514483 IP (tos 0x0, ttl 64, id 8157, offset 0, flags [DF], proto TCP (6), length 1096)
    rpi46.lan.33956 > rpi33.lan.46656: Flags [P.], cksum 0x8e44 (correct), seq 1044:2088, ack 1045, win 1142, options [nop,nop,TS val 3425613452 ecr 278511794], length 1044
1527818637.519209 IP (tos 0x0, ttl 64, id 20518, offset 0, flags [DF], proto TCP (6), length 1096)
    rpi39.lan.47594 > rpi33.lan.46656: Flags [P.], cksum 0x41bf (correct), seq 1044:2088, ack 1045, win 1324, options [nop,nop,TS val 278511993 ecr 278511794], length 1044
1527818637.521135 IP (tos 0x0, ttl 64, id 48945, offset 0, flags [DF], proto TCP (6), length 1096)
    rpi40.lan.32772 > rpi33.lan.46656: Flags [P.], cksum 0xb781 (correct), seq 1044:2088, ack 1045, win 1324, options [nop,nop,TS val 278509818 ecr 278511794], length 1044
1527818637.525286 IP (tos 0x0, ttl 64, id 28199, offset 0, flags [DF], proto TCP (6), length 1096)
    rpi42.lan.46656 > rpi33.lan.58064: Flags [P.], cksum 0xc4bf (correct), seq 1044:2088, ack 1045, win 1332, options [nop,nop,TS val 278511974 ecr 278511794], length 1044
1527818637.526775 IP (tos 0x0, ttl 64, id 41749, offset 0, flags [DF], proto TCP (6), length 1096)
    rpi37.lan.46656 > rpi33.lan.40414: Flags [P.], cksum 0x1c76 (correct), seq 3132:4176, ack 3133, win 1332, options [nop,nop,TS val 278511978 ecr 278511884], length 1044
1527818637.526863 IP (tos 0x0, ttl 64, id 17593, offset 0, flags [DF], proto TCP (6), length 52)
    rpi33.lan.40414 > rpi37.lan.46656: Flags [.], cksum 0x8485 (incorrect -> 0x6045), ack 4176, win 1323, options [nop,nop,TS val 278511994 ecr 278511978], length 0
1527818637.531261 IP (tos 0x0, ttl 64, id 31896, offset 0, flags [DF], proto TCP (6), length 1096)
    rpi41.lan.46656 > rpi33.lan.39064: Flags [P.], cksum 0xd04c (correct), seq 1044:2088, ack 1045, win 1332, options [nop,nop,TS val 1569990441 ecr 278511794], length 1044
1527818637.534125 IP (tos 0x0, ttl 64, id 3745, offset 0, flags [DF], proto TCP (6), length 1096)
    rpi47.lan.38764 > rpi33.lan.46656: Flags [P.], cksum 0x82b5 (correct), seq 1044:2088, ack 1045, win 816, options [nop,nop,TS val 278511991 ecr 278511794], length 1044
1527818637.534319 IP (tos 0x0, ttl 64, id 5584, offset 0, flags [DF], proto TCP (6), length 1096)
    rpi34.lan.46656 > rpi33.lan.36610: Flags [P.], cksum 0x1498 (correct), seq 1044:2088, ack 1045, win 1332, options [nop,nop,TS val 278512003 ecr 278511794], length 1044
1527818637.534427 IP (tos 0x0, ttl 64, id 42022, offset 0, flags [DF], proto TCP (6), length 1096)
    rpi33.lan.46656 > rpi44.lan.53452: Flags [P.], cksum 0x10e7 (correct), seq 1045:2089, ack 2088, win 1332, options [nop,nop,TS val 278511994 ecr 270654757], length 1044
1527818637.534491 IP (tos 0x0, ttl 64, id 47841, offset 0, flags [DF], proto TCP (6), length 1096)
    rpi33.lan.40536 > rpi38.lan.46656: Flags [P.], cksum 0x889a (incorrect -> 0x3134), seq 1045:2089, ack 2088, win 1324, options [nop,nop,TS val 278511994 ecr 278510525], length 1044
1527818637.534720 IP (tos 0x0, ttl 64, id 61622, offset 0, flags [DF], proto TCP (6), length 1096)
    rpi33.lan.46656 > rpi40.lan.32772: Flags [P.], cksum 0x3fb7 (correct), seq 1045:2089, ack 2088, win 1332, options [nop,nop,TS val 278511995 ecr 278509818], length 1044
1527818637.534751 IP (tos 0x0, ttl 64, id 26739, offset 0, flags [DF], proto TCP (6), length 1096)
    rpi33.lan.46656 > rpi45.lan.42200: Flags [P.], cksum 0x5dbc (correct), seq 1045:2089, ack 2088, win 1332, options [nop,nop,TS val 278511995 ecr 278509965], length 1044
1527818637.534963 IP (tos 0x0, ttl 64, id 36536, offset 0, flags [DF], proto TCP (6), length 1096)
    rpi33.lan.46656 > rpi43.lan.41016: Flags [P.], cksum 0x06ed (correct), seq 1044:2088, ack 1045, win 1332, options [nop,nop,TS val 278511995 ecr 278511782], length 1044
1527818637.534990 IP (tos 0x0, ttl 64, id 60184, offset 0, flags [DF], proto TCP (6), length 1096)
    rpi33.lan.58064 > rpi42.lan.46656: Flags [P.], cksum 0x889e (incorrect -> 0x7a72), seq 1045:2089, ack 2088, win 1324, options [nop,nop,TS val 278511995 ecr 278511974], length 1044
1527818637.535009 IP (tos 0x0, ttl 64, id 43723, offset 0, flags [DF], proto TCP (6), length 1096)
    rpi33.lan.39064 > rpi41.lan.46656: Flags [P.], cksum 0x889d (incorrect -> 0x6317), seq 1045:2089, ack 2088, win 1324, options [nop,nop,TS val 278511995 ecr 1569990441], length 1044
1527818637.535135 IP (tos 0x0, ttl 64, id 58994, offset 0, flags [DF], proto TCP (6), length 52)
    rpi44.lan.53452 > rpi33.lan.46656: Flags [.], cksum 0xd8d4 (correct), ack 2089, win 1323, options [nop,nop,TS val 270654759 ecr 278511994], length 0
1527818637.535291 IP (tos 0x0, ttl 64, id 4021, offset 0, flags [DF], proto TCP (6), length 52)
    rpi38.lan.46656 > rpi33.lan.40536: Flags [.], cksum 0x838b (correct), ack 2089, win 1331, options [nop,nop,TS val 278510527 ecr 278511994], length 0
1527818637.535476 IP (tos 0x0, ttl 64, id 48946, offset 0, flags [DF], proto TCP (6), length 52)
    rpi40.lan.32772 > rpi33.lan.46656: Flags [.], cksum 0xe6a6 (correct), ack 2089, win 1323, options [nop,nop,TS val 278509819 ecr 278511995], length 0
1527818637.535619 IP (tos 0x0, ttl 64, id 44966, offset 0, flags [DF], proto TCP (6), length 1096)
    rpi33.lan.36610 > rpi34.lan.46656: Flags [P.], cksum 0x8896 (incorrect -> 0xeb87), seq 1045:2089, ack 2088, win 1324, options [nop,nop,TS val 278511995 ecr 278512003], length 1044
1527818637.535678 IP (tos 0x0, ttl 64, id 43163, offset 0, flags [DF], proto TCP (6), length 1096)
    rpi33.lan.46656 > rpi46.lan.33956: Flags [P.], cksum 0xc19e (correct), seq 1045:2089, ack 2088, win 1010, options [nop,nop,TS val 278511995 ecr 3425613452], length 1044
1527818637.535719 IP (tos 0x0, ttl 64, id 64038, offset 0, flags [DF], proto TCP (6), length 1096)
    rpi33.lan.60752 > rpi36.lan.46656: Flags [P.], cksum 0x8898 (incorrect -> 0xb510), seq 1044:2088, ack 1045, win 1324, options [nop,nop,TS val 278511995 ecr 278511794], length 1044
1527818637.535778 IP (tos 0x0, ttl 64, id 61141, offset 0, flags [DF], proto TCP (6), length 52)
    rpi45.lan.42200 > rpi33.lan.46656: Flags [.], cksum 0x10be (correct), ack 2089, win 1323, options [nop,nop,TS val 278509969 ecr 278511995], length 0
1527818637.535887 IP (tos 0x0, ttl 64, id 47872, offset 0, flags [DF], proto TCP (6), length 1096)
    rpi33.lan.46656 > rpi39.lan.47594: Flags [P.], cksum 0x5b2c (correct), seq 1045:2089, ack 2088, win 1332, options [nop,nop,TS val 278511995 ecr 278511993], length 1044
1527818637.535884 IP (tos 0x0, ttl 64, id 28200, offset 0, flags [DF], proto TCP (6), length 52)
    rpi42.lan.46656 > rpi33.lan.58064: Flags [.], cksum 0xe2e1 (correct), ack 2089, win 1331, options [nop,nop,TS val 278511975 ecr 278511995], length 0
1527818637.535886 IP (tos 0x0, ttl 64, id 31897, offset 0, flags [DF], proto TCP (6), length 52)
    rpi41.lan.46656 > rpi33.lan.39064: Flags [.], cksum 0x1903 (correct), ack 2089, win 1331, options [nop,nop,TS val 1569990446 ecr 278511995], length 0
1527818637.535939 IP (tos 0x0, ttl 64, id 61830, offset 0, flags [DF], proto TCP (6), length 1096)
    rpi33.lan.54900 > rpi35.lan.46656: Flags [P.], cksum 0x8897 (incorrect -> 0x9f3b), seq 1044:2088, ack 1045, win 1324, options [nop,nop,TS val 278511995 ecr 278510320], length 1044
1527818637.536052 IP (tos 0x0, ttl 64, id 5995, offset 0, flags [DF], proto TCP (6), length 1096)
    rpi33.lan.46656 > rpi47.lan.38764: Flags [P.], cksum 0x245e (correct), seq 1045:2089, ack 2088, win 798, options [nop,nop,TS val 278511995 ecr 278511991], length 1044
1527818637.536181 IP (tos 0x0, ttl 64, id 17594, offset 0, flags [DF], proto TCP (6), length 1096)
    rpi33.lan.40414 > rpi37.lan.46656: Flags [P.], cksum 0x8899 (incorrect -> 0x5887), seq 3133:4177, ack 4176, win 1324, options [nop,nop,TS val 278511995 ecr 278511978], length 1044
1527818637.536377 IP (tos 0x0, ttl 64, id 5585, offset 0, flags [DF], proto TCP (6), length 52)
    rpi34.lan.46656 > rpi33.lan.36610: Flags [.], cksum 0xc765 (correct), ack 2089, win 1331, options [nop,nop,TS val 278512003 ecr 278511995], length 0
1527818637.536379 IP (tos 0x0, ttl 64, id 8158, offset 0, flags [DF], proto TCP (6), length 52)
    rpi46.lan.33956 > rpi33.lan.46656: Flags [.], cksum 0xc4ec (correct), ack 2089, win 1158, options [nop,nop,TS val 3425613474 ecr 278511995], length 0
1527818637.536662 IP (tos 0x0, ttl 64, id 20519, offset 0, flags [DF], proto TCP (6), length 52)
    rpi39.lan.47594 > rpi33.lan.46656: Flags [.], cksum 0xeaaf (correct), ack 2089, win 1323, options [nop,nop,TS val 278511995 ecr 278511995], length 0
1527818637.536939 IP (tos 0x0, ttl 64, id 41750, offset 0, flags [DF], proto TCP (6), length 52)
    rpi37.lan.46656 > rpi33.lan.40414: Flags [.], cksum 0x5c27 (correct), ack 4177, win 1331, options [nop,nop,TS val 278511979 ecr 278511995], length 0
1527818637.536941 IP (tos 0x0, ttl 64, id 3746, offset 0, flags [DF], proto TCP (6), length 52)
    rpi47.lan.38764 > rpi33.lan.46656: Flags [.], cksum 0xbd83 (correct), ack 2089, win 832, options [nop,nop,TS val 278511991 ecr 278511995], length 0
1527818637.537541 IP (tos 0x0, ttl 64, id 1, offset 0, flags [DF], proto TCP (6), length 1096)
    rpi43.lan.41016 > rpi33.lan.46656: Flags [P.], cksum 0x3e86 (correct), seq 1045:2089, ack 2088, win 1324, options [nop,nop,TS val 278511983 ecr 278511995], length 1044
1527818637.537610 IP (tos 0x0, ttl 64, id 36537, offset 0, flags [DF], proto TCP (6), length 52)
    rpi33.lan.46656 > rpi43.lan.41016: Flags [.], cksum 0x848b (incorrect -> 0x0c83), ack 2089, win 1331, options [nop,nop,TS val 278511995 ecr 278511983], length 0
1527818637.538698 IP (tos 0x0, ttl 64, id 63061, offset 0, flags [DF], proto TCP (6), length 1096)
    rpi36.lan.46656 > rpi33.lan.60752: Flags [P.], cksum 0x4973 (correct), seq 1045:2089, ack 2088, win 1332, options [nop,nop,TS val 278511995 ecr 278511995], length 1044
1527818637.538763 IP (tos 0x0, ttl 64, id 64039, offset 0, flags [DF], proto TCP (6), length 52)
    rpi33.lan.60752 > rpi36.lan.46656: Flags [.], cksum 0x8484 (incorrect -> 0xb2c7), ack 2089, win 1323, options [nop,nop,TS val 278511995 ecr 278511995], length 0
1527818637.572636 IP (tos 0x0, ttl 64, id 45424, offset 0, flags [DF], proto TCP (6), length 1096)
    rpi35.lan.46656 > rpi33.lan.54900: Flags [P.], cksum 0x2daf (correct), seq 1045:2089, ack 2088, win 1332, options [nop,nop,TS val 278510520 ecr 278511995], length 1044
1527818637.572726 IP (tos 0x0, ttl 64, id 61831, offset 0, flags [DF], proto TCP (6), length 52)
    rpi33.lan.54900 > rpi35.lan.46656: Flags [.], cksum 0x8483 (incorrect -> 0x9967), ack 2089, win 1323, options [nop,nop,TS val 278511998 ecr 278510520], length 0
1527818637.996311 IP (tos 0x0, ttl 64, id 61832, offset 0, flags [DF], proto TCP (6), length 1096)
    rpi33.lan.54900 > rpi35.lan.46656: Flags [P.], cksum 0x8897 (incorrect -> 0x4824), seq 2088:3132, ack 2089, win 1324, options [nop,nop,TS val 278512041 ecr 278510520], length 1044
1527818637.996373 IP (tos 0x0, ttl 64, id 47873, offset 0, flags [DF], proto TCP (6), length 1096)
    rpi33.lan.46656 > rpi39.lan.47594: Flags [P.], cksum 0x6a96 (correct), seq 2089:3133, ack 2088, win 1332, options [nop,nop,TS val 278512041 ecr 278511995], length 1044
1527818637.996391 IP (tos 0x0, ttl 64, id 64040, offset 0, flags [DF], proto TCP (6), length 1096)
    rpi33.lan.60752 > rpi36.lan.46656: Flags [P.], cksum 0x8898 (incorrect -> 0xce6c), seq 2088:3132, ack 2089, win 1324, options [nop,nop,TS val 278512041 ecr 278511995], length 1044
1527818637.996407 IP (tos 0x0, ttl 64, id 47842, offset 0, flags [DF], proto TCP (6), length 1096)
    rpi33.lan.40536 > rpi38.lan.46656: Flags [P.], cksum 0x889a (incorrect -> 0x5431), seq 2089:3133, ack 2088, win 1324, options [nop,nop,TS val 278512041 ecr 278510527], length 1044
1527818637.996517 IP (tos 0x0, ttl 64, id 61623, offset 0, flags [DF], proto TCP (6), length 1096)
    rpi33.lan.46656 > rpi40.lan.32772: Flags [P.], cksum 0xbf15 (correct), seq 2089:3133, ack 2088, win 1332, options [nop,nop,TS val 278512041 ecr 278509819], length 1044
1527818637.996542 IP (tos 0x0, ttl 64, id 44967, offset 0, flags [DF], proto TCP (6), length 1096)
    rpi33.lan.36610 > rpi34.lan.46656: Flags [P.], cksum 0x8896 (incorrect -> 0xc854), seq 2089:3133, ack 2088, win 1324, options [nop,nop,TS val 278512041 ecr 278512003], length 1044
1527818637.996807 IP (tos 0x0, ttl 64, id 60185, offset 0, flags [DF], proto TCP (6), length 1096)
    rpi33.lan.58064 > rpi42.lan.46656: Flags [P.], cksum 0x889e (incorrect -> 0xa4a6), seq 2089:3133, ack 2088, win 1324, options [nop,nop,TS val 278512041 ecr 278511975], length 1044
1527818637.996834 IP (tos 0x0, ttl 64, id 17595, offset 0, flags [DF], proto TCP (6), length 1096)
    rpi33.lan.40414 > rpi37.lan.46656: Flags [P.], cksum 0x8899 (incorrect -> 0x0b4f), seq 4177:5221, ack 4176, win 1324, options [nop,nop,TS val 278512041 ecr 278511979], length 1044
1527818637.996850 IP (tos 0x0, ttl 64, id 43724, offset 0, flags [DF], proto TCP (6), length 1096)
    rpi33.lan.39064 > rpi41.lan.46656: Flags [P.], cksum 0x889d (incorrect -> 0xc361), seq 2089:3133, ack 2088, win 1324, options [nop,nop,TS val 278512041 ecr 1569990446], length 1044
1527818637.996976 IP (tos 0x0, ttl 64, id 5996, offset 0, flags [DF], proto TCP (6), length 1096)
    rpi33.lan.46656 > rpi47.lan.38764: Flags [P.], cksum 0xfbe1 (correct), seq 2089:3133, ack 2088, win 798, options [nop,nop,TS val 278512041 ecr 278511991], length 1044
1527818637.997022 IP (tos 0x0, ttl 64, id 26740, offset 0, flags [DF], proto TCP (6), length 1096)
    rpi33.lan.46656 > rpi45.lan.42200: Flags [P.], cksum 0xe3a6 (correct), seq 2089:3133, ack 2088, win 1332, options [nop,nop,TS val 278512041 ecr 278509969], length 1044
1527818637.997048 IP (tos 0x0, ttl 64, id 36538, offset 0, flags [DF], proto TCP (6), length 1096)
    rpi33.lan.46656 > rpi43.lan.41016: Flags [P.], cksum 0xdb68 (correct), seq 2088:3132, ack 2089, win 1332, options [nop,nop,TS val 278512041 ecr 278511983], length 1044
1527818637.997068 IP (tos 0x0, ttl 64, id 42023, offset 0, flags [DF], proto TCP (6), length 1096)
    rpi33.lan.46656 > rpi44.lan.53452: Flags [P.], cksum 0xd79b (correct), seq 2089:3133, ack 2088, win 1332, options [nop,nop,TS val 278512041 ecr 270654759], length 1044
1527818637.997342 IP (tos 0x0, ttl 64, id 20520, offset 0, flags [DF], proto TCP (6), length 52)
    rpi39.lan.47594 > rpi33.lan.46656: Flags [.], cksum 0xe63f (correct), ack 3133, win 1323, options [nop,nop,TS val 278512041 ecr 278512041], length 0
1527818637.997496 IP (tos 0x0, ttl 64, id 4022, offset 0, flags [DF], proto TCP (6), length 52)
    rpi38.lan.46656 > rpi33.lan.40536: Flags [.], cksum 0x7f19 (correct), ack 3133, win 1331, options [nop,nop,TS val 278510574 ecr 278512041], length 0
1527818637.997498 IP (tos 0x0, ttl 64, id 48947, offset 0, flags [DF], proto TCP (6), length 52)
    rpi40.lan.32772 > rpi33.lan.46656: Flags [.], cksum 0xe235 (correct), ack 3133, win 1323, options [nop,nop,TS val 278509866 ecr 278512041], length 0
1527818637.997607 IP (tos 0x0, ttl 64, id 43164, offset 0, flags [DF], proto TCP (6), length 1096)
    rpi33.lan.46656 > rpi46.lan.33956: Flags [P.], cksum 0x6fce (correct), seq 2089:3133, ack 2088, win 1010, options [nop,nop,TS val 278512041 ecr 3425613474], length 1044
1527818637.997729 IP (tos 0x0, ttl 64, id 5586, offset 0, flags [DF], proto TCP (6), length 52)
    rpi34.lan.46656 > rpi33.lan.36610: Flags [.], cksum 0xc2f4 (correct), ack 3133, win 1331, options [nop,nop,TS val 278512050 ecr 278512041], length 0
1527818637.997730 IP (tos 0x0, ttl 64, id 28201, offset 0, flags [DF], proto TCP (6), length 52)
    rpi42.lan.46656 > rpi33.lan.58064: Flags [.], cksum 0xde71 (correct), ack 3133, win 1331, options [nop,nop,TS val 278512021 ecr 278512041], length 0
1527818637.997851 IP (tos 0x0, ttl 64, id 41751, offset 0, flags [DF], proto TCP (6), length 52)
    rpi37.lan.46656 > rpi33.lan.40414: Flags [.], cksum 0x57b7 (correct), ack 5221, win 1331, options [nop,nop,TS val 278512025 ecr 278512041], length 0
1527818637.997853 IP (tos 0x0, ttl 64, id 31898, offset 0, flags [DF], proto TCP (6), length 52)
    rpi41.lan.46656 > rpi33.lan.39064: Flags [.], cksum 0x12f3 (correct), ack 3133, win 1331, options [nop,nop,TS val 1569990908 ecr 278512041], length 0
1527818637.998147 IP (tos 0x0, ttl 64, id 61142, offset 0, flags [DF], proto TCP (6), length 52)
    rpi45.lan.42200 > rpi33.lan.46656: Flags [.], cksum 0x0c4e (correct), ack 3133, win 1323, options [nop,nop,TS val 278510015 ecr 278512041], length 0
1527818637.998148 IP (tos 0x0, ttl 64, id 3747, offset 0, flags [DF], proto TCP (6), length 52)
    rpi47.lan.38764 > rpi33.lan.46656: Flags [.], cksum 0xb903 (correct), ack 3133, win 848, options [nop,nop,TS val 278512037 ecr 278512041], length 0
1527818637.998319 IP (tos 0x0, ttl 64, id 58995, offset 0, flags [DF], proto TCP (6), length 52)
    rpi44.lan.53452 > rpi33.lan.46656: Flags [.], cksum 0xd463 (correct), ack 3133, win 1323, options [nop,nop,TS val 270654805 ecr 278512041], length 0
1527818637.998320 IP (tos 0x0, ttl 64, id 8159, offset 0, flags [DF], proto TCP (6), length 52)
    rpi46.lan.33956 > rpi33.lan.46656: Flags [.], cksum 0xbecb (correct), ack 3133, win 1175, options [nop,nop,TS val 3425613936 ecr 278512041], length 0
1527818638.044109 IP (tos 0x0, ttl 64, id 2, offset 0, flags [DF], proto TCP (6), length 52)
    rpi43.lan.41016 > rpi33.lan.46656: Flags [.], cksum 0x0815 (correct), ack 3132, win 1324, options [nop,nop,TS val 278512034 ecr 278512041], length 0
1527818638.046305 IP (tos 0x0, ttl 64, id 45425, offset 0, flags [DF], proto TCP (6), length 52)
    rpi35.lan.46656 > rpi33.lan.54900: Flags [.], cksum 0x94ef (correct), ack 3132, win 1332, options [nop,nop,TS val 278510568 ecr 278512041], length 0
1527818638.046804 IP (tos 0x0, ttl 64, id 63062, offset 0, flags [DF], proto TCP (6), length 52)
    rpi36.lan.46656 > rpi33.lan.60752: Flags [.], cksum 0xae49 (correct), ack 3132, win 1332, options [nop,nop,TS val 278512046 ecr 278512041], length 0
1527818639.426314 IP (tos 0x0, ttl 64, id 8160, offset 0, flags [DF], proto TCP (6), length 1096)
    rpi46.lan.33956 > rpi33.lan.46656: Flags [P.], cksum 0xfbc7 (correct), seq 2088:3132, ack 3133, win 1175, options [nop,nop,TS val 3425615364 ecr 278512041], length 1044
1527818639.474553 IP (tos 0x0, ttl 64, id 43165, offset 0, flags [DF], proto TCP (6), length 52)
    rpi33.lan.46656 > rpi46.lan.33956: Flags [.], cksum 0x848e (incorrect -> 0xb524), ack 3132, win 1026, options [nop,nop,TS val 278512189 ecr 3425615364], length 0
1527818639.506799 IP (tos 0x0, ttl 64, id 61143, offset 0, flags [DF], proto TCP (6), length 1096)
    rpi45.lan.42200 > rpi33.lan.46656: Flags [P.], cksum 0xb7b5 (correct), seq 2088:3132, ack 3133, win 1324, options [nop,nop,TS val 278510166 ecr 278512041], length 1044
1527818639.513797 IP (tos 0x0, ttl 64, id 58996, offset 0, flags [DF], proto TCP (6), length 1096)
    rpi44.lan.53452 > rpi33.lan.46656: Flags [P.], cksum 0x07f3 (correct), seq 2088:3132, ack 3133, win 1324, options [nop,nop,TS val 270654957 ecr 278512041], length 1044
1527818639.516137 IP (tos 0x0, ttl 64, id 4023, offset 0, flags [DF], proto TCP (6), length 1096)
    rpi38.lan.46656 > rpi33.lan.40536: Flags [P.], cksum 0xe2b5 (correct), seq 2088:3132, ack 3133, win 1332, options [nop,nop,TS val 278510725 ecr 278512041], length 1044
1527818639.523154 IP (tos 0x0, ttl 64, id 48948, offset 0, flags [DF], proto TCP (6), length 1096)
    rpi40.lan.32772 > rpi33.lan.46656: Flags [P.], cksum 0xcf85 (correct), seq 2088:3132, ack 3133, win 1324, options [nop,nop,TS val 278510018 ecr 278512041], length 1044
1527818639.523346 IP (tos 0x0, ttl 64, id 20521, offset 0, flags [DF], proto TCP (6), length 1096)
    rpi39.lan.47594 > rpi33.lan.46656: Flags [P.], cksum 0xa6d4 (correct), seq 2088:3132, ack 3133, win 1324, options [nop,nop,TS val 278512193 ecr 278512041], length 1044
1527818639.529725 IP (tos 0x0, ttl 64, id 28202, offset 0, flags [DF], proto TCP (6), length 1096)
    rpi42.lan.46656 > rpi33.lan.58064: Flags [P.], cksum 0xd537 (correct), seq 2088:3132, ack 3133, win 1332, options [nop,nop,TS val 278512174 ecr 278512041], length 1044
1527818639.529920 IP (tos 0x0, ttl 64, id 41752, offset 0, flags [DF], proto TCP (6), length 1096)
    rpi37.lan.46656 > rpi33.lan.40414: Flags [P.], cksum 0x8952 (correct), seq 4176:5220, ack 5221, win 1332, options [nop,nop,TS val 278512178 ecr 278512041], length 1044
1527818639.533225 IP (tos 0x0, ttl 64, id 31899, offset 0, flags [DF], proto TCP (6), length 1096)
    rpi41.lan.46656 > rpi33.lan.39064: Flags [P.], cksum 0x990a (correct), seq 2088:3132, ack 3133, win 1332, options [nop,nop,TS val 1569992443 ecr 278512041], length 1044
1527818639.537480 IP (tos 0x0, ttl 64, id 3748, offset 0, flags [DF], proto TCP (6), length 1096)
    rpi47.lan.38764 > rpi33.lan.46656: Flags [P.], cksum 0xfcf0 (correct), seq 2088:3132, ack 3133, win 848, options [nop,nop,TS val 278512191 ecr 278512041], length 1044
1527818639.537742 IP (tos 0x0, ttl 64, id 60186, offset 0, flags [DF], proto TCP (6), length 1096)
    rpi33.lan.58064 > rpi42.lan.46656: Flags [P.], cksum 0x889e (incorrect -> 0xcf74), seq 3133:4177, ack 3132, win 1324, options [nop,nop,TS val 278512195 ecr 278512174], length 1044
1527818639.537789 IP (tos 0x0, ttl 64, id 42024, offset 0, flags [DF], proto TCP (6), length 1096)
    rpi33.lan.46656 > rpi44.lan.53452: Flags [P.], cksum 0x1c5e (correct), seq 3133:4177, ack 3132, win 1332, options [nop,nop,TS val 278512195 ecr 270654957], length 1044
1527818639.537807 IP (tos 0x0, ttl 64, id 44968, offset 0, flags [DF], proto TCP (6), length 1096)
    rpi33.lan.36610 > rpi34.lan.46656: Flags [P.], cksum 0x8896 (incorrect -> 0xe8a5), seq 3133:4177, ack 2088, win 1324, options [nop,nop,TS val 278512195 ecr 278512050], length 1044
1527818639.537963 IP (tos 0x0, ttl 64, id 36539, offset 0, flags [DF], proto TCP (6), length 1096)
    rpi33.lan.46656 > rpi43.lan.41016: Flags [P.], cksum 0xaadb (correct), seq 3132:4176, ack 2089, win 1332, options [nop,nop,TS val 278512195 ecr 278512034], length 1044
1527818639.538115 IP (tos 0x0, ttl 64, id 64041, offset 0, flags [DF], proto TCP (6), length 1096)
    rpi33.lan.60752 > rpi36.lan.46656: Flags [P.], cksum 0x8898 (incorrect -> 0xc077), seq 3132:4176, ack 2089, win 1324, options [nop,nop,TS val 278512195 ecr 278512046], length 1044
1527818639.538278 IP (tos 0x0, ttl 64, id 5587, offset 0, flags [DF], proto TCP (6), length 1096)
    rpi34.lan.46656 > rpi33.lan.36610: Flags [P.], cksum 0x8283 (correct), seq 2088:3132, ack 3133, win 1332, options [nop,nop,TS val 278512204 ecr 278512041], length 1044
1527818639.538357 IP (tos 0x0, ttl 64, id 5997, offset 0, flags [DF], proto TCP (6), length 1096)
    rpi33.lan.46656 > rpi47.lan.38764: Flags [P.], cksum 0xe08e (correct), seq 3133:4177, ack 3132, win 814, options [nop,nop,TS val 278512195 ecr 278512191], length 1044
1527818639.538387 IP (tos 0x0, ttl 64, id 17596, offset 0, flags [DF], proto TCP (6), length 1096)
    rpi33.lan.40414 > rpi37.lan.46656: Flags [P.], cksum 0x8899 (incorrect -> 0xf2c5), seq 5221:6265, ack 5220, win 1324, options [nop,nop,TS val 278512195 ecr 278512178], length 1044
1527818639.538556 IP (tos 0x0, ttl 64, id 47843, offset 0, flags [DF], proto TCP (6), length 1096)
    rpi33.lan.40536 > rpi38.lan.46656: Flags [P.], cksum 0x889a (incorrect -> 0xa3c3), seq 3133:4177, ack 3132, win 1324, options [nop,nop,TS val 278512195 ecr 278510725], length 1044
1527818639.538594 IP (tos 0x0, ttl 64, id 43725, offset 0, flags [DF], proto TCP (6), length 1096)
    rpi33.lan.39064 > rpi41.lan.46656: Flags [P.], cksum 0x889d (incorrect -> 0xb363), seq 3133:4177, ack 3132, win 1324, options [nop,nop,TS val 278512195 ecr 1569992443], length 1044
1527818639.538590 IP (tos 0x0, ttl 64, id 28203, offset 0, flags [DF], proto TCP (6), length 52)
    rpi42.lan.46656 > rpi33.lan.58064: Flags [.], cksum 0xd515 (correct), ack 4177, win 1331, options [nop,nop,TS val 278512175 ecr 278512195], length 0
1527818639.538592 IP (tos 0x0, ttl 64, id 58997, offset 0, flags [DF], proto TCP (6), length 52)
    rpi44.lan.53452 > rpi33.lan.46656: Flags [.], cksum 0xcb07 (correct), ack 4177, win 1323, options [nop,nop,TS val 270654959 ecr 278512195], length 0
1527818639.538761 IP (tos 0x0, ttl 64, id 3, offset 0, flags [DF], proto TCP (6), length 52)
    rpi43.lan.41016 > rpi33.lan.46656: Flags [.], cksum 0x02d3 (correct), ack 4176, win 1323, options [nop,nop,TS val 278512183 ecr 278512195], length 0
1527818639.538800 IP (tos 0x0, ttl 64, id 43166, offset 0, flags [DF], proto TCP (6), length 1096)
    rpi33.lan.46656 > rpi46.lan.33956: Flags [P.], cksum 0x3a24 (correct), seq 3133:4177, ack 3132, win 1026, options [nop,nop,TS val 278512195 ecr 3425615364], length 1044
1527818639.538827 IP (tos 0x0, ttl 64, id 26741, offset 0, flags [DF], proto TCP (6), length 1096)
    rpi33.lan.46656 > rpi45.lan.42200: Flags [P.], cksum 0x3f29 (correct), seq 3133:4177, ack 3132, win 1332, options [nop,nop,TS val 278512195 ecr 278510166], length 1044
1527818639.538932 IP (tos 0x0, ttl 64, id 61833, offset 0, flags [DF], proto TCP (6), length 1096)
    rpi33.lan.54900 > rpi35.lan.46656: Flags [P.], cksum 0x8897 (incorrect -> 0x6b71), seq 3132:4176, ack 2089, win 1324, options [nop,nop,TS val 278512195 ecr 278510568], length 1044
1527818639.538965 IP (tos 0x0, ttl 64, id 63063, offset 0, flags [DF], proto TCP (6), length 52)
    rpi36.lan.46656 > rpi33.lan.60752: Flags [.], cksum 0xa907 (correct), ack 4176, win 1331, options [nop,nop,TS val 278512195 ecr 278512195], length 0
