1527829193.404525 IP (tos 0x0, ttl 64, id 35403, offset 0, flags [DF], proto TCP (6), length 52)
    rpi33.lan.46656 > rpi41.lan.47604: Flags [.], cksum 0x8489 (incorrect -> 0x5c14), ack 1742259268, win 1323, options [nop,nop,TS val 279567582 ecr 1580546352], length 0
1527829193.643115 IP (tos 0x0, ttl 64, id 46961, offset 0, flags [DF], proto TCP (6), length 1096)
    rpi36.lan.46656 > rpi33.lan.42904: Flags [P.], cksum 0xd62e (correct), seq 2362513266:2362514310, ack 2645206216, win 1332, options [nop,nop,TS val 279567605 ecr 279567559], length 1044
1527829193.643345 IP (tos 0x0, ttl 64, id 7419, offset 0, flags [DF], proto TCP (6), length 52)
    rpi33.lan.42904 > rpi36.lan.46656: Flags [.], cksum 0x8484 (incorrect -> 0xc952), ack 1044, win 1323, options [nop,nop,TS val 279567605 ecr 279567605], length 0
1527829193.643434 IP (tos 0x0, ttl 64, id 46962, offset 0, flags [DF], proto TCP (6), length 1096)
    rpi36.lan.46656 > rpi33.lan.42904: Flags [P.], cksum 0xd37f (correct), seq 1044:2088, ack 1, win 1332, options [nop,nop,TS val 279567605 ecr 279567559], length 1044
1527829193.643494 IP (tos 0x0, ttl 64, id 7420, offset 0, flags [DF], proto TCP (6), length 52)
    rpi33.lan.42904 > rpi36.lan.46656: Flags [.], cksum 0x8484 (incorrect -> 0xc53e), ack 2088, win 1323, options [nop,nop,TS val 279567605 ecr 279567605], length 0
1527829193.700979 IP (tos 0x0, ttl 64, id 36837, offset 0, flags [DF], proto TCP (6), length 1096)
    rpi37.lan.46656 > rpi33.lan.50820: Flags [P.], cksum 0x0b40 (correct), seq 1799438939:1799439983, ack 2619231907, win 1332, options [nop,nop,TS val 279567595 ecr 279567560], length 1044
1527829193.701157 IP (tos 0x0, ttl 64, id 35869, offset 0, flags [DF], proto TCP (6), length 52)
    rpi33.lan.50820 > rpi37.lan.46656: Flags [.], cksum 0x8485 (incorrect -> 0xf8c1), ack 1044, win 1323, options [nop,nop,TS val 279567611 ecr 279567595], length 0
1527829193.701822 IP (tos 0x0, ttl 64, id 36838, offset 0, flags [DF], proto TCP (6), length 1096)
    rpi37.lan.46656 > rpi33.lan.50820: Flags [P.], cksum 0xc0ff (correct), seq 1044:2088, ack 1, win 1332, options [nop,nop,TS val 279567595 ecr 279567560], length 1044
1527829193.701880 IP (tos 0x0, ttl 64, id 35870, offset 0, flags [DF], proto TCP (6), length 52)
    rpi33.lan.50820 > rpi37.lan.46656: Flags [.], cksum 0x8485 (incorrect -> 0xf4ad), ack 2088, win 1323, options [nop,nop,TS val 279567611 ecr 279567595], length 0
1527829193.711799 IP (tos 0x0, ttl 64, id 36687, offset 0, flags [DF], proto TCP (6), length 1096)
    rpi38.lan.46656 > rpi33.lan.50930: Flags [P.], cksum 0x2a9e (correct), seq 2819430466:2819431510, ack 1608661552, win 1332, options [nop,nop,TS val 279566145 ecr 279567559], length 1044
1527829193.711938 IP (tos 0x0, ttl 64, id 33777, offset 0, flags [DF], proto TCP (6), length 52)
    rpi33.lan.50930 > rpi38.lan.46656: Flags [.], cksum 0x8486 (incorrect -> 0x3bf8), ack 1044, win 1323, options [nop,nop,TS val 279567612 ecr 279566145], length 0
1527829193.714273 IP (tos 0x0, ttl 64, id 64053, offset 0, flags [DF], proto TCP (6), length 1096)
    rpi35.lan.46656 > rpi33.lan.37082: Flags [P.], cksum 0xab20 (correct), seq 3401308568:3401309612, ack 3961317922, win 1332, options [nop,nop,TS val 279566134 ecr 279567560], length 1044
1527829193.736733 IP (tos 0x0, ttl 64, id 56552, offset 0, flags [DF], proto TCP (6), length 1096)
    rpi33.lan.37082 > rpi35.lan.46656: Flags [P.], cksum 0x8897 (incorrect -> 0x6790), seq 1:1045, ack 1044, win 1324, options [nop,nop,TS val 279567615 ecr 279566134], length 1044
1527829193.736809 IP (tos 0x0, ttl 64, id 7635, offset 0, flags [DF], proto TCP (6), length 1096)
    rpi33.lan.47036 > rpi34.lan.46656: Flags [P.], cksum 0x8896 (incorrect -> 0x824b), seq 3934307345:3934308389, ack 4165961490, win 1324, options [nop,nop,TS val 279567615 ecr 279567568], length 1044
1527829193.736855 IP (tos 0x0, ttl 64, id 7421, offset 0, flags [DF], proto TCP (6), length 1096)
    rpi33.lan.42904 > rpi36.lan.46656: Flags [P.], cksum 0x8898 (incorrect -> 0x7cc8), seq 1:1045, ack 2088, win 1324, options [nop,nop,TS val 279567615 ecr 279567605], length 1044
1527829193.737016 IP (tos 0x0, ttl 64, id 33224, offset 0, flags [DF], proto TCP (6), length 1096)
    rpi33.lan.46656 > rpi47.lan.40272: Flags [P.], cksum 0xe20f (correct), seq 2960126083:2960127127, ack 3088476242, win 1332, options [nop,nop,TS val 279567615 ecr 279567554], length 1044
1527829193.737045 IP (tos 0x0, ttl 64, id 39509, offset 0, flags [DF], proto TCP (6), length 1096)
    rpi33.lan.46656 > rpi46.lan.35358: Flags [P.], cksum 0xe388 (correct), seq 1609246104:1609247148, ack 3902687627, win 1332, options [nop,nop,TS val 279567615 ecr 3436169160], length 1044
1527829193.737093 IP (tos 0x0, ttl 64, id 857, offset 0, flags [DF], proto TCP (6), length 1096)
    rpi33.lan.46656 > rpi44.lan.54986: Flags [P.], cksum 0x708b (correct), seq 1755954248:1755955292, ack 1920945128, win 1332, options [nop,nop,TS val 279567615 ecr 271710323], length 1044
1527829193.737210 IP (tos 0x0, ttl 64, id 35871, offset 0, flags [DF], proto TCP (6), length 1096)
    rpi33.lan.50820 > rpi37.lan.46656: Flags [P.], cksum 0x8899 (incorrect -> 0x7cec), seq 1:1045, ack 2088, win 1324, options [nop,nop,TS val 279567615 ecr 279567595], length 1044
1527829193.737253 IP (tos 0x0, ttl 64, id 57752, offset 0, flags [DF], proto TCP (6), length 1096)
    rpi33.lan.46656 > rpi45.lan.43814: Flags [P.], cksum 0x5b9c (correct), seq 762339362:762340406, ack 609145587, win 1331, options [nop,nop,TS val 279567615 ecr 279565533], length 1044
1527829193.737451 IP (tos 0x0, ttl 64, id 57753, offset 0, flags [DF], proto TCP (6), length 1096)
    rpi33.lan.46656 > rpi45.lan.43814: Flags [P.], cksum 0xf985 (correct), seq 1044:2088, ack 1, win 1331, options [nop,nop,TS val 279567615 ecr 279565533], length 1044
1527829193.737703 IP (tos 0x0, ttl 64, id 64054, offset 0, flags [DF], proto TCP (6), length 52)
    rpi35.lan.46656 > rpi33.lan.37082: Flags [.], cksum 0x4dcb (correct), ack 1045, win 1331, options [nop,nop,TS val 279566136 ecr 279567615], length 0
1527829193.737707 IP (tos 0x0, ttl 64, id 46963, offset 0, flags [DF], proto TCP (6), length 52)
    rpi36.lan.46656 > rpi33.lan.42904: Flags [.], cksum 0xc10f (correct), ack 1045, win 1331, options [nop,nop,TS val 279567614 ecr 279567615], length 0
1527829193.737709 IP (tos 0x0, ttl 64, id 19546, offset 0, flags [DF], proto TCP (6), length 52)
    rpi34.lan.46656 > rpi33.lan.47036: Flags [.], cksum 0x71ce (correct), ack 1044, win 1331, options [nop,nop,TS val 279567623 ecr 279567615], length 0
1527829193.737915 IP (tos 0x0, ttl 64, id 59063, offset 0, flags [DF], proto TCP (6), length 52)
    rpi46.lan.35358 > rpi33.lan.46656: Flags [.], cksum 0x6ca3 (correct), ack 1044, win 1323, options [nop,nop,TS val 3436169709 ecr 279567615], length 0
1527829193.737966 IP (tos 0x0, ttl 64, id 44525, offset 0, flags [DF], proto TCP (6), length 1096)
    rpi33.lan.33502 > rpi39.lan.46656: Flags [P.], cksum 0x889b (incorrect -> 0xab51), seq 2127975182:2127976226, ack 3156921401, win 1324, options [nop,nop,TS val 279567615 ecr 279567558], length 1044
1527829193.737917 IP (tos 0x0, ttl 64, id 3520, offset 0, flags [DF], proto TCP (6), length 52)
    rpi47.lan.40272 > rpi33.lan.46656: Flags [.], cksum 0xf8e2 (correct), ack 1044, win 1315, options [nop,nop,TS val 279567610 ecr 279567615], length 0
1527829193.737993 IP (tos 0x0, ttl 64, id 33778, offset 0, flags [DF], proto TCP (6), length 1096)
    rpi33.lan.50930 > rpi38.lan.46656: Flags [P.], cksum 0x889a (incorrect -> 0x1d97), seq 1:1045, ack 1044, win 1324, options [nop,nop,TS val 279567615 ecr 279566145], length 1044
1527829193.738136 IP (tos 0x0, ttl 64, id 36348, offset 0, flags [DF], proto TCP (6), length 52)
    rpi44.lan.54986 > rpi33.lan.46656: Flags [.], cksum 0x822d (correct), ack 1044, win 1323, options [nop,nop,TS val 271710379 ecr 279567615], length 0
1527829193.738162 IP (tos 0x0, ttl 64, id 51899, offset 0, flags [DF], proto TCP (6), length 1096)
    rpi33.lan.46656 > rpi48.lan.55640: Flags [P.], cksum 0xc8ab (correct), seq 820966374:820967418, ack 1061557669, win 1332, options [nop,nop,TS val 279567615 ecr 30552170], length 1044
1527829193.738137 IP (tos 0x0, ttl 64, id 36839, offset 0, flags [DF], proto TCP (6), length 52)
    rpi37.lan.46656 > rpi33.lan.50820: Flags [.], cksum 0xf089 (correct), ack 1045, win 1331, options [nop,nop,TS val 279567599 ecr 279567615], length 0
1527829193.738201 IP (tos 0x0, ttl 64, id 24921, offset 0, flags [DF], proto TCP (6), length 1096)
    rpi33.lan.46656 > rpi40.lan.34610: Flags [P.], cksum 0x51f8 (correct), seq 1727799516:1727800560, ack 2744816148, win 1332, options [nop,nop,TS val 279567615 ecr 279565385], length 1044
1527829193.738323 IP (tos 0x0, ttl 64, id 51900, offset 0, flags [DF], proto TCP (6), length 1096)
    rpi33.lan.46656 > rpi48.lan.55640: Flags [P.], cksum 0xa49f (correct), seq 1044:2088, ack 1, win 1332, options [nop,nop,TS val 279567615 ecr 30552170], length 1044
1527829193.738402 IP (tos 0x0, ttl 64, id 5296, offset 0, flags [DF], proto TCP (6), length 1096)
    rpi33.lan.46656 > rpi49.lan.52158: Flags [P.], cksum 0x1974 (correct), seq 2657766019:2657767063, ack 2532242117, win 1332, options [nop,nop,TS val 279567615 ecr 279567551], length 1044
1527829193.738530 IP (tos 0x0, ttl 64, id 26957, offset 0, flags [DF], proto TCP (6), length 1096)
    rpi33.lan.46656 > rpi50.lan.44206: Flags [P.], cksum 0x5000 (correct), seq 2737031762:2737032806, ack 3823344764, win 1271, options [nop,nop,TS val 279567615 ecr 279565404], length 1044
1527829193.738698 IP (tos 0x0, ttl 64, id 10818, offset 0, flags [DF], proto TCP (6), length 52)
    rpi39.lan.46656 > rpi33.lan.33502: Flags [.], cksum 0x7a5c (correct), ack 1044, win 1331, options [nop,nop,TS val 279567614 ecr 279567615], length 0
1527829193.738728 IP (tos 0x0, ttl 64, id 49608, offset 0, flags [DF], proto TCP (6), length 1096)
    rpi33.lan.40196 > rpi42.lan.46656: Flags [P.], cksum 0x889e (incorrect -> 0x9c73), seq 3884220181:3884221225, ack 1556709099, win 1324, options [nop,nop,TS val 279567615 ecr 279567540], length 1044
1527829193.738753 IP (tos 0x0, ttl 64, id 35404, offset 0, flags [DF], proto TCP (6), length 1096)
    rpi33.lan.46656 > rpi41.lan.47604: Flags [P.], cksum 0x1ab0 (correct), seq 0:1044, ack 1, win 1332, options [nop,nop,TS val 279567615 ecr 1580546352], length 1044
1527829193.738942 IP (tos 0x0, ttl 64, id 12256, offset 0, flags [DF], proto TCP (6), length 1096)
    rpi33.lan.56922 > rpi43.lan.46656: Flags [P.], cksum 0x889f (incorrect -> 0xf24f), seq 2846338919:2846339963, ack 2796802273, win 1324, options [nop,nop,TS val 279567615 ecr 279567548], length 1044
1527829193.738957 IP (tos 0x0, ttl 64, id 36688, offset 0, flags [DF], proto TCP (6), length 52)
    rpi38.lan.46656 > rpi33.lan.50930: Flags [.], cksum 0x37d7 (correct), ack 1045, win 1331, options [nop,nop,TS val 279566147 ecr 279567615], length 0
1527829193.738968 IP (tos 0x0, ttl 64, id 4022, offset 0, flags [DF], proto TCP (6), length 1096)
    rpi33.lan.46656 > rpi51.lan.38808: Flags [P.], cksum 0xf525 (correct), seq 450924890:450925934, ack 2415516514, win 1094, options [nop,nop,TS val 279567615 ecr 279567551], length 1044
1527829193.739169 IP (tos 0x0, ttl 64, id 47431, offset 0, flags [DF], proto TCP (6), length 52)
    rpi48.lan.55640 > rpi33.lan.46656: Flags [.], cksum 0xbfa5 (correct), ack 1044, win 1315, options [nop,nop,TS val 30552226 ecr 279567615], length 0
1527829193.739172 IP (tos 0x0, ttl 64, id 47432, offset 0, flags [DF], proto TCP (6), length 52)
    rpi48.lan.55640 > rpi33.lan.46656: Flags [.], cksum 0xbb95 (correct), ack 2088, win 1311, options [nop,nop,TS val 30552226 ecr 279567615], length 0
1527829193.739173 IP (tos 0x0, ttl 64, id 20803, offset 0, flags [DF], proto TCP (6), length 52)
    rpi49.lan.52158 > rpi33.lan.46656: Flags [.], cksum 0x192f (correct), ack 1044, win 1315, options [nop,nop,TS val 279567608 ecr 279567615], length 0
1527829193.739243 IP (tos 0x0, ttl 64, id 54252, offset 0, flags [DF], proto TCP (6), length 1096)
    rpi33.lan.46656 > rpi52.lan.42436: Flags [P.], cksum 0x23be (correct), seq 2453124571:2453125615, ack 759163653, win 749, options [nop,nop,TS val 279567615 ecr 279567554], length 1044
1527829193.739409 IP (tos 0x0, ttl 64, id 54253, offset 0, flags [DF], proto TCP (6), length 1096)
    rpi33.lan.46656 > rpi52.lan.42436: Flags [P.], cksum 0xc303 (correct), seq 1044:2088, ack 1, win 749, options [nop,nop,TS val 279567615 ecr 279567554], length 1044
1527829193.739450 IP (tos 0x0, ttl 64, id 22413, offset 0, flags [DF], proto TCP (6), length 52)
    rpi50.lan.44206 > rpi33.lan.46656: Flags [.], cksum 0xc56d (correct), ack 1044, win 1315, options [nop,nop,TS val 279565460 ecr 279567615], length 0
1527829193.739451 IP (tos 0x0, ttl 64, id 8697, offset 0, flags [DF], proto TCP (6), length 52)
    rpi41.lan.47604 > rpi33.lan.46656: Flags [.], cksum 0x565f (correct), ack 1044, win 1323, options [nop,nop,TS val 1580546736 ecr 279567615], length 0
1527829193.739609 IP (tos 0x0, ttl 64, id 63902, offset 0, flags [DF], proto TCP (6), length 52)
    rpi42.lan.46656 > rpi33.lan.40196: Flags [.], cksum 0x7840 (correct), ack 1044, win 1331, options [nop,nop,TS val 279567595 ecr 279567615], length 0
1527829193.739747 IP (tos 0x0, ttl 64, id 31198, offset 0, flags [DF], proto TCP (6), length 52)
    rpi43.lan.46656 > rpi33.lan.56922: Flags [.], cksum 0xa893 (correct), ack 1044, win 1323, options [nop,nop,TS val 279567603 ecr 279567615], length 0
1527829193.739974 IP (tos 0x0, ttl 64, id 51612, offset 0, flags [DF], proto TCP (6), length 52)
    rpi51.lan.38808 > rpi33.lan.46656: Flags [.], cksum 0xa935 (correct), ack 1044, win 1102, options [nop,nop,TS val 279567606 ecr 279567615], length 0
1527829193.740197 IP (tos 0x0, ttl 64, id 47570, offset 0, flags [DF], proto TCP (6), length 52)
    rpi52.lan.42436 > rpi33.lan.46656: Flags [.], cksum 0x52cf (correct), ack 1044, win 963, options [nop,nop,TS val 279567609 ecr 279567615], length 0
1527829193.740198 IP (tos 0x0, ttl 64, id 47571, offset 0, flags [DF], proto TCP (6), length 52)
    rpi52.lan.42436 > rpi33.lan.46656: Flags [.], cksum 0x4eab (correct), ack 2088, win 979, options [nop,nop,TS val 279567609 ecr 279567615], length 0
1527829193.757042 IP (tos 0x0, ttl 64, id 36349, offset 0, flags [DF], proto TCP (6), length 1096)
    rpi44.lan.54986 > rpi33.lan.46656: Flags [P.], cksum 0x03a7 (correct), seq 1:1045, ack 1044, win 1324, options [nop,nop,TS val 271710381 ecr 279567615], length 1044
1527829193.757259 IP (tos 0x0, ttl 64, id 36350, offset 0, flags [DF], proto TCP (6), length 1096)
    rpi44.lan.54986 > rpi33.lan.46656: Flags [P.], cksum 0x535a (correct), seq 1045:2089, ack 1044, win 1324, options [nop,nop,TS val 271710381 ecr 279567615], length 1044
1527829193.757906 IP (tos 0x0, ttl 64, id 63903, offset 0, flags [DF], proto TCP (6), length 1096)
    rpi42.lan.46656 > rpi33.lan.40196: Flags [P.], cksum 0xea2f (correct), seq 1:1045, ack 1044, win 1332, options [nop,nop,TS val 279567597 ecr 279567615], length 1044
1527829193.758075 IP (tos 0x0, ttl 64, id 858, offset 0, flags [DF], proto TCP (6), length 52)
    rpi33.lan.46656 > rpi44.lan.54986: Flags [.], cksum 0x848c (incorrect -> 0x79f9), ack 2089, win 1331, options [nop,nop,TS val 279567617 ecr 271710381], length 0
1527829193.758181 IP (tos 0x0, ttl 64, id 63904, offset 0, flags [DF], proto TCP (6), length 1096)
    rpi42.lan.46656 > rpi33.lan.40196: Flags [P.], cksum 0x2b09 (correct), seq 1045:2089, ack 1044, win 1332, options [nop,nop,TS val 279567597 ecr 279567615], length 1044
1527829193.758422 IP (tos 0x0, ttl 64, id 49609, offset 0, flags [DF], proto TCP (6), length 52)
    rpi33.lan.40196 > rpi42.lan.46656: Flags [.], cksum 0x848a (incorrect -> 0x701c), ack 2089, win 1323, options [nop,nop,TS val 279567617 ecr 279567597], length 0
1527829193.761411 IP (tos 0x0, ttl 64, id 47572, offset 0, flags [DF], proto TCP (6), length 1096)
    rpi52.lan.42436 > rpi33.lan.46656: Flags [P.], cksum 0x71c0 (correct), seq 1:1045, ack 2088, win 979, options [nop,nop,TS val 279567611 ecr 279567615], length 1044
1527829193.761603 IP (tos 0x0, ttl 64, id 47573, offset 0, flags [DF], proto TCP (6), length 1096)
    rpi52.lan.42436 > rpi33.lan.46656: Flags [P.], cksum 0xc390 (correct), seq 1045:2089, ack 2088, win 979, options [nop,nop,TS val 279567611 ecr 279567615], length 1044
1527829193.761689 IP (tos 0x0, ttl 64, id 54254, offset 0, flags [DF], proto TCP (6), length 52)
    rpi33.lan.46656 > rpi52.lan.42436: Flags [.], cksum 0x8494 (incorrect -> 0x4745), ack 2089, win 781, options [nop,nop,TS val 279567617 ecr 279567611], length 0
1527829193.762162 IP (tos 0x0, ttl 64, id 19547, offset 0, flags [DF], proto TCP (6), length 1096)
    rpi34.lan.46656 > rpi33.lan.47036: Flags [P.], cksum 0x8371 (correct), seq 1:1045, ack 1044, win 1332, options [nop,nop,TS val 279567626 ecr 279567615], length 1044
1527829193.763168 IP (tos 0x0, ttl 64, id 28354, offset 0, flags [DF], proto TCP (6), length 52)
    rpi45.lan.43814 > rpi33.lan.46656: Flags [.], cksum 0x2b5e (correct), ack 2088, win 1323, options [nop,nop,TS val 279565591 ecr 279567615], length 0
1527829193.781465 IP (tos 0x0, ttl 64, id 59293, offset 0, flags [DF], proto TCP (6), length 52)
    rpi40.lan.34610 > rpi33.lan.46656: Flags [.], cksum 0x1b4a (correct), ack 1044, win 1324, options [nop,nop,TS val 279565444 ecr 279567615], length 0
1527829193.798172 IP (tos 0x0, ttl 64, id 46964, offset 0, flags [DF], proto TCP (6), length 1096)
    rpi36.lan.46656 > rpi33.lan.42904: Flags [P.], cksum 0x5892 (correct), seq 2088:3132, ack 1045, win 1332, options [nop,nop,TS val 279567620 ecr 279567615], length 1044
1527829193.798325 IP (tos 0x0, ttl 64, id 7422, offset 0, flags [DF], proto TCP (6), length 52)
    rpi33.lan.42904 > rpi36.lan.46656: Flags [.], cksum 0x8484 (incorrect -> 0xbcf7), ack 3132, win 1323, options [nop,nop,TS val 279567621 ecr 279567620], length 0
1527829193.804536 IP (tos 0x0, ttl 64, id 7636, offset 0, flags [DF], proto TCP (6), length 52)
    rpi33.lan.47036 > rpi34.lan.46656: Flags [.], cksum 0x8482 (incorrect -> 0x6db7), ack 1045, win 1324, options [nop,nop,TS val 279567622 ecr 279567626], length 0
1527829193.807242 IP (tos 0x0, ttl 64, id 36840, offset 0, flags [DF], proto TCP (6), length 1096)
    rpi37.lan.46656 > rpi33.lan.50820: Flags [P.], cksum 0xea43 (correct), seq 2088:3132, ack 1045, win 1332, options [nop,nop,TS val 279567605 ecr 279567615], length 1044
1527829193.807325 IP (tos 0x0, ttl 64, id 35872, offset 0, flags [DF], proto TCP (6), length 52)
    rpi33.lan.50820 > rpi37.lan.46656: Flags [.], cksum 0x8485 (incorrect -> 0xec70), ack 3132, win 1323, options [nop,nop,TS val 279567622 ecr 279567605], length 0
1527829193.807450 IP (tos 0x0, ttl 64, id 28355, offset 0, flags [DF], proto TCP (6), length 1096)
    rpi45.lan.43814 > rpi33.lan.46656: Flags [P.], cksum 0xf973 (correct), seq 1:1045, ack 2088, win 1324, options [nop,nop,TS val 279565595 ecr 279567615], length 1044
1527829193.807505 IP (tos 0x0, ttl 64, id 57754, offset 0, flags [DF], proto TCP (6), length 52)
    rpi33.lan.46656 > rpi45.lan.43814: Flags [.], cksum 0x848d (incorrect -> 0x2737), ack 1045, win 1331, options [nop,nop,TS val 279567622 ecr 279565595], length 0
1527829193.807691 IP (tos 0x0, ttl 64, id 28356, offset 0, flags [DF], proto TCP (6), length 1096)
    rpi45.lan.43814 > rpi33.lan.46656: Flags [P.], cksum 0xb356 (correct), seq 1045:2089, ack 2088, win 1324, options [nop,nop,TS val 279565595 ecr 279567615], length 1044
1527829193.807745 IP (tos 0x0, ttl 64, id 57755, offset 0, flags [DF], proto TCP (6), length 52)
    rpi33.lan.46656 > rpi45.lan.43814: Flags [.], cksum 0x848d (incorrect -> 0x2323), ack 2089, win 1331, options [nop,nop,TS val 279567622 ecr 279565595], length 0
1527829193.813964 IP (tos 0x0, ttl 64, id 36689, offset 0, flags [DF], proto TCP (6), length 1096)
    rpi38.lan.46656 > rpi33.lan.50930: Flags [P.], cksum 0xa8cc (correct), seq 1044:2088, ack 1045, win 1332, options [nop,nop,TS val 279566155 ecr 279567615], length 1044
1527829193.814197 IP (tos 0x0, ttl 64, id 36690, offset 0, flags [DF], proto TCP (6), length 1096)
    rpi38.lan.46656 > rpi33.lan.50930: Flags [P.], cksum 0x18b4 (correct), seq 2088:3132, ack 1045, win 1332, options [nop,nop,TS val 279566155 ecr 279567615], length 1044
1527829193.814394 IP (tos 0x0, ttl 64, id 36691, offset 0, flags [DF], proto TCP (6), length 1096)
    rpi38.lan.46656 > rpi33.lan.50930: Flags [P.], cksum 0x28eb (correct), seq 3132:4176, ack 1045, win 1332, options [nop,nop,TS val 279566155 ecr 279567615], length 1044
1527829193.814592 IP (tos 0x0, ttl 64, id 36692, offset 0, flags [DF], proto TCP (6), length 1096)
    rpi38.lan.46656 > rpi33.lan.50930: Flags [P.], cksum 0x366b (correct), seq 4176:5220, ack 1045, win 1332, options [nop,nop,TS val 279566155 ecr 279567615], length 1044
1527829193.815724 IP (tos 0x0, ttl 64, id 33779, offset 0, flags [DF], proto TCP (6), length 52)
    rpi33.lan.50930 > rpi38.lan.46656: Flags [.], cksum 0x8486 (incorrect -> 0x278b), ack 5220, win 1311, options [nop,nop,TS val 279567623 ecr 279566155], length 0
1527829193.821853 IP (tos 0x0, ttl 64, id 47433, offset 0, flags [DF], proto TCP (6), length 1096)
    rpi48.lan.55640 > rpi33.lan.46656: Flags [P.], cksum 0x850e (correct), seq 1:1045, ack 2088, win 1324, options [nop,nop,TS val 30552234 ecr 279567615], length 1044
1527829193.822048 IP (tos 0x0, ttl 64, id 47434, offset 0, flags [DF], proto TCP (6), length 1096)
    rpi48.lan.55640 > rpi33.lan.46656: Flags [P.], cksum 0x7c60 (correct), seq 1045:2089, ack 2088, win 1324, options [nop,nop,TS val 30552234 ecr 279567615], length 1044
1527829193.822273 IP (tos 0x0, ttl 64, id 47435, offset 0, flags [DF], proto TCP (6), length 1096)
    rpi48.lan.55640 > rpi33.lan.46656: Flags [P.], cksum 0xa350 (correct), seq 2089:3133, ack 2088, win 1324, options [nop,nop,TS val 30552234 ecr 279567615], length 1044
1527829193.823595 IP (tos 0x0, ttl 64, id 51901, offset 0, flags [DF], proto TCP (6), length 52)
    rpi33.lan.46656 > rpi48.lan.55640: Flags [.], cksum 0x8490 (incorrect -> 0xaf41), ack 3133, win 1319, options [nop,nop,TS val 279567623 ecr 30552234], length 0
1527829193.845202 IP (tos 0x0, ttl 64, id 20804, offset 0, flags [DF], proto TCP (6), length 1096)
    rpi49.lan.52158 > rpi33.lan.46656: Flags [P.], cksum 0x5821 (correct), seq 1:1045, ack 1044, win 1324, options [nop,nop,TS val 279567618 ecr 279567615], length 1044
1527829193.846065 IP (tos 0x0, ttl 64, id 7637, offset 0, flags [DF], proto TCP (6), length 1096)
    rpi33.lan.47036 > rpi34.lan.46656: Flags [P.], cksum 0x8896 (incorrect -> 0xbd74), seq 1044:2088, ack 1045, win 1324, options [nop,nop,TS val 279567626 ecr 279567626], length 1044
1527829193.846633 IP (tos 0x0, ttl 64, id 56553, offset 0, flags [DF], proto TCP (6), length 1096)
    rpi33.lan.37082 > rpi35.lan.46656: Flags [P.], cksum 0x8897 (incorrect -> 0x9841), seq 1045:2089, ack 1044, win 1324, options [nop,nop,TS val 279567626 ecr 279566136], length 1044
1527829193.846672 IP (tos 0x0, ttl 64, id 5297, offset 0, flags [DF], proto TCP (6), length 1096)
    rpi33.lan.46656 > rpi49.lan.52158: Flags [P.], cksum 0x39d0 (correct), seq 1044:2088, ack 1045, win 1332, options [nop,nop,TS val 279567626 ecr 279567618], length 1044
1527829193.846849 IP (tos 0x0, ttl 64, id 33780, offset 0, flags [DF], proto TCP (6), length 1096)
    rpi33.lan.50930 > rpi38.lan.46656: Flags [P.], cksum 0x889a (incorrect -> 0xd8d8), seq 1045:2089, ack 5220, win 1324, options [nop,nop,TS val 279567626 ecr 279566155], length 1044
1527829193.846878 IP (tos 0x0, ttl 64, id 56554, offset 0, flags [DF], proto TCP (6), length 1096)
    rpi33.lan.37082 > rpi35.lan.46656: Flags [P.], cksum 0x8897 (incorrect -> 0x11f7), seq 2089:3133, ack 1044, win 1324, options [nop,nop,TS val 279567626 ecr 279566136], length 1044
1527829193.847015 IP (tos 0x0, ttl 64, id 56555, offset 0, flags [DF], proto TCP (6), length 1096)
    rpi33.lan.37082 > rpi35.lan.46656: Flags [P.], cksum 0x8897 (incorrect -> 0x1927), seq 3133:4177, ack 1044, win 1324, options [nop,nop,TS val 279567626 ecr 279566136], length 1044
1527829193.847050 IP (tos 0x0, ttl 64, id 33781, offset 0, flags [DF], proto TCP (6), length 1096)
    rpi33.lan.50930 > rpi38.lan.46656: Flags [P.], cksum 0x889a (incorrect -> 0x4da4), seq 2089:3133, ack 5220, win 1324, options [nop,nop,TS val 279567626 ecr 279566155], length 1044
1527829193.847142 IP (tos 0x0, ttl 64, id 56556, offset 0, flags [DF], proto TCP (6), length 1096)
    rpi33.lan.37082 > rpi35.lan.46656: Flags [P.], cksum 0x8897 (incorrect -> 0x9609), seq 4177:5221, ack 1044, win 1324, options [nop,nop,TS val 279567626 ecr 279566136], length 1044
1527829193.847217 IP (tos 0x0, ttl 64, id 33782, offset 0, flags [DF], proto TCP (6), length 1096)
    rpi33.lan.50930 > rpi38.lan.46656: Flags [P.], cksum 0x889a (incorrect -> 0xd647), seq 3133:4177, ack 5220, win 1324, options [nop,nop,TS val 279567626 ecr 279566155], length 1044
1527829193.847329 IP (tos 0x0, ttl 64, id 859, offset 0, flags [DF], proto TCP (6), length 1096)
    rpi33.lan.46656 > rpi44.lan.54986: Flags [P.], cksum 0xa2f7 (correct), seq 1044:2088, ack 2089, win 1332, options [nop,nop,TS val 279567626 ecr 271710381], length 1044
1527829193.847356 IP (tos 0x0, ttl 64, id 33783, offset 0, flags [DF], proto TCP (6), length 1096)
    rpi33.lan.50930 > rpi38.lan.46656: Flags [P.], cksum 0x889a (incorrect -> 0xfcf7), seq 4177:5221, ack 5220, win 1324, options [nop,nop,TS val 279567626 ecr 279566155], length 1044
1527829193.847448 IP (tos 0x0, ttl 64, id 64055, offset 0, flags [DF], proto TCP (6), length 52)
    rpi35.lan.46656 > rpi33.lan.37082: Flags [.], cksum 0x49a1 (correct), ack 2089, win 1331, options [nop,nop,TS val 279566147 ecr 279567626], length 0
1527829193.847472 IP (tos 0x0, ttl 64, id 51902, offset 0, flags [DF], proto TCP (6), length 1096)
    rpi33.lan.46656 > rpi48.lan.55640: Flags [P.], cksum 0xb50a (correct), seq 2088:3132, ack 3133, win 1332, options [nop,nop,TS val 279567626 ecr 30552234], length 1044
1527829193.847560 IP (tos 0x0, ttl 64, id 57756, offset 0, flags [DF], proto TCP (6), length 1096)
    rpi33.lan.46656 > rpi45.lan.43814: Flags [P.], cksum 0x0334 (correct), seq 2088:3132, ack 2089, win 1331, options [nop,nop,TS val 279567626 ecr 279565595], length 1044
1527829193.847632 IP (tos 0x0, ttl 64, id 20805, offset 0, flags [DF], proto TCP (6), length 52)
    rpi49.lan.52158 > rpi33.lan.46656: Flags [.], cksum 0x10ea (correct), ack 2088, win 1323, options [nop,nop,TS val 279567618 ecr 279567626], length 0
1527829193.847654 IP (tos 0x0, ttl 64, id 64056, offset 0, flags [DF], proto TCP (6), length 52)
    rpi35.lan.46656 > rpi33.lan.37082: Flags [.], cksum 0x458d (correct), ack 3133, win 1331, options [nop,nop,TS val 279566147 ecr 279567626], length 0
1527829193.847655 IP (tos 0x0, ttl 64, id 36693, offset 0, flags [DF], proto TCP (6), length 52)
    rpi38.lan.46656 > rpi33.lan.50930: Flags [.], cksum 0x235d (correct), ack 2089, win 1331, options [nop,nop,TS val 279566158 ecr 279567626], length 0
1527829193.847790 IP (tos 0x0, ttl 64, id 7423, offset 0, flags [DF], proto TCP (6), length 1096)
    rpi33.lan.42904 > rpi36.lan.46656: Flags [P.], cksum 0x8898 (incorrect -> 0xd3cf), seq 1045:2089, ack 3132, win 1324, options [nop,nop,TS val 279567626 ecr 279567620], length 1044
1527829193.847823 IP (tos 0x0, ttl 64, id 64057, offset 0, flags [DF], proto TCP (6), length 52)
    rpi35.lan.46656 > rpi33.lan.37082: Flags [.], cksum 0x4181 (correct), ack 4177, win 1323, options [nop,nop,TS val 279566147 ecr 279567626], length 0
1527829193.847824 IP (tos 0x0, ttl 64, id 36694, offset 0, flags [DF], proto TCP (6), length 52)
    rpi38.lan.46656 > rpi33.lan.50930: Flags [.], cksum 0x1f49 (correct), ack 3133, win 1331, options [nop,nop,TS val 279566158 ecr 279567626], length 0
1527829193.847896 IP (tos 0x0, ttl 64, id 12257, offset 0, flags [DF], proto TCP (6), length 1096)
    rpi33.lan.56922 > rpi43.lan.46656: Flags [P.], cksum 0x889f (incorrect -> 0xd089), seq 1044:2088, ack 1, win 1324, options [nop,nop,TS val 279567626 ecr 279567603], length 1044
1527829193.848029 IP (tos 0x0, ttl 64, id 64058, offset 0, flags [DF], proto TCP (6), length 52)
    rpi35.lan.46656 > rpi33.lan.37082: Flags [.], cksum 0x3d71 (correct), ack 5221, win 1319, options [nop,nop,TS val 279566147 ecr 279567626], length 0
1527829193.848030 IP (tos 0x0, ttl 64, id 36695, offset 0, flags [DF], proto TCP (6), length 52)
    rpi38.lan.46656 > rpi33.lan.50930: Flags [.], cksum 0x1b35 (correct), ack 4177, win 1331, options [nop,nop,TS val 279566158 ecr 279567626], length 0
1527829193.848099 IP (tos 0x0, ttl 64, id 7424, offset 0, flags [DF], proto TCP (6), length 1500)
    rpi33.lan.42904 > rpi36.lan.46656: Flags [.], cksum 0x8a2c (incorrect -> 0x6119), seq 2089:3537, ack 3132, win 1324, options [nop,nop,TS val 279567626 ecr 279567620], length 1448
1527829193.848129 IP (tos 0x0, ttl 64, id 44526, offset 0, flags [DF], proto TCP (6), length 1096)
    rpi33.lan.33502 > rpi39.lan.46656: Flags [P.], cksum 0x889b (incorrect -> 0xbddd), seq 1044:2088, ack 1, win 1324, options [nop,nop,TS val 279567626 ecr 279567614], length 1044
1527829193.848155 IP (tos 0x0, ttl 64, id 7425, offset 0, flags [DF], proto TCP (6), length 692)
    rpi33.lan.42904 > rpi36.lan.46656: Flags [P.], cksum 0x8704 (incorrect -> 0x0b0d), seq 3537:4177, ack 3132, win 1324, options [nop,nop,TS val 279567626 ecr 279567620], length 640
1527829193.848277 IP (tos 0x0, ttl 64, id 36696, offset 0, flags [DF], proto TCP (6), length 52)
    rpi38.lan.46656 > rpi33.lan.50930: Flags [.], cksum 0x1729 (correct), ack 5221, win 1323, options [nop,nop,TS val 279566158 ecr 279567626], length 0
1527829193.848354 IP (tos 0x0, ttl 64, id 24922, offset 0, flags [DF], proto TCP (6), length 1096)
    rpi33.lan.46656 > rpi40.lan.34610: Flags [P.], cksum 0x89cf (correct), seq 1044:2088, ack 1, win 1332, options [nop,nop,TS val 279567626 ecr 279565444], length 1044
1527829193.848380 IP (tos 0x0, ttl 64, id 39510, offset 0, flags [DF], proto TCP (6), length 1096)
    rpi33.lan.46656 > rpi46.lan.35358: Flags [P.], cksum 0x3cb4 (correct), seq 1044:2088, ack 1, win 1332, options [nop,nop,TS val 279567626 ecr 3436169709], length 1044
1527829193.848550 IP (tos 0x0, ttl 64, id 35873, offset 0, flags [DF], proto TCP (6), length 1096)
    rpi33.lan.50820 > rpi37.lan.46656: Flags [P.], cksum 0x8899 (incorrect -> 0x2759), seq 1045:2089, ack 3132, win 1324, options [nop,nop,TS val 279567626 ecr 279567605], length 1044
1527829193.848621 IP (tos 0x0, ttl 64, id 26958, offset 0, flags [DF], proto TCP (6), length 1096)
    rpi33.lan.46656 > rpi50.lan.44206: Flags [P.], cksum 0x47a7 (correct), seq 1044:2088, ack 1, win 1271, options [nop,nop,TS val 279567626 ecr 279565460], length 1044
1527829193.848652 IP (tos 0x0, ttl 64, id 47436, offset 0, flags [DF], proto TCP (6), length 52)
    rpi48.lan.55640 > rpi33.lan.46656: Flags [.], cksum 0xab23 (correct), ack 3132, win 1323, options [nop,nop,TS val 30552237 ecr 279567626], length 0
1527829193.848714 IP (tos 0x0, ttl 64, id 35874, offset 0, flags [DF], proto TCP (6), length 1096)
    rpi33.lan.50820 > rpi37.lan.46656: Flags [P.], cksum 0x8899 (incorrect -> 0x688d), seq 2089:3133, ack 3132, win 1324, options [nop,nop,TS val 279567626 ecr 279567605], length 1044
1527829193.848654 IP (tos 0x0, ttl 64, id 46965, offset 0, flags [DF], proto TCP (6), length 52)
    rpi36.lan.46656 > rpi33.lan.42904: Flags [.], cksum 0xb8d1 (correct), ack 2089, win 1331, options [nop,nop,TS val 279567625 ecr 279567626], length 0
1527829193.848820 IP (tos 0x0, ttl 64, id 31199, offset 0, flags [DF], proto TCP (6), length 52)
    rpi43.lan.46656 > rpi33.lan.56922: Flags [.], cksum 0xa46d (correct), ack 2088, win 1319, options [nop,nop,TS val 279567614 ecr 279567626], length 0
1527829193.848837 IP (tos 0x0, ttl 64, id 35405, offset 0, flags [DF], proto TCP (6), length 1096)
    rpi33.lan.46656 > rpi41.lan.47604: Flags [P.], cksum 0x4532 (correct), seq 1044:2088, ack 1, win 1332, options [nop,nop,TS val 279567626 ecr 1580546736], length 1044
1527829193.848822 IP (tos 0x0, ttl 64, id 46966, offset 0, flags [DF], proto TCP (6), length 52)
    rpi36.lan.46656 > rpi33.lan.42904: Flags [.], cksum 0xb329 (correct), ack 3537, win 1331, options [nop,nop,TS val 279567625 ecr 279567626], length 0
1527829193.848871 IP (tos 0x0, ttl 64, id 35875, offset 0, flags [DF], proto TCP (6), length 1096)
    rpi33.lan.50820 > rpi37.lan.46656: Flags [P.], cksum 0x8899 (incorrect -> 0xf29e), seq 3133:4177, ack 3132, win 1324, options [nop,nop,TS val 279567626 ecr 279567605], length 1044
1527829193.849013 IP (tos 0x0, ttl 64, id 10819, offset 0, flags [DF], proto TCP (6), length 52)
    rpi39.lan.46656 > rpi33.lan.33502: Flags [.], cksum 0x763a (correct), ack 2088, win 1323, options [nop,nop,TS val 279567625 ecr 279567626], length 0
1527829193.849015 IP (tos 0x0, ttl 64, id 46967, offset 0, flags [DF], proto TCP (6), length 52)
    rpi36.lan.46656 > rpi33.lan.42904: Flags [.], cksum 0xb0a9 (correct), ack 4177, win 1331, options [nop,nop,TS val 279567625 ecr 279567626], length 0
1527829193.849052 IP (tos 0x0, ttl 64, id 4023, offset 0, flags [DF], proto TCP (6), length 1096)
    rpi33.lan.46656 > rpi51.lan.38808: Flags [P.], cksum 0x1fb0 (correct), seq 1044:2088, ack 1, win 1094, options [nop,nop,TS val 279567626 ecr 279567606], length 1044
1527829193.849080 IP (tos 0x0, ttl 64, id 33225, offset 0, flags [DF], proto TCP (6), length 1096)
    rpi33.lan.46656 > rpi47.lan.40272: Flags [P.], cksum 0x689e (correct), seq 1044:2088, ack 1, win 1332, options [nop,nop,TS val 279567626 ecr 279567610], length 1044
1527829193.849176 IP (tos 0x0, ttl 64, id 59294, offset 0, flags [DF], proto TCP (6), length 52)
    rpi40.lan.34610 > rpi33.lan.46656: Flags [.], cksum 0x1726 (correct), ack 2088, win 1323, options [nop,nop,TS val 279565450 ecr 279567626], length 0
1527829193.849178 IP (tos 0x0, ttl 64, id 59064, offset 0, flags [DF], proto TCP (6), length 52)
    rpi46.lan.35358 > rpi33.lan.46656: Flags [.], cksum 0x681d (correct), ack 2088, win 1315, options [nop,nop,TS val 3436169820 ecr 279567626], length 0
1527829193.849299 IP (tos 0x0, ttl 64, id 49610, offset 0, flags [DF], proto TCP (6), length 1096)
    rpi33.lan.40196 > rpi42.lan.46656: Flags [P.], cksum 0x889e (incorrect -> 0xac88), seq 1044:2088, ack 2089, win 1324, options [nop,nop,TS val 279567626 ecr 279567597], length 1044
1527829193.849494 IP (tos 0x0, ttl 64, id 54255, offset 0, flags [DF], proto TCP (6), length 1096)
    rpi33.lan.46656 > rpi52.lan.42436: Flags [P.], cksum 0x4bde (correct), seq 2088:3132, ack 2089, win 781, options [nop,nop,TS val 279567626 ecr 279567611], length 1044
1527829193.849491 IP (tos 0x0, ttl 64, id 36841, offset 0, flags [DF], proto TCP (6), length 52)
    rpi37.lan.46656 > rpi33.lan.50820: Flags [.], cksum 0xe84b (correct), ack 2089, win 1331, options [nop,nop,TS val 279567610 ecr 279567626], length 0
1527829193.849494 IP (tos 0x0, ttl 64, id 22414, offset 0, flags [DF], proto TCP (6), length 52)
    rpi50.lan.44206 > rpi33.lan.46656: Flags [.], cksum 0xc147 (correct), ack 2088, win 1311, options [nop,nop,TS val 279565471 ecr 279567626], length 0
1527829193.849496 IP (tos 0x0, ttl 64, id 8698, offset 0, flags [DF], proto TCP (6), length 52)
    rpi41.lan.47604 > rpi33.lan.46656: Flags [.], cksum 0x51da (correct), ack 2088, win 1315, options [nop,nop,TS val 1580546846 ecr 279567626], length 0
1527829193.849498 IP (tos 0x0, ttl 64, id 36842, offset 0, flags [DF], proto TCP (6), length 52)
    rpi37.lan.46656 > rpi33.lan.50820: Flags [.], cksum 0xe437 (correct), ack 3133, win 1331, options [nop,nop,TS val 279567610 ecr 279567626], length 0
1527829193.849733 IP (tos 0x0, ttl 64, id 36843, offset 0, flags [DF], proto TCP (6), length 52)
    rpi37.lan.46656 > rpi33.lan.50820: Flags [.], cksum 0xe023 (correct), ack 4177, win 1331, options [nop,nop,TS val 279567610 ecr 279567626], length 0
1527829193.849962 IP (tos 0x0, ttl 64, id 51613, offset 0, flags [DF], proto TCP (6), length 52)
    rpi51.lan.38808 > rpi33.lan.46656: Flags [.], cksum 0xa4fb (correct), ack 2088, win 1118, options [nop,nop,TS val 279567617 ecr 279567626], length 0
1527829193.850114 IP (tos 0x0, ttl 64, id 3521, offset 0, flags [DF], proto TCP (6), length 52)
    rpi47.lan.40272 > rpi33.lan.46656: Flags [.], cksum 0xf4bb (correct), ack 2088, win 1311, options [nop,nop,TS val 279567622 ecr 279567626], length 0
1527829193.854063 IP (tos 0x0, ttl 64, id 64059, offset 0, flags [DF], proto TCP (6), length 1096)
    rpi35.lan.46656 > rpi33.lan.37082: Flags [P.], cksum 0xbf6e (correct), seq 1044:2088, ack 5221, win 1331, options [nop,nop,TS val 279566148 ecr 279567626], length 1044
1527829193.854261 IP (tos 0x0, ttl 64, id 64060, offset 0, flags [DF], proto TCP (6), length 1096)
    rpi35.lan.46656 > rpi33.lan.37082: Flags [P.], cksum 0xa6cb (correct), seq 2088:3132, ack 5221, win 1331, options [nop,nop,TS val 279566148 ecr 279567626], length 1044
1527829193.854434 IP (tos 0x0, ttl 64, id 64061, offset 0, flags [DF], proto TCP (6), length 1096)
    rpi35.lan.46656 > rpi33.lan.37082: Flags [P.], cksum 0x7bd2 (correct), seq 3132:4176, ack 5221, win 1331, options [nop,nop,TS val 279566148 ecr 279567626], length 1044
1527829193.854656 IP (tos 0x0, ttl 64, id 64062, offset 0, flags [DF], proto TCP (6), length 1096)
    rpi35.lan.46656 > rpi33.lan.37082: Flags [P.], cksum 0xfc17 (correct), seq 4176:5220, ack 5221, win 1331, options [nop,nop,TS val 279566148 ecr 279567626], length 1044
1527829193.855791 IP (tos 0x0, ttl 64, id 56557, offset 0, flags [DF], proto TCP (6), length 52)
    rpi33.lan.37082 > rpi35.lan.46656: Flags [.], cksum 0x8483 (incorrect -> 0x2d27), ack 5220, win 1311, options [nop,nop,TS val 279567627 ecr 279566148], length 0
1527829193.861102 IP (tos 0x0, ttl 64, id 63905, offset 0, flags [DF], proto TCP (6), length 1096)
    rpi42.lan.46656 > rpi33.lan.40196: Flags [P.], cksum 0xa730 (correct), seq 2089:3133, ack 2088, win 1332, options [nop,nop,TS val 279567607 ecr 279567626], length 1044
1527829193.861472 IP (tos 0x0, ttl 64, id 63906, offset 0, flags [DF], proto TCP (6), length 1096)
    rpi42.lan.46656 > rpi33.lan.40196: Flags [P.], cksum 0x4ef0 (correct), seq 3133:4177, ack 2088, win 1332, options [nop,nop,TS val 279567607 ecr 279567626], length 1044
1527829193.861818 IP (tos 0x0, ttl 64, id 63907, offset 0, flags [DF], proto TCP (6), length 1096)
    rpi42.lan.46656 > rpi33.lan.40196: Flags [P.], cksum 0xb47d (correct), seq 4177:5221, ack 2088, win 1332, options [nop,nop,TS val 279567607 ecr 279567626], length 1044
1527829193.862180 IP (tos 0x0, ttl 64, id 63908, offset 0, flags [DF], proto TCP (6), length 1096)
    rpi42.lan.46656 > rpi33.lan.40196: Flags [P.], cksum 0x4a2f (correct), seq 5221:6265, ack 2088, win 1332, options [nop,nop,TS val 279567607 ecr 279567626], length 1044
1527829193.869339 IP (tos 0x0, ttl 64, id 47574, offset 0, flags [DF], proto TCP (6), length 1096)
    rpi52.lan.42436 > rpi33.lan.46656: Flags [P.], cksum 0xe034 (correct), seq 2089:3133, ack 3132, win 995, options [nop,nop,TS val 279567622 ecr 279567626], length 1044
1527829193.869742 IP (tos 0x0, ttl 64, id 36351, offset 0, flags [DF], proto TCP (6), length 1096)
    rpi44.lan.54986 > rpi33.lan.46656: Flags [P.], cksum 0xc605 (correct), seq 2089:3133, ack 2088, win 1324, options [nop,nop,TS val 271710392 ecr 279567626], length 1044
1527829193.869745 IP (tos 0x0, ttl 64, id 47575, offset 0, flags [DF], proto TCP (6), length 1096)
    rpi52.lan.42436 > rpi33.lan.46656: Flags [P.], cksum 0x7c30 (correct), seq 3133:4177, ack 3132, win 995, options [nop,nop,TS val 279567622 ecr 279567626], length 1044
1527829193.869932 IP (tos 0x0, ttl 64, id 54256, offset 0, flags [DF], proto TCP (6), length 52)
