1527819035.090101 IP (tos 0x0, ttl 64, id 30829, offset 0, flags [DF], proto TCP (6), length 1096)
    rpi42.lan.46656 > rpi33.lan.58064: Flags [P.], cksum 0xff10 (correct), seq 2920400748:2920401792, ack 4238908125, win 1332, options [nop,nop,TS val 278551730 ecr 278551553], length 1044
1527819035.094155 IP (tos 0x0, ttl 64, id 34488, offset 0, flags [DF], proto TCP (6), length 1096)
    rpi41.lan.46656 > rpi33.lan.39064: Flags [P.], cksum 0x9c18 (correct), seq 2311552978:2311554022, ack 3749261219, win 1332, options [nop,nop,TS val 1570388007 ecr 278551553], length 1044
1527819035.098167 IP (tos 0x0, ttl 64, id 61717, offset 0, flags [DF], proto TCP (6), length 1096)
    rpi44.lan.53452 > rpi33.lan.46656: Flags [P.], cksum 0xffc9 (correct), seq 263496453:263497497, ack 2113707211, win 1324, options [nop,nop,TS val 270694515 ecr 278551553], length 1044
1527819035.099356 IP (tos 0x0, ttl 64, id 44490, offset 0, flags [DF], proto TCP (6), length 1096)
    rpi37.lan.46656 > rpi33.lan.40414: Flags [P.], cksum 0xf7d5 (correct), seq 3678132356:3678133400, ack 3331272287, win 1332, options [nop,nop,TS val 278551735 ecr 278551553], length 1044
1527819035.105115 IP (tos 0x0, ttl 64, id 10798, offset 0, flags [DF], proto TCP (6), length 1096)
    rpi46.lan.33956 > rpi33.lan.46656: Flags [P.], cksum 0x5116 (correct), seq 277349337:277350381, ack 614605436, win 1324, options [nop,nop,TS val 3426011044 ecr 278551553], length 1044
1527819035.107888 IP (tos 0x0, ttl 64, id 6265, offset 0, flags [DF], proto TCP (6), length 1096)
    rpi47.lan.38764 > rpi33.lan.46656: Flags [P.], cksum 0x8a7c (correct), seq 3233429546:3233430590, ack 4140888290, win 1324, options [nop,nop,TS val 278551748 ecr 278551553], length 1044
1527819035.108075 IP (tos 0x0, ttl 64, id 48194, offset 0, flags [DF], proto TCP (6), length 1096)
    rpi35.lan.46656 > rpi33.lan.54900: Flags [P.], cksum 0xb992 (correct), seq 2455185090:2455186134, ack 4035976613, win 1332, options [nop,nop,TS val 278550274 ecr 278551553], length 1044
1527819035.114992 IP (tos 0x0, ttl 64, id 8209, offset 0, flags [DF], proto TCP (6), length 1096)
    rpi34.lan.46656 > rpi33.lan.36610: Flags [P.], cksum 0xc562 (correct), seq 1296842964:1296844008, ack 2185759455, win 1332, options [nop,nop,TS val 278551761 ecr 278551553], length 1044
1527819035.117001 IP (tos 0x0, ttl 64, id 23117, offset 0, flags [DF], proto TCP (6), length 1096)
    rpi39.lan.47594 > rpi33.lan.46656: Flags [P.], cksum 0x8890 (correct), seq 3310366181:3310367225, ack 1192371388, win 1324, options [nop,nop,TS val 278551753 ecr 278551553], length 1044
1527819035.117554 IP (tos 0x0, ttl 64, id 51419, offset 0, flags [DF], proto TCP (6), length 1096)
    rpi40.lan.32772 > rpi33.lan.46656: Flags [P.], cksum 0x4205 (correct), seq 747927610:747928654, ack 2808481472, win 1324, options [nop,nop,TS val 278549578 ecr 278551553], length 1044
1527819035.119204 IP (tos 0x0, ttl 64, id 47638, offset 0, flags [DF], proto TCP (6), length 1096)
    rpi33.lan.36610 > rpi34.lan.46656: Flags [P.], cksum 0x8896 (incorrect -> 0xd11e), seq 1:1045, ack 1044, win 1324, options [nop,nop,TS val 278551753 ecr 278551761], length 1044
1527819035.119610 IP (tos 0x0, ttl 64, id 64365, offset 0, flags [DF], proto TCP (6), length 1096)
    rpi33.lan.46656 > rpi40.lan.32772: Flags [P.], cksum 0x80a7 (correct), seq 1:1045, ack 1044, win 1332, options [nop,nop,TS val 278551753 ecr 278549578], length 1044
1527819035.119643 IP (tos 0x0, ttl 64, id 20149, offset 0, flags [DF], proto TCP (6), length 1096)
    rpi33.lan.40414 > rpi37.lan.46656: Flags [P.], cksum 0x8899 (incorrect -> 0x4002), seq 1:1045, ack 1044, win 1324, options [nop,nop,TS val 278551753 ecr 278551735], length 1044
1527819035.119825 IP (tos 0x0, ttl 64, id 64444, offset 0, flags [DF], proto TCP (6), length 1096)
    rpi33.lan.54900 > rpi35.lan.46656: Flags [P.], cksum 0x8897 (incorrect -> 0xd7de), seq 1:1045, ack 1044, win 1324, options [nop,nop,TS val 278551753 ecr 278550274], length 1044
1527819035.119852 IP (tos 0x0, ttl 64, id 50395, offset 0, flags [DF], proto TCP (6), length 1096)
    rpi33.lan.40536 > rpi38.lan.46656: Flags [P.], cksum 0x889a (incorrect -> 0x92c7), seq 3528036579:3528037623, ack 1643821357, win 1324, options [nop,nop,TS val 278551753 ecr 278550086], length 1044
1527819035.120000 IP (tos 0x0, ttl 64, id 8210, offset 0, flags [DF], proto TCP (6), length 52)
    rpi34.lan.46656 > rpi33.lan.36610: Flags [.], cksum 0xa9ab (correct), ack 1045, win 1331, options [nop,nop,TS val 278551762 ecr 278551753], length 0
1527819035.120042 IP (tos 0x0, ttl 64, id 1094, offset 0, flags [DF], proto TCP (6), length 1096)
    rpi33.lan.60752 > rpi36.lan.46656: Flags [P.], cksum 0x8898 (incorrect -> 0x4785), seq 2550315834:2550316878, ack 4085581115, win 1324, options [nop,nop,TS val 278551753 ecr 278551553], length 1044
1527819035.120070 IP (tos 0x0, ttl 64, id 50565, offset 0, flags [DF], proto TCP (6), length 1096)
    rpi33.lan.46656 > rpi39.lan.47594: Flags [P.], cksum 0x2add (correct), seq 1:1045, ack 1044, win 1332, options [nop,nop,TS val 278551753 ecr 278551753], length 1044
1527819035.120383 IP (tos 0x0, ttl 64, id 51420, offset 0, flags [DF], proto TCP (6), length 52)
    rpi40.lan.32772 > rpi33.lan.46656: Flags [.], cksum 0x8986 (correct), ack 1045, win 1323, options [nop,nop,TS val 278549578 ecr 278551753], length 0
1527819035.120385 IP (tos 0x0, ttl 64, id 44491, offset 0, flags [DF], proto TCP (6), length 52)
    rpi37.lan.46656 > rpi33.lan.40414: Flags [.], cksum 0x0d7e (correct), ack 1045, win 1331, options [nop,nop,TS val 278551737 ecr 278551753], length 0
1527819035.120627 IP (tos 0x0, ttl 64, id 48195, offset 0, flags [DF], proto TCP (6), length 52)
    rpi35.lan.46656 > rpi33.lan.54900: Flags [.], cksum 0xbbff (correct), ack 1045, win 1331, options [nop,nop,TS val 278550275 ecr 278551753], length 0
1527819035.120644 IP (tos 0x0, ttl 64, id 8690, offset 0, flags [DF], proto TCP (6), length 1096)
    rpi33.lan.46656 > rpi47.lan.38764: Flags [P.], cksum 0xb519 (correct), seq 1:1045, ack 1044, win 1332, options [nop,nop,TS val 278551753 ecr 278551748], length 1044
1527819035.120671 IP (tos 0x0, ttl 64, id 39241, offset 0, flags [DF], proto TCP (6), length 1096)
    rpi33.lan.46656 > rpi43.lan.41016: Flags [P.], cksum 0x7cc8 (correct), seq 4121337088:4121338132, ack 3133722714, win 1332, options [nop,nop,TS val 278551753 ecr 278551551], length 1044
1527819035.120830 IP (tos 0x0, ttl 64, id 46358, offset 0, flags [DF], proto TCP (6), length 1096)
    rpi33.lan.39064 > rpi41.lan.46656: Flags [P.], cksum 0x889d (incorrect -> 0x8bcc), seq 1:1045, ack 1044, win 1324, options [nop,nop,TS val 278551753 ecr 1570388007], length 1044
1527819035.120879 IP (tos 0x0, ttl 64, id 44592, offset 0, flags [DF], proto TCP (6), length 1096)
    rpi33.lan.46656 > rpi44.lan.53452: Flags [P.], cksum 0x84a0 (correct), seq 1:1045, ack 1044, win 1332, options [nop,nop,TS val 278551753 ecr 270694515], length 1044
1527819035.121005 IP (tos 0x0, ttl 64, id 284, offset 0, flags [DF], proto TCP (6), length 1096)
    rpi36.lan.46656 > rpi33.lan.60752: Flags [P.], cksum 0x5a6d (correct), seq 1:1045, ack 0, win 1332, options [nop,nop,TS val 278551753 ecr 278551553], length 1044
1527819035.121039 IP (tos 0x0, ttl 64, id 62840, offset 0, flags [DF], proto TCP (6), length 1096)
    rpi33.lan.58064 > rpi42.lan.46656: Flags [P.], cksum 0x889e (incorrect -> 0x524d), seq 1:1045, ack 1044, win 1324, options [nop,nop,TS val 278551753 ecr 278551730], length 1044
1527819035.121079 IP (tos 0x0, ttl 64, id 1095, offset 0, flags [DF], proto TCP (6), length 52)
    rpi33.lan.60752 > rpi36.lan.46656: Flags [.], cksum 0x8484 (incorrect -> 0x1ab6), ack 1045, win 1323, options [nop,nop,TS val 278551753 ecr 278551753], length 0
1527819035.121009 IP (tos 0x0, ttl 64, id 23118, offset 0, flags [DF], proto TCP (6), length 52)
    rpi39.lan.47594 > rpi33.lan.46656: Flags [.], cksum 0x3b13 (correct), ack 1045, win 1323, options [nop,nop,TS val 278551753 ecr 278551753], length 0
1527819035.121297 IP (tos 0x0, ttl 64, id 45763, offset 0, flags [DF], proto TCP (6), length 1096)
    rpi33.lan.46656 > rpi46.lan.33956: Flags [P.], cksum 0xe4f8 (correct), seq 1:1045, ack 1044, win 1332, options [nop,nop,TS val 278551753 ecr 3426011044], length 1044
1527819035.121531 IP (tos 0x0, ttl 64, id 2549, offset 0, flags [DF], proto TCP (6), length 52)
    rpi43.lan.41016 > rpi33.lan.46656: Flags [.], cksum 0x9a1a (correct), ack 1044, win 1323, options [nop,nop,TS val 278551741 ecr 278551753], length 0
1527819035.121534 IP (tos 0x0, ttl 64, id 34489, offset 0, flags [DF], proto TCP (6), length 52)
    rpi41.lan.46656 > rpi33.lan.39064: Flags [.], cksum 0x7a2e (correct), ack 1045, win 1331, options [nop,nop,TS val 1570388035 ecr 278551753], length 0
1527819035.121535 IP (tos 0x0, ttl 64, id 6266, offset 0, flags [DF], proto TCP (6), length 52)
    rpi47.lan.38764 > rpi33.lan.46656: Flags [.], cksum 0xdbf8 (correct), ack 1045, win 1323, options [nop,nop,TS val 278551749 ecr 278551753], length 0
1527819035.121616 IP (tos 0x0, ttl 64, id 29490, offset 0, flags [DF], proto TCP (6), length 1096)
    rpi33.lan.46656 > rpi45.lan.42200: Flags [P.], cksum 0x19ad (correct), seq 3930575453:3930576497, ack 2033813800, win 1332, options [nop,nop,TS val 278551753 ecr 278549567], length 1044
1527819035.121740 IP (tos 0x0, ttl 64, id 61718, offset 0, flags [DF], proto TCP (6), length 52)
    rpi44.lan.53452 > rpi33.lan.46656: Flags [.], cksum 0x9a79 (correct), ack 1045, win 1323, options [nop,nop,TS val 270694518 ecr 278551753], length 0
1527819035.121742 IP (tos 0x0, ttl 64, id 30830, offset 0, flags [DF], proto TCP (6), length 52)
    rpi42.lan.46656 > rpi33.lan.58064: Flags [.], cksum 0x6434 (correct), ack 1045, win 1331, options [nop,nop,TS val 278551734 ecr 278551753], length 0
1527819035.122030 IP (tos 0x0, ttl 64, id 10799, offset 0, flags [DF], proto TCP (6), length 52)
    rpi46.lan.33956 > rpi33.lan.46656: Flags [.], cksum 0x4d50 (correct), ack 1045, win 1323, options [nop,nop,TS val 3426011061 ecr 278551753], length 0
1527819035.124702 IP (tos 0x0, ttl 64, id 63614, offset 0, flags [DF], proto TCP (6), length 1096)
    rpi45.lan.42200 > rpi33.lan.46656: Flags [P.], cksum 0x51c1 (correct), seq 1:1045, ack 1044, win 1324, options [nop,nop,TS val 278549727 ecr 278551753], length 1044
1527819035.124766 IP (tos 0x0, ttl 64, id 29491, offset 0, flags [DF], proto TCP (6), length 52)
    rpi33.lan.46656 > rpi45.lan.42200: Flags [.], cksum 0x848d (incorrect -> 0xf7fc), ack 1045, win 1331, options [nop,nop,TS val 278551754 ecr 278549727], length 0
1527819035.127647 IP (tos 0x0, ttl 64, id 6773, offset 0, flags [DF], proto TCP (6), length 1096)
    rpi38.lan.46656 > rpi33.lan.40536: Flags [P.], cksum 0xd110 (correct), seq 1:1045, ack 1044, win 1332, options [nop,nop,TS val 278550287 ecr 278551753], length 1044
1527819035.127714 IP (tos 0x0, ttl 64, id 50396, offset 0, flags [DF], proto TCP (6), length 52)
    rpi33.lan.40536 > rpi38.lan.46656: Flags [.], cksum 0x8486 (incorrect -> 0x3d0e), ack 1045, win 1323, options [nop,nop,TS val 278551754 ecr 278550287], length 0
1527819035.166773 IP (tos 0x0, ttl 64, id 285, offset 0, flags [DF], proto TCP (6), length 52)
    rpi36.lan.46656 > rpi33.lan.60752: Flags [.], cksum 0x1aa8 (correct), ack 1044, win 1332, options [nop,nop,TS val 278551758 ecr 278551753], length 0
1527819035.227333 IP (tos 0x0, ttl 64, id 2550, offset 0, flags [DF], proto TCP (6), length 1096)
    rpi43.lan.41016 > rpi33.lan.46656: Flags [P.], cksum 0x8dca (correct), seq 1:1045, ack 1044, win 1324, options [nop,nop,TS val 278551752 ecr 278551753], length 1044
1527819035.227435 IP (tos 0x0, ttl 64, id 39242, offset 0, flags [DF], proto TCP (6), length 52)
    rpi33.lan.46656 > rpi43.lan.41016: Flags [.], cksum 0x848b (incorrect -> 0x95e8), ack 1045, win 1331, options [nop,nop,TS val 278551764 ecr 278551752], length 0
1527819035.926334 IP (tos 0x0, ttl 64, id 63615, offset 0, flags [DF], proto TCP (6), length 1096)
    rpi45.lan.42200 > rpi33.lan.46656: Flags [P.], cksum 0x71f8 (correct), seq 1045:2089, ack 1044, win 1324, options [nop,nop,TS val 278549808 ecr 278551754], length 1044
1527819035.926414 IP (tos 0x0, ttl 64, id 29492, offset 0, flags [DF], proto TCP (6), length 52)
    rpi33.lan.46656 > rpi45.lan.42200: Flags [.], cksum 0x848d (incorrect -> 0xf347), ack 2089, win 1331, options [nop,nop,TS val 278551834 ecr 278549808], length 0
1527819035.926579 IP (tos 0x0, ttl 64, id 29493, offset 0, flags [DF], proto TCP (6), length 1096)
    rpi33.lan.46656 > rpi45.lan.42200: Flags [P.], cksum 0xd6f4 (correct), seq 1044:2088, ack 2089, win 1332, options [nop,nop,TS val 278551834 ecr 278549808], length 1044
1527819035.926974 IP (tos 0x0, ttl 64, id 29494, offset 0, flags [DF], proto TCP (6), length 1096)
    rpi33.lan.46656 > rpi45.lan.42200: Flags [P.], cksum 0x446b (correct), seq 2088:3132, ack 2089, win 1332, options [nop,nop,TS val 278551834 ecr 278549808], length 1044
1527819035.927768 IP (tos 0x0, ttl 64, id 63616, offset 0, flags [DF], proto TCP (6), length 52)
    rpi45.lan.42200 > rpi33.lan.46656: Flags [.], cksum 0xeb26 (correct), ack 3132, win 1324, options [nop,nop,TS val 278549808 ecr 278551834], length 0
1527819035.928103 IP (tos 0x0, ttl 64, id 63617, offset 0, flags [DF], proto TCP (6), length 1096)
    rpi45.lan.42200 > rpi33.lan.46656: Flags [P.], cksum 0x3b9a (correct), seq 2089:3133, ack 3132, win 1324, options [nop,nop,TS val 278549808 ecr 278551834], length 1044
1527819035.974504 IP (tos 0x0, ttl 64, id 29495, offset 0, flags [DF], proto TCP (6), length 52)
    rpi33.lan.46656 > rpi45.lan.42200: Flags [.], cksum 0x848d (incorrect -> 0xe705), ack 3133, win 1332, options [nop,nop,TS val 278551839 ecr 278549808], length 0
1527819037.093720 IP (tos 0x0, ttl 64, id 30831, offset 0, flags [DF], proto TCP (6), length 1096)
    rpi42.lan.46656 > rpi33.lan.58064: Flags [P.], cksum 0xe357 (correct), seq 1044:2088, ack 1045, win 1332, options [nop,nop,TS val 278551931 ecr 278551753], length 1044
1527819037.096929 IP (tos 0x0, ttl 64, id 34490, offset 0, flags [DF], proto TCP (6), length 1096)
    rpi41.lan.46656 > rpi33.lan.39064: Flags [P.], cksum 0x5ce9 (correct), seq 1044:2088, ack 1045, win 1332, options [nop,nop,TS val 1570390010 ecr 278551753], length 1044
1527819037.102581 IP (tos 0x0, ttl 64, id 44492, offset 0, flags [DF], proto TCP (6), length 1096)
    rpi37.lan.46656 > rpi33.lan.40414: Flags [P.], cksum 0xf586 (correct), seq 1044:2088, ack 1045, win 1332, options [nop,nop,TS val 278551936 ecr 278551753], length 1044
1527819037.102851 IP (tos 0x0, ttl 64, id 61719, offset 0, flags [DF], proto TCP (6), length 1096)
    rpi44.lan.53452 > rpi33.lan.46656: Flags [P.], cksum 0x4397 (correct), seq 1044:2088, ack 1045, win 1324, options [nop,nop,TS val 270694716 ecr 278551753], length 1044
1527819037.107587 IP (tos 0x0, ttl 64, id 10800, offset 0, flags [DF], proto TCP (6), length 1096)
    rpi46.lan.33956 > rpi33.lan.46656: Flags [P.], cksum 0xd7c7 (correct), seq 1044:2088, ack 1045, win 1324, options [nop,nop,TS val 3426013047 ecr 278551753], length 1044
1527819037.109883 IP (tos 0x0, ttl 64, id 48196, offset 0, flags [DF], proto TCP (6), length 1096)
    rpi35.lan.46656 > rpi33.lan.54900: Flags [P.], cksum 0xaca2 (correct), seq 1044:2088, ack 1045, win 1332, options [nop,nop,TS val 278550474 ecr 278551753], length 1044
1527819037.112295 IP (tos 0x0, ttl 64, id 6267, offset 0, flags [DF], proto TCP (6), length 1096)
    rpi47.lan.38764 > rpi33.lan.46656: Flags [P.], cksum 0x946f (correct), seq 1044:2088, ack 1045, win 1324, options [nop,nop,TS val 278551948 ecr 278551753], length 1044
1527819037.118138 IP (tos 0x0, ttl 64, id 8211, offset 0, flags [DF], proto TCP (6), length 1096)
    rpi34.lan.46656 > rpi33.lan.36610: Flags [P.], cksum 0x75de (correct), seq 1044:2088, ack 1045, win 1332, options [nop,nop,TS val 278551962 ecr 278551753], length 1044
1527819037.121238 IP (tos 0x0, ttl 64, id 51421, offset 0, flags [DF], proto TCP (6), length 1096)
    rpi40.lan.32772 > rpi33.lan.46656: Flags [P.], cksum 0x8f1d (correct), seq 1044:2088, ack 1045, win 1324, options [nop,nop,TS val 278549778 ecr 278551753], length 1044
1527819037.122112 IP (tos 0x0, ttl 64, id 47639, offset 0, flags [DF], proto TCP (6), length 1096)
    rpi33.lan.36610 > rpi34.lan.46656: Flags [P.], cksum 0x8896 (incorrect -> 0x6361), seq 1045:2089, ack 2088, win 1324, options [nop,nop,TS val 278551953 ecr 278551962], length 1044
1527819037.122230 IP (tos 0x0, ttl 64, id 23119, offset 0, flags [DF], proto TCP (6), length 1096)
    rpi39.lan.47594 > rpi33.lan.46656: Flags [P.], cksum 0x0eab (correct), seq 1044:2088, ack 1045, win 1324, options [nop,nop,TS val 278551953 ecr 278551753], length 1044
1527819037.122494 IP (tos 0x0, ttl 64, id 50397, offset 0, flags [DF], proto TCP (6), length 1096)
    rpi33.lan.40536 > rpi38.lan.46656: Flags [P.], cksum 0x889a (incorrect -> 0x2a4b), seq 1044:2088, ack 1045, win 1324, options [nop,nop,TS val 278551953 ecr 278550287], length 1044
1527819037.122540 IP (tos 0x0, ttl 64, id 1096, offset 0, flags [DF], proto TCP (6), length 1096)
    rpi33.lan.60752 > rpi36.lan.46656: Flags [P.], cksum 0x8898 (incorrect -> 0x878e), seq 1044:2088, ack 1045, win 1324, options [nop,nop,TS val 278551953 ecr 278551758], length 1044
1527819037.122718 IP (tos 0x0, ttl 64, id 20150, offset 0, flags [DF], proto TCP (6), length 1096)
    rpi33.lan.40414 > rpi37.lan.46656: Flags [P.], cksum 0x8899 (incorrect -> 0xacdc), seq 1045:2089, ack 2088, win 1324, options [nop,nop,TS val 278551953 ecr 278551936], length 1044
1527819037.122748 IP (tos 0x0, ttl 64, id 64445, offset 0, flags [DF], proto TCP (6), length 1096)
    rpi33.lan.54900 > rpi35.lan.46656: Flags [P.], cksum 0x8897 (incorrect -> 0xaedf), seq 1045:2089, ack 2088, win 1324, options [nop,nop,TS val 278551953 ecr 278550474], length 1044
1527819037.122892 IP (tos 0x0, ttl 64, id 8212, offset 0, flags [DF], proto TCP (6), length 52)
    rpi34.lan.46656 > rpi33.lan.36610: Flags [.], cksum 0x9ff3 (correct), ack 2089, win 1331, options [nop,nop,TS val 278551962 ecr 278551953], length 0
1527819037.123087 IP (tos 0x0, ttl 64, id 64366, offset 0, flags [DF], proto TCP (6), length 1096)
    rpi33.lan.46656 > rpi40.lan.32772: Flags [P.], cksum 0x54b2 (correct), seq 1045:2089, ack 2088, win 1332, options [nop,nop,TS val 278551953 ecr 278549778], length 1044
1527819037.123124 IP (tos 0x0, ttl 64, id 50566, offset 0, flags [DF], proto TCP (6), length 1096)
    rpi33.lan.46656 > rpi39.lan.47594: Flags [P.], cksum 0x2ea2 (correct), seq 1045:2089, ack 2088, win 1332, options [nop,nop,TS val 278551953 ecr 278551953], length 1044
1527819037.123152 IP (tos 0x0, ttl 64, id 39243, offset 0, flags [DF], proto TCP (6), length 1096)
    rpi33.lan.46656 > rpi43.lan.41016: Flags [P.], cksum 0xffb8 (correct), seq 1044:2088, ack 1045, win 1332, options [nop,nop,TS val 278551953 ecr 278551752], length 1044
1527819037.123307 IP (tos 0x0, ttl 64, id 46359, offset 0, flags [DF], proto TCP (6), length 1096)
    rpi33.lan.39064 > rpi41.lan.46656: Flags [P.], cksum 0x889d (incorrect -> 0x78bf), seq 1045:2089, ack 2088, win 1324, options [nop,nop,TS val 278551953 ecr 1570390010], length 1044
1527819037.123353 IP (tos 0x0, ttl 64, id 62841, offset 0, flags [DF], proto TCP (6), length 1096)
    rpi33.lan.58064 > rpi42.lan.46656: Flags [P.], cksum 0x889e (incorrect -> 0xf594), seq 1045:2089, ack 2088, win 1324, options [nop,nop,TS val 278551953 ecr 278551931], length 1044
1527819037.123428 IP (tos 0x0, ttl 64, id 286, offset 0, flags [DF], proto TCP (6), length 52)
    rpi36.lan.46656 > rpi33.lan.60752: Flags [.], cksum 0x150a (correct), ack 2088, win 1331, options [nop,nop,TS val 278551953 ecr 278551953], length 0
1527819037.123449 IP (tos 0x0, ttl 64, id 44493, offset 0, flags [DF], proto TCP (6), length 52)
    rpi37.lan.46656 > rpi33.lan.40414: Flags [.], cksum 0x03c5 (correct), ack 2089, win 1331, options [nop,nop,TS val 278551938 ecr 278551953], length 0
1527819037.123524 IP (tos 0x0, ttl 64, id 44593, offset 0, flags [DF], proto TCP (6), length 1096)
    rpi33.lan.46656 > rpi44.lan.53452: Flags [P.], cksum 0x05fb (correct), seq 1045:2089, ack 2088, win 1332, options [nop,nop,TS val 278551953 ecr 270694716], length 1044
1527819037.123554 IP (tos 0x0, ttl 64, id 29496, offset 0, flags [DF], proto TCP (6), length 1096)
    rpi33.lan.46656 > rpi45.lan.42200: Flags [P.], cksum 0x3d82 (correct), seq 3132:4176, ack 3133, win 1332, options [nop,nop,TS val 278551953 ecr 278549808], length 1044
1527819037.123617 IP (tos 0x0, ttl 64, id 48197, offset 0, flags [DF], proto TCP (6), length 52)
    rpi35.lan.46656 > rpi33.lan.54900: Flags [.], cksum 0xb247 (correct), ack 2089, win 1331, options [nop,nop,TS val 278550475 ecr 278551953], length 0
1527819037.123658 IP (tos 0x0, ttl 64, id 45764, offset 0, flags [DF], proto TCP (6), length 1096)
    rpi33.lan.46656 > rpi46.lan.33956: Flags [P.], cksum 0xef84 (correct), seq 1045:2089, ack 2088, win 1332, options [nop,nop,TS val 278551953 ecr 3426013047], length 1044
1527819037.123837 IP (tos 0x0, ttl 64, id 51422, offset 0, flags [DF], proto TCP (6), length 52)
    rpi40.lan.32772 > rpi33.lan.46656: Flags [.], cksum 0x7fce (correct), ack 2089, win 1323, options [nop,nop,TS val 278549778 ecr 278551953], length 0
1527819037.123839 IP (tos 0x0, ttl 64, id 23120, offset 0, flags [DF], proto TCP (6), length 52)
    rpi39.lan.47594 > rpi33.lan.46656: Flags [.], cksum 0x315b (correct), ack 2089, win 1323, options [nop,nop,TS val 278551953 ecr 278551953], length 0
1527819037.123934 IP (tos 0x0, ttl 64, id 8691, offset 0, flags [DF], proto TCP (6), length 1096)
    rpi33.lan.46656 > rpi47.lan.38764: Flags [P.], cksum 0xb86f (correct), seq 1045:2089, ack 2088, win 1332, options [nop,nop,TS val 278551953 ecr 278551948], length 1044
1527819037.124044 IP (tos 0x0, ttl 64, id 2551, offset 0, flags [DF], proto TCP (6), length 52)
    rpi43.lan.41016 > rpi33.lan.46656: Flags [.], cksum 0x9062 (correct), ack 2088, win 1323, options [nop,nop,TS val 278551941 ecr 278551953], length 0
1527819037.124045 IP (tos 0x0, ttl 64, id 34491, offset 0, flags [DF], proto TCP (6), length 52)
    rpi41.lan.46656 > rpi33.lan.39064: Flags [.], cksum 0x696c (correct), ack 2089, win 1331, options [nop,nop,TS val 1570390037 ecr 278551953], length 0
1527819037.124211 IP (tos 0x0, ttl 64, id 30832, offset 0, flags [DF], proto TCP (6), length 52)
    rpi42.lan.46656 > rpi33.lan.58064: Flags [.], cksum 0x5a7c (correct), ack 2089, win 1331, options [nop,nop,TS val 278551934 ecr 278551953], length 0
1527819037.124212 IP (tos 0x0, ttl 64, id 61720, offset 0, flags [DF], proto TCP (6), length 52)
    rpi44.lan.53452 > rpi33.lan.46656: Flags [.], cksum 0x90c1 (correct), ack 2089, win 1323, options [nop,nop,TS val 270694718 ecr 278551953], length 0
1527819037.124498 IP (tos 0x0, ttl 64, id 287, offset 0, flags [DF], proto TCP (6), length 1096)
    rpi36.lan.46656 > rpi33.lan.60752: Flags [P.], cksum 0x3897 (correct), seq 1045:2089, ack 2088, win 1332, options [nop,nop,TS val 278551953 ecr 278551953], length 1044
1527819037.124564 IP (tos 0x0, ttl 64, id 1097, offset 0, flags [DF], proto TCP (6), length 52)
    rpi33.lan.60752 > rpi36.lan.46656: Flags [.], cksum 0x8484 (incorrect -> 0x10fd), ack 2089, win 1323, options [nop,nop,TS val 278551954 ecr 278551953], length 0
1527819037.124500 IP (tos 0x0, ttl 64, id 10801, offset 0, flags [DF], proto TCP (6), length 52)
    rpi46.lan.33956 > rpi33.lan.46656: Flags [.], cksum 0x3c8d (correct), ack 2089, win 1323, options [nop,nop,TS val 3426013064 ecr 278551953], length 0
1527819037.124863 IP (tos 0x0, ttl 64, id 6268, offset 0, flags [DF], proto TCP (6), length 52)
    rpi47.lan.38764 > rpi33.lan.46656: Flags [.], cksum 0xd23f (correct), ack 2089, win 1323, options [nop,nop,TS val 278551950 ecr 278551953], length 0
1527819037.127583 IP (tos 0x0, ttl 64, id 63618, offset 0, flags [DF], proto TCP (6), length 1096)
    rpi45.lan.42200 > rpi33.lan.46656: Flags [P.], cksum 0xff2b (correct), seq 3133:4177, ack 4176, win 1324, options [nop,nop,TS val 278549928 ecr 278551953], length 1044
1527819037.127663 IP (tos 0x0, ttl 64, id 29497, offset 0, flags [DF], proto TCP (6), length 52)
    rpi33.lan.46656 > rpi45.lan.42200: Flags [.], cksum 0x848d (incorrect -> 0xddf3), ack 4177, win 1331, options [nop,nop,TS val 278551954 ecr 278549928], length 0
1527819037.129877 IP (tos 0x0, ttl 64, id 6774, offset 0, flags [DF], proto TCP (6), length 1096)
    rpi38.lan.46656 > rpi33.lan.40536: Flags [P.], cksum 0xaca2 (correct), seq 1045:2089, ack 2088, win 1332, options [nop,nop,TS val 278550487 ecr 278551953], length 1044
1527819037.129952 IP (tos 0x0, ttl 64, id 50398, offset 0, flags [DF], proto TCP (6), length 52)
    rpi33.lan.40536 > rpi38.lan.46656: Flags [.], cksum 0x8486 (incorrect -> 0x3356), ack 2089, win 1323, options [nop,nop,TS val 278551954 ecr 278550487], length 0
1527819037.232800 IP (tos 0x0, ttl 64, id 2552, offset 0, flags [DF], proto TCP (6), length 1096)
    rpi43.lan.41016 > rpi33.lan.46656: Flags [P.], cksum 0x69ad (correct), seq 1045:2089, ack 2088, win 1324, options [nop,nop,TS val 278551952 ecr 278551953], length 1044
1527819037.232947 IP (tos 0x0, ttl 64, id 39244, offset 0, flags [DF], proto TCP (6), length 52)
    rpi33.lan.46656 > rpi43.lan.41016: Flags [.], cksum 0x848b (incorrect -> 0x8c30), ack 2089, win 1331, options [nop,nop,TS val 278551964 ecr 278551952], length 0
1527819037.618569 IP (tos 0x0, ttl 64, id 51423, offset 0, flags [DF], proto TCP (6), length 1096)
    rpi40.lan.32772 > rpi33.lan.46656: Flags [P.], cksum 0xb364 (correct), seq 2088:3132, ack 2089, win 1324, options [nop,nop,TS val 278549828 ecr 278551953], length 1044
1527819037.664524 IP (tos 0x0, ttl 64, id 64367, offset 0, flags [DF], proto TCP (6), length 52)
    rpi33.lan.46656 > rpi40.lan.32772: Flags [.], cksum 0x8488 (incorrect -> 0x7b48), ack 3132, win 1332, options [nop,nop,TS val 278552008 ecr 278549828], length 0
1527819038.591914 IP (tos 0x0, ttl 64, id 2553, offset 0, flags [DF], proto TCP (6), length 1096)
    rpi43.lan.41016 > rpi33.lan.46656: Flags [P.], cksum 0xa250 (correct), seq 2089:3133, ack 2088, win 1324, options [nop,nop,TS val 278552088 ecr 278551964], length 1044
1527819038.592051 IP (tos 0x0, ttl 64, id 39245, offset 0, flags [DF], proto TCP (6), length 52)
    rpi33.lan.46656 > rpi43.lan.41016: Flags [.], cksum 0x848b (incorrect -> 0x870c), ack 3133, win 1331, options [nop,nop,TS val 278552100 ecr 278552088], length 0
1527819038.837479 IP (tos 0x0, ttl 64, id 51424, offset 0, flags [DF], proto TCP (6), length 1096)
    rpi40.lan.32772 > rpi33.lan.46656: Flags [P.], cksum 0x962c (correct), seq 3132:4176, ack 2089, win 1324, options [nop,nop,TS val 278549949 ecr 278552008], length 1044
1527819038.837602 IP (tos 0x0, ttl 64, id 64368, offset 0, flags [DF], proto TCP (6), length 52)
    rpi33.lan.46656 > rpi40.lan.32772: Flags [.], cksum 0x8488 (incorrect -> 0x7647), ack 4176, win 1331, options [nop,nop,TS val 278552125 ecr 278549949], length 0
1527819038.838183 IP (tos 0x0, ttl 64, id 64369, offset 0, flags [DF], proto TCP (6), length 1096)
    rpi33.lan.46656 > rpi40.lan.32772: Flags [P.], cksum 0xd941 (correct), seq 2089:3133, ack 4176, win 1332, options [nop,nop,TS val 278552125 ecr 278549949], length 1044
1527819038.838933 IP (tos 0x0, ttl 64, id 51425, offset 0, flags [DF], proto TCP (6), length 52)
    rpi40.lan.32772 > rpi33.lan.46656: Flags [.], cksum 0x723a (correct), ack 3133, win 1323, options [nop,nop,TS val 278549950 ecr 278552125], length 0
1527819038.840248 IP (tos 0x0, ttl 64, id 64370, offset 0, flags [DF], proto TCP (6), length 1096)
    rpi33.lan.46656 > rpi40.lan.32772: Flags [P.], cksum 0xf297 (correct), seq 3133:4177, ack 4176, win 1332, options [nop,nop,TS val 278552125 ecr 278549950], length 1044
1527819038.840991 IP (tos 0x0, ttl 64, id 51426, offset 0, flags [DF], proto TCP (6), length 52)
    rpi40.lan.32772 > rpi33.lan.46656: Flags [.], cksum 0x6e26 (correct), ack 4177, win 1323, options [nop,nop,TS val 278549950 ecr 278552125], length 0
1527819038.841641 IP (tos 0x0, ttl 64, id 51427, offset 0, flags [DF], proto TCP (6), length 1096)
    rpi40.lan.32772 > rpi33.lan.46656: Flags [P.], cksum 0x61fc (correct), seq 4176:5220, ack 4177, win 1324, options [nop,nop,TS val 278549950 ecr 278552125], length 1044
1527819038.884513 IP (tos 0x0, ttl 64, id 64371, offset 0, flags [DF], proto TCP (6), length 52)
    rpi33.lan.46656 > rpi40.lan.32772: Flags [.], cksum 0x8488 (incorrect -> 0x6a04), ack 5220, win 1332, options [nop,nop,TS val 278552130 ecr 278549950], length 0
1527819039.096820 IP (tos 0x0, ttl 64, id 30833, offset 0, flags [DF], proto TCP (6), length 1096)
    rpi42.lan.46656 > rpi33.lan.58064: Flags [P.], cksum 0x3920 (correct), seq 2088:3132, ack 2089, win 1332, options [nop,nop,TS val 278552131 ecr 278551953], length 1044
1527819039.103088 IP (tos 0x0, ttl 64, id 34492, offset 0, flags [DF], proto TCP (6), length 1096)
    rpi41.lan.46656 > rpi33.lan.39064: Flags [P.], cksum 0xe2a0 (correct), seq 2088:3132, ack 2089, win 1332, options [nop,nop,TS val 1570392016 ecr 278551953], length 1044
1527819039.105048 IP (tos 0x0, ttl 64, id 61721, offset 0, flags [DF], proto TCP (6), length 1096)
    rpi44.lan.53452 > rpi33.lan.46656: Flags [P.], cksum 0x4910 (correct), seq 2088:3132, ack 2089, win 1324, options [nop,nop,TS val 270694916 ecr 278551953], length 1044
1527819039.106557 IP (tos 0x0, ttl 64, id 44494, offset 0, flags [DF], proto TCP (6), length 1096)
    rpi37.lan.46656 > rpi33.lan.40414: Flags [P.], cksum 0x46e7 (correct), seq 2088:3132, ack 2089, win 1332, options [nop,nop,TS val 278552136 ecr 278551953], length 1044
1527819039.111775 IP (tos 0x0, ttl 64, id 10802, offset 0, flags [DF], proto TCP (6), length 1096)
    rpi46.lan.33956 > rpi33.lan.46656: Flags [P.], cksum 0x3236 (correct), seq 2088:3132, ack 2089, win 1324, options [nop,nop,TS val 3426015051 ecr 278551953], length 1044
1527819039.113784 IP (tos 0x0, ttl 64, id 48198, offset 0, flags [DF], proto TCP (6), length 1096)
    rpi35.lan.46656 > rpi33.lan.54900: Flags [P.], cksum 0x0c7b (correct), seq 2088:3132, ack 2089, win 1332, options [nop,nop,TS val 278550674 ecr 278551953], length 1044
1527819039.115315 IP (tos 0x0, ttl 64, id 6269, offset 0, flags [DF], proto TCP (6), length 1096)
    rpi47.lan.38764 > rpi33.lan.46656: Flags [P.], cksum 0x7cfa (correct), seq 2088:3132, ack 2089, win 1324, options [nop,nop,TS val 278552149 ecr 278551953], length 1044
1527819039.121602 IP (tos 0x0, ttl 64, id 8213, offset 0, flags [DF], proto TCP (6), length 1096)
    rpi34.lan.46656 > rpi33.lan.36610: Flags [P.], cksum 0x9896 (correct), seq 2088:3132, ack 2089, win 1332, options [nop,nop,TS val 278552162 ecr 278551953], length 1044
1527819039.123070 IP (tos 0x0, ttl 64, id 23121, offset 0, flags [DF], proto TCP (6), length 1096)
    rpi39.lan.47594 > rpi33.lan.46656: Flags [P.], cksum 0x3b86 (correct), seq 2088:3132, ack 2089, win 1324, options [nop,nop,TS val 278552153 ecr 278551953], length 1044
1527819039.125152 IP (tos 0x0, ttl 64, id 51428, offset 0, flags [DF], proto TCP (6), length 1096)
    rpi40.lan.32772 > rpi33.lan.46656: Flags [P.], cksum 0xfb77 (correct), seq 5220:6264, ack 4177, win 1324, options [nop,nop,TS val 278549978 ecr 278552130], length 1044
1527819039.125234 IP (tos 0x0, ttl 64, id 64372, offset 0, flags [DF], proto TCP (6), length 52)
    rpi33.lan.46656 > rpi40.lan.32772: Flags [.], cksum 0x8488 (incorrect -> 0x65bd), ack 6264, win 1331, options [nop,nop,TS val 278552154 ecr 278549978], length 0
1527819039.125766 IP (tos 0x0, ttl 64, id 1098, offset 0, flags [DF], proto TCP (6), length 1096)
    rpi33.lan.60752 > rpi36.lan.46656: Flags [P.], cksum 0x8898 (incorrect -> 0x81a2), seq 2088:3132, ack 2089, win 1324, options [nop,nop,TS val 278552154 ecr 278551953], length 1044
1527819039.125812 IP (tos 0x0, ttl 64, id 64446, offset 0, flags [DF], proto TCP (6), length 1096)
    rpi33.lan.54900 > rpi35.lan.46656: Flags [P.], cksum 0x8897 (incorrect -> 0x6634), seq 2089:3133, ack 3132, win 1324, options [nop,nop,TS val 278552154 ecr 278550674], length 1044
1527819039.125924 IP (tos 0x0, ttl 64, id 20151, offset 0, flags [DF], proto TCP (6), length 1096)
    rpi33.lan.40414 > rpi37.lan.46656: Flags [P.], cksum 0x8899 (incorrect -> 0xed6e), seq 2089:3133, ack 3132, win 1324, options [nop,nop,TS val 278552154 ecr 278552136], length 1044
1527819039.126054 IP (tos 0x0, ttl 64, id 50399, offset 0, flags [DF], proto TCP (6), length 1096)
    rpi33.lan.40536 > rpi38.lan.46656: Flags [P.], cksum 0x889a (incorrect -> 0x4772), seq 2088:3132, ack 2089, win 1324, options [nop,nop,TS val 278552154 ecr 278550487], length 1044
1527819039.126107 IP (tos 0x0, ttl 64, id 47640, offset 0, flags [DF], proto TCP (6), length 1096)
    rpi33.lan.36610 > rpi34.lan.46656: Flags [P.], cksum 0x8896 (incorrect -> 0x671b), seq 2089:3133, ack 3132, win 1324, options [nop,nop,TS val 278552154 ecr 278552162], length 1044
1527819039.126455 IP (tos 0x0, ttl 64, id 62842, offset 0, flags [DF], proto TCP (6), length 1096)
    rpi33.lan.58064 > rpi42.lan.46656: Flags [P.], cksum 0x889e (incorrect -> 0x2a0c), seq 2089:3133, ack 3132, win 1324, options [nop,nop,TS val 278552154 ecr 278552131], length 1044
1527819039.126528 IP (tos 0x0, ttl 64, id 46360, offset 0, flags [DF], proto TCP (6), length 1096)
    rpi33.lan.39064 > rpi41.lan.46656: Flags [P.], cksum 0x889d (incorrect -> 0x20bc), seq 2089:3133, ack 3132, win 1324, options [nop,nop,TS val 278552154 ecr 1570392016], length 1044
1527819039.126556 IP (tos 0x0, ttl 64, id 50567, offset 0, flags [DF], proto TCP (6), length 1096)
    rpi33.lan.46656 > rpi39.lan.47594: Flags [P.], cksum 0x0a7d (correct), seq 2089:3133, ack 3132, win 1332, options [nop,nop,TS val 278552154 ecr 278552153], length 1044
1527819039.126696 IP (tos 0x0, ttl 64, id 48199, offset 0, flags [DF], proto TCP (6), length 52)
    rpi35.lan.46656 > rpi33.lan.54900: Flags [.], cksum 0xa88d (correct), ack 3133, win 1331, options [nop,nop,TS val 278550676 ecr 278552154], length 0
1527819039.126698 IP (tos 0x0, ttl 64, id 44495, offset 0, flags [DF], proto TCP (6), length 52)
    rpi37.lan.46656 > rpi33.lan.40414: Flags [.], cksum 0xfa0b (correct), ack 3133, win 1331, options [nop,nop,TS val 278552138 ecr 278552154], length 0
1527819039.126901 IP (tos 0x0, ttl 64, id 8214, offset 0, flags [DF], proto TCP (6), length 52)
    rpi34.lan.46656 > rpi33.lan.36610: Flags [.], cksum 0x963a (correct), ack 3133, win 1331, options [nop,nop,TS val 278552162 ecr 278552154], length 0
1527819039.126972 IP (tos 0x0, ttl 64, id 39246, offset 0, flags [DF], proto TCP (6), length 1096)
    rpi33.lan.46656 > rpi43.lan.41016: Flags [P.], cksum 0xa7ef (correct), seq 2088:3132, ack 3133, win 1332, options [nop,nop,TS val 278552154 ecr 278552088], length 1044
1527819039.126998 IP (tos 0x0, ttl 64, id 45765, offset 0, flags [DF], proto TCP (6), length 1096)
    rpi33.lan.46656 > rpi46.lan.33956: Flags [P.], cksum 0xebf9 (correct), seq 2089:3133, ack 3132, win 1332, options [nop,nop,TS val 278552154 ecr 3426015051], length 1044
1527819039.127015 IP (tos 0x0, ttl 64, id 44594, offset 0, flags [DF], proto TCP (6), length 1096)
    rpi33.lan.46656 > rpi44.lan.53452: Flags [P.], cksum 0x65ee (correct), seq 2089:3133, ack 3132, win 1332, options [nop,nop,TS val 278552154 ecr 270694916], length 1044
1527819039.127156 IP (tos 0x0, ttl 64, id 64373, offset 0, flags [DF], proto TCP (6), length 1096)
    rpi33.lan.46656 > rpi40.lan.32772: Flags [P.], cksum 0x65d8 (correct), seq 4177:5221, ack 6264, win 1332, options [nop,nop,TS val 278552154 ecr 278549978], length 1044
1527819039.127194 IP (tos 0x0, ttl 64, id 29498, offset 0, flags [DF], proto TCP (6), length 1096)
    rpi33.lan.46656 > rpi45.lan.42200: Flags [P.], cksum 0x59a0 (correct), seq 4176:5220, ack 4177, win 1332, options [nop,nop,TS val 278552154 ecr 278549928], length 1044
1527819039.127286 IP (tos 0x0, ttl 64, id 30834, offset 0, flags [DF], proto TCP (6), length 52)
    rpi42.lan.46656 > rpi33.lan.58064: Flags [.], cksum 0x50c3 (correct), ack 3133, win 1331, options [nop,nop,TS val 278552134 ecr 278552154], length 0
1527819039.127287 IP (tos 0x0, ttl 64, id 34493, offset 0, flags [DF], proto TCP (6), length 52)
    rpi41.lan.46656 > rpi33.lan.39064: Flags [.], cksum 0x58a7 (correct), ack 3133, win 1331, options [nop,nop,TS val 1570392041 ecr 278552154], length 0
1527819039.127564 IP (tos 0x0, ttl 64, id 23122, offset 0, flags [DF], proto TCP (6), length 52)
    rpi39.lan.47594 > rpi33.lan.46656: Flags [.], cksum 0x27a1 (correct), ack 3133, win 1323, options [nop,nop,TS val 278552154 ecr 278552154], length 0
1527819039.127566 IP (tos 0x0, ttl 64, id 288, offset 0, flags [DF], proto TCP (6), length 1096)
    rpi36.lan.46656 > rpi33.lan.60752: Flags [P.], cksum 0xb83b (correct), seq 2089:3133, ack 3132, win 1332, options [nop,nop,TS val 278552154 ecr 278552154], length 1044
1527819039.127661 IP (tos 0x0, ttl 64, id 1099, offset 0, flags [DF], proto TCP (6), length 52)
    rpi33.lan.60752 > rpi36.lan.46656: Flags [.], cksum 0x8484 (incorrect -> 0x0744), ack 3133, win 1323, options [nop,nop,TS val 278552154 ecr 278552154], length 0
1527819039.127684 IP (tos 0x0, ttl 64, id 8692, offset 0, flags [DF], proto TCP (6), length 1096)
    rpi33.lan.46656 > rpi47.lan.38764: Flags [P.], cksum 0x2783 (correct), seq 2089:3133, ack 3132, win 1332, options [nop,nop,TS val 278552154 ecr 278552149], length 1044
1527819039.127786 IP (tos 0x0, ttl 64, id 2554, offset 0, flags [DF], proto TCP (6), length 52)
    rpi43.lan.41016 > rpi33.lan.46656: Flags [.], cksum 0x8294 (correct), ack 3132, win 1323, options [nop,nop,TS val 278552142 ecr 278552154], length 0
1527819039.127788 IP (tos 0x0, ttl 64, id 10803, offset 0, flags [DF], proto TCP (6), length 52)
    rpi46.lan.33956 > rpi33.lan.46656: Flags [.], cksum 0x2bc9 (correct), ack 3133, win 1323, options [nop,nop,TS val 3426015067 ecr 278552154], length 0
1527819039.127934 IP (tos 0x0, ttl 64, id 61722, offset 0, flags [DF], proto TCP (6), length 52)
    rpi44.lan.53452 > rpi33.lan.46656: Flags [.], cksum 0x8708 (correct), ack 3133, win 1323, options [nop,nop,TS val 270694918 ecr 278552154], length 0
1527819039.128612 IP (tos 0x0, ttl 64, id 6270, offset 0, flags [DF], proto TCP (6), length 52)
    rpi47.lan.38764 > rpi33.lan.46656: Flags [.], cksum 0xc886 (correct), ack 3133, win 1323, options [nop,nop,TS val 278552150 ecr 278552154], length 0
1527819039.131264 IP (tos 0x0, ttl 64, id 63619, offset 0, flags [DF], proto TCP (6), length 1096)
    rpi45.lan.42200 > rpi33.lan.46656: Flags [P.], cksum 0xa27a (correct), seq 4177:5221, ack 5220, win 1324, options [nop,nop,TS val 278550128 ecr 278552154], length 1044
1527819039.131344 IP (tos 0x0, ttl 64, id 29499, offset 0, flags [DF], proto TCP (6), length 52)
    rpi33.lan.46656 > rpi45.lan.42200: Flags [.], cksum 0x848d (incorrect -> 0xd43b), ack 5221, win 1331, options [nop,nop,TS val 278552154 ecr 278550128], length 0
1527819039.133497 IP (tos 0x0, ttl 64, id 6775, offset 0, flags [DF], proto TCP (6), length 1096)
    rpi38.lan.46656 > rpi33.lan.40536: Flags [P.], cksum 0xc673 (correct), seq 2089:3133, ack 3132, win 1332, options [nop,nop,TS val 278550687 ecr 278552154], length 1044
1527819039.133569 IP (tos 0x0, ttl 64, id 50400, offset 0, flags [DF], proto TCP (6), length 52)
    rpi33.lan.40536 > rpi38.lan.46656: Flags [.], cksum 0x8486 (incorrect -> 0x299e), ack 3133, win 1323, options [nop,nop,TS val 278552154 ecr 278550687], length 0
1527819039.177296 IP (tos 0x0, ttl 64, id 51429, offset 0, flags [DF], proto TCP (6), length 52)
    rpi40.lan.32772 > rpi33.lan.46656: Flags [.], cksum 0x61aa (correct), ack 5221, win 1324, options [nop,nop,TS val 278549984 ecr 278552154], length 0
1527819039.234522 IP (tos 0x0, ttl 64, id 2555, offset 0, flags [DF], proto TCP (6), length 1096)
