1527829556.803571 IP (tos 0x0, ttl 64, id 62313, offset 0, flags [DF], proto TCP (6), length 1096)
    rpi40.lan.34610 > rpi33.lan.46656: Flags [P.], cksum 0x7067 (correct), seq 2746538748:2746539792, ack 1729607724, win 1324, options [nop,nop,TS val 279601746 ecr 279603906], length 1044
1527829556.803676 IP (tos 0x0, ttl 64, id 27961, offset 0, flags [DF], proto TCP (6), length 52)
    rpi33.lan.46656 > rpi40.lan.34610: Flags [.], cksum 0x8488 (incorrect -> 0x1f34), ack 1044, win 1331, options [nop,nop,TS val 279603921 ecr 279601746], length 0
1527829556.824508 IP (tos 0x0, ttl 64, id 38816, offset 0, flags [DF], proto TCP (6), length 52)
    rpi33.lan.50820 > rpi37.lan.46656: Flags [.], cksum 0x8485 (incorrect -> 0x2caa), ack 1801254455, win 1324, options [nop,nop,TS val 279603924 ecr 279603901], length 0
1527829556.909383 IP (tos 0x0, ttl 64, id 38817, offset 0, flags [DF], proto TCP (6), length 1096)
    rpi33.lan.50820 > rpi37.lan.46656: Flags [P.], cksum 0x8899 (incorrect -> 0x926c), seq 0:1044, ack 1, win 1324, options [nop,nop,TS val 279603932 ecr 279603901], length 1044
1527829556.909794 IP (tos 0x0, ttl 64, id 39984, offset 0, flags [DF], proto TCP (6), length 1096)
    rpi37.lan.46656 > rpi33.lan.50820: Flags [P.], cksum 0xbb43 (correct), seq 1:1045, ack 0, win 1332, options [nop,nop,TS val 279603916 ecr 279603924], length 1044
1527829556.909913 IP (tos 0x0, ttl 64, id 38818, offset 0, flags [DF], proto TCP (6), length 52)
    rpi33.lan.50820 > rpi37.lan.46656: Flags [.], cksum 0x8485 (incorrect -> 0x246c), ack 1045, win 1323, options [nop,nop,TS val 279603932 ecr 279603916], length 0
1527829556.910304 IP (tos 0x0, ttl 64, id 39985, offset 0, flags [DF], proto TCP (6), length 52)
    rpi37.lan.46656 > rpi33.lan.50820: Flags [.], cksum 0x2464 (correct), ack 1044, win 1331, options [nop,nop,TS val 279603916 ecr 279603932], length 0
1527829556.910425 IP (tos 0x0, ttl 64, id 38819, offset 0, flags [DF], proto TCP (6), length 1096)
    rpi33.lan.50820 > rpi37.lan.46656: Flags [P.], cksum 0x8899 (incorrect -> 0xedec), seq 1044:2088, ack 1045, win 1324, options [nop,nop,TS val 279603932 ecr 279603916], length 1044
1527829556.911307 IP (tos 0x0, ttl 64, id 39986, offset 0, flags [DF], proto TCP (6), length 1096)
    rpi37.lan.46656 > rpi33.lan.50820: Flags [P.], cksum 0xf2b7 (correct), seq 1045:2089, ack 1044, win 1332, options [nop,nop,TS val 279603916 ecr 279603932], length 1044
1527829556.954552 IP (tos 0x0, ttl 64, id 38820, offset 0, flags [DF], proto TCP (6), length 52)
    rpi33.lan.50820 > rpi37.lan.46656: Flags [.], cksum 0x8485 (incorrect -> 0x1c3e), ack 2089, win 1324, options [nop,nop,TS val 279603937 ecr 279603916], length 0
1527829556.957598 IP (tos 0x0, ttl 64, id 39987, offset 0, flags [DF], proto TCP (6), length 52)
    rpi37.lan.46656 > rpi33.lan.50820: Flags [.], cksum 0x1c36 (correct), ack 2088, win 1332, options [nop,nop,TS val 279603921 ecr 279603932], length 0
1527829556.969427 IP (tos 0x0, ttl 64, id 27962, offset 0, flags [DF], proto TCP (6), length 1096)
    rpi33.lan.46656 > rpi40.lan.34610: Flags [P.], cksum 0x7cb7 (correct), seq 1:1045, ack 1044, win 1332, options [nop,nop,TS val 279603938 ecr 279601746], length 1044
1527829556.969612 IP (tos 0x0, ttl 64, id 27963, offset 0, flags [DF], proto TCP (6), length 1096)
    rpi33.lan.46656 > rpi40.lan.34610: Flags [P.], cksum 0xa9c0 (correct), seq 1045:2089, ack 1044, win 1332, options [nop,nop,TS val 279603938 ecr 279601746], length 1044
1527829556.969770 IP (tos 0x0, ttl 64, id 27964, offset 0, flags [DF], proto TCP (6), length 1096)
    rpi33.lan.46656 > rpi40.lan.34610: Flags [P.], cksum 0x0c11 (correct), seq 2089:3133, ack 1044, win 1332, options [nop,nop,TS val 279603938 ecr 279601746], length 1044
1527829556.969925 IP (tos 0x0, ttl 64, id 27965, offset 0, flags [DF], proto TCP (6), length 1096)
    rpi33.lan.46656 > rpi40.lan.34610: Flags [P.], cksum 0xd044 (correct), seq 3133:4177, ack 1044, win 1332, options [nop,nop,TS val 279603938 ecr 279601746], length 1044
1527829556.970232 IP (tos 0x0, ttl 64, id 62314, offset 0, flags [DF], proto TCP (6), length 52)
    rpi40.lan.34610 > rpi33.lan.46656: Flags [.], cksum 0x1b07 (correct), ack 1045, win 1323, options [nop,nop,TS val 279601762 ecr 279603938], length 0
1527829556.970235 IP (tos 0x0, ttl 64, id 62315, offset 0, flags [DF], proto TCP (6), length 52)
    rpi40.lan.34610 > rpi33.lan.46656: Flags [.], cksum 0x16f3 (correct), ack 2089, win 1323, options [nop,nop,TS val 279601762 ecr 279603938], length 0
1527829556.970489 IP (tos 0x0, ttl 64, id 62316, offset 0, flags [DF], proto TCP (6), length 52)
    rpi40.lan.34610 > rpi33.lan.46656: Flags [.], cksum 0x12e7 (correct), ack 3133, win 1315, options [nop,nop,TS val 279601762 ecr 279603938], length 0
1527829556.970746 IP (tos 0x0, ttl 64, id 62317, offset 0, flags [DF], proto TCP (6), length 52)
    rpi40.lan.34610 > rpi33.lan.46656: Flags [.], cksum 0x0ed7 (correct), ack 4177, win 1311, options [nop,nop,TS val 279601762 ecr 279603938], length 0
1527829557.270268 IP (tos 0x0, ttl 64, id 62318, offset 0, flags [DF], proto TCP (6), length 1096)
    rpi40.lan.34610 > rpi33.lan.46656: Flags [P.], cksum 0x5a56 (correct), seq 1044:2088, ack 4177, win 1324, options [nop,nop,TS val 279601792 ecr 279603938], length 1044
1527829557.270433 IP (tos 0x0, ttl 64, id 27966, offset 0, flags [DF], proto TCP (6), length 52)
    rpi33.lan.46656 > rpi40.lan.34610: Flags [.], cksum 0x8488 (incorrect -> 0x0a73), ack 2088, win 1331, options [nop,nop,TS val 279603968 ecr 279601792], length 0
1527829557.383837 IP (tos 0x0, ttl 64, id 62319, offset 0, flags [DF], proto TCP (6), length 1096)
    rpi40.lan.34610 > rpi33.lan.46656: Flags [P.], cksum 0x337d (correct), seq 2088:3132, ack 4177, win 1324, options [nop,nop,TS val 279601804 ecr 279603968], length 1044
1527829557.383932 IP (tos 0x0, ttl 64, id 27967, offset 0, flags [DF], proto TCP (6), length 52)
    rpi33.lan.46656 > rpi40.lan.34610: Flags [.], cksum 0x8488 (incorrect -> 0x0648), ack 3132, win 1331, options [nop,nop,TS val 279603979 ecr 279601804], length 0
1527829557.495179 IP (tos 0x0, ttl 64, id 62320, offset 0, flags [DF], proto TCP (6), length 1096)
    rpi40.lan.34610 > rpi33.lan.46656: Flags [P.], cksum 0xbb5d (correct), seq 3132:4176, ack 4177, win 1324, options [nop,nop,TS val 279601815 ecr 279603979], length 1044
1527829557.495304 IP (tos 0x0, ttl 64, id 27968, offset 0, flags [DF], proto TCP (6), length 52)
    rpi33.lan.46656 > rpi40.lan.34610: Flags [.], cksum 0x8488 (incorrect -> 0x021d), ack 4176, win 1331, options [nop,nop,TS val 279603991 ecr 279601815], length 0
1527829558.084814 IP (tos 0x0, ttl 64, id 27969, offset 0, flags [DF], proto TCP (6), length 1096)
    rpi33.lan.46656 > rpi40.lan.34610: Flags [P.], cksum 0xcd9a (correct), seq 4177:5221, ack 4176, win 1332, options [nop,nop,TS val 279604050 ecr 279601815], length 1044
1527829558.085727 IP (tos 0x0, ttl 64, id 62321, offset 0, flags [DF], proto TCP (6), length 52)
    rpi40.lan.34610 > rpi33.lan.46656: Flags [.], cksum 0xfd9a (correct), ack 5221, win 1323, options [nop,nop,TS val 279601874 ecr 279604050], length 0
1527829558.219761 IP (tos 0x0, ttl 64, id 62322, offset 0, flags [DF], proto TCP (6), length 1096)
    rpi40.lan.34610 > rpi33.lan.46656: Flags [P.], cksum 0xf9aa (correct), seq 4176:5220, ack 5221, win 1324, options [nop,nop,TS val 279601887 ecr 279604050], length 1044
1527829558.219900 IP (tos 0x0, ttl 64, id 27970, offset 0, flags [DF], proto TCP (6), length 52)
    rpi33.lan.46656 > rpi40.lan.34610: Flags [.], cksum 0x8488 (incorrect -> 0xf964), ack 5220, win 1331, options [nop,nop,TS val 279604063 ecr 279601887], length 0
1527829558.311726 IP (tos 0x0, ttl 64, id 39849, offset 0, flags [DF], proto TCP (6), length 1096)
    rpi38.lan.46656 > rpi33.lan.50930: Flags [P.], cksum 0x33f8 (correct), seq 2821269994:2821271038, ack 1610417560, win 1332, options [nop,nop,TS val 279602605 ecr 279603877], length 1044
1527829558.311903 IP (tos 0x0, ttl 64, id 36647, offset 0, flags [DF], proto TCP (6), length 52)
    rpi33.lan.50930 > rpi38.lan.46656: Flags [.], cksum 0x8486 (incorrect -> 0x41d8), ack 1044, win 1323, options [nop,nop,TS val 279604072 ecr 279602605], length 0
1527829558.341101 IP (tos 0x0, ttl 64, id 1344, offset 0, flags [DF], proto TCP (6), length 1096)
    rpi42.lan.46656 > rpi33.lan.40196: Flags [P.], cksum 0x9105 (correct), seq 1558491207:1558492251, ack 3886010641, win 1332, options [nop,nop,TS val 279604055 ecr 279603877], length 1044
1527829558.344611 IP (tos 0x0, ttl 64, id 39300, offset 0, flags [DF], proto TCP (6), length 1096)
    rpi44.lan.54986 > rpi33.lan.46656: Flags [P.], cksum 0x71ce (correct), seq 1922659376:1922660420, ack 1757766632, win 1324, options [nop,nop,TS val 271746840 ecr 279603877], length 1044
1527829558.349330 IP (tos 0x0, ttl 64, id 34081, offset 0, flags [DF], proto TCP (6), length 1096)
    rpi43.lan.46656 > rpi33.lan.56922: Flags [P.], cksum 0xd4e4 (correct), seq 2798422561:2798423605, ack 2848188887, win 1332, options [nop,nop,TS val 279604064 ecr 279603877], length 1044
1527829558.357157 IP (tos 0x0, ttl 64, id 39988, offset 0, flags [DF], proto TCP (6), length 1096)
    rpi37.lan.46656 > rpi33.lan.50820: Flags [P.], cksum 0x6db4 (correct), seq 2089:3133, ack 2088, win 1332, options [nop,nop,TS val 279604060 ecr 279603932], length 1044
1527829558.357262 IP (tos 0x0, ttl 64, id 38821, offset 0, flags [DF], proto TCP (6), length 52)
    rpi33.lan.50820 > rpi37.lan.46656: Flags [.], cksum 0x8485 (incorrect -> 0x170f), ack 3133, win 1323, options [nop,nop,TS val 279604077 ecr 279604060], length 0
1527829558.358465 IP (tos 0x0, ttl 64, id 50680, offset 0, flags [DF], proto TCP (6), length 1096)
    rpi52.lan.42436 > rpi33.lan.46656: Flags [P.], cksum 0xec86 (correct), seq 760980213:760981257, ack 2454883711, win 1324, options [nop,nop,TS val 279604070 ecr 279603877], length 1044
1527829558.360018 IP (tos 0x0, ttl 64, id 50075, offset 0, flags [DF], proto TCP (6), length 1096)
    rpi36.lan.46656 > rpi33.lan.42904: Flags [P.], cksum 0x11d3 (correct), seq 2364298506:2364299550, ack 2647007116, win 1332, options [nop,nop,TS val 279604076 ecr 279603882], length 1044
1527829558.360120 IP (tos 0x0, ttl 64, id 10422, offset 0, flags [DF], proto TCP (6), length 52)
    rpi33.lan.42904 > rpi36.lan.46656: Flags [.], cksum 0x8484 (incorrect -> 0xf3cf), ack 1044, win 1323, options [nop,nop,TS val 279604077 ecr 279604076], length 0
1527829558.360823 IP (tos 0x0, ttl 64, id 10619, offset 0, flags [DF], proto TCP (6), length 1096)
    rpi33.lan.47036 > rpi34.lan.46656: Flags [P.], cksum 0x8896 (incorrect -> 0x0a16), seq 3936092585:3936093629, ack 4167730026, win 1324, options [nop,nop,TS val 279604077 ecr 279603890], length 1044
1527829558.361079 IP (tos 0x0, ttl 64, id 8401, offset 0, flags [DF], proto TCP (6), length 1096)
    rpi33.lan.46656 > rpi49.lan.52158: Flags [P.], cksum 0x03ef (correct), seq 2659591975:2659593019, ack 2533991861, win 1332, options [nop,nop,TS val 279604077 ecr 279603870], length 1044
1527829558.361166 IP (tos 0x0, ttl 64, id 59479, offset 0, flags [DF], proto TCP (6), length 1096)
    rpi33.lan.37082 > rpi35.lan.46656: Flags [P.], cksum 0x8897 (incorrect -> 0xb1c8), seq 3963091678:3963092722, ack 3403126172, win 1324, options [nop,nop,TS val 279604077 ecr 279602399], length 1044
1527829558.361292 IP (tos 0x0, ttl 64, id 10423, offset 0, flags [DF], proto TCP (6), length 1096)
    rpi33.lan.42904 > rpi36.lan.46656: Flags [P.], cksum 0x8898 (incorrect -> 0x4520), seq 1:1045, ack 1044, win 1324, options [nop,nop,TS val 279604077 ecr 279604076], length 1044
1527829558.361480 IP (tos 0x0, ttl 64, id 3887, offset 0, flags [DF], proto TCP (6), length 1096)
    rpi33.lan.46656 > rpi44.lan.54986: Flags [P.], cksum 0x47e0 (correct), seq 1:1045, ack 1044, win 1332, options [nop,nop,TS val 279604077 ecr 271746840], length 1044
1527829558.361507 IP (tos 0x0, ttl 64, id 54929, offset 0, flags [DF], proto TCP (6), length 1096)
    rpi33.lan.46656 > rpi48.lan.55640: Flags [P.], cksum 0x9ef9 (correct), seq 822759966:822761010, ack 1063336645, win 1332, options [nop,nop,TS val 279604077 ecr 30588491], length 1044
1527829558.361646 IP (tos 0x0, ttl 64, id 22515, offset 0, flags [DF], proto TCP (6), length 52)
    rpi34.lan.46656 > rpi33.lan.47036: Flags [.], cksum 0x1aca (correct), ack 1044, win 1331, options [nop,nop,TS val 279604086 ecr 279604077], length 0
1527829558.362047 IP (tos 0x0, ttl 64, id 15382, offset 0, flags [DF], proto TCP (6), length 1096)
    rpi33.lan.56922 > rpi43.lan.46656: Flags [P.], cksum 0x889f (incorrect -> 0x9f76), seq 1:1045, ack 1044, win 1324, options [nop,nop,TS val 279604077 ecr 279604064], length 1044
1527829558.362092 IP (tos 0x0, ttl 64, id 57224, offset 0, flags [DF], proto TCP (6), length 1096)
    rpi33.lan.46656 > rpi52.lan.42436: Flags [P.], cksum 0x9d37 (correct), seq 1:1045, ack 1044, win 1332, options [nop,nop,TS val 279604077 ecr 279604070], length 1044
1527829558.362115 IP (tos 0x0, ttl 64, id 29929, offset 0, flags [DF], proto TCP (6), length 1096)
    rpi33.lan.46656 > rpi50.lan.44206: Flags [P.], cksum 0xb3cb (correct), seq 2738812826:2738813870, ack 3825136268, win 1332, options [nop,nop,TS val 279604077 ecr 279601724], length 1044
1527829558.362243 IP (tos 0x0, ttl 64, id 39301, offset 0, flags [DF], proto TCP (6), length 52)
    rpi44.lan.54986 > rpi33.lan.46656: Flags [.], cksum 0x911e (correct), ack 1045, win 1323, options [nop,nop,TS val 271746841 ecr 279604077], length 0
1527829558.362274 IP (tos 0x0, ttl 64, id 27971, offset 0, flags [DF], proto TCP (6), length 1096)
    rpi33.lan.46656 > rpi40.lan.34610: Flags [P.], cksum 0xc08f (correct), seq 5221:6265, ack 5220, win 1332, options [nop,nop,TS val 279604077 ecr 279601887], length 1044
1527829558.362318 IP (tos 0x0, ttl 64, id 47498, offset 0, flags [DF], proto TCP (6), length 1096)
    rpi33.lan.33502 > rpi39.lan.46656: Flags [P.], cksum 0x889b (incorrect -> 0xd63e), seq 2129760422:2129761466, ack 3158694113, win 1324, options [nop,nop,TS val 279604077 ecr 279603880], length 1044
1527829558.362489 IP (tos 0x0, ttl 64, id 27972, offset 0, flags [DF], proto TCP (6), length 1096)
    rpi33.lan.46656 > rpi40.lan.34610: Flags [P.], cksum 0x051d (correct), seq 6265:7309, ack 5220, win 1332, options [nop,nop,TS val 279604077 ecr 279601887], length 1044
1527829558.362523 IP (tos 0x0, ttl 64, id 36225, offset 0, flags [DF], proto TCP (6), length 1096)
    rpi33.lan.46656 > rpi47.lan.40272: Flags [P.], cksum 0x5525 (correct), seq 2961952039:2961953083, ack 3090135158, win 1332, options [nop,nop,TS val 279604077 ecr 279603877], length 1044
1527829558.362572 IP (tos 0x0, ttl 64, id 38822, offset 0, flags [DF], proto TCP (6), length 1096)
    rpi33.lan.50820 > rpi37.lan.46656: Flags [P.], cksum 0x8899 (incorrect -> 0x55a8), seq 2088:3132, ack 3133, win 1324, options [nop,nop,TS val 279604077 ecr 279604060], length 1044
1527829558.362654 IP (tos 0x0, ttl 64, id 27973, offset 0, flags [DF], proto TCP (6), length 1096)
    rpi33.lan.46656 > rpi40.lan.34610: Flags [P.], cksum 0x05db (correct), seq 7309:8353, ack 5220, win 1332, options [nop,nop,TS val 279604077 ecr 279601887], length 1044
1527829558.362725 IP (tos 0x0, ttl 64, id 36648, offset 0, flags [DF], proto TCP (6), length 1096)
    rpi33.lan.50930 > rpi38.lan.46656: Flags [P.], cksum 0x889a (incorrect -> 0xaf4c), seq 1:1045, ack 1044, win 1324, options [nop,nop,TS val 279604077 ecr 279602605], length 1044
1527829558.362815 IP (tos 0x0, ttl 64, id 27974, offset 0, flags [DF], proto TCP (6), length 1096)
    rpi33.lan.46656 > rpi40.lan.34610: Flags [P.], cksum 0x6ee2 (correct), seq 8353:9397, ack 5220, win 1332, options [nop,nop,TS val 279604077 ecr 279601887], length 1044
1527829558.362840 IP (tos 0x0, ttl 64, id 34082, offset 0, flags [DF], proto TCP (6), length 52)
    rpi43.lan.46656 > rpi33.lan.56922: Flags [.], cksum 0x93b5 (correct), ack 1045, win 1331, options [nop,nop,TS val 279604065 ecr 279604077], length 0
1527829558.362967 IP (tos 0x0, ttl 64, id 42461, offset 0, flags [DF], proto TCP (6), length 1096)
    rpi33.lan.46656 > rpi46.lan.35358: Flags [P.], cksum 0x7897 (correct), seq 1611028212:1611029256, ack 3904463471, win 1332, options [nop,nop,TS val 279604077 ecr 3436532332], length 1044
1527829558.363041 IP (tos 0x0, ttl 64, id 52651, offset 0, flags [DF], proto TCP (6), length 1096)
    rpi33.lan.40196 > rpi42.lan.46656: Flags [P.], cksum 0x889e (incorrect -> 0x83e9), seq 1:1045, ack 1044, win 1324, options [nop,nop,TS val 279604077 ecr 279604055], length 1044
1527829558.363046 IP (tos 0x0, ttl 64, id 50681, offset 0, flags [DF], proto TCP (6), length 52)
    rpi52.lan.42436 > rpi33.lan.46656: Flags [.], cksum 0xa0ab (correct), ack 1045, win 1323, options [nop,nop,TS val 279604071 ecr 279604077], length 0
1527829558.363048 IP (tos 0x0, ttl 64, id 62323, offset 0, flags [DF], proto TCP (6), length 52)
    rpi40.lan.34610 > rpi33.lan.46656: Flags [.], cksum 0xf53b (correct), ack 6265, win 1323, options [nop,nop,TS val 279601902 ecr 279604077], length 0
1527829558.363164 IP (tos 0x0, ttl 64, id 60863, offset 0, flags [DF], proto TCP (6), length 1096)
    rpi33.lan.46656 > rpi45.lan.43814: Flags [P.], cksum 0x57df (correct), seq 764169494:764170538, ack 610860879, win 1331, options [nop,nop,TS val 279604077 ecr 279601855], length 1044
1527829558.363216 IP (tos 0x0, ttl 64, id 38398, offset 0, flags [DF], proto TCP (6), length 1096)
    rpi33.lan.46656 > rpi41.lan.47604: Flags [P.], cksum 0x64fd (correct), seq 857576169:857577213, ack 1744078960, win 1332, options [nop,nop,TS val 279604077 ecr 1580909427], length 1044
1527829558.363272 IP (tos 0x0, ttl 64, id 13842, offset 0, flags [DF], proto TCP (6), length 52)
    rpi39.lan.46656 > rpi33.lan.33502: Flags [.], cksum 0x1308 (correct), ack 1044, win 1331, options [nop,nop,TS val 279604077 ecr 279604077], length 0
1527829558.363276 IP (tos 0x0, ttl 64, id 62324, offset 0, flags [DF], proto TCP (6), length 52)
    rpi40.lan.34610 > rpi33.lan.46656: Flags [.], cksum 0xf127 (correct), ack 7309, win 1323, options [nop,nop,TS val 279601902 ecr 279604077], length 0
1527829558.363277 IP (tos 0x0, ttl 64, id 6487, offset 0, flags [DF], proto TCP (6), length 52)
    rpi47.lan.40272 > rpi33.lan.46656: Flags [.], cksum 0xaeff (correct), ack 1044, win 1323, options [nop,nop,TS val 279604073 ecr 279604077], length 0
1527829558.363527 IP (tos 0x0, ttl 64, id 7043, offset 0, flags [DF], proto TCP (6), length 1096)
    rpi33.lan.46656 > rpi51.lan.38808: Flags [P.], cksum 0x6ab6 (correct), seq 452723702:452724746, ack 2417255818, win 1332, options [nop,nop,TS val 279604077 ecr 279603869], length 1044
1527829558.363654 IP (tos 0x0, ttl 64, id 62093, offset 0, flags [DF], proto TCP (6), length 1096)
    rpi46.lan.35358 > rpi33.lan.46656: Flags [P.], cksum 0x56ab (correct), seq 1:1045, ack 0, win 1324, options [nop,nop,TS val 3436534335 ecr 279603877], length 1044
1527829558.363736 IP (tos 0x0, ttl 64, id 42462, offset 0, flags [DF], proto TCP (6), length 52)
    rpi33.lan.46656 > rpi46.lan.35358: Flags [.], cksum 0x848e (incorrect -> 0xff4a), ack 1045, win 1331, options [nop,nop,TS val 279604077 ecr 3436534335], length 0
1527829558.363658 IP (tos 0x0, ttl 64, id 39989, offset 0, flags [DF], proto TCP (6), length 52)
    rpi37.lan.46656 > rpi33.lan.50820: Flags [.], cksum 0x12f2 (correct), ack 3132, win 1331, options [nop,nop,TS val 279604061 ecr 279604077], length 0
1527829558.363661 IP (tos 0x0, ttl 64, id 39850, offset 0, flags [DF], proto TCP (6), length 52)
    rpi38.lan.46656 > rpi33.lan.50930: Flags [.], cksum 0x3db2 (correct), ack 1045, win 1331, options [nop,nop,TS val 279602610 ecr 279604077], length 0
1527829558.363662 IP (tos 0x0, ttl 64, id 62325, offset 0, flags [DF], proto TCP (6), length 52)
    rpi40.lan.34610 > rpi33.lan.46656: Flags [.], cksum 0xed1b (correct), ack 8353, win 1315, options [nop,nop,TS val 279601902 ecr 279604077], length 0
1527829558.363951 IP (tos 0x0, ttl 64, id 62326, offset 0, flags [DF], proto TCP (6), length 52)
    rpi40.lan.34610 > rpi33.lan.46656: Flags [.], cksum 0xe90b (correct), ack 9397, win 1311, options [nop,nop,TS val 279601902 ecr 279604077], length 0
1527829558.363954 IP (tos 0x0, ttl 64, id 31345, offset 0, flags [DF], proto TCP (6), length 52)
    rpi45.lan.43814 > rpi33.lan.46656: Flags [.], cksum 0xf910 (correct), ack 1044, win 1323, options [nop,nop,TS val 279602051 ecr 279604077], length 0
1527829558.363956 IP (tos 0x0, ttl 64, id 1345, offset 0, flags [DF], proto TCP (6), length 52)
    rpi42.lan.46656 > rpi33.lan.40196: Flags [.], cksum 0xd3c0 (correct), ack 1045, win 1331, options [nop,nop,TS val 279604057 ecr 279604077], length 0
1527829558.363958 IP (tos 0x0, ttl 64, id 11803, offset 0, flags [DF], proto TCP (6), length 52)
    rpi41.lan.47604 > rpi33.lan.46656: Flags [.], cksum 0x1d24 (correct), ack 1044, win 1323, options [nop,nop,TS val 1580911364 ecr 279604077], length 0
1527829558.364717 IP (tos 0x0, ttl 64, id 23777, offset 0, flags [DF], proto TCP (6), length 1096)
    rpi49.lan.52158 > rpi33.lan.46656: Flags [P.], cksum 0x878e (correct), seq 1:1045, ack 1044, win 1324, options [nop,nop,TS val 279604070 ecr 279604077], length 1044
1527829558.364810 IP (tos 0x0, ttl 64, id 8402, offset 0, flags [DF], proto TCP (6), length 52)
    rpi33.lan.46656 > rpi49.lan.52158: Flags [.], cksum 0x8491 (incorrect -> 0x6862), ack 1045, win 1331, options [nop,nop,TS val 279604078 ecr 279604070], length 0
1527829558.371326 IP (tos 0x0, ttl 64, id 1656, offset 0, flags [DF], proto TCP (6), length 1096)
    rpi35.lan.46656 > rpi33.lan.37082: Flags [P.], cksum 0xfc8d (correct), seq 1:1045, ack 1044, win 1332, options [nop,nop,TS val 279602599 ecr 279604077], length 1044
1527829558.371421 IP (tos 0x0, ttl 64, id 59480, offset 0, flags [DF], proto TCP (6), length 52)
    rpi33.lan.37082 > rpi35.lan.46656: Flags [.], cksum 0x8483 (incorrect -> 0x63fd), ack 1045, win 1323, options [nop,nop,TS val 279604078 ecr 279602599], length 0
1527829558.379993 IP (tos 0x0, ttl 64, id 54602, offset 0, flags [DF], proto TCP (6), length 1096)
    rpi51.lan.38808 > rpi33.lan.46656: Flags [P.], cksum 0x2f24 (correct), seq 1:1045, ack 1044, win 1324, options [nop,nop,TS val 279604070 ecr 279604077], length 1044
1527829558.380095 IP (tos 0x0, ttl 64, id 7044, offset 0, flags [DF], proto TCP (6), length 52)
    rpi33.lan.46656 > rpi51.lan.38808: Flags [.], cksum 0x8493 (incorrect -> 0x8a61), ack 1045, win 1331, options [nop,nop,TS val 279604079 ecr 279604070], length 0
1527829558.382126 IP (tos 0x0, ttl 64, id 25474, offset 0, flags [DF], proto TCP (6), length 1096)
    rpi50.lan.44206 > rpi33.lan.46656: Flags [P.], cksum 0x8211 (correct), seq 1:1045, ack 1044, win 1324, options [nop,nop,TS val 279601924 ecr 279604077], length 1044
1527829558.382207 IP (tos 0x0, ttl 64, id 29930, offset 0, flags [DF], proto TCP (6), length 52)
    rpi33.lan.46656 > rpi50.lan.44206: Flags [.], cksum 0x8492 (incorrect -> 0x20da), ack 1045, win 1331, options [nop,nop,TS val 279604079 ecr 279601924], length 0
1527829558.392983 IP (tos 0x0, ttl 64, id 50462, offset 0, flags [DF], proto TCP (6), length 1096)
    rpi48.lan.55640 > rpi33.lan.46656: Flags [P.], cksum 0x7099 (correct), seq 1:1045, ack 1044, win 1324, options [nop,nop,TS val 30588691 ecr 279604077], length 1044
1527829558.393054 IP (tos 0x0, ttl 64, id 54930, offset 0, flags [DF], proto TCP (6), length 52)
    rpi33.lan.46656 > rpi48.lan.55640: Flags [.], cksum 0x8490 (incorrect -> 0x1b10), ack 1045, win 1331, options [nop,nop,TS val 279604080 ecr 30588691], length 0
1527829558.401177 IP (tos 0x0, ttl 64, id 13843, offset 0, flags [DF], proto TCP (6), length 1096)
    rpi39.lan.46656 > rpi33.lan.33502: Flags [P.], cksum 0x136e (correct), seq 1:1045, ack 1044, win 1332, options [nop,nop,TS val 279604081 ecr 279604077], length 1044
1527829558.401248 IP (tos 0x0, ttl 64, id 47499, offset 0, flags [DF], proto TCP (6), length 52)
    rpi33.lan.33502 > rpi39.lan.46656: Flags [.], cksum 0x8487 (incorrect -> 0x0ef4), ack 1045, win 1323, options [nop,nop,TS val 279604081 ecr 279604081], length 0
1527829558.402558 IP (tos 0x0, ttl 64, id 50076, offset 0, flags [DF], proto TCP (6), length 52)
    rpi36.lan.46656 > rpi33.lan.42904: Flags [.], cksum 0xefad (correct), ack 1045, win 1332, options [nop,nop,TS val 279604081 ecr 279604077], length 0
1527829558.405501 IP (tos 0x0, ttl 64, id 31346, offset 0, flags [DF], proto TCP (6), length 1096)
    rpi45.lan.43814 > rpi33.lan.46656: Flags [P.], cksum 0xeace (correct), seq 1:1045, ack 1044, win 1324, options [nop,nop,TS val 279602055 ecr 279604077], length 1044
1527829558.405562 IP (tos 0x0, ttl 64, id 60864, offset 0, flags [DF], proto TCP (6), length 52)
    rpi33.lan.46656 > rpi45.lan.43814: Flags [.], cksum 0x848d (incorrect -> 0xf4eb), ack 1045, win 1331, options [nop,nop,TS val 279604082 ecr 279602055], length 0
1527829558.407157 IP (tos 0x0, ttl 64, id 62094, offset 0, flags [DF], proto TCP (6), length 52)
    rpi46.lan.35358 > rpi33.lan.46656: Flags [.], cksum 0xff25 (correct), ack 1044, win 1324, options [nop,nop,TS val 3436534379 ecr 279604077], length 0
1527829558.407717 IP (tos 0x0, ttl 64, id 22516, offset 0, flags [DF], proto TCP (6), length 1096)
    rpi34.lan.46656 > rpi33.lan.47036: Flags [P.], cksum 0xee64 (correct), seq 1:1045, ack 1044, win 1332, options [nop,nop,TS val 279604090 ecr 279604077], length 1044
1527829558.407779 IP (tos 0x0, ttl 64, id 10620, offset 0, flags [DF], proto TCP (6), length 52)
    rpi33.lan.47036 > rpi34.lan.46656: Flags [.], cksum 0x8482 (incorrect -> 0x16b5), ack 1045, win 1323, options [nop,nop,TS val 279604082 ecr 279604090], length 0
1527829558.409146 IP (tos 0x0, ttl 64, id 6488, offset 0, flags [DF], proto TCP (6), length 1096)
    rpi47.lan.40272 > rpi33.lan.46656: Flags [P.], cksum 0xff86 (correct), seq 1:1045, ack 1044, win 1324, options [nop,nop,TS val 279604077 ecr 279604077], length 1044
1527829558.409208 IP (tos 0x0, ttl 64, id 36226, offset 0, flags [DF], proto TCP (6), length 52)
    rpi33.lan.46656 > rpi47.lan.40272: Flags [.], cksum 0x848f (incorrect -> 0xaada), ack 1045, win 1331, options [nop,nop,TS val 279604082 ecr 279604077], length 0
1527829558.430760 IP (tos 0x0, ttl 64, id 11804, offset 0, flags [DF], proto TCP (6), length 1096)
    rpi41.lan.47604 > rpi33.lan.46656: Flags [P.], cksum 0x772d (correct), seq 1:1045, ack 1044, win 1324, options [nop,nop,TS val 1580911430 ecr 279604077], length 1044
1527829558.430870 IP (tos 0x0, ttl 64, id 38399, offset 0, flags [DF], proto TCP (6), length 52)
    rpi33.lan.46656 > rpi41.lan.47604: Flags [.], cksum 0x8489 (incorrect -> 0x18bf), ack 1045, win 1331, options [nop,nop,TS val 279604084 ecr 1580911430], length 0
1527829558.538294 IP (tos 0x0, ttl 64, id 62327, offset 0, flags [DF], proto TCP (6), length 1096)
    rpi40.lan.34610 > rpi33.lan.46656: Flags [P.], cksum 0xcee3 (correct), seq 5220:6264, ack 9397, win 1324, options [nop,nop,TS val 279601919 ecr 279604077], length 1044
1527829558.538434 IP (tos 0x0, ttl 64, id 27975, offset 0, flags [DF], proto TCP (6), length 52)
    rpi33.lan.46656 > rpi40.lan.34610: Flags [.], cksum 0x8488 (incorrect -> 0xe4c0), ack 6264, win 1331, options [nop,nop,TS val 279604095 ecr 279601919], length 0
1527829560.315091 IP (tos 0x0, ttl 64, id 39851, offset 0, flags [DF], proto TCP (6), length 1096)
    rpi38.lan.46656 > rpi33.lan.50930: Flags [P.], cksum 0x01da (correct), seq 1044:2088, ack 1045, win 1332, options [nop,nop,TS val 279602805 ecr 279604077], length 1044
1527829560.315264 IP (tos 0x0, ttl 64, id 36649, offset 0, flags [DF], proto TCP (6), length 52)
    rpi33.lan.50930 > rpi38.lan.46656: Flags [.], cksum 0x8486 (incorrect -> 0x381f), ack 2088, win 1323, options [nop,nop,TS val 279604273 ecr 279602805], length 0
1527829560.345333 IP (tos 0x0, ttl 64, id 1346, offset 0, flags [DF], proto TCP (6), length 1096)
    rpi42.lan.46656 > rpi33.lan.40196: Flags [P.], cksum 0xa526 (correct), seq 1044:2088, ack 1045, win 1332, options [nop,nop,TS val 279604255 ecr 279604077], length 1044
1527829560.349361 IP (tos 0x0, ttl 64, id 39302, offset 0, flags [DF], proto TCP (6), length 1096)
    rpi44.lan.54986 > rpi33.lan.46656: Flags [P.], cksum 0x0306 (correct), seq 1044:2088, ack 1045, win 1324, options [nop,nop,TS val 271747040 ecr 279604077], length 1044
1527829560.354078 IP (tos 0x0, ttl 64, id 34083, offset 0, flags [DF], proto TCP (6), length 1096)
    rpi43.lan.46656 > rpi33.lan.56922: Flags [P.], cksum 0xb897 (correct), seq 1044:2088, ack 1045, win 1332, options [nop,nop,TS val 279604264 ecr 279604077], length 1044
1527829560.360895 IP (tos 0x0, ttl 64, id 39990, offset 0, flags [DF], proto TCP (6), length 1096)
    rpi37.lan.46656 > rpi33.lan.50820: Flags [P.], cksum 0x37fa (correct), seq 3133:4177, ack 3132, win 1332, options [nop,nop,TS val 279604261 ecr 279604077], length 1044
1527829560.362092 IP (tos 0x0, ttl 64, id 50682, offset 0, flags [DF], proto TCP (6), length 1096)
    rpi52.lan.42436 > rpi33.lan.46656: Flags [P.], cksum 0x4141 (correct), seq 1044:2088, ack 1045, win 1324, options [nop,nop,TS val 279604271 ecr 279604077], length 1044
1527829560.363685 IP (tos 0x0, ttl 64, id 59481, offset 0, flags [DF], proto TCP (6), length 1096)
    rpi33.lan.37082 > rpi35.lan.46656: Flags [P.], cksum 0x8897 (incorrect -> 0x4fe1), seq 1044:2088, ack 1045, win 1324, options [nop,nop,TS val 279604277 ecr 279602599], length 1044
1527829560.363763 IP (tos 0x0, ttl 64, id 50077, offset 0, flags [DF], proto TCP (6), length 1096)
    rpi36.lan.46656 > rpi33.lan.42904: Flags [P.], cksum 0x2129 (correct), seq 1044:2088, ack 1045, win 1332, options [nop,nop,TS val 279604277 ecr 279604077], length 1044
1527829560.363996 IP (tos 0x0, ttl 64, id 38823, offset 0, flags [DF], proto TCP (6), length 1096)
    rpi33.lan.50820 > rpi37.lan.46656: Flags [P.], cksum 0x8899 (incorrect -> 0x4099), seq 3132:4176, ack 4177, win 1324, options [nop,nop,TS val 279604277 ecr 279604261], length 1044
1527829560.364278 IP (tos 0x0, ttl 64, id 10424, offset 0, flags [DF], proto TCP (6), length 1096)
    rpi33.lan.42904 > rpi36.lan.46656: Flags [P.], cksum 0x8898 (incorrect -> 0x318f), seq 1045:2089, ack 2088, win 1324, options [nop,nop,TS val 279604277 ecr 279604277], length 1044
1527829560.364407 IP (tos 0x0, ttl 64, id 10621, offset 0, flags [DF], proto TCP (6), length 1096)
    rpi33.lan.47036 > rpi34.lan.46656: Flags [P.], cksum 0x8896 (incorrect -> 0xdd67), seq 1044:2088, ack 1045, win 1324, options [nop,nop,TS val 279604277 ecr 279604090], length 1044
1527829560.364573 IP (tos 0x0, ttl 64, id 47500, offset 0, flags [DF], proto TCP (6), length 1096)
    rpi33.lan.33502 > rpi39.lan.46656: Flags [P.], cksum 0x889b (incorrect -> 0x5306), seq 1044:2088, ack 1045, win 1324, options [nop,nop,TS val 279604278 ecr 279604081], length 1044
1527829560.364711 IP (tos 0x0, ttl 64, id 36650, offset 0, flags [DF], proto TCP (6), length 1096)
    rpi33.lan.50930 > rpi38.lan.46656: Flags [P.], cksum 0x889a (incorrect -> 0xa3b6), seq 1045:2089, ack 2088, win 1324, options [nop,nop,TS val 279604278 ecr 279602805], length 1044
1527829560.364759 IP (tos 0x0, ttl 64, id 39991, offset 0, flags [DF], proto TCP (6), length 52)
    rpi37.lan.46656 > rpi33.lan.50820: Flags [.], cksum 0x093a (correct), ack 4176, win 1331, options [nop,nop,TS val 279604261 ecr 279604277], length 0
1527829560.365108 IP (tos 0x0, ttl 64, id 50078, offset 0, flags [DF], proto TCP (6), length 52)
    rpi36.lan.46656 > rpi33.lan.42904: Flags [.], cksum 0xe5fa (correct), ack 2089, win 1331, options [nop,nop,TS val 279604277 ecr 279604277], length 0
1527829560.365109 IP (tos 0x0, ttl 64, id 22517, offset 0, flags [DF], proto TCP (6), length 52)
    rpi34.lan.46656 > rpi33.lan.47036: Flags [.], cksum 0x1112 (correct), ack 2088, win 1331, options [nop,nop,TS val 279604286 ecr 279604277], length 0
1527829560.365248 IP (tos 0x0, ttl 64, id 42463, offset 0, flags [DF], proto TCP (6), length 1096)
    rpi33.lan.46656 > rpi46.lan.35358: Flags [P.], cksum 0x82ac (correct), seq 1044:2088, ack 1045, win 1332, options [nop,nop,TS val 279604278 ecr 3436534379], length 1044
1527829560.365278 IP (tos 0x0, ttl 64, id 8403, offset 0, flags [DF], proto TCP (6), length 1096)
    rpi33.lan.46656 > rpi49.lan.52158: Flags [P.], cksum 0x393e (correct), seq 1044:2088, ack 1045, win 1332, options [nop,nop,TS val 279604278 ecr 279604070], length 1044
1527829560.365355 IP (tos 0x0, ttl 64, id 13844, offset 0, flags [DF], proto TCP (6), length 52)
    rpi39.lan.46656 > rpi33.lan.33502: Flags [.], cksum 0x094f (correct), ack 2088, win 1331, options [nop,nop,TS val 279604277 ecr 279604278], length 0
1527829560.365484 IP (tos 0x0, ttl 64, id 38400, offset 0, flags [DF], proto TCP (6), length 1096)
    rpi33.lan.46656 > rpi41.lan.47604: Flags [P.], cksum 0x00b9 (correct), seq 1044:2088, ack 1045, win 1332, options [nop,nop,TS val 279604278 ecr 1580911430], length 1044
1527829560.365497 IP (tos 0x0, ttl 64, id 39852, offset 0, flags [DF], proto TCP (6), length 52)
    rpi38.lan.46656 > rpi33.lan.50930: Flags [.], cksum 0x33f9 (correct), ack 2089, win 1331, options [nop,nop,TS val 279602810 ecr 279604278], length 0
1527829560.365510 IP (tos 0x0, ttl 64, id 60865, offset 0, flags [DF], proto TCP (6), length 1096)
    rpi33.lan.46656 > rpi45.lan.43814: Flags [P.], cksum 0x472a (correct), seq 1044:2088, ack 1045, win 1331, options [nop,nop,TS val 279604278 ecr 279602055], length 1044
1527829560.365665 IP (tos 0x0, ttl 64, id 3888, offset 0, flags [DF], proto TCP (6), length 1096)
    rpi33.lan.46656 > rpi44.lan.54986: Flags [P.], cksum 0x0612 (correct), seq 1045:2089, ack 2088, win 1332, options [nop,nop,TS val 279604278 ecr 271747040], length 1044
1527829560.365718 IP (tos 0x0, ttl 64, id 36227, offset 0, flags [DF], proto TCP (6), length 1096)
    rpi33.lan.46656 > rpi47.lan.40272: Flags [P.], cksum 0x39e6 (correct), seq 1044:2088, ack 1045, win 1332, options [nop,nop,TS val 279604278 ecr 279604077], length 1044
1527829560.365823 IP (tos 0x0, ttl 64, id 7045, offset 0, flags [DF], proto TCP (6), length 1096)
    rpi33.lan.46656 > rpi51.lan.38808: Flags [P.], cksum 0xfb54 (correct), seq 1044:2088, ack 1045, win 1332, options [nop,nop,TS val 279604278 ecr 279604070], length 1044
1527829560.365872 IP (tos 0x0, ttl 64, id 29931, offset 0, flags [DF], proto TCP (6), length 1096)
    rpi33.lan.46656 > rpi50.lan.44206: Flags [P.], cksum 0xfe4a (correct), seq 1044:2088, ack 1045, win 1332, options [nop,nop,TS val 279604278 ecr 279601924], length 1044
1527829560.365928 IP (tos 0x0, ttl 64, id 52652, offset 0, flags [DF], proto TCP (6), length 1096)
    rpi33.lan.40196 > rpi42.lan.46656: Flags [P.], cksum 0x889e (incorrect -> 0xbd3e), seq 1045:2089, ack 2088, win 1324, options [nop,nop,TS val 279604278 ecr 279604255], length 1044
1527829560.366028 IP (tos 0x0, ttl 64, id 62095, offset 0, flags [DF], proto TCP (6), length 52)
    rpi46.lan.35358 > rpi33.lan.46656: Flags [.], cksum 0xf2a2 (correct), ack 2088, win 1323, options [nop,nop,TS val 3436536338 ecr 279604278], length 0
1527829560.366142 IP (tos 0x0, ttl 64, id 15383, offset 0, flags [DF], proto TCP (6), length 1096)
    rpi33.lan.56922 > rpi43.lan.46656: Flags [P.], cksum 0x889f (incorrect -> 0x4933), seq 1045:2089, ack 2088, win 1324, options [nop,nop,TS val 279604278 ecr 279604264], length 1044
1527829560.366167 IP (tos 0x0, ttl 64, id 54931, offset 0, flags [DF], proto TCP (6), length 1096)
    rpi33.lan.46656 > rpi48.lan.55640: Flags [P.], cksum 0xa6a5 (correct), seq 1044:2088, ack 1045, win 1332, options [nop,nop,TS val 279604278 ecr 30588691], length 1044
1527829560.366199 IP (tos 0x0, ttl 64, id 57225, offset 0, flags [DF], proto TCP (6), length 1096)
    rpi33.lan.46656 > rpi52.lan.42436: Flags [P.], cksum 0xcc1f (correct), seq 1045:2089, ack 2088, win 1332, options [nop,nop,TS val 279604278 ecr 279604271], length 1044
1527829560.366306 IP (tos 0x0, ttl 64, id 27976, offset 0, flags [DF], proto TCP (6), length 1096)
    rpi33.lan.46656 > rpi40.lan.34610: Flags [P.], cksum 0xcb35 (correct), seq 9397:10441, ack 6264, win 1332, options [nop,nop,TS val 279604278 ecr 279601919], length 1044
1527829560.366306 IP (tos 0x0, ttl 64, id 11805, offset 0, flags [DF], proto TCP (6), length 52)
    rpi41.lan.47604 > rpi33.lan.46656: Flags [.], cksum 0x0c61 (correct), ack 2088, win 1323, options [nop,nop,TS val 1580913366 ecr 279604278], length 0
1527829560.366308 IP (tos 0x0, ttl 64, id 31347, offset 0, flags [DF], proto TCP (6), length 52)
    rpi45.lan.43814 > rpi33.lan.46656: Flags [.], cksum 0xef57 (correct), ack 2088, win 1323, options [nop,nop,TS val 279602251 ecr 279604278], length 0
1527829560.366458 IP (tos 0x0, ttl 64, id 39303, offset 0, flags [DF], proto TCP (6), length 52)
    rpi44.lan.54986 > rpi33.lan.46656: Flags [.], cksum 0x8764 (correct), ack 2089, win 1323, options [nop,nop,TS val 271747042 ecr 279604278], length 0
1527829560.366624 IP (tos 0x0, ttl 64, id 6489, offset 0, flags [DF], proto TCP (6), length 52)
    rpi47.lan.40272 > rpi33.lan.46656: Flags [.], cksum 0xa546 (correct), ack 2088, win 1323, options [nop,nop,TS val 279604273 ecr 279604278], length 0
1527829560.366827 IP (tos 0x0, ttl 64, id 1347, offset 0, flags [DF], proto TCP (6), length 52)
    rpi42.lan.46656 > rpi33.lan.40196: Flags [.], cksum 0xca06 (correct), ack 2089, win 1331, options [nop,nop,TS val 279604258 ecr 279604278], length 0
1527829560.366828 IP (tos 0x0, ttl 64, id 34084, offset 0, flags [DF], proto TCP (6), length 52)
    rpi43.lan.46656 > rpi33.lan.56922: Flags [.], cksum 0x89fb (correct), ack 2089, win 1331, options [nop,nop,TS val 279604266 ecr 279604278], length 0
1527829560.367180 IP (tos 0x0, ttl 64, id 62328, offset 0, flags [DF], proto TCP (6), length 52)
    rpi40.lan.34610 > rpi33.lan.46656: Flags [.], cksum 0xdf46 (correct), ack 10441, win 1323, options [nop,nop,TS val 279602102 ecr 279604278], length 0
1527829560.367182 IP (tos 0x0, ttl 64, id 50683, offset 0, flags [DF], proto TCP (6), length 52)
    rpi52.lan.42436 > rpi33.lan.46656: Flags [.], cksum 0x96f2 (correct), ack 2089, win 1323, options [nop,nop,TS val 279604271 ecr 279604278], length 0
1527829560.369456 IP (tos 0x0, ttl 64, id 23778, offset 0, flags [DF], proto TCP (6), length 1096)
    rpi49.lan.52158 > rpi33.lan.46656: Flags [P.], cksum 0x19e0 (correct), seq 1045:2089, ack 2088, win 1324, options [nop,nop,TS val 279604271 ecr 279604278], length 1044
1527829560.369537 IP (tos 0x0, ttl 64, id 8404, offset 0, flags [DF], proto TCP (6), length 52)
    rpi33.lan.46656 > rpi49.lan.52158: Flags [.], cksum 0x8491 (incorrect -> 0x5ea9), ack 2089, win 1331, options [nop,nop,TS val 279604278 ecr 279604271], length 0
1527829560.369842 IP (tos 0x0, ttl 64, id 62096, offset 0, flags [DF], proto TCP (6), length 1096)
    rpi46.lan.35358 > rpi33.lan.46656: Flags [P.], cksum 0x86f2 (correct), seq 1045:2089, ack 2088, win 1324, options [nop,nop,TS val 3436536342 ecr 279604278], length 1044
1527829560.369899 IP (tos 0x0, ttl 64, id 42464, offset 0, flags [DF], proto TCP (6), length 52)
    rpi33.lan.46656 > rpi46.lan.35358: Flags [.], cksum 0x848e (incorrect -> 0xee82), ack 2089, win 1331, options [nop,nop,TS val 279604278 ecr 3436536342], length 0
1527829560.373880 IP (tos 0x0, ttl 64, id 1657, offset 0, flags [DF], proto TCP (6), length 1096)
    rpi35.lan.46656 > rpi33.lan.37082: Flags [P.], cksum 0x5da9 (correct), seq 1045:2089, ack 2088, win 1332, options [nop,nop,TS val 279602799 ecr 279604277], length 1044
1527829560.373977 IP (tos 0x0, ttl 64, id 59482, offset 0, flags [DF], proto TCP (6), length 52)
    rpi33.lan.37082 > rpi35.lan.46656: Flags [.], cksum 0x8483 (incorrect -> 0x5a45), ack 2089, win 1323, options [nop,nop,TS val 279604278 ecr 279602799], length 0
1527829560.383419 IP (tos 0x0, ttl 64, id 54603, offset 0, flags [DF], proto TCP (6), length 1096)
