1527829240.226195 IP (tos 0x0, ttl 64, id 64211, offset 0, flags [DF], proto TCP (6), length 1096)
    rpi42.lan.46656 > rpi33.lan.40196: Flags [P.], cksum 0xb0f0 (correct), seq 1556900151:1556901195, ack 3884391397, win 1332, options [nop,nop,TS val 279572243 ecr 279572072], length 1044
1527829240.226316 IP (tos 0x0, ttl 64, id 49899, offset 0, flags [DF], proto TCP (6), length 52)
    rpi33.lan.40196 > rpi42.lan.46656: Flags [.], cksum 0x848a (incorrect -> 0xccd5), ack 1044, win 1323, options [nop,nop,TS val 279572264 ecr 279572243], length 0
1527829240.229014 IP (tos 0x0, ttl 64, id 47871, offset 0, flags [DF], proto TCP (6), length 1096)
    rpi52.lan.42436 > rpi33.lan.46656: Flags [P.], cksum 0x47f6 (correct), seq 759350529:759351573, ack 2453291611, win 1324, options [nop,nop,TS val 279572257 ecr 279572072], length 1044
1527829240.229098 IP (tos 0x0, ttl 64, id 54546, offset 0, flags [DF], proto TCP (6), length 52)
    rpi33.lan.46656 > rpi52.lan.42436: Flags [.], cksum 0x8494 (incorrect -> 0xc68c), ack 1044, win 1331, options [nop,nop,TS val 279572264 ecr 279572257], length 0
1527829240.233063 IP (tos 0x0, ttl 64, id 37125, offset 0, flags [DF], proto TCP (6), length 1096)
    rpi37.lan.46656 > rpi33.lan.50820: Flags [P.], cksum 0x1f8f (correct), seq 1799623727:1799624771, ack 2619403123, win 1332, options [nop,nop,TS val 279572248 ecr 279572072], length 1044
1527829240.233129 IP (tos 0x0, ttl 64, id 36163, offset 0, flags [DF], proto TCP (6), length 52)
    rpi33.lan.50820 > rpi37.lan.46656: Flags [.], cksum 0x8485 (incorrect -> 0x65be), ack 1044, win 1323, options [nop,nop,TS val 279572264 ecr 279572248], length 0
1527829240.233415 IP (tos 0x0, ttl 64, id 3811, offset 0, flags [DF], proto TCP (6), length 1096)
    rpi47.lan.40272 > rpi33.lan.46656: Flags [P.], cksum 0xe9dc (correct), seq 3088645370:3088646414, ack 2960293123, win 1324, options [nop,nop,TS val 279572260 ecr 279572072], length 1044
1527829240.233475 IP (tos 0x0, ttl 64, id 33493, offset 0, flags [DF], proto TCP (6), length 52)
    rpi33.lan.46656 > rpi47.lan.40272: Flags [.], cksum 0x848f (incorrect -> 0xb352), ack 1044, win 1331, options [nop,nop,TS val 279572264 ecr 279572260], length 0
1527829240.234581 IP (tos 0x0, ttl 64, id 51898, offset 0, flags [DF], proto TCP (6), length 1096)
    rpi51.lan.38808 > rpi33.lan.46656: Flags [P.], cksum 0xe43d (correct), seq 2415673114:2415674158, ack 451108634, win 1324, options [nop,nop,TS val 279572255 ecr 279572072], length 1044
1527829240.234669 IP (tos 0x0, ttl 64, id 4316, offset 0, flags [DF], proto TCP (6), length 52)
    rpi33.lan.46656 > rpi51.lan.38808: Flags [.], cksum 0x8493 (incorrect -> 0x5280), ack 1044, win 1331, options [nop,nop,TS val 279572265 ecr 279572255], length 0
1527829240.240104 IP (tos 0x0, ttl 64, id 59588, offset 0, flags [DF], proto TCP (6), length 1096)
    rpi40.lan.34610 > rpi33.lan.46656: Flags [P.], cksum 0x8986 (correct), seq 2744994672:2744995716, ack 1727965512, win 1324, options [nop,nop,TS val 279570089 ecr 279572072], length 1044
1527829240.240192 IP (tos 0x0, ttl 64, id 25215, offset 0, flags [DF], proto TCP (6), length 52)
    rpi33.lan.46656 > rpi40.lan.34610: Flags [.], cksum 0x8488 (incorrect -> 0xb526), ack 1044, win 1331, options [nop,nop,TS val 279572265 ecr 279570089], length 0
1527829240.240386 IP (tos 0x0, ttl 64, id 36987, offset 0, flags [DF], proto TCP (6), length 1096)
    rpi38.lan.46656 > rpi33.lan.50930: Flags [P.], cksum 0x40e3 (correct), seq 2819619430:2819620474, ack 1608824416, win 1332, options [nop,nop,TS val 279570797 ecr 279572072], length 1044
1527829240.240445 IP (tos 0x0, ttl 64, id 34059, offset 0, flags [DF], proto TCP (6), length 52)
    rpi33.lan.50930 > rpi38.lan.46656: Flags [.], cksum 0x8486 (incorrect -> 0xb945), ack 1044, win 1323, options [nop,nop,TS val 279572265 ecr 279570797], length 0
1527829240.244633 IP (tos 0x0, ttl 64, id 28651, offset 0, flags [DF], proto TCP (6), length 1096)
    rpi45.lan.43814 > rpi33.lan.46656: Flags [P.], cksum 0x63f9 (correct), seq 609331419:609332463, ack 762505358, win 1324, options [nop,nop,TS val 279570239 ecr 279572072], length 1044
1527829240.244707 IP (tos 0x0, ttl 64, id 58045, offset 0, flags [DF], proto TCP (6), length 52)
    rpi33.lan.46656 > rpi45.lan.43814: Flags [.], cksum 0x848d (incorrect -> 0xacbd), ack 1044, win 1331, options [nop,nop,TS val 279572266 ecr 279570239], length 0
1527829240.247790 IP (tos 0x0, ttl 64, id 31475, offset 0, flags [DF], proto TCP (6), length 1096)
    rpi43.lan.46656 > rpi33.lan.56922: Flags [P.], cksum 0x2ed8 (correct), seq 2796970357:2796971401, ack 2846513267, win 1332, options [nop,nop,TS val 279572254 ecr 279572072], length 1044
1527829240.247855 IP (tos 0x0, ttl 64, id 12568, offset 0, flags [DF], proto TCP (6), length 52)
    rpi33.lan.56922 > rpi43.lan.46656: Flags [.], cksum 0x848b (incorrect -> 0x4a98), ack 1044, win 1323, options [nop,nop,TS val 279572266 ecr 279572254], length 0
1527829240.249881 IP (tos 0x0, ttl 64, id 47732, offset 0, flags [DF], proto TCP (6), length 1096)
    rpi48.lan.55640 > rpi33.lan.46656: Flags [P.], cksum 0x0251 (correct), seq 1061742457:1061743501, ack 821131326, win 1324, options [nop,nop,TS val 30556877 ecr 279572072], length 1044
1527829240.249939 IP (tos 0x0, ttl 64, id 52179, offset 0, flags [DF], proto TCP (6), length 52)
    rpi33.lan.46656 > rpi48.lan.55640: Flags [.], cksum 0x8490 (incorrect -> 0x450e), ack 1044, win 1331, options [nop,nop,TS val 279572266 ecr 30556877], length 0
1527829240.251486 IP (tos 0x0, ttl 64, id 47271, offset 0, flags [DF], proto TCP (6), length 1096)
    rpi36.lan.46656 > rpi33.lan.42904: Flags [P.], cksum 0xff29 (correct), seq 2362702230:2362703274, ack 2645384740, win 1332, options [nop,nop,TS val 279572265 ecr 279572072], length 1044
1527829240.251542 IP (tos 0x0, ttl 64, id 7730, offset 0, flags [DF], proto TCP (6), length 52)
    rpi33.lan.42904 > rpi36.lan.46656: Flags [.], cksum 0x8484 (incorrect -> 0x0964), ack 1044, win 1323, options [nop,nop,TS val 279572266 ecr 279572265], length 0
1527829240.254478 IP (tos 0x0, ttl 64, id 9002, offset 0, flags [DF], proto TCP (6), length 1096)
    rpi41.lan.47604 > rpi33.lan.46656: Flags [P.], cksum 0x4bee (correct), seq 1742451364:1742452408, ack 855953793, win 1324, options [nop,nop,TS val 1580593251 ecr 279572072], length 1044
1527829240.254533 IP (tos 0x0, ttl 64, id 35695, offset 0, flags [DF], proto TCP (6), length 52)
    rpi33.lan.46656 > rpi41.lan.47604: Flags [.], cksum 0x8489 (incorrect -> 0x0b6a), ack 1044, win 1331, options [nop,nop,TS val 279572267 ecr 1580593251], length 0
1527829240.264300 IP (tos 0x0, ttl 64, id 21082, offset 0, flags [DF], proto TCP (6), length 1096)
    rpi49.lan.52158 > rpi33.lan.46656: Flags [P.], cksum 0x7bf7 (correct), seq 2532416465:2532417509, ack 2657940367, win 1324, options [nop,nop,TS val 279572260 ecr 279572072], length 1044
1527829240.264356 IP (tos 0x0, ttl 64, id 5586, offset 0, flags [DF], proto TCP (6), length 52)
    rpi33.lan.46656 > rpi49.lan.52158: Flags [.], cksum 0x8491 (incorrect -> 0xa2a9), ack 1044, win 1331, options [nop,nop,TS val 279572267 ecr 279572260], length 0
1527829240.286846 IP (tos 0x0, ttl 64, id 36632, offset 0, flags [DF], proto TCP (6), length 1096)
    rpi44.lan.54986 > rpi33.lan.46656: Flags [P.], cksum 0x8860 (correct), seq 1921121564:1921122608, ack 1756123376, win 1324, options [nop,nop,TS val 271715034 ecr 279572072], length 1044
1527829240.299178 IP (tos 0x0, ttl 64, id 22710, offset 0, flags [DF], proto TCP (6), length 1096)
    rpi50.lan.44206 > rpi33.lan.46656: Flags [P.], cksum 0x2f35 (correct), seq 3823526420:3823527464, ack 2737197758, win 1324, options [nop,nop,TS val 279570116 ecr 279572072], length 1044
1527829240.305745 IP (tos 0x0, ttl 64, id 19853, offset 0, flags [DF], proto TCP (6), length 1096)
    rpi34.lan.46656 > rpi33.lan.47036: Flags [P.], cksum 0xa9ad (correct), seq 4166149410:4166150454, ack 3934480649, win 1332, options [nop,nop,TS val 279572280 ecr 279572071], length 1044
1527829240.307756 IP (tos 0x0, ttl 64, id 34060, offset 0, flags [DF], proto TCP (6), length 1096)
    rpi33.lan.50930 > rpi38.lan.46656: Flags [P.], cksum 0x889a (incorrect -> 0xbf9a), seq 1:1045, ack 1044, win 1324, options [nop,nop,TS val 279572272 ecr 279570797], length 1044
1527829240.307986 IP (tos 0x0, ttl 64, id 44809, offset 0, flags [DF], proto TCP (6), length 1096)
    rpi33.lan.33502 > rpi39.lan.46656: Flags [P.], cksum 0x889b (incorrect -> 0x515d), seq 2128146398:2128147442, ack 3157093661, win 1324, options [nop,nop,TS val 279572272 ecr 279572072], length 1044
1527829240.308417 IP (tos 0x0, ttl 64, id 1128, offset 0, flags [DF], proto TCP (6), length 1096)
    rpi33.lan.46656 > rpi44.lan.54986: Flags [P.], cksum 0x5882 (correct), seq 1:1045, ack 1044, win 1332, options [nop,nop,TS val 279572272 ecr 271715034], length 1044
1527829240.308534 IP (tos 0x0, ttl 64, id 36988, offset 0, flags [DF], proto TCP (6), length 52)
    rpi38.lan.46656 > rpi33.lan.50930: Flags [.], cksum 0xb51b (correct), ack 1045, win 1331, options [nop,nop,TS val 279570804 ecr 279572272], length 0
1527829240.308626 IP (tos 0x0, ttl 64, id 25216, offset 0, flags [DF], proto TCP (6), length 1096)
    rpi33.lan.46656 > rpi40.lan.34610: Flags [P.], cksum 0x55d7 (correct), seq 1:1045, ack 1044, win 1332, options [nop,nop,TS val 279572272 ecr 279570089], length 1044
1527829240.308828 IP (tos 0x0, ttl 64, id 7913, offset 0, flags [DF], proto TCP (6), length 1096)
    rpi33.lan.47036 > rpi34.lan.46656: Flags [P.], cksum 0x8896 (incorrect -> 0x8c0d), seq 1:1045, ack 1044, win 1324, options [nop,nop,TS val 279572272 ecr 279572280], length 1044
1527829240.309079 IP (tos 0x0, ttl 64, id 35696, offset 0, flags [DF], proto TCP (6), length 1096)
    rpi33.lan.46656 > rpi41.lan.47604: Flags [P.], cksum 0xa3ca (correct), seq 1:1045, ack 1044, win 1332, options [nop,nop,TS val 279572272 ecr 1580593251], length 1044
1527829240.309188 IP (tos 0x0, ttl 64, id 36633, offset 0, flags [DF], proto TCP (6), length 52)
    rpi44.lan.54986 > rpi33.lan.46656: Flags [.], cksum 0x13d6 (correct), ack 1045, win 1323, options [nop,nop,TS val 271715036 ecr 279572272], length 0
1527829240.309283 IP (tos 0x0, ttl 64, id 56848, offset 0, flags [DF], proto TCP (6), length 1096)
    rpi33.lan.37082 > rpi35.lan.46656: Flags [P.], cksum 0x8897 (incorrect -> 0x4f47), seq 3961489138:3961490182, ack 3401491268, win 1324, options [nop,nop,TS val 279572272 ecr 279570598], length 1044
1527829240.309391 IP (tos 0x0, ttl 64, id 59589, offset 0, flags [DF], proto TCP (6), length 52)
    rpi40.lan.34610 > rpi33.lan.46656: Flags [.], cksum 0xb10c (correct), ack 1045, win 1323, options [nop,nop,TS val 279570096 ecr 279572272], length 0
1527829240.309485 IP (tos 0x0, ttl 64, id 7731, offset 0, flags [DF], proto TCP (6), length 1096)
    rpi33.lan.42904 > rpi36.lan.46656: Flags [P.], cksum 0x8898 (incorrect -> 0x487a), seq 1:1045, ack 1044, win 1324, options [nop,nop,TS val 279572272 ecr 279572265], length 1044
1527829240.309590 IP (tos 0x0, ttl 64, id 19854, offset 0, flags [DF], proto TCP (6), length 52)
    rpi34.lan.46656 > rpi33.lan.47036: Flags [.], cksum 0xc64a (correct), ack 1045, win 1331, options [nop,nop,TS val 279572280 ecr 279572272], length 0
1527829240.309689 IP (tos 0x0, ttl 64, id 49900, offset 0, flags [DF], proto TCP (6), length 1096)
    rpi33.lan.40196 > rpi42.lan.46656: Flags [P.], cksum 0x889e (incorrect -> 0xbc3b), seq 1:1045, ack 1044, win 1324, options [nop,nop,TS val 279572272 ecr 279572243], length 1044
1527829240.309829 IP (tos 0x0, ttl 64, id 9003, offset 0, flags [DF], proto TCP (6), length 52)
    rpi41.lan.47604 > rpi33.lan.46656: Flags [.], cksum 0x0721 (correct), ack 1045, win 1323, options [nop,nop,TS val 1580593307 ecr 279572272], length 0
1527829240.309915 IP (tos 0x0, ttl 64, id 36164, offset 0, flags [DF], proto TCP (6), length 1096)
    rpi33.lan.50820 > rpi37.lan.46656: Flags [P.], cksum 0x8899 (incorrect -> 0x330e), seq 1:1045, ack 1044, win 1324, options [nop,nop,TS val 279572272 ecr 279572248], length 1044
1527829240.310038 IP (tos 0x0, ttl 64, id 64348, offset 0, flags [DF], proto TCP (6), length 52)
    rpi35.lan.46656 > rpi33.lan.37082: Flags [.], cksum 0xc6fb (correct), ack 1044, win 1331, options [nop,nop,TS val 279570793 ecr 279572272], length 0
1527829240.310118 IP (tos 0x0, ttl 64, id 12569, offset 0, flags [DF], proto TCP (6), length 1096)
    rpi33.lan.56922 > rpi43.lan.46656: Flags [P.], cksum 0x889f (incorrect -> 0xb19f), seq 1:1045, ack 1044, win 1324, options [nop,nop,TS val 279572272 ecr 279572254], length 1044
1527829240.310242 IP (tos 0x0, ttl 64, id 47272, offset 0, flags [DF], proto TCP (6), length 52)
    rpi36.lan.46656 > rpi33.lan.42904: Flags [.], cksum 0x053c (correct), ack 1045, win 1331, options [nop,nop,TS val 279572271 ecr 279572272], length 0
1527829240.310321 IP (tos 0x0, ttl 64, id 52180, offset 0, flags [DF], proto TCP (6), length 1096)
    rpi33.lan.46656 > rpi48.lan.55640: Flags [P.], cksum 0xca0d (correct), seq 1:1045, ack 1044, win 1332, options [nop,nop,TS val 279572272 ecr 30556877], length 1044
1527829240.310448 IP (tos 0x0, ttl 64, id 64212, offset 0, flags [DF], proto TCP (6), length 52)
    rpi42.lan.46656 > rpi33.lan.40196: Flags [.], cksum 0xc8a8 (correct), ack 1045, win 1331, options [nop,nop,TS val 279572252 ecr 279572272], length 0
1527829240.310522 IP (tos 0x0, ttl 64, id 5587, offset 0, flags [DF], proto TCP (6), length 1096)
    rpi33.lan.46656 > rpi49.lan.52158: Flags [P.], cksum 0xc75a (correct), seq 1:1045, ack 1044, win 1332, options [nop,nop,TS val 279572272 ecr 279572260], length 1044
1527829240.310711 IP (tos 0x0, ttl 64, id 37126, offset 0, flags [DF], proto TCP (6), length 52)
    rpi37.lan.46656 > rpi33.lan.50820: Flags [.], cksum 0x6192 (correct), ack 1045, win 1331, options [nop,nop,TS val 279572256 ecr 279572272], length 0
1527829240.310884 IP (tos 0x0, ttl 64, id 31476, offset 0, flags [DF], proto TCP (6), length 52)
    rpi43.lan.46656 > rpi33.lan.56922: Flags [.], cksum 0x4670 (correct), ack 1045, win 1331, options [nop,nop,TS val 279572260 ecr 279572272], length 0
1527829240.310975 IP (tos 0x0, ttl 64, id 33494, offset 0, flags [DF], proto TCP (6), length 1096)
    rpi33.lan.46656 > rpi47.lan.40272: Flags [P.], cksum 0xf2f1 (correct), seq 1:1045, ack 1044, win 1332, options [nop,nop,TS val 279572272 ecr 279572260], length 1044
1527829240.311192 IP (tos 0x0, ttl 64, id 47733, offset 0, flags [DF], proto TCP (6), length 52)
    rpi48.lan.55640 > rpi33.lan.46656: Flags [.], cksum 0x40f6 (correct), ack 1045, win 1323, options [nop,nop,TS val 30556883 ecr 279572272], length 0
1527829240.311278 IP (tos 0x0, ttl 64, id 27238, offset 0, flags [DF], proto TCP (6), length 1096)
    rpi33.lan.46656 > rpi50.lan.44206: Flags [P.], cksum 0x7e76 (correct), seq 1:1045, ack 1044, win 1332, options [nop,nop,TS val 279572272 ecr 279570116], length 1044
1527829240.311346 IP (tos 0x0, ttl 64, id 21083, offset 0, flags [DF], proto TCP (6), length 52)
    rpi49.lan.52158 > rpi33.lan.46656: Flags [.], cksum 0x9e93 (correct), ack 1045, win 1323, options [nop,nop,TS val 279572265 ecr 279572272], length 0
1527829240.311581 IP (tos 0x0, ttl 64, id 58046, offset 0, flags [DF], proto TCP (6), length 1096)
    rpi33.lan.46656 > rpi45.lan.43814: Flags [P.], cksum 0x9f3d (correct), seq 1:1045, ack 1044, win 1331, options [nop,nop,TS val 279572272 ecr 279570239], length 1044
1527829240.311820 IP (tos 0x0, ttl 64, id 3812, offset 0, flags [DF], proto TCP (6), length 52)
    rpi47.lan.40272 > rpi33.lan.46656: Flags [.], cksum 0xaf36 (correct), ack 1045, win 1323, options [nop,nop,TS val 279572268 ecr 279572272], length 0
1527829240.311916 IP (tos 0x0, ttl 64, id 4317, offset 0, flags [DF], proto TCP (6), length 1096)
    rpi33.lan.46656 > rpi51.lan.38808: Flags [P.], cksum 0x3cb8 (correct), seq 1:1045, ack 1044, win 1332, options [nop,nop,TS val 279572272 ecr 279572255], length 1044
1527829240.312202 IP (tos 0x0, ttl 64, id 22711, offset 0, flags [DF], proto TCP (6), length 52)
    rpi50.lan.44206 > rpi33.lan.46656: Flags [.], cksum 0x4ee6 (correct), ack 1045, win 1323, options [nop,nop,TS val 279570117 ecr 279572272], length 0
1527829240.312215 IP (tos 0x0, ttl 64, id 54547, offset 0, flags [DF], proto TCP (6), length 1096)
    rpi33.lan.46656 > rpi52.lan.42436: Flags [P.], cksum 0xa340 (correct), seq 1:1045, ack 1044, win 1332, options [nop,nop,TS val 279572272 ecr 279572257], length 1044
1527829240.312319 IP (tos 0x0, ttl 64, id 39800, offset 0, flags [DF], proto TCP (6), length 1096)
    rpi33.lan.46656 > rpi46.lan.35358: Flags [P.], cksum 0xc483 (correct), seq 1609430892:1609431936, ack 3902849447, win 1332, options [nop,nop,TS val 279572272 ecr 3436214297], length 1044
1527829240.312337 IP (tos 0x0, ttl 64, id 28652, offset 0, flags [DF], proto TCP (6), length 52)
    rpi45.lan.43814 > rpi33.lan.46656: Flags [.], cksum 0xa8a4 (correct), ack 1045, win 1323, options [nop,nop,TS val 279570246 ecr 279572272], length 0
1527829240.312785 IP (tos 0x0, ttl 64, id 51899, offset 0, flags [DF], proto TCP (6), length 52)
    rpi51.lan.38808 > rpi33.lan.46656: Flags [.], cksum 0x4e65 (correct), ack 1045, win 1323, options [nop,nop,TS val 279572263 ecr 279572272], length 0
1527829240.313078 IP (tos 0x0, ttl 64, id 47872, offset 0, flags [DF], proto TCP (6), length 52)
    rpi52.lan.42436 > rpi33.lan.46656: Flags [.], cksum 0xc26f (correct), ack 1045, win 1323, options [nop,nop,TS val 279572266 ecr 279572272], length 0
1527829240.318686 IP (tos 0x0, ttl 64, id 11102, offset 0, flags [DF], proto TCP (6), length 1096)
    rpi39.lan.46656 > rpi33.lan.33502: Flags [P.], cksum 0x183a (correct), seq 1:1045, ack 1044, win 1332, options [nop,nop,TS val 279572272 ecr 279572272], length 1044
1527829240.318762 IP (tos 0x0, ttl 64, id 44810, offset 0, flags [DF], proto TCP (6), length 52)
    rpi33.lan.33502 > rpi39.lan.46656: Flags [.], cksum 0x8487 (incorrect -> 0x1433), ack 1045, win 1323, options [nop,nop,TS val 279572273 ecr 279572272], length 0
1527829240.331110 IP (tos 0x0, ttl 64, id 59343, offset 0, flags [DF], proto TCP (6), length 1096)
    rpi46.lan.35358 > rpi33.lan.46656: Flags [P.], cksum 0x65df (correct), seq 1:1045, ack 1044, win 1324, options [nop,nop,TS val 3436216302 ecr 279572272], length 1044
1527829240.331192 IP (tos 0x0, ttl 64, id 39801, offset 0, flags [DF], proto TCP (6), length 52)
    rpi33.lan.46656 > rpi46.lan.35358: Flags [.], cksum 0x848e (incorrect -> 0x565d), ack 1045, win 1331, options [nop,nop,TS val 279572274 ecr 3436216302], length 0
1527829240.360916 IP (tos 0x0, ttl 64, id 64349, offset 0, flags [DF], proto TCP (6), length 1096)
    rpi35.lan.46656 > rpi33.lan.37082: Flags [P.], cksum 0x710d (correct), seq 1:1045, ack 1044, win 1332, options [nop,nop,TS val 279570798 ecr 279572272], length 1044
1527829240.361022 IP (tos 0x0, ttl 64, id 56849, offset 0, flags [DF], proto TCP (6), length 52)
    rpi33.lan.37082 > rpi35.lan.46656: Flags [.], cksum 0x8483 (incorrect -> 0xc2e5), ack 1045, win 1323, options [nop,nop,TS val 279572277 ecr 279570798], length 0
1527829241.579156 IP (tos 0x0, ttl 64, id 59590, offset 0, flags [DF], proto TCP (6), length 1096)
    rpi40.lan.34610 > rpi33.lan.46656: Flags [P.], cksum 0xb8e5 (correct), seq 1044:2088, ack 1045, win 1324, options [nop,nop,TS val 279570223 ecr 279572272], length 1044
1527829241.579256 IP (tos 0x0, ttl 64, id 25217, offset 0, flags [DF], proto TCP (6), length 52)
    rpi33.lan.46656 > rpi40.lan.34610: Flags [.], cksum 0x8488 (incorrect -> 0xabf2), ack 2088, win 1331, options [nop,nop,TS val 279572399 ecr 279570223], length 0
1527829242.228791 IP (tos 0x0, ttl 64, id 64213, offset 0, flags [DF], proto TCP (6), length 1096)
    rpi42.lan.46656 > rpi33.lan.40196: Flags [P.], cksum 0x6e6f (correct), seq 1044:2088, ack 1045, win 1332, options [nop,nop,TS val 279572444 ecr 279572272], length 1044
1527829242.228964 IP (tos 0x0, ttl 64, id 49901, offset 0, flags [DF], proto TCP (6), length 52)
    rpi33.lan.40196 > rpi42.lan.46656: Flags [.], cksum 0x848a (incorrect -> 0xc31c), ack 2088, win 1323, options [nop,nop,TS val 279572464 ecr 279572444], length 0
1527829242.230956 IP (tos 0x0, ttl 64, id 47873, offset 0, flags [DF], proto TCP (6), length 1096)
    rpi52.lan.42436 > rpi33.lan.46656: Flags [P.], cksum 0xa71f (correct), seq 1044:2088, ack 1045, win 1324, options [nop,nop,TS val 279572458 ecr 279572272], length 1044
1527829242.231032 IP (tos 0x0, ttl 64, id 54548, offset 0, flags [DF], proto TCP (6), length 52)
    rpi33.lan.46656 > rpi52.lan.42436: Flags [.], cksum 0x8494 (incorrect -> 0xbcd3), ack 2088, win 1331, options [nop,nop,TS val 279572464 ecr 279572458], length 0
1527829242.235484 IP (tos 0x0, ttl 64, id 3813, offset 0, flags [DF], proto TCP (6), length 1096)
    rpi47.lan.40272 > rpi33.lan.46656: Flags [P.], cksum 0xf2f4 (correct), seq 1044:2088, ack 1045, win 1324, options [nop,nop,TS val 279572460 ecr 279572272], length 1044
1527829242.235542 IP (tos 0x0, ttl 64, id 33495, offset 0, flags [DF], proto TCP (6), length 52)
    rpi33.lan.46656 > rpi47.lan.40272: Flags [.], cksum 0x848f (incorrect -> 0xa999), ack 2088, win 1331, options [nop,nop,TS val 279572465 ecr 279572460], length 0
1527829242.236665 IP (tos 0x0, ttl 64, id 37127, offset 0, flags [DF], proto TCP (6), length 1096)
    rpi37.lan.46656 > rpi33.lan.50820: Flags [P.], cksum 0xca66 (correct), seq 1044:2088, ack 1045, win 1332, options [nop,nop,TS val 279572448 ecr 279572272], length 1044
1527829242.236730 IP (tos 0x0, ttl 64, id 36165, offset 0, flags [DF], proto TCP (6), length 52)
    rpi33.lan.50820 > rpi37.lan.46656: Flags [.], cksum 0x8485 (incorrect -> 0x5c05), ack 2088, win 1323, options [nop,nop,TS val 279572465 ecr 279572448], length 0
1527829242.236839 IP (tos 0x0, ttl 64, id 51900, offset 0, flags [DF], proto TCP (6), length 1096)
    rpi51.lan.38808 > rpi33.lan.46656: Flags [P.], cksum 0x45bb (correct), seq 1044:2088, ack 1045, win 1324, options [nop,nop,TS val 279572455 ecr 279572272], length 1044
1527829242.236893 IP (tos 0x0, ttl 64, id 4318, offset 0, flags [DF], proto TCP (6), length 52)
    rpi33.lan.46656 > rpi51.lan.38808: Flags [.], cksum 0x8493 (incorrect -> 0x48c8), ack 2088, win 1331, options [nop,nop,TS val 279572465 ecr 279572455], length 0
1527829242.243052 IP (tos 0x0, ttl 64, id 59591, offset 0, flags [DF], proto TCP (6), length 1096)
    rpi40.lan.34610 > rpi33.lan.46656: Flags [P.], cksum 0xe47d (correct), seq 2088:3132, ack 1045, win 1324, options [nop,nop,TS val 279570290 ecr 279572399], length 1044
1527829242.243146 IP (tos 0x0, ttl 64, id 25218, offset 0, flags [DF], proto TCP (6), length 52)
    rpi33.lan.46656 > rpi40.lan.34610: Flags [.], cksum 0x8488 (incorrect -> 0xa759), ack 3132, win 1331, options [nop,nop,TS val 279572465 ecr 279570290], length 0
1527829242.243695 IP (tos 0x0, ttl 64, id 36989, offset 0, flags [DF], proto TCP (6), length 1096)
    rpi38.lan.46656 > rpi33.lan.50930: Flags [P.], cksum 0xa4a2 (correct), seq 1044:2088, ack 1045, win 1332, options [nop,nop,TS val 279570998 ecr 279572272], length 1044
1527829242.243770 IP (tos 0x0, ttl 64, id 34061, offset 0, flags [DF], proto TCP (6), length 52)
    rpi33.lan.50930 > rpi38.lan.46656: Flags [.], cksum 0x8486 (incorrect -> 0xaf8c), ack 2088, win 1323, options [nop,nop,TS val 279572465 ecr 279570998], length 0
1527829242.245734 IP (tos 0x0, ttl 64, id 28653, offset 0, flags [DF], proto TCP (6), length 1096)
    rpi45.lan.43814 > rpi33.lan.46656: Flags [P.], cksum 0xe91d (correct), seq 1044:2088, ack 1045, win 1324, options [nop,nop,TS val 279570439 ecr 279572272], length 1044
1527829242.245823 IP (tos 0x0, ttl 64, id 58047, offset 0, flags [DF], proto TCP (6), length 52)
    rpi33.lan.46656 > rpi45.lan.43814: Flags [.], cksum 0x848d (incorrect -> 0xa305), ack 2088, win 1331, options [nop,nop,TS val 279572466 ecr 279570439], length 0
1527829242.252102 IP (tos 0x0, ttl 64, id 31477, offset 0, flags [DF], proto TCP (6), length 1096)
    rpi43.lan.46656 > rpi33.lan.56922: Flags [P.], cksum 0xe40a (correct), seq 1044:2088, ack 1045, win 1332, options [nop,nop,TS val 279572454 ecr 279572272], length 1044
1527829242.252184 IP (tos 0x0, ttl 64, id 12570, offset 0, flags [DF], proto TCP (6), length 52)
    rpi33.lan.56922 > rpi43.lan.46656: Flags [.], cksum 0x848b (incorrect -> 0x40e0), ack 2088, win 1323, options [nop,nop,TS val 279572466 ecr 279572454], length 0
1527829242.253922 IP (tos 0x0, ttl 64, id 47734, offset 0, flags [DF], proto TCP (6), length 1096)
    rpi48.lan.55640 > rpi33.lan.46656: Flags [P.], cksum 0x9218 (correct), seq 1044:2088, ack 1045, win 1324, options [nop,nop,TS val 30557077 ecr 279572272], length 1044
1527829242.253992 IP (tos 0x0, ttl 64, id 52181, offset 0, flags [DF], proto TCP (6), length 52)
    rpi33.lan.46656 > rpi48.lan.55640: Flags [.], cksum 0x8490 (incorrect -> 0x3b56), ack 2088, win 1331, options [nop,nop,TS val 279572466 ecr 30557077], length 0
1527829242.255133 IP (tos 0x0, ttl 64, id 47273, offset 0, flags [DF], proto TCP (6), length 1096)
    rpi36.lan.46656 > rpi33.lan.42904: Flags [P.], cksum 0x323e (correct), seq 1044:2088, ack 1045, win 1332, options [nop,nop,TS val 279572466 ecr 279572272], length 1044
1527829242.255188 IP (tos 0x0, ttl 64, id 7732, offset 0, flags [DF], proto TCP (6), length 52)
    rpi33.lan.42904 > rpi36.lan.46656: Flags [.], cksum 0x8484 (incorrect -> 0xffa9), ack 2088, win 1323, options [nop,nop,TS val 279572467 ecr 279572466], length 0
1527829242.256932 IP (tos 0x0, ttl 64, id 9004, offset 0, flags [DF], proto TCP (6), length 1096)
    rpi41.lan.47604 > rpi33.lan.46656: Flags [P.], cksum 0x934e (correct), seq 1044:2088, ack 1045, win 1324, options [nop,nop,TS val 1580595254 ecr 279572272], length 1044
1527829242.256986 IP (tos 0x0, ttl 64, id 35697, offset 0, flags [DF], proto TCP (6), length 52)
    rpi33.lan.46656 > rpi41.lan.47604: Flags [.], cksum 0x8489 (incorrect -> 0xfaa6), ack 2088, win 1331, options [nop,nop,TS val 279572467 ecr 1580595254], length 0
1527829242.268317 IP (tos 0x0, ttl 64, id 21084, offset 0, flags [DF], proto TCP (6), length 1096)
    rpi49.lan.52158 > rpi33.lan.46656: Flags [P.], cksum 0x8139 (correct), seq 1044:2088, ack 1045, win 1324, options [nop,nop,TS val 279572461 ecr 279572272], length 1044
1527829242.268372 IP (tos 0x0, ttl 64, id 5588, offset 0, flags [DF], proto TCP (6), length 52)
    rpi33.lan.46656 > rpi49.lan.52158: Flags [.], cksum 0x8491 (incorrect -> 0x98ef), ack 2088, win 1331, options [nop,nop,TS val 279572468 ecr 279572461], length 0
1527829242.290812 IP (tos 0x0, ttl 64, id 36634, offset 0, flags [DF], proto TCP (6), length 1096)
    rpi44.lan.54986 > rpi33.lan.46656: Flags [P.], cksum 0x5745 (correct), seq 1044:2088, ack 1045, win 1324, options [nop,nop,TS val 271715234 ecr 279572272], length 1044
1527829242.302347 IP (tos 0x0, ttl 64, id 22712, offset 0, flags [DF], proto TCP (6), length 1096)
    rpi50.lan.44206 > rpi33.lan.46656: Flags [P.], cksum 0x60e7 (correct), seq 1044:2088, ack 1045, win 1324, options [nop,nop,TS val 279570316 ecr 279572272], length 1044
1527829242.309359 IP (tos 0x0, ttl 64, id 19855, offset 0, flags [DF], proto TCP (6), length 1096)
    rpi34.lan.46656 > rpi33.lan.47036: Flags [P.], cksum 0xae7b (correct), seq 1044:2088, ack 1045, win 1332, options [nop,nop,TS val 279572480 ecr 279572272], length 1044
1527829242.310822 IP (tos 0x0, ttl 64, id 49902, offset 0, flags [DF], proto TCP (6), length 1096)
    rpi33.lan.40196 > rpi42.lan.46656: Flags [P.], cksum 0x889e (incorrect -> 0xfc9f), seq 1045:2089, ack 2088, win 1324, options [nop,nop,TS val 279572472 ecr 279572444], length 1044
1527829242.310865 IP (tos 0x0, ttl 64, id 7914, offset 0, flags [DF], proto TCP (6), length 1096)
    rpi33.lan.47036 > rpi34.lan.46656: Flags [P.], cksum 0x8896 (incorrect -> 0x7ef9), seq 1045:2089, ack 2088, win 1324, options [nop,nop,TS val 279572472 ecr 279572480], length 1044
1527829242.311195 IP (tos 0x0, ttl 64, id 12571, offset 0, flags [DF], proto TCP (6), length 1096)
    rpi33.lan.56922 > rpi43.lan.46656: Flags [P.], cksum 0x889f (incorrect -> 0xa556), seq 1045:2089, ack 2088, win 1324, options [nop,nop,TS val 279572472 ecr 279572454], length 1044
1527829242.311561 IP (tos 0x0, ttl 64, id 35698, offset 0, flags [DF], proto TCP (6), length 1096)
    rpi33.lan.46656 > rpi41.lan.47604: Flags [P.], cksum 0x39cd (correct), seq 1045:2089, ack 2088, win 1332, options [nop,nop,TS val 279572472 ecr 1580595254], length 1044
1527829242.311642 IP (tos 0x0, ttl 64, id 64214, offset 0, flags [DF], proto TCP (6), length 52)
    rpi42.lan.46656 > rpi33.lan.40196: Flags [.], cksum 0xbef0 (correct), ack 2089, win 1331, options [nop,nop,TS val 279572452 ecr 279572472], length 0
1527829242.311645 IP (tos 0x0, ttl 64, id 19856, offset 0, flags [DF], proto TCP (6), length 52)
    rpi34.lan.46656 > rpi33.lan.47036: Flags [.], cksum 0xbc91 (correct), ack 2089, win 1331, options [nop,nop,TS val 279572481 ecr 279572472], length 0
1527829242.311768 IP (tos 0x0, ttl 64, id 1129, offset 0, flags [DF], proto TCP (6), length 1096)
    rpi33.lan.46656 > rpi44.lan.54986: Flags [P.], cksum 0x5631 (correct), seq 1045:2089, ack 2088, win 1332, options [nop,nop,TS val 279572472 ecr 271715234], length 1044
1527829242.311937 IP (tos 0x0, ttl 64, id 31478, offset 0, flags [DF], proto TCP (6), length 52)
    rpi43.lan.46656 > rpi33.lan.56922: Flags [.], cksum 0x3cb8 (correct), ack 2089, win 1331, options [nop,nop,TS val 279572460 ecr 279572472], length 0
1527829242.311973 IP (tos 0x0, ttl 64, id 7733, offset 0, flags [DF], proto TCP (6), length 1096)
    rpi33.lan.42904 > rpi36.lan.46656: Flags [P.], cksum 0x8898 (incorrect -> 0x6988), seq 1045:2089, ack 2088, win 1324, options [nop,nop,TS val 279572472 ecr 279572466], length 1044
1527829242.312177 IP (tos 0x0, ttl 64, id 52182, offset 0, flags [DF], proto TCP (6), length 1096)
    rpi33.lan.46656 > rpi48.lan.55640: Flags [P.], cksum 0x65b8 (correct), seq 1045:2089, ack 2088, win 1332, options [nop,nop,TS val 279572472 ecr 30557077], length 1044
1527829242.312308 IP (tos 0x0, ttl 64, id 9005, offset 0, flags [DF], proto TCP (6), length 52)
    rpi41.lan.47604 > rpi33.lan.46656: Flags [.], cksum 0xf65e (correct), ack 2089, win 1323, options [nop,nop,TS val 1580595309 ecr 279572472], length 0
1527829242.312415 IP (tos 0x0, ttl 64, id 5589, offset 0, flags [DF], proto TCP (6), length 1096)
    rpi33.lan.46656 > rpi49.lan.52158: Flags [P.], cksum 0x7540 (correct), seq 1045:2089, ack 2088, win 1332, options [nop,nop,TS val 279572472 ecr 279572461], length 1044
1527829242.312551 IP (tos 0x0, ttl 64, id 36635, offset 0, flags [DF], proto TCP (6), length 52)
    rpi44.lan.54986 > rpi33.lan.46656: Flags [.], cksum 0x0a1e (correct), ack 2089, win 1323, options [nop,nop,TS val 271715236 ecr 279572472], length 0
1527829242.312619 IP (tos 0x0, ttl 64, id 36166, offset 0, flags [DF], proto TCP (6), length 1096)
    rpi33.lan.50820 > rpi37.lan.46656: Flags [P.], cksum 0x8899 (incorrect -> 0x3bee), seq 1045:2089, ack 2088, win 1324, options [nop,nop,TS val 279572472 ecr 279572448], length 1044
1527829242.312780 IP (tos 0x0, ttl 64, id 47274, offset 0, flags [DF], proto TCP (6), length 52)
    rpi36.lan.46656 > rpi33.lan.42904: Flags [.], cksum 0xfb82 (correct), ack 2089, win 1331, options [nop,nop,TS val 279572472 ecr 279572472], length 0
1527829242.312824 IP (tos 0x0, ttl 64, id 58048, offset 0, flags [DF], proto TCP (6), length 1096)
    rpi33.lan.46656 > rpi45.lan.43814: Flags [P.], cksum 0xfb5f (correct), seq 1045:2089, ack 2088, win 1331, options [nop,nop,TS val 279572472 ecr 279570439], length 1044
1527829242.313016 IP (tos 0x0, ttl 64, id 47735, offset 0, flags [DF], proto TCP (6), length 52)
    rpi48.lan.55640 > rpi33.lan.46656: Flags [.], cksum 0x373e (correct), ack 2089, win 1323, options [nop,nop,TS val 30557083 ecr 279572472], length 0
1527829242.313024 IP (tos 0x0, ttl 64, id 27239, offset 0, flags [DF], proto TCP (6), length 1096)
    rpi33.lan.46656 > rpi50.lan.44206: Flags [P.], cksum 0x32bd (correct), seq 1045:2089, ack 2088, win 1332, options [nop,nop,TS val 279572472 ecr 279570316], length 1044
1527829242.313225 IP (tos 0x0, ttl 64, id 34062, offset 0, flags [DF], proto TCP (6), length 1096)
    rpi33.lan.50930 > rpi38.lan.46656: Flags [P.], cksum 0x889a (incorrect -> 0x7bff), seq 1045:2089, ack 2088, win 1324, options [nop,nop,TS val 279572472 ecr 279570998], length 1044
1527829242.313271 IP (tos 0x0, ttl 64, id 21085, offset 0, flags [DF], proto TCP (6), length 52)
    rpi49.lan.52158 > rpi33.lan.46656: Flags [.], cksum 0x94db (correct), ack 2089, win 1323, options [nop,nop,TS val 279572465 ecr 279572472], length 0
1527829242.313272 IP (tos 0x0, ttl 64, id 37128, offset 0, flags [DF], proto TCP (6), length 52)
    rpi37.lan.46656 > rpi33.lan.50820: Flags [.], cksum 0x57da (correct), ack 2089, win 1331, options [nop,nop,TS val 279572456 ecr 279572472], length 0
1527829242.313436 IP (tos 0x0, ttl 64, id 39802, offset 0, flags [DF], proto TCP (6), length 1096)
    rpi33.lan.46656 > rpi46.lan.35358: Flags [P.], cksum 0x646d (correct), seq 1044:2088, ack 1045, win 1332, options [nop,nop,TS val 279572472 ecr 3436216302], length 1044
1527829242.313554 IP (tos 0x0, ttl 64, id 28654, offset 0, flags [DF], proto TCP (6), length 52)
    rpi45.lan.43814 > rpi33.lan.46656: Flags [.], cksum 0x9eec (correct), ack 2089, win 1323, options [nop,nop,TS val 279570446 ecr 279572472], length 0
1527829242.313640 IP (tos 0x0, ttl 64, id 4319, offset 0, flags [DF], proto TCP (6), length 1096)
    rpi33.lan.46656 > rpi51.lan.38808: Flags [P.], cksum 0xf2ee (correct), seq 1045:2089, ack 2088, win 1332, options [nop,nop,TS val 279572472 ecr 279572455], length 1044
1527829242.313862 IP (tos 0x0, ttl 64, id 44811, offset 0, flags [DF], proto TCP (6), length 1096)
    rpi33.lan.33502 > rpi39.lan.46656: Flags [P.], cksum 0x889b (incorrect -> 0xafaa), seq 1044:2088, ack 1045, win 1324, options [nop,nop,TS val 279572472 ecr 279572272], length 1044
1527829242.313968 IP (tos 0x0, ttl 64, id 36990, offset 0, flags [DF], proto TCP (6), length 52)
    rpi38.lan.46656 > rpi33.lan.50930: Flags [.], cksum 0xab62 (correct), ack 2089, win 1331, options [nop,nop,TS val 279571005 ecr 279572472], length 0
1527829242.313970 IP (tos 0x0, ttl 64, id 22713, offset 0, flags [DF], proto TCP (6), length 52)
    rpi50.lan.44206 > rpi33.lan.46656: Flags [.], cksum 0x452d (correct), ack 2089, win 1323, options [nop,nop,TS val 279570318 ecr 279572472], length 0
1527829242.314067 IP (tos 0x0, ttl 64, id 33496, offset 0, flags [DF], proto TCP (6), length 1096)
    rpi33.lan.46656 > rpi47.lan.40272: Flags [P.], cksum 0xf469 (correct), seq 1045:2089, ack 2088, win 1332, options [nop,nop,TS val 279572472 ecr 279572460], length 1044
1527829242.314271 IP (tos 0x0, ttl 64, id 54549, offset 0, flags [DF], proto TCP (6), length 1096)
    rpi33.lan.46656 > rpi52.lan.42436: Flags [P.], cksum 0x06b8 (correct), seq 1045:2089, ack 2088, win 1332, options [nop,nop,TS val 279572472 ecr 279572458], length 1044
1527829242.314552 IP (tos 0x0, ttl 64, id 25219, offset 0, flags [DF], proto TCP (6), length 1096)
    rpi33.lan.46656 > rpi40.lan.34610: Flags [P.], cksum 0x48b4 (correct), seq 1045:2089, ack 3132, win 1332, options [nop,nop,TS val 279572473 ecr 279570290], length 1044
1527829242.314519 IP (tos 0x0, ttl 64, id 51901, offset 0, flags [DF], proto TCP (6), length 52)
    rpi51.lan.38808 > rpi33.lan.46656: Flags [.], cksum 0x44ad (correct), ack 2089, win 1323, options [nop,nop,TS val 279572463 ecr 279572472], length 0
1527829242.314941 IP (tos 0x0, ttl 64, id 3814, offset 0, flags [DF], proto TCP (6), length 52)
    rpi47.lan.40272 > rpi33.lan.46656: Flags [.], cksum 0xa57e (correct), ack 2089, win 1323, options [nop,nop,TS val 279572468 ecr 279572472], length 0
1527829242.315058 IP (tos 0x0, ttl 64, id 56850, offset 0, flags [DF], proto TCP (6), length 1096)
    rpi33.lan.37082 > rpi35.lan.46656: Flags [P.], cksum 0x8897 (incorrect -> 0x7ccf), seq 1044:2088, ack 1045, win 1324, options [nop,nop,TS val 279572473 ecr 279570798], length 1044
1527829242.315137 IP (tos 0x0, ttl 64, id 47874, offset 0, flags [DF], proto TCP (6), length 52)
    rpi52.lan.42436 > rpi33.lan.46656: Flags [.], cksum 0xb8b7 (correct), ack 2089, win 1323, options [nop,nop,TS val 279572466 ecr 279572472], length 0
1527829242.315315 IP (tos 0x0, ttl 64, id 59592, offset 0, flags [DF], proto TCP (6), length 52)
    rpi40.lan.34610 > rpi33.lan.46656: Flags [.], cksum 0xa33e (correct), ack 2089, win 1323, options [nop,nop,TS val 279570297 ecr 279572473], length 0
1527829242.315777 IP (tos 0x0, ttl 64, id 64350, offset 0, flags [DF], proto TCP (6), length 52)
    rpi35.lan.46656 > rpi33.lan.37082: Flags [.], cksum 0xbd41 (correct), ack 2088, win 1331, options [nop,nop,TS val 279570994 ecr 279572473], length 0
1527829242.322163 IP (tos 0x0, ttl 64, id 11103, offset 0, flags [DF], proto TCP (6), length 1096)
    rpi39.lan.46656 > rpi33.lan.33502: Flags [P.], cksum 0x29bf (correct), seq 1045:2089, ack 2088, win 1332, options [nop,nop,TS val 279572473 ecr 279572472], length 1044
1527829242.322242 IP (tos 0x0, ttl 64, id 44812, offset 0, flags [DF], proto TCP (6), length 52)
    rpi33.lan.33502 > rpi39.lan.46656: Flags [.], cksum 0x8487 (incorrect -> 0x0a7a), ack 2089, win 1323, options [nop,nop,TS val 279572473 ecr 279572473], length 0
1527829242.333852 IP (tos 0x0, ttl 64, id 59344, offset 0, flags [DF], proto TCP (6), length 1096)
    rpi46.lan.35358 > rpi33.lan.46656: Flags [P.], cksum 0x6df0 (correct), seq 1045:2089, ack 2088, win 1324, options [nop,nop,TS val 3436218305 ecr 279572472], length 1044
1527829242.333953 IP (tos 0x0, ttl 64, id 39803, offset 0, flags [DF], proto TCP (6), length 52)
    rpi33.lan.46656 > rpi46.lan.35358: Flags [.], cksum 0x848e (incorrect -> 0x459a), ack 2089, win 1331, options [nop,nop,TS val 279572474 ecr 3436218305], length 0
1527829242.364382 IP (tos 0x0, ttl 64, id 64351, offset 0, flags [DF], proto TCP (6), length 1096)
    rpi35.lan.46656 > rpi33.lan.37082: Flags [P.], cksum 0x261b (correct), seq 1045:2089, ack 2088, win 1332, options [nop,nop,TS val 279570999 ecr 279572473], length 1044
1527829242.364489 IP (tos 0x0, ttl 64, id 56851, offset 0, flags [DF], proto TCP (6), length 52)
    rpi33.lan.37082 > rpi35.lan.46656: Flags [.], cksum 0x8483 (incorrect -> 0xb92c), ack 2089, win 1323, options [nop,nop,TS val 279572477 ecr 279570999], length 0
1527829242.595368 IP (tos 0x0, ttl 64, id 25220, offset 0, flags [DF], proto TCP (6), length 1096)
    rpi33.lan.46656 > rpi40.lan.34610: Flags [P.], cksum 0x107c (correct), seq 2089:3133, ack 3132, win 1332, options [nop,nop,TS val 279572501 ecr 279570297], length 1044
1527829242.596245 IP (tos 0x0, ttl 64, id 59593, offset 0, flags [DF], proto TCP (6), length 52)
    rpi40.lan.34610 > rpi33.lan.46656: Flags [.], cksum 0x9ef2 (correct), ack 3133, win 1323, options [nop,nop,TS val 279570325 ecr 279572501], length 0
1527829242.597031 IP (tos 0x0, ttl 64, id 59594, offset 0, flags [DF], proto TCP (6), length 1096)
    rpi40.lan.34610 > rpi33.lan.46656: Flags [P.], cksum 0x90f9 (correct), seq 3132:4176, ack 3133, win 1324, options [nop,nop,TS val 279570325 ecr 279572501], length 1044
1527829242.597107 IP (tos 0x0, ttl 64, id 25221, offset 0, flags [DF], proto TCP (6), length 52)
    rpi33.lan.46656 > rpi40.lan.34610: Flags [.], cksum 0x8488 (incorrect -> 0x9ad6), ack 4176, win 1331, options [nop,nop,TS val 279572501 ecr 279570325], length 0
1527829242.597269 IP (tos 0x0, ttl 64, id 59595, offset 0, flags [DF], proto TCP (6), length 1096)
    rpi40.lan.34610 > rpi33.lan.46656: Flags [P.], cksum 0x8c03 (correct), seq 4176:5220, ack 3133, win 1324, options [nop,nop,TS val 279570325 ecr 279572501], length 1044
1527829242.597327 IP (tos 0x0, ttl 64, id 25222, offset 0, flags [DF], proto TCP (6), length 52)
