1527818728.989082 IP (tos 0x0, ttl 64, id 20812, offset 0, flags [DF], proto TCP (6), length 1096)
    rpi39.lan.47594 > rpi33.lan.46656: Flags [P.], cksum 0xbaa6 (correct), seq 3309007937:3309008981, ack 1190952592, win 1324, options [nop,nop,TS val 278521140 ecr 278520943], length 1044
1527818728.996940 IP (tos 0x0, ttl 64, id 4029, offset 0, flags [DF], proto TCP (6), length 1096)
    rpi47.lan.38764 > rpi33.lan.46656: Flags [P.], cksum 0xf506 (correct), seq 3232149602:3232150646, ack 4139447570, win 1324, options [nop,nop,TS val 278521137 ecr 278520943], length 1044
1527818729.005334 IP (tos 0x0, ttl 64, id 63333, offset 0, flags [DF], proto TCP (6), length 1096)
    rpi36.lan.46656 > rpi33.lan.60752: Flags [P.], cksum 0xc17e (correct), seq 4084166495:4084167539, ack 2548921050, win 1332, options [nop,nop,TS val 278521141 ecr 278520943], length 1044
1527818729.006433 IP (tos 0x0, ttl 64, id 42058, offset 0, flags [DF], proto TCP (6), length 1096)
    rpi37.lan.46656 > rpi33.lan.40414: Flags [P.], cksum 0x669e (correct), seq 3676728176:3676729220, ack 3329879591, win 1332, options [nop,nop,TS val 278521126 ecr 278520943], length 1044
1527818729.008883 IP (tos 0x0, ttl 64, id 45708, offset 0, flags [DF], proto TCP (6), length 1096)
    rpi35.lan.46656 > rpi33.lan.54900: Flags [P.], cksum 0x8276 (correct), seq 2453775690:2453776734, ack 4034564081, win 1332, options [nop,nop,TS val 278519664 ecr 278521046], length 1044
1527818729.009325 IP (tos 0x0, ttl 64, id 8444, offset 0, flags [DF], proto TCP (6), length 1096)
    rpi46.lan.33956 > rpi33.lan.46656: Flags [P.], cksum 0xfeff (correct), seq 275969169:275970213, ack 613198124, win 1324, options [nop,nop,TS val 3425704947 ecr 278520943], length 1044
1527818729.010587 IP (tos 0x0, ttl 64, id 5890, offset 0, flags [DF], proto TCP (6), length 1096)
    rpi34.lan.46656 > rpi33.lan.36610: Flags [P.], cksum 0xd858 (correct), seq 1295454444:1295455488, ack 2184363627, win 1332, options [nop,nop,TS val 278521151 ecr 278520943], length 1044
1527818729.011539 IP (tos 0x0, ttl 64, id 28489, offset 0, flags [DF], proto TCP (6), length 1096)
    rpi42.lan.46656 > rpi33.lan.58064: Flags [P.], cksum 0xf4a5 (correct), seq 2919056076:2919057120, ack 4237498725, win 1332, options [nop,nop,TS val 278521122 ecr 278520943], length 1044
1527818729.012506 IP (tos 0x0, ttl 64, id 282, offset 0, flags [DF], proto TCP (6), length 1096)
    rpi43.lan.41016 > rpi33.lan.46656: Flags [P.], cksum 0xa7ee (correct), seq 3132421890:3132422934, ack 4119900544, win 1324, options [nop,nop,TS val 278521130 ecr 278520943], length 1044
1527818729.013669 IP (tos 0x0, ttl 64, id 59278, offset 0, flags [DF], proto TCP (6), length 1096)
    rpi44.lan.53452 > rpi33.lan.46656: Flags [P.], cksum 0x1042 (correct), seq 262088097:262089141, ack 2112309295, win 1324, options [nop,nop,TS val 270663907 ecr 278520943], length 1044
1527818729.018695 IP (tos 0x0, ttl 64, id 4329, offset 0, flags [DF], proto TCP (6), length 1096)
    rpi38.lan.46656 > rpi33.lan.40536: Flags [P.], cksum 0xabb2 (correct), seq 1642406737:1642407781, ack 3526660587, win 1332, options [nop,nop,TS val 278519676 ecr 278520943], length 1044
1527818729.020416 IP (tos 0x0, ttl 64, id 43980, offset 0, flags [DF], proto TCP (6), length 1096)
    rpi33.lan.39064 > rpi41.lan.46656: Flags [P.], cksum 0x889d (incorrect -> 0x9e57), seq 3747841379:3747842423, ack 2310233362, win 1324, options [nop,nop,TS val 278521143 ecr 1570079929], length 1044
1527818729.020463 IP (tos 0x0, ttl 64, id 43415, offset 0, flags [DF], proto TCP (6), length 1096)
    rpi33.lan.46656 > rpi46.lan.33956: Flags [P.], cksum 0xf7d8 (correct), seq 1:1045, ack 1044, win 1332, options [nop,nop,TS val 278521143 ecr 3425704947], length 1044
1527818729.020481 IP (tos 0x0, ttl 64, id 60442, offset 0, flags [DF], proto TCP (6), length 1096)
    rpi33.lan.58064 > rpi42.lan.46656: Flags [P.], cksum 0x889e (incorrect -> 0xc67a), seq 1:1045, ack 1044, win 1324, options [nop,nop,TS val 278521143 ecr 278521122], length 1044
1527818729.020611 IP (tos 0x0, ttl 64, id 17858, offset 0, flags [DF], proto TCP (6), length 1096)
    rpi33.lan.40414 > rpi37.lan.46656: Flags [P.], cksum 0x8899 (incorrect -> 0x8c44), seq 1:1045, ack 1044, win 1324, options [nop,nop,TS val 278521143 ecr 278521126], length 1044
1527818729.020831 IP (tos 0x0, ttl 64, id 27016, offset 0, flags [DF], proto TCP (6), length 1096)
    rpi33.lan.46656 > rpi45.lan.42200: Flags [P.], cksum 0xad41 (correct), seq 3929125337:3929126381, ack 2032521328, win 1332, options [nop,nop,TS val 278521143 ecr 278518917], length 1044
1527818729.021053 IP (tos 0x0, ttl 64, id 48114, offset 0, flags [DF], proto TCP (6), length 1096)
    rpi33.lan.40536 > rpi38.lan.46656: Flags [P.], cksum 0x889a (incorrect -> 0xc312), seq 1:1045, ack 1044, win 1324, options [nop,nop,TS val 278521143 ecr 278519676], length 1044
1527818729.021115 IP (tos 0x0, ttl 64, id 42267, offset 0, flags [DF], proto TCP (6), length 1096)
    rpi33.lan.46656 > rpi44.lan.53452: Flags [P.], cksum 0x4cc1 (correct), seq 1:1045, ack 1044, win 1332, options [nop,nop,TS val 278521143 ecr 270663907], length 1044
1527818729.021246 IP (tos 0x0, ttl 64, id 8445, offset 0, flags [DF], proto TCP (6), length 52)
    rpi46.lan.33956 > rpi33.lan.46656: Flags [.], cksum 0xf95e (correct), ack 1045, win 1323, options [nop,nop,TS val 3425704960 ecr 278521143], length 0
1527818729.021270 IP (tos 0x0, ttl 64, id 36815, offset 0, flags [DF], proto TCP (6), length 1096)
    rpi33.lan.46656 > rpi43.lan.41016: Flags [P.], cksum 0x08f0 (correct), seq 1:1045, ack 1044, win 1332, options [nop,nop,TS val 278521143 ecr 278521130], length 1044
1527818729.021326 IP (tos 0x0, ttl 64, id 6250, offset 0, flags [DF], proto TCP (6), length 1096)
    rpi33.lan.46656 > rpi47.lan.38764: Flags [P.], cksum 0x9c65 (correct), seq 1:1045, ack 1044, win 1332, options [nop,nop,TS val 278521143 ecr 278521137], length 1044
1527818729.021435 IP (tos 0x0, ttl 64, id 28490, offset 0, flags [DF], proto TCP (6), length 52)
    rpi42.lan.46656 > rpi33.lan.58064: Flags [.], cksum 0x599c (correct), ack 1045, win 1331, options [nop,nop,TS val 278521123 ecr 278521143], length 0
1527818729.021437 IP (tos 0x0, ttl 64, id 42059, offset 0, flags [DF], proto TCP (6), length 52)
    rpi37.lan.46656 > rpi33.lan.40414: Flags [.], cksum 0xaa18 (correct), ack 1045, win 1331, options [nop,nop,TS val 278521128 ecr 278521143], length 0
1527818729.021486 IP (tos 0x0, ttl 64, id 61898, offset 0, flags [DF], proto TCP (6), length 1096)
    rpi33.lan.46656 > rpi40.lan.32772: Flags [P.], cksum 0xa873 (correct), seq 2806992728:2806993772, ack 746730142, win 1332, options [nop,nop,TS val 278521143 ecr 278518768], length 1044
1527818729.021619 IP (tos 0x0, ttl 64, id 48120, offset 0, flags [DF], proto TCP (6), length 1096)
    rpi33.lan.46656 > rpi39.lan.47594: Flags [P.], cksum 0xab7a (correct), seq 1:1045, ack 1044, win 1332, options [nop,nop,TS val 278521143 ecr 278521140], length 1044
1527818729.021770 IP (tos 0x0, ttl 64, id 32176, offset 0, flags [DF], proto TCP (6), length 1096)
    rpi41.lan.46656 > rpi33.lan.39064: Flags [P.], cksum 0xe069 (correct), seq 1:1045, ack 1044, win 1332, options [nop,nop,TS val 1570081932 ecr 278521143], length 1044
1527818729.021785 IP (tos 0x0, ttl 64, id 45230, offset 0, flags [DF], proto TCP (6), length 1096)
    rpi33.lan.36610 > rpi34.lan.46656: Flags [P.], cksum 0x8896 (incorrect -> 0xda92), seq 1:1045, ack 1044, win 1324, options [nop,nop,TS val 278521143 ecr 278521151], length 1044
1527818729.021846 IP (tos 0x0, ttl 64, id 43981, offset 0, flags [DF], proto TCP (6), length 52)
    rpi33.lan.39064 > rpi41.lan.46656: Flags [.], cksum 0x8489 (incorrect -> 0x6aae), ack 1045, win 1323, options [nop,nop,TS val 278521143 ecr 1570081932], length 0
1527818729.021773 IP (tos 0x0, ttl 64, id 4330, offset 0, flags [DF], proto TCP (6), length 52)
    rpi38.lan.46656 > rpi33.lan.40536: Flags [.], cksum 0xc12b (correct), ack 1045, win 1331, options [nop,nop,TS val 278519676 ecr 278521143], length 0
1527818729.021936 IP (tos 0x0, ttl 64, id 64323, offset 0, flags [DF], proto TCP (6), length 1096)
    rpi33.lan.60752 > rpi36.lan.46656: Flags [P.], cksum 0x8898 (incorrect -> 0x8d24), seq 1:1045, ack 1044, win 1324, options [nop,nop,TS val 278521143 ecr 278521141], length 1044
1527818729.021774 IP (tos 0x0, ttl 64, id 59279, offset 0, flags [DF], proto TCP (6), length 52)
    rpi44.lan.53452 > rpi33.lan.46656: Flags [.], cksum 0x5bc9 (correct), ack 1045, win 1323, options [nop,nop,TS val 270663908 ecr 278521143], length 0
1527818729.021997 IP (tos 0x0, ttl 64, id 62120, offset 0, flags [DF], proto TCP (6), length 1096)
    rpi33.lan.54900 > rpi35.lan.46656: Flags [P.], cksum 0x8897 (incorrect -> 0x382b), seq 1:1045, ack 1044, win 1324, options [nop,nop,TS val 278521143 ecr 278519664], length 1044
1527818729.022056 IP (tos 0x0, ttl 64, id 283, offset 0, flags [DF], proto TCP (6), length 52)
    rpi43.lan.41016 > rpi33.lan.46656: Flags [.], cksum 0x4a2d (correct), ack 1045, win 1323, options [nop,nop,TS val 278521131 ecr 278521143], length 0
1527818729.022246 IP (tos 0x0, ttl 64, id 4030, offset 0, flags [DF], proto TCP (6), length 52)
    rpi47.lan.38764 > rpi33.lan.46656: Flags [.], cksum 0x4edf (correct), ack 1045, win 1323, options [nop,nop,TS val 278521139 ecr 278521143], length 0
1527818729.022248 IP (tos 0x0, ttl 64, id 20813, offset 0, flags [DF], proto TCP (6), length 52)
    rpi39.lan.47594 > rpi33.lan.46656: Flags [.], cksum 0x8a32 (correct), ack 1045, win 1323, options [nop,nop,TS val 278521143 ecr 278521143], length 0
1527818729.022539 IP (tos 0x0, ttl 64, id 5891, offset 0, flags [DF], proto TCP (6), length 52)
    rpi34.lan.46656 > rpi33.lan.36610: Flags [.], cksum 0x1557 (correct), ack 1045, win 1331, options [nop,nop,TS val 278521152 ecr 278521143], length 0
1527818729.022712 IP (tos 0x0, ttl 64, id 63334, offset 0, flags [DF], proto TCP (6), length 52)
    rpi36.lan.46656 > rpi33.lan.60752: Flags [.], cksum 0xe839 (correct), ack 1045, win 1331, options [nop,nop,TS val 278521143 ecr 278521143], length 0
1527818729.022714 IP (tos 0x0, ttl 64, id 45709, offset 0, flags [DF], proto TCP (6), length 52)
    rpi35.lan.46656 > rpi33.lan.54900: Flags [.], cksum 0xba7b (correct), ack 1045, win 1331, options [nop,nop,TS val 278519665 ecr 278521143], length 0
1527818729.026864 IP (tos 0x0, ttl 64, id 49214, offset 0, flags [DF], proto TCP (6), length 1096)
    rpi40.lan.32772 > rpi33.lan.46656: Flags [P.], cksum 0x56d4 (correct), seq 1:1045, ack 1044, win 1324, options [nop,nop,TS val 278518968 ecr 278521143], length 1044
1527818729.026938 IP (tos 0x0, ttl 64, id 61899, offset 0, flags [DF], proto TCP (6), length 52)
    rpi33.lan.46656 > rpi40.lan.32772: Flags [.], cksum 0x8488 (incorrect -> 0x75cf), ack 1045, win 1331, options [nop,nop,TS val 278521144 ecr 278518968], length 0
1527818729.028560 IP (tos 0x0, ttl 64, id 61396, offset 0, flags [DF], proto TCP (6), length 1096)
    rpi45.lan.42200 > rpi33.lan.46656: Flags [P.], cksum 0xfe4e (correct), seq 1:1045, ack 1044, win 1324, options [nop,nop,TS val 278519118 ecr 278521143], length 1044
1527818729.028627 IP (tos 0x0, ttl 64, id 27017, offset 0, flags [DF], proto TCP (6), length 52)
    rpi33.lan.46656 > rpi45.lan.42200: Flags [.], cksum 0x848d (incorrect -> 0xc086), ack 1045, win 1331, options [nop,nop,TS val 278521144 ecr 278519118], length 0
1527818730.993782 IP (tos 0x0, ttl 64, id 20814, offset 0, flags [DF], proto TCP (6), length 1096)
    rpi39.lan.47594 > rpi33.lan.46656: Flags [P.], cksum 0x6ddd (correct), seq 1044:2088, ack 1045, win 1324, options [nop,nop,TS val 278521340 ecr 278521143], length 1044
1527818731.001520 IP (tos 0x0, ttl 64, id 4031, offset 0, flags [DF], proto TCP (6), length 1096)
    rpi47.lan.38764 > rpi33.lan.46656: Flags [P.], cksum 0x4e2e (correct), seq 1044:2088, ack 1045, win 1324, options [nop,nop,TS val 278521337 ecr 278521143], length 1044
1527818731.008213 IP (tos 0x0, ttl 64, id 63335, offset 0, flags [DF], proto TCP (6), length 1096)
    rpi36.lan.46656 > rpi33.lan.60752: Flags [P.], cksum 0x48f4 (correct), seq 1044:2088, ack 1045, win 1332, options [nop,nop,TS val 278521342 ecr 278521143], length 1044
1527818731.008449 IP (tos 0x0, ttl 64, id 42060, offset 0, flags [DF], proto TCP (6), length 1096)
    rpi37.lan.46656 > rpi33.lan.40414: Flags [P.], cksum 0x7df0 (correct), seq 1044:2088, ack 1045, win 1332, options [nop,nop,TS val 278521326 ecr 278521143], length 1044
1527818731.011375 IP (tos 0x0, ttl 64, id 8446, offset 0, flags [DF], proto TCP (6), length 1096)
    rpi46.lan.33956 > rpi33.lan.46656: Flags [P.], cksum 0x55fe (correct), seq 1044:2088, ack 1045, win 1324, options [nop,nop,TS val 3425706950 ecr 278521143], length 1044
1527818731.012372 IP (tos 0x0, ttl 64, id 45710, offset 0, flags [DF], proto TCP (6), length 1096)
    rpi35.lan.46656 > rpi33.lan.54900: Flags [P.], cksum 0xf486 (correct), seq 1044:2088, ack 1045, win 1332, options [nop,nop,TS val 278519864 ecr 278521143], length 1044
1527818731.014914 IP (tos 0x0, ttl 64, id 28491, offset 0, flags [DF], proto TCP (6), length 1096)
    rpi42.lan.46656 > rpi33.lan.58064: Flags [P.], cksum 0x57b1 (correct), seq 1044:2088, ack 1045, win 1332, options [nop,nop,TS val 278521323 ecr 278521143], length 1044
1527818731.015285 IP (tos 0x0, ttl 64, id 284, offset 0, flags [DF], proto TCP (6), length 1096)
    rpi43.lan.41016 > rpi33.lan.46656: Flags [P.], cksum 0x9993 (correct), seq 1044:2088, ack 1045, win 1324, options [nop,nop,TS val 278521331 ecr 278521143], length 1044
1527818731.016048 IP (tos 0x0, ttl 64, id 59280, offset 0, flags [DF], proto TCP (6), length 1096)
    rpi44.lan.53452 > rpi33.lan.46656: Flags [P.], cksum 0x6cdc (correct), seq 1044:2088, ack 1045, win 1324, options [nop,nop,TS val 270664107 ecr 278521143], length 1044
1527818731.018204 IP (tos 0x0, ttl 64, id 5892, offset 0, flags [DF], proto TCP (6), length 1096)
    rpi34.lan.46656 > rpi33.lan.36610: Flags [P.], cksum 0xf68d (correct), seq 1044:2088, ack 1045, win 1332, options [nop,nop,TS val 278521352 ecr 278521143], length 1044
1527818731.023811 IP (tos 0x0, ttl 64, id 45231, offset 0, flags [DF], proto TCP (6), length 1096)
    rpi33.lan.36610 > rpi34.lan.46656: Flags [P.], cksum 0x8896 (incorrect -> 0xc4b7), seq 1045:2089, ack 2088, win 1324, options [nop,nop,TS val 278521343 ecr 278521352], length 1044
1527818731.023863 IP (tos 0x0, ttl 64, id 48115, offset 0, flags [DF], proto TCP (6), length 1096)
    rpi33.lan.40536 > rpi38.lan.46656: Flags [P.], cksum 0x889a (incorrect -> 0xf263), seq 1045:2089, ack 1044, win 1324, options [nop,nop,TS val 278521343 ecr 278519676], length 1044
1527818731.023879 IP (tos 0x0, ttl 64, id 4331, offset 0, flags [DF], proto TCP (6), length 1096)
    rpi38.lan.46656 > rpi33.lan.40536: Flags [P.], cksum 0xaf6d (correct), seq 1044:2088, ack 1045, win 1332, options [nop,nop,TS val 278519876 ecr 278521143], length 1044
1527818731.023901 IP (tos 0x0, ttl 64, id 61900, offset 0, flags [DF], proto TCP (6), length 1096)
    rpi33.lan.46656 > rpi40.lan.32772: Flags [P.], cksum 0xaace (correct), seq 1044:2088, ack 1045, win 1332, options [nop,nop,TS val 278521343 ecr 278518968], length 1044
1527818731.024093 IP (tos 0x0, ttl 64, id 48121, offset 0, flags [DF], proto TCP (6), length 1096)
    rpi33.lan.46656 > rpi39.lan.47594: Flags [P.], cksum 0x2b83 (correct), seq 1045:2089, ack 2088, win 1332, options [nop,nop,TS val 278521343 ecr 278521340], length 1044
1527818731.024120 IP (tos 0x0, ttl 64, id 42268, offset 0, flags [DF], proto TCP (6), length 1096)
    rpi33.lan.46656 > rpi44.lan.53452: Flags [P.], cksum 0x9cca (correct), seq 1045:2089, ack 2088, win 1332, options [nop,nop,TS val 278521343 ecr 270664107], length 1044
1527818731.024298 IP (tos 0x0, ttl 64, id 62121, offset 0, flags [DF], proto TCP (6), length 1096)
    rpi33.lan.54900 > rpi35.lan.46656: Flags [P.], cksum 0x8897 (incorrect -> 0xbe43), seq 1045:2089, ack 2088, win 1324, options [nop,nop,TS val 278521343 ecr 278519864], length 1044
1527818731.024327 IP (tos 0x0, ttl 64, id 60443, offset 0, flags [DF], proto TCP (6), length 1096)
    rpi33.lan.58064 > rpi42.lan.46656: Flags [P.], cksum 0x889e (incorrect -> 0x8e68), seq 1045:2089, ack 2088, win 1324, options [nop,nop,TS val 278521343 ecr 278521323], length 1044
1527818731.024572 IP (tos 0x0, ttl 64, id 5893, offset 0, flags [DF], proto TCP (6), length 52)
    rpi34.lan.46656 > rpi33.lan.36610: Flags [.], cksum 0x0b9f (correct), ack 2089, win 1331, options [nop,nop,TS val 278521352 ecr 278521343], length 0
1527818731.024644 IP (tos 0x0, ttl 64, id 36816, offset 0, flags [DF], proto TCP (6), length 1096)
    rpi33.lan.46656 > rpi43.lan.41016: Flags [P.], cksum 0x4367 (correct), seq 1045:2089, ack 2088, win 1332, options [nop,nop,TS val 278521344 ecr 278521331], length 1044
1527818731.024776 IP (tos 0x0, ttl 64, id 4332, offset 0, flags [DF], proto TCP (6), length 52)
    rpi38.lan.46656 > rpi33.lan.40536: Flags [.], cksum 0xb773 (correct), ack 2089, win 1331, options [nop,nop,TS val 278519876 ecr 278521343], length 0
1527818731.024778 IP (tos 0x0, ttl 64, id 20815, offset 0, flags [DF], proto TCP (6), length 52)
    rpi39.lan.47594 > rpi33.lan.46656: Flags [.], cksum 0x8079 (correct), ack 2089, win 1323, options [nop,nop,TS val 278521344 ecr 278521343], length 0
1527818731.024872 IP (tos 0x0, ttl 64, id 43982, offset 0, flags [DF], proto TCP (6), length 1096)
    rpi33.lan.39064 > rpi41.lan.46656: Flags [P.], cksum 0x889d (incorrect -> 0xa462), seq 1044:2088, ack 1045, win 1324, options [nop,nop,TS val 278521344 ecr 1570081932], length 1044
1527818731.024897 IP (tos 0x0, ttl 64, id 6251, offset 0, flags [DF], proto TCP (6), length 1096)
    rpi33.lan.46656 > rpi47.lan.38764: Flags [P.], cksum 0x0b06 (correct), seq 1045:2089, ack 2088, win 1332, options [nop,nop,TS val 278521344 ecr 278521337], length 1044
1527818731.024915 IP (tos 0x0, ttl 64, id 43416, offset 0, flags [DF], proto TCP (6), length 1096)
    rpi33.lan.46656 > rpi46.lan.33956: Flags [P.], cksum 0xf25b (correct), seq 1045:2089, ack 2088, win 1332, options [nop,nop,TS val 278521344 ecr 3425706950], length 1044
1527818731.025091 IP (tos 0x0, ttl 64, id 17859, offset 0, flags [DF], proto TCP (6), length 1096)
    rpi33.lan.40414 > rpi37.lan.46656: Flags [P.], cksum 0x8899 (incorrect -> 0x2648), seq 1045:2089, ack 2088, win 1324, options [nop,nop,TS val 278521344 ecr 278521326], length 1044
1527818731.025186 IP (tos 0x0, ttl 64, id 59281, offset 0, flags [DF], proto TCP (6), length 52)
    rpi44.lan.53452 > rpi33.lan.46656: Flags [.], cksum 0x5211 (correct), ack 2089, win 1323, options [nop,nop,TS val 270664108 ecr 278521343], length 0
1527818731.025188 IP (tos 0x0, ttl 64, id 32177, offset 0, flags [DF], proto TCP (6), length 1096)
    rpi41.lan.46656 > rpi33.lan.39064: Flags [P.], cksum 0x277a (correct), seq 1045:2089, ack 1044, win 1332, options [nop,nop,TS val 1570083936 ecr 278521143], length 1044
1527818731.025192 IP (tos 0x0, ttl 64, id 45711, offset 0, flags [DF], proto TCP (6), length 52)
    rpi35.lan.46656 > rpi33.lan.54900: Flags [.], cksum 0xb0c3 (correct), ack 2089, win 1331, options [nop,nop,TS val 278519865 ecr 278521343], length 0
1527818731.025288 IP (tos 0x0, ttl 64, id 27018, offset 0, flags [DF], proto TCP (6), length 1096)
    rpi33.lan.46656 > rpi45.lan.42200: Flags [P.], cksum 0x367f (correct), seq 1044:2088, ack 1045, win 1332, options [nop,nop,TS val 278521344 ecr 278519118], length 1044
1527818731.025328 IP (tos 0x0, ttl 64, id 43983, offset 0, flags [DF], proto TCP (6), length 52)
    rpi33.lan.39064 > rpi41.lan.46656: Flags [.], cksum 0x8489 (incorrect -> 0x59e9), ack 2089, win 1323, options [nop,nop,TS val 278521344 ecr 1570083936], length 0
1527818731.025194 IP (tos 0x0, ttl 64, id 28492, offset 0, flags [DF], proto TCP (6), length 52)
    rpi42.lan.46656 > rpi33.lan.58064: Flags [.], cksum 0x4fe3 (correct), ack 2089, win 1331, options [nop,nop,TS val 278521324 ecr 278521343], length 0
1527818731.025433 IP (tos 0x0, ttl 64, id 285, offset 0, flags [DF], proto TCP (6), length 52)
    rpi43.lan.41016 > rpi33.lan.46656: Flags [.], cksum 0x4073 (correct), ack 2089, win 1323, options [nop,nop,TS val 278521332 ecr 278521344], length 0
1527818731.025592 IP (tos 0x0, ttl 64, id 64324, offset 0, flags [DF], proto TCP (6), length 1096)
    rpi33.lan.60752 > rpi36.lan.46656: Flags [P.], cksum 0x8898 (incorrect -> 0x4445), seq 1045:2089, ack 2088, win 1324, options [nop,nop,TS val 278521344 ecr 278521342], length 1044
1527818731.025796 IP (tos 0x0, ttl 64, id 8447, offset 0, flags [DF], proto TCP (6), length 52)
    rpi46.lan.33956 > rpi33.lan.46656: Flags [.], cksum 0xe899 (correct), ack 2089, win 1323, options [nop,nop,TS val 3425706964 ecr 278521344], length 0
1527818731.025799 IP (tos 0x0, ttl 64, id 4032, offset 0, flags [DF], proto TCP (6), length 52)
    rpi47.lan.38764 > rpi33.lan.46656: Flags [.], cksum 0x4525 (correct), ack 2089, win 1323, options [nop,nop,TS val 278521340 ecr 278521344], length 0
1527818731.025800 IP (tos 0x0, ttl 64, id 42061, offset 0, flags [DF], proto TCP (6), length 52)
    rpi37.lan.46656 > rpi33.lan.40414: Flags [.], cksum 0xa05f (correct), ack 2089, win 1331, options [nop,nop,TS val 278521328 ecr 278521344], length 0
1527818731.026358 IP (tos 0x0, ttl 64, id 63336, offset 0, flags [DF], proto TCP (6), length 52)
    rpi36.lan.46656 > rpi33.lan.60752: Flags [.], cksum 0xde80 (correct), ack 2089, win 1331, options [nop,nop,TS val 278521343 ecr 278521344], length 0
1527818731.032066 IP (tos 0x0, ttl 64, id 49215, offset 0, flags [DF], proto TCP (6), length 1096)
    rpi40.lan.32772 > rpi33.lan.46656: Flags [P.], cksum 0xf83b (correct), seq 1045:2089, ack 2088, win 1324, options [nop,nop,TS val 278519169 ecr 278521343], length 1044
1527818731.032143 IP (tos 0x0, ttl 64, id 61901, offset 0, flags [DF], proto TCP (6), length 52)
    rpi33.lan.46656 > rpi40.lan.32772: Flags [.], cksum 0x8488 (incorrect -> 0x6c16), ack 2089, win 1331, options [nop,nop,TS val 278521344 ecr 278519169], length 0
1527818731.035893 IP (tos 0x0, ttl 64, id 61397, offset 0, flags [DF], proto TCP (6), length 1096)
    rpi45.lan.42200 > rpi33.lan.46656: Flags [P.], cksum 0xefda (correct), seq 1045:2089, ack 2088, win 1324, options [nop,nop,TS val 278519319 ecr 278521344], length 1044
1527818731.035988 IP (tos 0x0, ttl 64, id 27019, offset 0, flags [DF], proto TCP (6), length 52)
    rpi33.lan.46656 > rpi45.lan.42200: Flags [.], cksum 0x848d (incorrect -> 0xb6cc), ack 2089, win 1331, options [nop,nop,TS val 278521345 ecr 278519319], length 0
1527818731.064503 IP (tos 0x0, ttl 64, id 48116, offset 0, flags [DF], proto TCP (6), length 52)
    rpi33.lan.40536 > rpi38.lan.46656: Flags [.], cksum 0x8486 (incorrect -> 0xb775), ack 2088, win 1324, options [nop,nop,TS val 278521348 ecr 278519876], length 0
1527818731.074673 IP (tos 0x0, ttl 64, id 32178, offset 0, flags [DF], proto TCP (6), length 52)
    rpi41.lan.46656 > rpi33.lan.39064: Flags [.], cksum 0x59af (correct), ack 2088, win 1332, options [nop,nop,TS val 1570083985 ecr 278521344], length 0
1527818732.998902 IP (tos 0x0, ttl 64, id 20816, offset 0, flags [DF], proto TCP (6), length 1096)
    rpi39.lan.47594 > rpi33.lan.46656: Flags [P.], cksum 0xf7f7 (correct), seq 2088:3132, ack 2089, win 1324, options [nop,nop,TS val 278521541 ecr 278521343], length 1044
1527818733.003937 IP (tos 0x0, ttl 64, id 4033, offset 0, flags [DF], proto TCP (6), length 1096)
    rpi47.lan.38764 > rpi33.lan.46656: Flags [P.], cksum 0x102b (correct), seq 2088:3132, ack 2089, win 1324, options [nop,nop,TS val 278521538 ecr 278521344], length 1044
1527818733.011651 IP (tos 0x0, ttl 64, id 42062, offset 0, flags [DF], proto TCP (6), length 1096)
    rpi37.lan.46656 > rpi33.lan.40414: Flags [P.], cksum 0xa8d2 (correct), seq 2088:3132, ack 2089, win 1332, options [nop,nop,TS val 278521527 ecr 278521344], length 1044
1527818733.012094 IP (tos 0x0, ttl 64, id 63337, offset 0, flags [DF], proto TCP (6), length 1096)
    rpi36.lan.46656 > rpi33.lan.60752: Flags [P.], cksum 0x830f (correct), seq 2088:3132, ack 2089, win 1332, options [nop,nop,TS val 278521542 ecr 278521344], length 1044
1527818733.015692 IP (tos 0x0, ttl 64, id 8448, offset 0, flags [DF], proto TCP (6), length 1096)
    rpi46.lan.33956 > rpi33.lan.46656: Flags [P.], cksum 0xbdf7 (correct), seq 2088:3132, ack 2089, win 1324, options [nop,nop,TS val 3425708954 ecr 278521344], length 1044
1527818733.016115 IP (tos 0x0, ttl 64, id 5894, offset 0, flags [DF], proto TCP (6), length 1096)
    rpi34.lan.46656 > rpi33.lan.36610: Flags [P.], cksum 0x979c (correct), seq 2088:3132, ack 2089, win 1332, options [nop,nop,TS val 278521551 ecr 278521343], length 1044
1527818733.017263 IP (tos 0x0, ttl 64, id 45712, offset 0, flags [DF], proto TCP (6), length 1096)
    rpi35.lan.46656 > rpi33.lan.54900: Flags [P.], cksum 0x6b32 (correct), seq 2088:3132, ack 2089, win 1332, options [nop,nop,TS val 278520065 ecr 278521343], length 1044
1527818733.019043 IP (tos 0x0, ttl 64, id 28493, offset 0, flags [DF], proto TCP (6), length 1096)
    rpi42.lan.46656 > rpi33.lan.58064: Flags [P.], cksum 0x33cf (correct), seq 2088:3132, ack 2089, win 1332, options [nop,nop,TS val 278521523 ecr 278521343], length 1044
1527818733.020169 IP (tos 0x0, ttl 64, id 286, offset 0, flags [DF], proto TCP (6), length 1096)
    rpi43.lan.41016 > rpi33.lan.46656: Flags [P.], cksum 0xccd2 (correct), seq 2088:3132, ack 2089, win 1324, options [nop,nop,TS val 278521531 ecr 278521344], length 1044
1527818733.020362 IP (tos 0x0, ttl 64, id 59282, offset 0, flags [DF], proto TCP (6), length 1096)
    rpi44.lan.53452 > rpi33.lan.46656: Flags [P.], cksum 0x6ade (correct), seq 2088:3132, ack 2089, win 1324, options [nop,nop,TS val 270664308 ecr 278521343], length 1044
1527818733.027701 IP (tos 0x0, ttl 64, id 48117, offset 0, flags [DF], proto TCP (6), length 1096)
    rpi33.lan.40536 > rpi38.lan.46656: Flags [P.], cksum 0x889a (incorrect -> 0xac2c), seq 2089:3133, ack 2088, win 1324, options [nop,nop,TS val 278521544 ecr 278519876], length 1044
1527818733.028122 IP (tos 0x0, ttl 64, id 64325, offset 0, flags [DF], proto TCP (6), length 1096)
    rpi33.lan.60752 > rpi36.lan.46656: Flags [P.], cksum 0x8898 (incorrect -> 0x36b1), seq 2089:3133, ack 3132, win 1324, options [nop,nop,TS val 278521544 ecr 278521542], length 1044
1527818733.028156 IP (tos 0x0, ttl 64, id 36817, offset 0, flags [DF], proto TCP (6), length 1096)
    rpi33.lan.46656 > rpi43.lan.41016: Flags [P.], cksum 0xe195 (correct), seq 2089:3133, ack 3132, win 1332, options [nop,nop,TS val 278521544 ecr 278521531], length 1044
1527818733.028195 IP (tos 0x0, ttl 64, id 17860, offset 0, flags [DF], proto TCP (6), length 1096)
    rpi33.lan.40414 > rpi37.lan.46656: Flags [P.], cksum 0x8899 (incorrect -> 0x5a29), seq 2089:3133, ack 3132, win 1324, options [nop,nop,TS val 278521544 ecr 278521527], length 1044
1527818733.028236 IP (tos 0x0, ttl 64, id 4333, offset 0, flags [DF], proto TCP (6), length 1096)
    rpi38.lan.46656 > rpi33.lan.40536: Flags [P.], cksum 0x09c3 (correct), seq 2088:3132, ack 2089, win 1332, options [nop,nop,TS val 278520077 ecr 278521348], length 1044
1527818733.028347 IP (tos 0x0, ttl 64, id 62122, offset 0, flags [DF], proto TCP (6), length 1096)
    rpi33.lan.54900 > rpi35.lan.46656: Flags [P.], cksum 0x8897 (incorrect -> 0xeeef), seq 2089:3133, ack 3132, win 1324, options [nop,nop,TS val 278521544 ecr 278520065], length 1044
1527818733.028377 IP (tos 0x0, ttl 64, id 42269, offset 0, flags [DF], proto TCP (6), length 1096)
    rpi33.lan.46656 > rpi44.lan.53452: Flags [P.], cksum 0xfedd (correct), seq 2089:3133, ack 3132, win 1332, options [nop,nop,TS val 278521544 ecr 270664308], length 1044
1527818733.028395 IP (tos 0x0, ttl 64, id 48118, offset 0, flags [DF], proto TCP (6), length 52)
    rpi33.lan.40536 > rpi38.lan.46656: Flags [.], cksum 0x8486 (incorrect -> 0xadc1), ack 3132, win 1323, options [nop,nop,TS val 278521544 ecr 278520077], length 0
1527818733.028528 IP (tos 0x0, ttl 64, id 61902, offset 0, flags [DF], proto TCP (6), length 1096)
    rpi33.lan.46656 > rpi40.lan.32772: Flags [P.], cksum 0xd701 (correct), seq 2088:3132, ack 2089, win 1332, options [nop,nop,TS val 278521544 ecr 278519169], length 1044
1527818733.028573 IP (tos 0x0, ttl 64, id 32179, offset 0, flags [DF], proto TCP (6), length 1096)
    rpi41.lan.46656 > rpi33.lan.39064: Flags [P.], cksum 0x3cdf (correct), seq 2089:3133, ack 2088, win 1332, options [nop,nop,TS val 1570085939 ecr 278521344], length 1044
1527818733.028615 IP (tos 0x0, ttl 64, id 45232, offset 0, flags [DF], proto TCP (6), length 1096)
    rpi33.lan.36610 > rpi34.lan.46656: Flags [P.], cksum 0x8896 (incorrect -> 0xa5f6), seq 2089:3133, ack 3132, win 1324, options [nop,nop,TS val 278521544 ecr 278521551], length 1044
1527818733.028643 IP (tos 0x0, ttl 64, id 43984, offset 0, flags [DF], proto TCP (6), length 1096)
    rpi33.lan.39064 > rpi41.lan.46656: Flags [P.], cksum 0x889d (incorrect -> 0x116b), seq 2088:3132, ack 2089, win 1324, options [nop,nop,TS val 278521544 ecr 1570083985], length 1044
1527818733.028668 IP (tos 0x0, ttl 64, id 43985, offset 0, flags [DF], proto TCP (6), length 52)
    rpi33.lan.39064 > rpi41.lan.46656: Flags [.], cksum 0x8489 (incorrect -> 0x4926), ack 3133, win 1323, options [nop,nop,TS val 278521544 ecr 1570085939], length 0
1527818733.028817 IP (tos 0x0, ttl 64, id 4334, offset 0, flags [DF], proto TCP (6), length 52)
    rpi38.lan.46656 > rpi33.lan.40536: Flags [.], cksum 0xadb9 (correct), ack 3133, win 1331, options [nop,nop,TS val 278520077 ecr 278521544], length 0
1527818733.028819 IP (tos 0x0, ttl 64, id 63338, offset 0, flags [DF], proto TCP (6), length 52)
    rpi36.lan.46656 > rpi33.lan.60752: Flags [.], cksum 0xd4c7 (correct), ack 3133, win 1331, options [nop,nop,TS val 278521544 ecr 278521544], length 0
1527818733.028874 IP (tos 0x0, ttl 64, id 27020, offset 0, flags [DF], proto TCP (6), length 1096)
    rpi33.lan.46656 > rpi45.lan.42200: Flags [P.], cksum 0xde82 (correct), seq 2088:3132, ack 2089, win 1332, options [nop,nop,TS val 278521544 ecr 278519319], length 1044
1527818733.029072 IP (tos 0x0, ttl 64, id 287, offset 0, flags [DF], proto TCP (6), length 52)
    rpi43.lan.41016 > rpi33.lan.46656: Flags [.], cksum 0x36bb (correct), ack 3133, win 1323, options [nop,nop,TS val 278521532 ecr 278521544], length 0
1527818733.029074 IP (tos 0x0, ttl 64, id 42063, offset 0, flags [DF], proto TCP (6), length 52)
    rpi37.lan.46656 > rpi33.lan.40414: Flags [.], cksum 0x96a7 (correct), ack 3133, win 1331, options [nop,nop,TS val 278521528 ecr 278521544], length 0
1527818733.029246 IP (tos 0x0, ttl 64, id 45713, offset 0, flags [DF], proto TCP (6), length 52)
    rpi35.lan.46656 > rpi33.lan.54900: Flags [.], cksum 0xa709 (correct), ack 3133, win 1331, options [nop,nop,TS val 278520066 ecr 278521544], length 0
1527818733.029258 IP (tos 0x0, ttl 64, id 59283, offset 0, flags [DF], proto TCP (6), length 52)
    rpi44.lan.53452 > rpi33.lan.46656: Flags [.], cksum 0x4857 (correct), ack 3133, win 1323, options [nop,nop,TS val 270664309 ecr 278521544], length 0
1527818733.029363 IP (tos 0x0, ttl 64, id 48122, offset 0, flags [DF], proto TCP (6), length 1096)
    rpi33.lan.46656 > rpi39.lan.47594: Flags [P.], cksum 0x72c7 (correct), seq 2089:3133, ack 3132, win 1332, options [nop,nop,TS val 278521544 ecr 278521541], length 1044
1527818733.029461 IP (tos 0x0, ttl 64, id 43417, offset 0, flags [DF], proto TCP (6), length 1096)
    rpi33.lan.46656 > rpi46.lan.33956: Flags [P.], cksum 0xe323 (correct), seq 2089:3133, ack 3132, win 1332, options [nop,nop,TS val 278521544 ecr 3425708954], length 1044
1527818733.029512 IP (tos 0x0, ttl 64, id 60444, offset 0, flags [DF], proto TCP (6), length 1096)
    rpi33.lan.58064 > rpi42.lan.46656: Flags [P.], cksum 0x889e (incorrect -> 0xf9a6), seq 2089:3133, ack 3132, win 1324, options [nop,nop,TS val 278521544 ecr 278521523], length 1044
1527818733.029524 IP (tos 0x0, ttl 64, id 5895, offset 0, flags [DF], proto TCP (6), length 52)
    rpi34.lan.46656 > rpi33.lan.36610: Flags [.], cksum 0x01e5 (correct), ack 3133, win 1331, options [nop,nop,TS val 278521553 ecr 278521544], length 0
1527818733.029526 IP (tos 0x0, ttl 64, id 32180, offset 0, flags [DF], proto TCP (6), length 52)
    rpi41.lan.46656 > rpi33.lan.39064: Flags [.], cksum 0x491d (correct), ack 3132, win 1331, options [nop,nop,TS val 1570085940 ecr 278521544], length 0
1527818733.029797 IP (tos 0x0, ttl 64, id 6252, offset 0, flags [DF], proto TCP (6), length 1096)
    rpi33.lan.46656 > rpi47.lan.38764: Flags [P.], cksum 0x2912 (correct), seq 2089:3133, ack 3132, win 1332, options [nop,nop,TS val 278521544 ecr 278521538], length 1044
1527818733.030134 IP (tos 0x0, ttl 64, id 20817, offset 0, flags [DF], proto TCP (6), length 52)
    rpi39.lan.47594 > rpi33.lan.46656: Flags [.], cksum 0x76c0 (correct), ack 3133, win 1323, options [nop,nop,TS val 278521544 ecr 278521544], length 0
1527818733.030136 IP (tos 0x0, ttl 64, id 8449, offset 0, flags [DF], proto TCP (6), length 52)
    rpi46.lan.33956 > rpi33.lan.46656: Flags [.], cksum 0xd7d4 (correct), ack 3133, win 1323, options [nop,nop,TS val 3425708969 ecr 278521544], length 0
1527818733.030325 IP (tos 0x0, ttl 64, id 28494, offset 0, flags [DF], proto TCP (6), length 52)
    rpi42.lan.46656 > rpi33.lan.58064: Flags [.], cksum 0x462a (correct), ack 3133, win 1331, options [nop,nop,TS val 278521524 ecr 278521544], length 0
1527818733.030662 IP (tos 0x0, ttl 64, id 4034, offset 0, flags [DF], proto TCP (6), length 52)
    rpi47.lan.38764 > rpi33.lan.46656: Flags [.], cksum 0x3b6d (correct), ack 3133, win 1323, options [nop,nop,TS val 278521540 ecr 278521544], length 0
1527818733.033361 IP (tos 0x0, ttl 64, id 49216, offset 0, flags [DF], proto TCP (6), length 1096)
    rpi40.lan.32772 > rpi33.lan.46656: Flags [P.], cksum 0xe6a2 (correct), seq 2089:3133, ack 3132, win 1324, options [nop,nop,TS val 278519369 ecr 278521544], length 1044
1527818733.033438 IP (tos 0x0, ttl 64, id 61903, offset 0, flags [DF], proto TCP (6), length 52)
    rpi33.lan.46656 > rpi40.lan.32772: Flags [.], cksum 0x8488 (incorrect -> 0x625e), ack 3133, win 1331, options [nop,nop,TS val 278521544 ecr 278519369], length 0
1527818733.036694 IP (tos 0x0, ttl 64, id 61398, offset 0, flags [DF], proto TCP (6), length 1096)
    rpi45.lan.42200 > rpi33.lan.46656: Flags [P.], cksum 0x58f9 (correct), seq 2089:3133, ack 3132, win 1324, options [nop,nop,TS val 278519519 ecr 278521544], length 1044
1527818733.036782 IP (tos 0x0, ttl 64, id 27021, offset 0, flags [DF], proto TCP (6), length 52)
    rpi33.lan.46656 > rpi45.lan.42200: Flags [.], cksum 0x848d (incorrect -> 0xad14), ack 3133, win 1331, options [nop,nop,TS val 278521545 ecr 278519519], length 0
1527818733.523521 IP (tos 0x0, ttl 64, id 61399, offset 0, flags [DF], proto TCP (6), length 1096)
    rpi45.lan.42200 > rpi33.lan.46656: Flags [P.], cksum 0x8a21 (correct), seq 3133:4177, ack 3132, win 1324, options [nop,nop,TS val 278519567 ecr 278521545], length 1044
1527818733.523632 IP (tos 0x0, ttl 64, id 27022, offset 0, flags [DF], proto TCP (6), length 52)
    rpi33.lan.46656 > rpi45.lan.42200: Flags [.], cksum 0x848d (incorrect -> 0xa8a0), ack 4177, win 1331, options [nop,nop,TS val 278521593 ecr 278519567], length 0
1527818735.001946 IP (tos 0x0, ttl 64, id 20818, offset 0, flags [DF], proto TCP (6), length 1096)
    rpi39.lan.47594 > rpi33.lan.46656: Flags [P.], cksum 0x8e8e (correct), seq 3132:4176, ack 3133, win 1324, options [nop,nop,TS val 278521741 ecr 278521544], length 1044
1527818735.007155 IP (tos 0x0, ttl 64, id 4035, offset 0, flags [DF], proto TCP (6), length 1096)
    rpi47.lan.38764 > rpi33.lan.46656: Flags [P.], cksum 0x392f (correct), seq 3132:4176, ack 3133, win 1324, options [nop,nop,TS val 278521738 ecr 278521544], length 1044
1527818735.015318 IP (tos 0x0, ttl 64, id 42064, offset 0, flags [DF], proto TCP (6), length 1096)
    rpi37.lan.46656 > rpi33.lan.40414: Flags [P.], cksum 0x1e89 (correct), seq 3132:4176, ack 3133, win 1332, options [nop,nop,TS val 278521727 ecr 278521544], length 1044
1527818735.015513 IP (tos 0x0, ttl 64, id 63339, offset 0, flags [DF], proto TCP (6), length 1096)
    rpi36.lan.46656 > rpi33.lan.60752: Flags [P.], cksum 0x6927 (correct), seq 3132:4176, ack 3133, win 1332, options [nop,nop,TS val 278521742 ecr 278521544], length 1044
1527818735.018985 IP (tos 0x0, ttl 64, id 8450, offset 0, flags [DF], proto TCP (6), length 1096)
    rpi46.lan.33956 > rpi33.lan.46656: Flags [P.], cksum 0xb58a (correct), seq 3132:4176, ack 3133, win 1324, options [nop,nop,TS val 3425710957 ecr 278521544], length 1044
1527818735.019641 IP (tos 0x0, ttl 64, id 5896, offset 0, flags [DF], proto TCP (6), length 1096)
    rpi34.lan.46656 > rpi33.lan.36610: Flags [P.], cksum 0xf5f6 (correct), seq 3132:4176, ack 3133, win 1332, options [nop,nop,TS val 278521752 ecr 278521544], length 1044
1527818735.019834 IP (tos 0x0, ttl 64, id 45714, offset 0, flags [DF], proto TCP (6), length 1096)
    rpi35.lan.46656 > rpi33.lan.54900: Flags [P.], cksum 0x7f7a (correct), seq 3132:4176, ack 3133, win 1332, options [nop,nop,TS val 278520265 ecr 278521544], length 1044
1527818735.022018 IP (tos 0x0, ttl 64, id 28495, offset 0, flags [DF], proto TCP (6), length 1096)
    rpi42.lan.46656 > rpi33.lan.58064: Flags [P.], cksum 0x2bd4 (correct), seq 3132:4176, ack 3133, win 1332, options [nop,nop,TS val 278521723 ecr 278521544], length 1044
1527818735.022784 IP (tos 0x0, ttl 64, id 288, offset 0, flags [DF], proto TCP (6), length 1096)
    rpi43.lan.41016 > rpi33.lan.46656: Flags [P.], cksum 0x3d80 (correct), seq 3132:4176, ack 3133, win 1324, options [nop,nop,TS val 278521731 ecr 278521544], length 1044
1527818735.023675 IP (tos 0x0, ttl 64, id 59284, offset 0, flags [DF], proto TCP (6), length 1096)
    rpi44.lan.53452 > rpi33.lan.46656: Flags [P.], cksum 0x457a (correct), seq 3132:4176, ack 3133, win 1324, options [nop,nop,TS val 270664508 ecr 278521544], length 1044
1527818735.030972 IP (tos 0x0, ttl 64, id 45233, offset 0, flags [DF], proto TCP (6), length 1096)
    rpi33.lan.36610 > rpi34.lan.46656: Flags [P.], cksum 0x8896 (incorrect -> 0xd7a1), seq 3133:4177, ack 4176, win 1324, options [nop,nop,TS val 278521744 ecr 278521752], length 1044
1527818735.031023 IP (tos 0x0, ttl 64, id 62123, offset 0, flags [DF], proto TCP (6), length 1096)
    rpi33.lan.54900 > rpi35.lan.46656: Flags [P.], cksum 0x8897 (incorrect -> 0x66be), seq 3133:4177, ack 4176, win 1324, options [nop,nop,TS val 278521744 ecr 278520265], length 1044
1527818735.031169 IP (tos 0x0, ttl 64, id 64326, offset 0, flags [DF], proto TCP (6), length 1096)
    rpi33.lan.60752 > rpi36.lan.46656: Flags [P.], cksum 0x8898 (incorrect -> 0x5cc0), seq 3133:4177, ack 4176, win 1324, options [nop,nop,TS val 278521744 ecr 278521742], length 1044
1527818735.031339 IP (tos 0x0, ttl 64, id 27023, offset 0, flags [DF], proto TCP (6), length 1096)
    rpi33.lan.46656 > rpi45.lan.42200: Flags [P.], cksum 0xe274 (correct), seq 3132:4176, ack 4177, win 1332, options [nop,nop,TS val 278521744 ecr 278519567], length 1044
1527818735.031379 IP (tos 0x0, ttl 64, id 60445, offset 0, flags [DF], proto TCP (6), length 1096)
    rpi33.lan.58064 > rpi42.lan.46656: Flags [P.], cksum 0x889e (incorrect -> 0x2cbc), seq 3133:4177, ack 4176, win 1324, options [nop,nop,TS val 278521744 ecr 278521723], length 1044
1527818735.031690 IP (tos 0x0, ttl 64, id 5897, offset 0, flags [DF], proto TCP (6), length 52)
    rpi34.lan.46656 > rpi33.lan.36610: Flags [.], cksum 0xf82c (correct), ack 4177, win 1331, options [nop,nop,TS val 278521753 ecr 278521744], length 0
1527818735.031775 IP (tos 0x0, ttl 64, id 6253, offset 0, flags [DF], proto TCP (6), length 1096)
    rpi33.lan.46656 > rpi47.lan.38764: Flags [P.], cksum 0xb589 (correct), seq 3133:4177, ack 4176, win 1332, options [nop,nop,TS val 278521744 ecr 278521738], length 1044
