1527819095.334607 IP (tos 0x0, ttl 64, id 11043, offset 0, flags [DF], proto TCP (6), length 1096)
    rpi46.lan.33956 > rpi33.lan.46656: Flags [P.], cksum 0x85c5 (correct), seq 277500717:277501761, ack 614740112, win 1324, options [nop,nop,TS val 3426071274 ecr 278557577], length 1044
1527819095.335885 IP (tos 0x0, ttl 64, id 2780, offset 0, flags [DF], proto TCP (6), length 1096)
    rpi43.lan.41016 > rpi33.lan.46656: Flags [P.], cksum 0x2815 (correct), seq 3133867830:3133868874, ack 4121489512, win 1324, options [nop,nop,TS val 278557763 ecr 278557577], length 1044
1527819095.339778 IP (tos 0x0, ttl 64, id 8457, offset 0, flags [DF], proto TCP (6), length 1096)
    rpi34.lan.46656 > rpi33.lan.36610: Flags [P.], cksum 0x8d31 (correct), seq 1296992256:1296993300, ack 2185897263, win 1332, options [nop,nop,TS val 278557784 ecr 278557577], length 1044
1527819095.341751 IP (tos 0x0, ttl 64, id 7003, offset 0, flags [DF], proto TCP (6), length 1096)
    rpi38.lan.46656 > rpi33.lan.40536: Flags [P.], cksum 0x94fd (correct), seq 1643976913:1643977957, ack 3528178563, win 1332, options [nop,nop,TS val 278556308 ecr 278557577], length 1044
1527819095.342582 IP (tos 0x0, ttl 64, id 63841, offset 0, flags [DF], proto TCP (6), length 1096)
    rpi45.lan.42200 > rpi33.lan.46656: Flags [P.], cksum 0xb443 (correct), seq 2033955784:2033956828, ack 3930716393, win 1324, options [nop,nop,TS val 278555749 ecr 278557598], length 1044
1527819095.342675 IP (tos 0x0, ttl 64, id 29720, offset 0, flags [DF], proto TCP (6), length 52)
    rpi33.lan.46656 > rpi45.lan.42200: Flags [.], cksum 0x848d (incorrect -> 0x7bd5), ack 1044, win 1331, options [nop,nop,TS val 278557775 ecr 278555749], length 0
1527819095.351445 IP (tos 0x0, ttl 64, id 61958, offset 0, flags [DF], proto TCP (6), length 1096)
    rpi44.lan.53452 > rpi33.lan.46656: Flags [P.], cksum 0x3c8e (correct), seq 263657229:263658273, ack 2113843975, win 1324, options [nop,nop,TS val 270700541 ecr 278557577], length 1044
1527819095.351637 IP (tos 0x0, ttl 64, id 34747, offset 0, flags [DF], proto TCP (6), length 1096)
    rpi41.lan.46656 > rpi33.lan.39064: Flags [P.], cksum 0xbef0 (correct), seq 2311710622:2311711666, ack 3749402159, win 1332, options [nop,nop,TS val 1570448265 ecr 278557577], length 1044
1527819095.353263 IP (tos 0x0, ttl 64, id 537, offset 0, flags [DF], proto TCP (6), length 1096)
    rpi36.lan.46656 > rpi33.lan.60752: Flags [P.], cksum 0x7f70 (correct), seq 4085743979:4085745023, ack 2550447378, win 1332, options [nop,nop,TS val 278557776 ecr 278557577], length 1044
1527819095.356873 IP (tos 0x0, ttl 64, id 48448, offset 0, flags [DF], proto TCP (6), length 1096)
    rpi35.lan.46656 > rpi33.lan.54900: Flags [P.], cksum 0x06a1 (correct), seq 2455342734:2455343778, ack 4036109201, win 1332, options [nop,nop,TS val 278556299 ecr 278557577], length 1044
1527819095.357967 IP (tos 0x0, ttl 64, id 23365, offset 0, flags [DF], proto TCP (6), length 1096)
    rpi39.lan.47594 > rpi33.lan.46656: Flags [P.], cksum 0x81df (correct), seq 3310521737:3310522781, ack 1192507108, win 1324, options [nop,nop,TS val 278557777 ecr 278557577], length 1044
1527819095.361459 IP (tos 0x0, ttl 64, id 44736, offset 0, flags [DF], proto TCP (6), length 1096)
    rpi37.lan.46656 > rpi33.lan.40414: Flags [P.], cksum 0x44f7 (correct), seq 3678287912:3678288956, ack 3331402787, win 1332, options [nop,nop,TS val 278557762 ecr 278557577], length 1044
1527819095.361653 IP (tos 0x0, ttl 64, id 31093, offset 0, flags [DF], proto TCP (6), length 1096)
    rpi42.lan.46656 > rpi33.lan.58064: Flags [P.], cksum 0x8407 (correct), seq 2920554216:2920555260, ack 4239054285, win 1332, options [nop,nop,TS val 278557757 ecr 278557577], length 1044
1527819095.364863 IP (tos 0x0, ttl 64, id 63059, offset 0, flags [DF], proto TCP (6), length 1096)
    rpi33.lan.58064 > rpi42.lan.46656: Flags [P.], cksum 0x889e (incorrect -> 0x40d2), seq 1:1045, ack 1044, win 1324, options [nop,nop,TS val 278557778 ecr 278557757], length 1044
1527819095.364977 IP (tos 0x0, ttl 64, id 1335, offset 0, flags [DF], proto TCP (6), length 1096)
    rpi33.lan.60752 > rpi36.lan.46656: Flags [P.], cksum 0x8898 (incorrect -> 0xe5af), seq 1:1045, ack 1044, win 1324, options [nop,nop,TS val 278557778 ecr 278557776], length 1044
1527819095.365102 IP (tos 0x0, ttl 64, id 47864, offset 0, flags [DF], proto TCP (6), length 1096)
    rpi33.lan.36610 > rpi34.lan.46656: Flags [P.], cksum 0x8896 (incorrect -> 0x209e), seq 1:1045, ack 1044, win 1324, options [nop,nop,TS val 278557778 ecr 278557784], length 1044
1527819095.365205 IP (tos 0x0, ttl 64, id 50795, offset 0, flags [DF], proto TCP (6), length 1096)
    rpi33.lan.46656 > rpi39.lan.47594: Flags [P.], cksum 0xe847 (correct), seq 1:1045, ack 1044, win 1332, options [nop,nop,TS val 278557778 ecr 278557777], length 1044
1527819095.365309 IP (tos 0x0, ttl 64, id 64662, offset 0, flags [DF], proto TCP (6), length 1096)
    rpi33.lan.54900 > rpi35.lan.46656: Flags [P.], cksum 0x8897 (incorrect -> 0x4a39), seq 1:1045, ack 1044, win 1324, options [nop,nop,TS val 278557778 ecr 278556299], length 1044
1527819095.365410 IP (tos 0x0, ttl 64, id 39488, offset 0, flags [DF], proto TCP (6), length 1096)
    rpi33.lan.46656 > rpi43.lan.41016: Flags [P.], cksum 0x5331 (correct), seq 1:1045, ack 1044, win 1332, options [nop,nop,TS val 278557778 ecr 278557763], length 1044
1527819095.365612 IP (tos 0x0, ttl 64, id 64592, offset 0, flags [DF], proto TCP (6), length 1096)
    rpi33.lan.46656 > rpi40.lan.32772: Flags [P.], cksum 0xb03b (correct), seq 2808627632:2808628676, ack 748068550, win 1332, options [nop,nop,TS val 278557778 ecr 278555446], length 1044
1527819095.365661 IP (tos 0x0, ttl 64, id 31094, offset 0, flags [DF], proto TCP (6), length 52)
    rpi42.lan.46656 > rpi33.lan.58064: Flags [.], cksum 0xa2b2 (correct), ack 1045, win 1331, options [nop,nop,TS val 278557758 ecr 278557778], length 0
1527819095.365663 IP (tos 0x0, ttl 64, id 538, offset 0, flags [DF], proto TCP (6), length 52)
    rpi36.lan.46656 > rpi33.lan.60752: Flags [.], cksum 0x6d90 (correct), ack 1045, win 1331, options [nop,nop,TS val 278557777 ecr 278557778], length 0
1527819095.365878 IP (tos 0x0, ttl 64, id 8458, offset 0, flags [DF], proto TCP (6), length 52)
    rpi34.lan.46656 > rpi33.lan.36610: Flags [.], cksum 0x191a (correct), ack 1045, win 1331, options [nop,nop,TS val 278557786 ecr 278557778], length 0
1527819095.365880 IP (tos 0x0, ttl 64, id 23366, offset 0, flags [DF], proto TCP (6), length 52)
    rpi39.lan.47594 > rpi33.lan.46656: Flags [.], cksum 0x9a30 (correct), ack 1045, win 1323, options [nop,nop,TS val 278557778 ecr 278557778], length 0
1527819095.365983 IP (tos 0x0, ttl 64, id 29721, offset 0, flags [DF], proto TCP (6), length 1096)
    rpi33.lan.46656 > rpi45.lan.42200: Flags [P.], cksum 0x6262 (correct), seq 1:1045, ack 1044, win 1332, options [nop,nop,TS val 278557778 ecr 278555749], length 1044
1527819095.366013 IP (tos 0x0, ttl 64, id 44825, offset 0, flags [DF], proto TCP (6), length 1096)
    rpi33.lan.46656 > rpi44.lan.53452: Flags [P.], cksum 0x5b4b (correct), seq 1:1045, ack 1044, win 1332, options [nop,nop,TS val 278557778 ecr 270700541], length 1044
1527819095.366042 IP (tos 0x0, ttl 64, id 46593, offset 0, flags [DF], proto TCP (6), length 1096)
    rpi33.lan.39064 > rpi41.lan.46656: Flags [P.], cksum 0x889d (incorrect -> 0x36b8), seq 1:1045, ack 1044, win 1324, options [nop,nop,TS val 278557778 ecr 1570448265], length 1044
1527819095.366166 IP (tos 0x0, ttl 64, id 48449, offset 0, flags [DF], proto TCP (6), length 52)
    rpi35.lan.46656 > rpi33.lan.54900: Flags [.], cksum 0x1f32 (correct), ack 1045, win 1331, options [nop,nop,TS val 278556299 ecr 278557778], length 0
1527819095.366195 IP (tos 0x0, ttl 64, id 45993, offset 0, flags [DF], proto TCP (6), length 1096)
    rpi33.lan.46656 > rpi46.lan.33956: Flags [P.], cksum 0x9474 (correct), seq 1:1045, ack 1044, win 1332, options [nop,nop,TS val 278557778 ecr 3426071274], length 1044
1527819095.366228 IP (tos 0x0, ttl 64, id 20362, offset 0, flags [DF], proto TCP (6), length 1096)
    rpi33.lan.40414 > rpi37.lan.46656: Flags [P.], cksum 0x8899 (incorrect -> 0xebe9), seq 1:1045, ack 1044, win 1324, options [nop,nop,TS val 278557778 ecr 278557762], length 1044
1527819095.366168 IP (tos 0x0, ttl 64, id 2781, offset 0, flags [DF], proto TCP (6), length 52)
    rpi43.lan.41016 > rpi33.lan.46656: Flags [.], cksum 0xdcab (correct), ack 1045, win 1323, options [nop,nop,TS val 278557766 ecr 278557778], length 0
1527819095.366260 IP (tos 0x0, ttl 64, id 50642, offset 0, flags [DF], proto TCP (6), length 1096)
    rpi33.lan.40536 > rpi38.lan.46656: Flags [P.], cksum 0x889a (incorrect -> 0xcd38), seq 1:1045, ack 1044, win 1324, options [nop,nop,TS val 278557778 ecr 278556308], length 1044
1527819095.366400 IP (tos 0x0, ttl 64, id 51660, offset 0, flags [DF], proto TCP (6), length 52)
    rpi40.lan.32772 > rpi33.lan.46656: Flags [.], cksum 0xfd08 (correct), ack 1044, win 1323, options [nop,nop,TS val 278555602 ecr 278557778], length 0
1527819095.366441 IP (tos 0x0, ttl 64, id 8928, offset 0, flags [DF], proto TCP (6), length 1096)
    rpi33.lan.46656 > rpi47.lan.38764: Flags [P.], cksum 0x1ad8 (correct), seq 4141016702:4141017746, ack 3233591366, win 1332, options [nop,nop,TS val 278557778 ecr 278557579], length 1044
1527819095.366765 IP (tos 0x0, ttl 64, id 6511, offset 0, flags [DF], proto TCP (6), length 1096)
    rpi47.lan.38764 > rpi33.lan.46656: Flags [P.], cksum 0x8407 (correct), seq 1:1045, ack 0, win 1324, options [nop,nop,TS val 278557774 ecr 278557577], length 1044
1527819095.366839 IP (tos 0x0, ttl 64, id 8929, offset 0, flags [DF], proto TCP (6), length 52)
    rpi33.lan.46656 > rpi47.lan.38764: Flags [.], cksum 0x848f (incorrect -> 0x3f22), ack 1045, win 1331, options [nop,nop,TS val 278557778 ecr 278557774], length 0
1527819095.366768 IP (tos 0x0, ttl 64, id 63842, offset 0, flags [DF], proto TCP (6), length 52)
    rpi45.lan.42200 > rpi33.lan.46656: Flags [.], cksum 0x77c3 (correct), ack 1045, win 1323, options [nop,nop,TS val 278555752 ecr 278557778], length 0
1527819095.366770 IP (tos 0x0, ttl 64, id 61959, offset 0, flags [DF], proto TCP (6), length 52)
    rpi44.lan.53452 > rpi33.lan.46656: Flags [.], cksum 0xe11f (correct), ack 1045, win 1323, options [nop,nop,TS val 270700542 ecr 278557778], length 0
1527819095.367003 IP (tos 0x0, ttl 64, id 34748, offset 0, flags [DF], proto TCP (6), length 52)
    rpi41.lan.46656 > rpi33.lan.39064: Flags [.], cksum 0xe8f1 (correct), ack 1045, win 1331, options [nop,nop,TS val 1570448281 ecr 278557778], length 0
1527819095.367005 IP (tos 0x0, ttl 64, id 11044, offset 0, flags [DF], proto TCP (6), length 52)
    rpi46.lan.33956 > rpi33.lan.46656: Flags [.], cksum 0xed03 (correct), ack 1045, win 1323, options [nop,nop,TS val 3426071307 ecr 278557778], length 0
1527819095.367007 IP (tos 0x0, ttl 64, id 44737, offset 0, flags [DF], proto TCP (6), length 52)
    rpi37.lan.46656 > rpi33.lan.40414: Flags [.], cksum 0x80ff (correct), ack 1045, win 1331, options [nop,nop,TS val 278557762 ecr 278557778], length 0
1527819095.367208 IP (tos 0x0, ttl 64, id 7004, offset 0, flags [DF], proto TCP (6), length 52)
    rpi38.lan.46656 > rpi33.lan.40536: Flags [.], cksum 0x83ad (correct), ack 1045, win 1331, options [nop,nop,TS val 278556311 ecr 278557778], length 0
1527819095.367385 IP (tos 0x0, ttl 64, id 6512, offset 0, flags [DF], proto TCP (6), length 52)
    rpi47.lan.38764 > rpi33.lan.46656: Flags [.], cksum 0x3f2a (correct), ack 1044, win 1323, options [nop,nop,TS val 278557774 ecr 278557778], length 0
1527819095.802509 IP (tos 0x0, ttl 64, id 51661, offset 0, flags [DF], proto TCP (6), length 1096)
    rpi40.lan.32772 > rpi33.lan.46656: Flags [P.], cksum 0xf2ea (correct), seq 1:1045, ack 1044, win 1324, options [nop,nop,TS val 278555646 ecr 278557778], length 1044
1527819095.802678 IP (tos 0x0, ttl 64, id 64593, offset 0, flags [DF], proto TCP (6), length 52)
    rpi33.lan.46656 > rpi40.lan.32772: Flags [.], cksum 0x8488 (incorrect -> 0xf895), ack 1045, win 1331, options [nop,nop,TS val 278557821 ecr 278555646], length 0
1527819095.926032 IP (tos 0x0, ttl 64, id 29722, offset 0, flags [DF], proto TCP (6), length 1096)
    rpi33.lan.46656 > rpi45.lan.42200: Flags [P.], cksum 0xb68e (correct), seq 1045:2089, ack 1044, win 1332, options [nop,nop,TS val 278557834 ecr 278555752], length 1044
1527819095.926333 IP (tos 0x0, ttl 64, id 63843, offset 0, flags [DF], proto TCP (6), length 1096)
    rpi45.lan.42200 > rpi33.lan.46656: Flags [P.], cksum 0x3af8 (correct), seq 1044:2088, ack 1045, win 1324, options [nop,nop,TS val 278555808 ecr 278557778], length 1044
1527819095.926878 IP (tos 0x0, ttl 64, id 63844, offset 0, flags [DF], proto TCP (6), length 52)
    rpi45.lan.42200 > rpi33.lan.46656: Flags [.], cksum 0x6f2b (correct), ack 2089, win 1323, options [nop,nop,TS val 278555808 ecr 278557834], length 0
1527819095.926936 IP (tos 0x0, ttl 64, id 29723, offset 0, flags [DF], proto TCP (6), length 1096)
    rpi33.lan.46656 > rpi45.lan.42200: Flags [P.], cksum 0x53cb (correct), seq 2089:3133, ack 2088, win 1332, options [nop,nop,TS val 278557834 ecr 278555808], length 1044
1527819095.927551 IP (tos 0x0, ttl 64, id 63845, offset 0, flags [DF], proto TCP (6), length 1096)
    rpi45.lan.42200 > rpi33.lan.46656: Flags [P.], cksum 0xe987 (correct), seq 2088:3132, ack 2089, win 1324, options [nop,nop,TS val 278555808 ecr 278557834], length 1044
1527819095.974507 IP (tos 0x0, ttl 64, id 29724, offset 0, flags [DF], proto TCP (6), length 52)
    rpi33.lan.46656 > rpi45.lan.42200: Flags [.], cksum 0x848d (incorrect -> 0x66f5), ack 3132, win 1332, options [nop,nop,TS val 278557839 ecr 278555808], length 0
1527819095.975574 IP (tos 0x0, ttl 64, id 63846, offset 0, flags [DF], proto TCP (6), length 52)
    rpi45.lan.42200 > rpi33.lan.46656: Flags [.], cksum 0x66fd (correct), ack 3133, win 1324, options [nop,nop,TS val 278555813 ecr 278557834], length 0
1527819097.336990 IP (tos 0x0, ttl 64, id 11045, offset 0, flags [DF], proto TCP (6), length 1096)
    rpi46.lan.33956 > rpi33.lan.46656: Flags [P.], cksum 0xa8d5 (correct), seq 1044:2088, ack 1045, win 1324, options [nop,nop,TS val 3426073276 ecr 278557778], length 1044
1527819097.339052 IP (tos 0x0, ttl 64, id 2782, offset 0, flags [DF], proto TCP (6), length 1096)
    rpi43.lan.41016 > rpi33.lan.46656: Flags [P.], cksum 0xaa9d (correct), seq 1044:2088, ack 1045, win 1324, options [nop,nop,TS val 278557963 ecr 278557778], length 1044
1527819097.342874 IP (tos 0x0, ttl 64, id 8459, offset 0, flags [DF], proto TCP (6), length 1096)
    rpi34.lan.46656 > rpi33.lan.36610: Flags [P.], cksum 0x8c30 (correct), seq 1044:2088, ack 1045, win 1332, options [nop,nop,TS val 278557984 ecr 278557778], length 1044
1527819097.345184 IP (tos 0x0, ttl 64, id 7005, offset 0, flags [DF], proto TCP (6), length 1096)
    rpi38.lan.46656 > rpi33.lan.40536: Flags [P.], cksum 0xf155 (correct), seq 1044:2088, ack 1045, win 1332, options [nop,nop,TS val 278556508 ecr 278557778], length 1044
1527819097.346875 IP (tos 0x0, ttl 64, id 63847, offset 0, flags [DF], proto TCP (6), length 1096)
    rpi45.lan.42200 > rpi33.lan.46656: Flags [P.], cksum 0x283e (correct), seq 3132:4176, ack 3133, win 1324, options [nop,nop,TS val 278555950 ecr 278557834], length 1044
1527819097.346979 IP (tos 0x0, ttl 64, id 29725, offset 0, flags [DF], proto TCP (6), length 52)
    rpi33.lan.46656 > rpi45.lan.42200: Flags [.], cksum 0x848d (incorrect -> 0x61cb), ack 4176, win 1331, options [nop,nop,TS val 278557976 ecr 278555950], length 0
1527819097.354180 IP (tos 0x0, ttl 64, id 61960, offset 0, flags [DF], proto TCP (6), length 1096)
    rpi44.lan.53452 > rpi33.lan.46656: Flags [P.], cksum 0xa279 (correct), seq 1044:2088, ack 1045, win 1324, options [nop,nop,TS val 270700741 ecr 278557778], length 1044
1527819097.355484 IP (tos 0x0, ttl 64, id 34749, offset 0, flags [DF], proto TCP (6), length 1096)
    rpi41.lan.46656 > rpi33.lan.39064: Flags [P.], cksum 0x78ba (correct), seq 1044:2088, ack 1045, win 1332, options [nop,nop,TS val 1570450269 ecr 278557778], length 1044
1527819097.357359 IP (tos 0x0, ttl 64, id 539, offset 0, flags [DF], proto TCP (6), length 1096)
    rpi36.lan.46656 > rpi33.lan.60752: Flags [P.], cksum 0xafc1 (correct), seq 1044:2088, ack 1045, win 1332, options [nop,nop,TS val 278557977 ecr 278557778], length 1044
1527819097.360575 IP (tos 0x0, ttl 64, id 48450, offset 0, flags [DF], proto TCP (6), length 1096)
    rpi35.lan.46656 > rpi33.lan.54900: Flags [P.], cksum 0x75d2 (correct), seq 1044:2088, ack 1045, win 1332, options [nop,nop,TS val 278556499 ecr 278557778], length 1044
1527819097.361531 IP (tos 0x0, ttl 64, id 23367, offset 0, flags [DF], proto TCP (6), length 1096)
    rpi39.lan.47594 > rpi33.lan.46656: Flags [P.], cksum 0x15f1 (correct), seq 1044:2088, ack 1045, win 1324, options [nop,nop,TS val 278557977 ecr 278557778], length 1044
1527819097.364504 IP (tos 0x0, ttl 64, id 44738, offset 0, flags [DF], proto TCP (6), length 1096)
    rpi37.lan.46656 > rpi33.lan.40414: Flags [P.], cksum 0x3c78 (correct), seq 1044:2088, ack 1045, win 1332, options [nop,nop,TS val 278557962 ecr 278557778], length 1044
1527819097.365234 IP (tos 0x0, ttl 64, id 31095, offset 0, flags [DF], proto TCP (6), length 1096)
    rpi42.lan.46656 > rpi33.lan.58064: Flags [P.], cksum 0x51ae (correct), seq 1044:2088, ack 1045, win 1332, options [nop,nop,TS val 278557958 ecr 278557778], length 1044
1527819097.368528 IP (tos 0x0, ttl 64, id 64663, offset 0, flags [DF], proto TCP (6), length 1096)
    rpi33.lan.54900 > rpi35.lan.46656: Flags [P.], cksum 0x8897 (incorrect -> 0x4720), seq 1045:2089, ack 2088, win 1324, options [nop,nop,TS val 278557978 ecr 278556499], length 1044
1527819097.368764 IP (tos 0x0, ttl 64, id 47865, offset 0, flags [DF], proto TCP (6), length 1096)
    rpi33.lan.36610 > rpi34.lan.46656: Flags [P.], cksum 0x8896 (incorrect -> 0xb344), seq 1045:2089, ack 2088, win 1324, options [nop,nop,TS val 278557978 ecr 278557984], length 1044
1527819097.369231 IP (tos 0x0, ttl 64, id 50796, offset 0, flags [DF], proto TCP (6), length 1096)
    rpi33.lan.46656 > rpi39.lan.47594: Flags [P.], cksum 0xc01d (correct), seq 1045:2089, ack 2088, win 1332, options [nop,nop,TS val 278557978 ecr 278557977], length 1044
1527819097.369273 IP (tos 0x0, ttl 64, id 46594, offset 0, flags [DF], proto TCP (6), length 1096)
    rpi33.lan.39064 > rpi41.lan.46656: Flags [P.], cksum 0x889d (incorrect -> 0x1e81), seq 1045:2089, ack 2088, win 1324, options [nop,nop,TS val 278557978 ecr 1570450269], length 1044
1527819097.369333 IP (tos 0x0, ttl 64, id 48451, offset 0, flags [DF], proto TCP (6), length 52)
    rpi35.lan.46656 > rpi33.lan.54900: Flags [.], cksum 0x1579 (correct), ack 2089, win 1331, options [nop,nop,TS val 278556500 ecr 278557978], length 0
1527819097.369515 IP (tos 0x0, ttl 64, id 64594, offset 0, flags [DF], proto TCP (6), length 1096)
    rpi33.lan.46656 > rpi40.lan.32772: Flags [P.], cksum 0x561f (correct), seq 1044:2088, ack 1045, win 1332, options [nop,nop,TS val 278557978 ecr 278555646], length 1044
1527819097.369552 IP (tos 0x0, ttl 64, id 39489, offset 0, flags [DF], proto TCP (6), length 1096)
    rpi33.lan.46656 > rpi43.lan.41016: Flags [P.], cksum 0x491f (correct), seq 1045:2089, ack 2088, win 1332, options [nop,nop,TS val 278557978 ecr 278557963], length 1044
1527819097.369562 IP (tos 0x0, ttl 64, id 8460, offset 0, flags [DF], proto TCP (6), length 52)
    rpi34.lan.46656 > rpi33.lan.36610: Flags [.], cksum 0x0f61 (correct), ack 2089, win 1331, options [nop,nop,TS val 278557987 ecr 278557978], length 0
1527819097.369718 IP (tos 0x0, ttl 64, id 63060, offset 0, flags [DF], proto TCP (6), length 1096)
    rpi33.lan.58064 > rpi42.lan.46656: Flags [P.], cksum 0x889e (incorrect -> 0xf82b), seq 1045:2089, ack 2088, win 1324, options [nop,nop,TS val 278557978 ecr 278557958], length 1044
1527819097.369801 IP (tos 0x0, ttl 64, id 29726, offset 0, flags [DF], proto TCP (6), length 1096)
    rpi33.lan.46656 > rpi45.lan.42200: Flags [P.], cksum 0x820a (correct), seq 3133:4177, ack 4176, win 1332, options [nop,nop,TS val 278557978 ecr 278555950], length 1044
1527819097.369935 IP (tos 0x0, ttl 64, id 20363, offset 0, flags [DF], proto TCP (6), length 1096)
    rpi33.lan.40414 > rpi37.lan.46656: Flags [P.], cksum 0x8899 (incorrect -> 0x6550), seq 1045:2089, ack 2088, win 1324, options [nop,nop,TS val 278557978 ecr 278557962], length 1044
1527819097.370010 IP (tos 0x0, ttl 64, id 44826, offset 0, flags [DF], proto TCP (6), length 1096)
    rpi33.lan.46656 > rpi44.lan.53452: Flags [P.], cksum 0xa75f (correct), seq 1045:2089, ack 2088, win 1332, options [nop,nop,TS val 278557978 ecr 270700741], length 1044
1527819097.370015 IP (tos 0x0, ttl 64, id 23368, offset 0, flags [DF], proto TCP (6), length 52)
    rpi39.lan.47594 > rpi33.lan.46656: Flags [.], cksum 0x9078 (correct), ack 2089, win 1323, options [nop,nop,TS val 278557978 ecr 278557978], length 0
1527819097.370017 IP (tos 0x0, ttl 64, id 34750, offset 0, flags [DF], proto TCP (6), length 52)
    rpi41.lan.46656 > rpi33.lan.39064: Flags [.], cksum 0xd82e (correct), ack 2089, win 1331, options [nop,nop,TS val 1570450284 ecr 278557978], length 0
1527819097.370188 IP (tos 0x0, ttl 64, id 50643, offset 0, flags [DF], proto TCP (6), length 1096)
    rpi33.lan.40536 > rpi38.lan.46656: Flags [P.], cksum 0x889a (incorrect -> 0x52b5), seq 1045:2089, ack 2088, win 1324, options [nop,nop,TS val 278557978 ecr 278556508], length 1044
1527819097.370278 IP (tos 0x0, ttl 64, id 6513, offset 0, flags [DF], proto TCP (6), length 1096)
    rpi47.lan.38764 > rpi33.lan.46656: Flags [P.], cksum 0x5150 (correct), seq 1045:2089, ack 1044, win 1324, options [nop,nop,TS val 278557974 ecr 278557778], length 1044
1527819097.370376 IP (tos 0x0, ttl 64, id 8930, offset 0, flags [DF], proto TCP (6), length 52)
    rpi33.lan.46656 > rpi47.lan.38764: Flags [.], cksum 0x848f (incorrect -> 0x397e), ack 2089, win 1331, options [nop,nop,TS val 278557978 ecr 278557974], length 0
1527819097.370281 IP (tos 0x0, ttl 64, id 51662, offset 0, flags [DF], proto TCP (6), length 52)
    rpi40.lan.32772 > rpi33.lan.46656: Flags [.], cksum 0xf34f (correct), ack 2088, win 1323, options [nop,nop,TS val 278555803 ecr 278557978], length 0
1527819097.370416 IP (tos 0x0, ttl 64, id 45994, offset 0, flags [DF], proto TCP (6), length 1096)
    rpi33.lan.46656 > rpi46.lan.33956: Flags [P.], cksum 0xfc6a (correct), seq 1045:2089, ack 2088, win 1332, options [nop,nop,TS val 278557978 ecr 3426073276], length 1044
1527819097.370441 IP (tos 0x0, ttl 64, id 8931, offset 0, flags [DF], proto TCP (6), length 1096)
    rpi33.lan.46656 > rpi47.lan.38764: Flags [P.], cksum 0x7131 (correct), seq 1044:2088, ack 2089, win 1331, options [nop,nop,TS val 278557978 ecr 278557974], length 1044
1527819097.370577 IP (tos 0x0, ttl 64, id 2783, offset 0, flags [DF], proto TCP (6), length 52)
    rpi43.lan.41016 > rpi33.lan.46656: Flags [.], cksum 0xd2f3 (correct), ack 2089, win 1323, options [nop,nop,TS val 278557966 ecr 278557978], length 0
1527819097.370586 IP (tos 0x0, ttl 64, id 31096, offset 0, flags [DF], proto TCP (6), length 52)
    rpi42.lan.46656 > rpi33.lan.58064: Flags [.], cksum 0x98fa (correct), ack 2089, win 1331, options [nop,nop,TS val 278557958 ecr 278557978], length 0
1527819097.370627 IP (tos 0x0, ttl 64, id 1336, offset 0, flags [DF], proto TCP (6), length 1096)
    rpi33.lan.60752 > rpi36.lan.46656: Flags [P.], cksum 0x8898 (incorrect -> 0x35bd), seq 1045:2089, ack 2088, win 1324, options [nop,nop,TS val 278557978 ecr 278557977], length 1044
1527819097.370588 IP (tos 0x0, ttl 64, id 63848, offset 0, flags [DF], proto TCP (6), length 52)
    rpi45.lan.42200 > rpi33.lan.46656: Flags [.], cksum 0x5dbb (correct), ack 4177, win 1323, options [nop,nop,TS val 278555952 ecr 278557978], length 0
1527819097.370768 IP (tos 0x0, ttl 64, id 44739, offset 0, flags [DF], proto TCP (6), length 52)
    rpi37.lan.46656 > rpi33.lan.40414: Flags [.], cksum 0x7747 (correct), ack 2089, win 1331, options [nop,nop,TS val 278557962 ecr 278557978], length 0
1527819097.370770 IP (tos 0x0, ttl 64, id 61961, offset 0, flags [DF], proto TCP (6), length 52)
    rpi44.lan.53452 > rpi33.lan.46656: Flags [.], cksum 0xd766 (correct), ack 2089, win 1323, options [nop,nop,TS val 270700743 ecr 278557978], length 0
1527819097.370935 IP (tos 0x0, ttl 64, id 7006, offset 0, flags [DF], proto TCP (6), length 52)
    rpi38.lan.46656 > rpi33.lan.40536: Flags [.], cksum 0x79f5 (correct), ack 2089, win 1331, options [nop,nop,TS val 278556511 ecr 278557978], length 0
1527819097.371129 IP (tos 0x0, ttl 64, id 11046, offset 0, flags [DF], proto TCP (6), length 52)
    rpi46.lan.33956 > rpi33.lan.46656: Flags [.], cksum 0xdc3f (correct), ack 2089, win 1323, options [nop,nop,TS val 3426073311 ecr 278557978], length 0
1527819097.371352 IP (tos 0x0, ttl 64, id 6514, offset 0, flags [DF], proto TCP (6), length 52)
    rpi47.lan.38764 > rpi33.lan.46656: Flags [.], cksum 0x3572 (correct), ack 2088, win 1323, options [nop,nop,TS val 278557974 ecr 278557978], length 0
1527819097.371354 IP (tos 0x0, ttl 64, id 540, offset 0, flags [DF], proto TCP (6), length 52)
    rpi36.lan.46656 > rpi33.lan.60752: Flags [.], cksum 0x63d7 (correct), ack 2089, win 1331, options [nop,nop,TS val 278557978 ecr 278557978], length 0
1527819097.618745 IP (tos 0x0, ttl 64, id 51663, offset 0, flags [DF], proto TCP (6), length 1096)
    rpi40.lan.32772 > rpi33.lan.46656: Flags [P.], cksum 0x3f62 (correct), seq 1045:2089, ack 2088, win 1324, options [nop,nop,TS val 278555828 ecr 278557978], length 1044
1527819097.618876 IP (tos 0x0, ttl 64, id 64595, offset 0, flags [DF], proto TCP (6), length 52)
    rpi33.lan.46656 > rpi40.lan.32772: Flags [.], cksum 0x8488 (incorrect -> 0xef01), ack 2089, win 1331, options [nop,nop,TS val 278558003 ecr 278555828], length 0
1527819097.805106 IP (tos 0x0, ttl 64, id 51664, offset 0, flags [DF], proto TCP (6), length 1096)
    rpi40.lan.32772 > rpi33.lan.46656: Flags [P.], cksum 0xdb8c (correct), seq 2089:3133, ack 2088, win 1324, options [nop,nop,TS val 278555846 ecr 278558003], length 1044
1527819097.805184 IP (tos 0x0, ttl 64, id 64596, offset 0, flags [DF], proto TCP (6), length 52)
    rpi33.lan.46656 > rpi40.lan.32772: Flags [.], cksum 0x8488 (incorrect -> 0xeac8), ack 3133, win 1331, options [nop,nop,TS val 278558022 ecr 278555846], length 0
1527819098.591304 IP (tos 0x0, ttl 64, id 2784, offset 0, flags [DF], proto TCP (6), length 1096)
    rpi43.lan.41016 > rpi33.lan.46656: Flags [P.], cksum 0x5f35 (correct), seq 2088:3132, ack 2089, win 1324, options [nop,nop,TS val 278558088 ecr 278557978], length 1044
1527819098.634543 IP (tos 0x0, ttl 64, id 39490, offset 0, flags [DF], proto TCP (6), length 52)
    rpi33.lan.46656 > rpi43.lan.41016: Flags [.], cksum 0x848b (incorrect -> 0xcddd), ack 3132, win 1332, options [nop,nop,TS val 278558105 ecr 278558088], length 0
1527819098.837486 IP (tos 0x0, ttl 64, id 51665, offset 0, flags [DF], proto TCP (6), length 1096)
    rpi40.lan.32772 > rpi33.lan.46656: Flags [P.], cksum 0x2943 (correct), seq 3133:4177, ack 2088, win 1324, options [nop,nop,TS val 278555949 ecr 278558022], length 1044
1527819098.837597 IP (tos 0x0, ttl 64, id 64597, offset 0, flags [DF], proto TCP (6), length 52)
    rpi33.lan.46656 > rpi40.lan.32772: Flags [.], cksum 0x8488 (incorrect -> 0xe5e6), ack 4177, win 1331, options [nop,nop,TS val 278558125 ecr 278555949], length 0
1527819098.838180 IP (tos 0x0, ttl 64, id 64598, offset 0, flags [DF], proto TCP (6), length 1096)
    rpi33.lan.46656 > rpi40.lan.32772: Flags [P.], cksum 0xcb39 (correct), seq 2088:3132, ack 4177, win 1332, options [nop,nop,TS val 278558125 ecr 278555949], length 1044
1527819098.838941 IP (tos 0x0, ttl 64, id 51666, offset 0, flags [DF], proto TCP (6), length 52)
    rpi40.lan.32772 > rpi33.lan.46656: Flags [.], cksum 0xe1d9 (correct), ack 3132, win 1323, options [nop,nop,TS val 278555950 ecr 278558125], length 0
1527819098.840254 IP (tos 0x0, ttl 64, id 64599, offset 0, flags [DF], proto TCP (6), length 1096)
    rpi33.lan.46656 > rpi40.lan.32772: Flags [P.], cksum 0x0fa1 (correct), seq 3132:4176, ack 4177, win 1332, options [nop,nop,TS val 278558125 ecr 278555950], length 1044
1527819098.840984 IP (tos 0x0, ttl 64, id 51667, offset 0, flags [DF], proto TCP (6), length 52)
    rpi40.lan.32772 > rpi33.lan.46656: Flags [.], cksum 0xddc5 (correct), ack 4176, win 1323, options [nop,nop,TS val 278555950 ecr 278558125], length 0
1527819098.841685 IP (tos 0x0, ttl 64, id 51668, offset 0, flags [DF], proto TCP (6), length 1096)
    rpi40.lan.32772 > rpi33.lan.46656: Flags [P.], cksum 0x471b (correct), seq 4177:5221, ack 4176, win 1324, options [nop,nop,TS val 278555950 ecr 278558125], length 1044
1527819098.884495 IP (tos 0x0, ttl 64, id 64600, offset 0, flags [DF], proto TCP (6), length 52)
    rpi33.lan.46656 > rpi40.lan.32772: Flags [.], cksum 0x8488 (incorrect -> 0xd9a3), ack 5221, win 1332, options [nop,nop,TS val 278558130 ecr 278555950], length 0
1527819099.340466 IP (tos 0x0, ttl 64, id 11047, offset 0, flags [DF], proto TCP (6), length 1096)
    rpi46.lan.33956 > rpi33.lan.46656: Flags [P.], cksum 0x7940 (correct), seq 2088:3132, ack 2089, win 1324, options [nop,nop,TS val 3426075280 ecr 278557978], length 1044
1527819099.342811 IP (tos 0x0, ttl 64, id 2785, offset 0, flags [DF], proto TCP (6), length 1096)
    rpi43.lan.41016 > rpi33.lan.46656: Flags [P.], cksum 0x6deb (correct), seq 3132:4176, ack 2089, win 1324, options [nop,nop,TS val 278558163 ecr 278558105], length 1044
1527819099.342905 IP (tos 0x0, ttl 64, id 39491, offset 0, flags [DF], proto TCP (6), length 52)
    rpi33.lan.46656 > rpi43.lan.41016: Flags [.], cksum 0x848b (incorrect -> 0xc939), ack 4176, win 1331, options [nop,nop,TS val 278558175 ecr 278558163], length 0
1527819099.346849 IP (tos 0x0, ttl 64, id 8461, offset 0, flags [DF], proto TCP (6), length 1096)
    rpi34.lan.46656 > rpi33.lan.36610: Flags [P.], cksum 0xf45c (correct), seq 2088:3132, ack 2089, win 1332, options [nop,nop,TS val 278558184 ecr 278557978], length 1044
1527819099.348871 IP (tos 0x0, ttl 64, id 7007, offset 0, flags [DF], proto TCP (6), length 1096)
    rpi38.lan.46656 > rpi33.lan.40536: Flags [P.], cksum 0x858e (correct), seq 2088:3132, ack 2089, win 1332, options [nop,nop,TS val 278556709 ecr 278557978], length 1044
1527819099.350912 IP (tos 0x0, ttl 64, id 63849, offset 0, flags [DF], proto TCP (6), length 1096)
    rpi45.lan.42200 > rpi33.lan.46656: Flags [P.], cksum 0x3783 (correct), seq 4176:5220, ack 4177, win 1324, options [nop,nop,TS val 278556150 ecr 278557978], length 1044
1527819099.358191 IP (tos 0x0, ttl 64, id 34751, offset 0, flags [DF], proto TCP (6), length 1096)
    rpi41.lan.46656 > rpi33.lan.39064: Flags [P.], cksum 0x4c94 (correct), seq 2088:3132, ack 2089, win 1332, options [nop,nop,TS val 1570452272 ecr 278557978], length 1044
1527819099.358386 IP (tos 0x0, ttl 64, id 61962, offset 0, flags [DF], proto TCP (6), length 1096)
    rpi44.lan.53452 > rpi33.lan.46656: Flags [P.], cksum 0x839f (correct), seq 2088:3132, ack 2089, win 1324, options [nop,nop,TS val 270700941 ecr 278557978], length 1044
1527819099.361763 IP (tos 0x0, ttl 64, id 541, offset 0, flags [DF], proto TCP (6), length 1096)
    rpi36.lan.46656 > rpi33.lan.60752: Flags [P.], cksum 0xbb13 (correct), seq 2088:3132, ack 2089, win 1332, options [nop,nop,TS val 278558177 ecr 278557978], length 1044
1527819099.364177 IP (tos 0x0, ttl 64, id 48452, offset 0, flags [DF], proto TCP (6), length 1096)
    rpi35.lan.46656 > rpi33.lan.54900: Flags [P.], cksum 0x088e (correct), seq 2088:3132, ack 2089, win 1332, options [nop,nop,TS val 278556699 ecr 278557978], length 1044
1527819099.364958 IP (tos 0x0, ttl 64, id 23369, offset 0, flags [DF], proto TCP (6), length 1096)
    rpi39.lan.47594 > rpi33.lan.46656: Flags [P.], cksum 0x1287 (correct), seq 2088:3132, ack 2089, win 1324, options [nop,nop,TS val 278558178 ecr 278557978], length 1044
1527819099.367886 IP (tos 0x0, ttl 64, id 44740, offset 0, flags [DF], proto TCP (6), length 1096)
    rpi37.lan.46656 > rpi33.lan.40414: Flags [P.], cksum 0x8e0b (correct), seq 2088:3132, ack 2089, win 1332, options [nop,nop,TS val 278558162 ecr 278557978], length 1044
1527819099.368841 IP (tos 0x0, ttl 64, id 31097, offset 0, flags [DF], proto TCP (6), length 1096)
    rpi42.lan.46656 > rpi33.lan.58064: Flags [P.], cksum 0xbb8d (correct), seq 2088:3132, ack 2089, win 1332, options [nop,nop,TS val 278558158 ecr 278557978], length 1044
1527819099.371309 IP (tos 0x0, ttl 64, id 47866, offset 0, flags [DF], proto TCP (6), length 1096)
    rpi33.lan.36610 > rpi34.lan.46656: Flags [P.], cksum 0x8896 (incorrect -> 0x671a), seq 2089:3133, ack 3132, win 1324, options [nop,nop,TS val 278558178 ecr 278558184], length 1044
1527819099.371543 IP (tos 0x0, ttl 64, id 1337, offset 0, flags [DF], proto TCP (6), length 1096)
    rpi33.lan.60752 > rpi36.lan.46656: Flags [P.], cksum 0x8898 (incorrect -> 0x0fe1), seq 2089:3133, ack 3132, win 1324, options [nop,nop,TS val 278558178 ecr 278558177], length 1044
1527819099.371776 IP (tos 0x0, ttl 64, id 50797, offset 0, flags [DF], proto TCP (6), length 1096)
    rpi33.lan.46656 > rpi39.lan.47594: Flags [P.], cksum 0xcb7b (correct), seq 2089:3133, ack 3132, win 1332, options [nop,nop,TS val 278558178 ecr 278558178], length 1044
1527819099.372076 IP (tos 0x0, ttl 64, id 8462, offset 0, flags [DF], proto TCP (6), length 52)
    rpi34.lan.46656 > rpi33.lan.36610: Flags [.], cksum 0x05a9 (correct), ack 3133, win 1331, options [nop,nop,TS val 278558187 ecr 278558178], length 0
1527819099.372144 IP (tos 0x0, ttl 64, id 8932, offset 0, flags [DF], proto TCP (6), length 1096)
    rpi33.lan.46656 > rpi47.lan.38764: Flags [P.], cksum 0xcf56 (correct), seq 2088:3132, ack 2089, win 1332, options [nop,nop,TS val 278558178 ecr 278557974], length 1044
1527819099.372291 IP (tos 0x0, ttl 64, id 542, offset 0, flags [DF], proto TCP (6), length 52)
    rpi36.lan.46656 > rpi33.lan.60752: Flags [.], cksum 0x5a1f (correct), ack 3133, win 1331, options [nop,nop,TS val 278558178 ecr 278558178], length 0
1527819099.372352 IP (tos 0x0, ttl 64, id 20364, offset 0, flags [DF], proto TCP (6), length 1096)
    rpi33.lan.40414 > rpi37.lan.46656: Flags [P.], cksum 0x8899 (incorrect -> 0xf64f), seq 2089:3133, ack 3132, win 1324, options [nop,nop,TS val 278558178 ecr 278558162], length 1044
1527819099.372508 IP (tos 0x0, ttl 64, id 23370, offset 0, flags [DF], proto TCP (6), length 52)
    rpi39.lan.47594 > rpi33.lan.46656: Flags [.], cksum 0x86c0 (correct), ack 3133, win 1323, options [nop,nop,TS val 278558178 ecr 278558178], length 0
1527819099.372609 IP (tos 0x0, ttl 64, id 64664, offset 0, flags [DF], proto TCP (6), length 1096)
    rpi33.lan.54900 > rpi35.lan.46656: Flags [P.], cksum 0x8897 (incorrect -> 0x8030), seq 2089:3133, ack 3132, win 1324, options [nop,nop,TS val 278558178 ecr 278556699], length 1044
1527819099.372819 IP (tos 0x0, ttl 64, id 50644, offset 0, flags [DF], proto TCP (6), length 1096)
    rpi33.lan.40536 > rpi38.lan.46656: Flags [P.], cksum 0x889a (incorrect -> 0xdce5), seq 2089:3133, ack 3132, win 1324, options [nop,nop,TS val 278558178 ecr 278556709], length 1044
1527819099.373022 IP (tos 0x0, ttl 64, id 63061, offset 0, flags [DF], proto TCP (6), length 1096)
    rpi33.lan.58064 > rpi42.lan.46656: Flags [P.], cksum 0x889e (incorrect -> 0x97fc), seq 2089:3133, ack 3132, win 1324, options [nop,nop,TS val 278558178 ecr 278558158], length 1044
1527819099.373050 IP (tos 0x0, ttl 64, id 6515, offset 0, flags [DF], proto TCP (6), length 52)
    rpi47.lan.38764 > rpi33.lan.46656: Flags [.], cksum 0x2fcd (correct), ack 3132, win 1323, options [nop,nop,TS val 278558175 ecr 278558178], length 0
1527819099.373051 IP (tos 0x0, ttl 64, id 44741, offset 0, flags [DF], proto TCP (6), length 52)
    rpi37.lan.46656 > rpi33.lan.40414: Flags [.], cksum 0x6d8e (correct), ack 3133, win 1331, options [nop,nop,TS val 278558163 ecr 278558178], length 0
1527819099.373231 IP (tos 0x0, ttl 64, id 64601, offset 0, flags [DF], proto TCP (6), length 1096)
    rpi33.lan.46656 > rpi40.lan.32772: Flags [P.], cksum 0x7e11 (correct), seq 4176:5220, ack 5221, win 1332, options [nop,nop,TS val 278558178 ecr 278555950], length 1044
1527819099.373346 IP (tos 0x0, ttl 64, id 48453, offset 0, flags [DF], proto TCP (6), length 52)
    rpi35.lan.46656 > rpi33.lan.54900: Flags [.], cksum 0x0bc1 (correct), ack 3133, win 1331, options [nop,nop,TS val 278556700 ecr 278558178], length 0
1527819099.373462 IP (tos 0x0, ttl 64, id 46595, offset 0, flags [DF], proto TCP (6), length 1096)
    rpi33.lan.39064 > rpi41.lan.46656: Flags [P.], cksum 0x889d (incorrect -> 0x5eee), seq 2089:3133, ack 3132, win 1324, options [nop,nop,TS val 278558178 ecr 1570452272], length 1044
1527819099.373576 IP (tos 0x0, ttl 64, id 6516, offset 0, flags [DF], proto TCP (6), length 1096)
    rpi47.lan.38764 > rpi33.lan.46656: Flags [P.], cksum 0x8e24 (correct), seq 2089:3133, ack 3132, win 1324, options [nop,nop,TS val 278558175 ecr 278558178], length 1044
1527819099.373578 IP (tos 0x0, ttl 64, id 7008, offset 0, flags [DF], proto TCP (6), length 52)
    rpi38.lan.46656 > rpi33.lan.40536: Flags [.], cksum 0x703d (correct), ack 3133, win 1331, options [nop,nop,TS val 278556711 ecr 278558178], length 0
1527819099.373676 IP (tos 0x0, ttl 64, id 44827, offset 0, flags [DF], proto TCP (6), length 1096)
    rpi33.lan.46656 > rpi44.lan.53452: Flags [P.], cksum 0x8877 (correct), seq 2089:3133, ack 3132, win 1332, options [nop,nop,TS val 278558178 ecr 270700941], length 1044
1527819099.373795 IP (tos 0x0, ttl 64, id 31098, offset 0, flags [DF], proto TCP (6), length 52)
    rpi42.lan.46656 > rpi33.lan.58064: Flags [.], cksum 0x8f41 (correct), ack 3133, win 1331, options [nop,nop,TS val 278558159 ecr 278558178], length 0
1527819099.373889 IP (tos 0x0, ttl 64, id 29727, offset 0, flags [DF], proto TCP (6), length 1096)
    rpi33.lan.46656 > rpi45.lan.42200: Flags [P.], cksum 0x2ce8 (correct), seq 4177:5221, ack 5220, win 1332, options [nop,nop,TS val 278558178 ecr 278556150], length 1044
1527819099.374099 IP (tos 0x0, ttl 64, id 39492, offset 0, flags [DF], proto TCP (6), length 1096)
    rpi33.lan.46656 > rpi43.lan.41016: Flags [P.], cksum 0xfee8 (correct), seq 2089:3133, ack 4176, win 1332, options [nop,nop,TS val 278558178 ecr 278558163], length 1044
1527819099.374216 IP (tos 0x0, ttl 64, id 34752, offset 0, flags [DF], proto TCP (6), length 52)
    rpi41.lan.46656 > rpi33.lan.39064: Flags [.], cksum 0xc76a (correct), ack 3133, win 1331, options [nop,nop,TS val 1570452288 ecr 278558178], length 0
1527819099.374430 IP (tos 0x0, ttl 64, id 45995, offset 0, flags [DF], proto TCP (6), length 1096)
    rpi33.lan.46656 > rpi46.lan.33956: Flags [P.], cksum 0x83b7 (correct), seq 2089:3133, ack 3132, win 1332, options [nop,nop,TS val 278558178 ecr 3426075280], length 1044
1527819099.374522 IP (tos 0x0, ttl 64, id 61963, offset 0, flags [DF], proto TCP (6), length 52)
    rpi44.lan.53452 > rpi33.lan.46656: Flags [.], cksum 0xcdae (correct), ack 3133, win 1323, options [nop,nop,TS val 270700943 ecr 278558178], length 0
1527819099.374649 IP (tos 0x0, ttl 64, id 63850, offset 0, flags [DF], proto TCP (6), length 52)
    rpi45.lan.42200 > rpi33.lan.46656: Flags [.], cksum 0x5403 (correct), ack 5221, win 1323, options [nop,nop,TS val 278556152 ecr 278558178], length 0
1527819099.374872 IP (tos 0x0, ttl 64, id 2786, offset 0, flags [DF], proto TCP (6), length 52)
    rpi43.lan.41016 > rpi33.lan.46656: Flags [.], cksum 0xc526 (correct), ack 3133, win 1323, options [nop,nop,TS val 278558167 ecr 278558178], length 0
1527819099.375139 IP (tos 0x0, ttl 64, id 11048, offset 0, flags [DF], proto TCP (6), length 52)
