1527815318.786079 IP (tos 0x0, ttl 64, id 55260, offset 0, flags [DF], proto TCP (6), length 1096)
    rpi37.lan.46656 > rpi33.lan.57588: Flags [P.], cksum 0x75e8 (correct), seq 888297514:888298558, ack 3678858913, win 1332, options [nop,nop,TS val 278180104 ecr 278179922], length 1044
1527815318.787916 IP (tos 0x0, ttl 64, id 48000, offset 0, flags [DF], proto TCP (6), length 1096)
    rpi34.lan.50462 > rpi33.lan.46656: Flags [P.], cksum 0x48ea (correct), seq 1115407323:1115408367, ack 2417119164, win 1324, options [nop,nop,TS val 278180129 ecr 278180018], length 1044
1527815318.788041 IP (tos 0x0, ttl 64, id 11546, offset 0, flags [DF], proto TCP (6), length 52)
    rpi33.lan.46656 > rpi34.lan.50462: Flags [.], cksum 0x8482 (incorrect -> 0x0433), ack 1044, win 1331, options [nop,nop,TS val 278180120 ecr 278180129], length 0
1527815318.803915 IP (tos 0x0, ttl 64, id 19395, offset 0, flags [DF], proto TCP (6), length 1096)
    rpi36.lan.46656 > rpi33.lan.49740: Flags [P.], cksum 0x395e (correct), seq 1467024153:1467025197, ack 572357767, win 1332, options [nop,nop,TS val 278180121 ecr 278179922], length 1044
1527815318.806009 IP (tos 0x0, ttl 64, id 11096, offset 0, flags [DF], proto TCP (6), length 1096)
    rpi35.lan.46656 > rpi33.lan.43980: Flags [P.], cksum 0xd711 (correct), seq 243169133:243170177, ack 1150718721, win 1332, options [nop,nop,TS val 278178643 ecr 278179922], length 1044
1527815318.810762 IP (tos 0x0, ttl 64, id 64219, offset 0, flags [DF], proto TCP (6), length 1096)
    rpi33.lan.49740 > rpi36.lan.46656: Flags [P.], cksum 0x8898 (incorrect -> 0x6c3c), seq 1:1045, ack 1044, win 1324, options [nop,nop,TS val 278180122 ecr 278180121], length 1044
1527815318.810812 IP (tos 0x0, ttl 64, id 11547, offset 0, flags [DF], proto TCP (6), length 1096)
    rpi33.lan.46656 > rpi34.lan.50462: Flags [P.], cksum 0x5d27 (correct), seq 1:1045, ack 1044, win 1332, options [nop,nop,TS val 278180122 ecr 278180129], length 1044
1527815318.810830 IP (tos 0x0, ttl 64, id 41172, offset 0, flags [DF], proto TCP (6), length 1096)
    rpi33.lan.43980 > rpi35.lan.46656: Flags [P.], cksum 0x8897 (incorrect -> 0xa6d7), seq 1:1045, ack 1044, win 1324, options [nop,nop,TS val 278180122 ecr 278178643], length 1044
1527815318.811096 IP (tos 0x0, ttl 64, id 61167, offset 0, flags [DF], proto TCP (6), length 1096)
    rpi33.lan.57588 > rpi37.lan.46656: Flags [P.], cksum 0x8899 (incorrect -> 0xd629), seq 1:1045, ack 1044, win 1324, options [nop,nop,TS val 278180122 ecr 278180104], length 1044
1527815318.811569 IP (tos 0x0, ttl 64, id 19396, offset 0, flags [DF], proto TCP (6), length 52)
    rpi36.lan.46656 > rpi33.lan.49740: Flags [.], cksum 0xefea (correct), ack 1045, win 1331, options [nop,nop,TS val 278180122 ecr 278180122], length 0
1527815318.811720 IP (tos 0x0, ttl 64, id 11097, offset 0, flags [DF], proto TCP (6), length 52)
    rpi35.lan.46656 > rpi33.lan.43980: Flags [.], cksum 0xa7dd (correct), ack 1045, win 1331, options [nop,nop,TS val 278178644 ecr 278180122], length 0
1527815318.811722 IP (tos 0x0, ttl 64, id 55261, offset 0, flags [DF], proto TCP (6), length 52)
    rpi37.lan.46656 > rpi33.lan.57588: Flags [.], cksum 0x737a (correct), ack 1045, win 1331, options [nop,nop,TS val 278180107 ecr 278180122], length 0
1527815318.857384 IP (tos 0x0, ttl 64, id 48001, offset 0, flags [DF], proto TCP (6), length 52)
    rpi34.lan.50462 > rpi33.lan.46656: Flags [.], cksum 0x001d (correct), ack 1045, win 1324, options [nop,nop,TS val 278180136 ecr 278180122], length 0
1527815320.788965 IP (tos 0x0, ttl 64, id 55262, offset 0, flags [DF], proto TCP (6), length 1096)
    rpi37.lan.46656 > rpi33.lan.57588: Flags [P.], cksum 0x10ea (correct), seq 1044:2088, ack 1045, win 1332, options [nop,nop,TS val 278180304 ecr 278180122], length 1044
1527815320.791269 IP (tos 0x0, ttl 64, id 48002, offset 0, flags [DF], proto TCP (6), length 1096)
    rpi34.lan.50462 > rpi33.lan.46656: Flags [P.], cksum 0x17eb (correct), seq 1044:2088, ack 1045, win 1324, options [nop,nop,TS val 278180329 ecr 278180122], length 1044
1527815320.807495 IP (tos 0x0, ttl 64, id 19397, offset 0, flags [DF], proto TCP (6), length 1096)
    rpi36.lan.46656 > rpi33.lan.49740: Flags [P.], cksum 0x1df5 (correct), seq 1044:2088, ack 1045, win 1332, options [nop,nop,TS val 278180322 ecr 278180122], length 1044
1527815320.809181 IP (tos 0x0, ttl 64, id 11098, offset 0, flags [DF], proto TCP (6), length 1096)
    rpi35.lan.46656 > rpi33.lan.43980: Flags [P.], cksum 0xaa89 (correct), seq 1044:2088, ack 1045, win 1332, options [nop,nop,TS val 278178844 ecr 278180122], length 1044
1527815320.809848 IP (tos 0x0, ttl 64, id 41173, offset 0, flags [DF], proto TCP (6), length 1096)
    rpi33.lan.43980 > rpi35.lan.46656: Flags [P.], cksum 0x8897 (incorrect -> 0x7e8a), seq 1045:2089, ack 2088, win 1324, options [nop,nop,TS val 278180322 ecr 278178844], length 1044
1527815320.809889 IP (tos 0x0, ttl 64, id 64220, offset 0, flags [DF], proto TCP (6), length 1096)
    rpi33.lan.49740 > rpi36.lan.46656: Flags [P.], cksum 0x8898 (incorrect -> 0xed66), seq 1045:2089, ack 2088, win 1324, options [nop,nop,TS val 278180322 ecr 278180322], length 1044
1527815320.810255 IP (tos 0x0, ttl 64, id 11548, offset 0, flags [DF], proto TCP (6), length 1096)
    rpi33.lan.46656 > rpi34.lan.50462: Flags [P.], cksum 0xe61f (correct), seq 1045:2089, ack 2088, win 1332, options [nop,nop,TS val 278180322 ecr 278180329], length 1044
1527815320.810286 IP (tos 0x0, ttl 64, id 61168, offset 0, flags [DF], proto TCP (6), length 1096)
    rpi33.lan.57588 > rpi37.lan.46656: Flags [P.], cksum 0x8899 (incorrect -> 0x9c51), seq 1045:2089, ack 2088, win 1324, options [nop,nop,TS val 278180322 ecr 278180304], length 1044
1527815320.810620 IP (tos 0x0, ttl 64, id 11099, offset 0, flags [DF], proto TCP (6), length 52)
    rpi35.lan.46656 > rpi33.lan.43980: Flags [.], cksum 0x9e25 (correct), ack 2089, win 1331, options [nop,nop,TS val 278178844 ecr 278180322], length 0
1527815320.810622 IP (tos 0x0, ttl 64, id 19398, offset 0, flags [DF], proto TCP (6), length 52)
    rpi36.lan.46656 > rpi33.lan.49740: Flags [.], cksum 0xe632 (correct), ack 2089, win 1331, options [nop,nop,TS val 278180322 ecr 278180322], length 0
1527815320.811018 IP (tos 0x0, ttl 64, id 48003, offset 0, flags [DF], proto TCP (6), length 52)
    rpi34.lan.50462 > rpi33.lan.46656: Flags [.], cksum 0xf66a (correct), ack 2089, win 1323, options [nop,nop,TS val 278180331 ecr 278180322], length 0
1527815320.811020 IP (tos 0x0, ttl 64, id 55263, offset 0, flags [DF], proto TCP (6), length 52)
    rpi37.lan.46656 > rpi33.lan.57588: Flags [.], cksum 0x69c3 (correct), ack 2089, win 1331, options [nop,nop,TS val 278180306 ecr 278180322], length 0
1527815322.792573 IP (tos 0x0, ttl 64, id 55264, offset 0, flags [DF], proto TCP (6), length 1096)
    rpi37.lan.46656 > rpi33.lan.57588: Flags [P.], cksum 0x8959 (correct), seq 2088:3132, ack 2089, win 1332, options [nop,nop,TS val 278180505 ecr 278180322], length 1044
1527815322.794714 IP (tos 0x0, ttl 64, id 48004, offset 0, flags [DF], proto TCP (6), length 1096)
    rpi34.lan.50462 > rpi33.lan.46656: Flags [P.], cksum 0x9bfb (correct), seq 2088:3132, ack 2089, win 1324, options [nop,nop,TS val 278180529 ecr 278180322], length 1044
1527815322.810687 IP (tos 0x0, ttl 64, id 19399, offset 0, flags [DF], proto TCP (6), length 1096)
    rpi36.lan.46656 > rpi33.lan.49740: Flags [P.], cksum 0x1a60 (correct), seq 2088:3132, ack 2089, win 1332, options [nop,nop,TS val 278180522 ecr 278180322], length 1044
1527815322.812437 IP (tos 0x0, ttl 64, id 11100, offset 0, flags [DF], proto TCP (6), length 1096)
    rpi35.lan.46656 > rpi33.lan.43980: Flags [P.], cksum 0x7865 (correct), seq 2088:3132, ack 2089, win 1332, options [nop,nop,TS val 278179044 ecr 278180322], length 1044
1527815322.815603 IP (tos 0x0, ttl 64, id 11549, offset 0, flags [DF], proto TCP (6), length 1096)
    rpi33.lan.46656 > rpi34.lan.50462: Flags [P.], cksum 0x322a (correct), seq 2089:3133, ack 3132, win 1332, options [nop,nop,TS val 278180523 ecr 278180529], length 1044
1527815322.815833 IP (tos 0x0, ttl 64, id 64221, offset 0, flags [DF], proto TCP (6), length 1096)
    rpi33.lan.49740 > rpi36.lan.46656: Flags [P.], cksum 0x8898 (incorrect -> 0x1fe2), seq 2089:3133, ack 3132, win 1324, options [nop,nop,TS val 278180523 ecr 278180522], length 1044
1527815322.816035 IP (tos 0x0, ttl 64, id 41174, offset 0, flags [DF], proto TCP (6), length 1096)
    rpi33.lan.43980 > rpi35.lan.46656: Flags [P.], cksum 0x8897 (incorrect -> 0xc77c), seq 2089:3133, ack 3132, win 1324, options [nop,nop,TS val 278180523 ecr 278179044], length 1044
1527815322.816359 IP (tos 0x0, ttl 64, id 61169, offset 0, flags [DF], proto TCP (6), length 1096)
    rpi33.lan.57588 > rpi37.lan.46656: Flags [P.], cksum 0x8899 (incorrect -> 0xc1db), seq 2089:3133, ack 3132, win 1324, options [nop,nop,TS val 278180523 ecr 278180505], length 1044
1527815322.816387 IP (tos 0x0, ttl 64, id 48005, offset 0, flags [DF], proto TCP (6), length 52)
    rpi34.lan.50462 > rpi33.lan.46656: Flags [.], cksum 0xecb1 (correct), ack 3133, win 1323, options [nop,nop,TS val 278180531 ecr 278180523], length 0
1527815322.816589 IP (tos 0x0, ttl 64, id 19400, offset 0, flags [DF], proto TCP (6), length 52)
    rpi36.lan.46656 > rpi33.lan.49740: Flags [.], cksum 0xdc79 (correct), ack 3133, win 1331, options [nop,nop,TS val 278180522 ecr 278180523], length 0
1527815322.816803 IP (tos 0x0, ttl 64, id 11101, offset 0, flags [DF], proto TCP (6), length 52)
    rpi35.lan.46656 > rpi33.lan.43980: Flags [.], cksum 0x946c (correct), ack 3133, win 1331, options [nop,nop,TS val 278179044 ecr 278180523], length 0
1527815322.817127 IP (tos 0x0, ttl 64, id 55265, offset 0, flags [DF], proto TCP (6), length 52)
    rpi37.lan.46656 > rpi33.lan.57588: Flags [.], cksum 0x6009 (correct), ack 3133, win 1331, options [nop,nop,TS val 278180507 ecr 278180523], length 0
1527815324.795724 IP (tos 0x0, ttl 64, id 55266, offset 0, flags [DF], proto TCP (6), length 1096)
    rpi37.lan.46656 > rpi33.lan.57588: Flags [P.], cksum 0x69ac (correct), seq 3132:4176, ack 3133, win 1332, options [nop,nop,TS val 278180705 ecr 278180523], length 1044
1527815324.798216 IP (tos 0x0, ttl 64, id 48006, offset 0, flags [DF], proto TCP (6), length 1096)
    rpi34.lan.50462 > rpi33.lan.46656: Flags [P.], cksum 0x74a1 (correct), seq 3132:4176, ack 3133, win 1324, options [nop,nop,TS val 278180730 ecr 278180523], length 1044
1527815324.814419 IP (tos 0x0, ttl 64, id 19401, offset 0, flags [DF], proto TCP (6), length 1096)
    rpi36.lan.46656 > rpi33.lan.49740: Flags [P.], cksum 0x3044 (correct), seq 3132:4176, ack 3133, win 1332, options [nop,nop,TS val 278180722 ecr 278180523], length 1044
1527815324.815805 IP (tos 0x0, ttl 64, id 11102, offset 0, flags [DF], proto TCP (6), length 1096)
    rpi35.lan.46656 > rpi33.lan.43980: Flags [P.], cksum 0x8029 (correct), seq 3132:4176, ack 3133, win 1332, options [nop,nop,TS val 278179244 ecr 278180523], length 1044
1527815324.821030 IP (tos 0x0, ttl 64, id 11550, offset 0, flags [DF], proto TCP (6), length 1096)
    rpi33.lan.46656 > rpi34.lan.50462: Flags [P.], cksum 0xe7db (correct), seq 3133:4177, ack 4176, win 1332, options [nop,nop,TS val 278180723 ecr 278180730], length 1044
1527815324.821075 IP (tos 0x0, ttl 64, id 41175, offset 0, flags [DF], proto TCP (6), length 1096)
    rpi33.lan.43980 > rpi35.lan.46656: Flags [P.], cksum 0x8897 (incorrect -> 0xf54a), seq 3133:4177, ack 4176, win 1324, options [nop,nop,TS val 278180723 ecr 278179244], length 1044
1527815324.821093 IP (tos 0x0, ttl 64, id 64222, offset 0, flags [DF], proto TCP (6), length 1096)
    rpi33.lan.49740 > rpi36.lan.46656: Flags [P.], cksum 0x8898 (incorrect -> 0x4b9e), seq 3133:4177, ack 4176, win 1324, options [nop,nop,TS val 278180723 ecr 278180722], length 1044
1527815324.821459 IP (tos 0x0, ttl 64, id 61170, offset 0, flags [DF], proto TCP (6), length 1096)
    rpi33.lan.57588 > rpi37.lan.46656: Flags [P.], cksum 0x8899 (incorrect -> 0x36f7), seq 3133:4177, ack 4176, win 1324, options [nop,nop,TS val 278180723 ecr 278180705], length 1044
1527815324.821812 IP (tos 0x0, ttl 64, id 48007, offset 0, flags [DF], proto TCP (6), length 52)
    rpi34.lan.50462 > rpi33.lan.46656: Flags [.], cksum 0xe2f8 (correct), ack 4177, win 1323, options [nop,nop,TS val 278180732 ecr 278180723], length 0
1527815324.821814 IP (tos 0x0, ttl 64, id 11103, offset 0, flags [DF], proto TCP (6), length 52)
    rpi35.lan.46656 > rpi33.lan.43980: Flags [.], cksum 0x8ab3 (correct), ack 4177, win 1331, options [nop,nop,TS val 278179245 ecr 278180723], length 0
1527815324.822025 IP (tos 0x0, ttl 64, id 19402, offset 0, flags [DF], proto TCP (6), length 52)
    rpi36.lan.46656 > rpi33.lan.49740: Flags [.], cksum 0xd2c0 (correct), ack 4177, win 1331, options [nop,nop,TS val 278180723 ecr 278180723], length 0
1527815324.822241 IP (tos 0x0, ttl 64, id 55267, offset 0, flags [DF], proto TCP (6), length 52)
    rpi37.lan.46656 > rpi33.lan.57588: Flags [.], cksum 0x5650 (correct), ack 4177, win 1331, options [nop,nop,TS val 278180708 ecr 278180723], length 0
1527815326.799294 IP (tos 0x0, ttl 64, id 55268, offset 0, flags [DF], proto TCP (6), length 1096)
    rpi37.lan.46656 > rpi33.lan.57588: Flags [P.], cksum 0xaaa3 (correct), seq 4176:5220, ack 4177, win 1332, options [nop,nop,TS val 278180905 ecr 278180723], length 1044
1527815326.801697 IP (tos 0x0, ttl 64, id 48008, offset 0, flags [DF], proto TCP (6), length 1096)
    rpi34.lan.50462 > rpi33.lan.46656: Flags [P.], cksum 0x77dd (correct), seq 4176:5220, ack 4177, win 1324, options [nop,nop,TS val 278180930 ecr 278180723], length 1044
1527815326.818084 IP (tos 0x0, ttl 64, id 19403, offset 0, flags [DF], proto TCP (6), length 1096)
    rpi36.lan.46656 > rpi33.lan.49740: Flags [P.], cksum 0x4409 (correct), seq 4176:5220, ack 4177, win 1332, options [nop,nop,TS val 278180923 ecr 278180723], length 1044
1527815326.819146 IP (tos 0x0, ttl 64, id 11104, offset 0, flags [DF], proto TCP (6), length 1096)
    rpi35.lan.46656 > rpi33.lan.43980: Flags [P.], cksum 0x860a (correct), seq 4176:5220, ack 4177, win 1332, options [nop,nop,TS val 278179445 ecr 278180723], length 1044
1527815326.824312 IP (tos 0x0, ttl 64, id 61171, offset 0, flags [DF], proto TCP (6), length 1096)
    rpi33.lan.57588 > rpi37.lan.46656: Flags [P.], cksum 0x8899 (incorrect -> 0x2c3f), seq 4177:5221, ack 5220, win 1324, options [nop,nop,TS val 278180923 ecr 278180905], length 1044
1527815326.824352 IP (tos 0x0, ttl 64, id 11551, offset 0, flags [DF], proto TCP (6), length 1096)
    rpi33.lan.46656 > rpi34.lan.50462: Flags [P.], cksum 0x29d0 (correct), seq 4177:5221, ack 5220, win 1332, options [nop,nop,TS val 278180923 ecr 278180930], length 1044
1527815326.824480 IP (tos 0x0, ttl 64, id 41176, offset 0, flags [DF], proto TCP (6), length 1096)
    rpi33.lan.43980 > rpi35.lan.46656: Flags [P.], cksum 0x8897 (incorrect -> 0x1518), seq 4177:5221, ack 5220, win 1324, options [nop,nop,TS val 278180923 ecr 278179445], length 1044
1527815326.824778 IP (tos 0x0, ttl 64, id 64223, offset 0, flags [DF], proto TCP (6), length 1096)
    rpi33.lan.49740 > rpi36.lan.46656: Flags [P.], cksum 0x8898 (incorrect -> 0x80be), seq 4177:5221, ack 5220, win 1324, options [nop,nop,TS val 278180924 ecr 278180923], length 1044
1527815326.825114 IP (tos 0x0, ttl 64, id 55269, offset 0, flags [DF], proto TCP (6), length 52)
    rpi37.lan.46656 > rpi33.lan.57588: Flags [.], cksum 0x4c98 (correct), ack 5221, win 1331, options [nop,nop,TS val 278180908 ecr 278180923], length 0
1527815326.825117 IP (tos 0x0, ttl 64, id 48009, offset 0, flags [DF], proto TCP (6), length 52)
    rpi34.lan.50462 > rpi33.lan.46656: Flags [.], cksum 0xd940 (correct), ack 5221, win 1323, options [nop,nop,TS val 278180932 ecr 278180923], length 0
1527815326.825267 IP (tos 0x0, ttl 64, id 11105, offset 0, flags [DF], proto TCP (6), length 52)
    rpi35.lan.46656 > rpi33.lan.43980: Flags [.], cksum 0x80fb (correct), ack 5221, win 1331, options [nop,nop,TS val 278179445 ecr 278180923], length 0
1527815326.825557 IP (tos 0x0, ttl 64, id 19404, offset 0, flags [DF], proto TCP (6), length 52)
    rpi36.lan.46656 > rpi33.lan.49740: Flags [.], cksum 0xc907 (correct), ack 5221, win 1331, options [nop,nop,TS val 278180923 ecr 278180924], length 0
1527815328.802545 IP (tos 0x0, ttl 64, id 55270, offset 0, flags [DF], proto TCP (6), length 1096)
    rpi37.lan.46656 > rpi33.lan.57588: Flags [P.], cksum 0x6c66 (correct), seq 5220:6264, ack 5221, win 1332, options [nop,nop,TS val 278181106 ecr 278180923], length 1044
1527815328.805387 IP (tos 0x0, ttl 64, id 48010, offset 0, flags [DF], proto TCP (6), length 1096)
    rpi34.lan.50462 > rpi33.lan.46656: Flags [P.], cksum 0x0a62 (correct), seq 5220:6264, ack 5221, win 1324, options [nop,nop,TS val 278181130 ecr 278180923], length 1044
1527815328.821195 IP (tos 0x0, ttl 64, id 19405, offset 0, flags [DF], proto TCP (6), length 1096)
    rpi36.lan.46656 > rpi33.lan.49740: Flags [P.], cksum 0x487a (correct), seq 5220:6264, ack 5221, win 1332, options [nop,nop,TS val 278181123 ecr 278180924], length 1044
1527815328.822455 IP (tos 0x0, ttl 64, id 11106, offset 0, flags [DF], proto TCP (6), length 1096)
    rpi35.lan.46656 > rpi33.lan.43980: Flags [P.], cksum 0x88db (correct), seq 5220:6264, ack 5221, win 1332, options [nop,nop,TS val 278179645 ecr 278180923], length 1044
1527815328.827978 IP (tos 0x0, ttl 64, id 11552, offset 0, flags [DF], proto TCP (6), length 1096)
    rpi33.lan.46656 > rpi34.lan.50462: Flags [P.], cksum 0x74c3 (correct), seq 5221:6265, ack 6264, win 1332, options [nop,nop,TS val 278181124 ecr 278181130], length 1044
1527815328.828245 IP (tos 0x0, ttl 64, id 64224, offset 0, flags [DF], proto TCP (6), length 1096)
    rpi33.lan.49740 > rpi36.lan.46656: Flags [P.], cksum 0x8898 (incorrect -> 0xc979), seq 5221:6265, ack 6264, win 1324, options [nop,nop,TS val 278181124 ecr 278181123], length 1044
1527815328.828456 IP (tos 0x0, ttl 64, id 61172, offset 0, flags [DF], proto TCP (6), length 1096)
    rpi33.lan.57588 > rpi37.lan.46656: Flags [P.], cksum 0x8899 (incorrect -> 0xd397), seq 5221:6265, ack 6264, win 1324, options [nop,nop,TS val 278181124 ecr 278181106], length 1044
1527815328.828770 IP (tos 0x0, ttl 64, id 48011, offset 0, flags [DF], proto TCP (6), length 52)
    rpi34.lan.50462 > rpi33.lan.46656: Flags [.], cksum 0xcf86 (correct), ack 6265, win 1323, options [nop,nop,TS val 278181133 ecr 278181124], length 0
1527815328.828874 IP (tos 0x0, ttl 64, id 41177, offset 0, flags [DF], proto TCP (6), length 1096)
    rpi33.lan.43980 > rpi35.lan.46656: Flags [P.], cksum 0x8897 (incorrect -> 0x4622), seq 5221:6265, ack 6264, win 1324, options [nop,nop,TS val 278181124 ecr 278179645], length 1044
1527815328.829011 IP (tos 0x0, ttl 64, id 19406, offset 0, flags [DF], proto TCP (6), length 52)
    rpi36.lan.46656 > rpi33.lan.49740: Flags [.], cksum 0xbf4e (correct), ack 6265, win 1331, options [nop,nop,TS val 278181124 ecr 278181124], length 0
1527815328.829241 IP (tos 0x0, ttl 64, id 55271, offset 0, flags [DF], proto TCP (6), length 52)
    rpi37.lan.46656 > rpi33.lan.57588: Flags [.], cksum 0x42df (correct), ack 6265, win 1331, options [nop,nop,TS val 278181108 ecr 278181124], length 0
1527815328.829646 IP (tos 0x0, ttl 64, id 11107, offset 0, flags [DF], proto TCP (6), length 52)
    rpi35.lan.46656 > rpi33.lan.43980: Flags [.], cksum 0x7741 (correct), ack 6265, win 1331, options [nop,nop,TS val 278179646 ecr 278181124], length 0
1527815330.806169 IP (tos 0x0, ttl 64, id 55272, offset 0, flags [DF], proto TCP (6), length 1096)
    rpi37.lan.46656 > rpi33.lan.57588: Flags [P.], cksum 0xa1ad (correct), seq 6264:7308, ack 6265, win 1332, options [nop,nop,TS val 278181306 ecr 278181124], length 1044
1527815330.808940 IP (tos 0x0, ttl 64, id 48012, offset 0, flags [DF], proto TCP (6), length 1096)
    rpi34.lan.50462 > rpi33.lan.46656: Flags [P.], cksum 0x620f (correct), seq 6264:7308, ack 6265, win 1324, options [nop,nop,TS val 278181331 ecr 278181124], length 1044
1527815330.824913 IP (tos 0x0, ttl 64, id 19407, offset 0, flags [DF], proto TCP (6), length 1096)
    rpi36.lan.46656 > rpi33.lan.49740: Flags [P.], cksum 0xa8e5 (correct), seq 6264:7308, ack 6265, win 1332, options [nop,nop,TS val 278181323 ecr 278181124], length 1044
1527815330.826055 IP (tos 0x0, ttl 64, id 11108, offset 0, flags [DF], proto TCP (6), length 1096)
    rpi35.lan.46656 > rpi33.lan.43980: Flags [P.], cksum 0x2528 (correct), seq 6264:7308, ack 6265, win 1332, options [nop,nop,TS val 278179845 ecr 278181124], length 1044
1527815330.832843 IP (tos 0x0, ttl 64, id 41178, offset 0, flags [DF], proto TCP (6), length 1096)
    rpi33.lan.43980 > rpi35.lan.46656: Flags [P.], cksum 0x8897 (incorrect -> 0x4697), seq 6265:7309, ack 7308, win 1324, options [nop,nop,TS val 278181324 ecr 278179845], length 1044
1527815330.833243 IP (tos 0x0, ttl 64, id 61173, offset 0, flags [DF], proto TCP (6), length 1096)
    rpi33.lan.57588 > rpi37.lan.46656: Flags [P.], cksum 0x8899 (incorrect -> 0x0620), seq 6265:7309, ack 7308, win 1324, options [nop,nop,TS val 278181324 ecr 278181306], length 1044
1527815330.833283 IP (tos 0x0, ttl 64, id 11553, offset 0, flags [DF], proto TCP (6), length 1096)
    rpi33.lan.46656 > rpi34.lan.50462: Flags [P.], cksum 0x4990 (correct), seq 6265:7309, ack 7308, win 1332, options [nop,nop,TS val 278181324 ecr 278181331], length 1044
1527815330.833311 IP (tos 0x0, ttl 64, id 64225, offset 0, flags [DF], proto TCP (6), length 1096)
    rpi33.lan.49740 > rpi36.lan.46656: Flags [P.], cksum 0x8898 (incorrect -> 0x2df3), seq 6265:7309, ack 7308, win 1324, options [nop,nop,TS val 278181324 ecr 278181323], length 1044
1527815330.833659 IP (tos 0x0, ttl 64, id 11109, offset 0, flags [DF], proto TCP (6), length 52)
    rpi35.lan.46656 > rpi33.lan.43980: Flags [.], cksum 0x6d89 (correct), ack 7309, win 1331, options [nop,nop,TS val 278179846 ecr 278181324], length 0
1527815330.834048 IP (tos 0x0, ttl 64, id 55273, offset 0, flags [DF], proto TCP (6), length 52)
    rpi37.lan.46656 > rpi33.lan.57588: Flags [.], cksum 0x3926 (correct), ack 7309, win 1331, options [nop,nop,TS val 278181309 ecr 278181324], length 0
1527815330.834050 IP (tos 0x0, ttl 64, id 48013, offset 0, flags [DF], proto TCP (6), length 52)
    rpi34.lan.50462 > rpi33.lan.46656: Flags [.], cksum 0xc5ce (correct), ack 7309, win 1323, options [nop,nop,TS val 278181333 ecr 278181324], length 0
1527815330.834214 IP (tos 0x0, ttl 64, id 19408, offset 0, flags [DF], proto TCP (6), length 52)
    rpi36.lan.46656 > rpi33.lan.49740: Flags [.], cksum 0xb596 (correct), ack 7309, win 1331, options [nop,nop,TS val 278181324 ecr 278181324], length 0
1527815331.429085 IP (tos 0x0, ttl 64, id 11110, offset 0, flags [DF], proto TCP (6), length 1096)
    rpi35.lan.46656 > rpi33.lan.43980: Flags [P.], cksum 0x01c7 (correct), seq 7308:8352, ack 7309, win 1332, options [nop,nop,TS val 278179906 ecr 278181324], length 1044
1527815331.429955 IP (tos 0x0, ttl 64, id 41179, offset 0, flags [DF], proto TCP (6), length 1096)
    rpi33.lan.43980 > rpi35.lan.46656: Flags [P.], cksum 0x8897 (incorrect -> 0x44e5), seq 7309:8353, ack 8352, win 1324, options [nop,nop,TS val 278181384 ecr 278179906], length 1044
1527815331.430252 IP (tos 0x0, ttl 64, id 41180, offset 0, flags [DF], proto TCP (6), length 1096)
    rpi33.lan.43980 > rpi35.lan.46656: Flags [P.], cksum 0x8897 (incorrect -> 0x9ae1), seq 8353:9397, ack 8352, win 1324, options [nop,nop,TS val 278181384 ecr 278179906], length 1044
1527815331.430782 IP (tos 0x0, ttl 64, id 11111, offset 0, flags [DF], proto TCP (6), length 52)
    rpi35.lan.46656 > rpi33.lan.43980: Flags [.], cksum 0x64e9 (correct), ack 8353, win 1331, options [nop,nop,TS val 278179906 ecr 278181384], length 0
1527815331.431013 IP (tos 0x0, ttl 64, id 11112, offset 0, flags [DF], proto TCP (6), length 52)
    rpi35.lan.46656 > rpi33.lan.43980: Flags [.], cksum 0x60d5 (correct), ack 9397, win 1331, options [nop,nop,TS val 278179906 ecr 278181384], length 0
1527815331.431650 IP (tos 0x0, ttl 64, id 11113, offset 0, flags [DF], proto TCP (6), length 1096)
    rpi35.lan.46656 > rpi33.lan.43980: Flags [P.], cksum 0xce31 (correct), seq 8352:9396, ack 9397, win 1332, options [nop,nop,TS val 278179906 ecr 278181384], length 1044
1527815331.474618 IP (tos 0x0, ttl 64, id 41181, offset 0, flags [DF], proto TCP (6), length 52)
    rpi33.lan.43980 > rpi35.lan.46656: Flags [.], cksum 0x8483 (incorrect -> 0x5cc3), ack 9396, win 1324, options [nop,nop,TS val 278181389 ecr 278179906], length 0
1527815331.729811 IP (tos 0x0, ttl 64, id 11554, offset 0, flags [DF], proto TCP (6), length 1096)
    rpi33.lan.46656 > rpi34.lan.50462: Flags [P.], cksum 0x687e (correct), seq 7309:8353, ack 7308, win 1332, options [nop,nop,TS val 278181414 ecr 278181333], length 1044
1527815331.729946 IP (tos 0x0, ttl 64, id 61174, offset 0, flags [DF], proto TCP (6), length 1096)
    rpi33.lan.57588 > rpi37.lan.46656: Flags [P.], cksum 0x8899 (incorrect -> 0xc30e), seq 7309:8353, ack 7308, win 1324, options [nop,nop,TS val 278181414 ecr 278181309], length 1044
1527815331.729977 IP (tos 0x0, ttl 64, id 41182, offset 0, flags [DF], proto TCP (6), length 1096)
    rpi33.lan.43980 > rpi35.lan.46656: Flags [P.], cksum 0x8897 (incorrect -> 0x9a8e), seq 9397:10441, ack 9396, win 1324, options [nop,nop,TS val 278181414 ecr 278179906], length 1044
1527815331.730357 IP (tos 0x0, ttl 64, id 64226, offset 0, flags [DF], proto TCP (6), length 1096)
    rpi33.lan.49740 > rpi36.lan.46656: Flags [P.], cksum 0x8898 (incorrect -> 0xa260), seq 7309:8353, ack 7308, win 1324, options [nop,nop,TS val 278181414 ecr 278181324], length 1044
1527815331.730636 IP (tos 0x0, ttl 64, id 48014, offset 0, flags [DF], proto TCP (6), length 52)
    rpi34.lan.50462 > rpi33.lan.46656: Flags [.], cksum 0xc106 (correct), ack 8353, win 1323, options [nop,nop,TS val 278181423 ecr 278181414], length 0
1527815331.730786 IP (tos 0x0, ttl 64, id 55274, offset 0, flags [DF], proto TCP (6), length 52)
    rpi37.lan.46656 > rpi33.lan.57588: Flags [.], cksum 0x345f (correct), ack 8353, win 1331, options [nop,nop,TS val 278181398 ecr 278181414], length 0
1527815331.731209 IP (tos 0x0, ttl 64, id 19409, offset 0, flags [DF], proto TCP (6), length 52)
    rpi36.lan.46656 > rpi33.lan.49740: Flags [.], cksum 0xb0ce (correct), ack 8353, win 1331, options [nop,nop,TS val 278181414 ecr 278181414], length 0
1527815331.777259 IP (tos 0x0, ttl 64, id 11114, offset 0, flags [DF], proto TCP (6), length 52)
    rpi35.lan.46656 > rpi33.lan.43980: Flags [.], cksum 0x586b (correct), ack 10441, win 1332, options [nop,nop,TS val 278179941 ecr 278181414], length 0
1527815331.836352 IP (tos 0x0, ttl 64, id 55275, offset 0, flags [DF], proto TCP (6), length 1096)
    rpi37.lan.46656 > rpi33.lan.57588: Flags [P.], cksum 0x241e (correct), seq 7308:8352, ack 8353, win 1332, options [nop,nop,TS val 278181409 ecr 278181414], length 1044
1527815331.836572 IP (tos 0x0, ttl 64, id 48015, offset 0, flags [DF], proto TCP (6), length 1096)
    rpi34.lan.50462 > rpi33.lan.46656: Flags [P.], cksum 0x497b (correct), seq 7308:8352, ack 8353, win 1324, options [nop,nop,TS val 278181433 ecr 278181414], length 1044
1527815331.837471 IP (tos 0x0, ttl 64, id 19410, offset 0, flags [DF], proto TCP (6), length 1096)
    rpi36.lan.46656 > rpi33.lan.49740: Flags [P.], cksum 0x5c35 (correct), seq 7308:8352, ack 8353, win 1332, options [nop,nop,TS val 278181425 ecr 278181414], length 1044
1527815331.838985 IP (tos 0x0, ttl 64, id 11115, offset 0, flags [DF], proto TCP (6), length 1096)
    rpi35.lan.46656 > rpi33.lan.43980: Flags [P.], cksum 0x7aad (correct), seq 9396:10440, ack 10441, win 1332, options [nop,nop,TS val 278179947 ecr 278181414], length 1044
1527815331.839077 IP (tos 0x0, ttl 64, id 41183, offset 0, flags [DF], proto TCP (6), length 52)
    rpi33.lan.43980 > rpi35.lan.46656: Flags [.], cksum 0x8483 (incorrect -> 0x544f), ack 10440, win 1323, options [nop,nop,TS val 278181425 ecr 278179947], length 0
1527815331.884523 IP (tos 0x0, ttl 64, id 61175, offset 0, flags [DF], proto TCP (6), length 52)
    rpi33.lan.57588 > rpi37.lan.46656: Flags [.], cksum 0x8485 (incorrect -> 0x3037), ack 8352, win 1324, options [nop,nop,TS val 278181430 ecr 278181409], length 0
1527815331.884569 IP (tos 0x0, ttl 64, id 64227, offset 0, flags [DF], proto TCP (6), length 52)
    rpi33.lan.49740 > rpi36.lan.46656: Flags [.], cksum 0x8484 (incorrect -> 0xaca6), ack 8352, win 1324, options [nop,nop,TS val 278181430 ecr 278181425], length 0
1527815331.884611 IP (tos 0x0, ttl 64, id 11555, offset 0, flags [DF], proto TCP (6), length 52)
    rpi33.lan.46656 > rpi34.lan.50462: Flags [.], cksum 0x8482 (incorrect -> 0xbccf), ack 8352, win 1332, options [nop,nop,TS val 278181430 ecr 278181433], length 0
1527815331.943642 IP (tos 0x0, ttl 64, id 19411, offset 0, flags [DF], proto TCP (6), length 1096)
    rpi36.lan.46656 > rpi33.lan.49740: Flags [P.], cksum 0x2f7f (correct), seq 8352:9396, ack 8353, win 1332, options [nop,nop,TS val 278181435 ecr 278181430], length 1044
1527815331.943722 IP (tos 0x0, ttl 64, id 64228, offset 0, flags [DF], proto TCP (6), length 52)
    rpi33.lan.49740 > rpi36.lan.46656: Flags [.], cksum 0x8484 (incorrect -> 0xa884), ack 9396, win 1323, options [nop,nop,TS val 278181435 ecr 278181435], length 0
1527815331.943849 IP (tos 0x0, ttl 64, id 19412, offset 0, flags [DF], proto TCP (6), length 1096)
    rpi36.lan.46656 > rpi33.lan.49740: Flags [P.], cksum 0x33ae (correct), seq 9396:10440, ack 8353, win 1332, options [nop,nop,TS val 278181435 ecr 278181430], length 1044
1527815331.943899 IP (tos 0x0, ttl 64, id 64229, offset 0, flags [DF], proto TCP (6), length 52)
    rpi33.lan.49740 > rpi36.lan.46656: Flags [.], cksum 0x8484 (incorrect -> 0xa470), ack 10440, win 1323, options [nop,nop,TS val 278181435 ecr 278181435], length 0
1527815332.045196 IP (tos 0x0, ttl 64, id 19413, offset 0, flags [DF], proto TCP (6), length 1096)
    rpi36.lan.46656 > rpi33.lan.49740: Flags [P.], cksum 0x4a9b (correct), seq 10440:11484, ack 8353, win 1332, options [nop,nop,TS val 278181445 ecr 278181435], length 1044
1527815332.045350 IP (tos 0x0, ttl 64, id 64230, offset 0, flags [DF], proto TCP (6), length 52)
    rpi33.lan.49740 > rpi36.lan.46656: Flags [.], cksum 0x8484 (incorrect -> 0xa047), ack 11484, win 1323, options [nop,nop,TS val 278181446 ecr 278181445], length 0
1527815332.120039 IP (tos 0x0, ttl 64, id 11116, offset 0, flags [DF], proto TCP (6), length 1096)
    rpi35.lan.46656 > rpi33.lan.43980: Flags [P.], cksum 0x9e26 (correct), seq 10440:11484, ack 10441, win 1332, options [nop,nop,TS val 278179975 ecr 278181425], length 1044
1527815332.120275 IP (tos 0x0, ttl 64, id 41184, offset 0, flags [DF], proto TCP (6), length 52)
    rpi33.lan.43980 > rpi35.lan.46656: Flags [.], cksum 0x8483 (incorrect -> 0x5003), ack 11484, win 1323, options [nop,nop,TS val 278181453 ecr 278179975], length 0
1527815332.120359 IP (tos 0x0, ttl 64, id 11117, offset 0, flags [DF], proto TCP (6), length 1096)
    rpi35.lan.46656 > rpi33.lan.43980: Flags [P.], cksum 0x2880 (correct), seq 11484:12528, ack 10441, win 1332, options [nop,nop,TS val 278179975 ecr 278181425], length 1044
1527815332.120446 IP (tos 0x0, ttl 64, id 41185, offset 0, flags [DF], proto TCP (6), length 52)
    rpi33.lan.43980 > rpi35.lan.46656: Flags [.], cksum 0x8483 (incorrect -> 0x4bef), ack 12528, win 1323, options [nop,nop,TS val 278181453 ecr 278179975], length 0
1527815332.120361 IP (tos 0x0, ttl 64, id 55276, offset 0, flags [DF], proto TCP (6), length 1096)
    rpi37.lan.46656 > rpi33.lan.57588: Flags [P.], cksum 0xdfe3 (correct), seq 8352:9396, ack 8353, win 1332, options [nop,nop,TS val 278181437 ecr 278181430], length 1044
1527815332.120540 IP (tos 0x0, ttl 64, id 61176, offset 0, flags [DF], proto TCP (6), length 52)
    rpi33.lan.57588 > rpi37.lan.46656: Flags [.], cksum 0x8485 (incorrect -> 0x2bf1), ack 9396, win 1323, options [nop,nop,TS val 278181453 ecr 278181437], length 0
1527815332.120606 IP (tos 0x0, ttl 64, id 55277, offset 0, flags [DF], proto TCP (6), length 1096)
    rpi37.lan.46656 > rpi33.lan.57588: Flags [P.], cksum 0x5fd7 (correct), seq 9396:10440, ack 8353, win 1332, options [nop,nop,TS val 278181437 ecr 278181430], length 1044
1527815332.120661 IP (tos 0x0, ttl 64, id 61177, offset 0, flags [DF], proto TCP (6), length 52)
    rpi33.lan.57588 > rpi37.lan.46656: Flags [.], cksum 0x8485 (incorrect -> 0x27dd), ack 10440, win 1323, options [nop,nop,TS val 278181453 ecr 278181437], length 0
1527815332.122828 IP (tos 0x0, ttl 64, id 11556, offset 0, flags [DF], proto TCP (6), length 1096)
    rpi33.lan.46656 > rpi34.lan.50462: Flags [P.], cksum 0x26b2 (correct), seq 8353:9397, ack 8352, win 1332, options [nop,nop,TS val 278181453 ecr 278181433], length 1044
1527815332.123095 IP (tos 0x0, ttl 64, id 11557, offset 0, flags [DF], proto TCP (6), length 1096)
    rpi33.lan.46656 > rpi34.lan.50462: Flags [P.], cksum 0x7772 (correct), seq 9397:10441, ack 8352, win 1332, options [nop,nop,TS val 278181453 ecr 278181433], length 1044
1527815332.123678 IP (tos 0x0, ttl 64, id 61178, offset 0, flags [DF], proto TCP (6), length 1096)
    rpi33.lan.57588 > rpi37.lan.46656: Flags [P.], cksum 0x8899 (incorrect -> 0x7e18), seq 8353:9397, ack 10440, win 1324, options [nop,nop,TS val 278181453 ecr 278181437], length 1044
1527815332.123810 IP (tos 0x0, ttl 64, id 48016, offset 0, flags [DF], proto TCP (6), length 52)
    rpi34.lan.50462 > rpi33.lan.46656: Flags [.], cksum 0xb890 (correct), ack 9397, win 1323, options [nop,nop,TS val 278181462 ecr 278181453], length 0
1527815332.123814 IP (tos 0x0, ttl 64, id 48017, offset 0, flags [DF], proto TCP (6), length 52)
    rpi34.lan.50462 > rpi33.lan.46656: Flags [.], cksum 0xb47c (correct), ack 10441, win 1323, options [nop,nop,TS val 278181462 ecr 278181453], length 0
1527815332.124040 IP (tos 0x0, ttl 64, id 61179, offset 0, flags [DF], proto TCP (6), length 1096)
    rpi33.lan.57588 > rpi37.lan.46656: Flags [P.], cksum 0x8899 (incorrect -> 0x8ba6), seq 9397:10441, ack 10440, win 1324, options [nop,nop,TS val 278181453 ecr 278181437], length 1044
1527815332.124513 IP (tos 0x0, ttl 64, id 55278, offset 0, flags [DF], proto TCP (6), length 52)
    rpi37.lan.46656 > rpi33.lan.57588: Flags [.], cksum 0x23c0 (correct), ack 9397, win 1331, options [nop,nop,TS val 278181438 ecr 278181453], length 0
1527815332.124811 IP (tos 0x0, ttl 64, id 55279, offset 0, flags [DF], proto TCP (6), length 52)
    rpi37.lan.46656 > rpi33.lan.57588: Flags [.], cksum 0x1fac (correct), ack 10441, win 1331, options [nop,nop,TS val 278181438 ecr 278181453], length 0
1527815332.124924 IP (tos 0x0, ttl 64, id 41186, offset 0, flags [DF], proto TCP (6), length 1096)
    rpi33.lan.43980 > rpi35.lan.46656: Flags [P.], cksum 0x8897 (incorrect -> 0xffd0), seq 10441:11485, ack 12528, win 1324, options [nop,nop,TS val 278181454 ecr 278179975], length 1044
1527815332.125161 IP (tos 0x0, ttl 64, id 41187, offset 0, flags [DF], proto TCP (6), length 1096)
    rpi33.lan.43980 > rpi35.lan.46656: Flags [P.], cksum 0x8897 (incorrect -> 0x9bab), seq 11485:12529, ack 12528, win 1324, options [nop,nop,TS val 278181454 ecr 278179975], length 1044
1527815332.125768 IP (tos 0x0, ttl 64, id 11118, offset 0, flags [DF], proto TCP (6), length 52)
    rpi35.lan.46656 > rpi33.lan.43980: Flags [.], cksum 0x47d2 (correct), ack 11485, win 1331, options [nop,nop,TS val 278179975 ecr 278181454], length 0
1527815332.125923 IP (tos 0x0, ttl 64, id 11119, offset 0, flags [DF], proto TCP (6), length 52)
    rpi35.lan.46656 > rpi33.lan.43980: Flags [.], cksum 0x43be (correct), ack 12529, win 1331, options [nop,nop,TS val 278179975 ecr 278181454], length 0
1527815332.127085 IP (tos 0x0, ttl 64, id 64231, offset 0, flags [DF], proto TCP (6), length 1096)
    rpi33.lan.49740 > rpi36.lan.46656: Flags [P.], cksum 0x8898 (incorrect -> 0xff2f), seq 8353:9397, ack 11484, win 1324, options [nop,nop,TS val 278181454 ecr 278181445], length 1044
1527815332.127865 IP (tos 0x0, ttl 64, id 19414, offset 0, flags [DF], proto TCP (6), length 52)
    rpi36.lan.46656 > rpi33.lan.49740: Flags [.], cksum 0x9c1a (correct), ack 9397, win 1331, options [nop,nop,TS val 278181454 ecr 278181454], length 0
1527815332.146314 IP (tos 0x0, ttl 64, id 48018, offset 0, flags [DF], proto TCP (6), length 1096)
    rpi34.lan.50462 > rpi33.lan.46656: Flags [P.], cksum 0x187b (correct), seq 8352:9396, ack 10441, win 1324, options [nop,nop,TS val 278181464 ecr 278181453], length 1044
1527815332.146387 IP (tos 0x0, ttl 64, id 11558, offset 0, flags [DF], proto TCP (6), length 52)
    rpi33.lan.46656 > rpi34.lan.50462: Flags [.], cksum 0x8482 (incorrect -> 0xb05b), ack 9396, win 1331, options [nop,nop,TS val 278181456 ecr 278181464], length 0
1527815332.146659 IP (tos 0x0, ttl 64, id 48019, offset 0, flags [DF], proto TCP (6), length 1096)
    rpi34.lan.50462 > rpi33.lan.46656: Flags [P.], cksum 0x4abc (correct), seq 9396:10440, ack 10441, win 1324, options [nop,nop,TS val 278181464 ecr 278181453], length 1044
1527815332.146708 IP (tos 0x0, ttl 64, id 11559, offset 0, flags [DF], proto TCP (6), length 52)
    rpi33.lan.46656 > rpi34.lan.50462: Flags [.], cksum 0x8482 (incorrect -> 0xac47), ack 10440, win 1331, options [nop,nop,TS val 278181456 ecr 278181464], length 0
1527815332.221678 IP (tos 0x0, ttl 64, id 11120, offset 0, flags [DF], proto TCP (6), length 1096)
    rpi35.lan.46656 > rpi33.lan.43980: Flags [P.], cksum 0x5688 (correct), seq 12528:13572, ack 12529, win 1332, options [nop,nop,TS val 278179985 ecr 278181454], length 1044
1527815332.221940 IP (tos 0x0, ttl 64, id 55280, offset 0, flags [DF], proto TCP (6), length 1096)
    rpi37.lan.46656 > rpi33.lan.57588: Flags [P.], cksum 0x642e (correct), seq 10440:11484, ack 10441, win 1332, options [nop,nop,TS val 278181448 ecr 278181453], length 1044
1527815332.224723 IP (tos 0x0, ttl 64, id 61180, offset 0, flags [DF], proto TCP (6), length 1096)
    rpi33.lan.57588 > rpi37.lan.46656: Flags [P.], cksum 0x8899 (incorrect -> 0x0efd), seq 10441:11485, ack 11484, win 1324, options [nop,nop,TS val 278181464 ecr 278181448], length 1044
1527815332.224782 IP (tos 0x0, ttl 64, id 11560, offset 0, flags [DF], proto TCP (6), length 1096)
    rpi33.lan.46656 > rpi34.lan.50462: Flags [P.], cksum 0x05f6 (correct), seq 10441:11485, ack 10440, win 1332, options [nop,nop,TS val 278181464 ecr 278181464], length 1044
1527815332.225544 IP (tos 0x0, ttl 64, id 55281, offset 0, flags [DF], proto TCP (6), length 52)
    rpi37.lan.46656 > rpi33.lan.57588: Flags [.], cksum 0x176f (correct), ack 11485, win 1331, options [nop,nop,TS val 278181448 ecr 278181464], length 0
1527815332.239704 IP (tos 0x0, ttl 64, id 19415, offset 0, flags [DF], proto TCP (6), length 1096)
    rpi36.lan.46656 > rpi33.lan.49740: Flags [P.], cksum 0x72c9 (correct), seq 11484:12528, ack 9397, win 1332, options [nop,nop,TS val 278181465 ecr 278181454], length 1044
1527815332.239878 IP (tos 0x0, ttl 64, id 64232, offset 0, flags [DF], proto TCP (6), length 52)
    rpi33.lan.49740 > rpi36.lan.46656: Flags [.], cksum 0x8484 (incorrect -> 0x97f8), ack 12528, win 1323, options [nop,nop,TS val 278181465 ecr 278181465], length 0
1527815332.247727 IP (tos 0x0, ttl 64, id 48020, offset 0, flags [DF], proto TCP (6), length 1096)
    rpi34.lan.50462 > rpi33.lan.46656: Flags [P.], cksum 0xd61c (correct), seq 10440:11484, ack 11485, win 1324, options [nop,nop,TS val 278181475 ecr 278181464], length 1044
1527815332.247914 IP (tos 0x0, ttl 64, id 11561, offset 0, flags [DF], proto TCP (6), length 52)
    rpi33.lan.46656 > rpi34.lan.50462: Flags [.], cksum 0x8482 (incorrect -> 0xa40a), ack 11484, win 1331, options [nop,nop,TS val 278181466 ecr 278181475], length 0
1527815332.264562 IP (tos 0x0, ttl 64, id 41188, offset 0, flags [DF], proto TCP (6), length 52)
