1527815183.469696 IP (tos 0x0, ttl 64, id 46764, offset 0, flags [DF], proto TCP (6), length 1096)
    rpi34.lan.50462 > rpi33.lan.46656: Flags [P.], cksum 0x9f68 (correct), seq 1114706799:1114707843, ack 2416461444, win 1324, options [nop,nop,TS val 278166597 ecr 278166391], length 1044
1527815183.487794 IP (tos 0x0, ttl 64, id 53988, offset 0, flags [DF], proto TCP (6), length 1096)
    rpi37.lan.46656 > rpi33.lan.57588: Flags [P.], cksum 0xbd5c (correct), seq 887579242:887580286, ack 3678202237, win 1332, options [nop,nop,TS val 278166574 ecr 278166391], length 1044
1527815183.495306 IP (tos 0x0, ttl 64, id 10364, offset 0, flags [DF], proto TCP (6), length 1096)
    rpi33.lan.46656 > rpi34.lan.50462: Flags [P.], cksum 0xba66 (correct), seq 1:1045, ack 1044, win 1332, options [nop,nop,TS val 278166591 ecr 278166597], length 1044
1527815183.495401 IP (tos 0x0, ttl 64, id 60013, offset 0, flags [DF], proto TCP (6), length 1096)
    rpi33.lan.57588 > rpi37.lan.46656: Flags [P.], cksum 0x8899 (incorrect -> 0xf6b5), seq 1:1045, ack 1044, win 1324, options [nop,nop,TS val 278166591 ecr 278166574], length 1044
1527815183.495542 IP (tos 0x0, ttl 64, id 63068, offset 0, flags [DF], proto TCP (6), length 1096)
    rpi33.lan.49740 > rpi36.lan.46656: Flags [P.], cksum 0x8898 (incorrect -> 0x3783), seq 571700047:571701091, ack 1466314233, win 1324, options [nop,nop,TS val 278166591 ecr 278166390], length 1044
1527815183.495627 IP (tos 0x0, ttl 64, id 40008, offset 0, flags [DF], proto TCP (6), length 1096)
    rpi33.lan.43980 > rpi35.lan.46656: Flags [P.], cksum 0x8897 (incorrect -> 0x923d), seq 1150062045:1150063089, ack 242451905, win 1324, options [nop,nop,TS val 278166591 ecr 278164912], length 1044
1527815183.496106 IP (tos 0x0, ttl 64, id 46765, offset 0, flags [DF], proto TCP (6), length 52)
    rpi34.lan.50462 > rpi33.lan.46656: Flags [.], cksum 0x2393 (correct), ack 1045, win 1323, options [nop,nop,TS val 278166599 ecr 278166591], length 0
1527815183.496109 IP (tos 0x0, ttl 64, id 53989, offset 0, flags [DF], proto TCP (6), length 52)
    rpi37.lan.46656 > rpi33.lan.57588: Flags [.], cksum 0xd82a (correct), ack 1045, win 1331, options [nop,nop,TS val 278166575 ecr 278166591], length 0
1527815183.496353 IP (tos 0x0, ttl 64, id 18123, offset 0, flags [DF], proto TCP (6), length 52)
    rpi36.lan.46656 > rpi33.lan.49740: Flags [.], cksum 0x3c23 (correct), ack 1044, win 1331, options [nop,nop,TS val 278166590 ecr 278166591], length 0
1527815183.496798 IP (tos 0x0, ttl 64, id 9823, offset 0, flags [DF], proto TCP (6), length 1096)
    rpi35.lan.46656 > rpi33.lan.43980: Flags [P.], cksum 0xc0ac (correct), seq 1:1045, ack 0, win 1332, options [nop,nop,TS val 278165112 ecr 278166391], length 1044
1527815183.496800 IP (tos 0x0, ttl 64, id 9824, offset 0, flags [DF], proto TCP (6), length 52)
    rpi35.lan.46656 > rpi33.lan.43980: Flags [.], cksum 0x087a (correct), ack 1044, win 1331, options [nop,nop,TS val 278165112 ecr 278166591], length 0
1527815183.498530 IP (tos 0x0, ttl 64, id 18124, offset 0, flags [DF], proto TCP (6), length 1096)
    rpi36.lan.46656 > rpi33.lan.49740: Flags [P.], cksum 0xfb36 (correct), seq 1:1045, ack 1044, win 1332, options [nop,nop,TS val 278166591 ecr 278166591], length 1044
1527815183.544508 IP (tos 0x0, ttl 64, id 63069, offset 0, flags [DF], proto TCP (6), length 52)
    rpi33.lan.49740 > rpi36.lan.46656: Flags [.], cksum 0x8484 (incorrect -> 0x3810), ack 1045, win 1324, options [nop,nop,TS val 278166596 ecr 278166591], length 0
1527815183.544564 IP (tos 0x0, ttl 64, id 40009, offset 0, flags [DF], proto TCP (6), length 52)
    rpi33.lan.43980 > rpi35.lan.46656: Flags [.], cksum 0x8483 (incorrect -> 0x087c), ack 1045, win 1324, options [nop,nop,TS val 278166596 ecr 278165112], length 0
1527815185.472978 IP (tos 0x0, ttl 64, id 46766, offset 0, flags [DF], proto TCP (6), length 1096)
    rpi34.lan.50462 > rpi33.lan.46656: Flags [P.], cksum 0x3026 (correct), seq 1044:2088, ack 1045, win 1324, options [nop,nop,TS val 278166797 ecr 278166591], length 1044
1527815185.473178 IP (tos 0x0, ttl 64, id 53990, offset 0, flags [DF], proto TCP (6), length 1096)
    rpi37.lan.46656 > rpi33.lan.57588: Flags [P.], cksum 0x9e8c (correct), seq 1044:2088, ack 1045, win 1332, options [nop,nop,TS val 278166773 ecr 278166591], length 1044
1527815185.500092 IP (tos 0x0, ttl 64, id 9825, offset 0, flags [DF], proto TCP (6), length 1096)
    rpi35.lan.46656 > rpi33.lan.43980: Flags [P.], cksum 0x0e51 (correct), seq 1045:2089, ack 1044, win 1332, options [nop,nop,TS val 278165313 ecr 278166596], length 1044
1527815185.500203 IP (tos 0x0, ttl 64, id 40010, offset 0, flags [DF], proto TCP (6), length 52)
    rpi33.lan.43980 > rpi35.lan.46656: Flags [.], cksum 0x8483 (incorrect -> 0x02dd), ack 2089, win 1323, options [nop,nop,TS val 278166791 ecr 278165313], length 0
1527815185.501426 IP (tos 0x0, ttl 64, id 18125, offset 0, flags [DF], proto TCP (6), length 1096)
    rpi36.lan.46656 > rpi33.lan.49740: Flags [P.], cksum 0x8793 (correct), seq 1045:2089, ack 1044, win 1332, options [nop,nop,TS val 278166791 ecr 278166596], length 1044
1527815185.501519 IP (tos 0x0, ttl 64, id 63070, offset 0, flags [DF], proto TCP (6), length 52)
    rpi33.lan.49740 > rpi36.lan.46656: Flags [.], cksum 0x8484 (incorrect -> 0x3272), ack 2089, win 1323, options [nop,nop,TS val 278166791 ecr 278166791], length 0
1527815185.501595 IP (tos 0x0, ttl 64, id 63071, offset 0, flags [DF], proto TCP (6), length 1096)
    rpi33.lan.49740 > rpi36.lan.46656: Flags [P.], cksum 0x8898 (incorrect -> 0x1704), seq 1044:2088, ack 2089, win 1323, options [nop,nop,TS val 278166791 ecr 278166791], length 1044
1527815185.501982 IP (tos 0x0, ttl 64, id 40011, offset 0, flags [DF], proto TCP (6), length 1096)
    rpi33.lan.43980 > rpi35.lan.46656: Flags [P.], cksum 0x8897 (incorrect -> 0x72fe), seq 1044:2088, ack 2089, win 1324, options [nop,nop,TS val 278166791 ecr 278165313], length 1044
1527815185.502020 IP (tos 0x0, ttl 64, id 60014, offset 0, flags [DF], proto TCP (6), length 1096)
    rpi33.lan.57588 > rpi37.lan.46656: Flags [P.], cksum 0x8899 (incorrect -> 0x160c), seq 1045:2089, ack 2088, win 1324, options [nop,nop,TS val 278166791 ecr 278166773], length 1044
1527815185.502038 IP (tos 0x0, ttl 64, id 10365, offset 0, flags [DF], proto TCP (6), length 1096)
    rpi33.lan.46656 > rpi34.lan.50462: Flags [P.], cksum 0x8558 (correct), seq 1045:2089, ack 2088, win 1332, options [nop,nop,TS val 278166791 ecr 278166797], length 1044
1527815185.502773 IP (tos 0x0, ttl 64, id 9826, offset 0, flags [DF], proto TCP (6), length 52)
    rpi35.lan.46656 > rpi33.lan.43980: Flags [.], cksum 0xfec0 (correct), ack 2088, win 1331, options [nop,nop,TS val 278165313 ecr 278166791], length 0
1527815185.502775 IP (tos 0x0, ttl 64, id 53991, offset 0, flags [DF], proto TCP (6), length 52)
    rpi37.lan.46656 > rpi33.lan.57588: Flags [.], cksum 0xce71 (correct), ack 2089, win 1331, options [nop,nop,TS val 278166776 ecr 278166791], length 0
1527815185.502942 IP (tos 0x0, ttl 64, id 46767, offset 0, flags [DF], proto TCP (6), length 52)
    rpi34.lan.50462 > rpi33.lan.46656: Flags [.], cksum 0x19da (correct), ack 2089, win 1323, options [nop,nop,TS val 278166800 ecr 278166791], length 0
1527815185.547125 IP (tos 0x0, ttl 64, id 18126, offset 0, flags [DF], proto TCP (6), length 52)
    rpi36.lan.46656 > rpi33.lan.49740: Flags [.], cksum 0x2e50 (correct), ack 2088, win 1332, options [nop,nop,TS val 278166796 ecr 278166791], length 0
1527815187.476354 IP (tos 0x0, ttl 64, id 46768, offset 0, flags [DF], proto TCP (6), length 1096)
    rpi34.lan.50462 > rpi33.lan.46656: Flags [P.], cksum 0x49c3 (correct), seq 2088:3132, ack 2089, win 1324, options [nop,nop,TS val 278166997 ecr 278166791], length 1044
1527815187.476977 IP (tos 0x0, ttl 64, id 53992, offset 0, flags [DF], proto TCP (6), length 1096)
    rpi37.lan.46656 > rpi33.lan.57588: Flags [P.], cksum 0x734c (correct), seq 2088:3132, ack 2089, win 1332, options [nop,nop,TS val 278166973 ecr 278166791], length 1044
1527815187.503631 IP (tos 0x0, ttl 64, id 9827, offset 0, flags [DF], proto TCP (6), length 1096)
    rpi35.lan.46656 > rpi33.lan.43980: Flags [P.], cksum 0xe825 (correct), seq 2089:3133, ack 2088, win 1332, options [nop,nop,TS val 278165513 ecr 278166791], length 1044
1527815187.504916 IP (tos 0x0, ttl 64, id 18127, offset 0, flags [DF], proto TCP (6), length 1096)
    rpi36.lan.46656 > rpi33.lan.49740: Flags [P.], cksum 0x8a8b (correct), seq 2089:3133, ack 2088, win 1332, options [nop,nop,TS val 278166991 ecr 278166791], length 1044
1527815187.506928 IP (tos 0x0, ttl 64, id 60015, offset 0, flags [DF], proto TCP (6), length 1096)
    rpi33.lan.57588 > rpi37.lan.46656: Flags [P.], cksum 0x8899 (incorrect -> 0x2337), seq 2089:3133, ack 3132, win 1324, options [nop,nop,TS val 278166992 ecr 278166973], length 1044
1527815187.506978 IP (tos 0x0, ttl 64, id 63072, offset 0, flags [DF], proto TCP (6), length 1096)
    rpi33.lan.49740 > rpi36.lan.46656: Flags [P.], cksum 0x8898 (incorrect -> 0xeb3a), seq 2088:3132, ack 3133, win 1324, options [nop,nop,TS val 278166992 ecr 278166991], length 1044
1527815187.506999 IP (tos 0x0, ttl 64, id 40012, offset 0, flags [DF], proto TCP (6), length 1096)
    rpi33.lan.43980 > rpi35.lan.46656: Flags [P.], cksum 0x8897 (incorrect -> 0x092e), seq 2088:3132, ack 3133, win 1324, options [nop,nop,TS val 278166992 ecr 278165513], length 1044
1527815187.507058 IP (tos 0x0, ttl 64, id 10366, offset 0, flags [DF], proto TCP (6), length 1096)
    rpi33.lan.46656 > rpi34.lan.50462: Flags [P.], cksum 0x6432 (correct), seq 2089:3133, ack 3132, win 1332, options [nop,nop,TS val 278166992 ecr 278166997], length 1044
1527815187.507724 IP (tos 0x0, ttl 64, id 53993, offset 0, flags [DF], proto TCP (6), length 52)
    rpi37.lan.46656 > rpi33.lan.57588: Flags [.], cksum 0xc4b8 (correct), ack 3133, win 1331, options [nop,nop,TS val 278166976 ecr 278166992], length 0
1527815187.507726 IP (tos 0x0, ttl 64, id 18128, offset 0, flags [DF], proto TCP (6), length 52)
    rpi36.lan.46656 > rpi33.lan.49740: Flags [.], cksum 0x249c (correct), ack 3132, win 1331, options [nop,nop,TS val 278166992 ecr 278166992], length 0
1527815187.507901 IP (tos 0x0, ttl 64, id 9828, offset 0, flags [DF], proto TCP (6), length 52)
    rpi35.lan.46656 > rpi33.lan.43980: Flags [.], cksum 0xf506 (correct), ack 3132, win 1331, options [nop,nop,TS val 278165514 ecr 278166992], length 0
1527815187.507903 IP (tos 0x0, ttl 64, id 46769, offset 0, flags [DF], proto TCP (6), length 52)
    rpi34.lan.50462 > rpi33.lan.46656: Flags [.], cksum 0x1020 (correct), ack 3133, win 1323, options [nop,nop,TS val 278167001 ecr 278166992], length 0
1527815189.479585 IP (tos 0x0, ttl 64, id 53994, offset 0, flags [DF], proto TCP (6), length 1096)
    rpi37.lan.46656 > rpi33.lan.57588: Flags [P.], cksum 0xa096 (correct), seq 3132:4176, ack 3133, win 1332, options [nop,nop,TS val 278167173 ecr 278166992], length 1044
1527815189.479807 IP (tos 0x0, ttl 64, id 46770, offset 0, flags [DF], proto TCP (6), length 1096)
    rpi34.lan.50462 > rpi33.lan.46656: Flags [P.], cksum 0x8cb9 (correct), seq 3132:4176, ack 3133, win 1324, options [nop,nop,TS val 278167198 ecr 278166992], length 1044
1527815189.506887 IP (tos 0x0, ttl 64, id 9829, offset 0, flags [DF], proto TCP (6), length 1096)
    rpi35.lan.46656 > rpi33.lan.43980: Flags [P.], cksum 0xa412 (correct), seq 3133:4177, ack 3132, win 1332, options [nop,nop,TS val 278165713 ecr 278166992], length 1044
1527815189.508550 IP (tos 0x0, ttl 64, id 18129, offset 0, flags [DF], proto TCP (6), length 1096)
    rpi36.lan.46656 > rpi33.lan.49740: Flags [P.], cksum 0x89a9 (correct), seq 3133:4177, ack 3132, win 1332, options [nop,nop,TS val 278167192 ecr 278166992], length 1044
1527815189.509428 IP (tos 0x0, ttl 64, id 60016, offset 0, flags [DF], proto TCP (6), length 1096)
    rpi33.lan.57588 > rpi37.lan.46656: Flags [P.], cksum 0x8899 (incorrect -> 0x546b), seq 3133:4177, ack 4176, win 1324, options [nop,nop,TS val 278167192 ecr 278167173], length 1044
1527815189.509474 IP (tos 0x0, ttl 64, id 40013, offset 0, flags [DF], proto TCP (6), length 1096)
    rpi33.lan.43980 > rpi35.lan.46656: Flags [P.], cksum 0x8897 (incorrect -> 0x268f), seq 3132:4176, ack 4177, win 1324, options [nop,nop,TS val 278167192 ecr 278165713], length 1044
1527815189.509517 IP (tos 0x0, ttl 64, id 63073, offset 0, flags [DF], proto TCP (6), length 1096)
    rpi33.lan.49740 > rpi36.lan.46656: Flags [P.], cksum 0x8898 (incorrect -> 0x9f53), seq 3132:4176, ack 4177, win 1324, options [nop,nop,TS val 278167192 ecr 278167192], length 1044
1527815189.509562 IP (tos 0x0, ttl 64, id 10367, offset 0, flags [DF], proto TCP (6), length 1096)
    rpi33.lan.46656 > rpi34.lan.50462: Flags [P.], cksum 0xaf9c (correct), seq 3133:4177, ack 4176, win 1332, options [nop,nop,TS val 278167192 ecr 278167198], length 1044
1527815189.510213 IP (tos 0x0, ttl 64, id 53995, offset 0, flags [DF], proto TCP (6), length 52)
    rpi37.lan.46656 > rpi33.lan.57588: Flags [.], cksum 0xbb00 (correct), ack 4177, win 1331, options [nop,nop,TS val 278167176 ecr 278167192], length 0
1527815189.510216 IP (tos 0x0, ttl 64, id 9830, offset 0, flags [DF], proto TCP (6), length 52)
    rpi35.lan.46656 > rpi33.lan.43980: Flags [.], cksum 0xeb4e (correct), ack 4176, win 1331, options [nop,nop,TS val 278165714 ecr 278167192], length 0
1527815189.510382 IP (tos 0x0, ttl 64, id 18130, offset 0, flags [DF], proto TCP (6), length 52)
    rpi36.lan.46656 > rpi33.lan.49740: Flags [.], cksum 0x1ae4 (correct), ack 4176, win 1331, options [nop,nop,TS val 278167192 ecr 278167192], length 0
1527815189.510384 IP (tos 0x0, ttl 64, id 46771, offset 0, flags [DF], proto TCP (6), length 52)
    rpi34.lan.50462 > rpi33.lan.46656: Flags [.], cksum 0x0668 (correct), ack 4177, win 1323, options [nop,nop,TS val 278167201 ecr 278167192], length 0
1527815191.482921 IP (tos 0x0, ttl 64, id 46772, offset 0, flags [DF], proto TCP (6), length 1096)
    rpi34.lan.50462 > rpi33.lan.46656: Flags [P.], cksum 0xd57b (correct), seq 4176:5220, ack 4177, win 1324, options [nop,nop,TS val 278167398 ecr 278167192], length 1044
1527815191.483116 IP (tos 0x0, ttl 64, id 53996, offset 0, flags [DF], proto TCP (6), length 1096)
    rpi37.lan.46656 > rpi33.lan.57588: Flags [P.], cksum 0xb502 (correct), seq 4176:5220, ack 4177, win 1332, options [nop,nop,TS val 278167374 ecr 278167192], length 1044
1527815191.510297 IP (tos 0x0, ttl 64, id 63074, offset 0, flags [DF], proto TCP (6), length 1096)
    rpi33.lan.49740 > rpi36.lan.46656: Flags [P.], cksum 0x8898 (incorrect -> 0x3789), seq 4176:5220, ack 4177, win 1324, options [nop,nop,TS val 278167392 ecr 278167192], length 1044
1527815191.510343 IP (tos 0x0, ttl 64, id 60017, offset 0, flags [DF], proto TCP (6), length 1096)
    rpi33.lan.57588 > rpi37.lan.46656: Flags [P.], cksum 0x8899 (incorrect -> 0xd870), seq 4177:5221, ack 5220, win 1324, options [nop,nop,TS val 278167392 ecr 278167374], length 1044
1527815191.510385 IP (tos 0x0, ttl 64, id 10368, offset 0, flags [DF], proto TCP (6), length 1096)
    rpi33.lan.46656 > rpi34.lan.50462: Flags [P.], cksum 0x5ab4 (correct), seq 4177:5221, ack 5220, win 1332, options [nop,nop,TS val 278167392 ecr 278167398], length 1044
1527815191.510493 IP (tos 0x0, ttl 64, id 9831, offset 0, flags [DF], proto TCP (6), length 1096)
    rpi35.lan.46656 > rpi33.lan.43980: Flags [P.], cksum 0xc1ba (correct), seq 4177:5221, ack 4176, win 1332, options [nop,nop,TS val 278165914 ecr 278167192], length 1044
1527815191.511103 IP (tos 0x0, ttl 64, id 18131, offset 0, flags [DF], proto TCP (6), length 52)
    rpi36.lan.46656 > rpi33.lan.49740: Flags [.], cksum 0x1540 (correct), ack 5220, win 1331, options [nop,nop,TS val 278167392 ecr 278167392], length 0
1527815191.511137 IP (tos 0x0, ttl 64, id 40014, offset 0, flags [DF], proto TCP (6), length 1096)
    rpi33.lan.43980 > rpi35.lan.46656: Flags [P.], cksum 0x8897 (incorrect -> 0x27b3), seq 4176:5220, ack 5221, win 1324, options [nop,nop,TS val 278167392 ecr 278165914], length 1044
1527815191.511105 IP (tos 0x0, ttl 64, id 53997, offset 0, flags [DF], proto TCP (6), length 52)
    rpi37.lan.46656 > rpi33.lan.57588: Flags [.], cksum 0xb148 (correct), ack 5221, win 1331, options [nop,nop,TS val 278167376 ecr 278167392], length 0
1527815191.511266 IP (tos 0x0, ttl 64, id 46773, offset 0, flags [DF], proto TCP (6), length 52)
    rpi34.lan.50462 > rpi33.lan.46656: Flags [.], cksum 0xfcaf (correct), ack 5221, win 1323, options [nop,nop,TS val 278167401 ecr 278167392], length 0
1527815191.511891 IP (tos 0x0, ttl 64, id 9832, offset 0, flags [DF], proto TCP (6), length 52)
    rpi35.lan.46656 > rpi33.lan.43980: Flags [.], cksum 0xe196 (correct), ack 5220, win 1331, options [nop,nop,TS val 278165914 ecr 278167392], length 0
1527815191.512255 IP (tos 0x0, ttl 64, id 18132, offset 0, flags [DF], proto TCP (6), length 1096)
    rpi36.lan.46656 > rpi33.lan.49740: Flags [P.], cksum 0x3c61 (correct), seq 4177:5221, ack 5220, win 1332, options [nop,nop,TS val 278167392 ecr 278167392], length 1044
1527815191.554503 IP (tos 0x0, ttl 64, id 63075, offset 0, flags [DF], proto TCP (6), length 52)
    rpi33.lan.49740 > rpi36.lan.46656: Flags [.], cksum 0x8484 (incorrect -> 0x112e), ack 5221, win 1324, options [nop,nop,TS val 278167397 ecr 278167392], length 0
1527815193.486517 IP (tos 0x0, ttl 64, id 46774, offset 0, flags [DF], proto TCP (6), length 1096)
    rpi34.lan.50462 > rpi33.lan.46656: Flags [P.], cksum 0x7913 (correct), seq 5220:6264, ack 5221, win 1324, options [nop,nop,TS val 278167598 ecr 278167392], length 1044
1527815193.486936 IP (tos 0x0, ttl 64, id 53998, offset 0, flags [DF], proto TCP (6), length 1096)
    rpi37.lan.46656 > rpi33.lan.57588: Flags [P.], cksum 0xea9a (correct), seq 5220:6264, ack 5221, win 1332, options [nop,nop,TS val 278167574 ecr 278167392], length 1044
1527815193.514160 IP (tos 0x0, ttl 64, id 9833, offset 0, flags [DF], proto TCP (6), length 1096)
    rpi35.lan.46656 > rpi33.lan.43980: Flags [P.], cksum 0xbcab (correct), seq 5221:6265, ack 5220, win 1332, options [nop,nop,TS val 278166114 ecr 278167392], length 1044
1527815193.515492 IP (tos 0x0, ttl 64, id 18133, offset 0, flags [DF], proto TCP (6), length 1096)
    rpi36.lan.46656 > rpi33.lan.49740: Flags [P.], cksum 0x27e2 (correct), seq 5221:6265, ack 5220, win 1332, options [nop,nop,TS val 278167592 ecr 278167397], length 1044
1527815193.515635 IP (tos 0x0, ttl 64, id 63076, offset 0, flags [DF], proto TCP (6), length 52)
    rpi33.lan.49740 > rpi36.lan.46656: Flags [.], cksum 0x8484 (incorrect -> 0x0b8f), ack 6265, win 1323, options [nop,nop,TS val 278167593 ecr 278167592], length 0
1527815193.517715 IP (tos 0x0, ttl 64, id 60018, offset 0, flags [DF], proto TCP (6), length 1096)
    rpi33.lan.57588 > rpi37.lan.46656: Flags [P.], cksum 0x8899 (incorrect -> 0x8083), seq 5221:6265, ack 6264, win 1324, options [nop,nop,TS val 278167593 ecr 278167574], length 1044
1527815193.518009 IP (tos 0x0, ttl 64, id 63077, offset 0, flags [DF], proto TCP (6), length 1096)
    rpi33.lan.49740 > rpi36.lan.46656: Flags [P.], cksum 0x8898 (incorrect -> 0x7209), seq 5220:6264, ack 6265, win 1324, options [nop,nop,TS val 278167593 ecr 278167592], length 1044
1527815193.518228 IP (tos 0x0, ttl 64, id 10369, offset 0, flags [DF], proto TCP (6), length 1096)
    rpi33.lan.46656 > rpi34.lan.50462: Flags [P.], cksum 0x325c (correct), seq 5221:6265, ack 6264, win 1332, options [nop,nop,TS val 278167593 ecr 278167598], length 1044
1527815193.518480 IP (tos 0x0, ttl 64, id 53999, offset 0, flags [DF], proto TCP (6), length 52)
    rpi37.lan.46656 > rpi33.lan.57588: Flags [.], cksum 0xa78e (correct), ack 6265, win 1331, options [nop,nop,TS val 278167577 ecr 278167593], length 0
1527815193.518550 IP (tos 0x0, ttl 64, id 40015, offset 0, flags [DF], proto TCP (6), length 1096)
    rpi33.lan.43980 > rpi35.lan.46656: Flags [P.], cksum 0x8897 (incorrect -> 0xbeed), seq 5220:6264, ack 6265, win 1324, options [nop,nop,TS val 278167593 ecr 278166114], length 1044
1527815193.518980 IP (tos 0x0, ttl 64, id 46775, offset 0, flags [DF], proto TCP (6), length 52)
    rpi34.lan.50462 > rpi33.lan.46656: Flags [.], cksum 0xf2f5 (correct), ack 6265, win 1323, options [nop,nop,TS val 278167602 ecr 278167593], length 0
1527815193.519315 IP (tos 0x0, ttl 64, id 9834, offset 0, flags [DF], proto TCP (6), length 52)
    rpi35.lan.46656 > rpi33.lan.43980: Flags [.], cksum 0xd7dc (correct), ack 6264, win 1331, options [nop,nop,TS val 278166115 ecr 278167593], length 0
1527815193.567150 IP (tos 0x0, ttl 64, id 18134, offset 0, flags [DF], proto TCP (6), length 52)
    rpi36.lan.46656 > rpi33.lan.49740: Flags [.], cksum 0x076c (correct), ack 6264, win 1332, options [nop,nop,TS val 278167598 ecr 278167593], length 0
1527815194.886394 IP (tos 0x0, ttl 64, id 10370, offset 0, flags [DF], proto TCP (6), length 1096)
    rpi33.lan.46656 > rpi34.lan.50462: Flags [P.], cksum 0x9371 (correct), seq 6265:7309, ack 6264, win 1332, options [nop,nop,TS val 278167730 ecr 278167602], length 1044
1527815194.886461 IP (tos 0x0, ttl 64, id 40016, offset 0, flags [DF], proto TCP (6), length 1096)
    rpi33.lan.43980 > rpi35.lan.46656: Flags [P.], cksum 0x8897 (incorrect -> 0x97a6), seq 6264:7308, ack 6265, win 1324, options [nop,nop,TS val 278167730 ecr 278166115], length 1044
1527815194.886549 IP (tos 0x0, ttl 64, id 63078, offset 0, flags [DF], proto TCP (6), length 1096)
    rpi33.lan.49740 > rpi36.lan.46656: Flags [P.], cksum 0x8898 (incorrect -> 0x08bf), seq 6264:7308, ack 6265, win 1324, options [nop,nop,TS val 278167730 ecr 278167598], length 1044
1527815194.886952 IP (tos 0x0, ttl 64, id 60019, offset 0, flags [DF], proto TCP (6), length 1096)
    rpi33.lan.57588 > rpi37.lan.46656: Flags [P.], cksum 0x8899 (incorrect -> 0xd4f5), seq 6265:7309, ack 6264, win 1324, options [nop,nop,TS val 278167730 ecr 278167577], length 1044
1527815194.887310 IP (tos 0x0, ttl 64, id 46776, offset 0, flags [DF], proto TCP (6), length 52)
    rpi34.lan.50462 > rpi33.lan.46656: Flags [.], cksum 0xedd0 (correct), ack 7309, win 1323, options [nop,nop,TS val 278167738 ecr 278167730], length 0
1527815194.887312 IP (tos 0x0, ttl 64, id 9835, offset 0, flags [DF], proto TCP (6), length 52)
    rpi35.lan.46656 > rpi33.lan.43980: Flags [.], cksum 0xd2b6 (correct), ack 7308, win 1331, options [nop,nop,TS val 278166252 ecr 278167730], length 0
1527815194.887498 IP (tos 0x0, ttl 64, id 18135, offset 0, flags [DF], proto TCP (6), length 52)
    rpi36.lan.46656 > rpi33.lan.49740: Flags [.], cksum 0x024c (correct), ack 7308, win 1331, options [nop,nop,TS val 278167730 ecr 278167730], length 0
1527815194.887856 IP (tos 0x0, ttl 64, id 54000, offset 0, flags [DF], proto TCP (6), length 52)
    rpi37.lan.46656 > rpi33.lan.57588: Flags [.], cksum 0xa268 (correct), ack 7309, win 1331, options [nop,nop,TS val 278167714 ecr 278167730], length 0
1527815194.992589 IP (tos 0x0, ttl 64, id 46777, offset 0, flags [DF], proto TCP (6), length 1096)
    rpi34.lan.50462 > rpi33.lan.46656: Flags [P.], cksum 0x668e (correct), seq 6264:7308, ack 7309, win 1324, options [nop,nop,TS val 278167749 ecr 278167730], length 1044
1527815194.992785 IP (tos 0x0, ttl 64, id 9836, offset 0, flags [DF], proto TCP (6), length 1096)
    rpi35.lan.46656 > rpi33.lan.43980: Flags [P.], cksum 0x1352 (correct), seq 6265:7309, ack 7308, win 1332, options [nop,nop,TS val 278166262 ecr 278167730], length 1044
1527815194.993185 IP (tos 0x0, ttl 64, id 18136, offset 0, flags [DF], proto TCP (6), length 1096)
    rpi36.lan.46656 > rpi33.lan.49740: Flags [P.], cksum 0xaf36 (correct), seq 6265:7309, ack 7308, win 1332, options [nop,nop,TS val 278167740 ecr 278167730], length 1044
1527815194.993797 IP (tos 0x0, ttl 64, id 54001, offset 0, flags [DF], proto TCP (6), length 1096)
    rpi37.lan.46656 > rpi33.lan.57588: Flags [P.], cksum 0x4003 (correct), seq 6264:7308, ack 7309, win 1332, options [nop,nop,TS val 278167725 ecr 278167730], length 1044
1527815195.034542 IP (tos 0x0, ttl 64, id 10371, offset 0, flags [DF], proto TCP (6), length 52)
    rpi33.lan.46656 > rpi34.lan.50462: Flags [.], cksum 0x8482 (incorrect -> 0xe999), ack 7308, win 1332, options [nop,nop,TS val 278167745 ecr 278167749], length 0
1527815195.034596 IP (tos 0x0, ttl 64, id 60020, offset 0, flags [DF], proto TCP (6), length 52)
    rpi33.lan.57588 > rpi37.lan.46656: Flags [.], cksum 0x8485 (incorrect -> 0x9e41), ack 7308, win 1324, options [nop,nop,TS val 278167745 ecr 278167725], length 0
1527815195.034641 IP (tos 0x0, ttl 64, id 63079, offset 0, flags [DF], proto TCP (6), length 52)
    rpi33.lan.49740 > rpi36.lan.46656: Flags [.], cksum 0x8484 (incorrect -> 0xfe25), ack 7309, win 1324, options [nop,nop,TS val 278167745 ecr 278167740], length 0
1527815195.034673 IP (tos 0x0, ttl 64, id 40017, offset 0, flags [DF], proto TCP (6), length 52)
    rpi33.lan.43980 > rpi35.lan.46656: Flags [.], cksum 0x8483 (incorrect -> 0xce90), ack 7309, win 1324, options [nop,nop,TS val 278167745 ecr 278166262], length 0
1527815195.103946 IP (tos 0x0, ttl 64, id 54002, offset 0, flags [DF], proto TCP (6), length 1096)
    rpi37.lan.46656 > rpi33.lan.57588: Flags [P.], cksum 0xa891 (correct), seq 7308:8352, ack 7309, win 1332, options [nop,nop,TS val 278167736 ecr 278167745], length 1044
1527815195.104046 IP (tos 0x0, ttl 64, id 60021, offset 0, flags [DF], proto TCP (6), length 52)
    rpi33.lan.57588 > rpi37.lan.46656: Flags [.], cksum 0x8485 (incorrect -> 0x9a1d), ack 8352, win 1323, options [nop,nop,TS val 278167751 ecr 278167736], length 0
1527815195.104311 IP (tos 0x0, ttl 64, id 54003, offset 0, flags [DF], proto TCP (6), length 1096)
    rpi37.lan.46656 > rpi33.lan.57588: Flags [P.], cksum 0x9da7 (correct), seq 8352:9396, ack 7309, win 1332, options [nop,nop,TS val 278167736 ecr 278167745], length 1044
1527815195.104367 IP (tos 0x0, ttl 64, id 60022, offset 0, flags [DF], proto TCP (6), length 52)
    rpi33.lan.57588 > rpi37.lan.46656: Flags [.], cksum 0x8485 (incorrect -> 0x9609), ack 9396, win 1323, options [nop,nop,TS val 278167751 ecr 278167736], length 0
1527815195.215364 IP (tos 0x0, ttl 64, id 54004, offset 0, flags [DF], proto TCP (6), length 1096)
    rpi37.lan.46656 > rpi33.lan.57588: Flags [P.], cksum 0x4505 (correct), seq 9396:10440, ack 7309, win 1332, options [nop,nop,TS val 278167747 ecr 278167751], length 1044
1527815195.215512 IP (tos 0x0, ttl 64, id 60023, offset 0, flags [DF], proto TCP (6), length 52)
    rpi33.lan.57588 > rpi37.lan.46656: Flags [.], cksum 0x8485 (incorrect -> 0x91de), ack 10440, win 1323, options [nop,nop,TS val 278167763 ecr 278167747], length 0
1527815195.279343 IP (tos 0x0, ttl 64, id 9837, offset 0, flags [DF], proto TCP (6), length 1096)
    rpi35.lan.46656 > rpi33.lan.43980: Flags [P.], cksum 0xf134 (correct), seq 7309:8353, ack 7308, win 1332, options [nop,nop,TS val 278166291 ecr 278167745], length 1044
1527815195.279508 IP (tos 0x0, ttl 64, id 40018, offset 0, flags [DF], proto TCP (6), length 52)
    rpi33.lan.43980 > rpi35.lan.46656: Flags [.], cksum 0x8483 (incorrect -> 0xca48), ack 8353, win 1323, options [nop,nop,TS val 278167769 ecr 278166291], length 0
1527815195.279633 IP (tos 0x0, ttl 64, id 9838, offset 0, flags [DF], proto TCP (6), length 1096)
    rpi35.lan.46656 > rpi33.lan.43980: Flags [P.], cksum 0xf146 (correct), seq 8353:9397, ack 7308, win 1332, options [nop,nop,TS val 278166291 ecr 278167745], length 1044
1527815195.279684 IP (tos 0x0, ttl 64, id 40019, offset 0, flags [DF], proto TCP (6), length 52)
    rpi33.lan.43980 > rpi35.lan.46656: Flags [.], cksum 0x8483 (incorrect -> 0xc634), ack 9397, win 1323, options [nop,nop,TS val 278167769 ecr 278166291], length 0
1527815195.282861 IP (tos 0x0, ttl 64, id 18137, offset 0, flags [DF], proto TCP (6), length 1096)
    rpi36.lan.46656 > rpi33.lan.49740: Flags [P.], cksum 0xeea5 (correct), seq 7309:8353, ack 7308, win 1332, options [nop,nop,TS val 278167769 ecr 278167745], length 1044
1527815195.282981 IP (tos 0x0, ttl 64, id 63080, offset 0, flags [DF], proto TCP (6), length 52)
    rpi33.lan.49740 > rpi36.lan.46656: Flags [.], cksum 0x8484 (incorrect -> 0xf9dd), ack 8353, win 1323, options [nop,nop,TS val 278167769 ecr 278167769], length 0
1527815195.283133 IP (tos 0x0, ttl 64, id 18138, offset 0, flags [DF], proto TCP (6), length 1096)
    rpi36.lan.46656 > rpi33.lan.49740: Flags [P.], cksum 0xf709 (correct), seq 8353:9397, ack 7308, win 1332, options [nop,nop,TS val 278167769 ecr 278167745], length 1044
1527815195.283193 IP (tos 0x0, ttl 64, id 63081, offset 0, flags [DF], proto TCP (6), length 52)
    rpi33.lan.49740 > rpi36.lan.46656: Flags [.], cksum 0x8484 (incorrect -> 0xf5c9), ack 9397, win 1323, options [nop,nop,TS val 278167769 ecr 278167769], length 0
1527815195.283336 IP (tos 0x0, ttl 64, id 40020, offset 0, flags [DF], proto TCP (6), length 1096)
    rpi33.lan.43980 > rpi35.lan.46656: Flags [P.], cksum 0x8897 (incorrect -> 0x4809), seq 7308:8352, ack 9397, win 1324, options [nop,nop,TS val 278167769 ecr 278166291], length 1044
1527815195.283485 IP (tos 0x0, ttl 64, id 10372, offset 0, flags [DF], proto TCP (6), length 1096)
    rpi33.lan.46656 > rpi34.lan.50462: Flags [P.], cksum 0xb6a5 (correct), seq 7309:8353, ack 7308, win 1332, options [nop,nop,TS val 278167769 ecr 278167749], length 1044
1527815195.283512 IP (tos 0x0, ttl 64, id 40021, offset 0, flags [DF], proto TCP (6), length 1096)
    rpi33.lan.43980 > rpi35.lan.46656: Flags [P.], cksum 0x8897 (incorrect -> 0x4c8f), seq 8352:9396, ack 9397, win 1324, options [nop,nop,TS val 278167769 ecr 278166291], length 1044
1527815195.283709 IP (tos 0x0, ttl 64, id 10373, offset 0, flags [DF], proto TCP (6), length 1096)
    rpi33.lan.46656 > rpi34.lan.50462: Flags [P.], cksum 0x0bc3 (correct), seq 8353:9397, ack 7308, win 1332, options [nop,nop,TS val 278167769 ecr 278167749], length 1044
1527815195.283735 IP (tos 0x0, ttl 64, id 63082, offset 0, flags [DF], proto TCP (6), length 1096)
    rpi33.lan.49740 > rpi36.lan.46656: Flags [P.], cksum 0x8898 (incorrect -> 0x3b59), seq 7308:8352, ack 9397, win 1323, options [nop,nop,TS val 278167769 ecr 278167769], length 1044
1527815195.283922 IP (tos 0x0, ttl 64, id 63083, offset 0, flags [DF], proto TCP (6), length 1096)
    rpi33.lan.49740 > rpi36.lan.46656: Flags [P.], cksum 0x8898 (incorrect -> 0x7155), seq 8352:9396, ack 9397, win 1323, options [nop,nop,TS val 278167769 ecr 278167769], length 1044
1527815195.284173 IP (tos 0x0, ttl 64, id 9839, offset 0, flags [DF], proto TCP (6), length 52)
    rpi35.lan.46656 > rpi33.lan.43980: Flags [.], cksum 0xc218 (correct), ack 8352, win 1331, options [nop,nop,TS val 278166291 ecr 278167769], length 0
1527815195.284175 IP (tos 0x0, ttl 64, id 46778, offset 0, flags [DF], proto TCP (6), length 52)
    rpi34.lan.50462 > rpi33.lan.46656: Flags [.], cksum 0xe559 (correct), ack 8353, win 1323, options [nop,nop,TS val 278167778 ecr 278167769], length 0
1527815195.284369 IP (tos 0x0, ttl 64, id 9840, offset 0, flags [DF], proto TCP (6), length 52)
    rpi35.lan.46656 > rpi33.lan.43980: Flags [.], cksum 0xbe04 (correct), ack 9396, win 1331, options [nop,nop,TS val 278166291 ecr 278167769], length 0
1527815195.284371 IP (tos 0x0, ttl 64, id 46779, offset 0, flags [DF], proto TCP (6), length 52)
    rpi34.lan.50462 > rpi33.lan.46656: Flags [.], cksum 0xe145 (correct), ack 9397, win 1323, options [nop,nop,TS val 278167778 ecr 278167769], length 0
1527815195.284548 IP (tos 0x0, ttl 64, id 18139, offset 0, flags [DF], proto TCP (6), length 52)
    rpi36.lan.46656 > rpi33.lan.49740: Flags [.], cksum 0xf1ad (correct), ack 8352, win 1331, options [nop,nop,TS val 278167769 ecr 278167769], length 0
1527815195.284697 IP (tos 0x0, ttl 64, id 18140, offset 0, flags [DF], proto TCP (6), length 52)
    rpi36.lan.46656 > rpi33.lan.49740: Flags [.], cksum 0xed99 (correct), ack 9396, win 1331, options [nop,nop,TS val 278167769 ecr 278167769], length 0
1527815195.288323 IP (tos 0x0, ttl 64, id 60024, offset 0, flags [DF], proto TCP (6), length 1096)
    rpi33.lan.57588 > rpi37.lan.46656: Flags [P.], cksum 0x8899 (incorrect -> 0x695a), seq 7309:8353, ack 10440, win 1324, options [nop,nop,TS val 278167770 ecr 278167747], length 1044
1527815195.289197 IP (tos 0x0, ttl 64, id 54005, offset 0, flags [DF], proto TCP (6), length 52)
    rpi37.lan.46656 > rpi33.lan.57588: Flags [.], cksum 0x8db4 (correct), ack 8353, win 1331, options [nop,nop,TS val 278167754 ecr 278167770], length 0
1527815195.301520 IP (tos 0x0, ttl 64, id 46780, offset 0, flags [DF], proto TCP (6), length 1096)
    rpi34.lan.50462 > rpi33.lan.46656: Flags [P.], cksum 0x6952 (correct), seq 7308:8352, ack 9397, win 1324, options [nop,nop,TS val 278167780 ecr 278167769], length 1044
1527815195.301736 IP (tos 0x0, ttl 64, id 10374, offset 0, flags [DF], proto TCP (6), length 52)
    rpi33.lan.46656 > rpi34.lan.50462: Flags [.], cksum 0x8482 (incorrect -> 0xdd25), ack 8352, win 1331, options [nop,nop,TS val 278167771 ecr 278167780], length 0
1527815195.301813 IP (tos 0x0, ttl 64, id 46781, offset 0, flags [DF], proto TCP (6), length 1096)
    rpi34.lan.50462 > rpi33.lan.46656: Flags [P.], cksum 0xdfeb (correct), seq 8352:9396, ack 9397, win 1324, options [nop,nop,TS val 278167780 ecr 278167769], length 1044
1527815195.301865 IP (tos 0x0, ttl 64, id 10375, offset 0, flags [DF], proto TCP (6), length 52)
    rpi33.lan.46656 > rpi34.lan.50462: Flags [.], cksum 0x8482 (incorrect -> 0xd911), ack 9396, win 1331, options [nop,nop,TS val 278167771 ecr 278167780], length 0
1527815195.383465 IP (tos 0x0, ttl 64, id 9841, offset 0, flags [DF], proto TCP (6), length 1096)
    rpi35.lan.46656 > rpi33.lan.43980: Flags [P.], cksum 0xc592 (correct), seq 9397:10441, ack 9396, win 1332, options [nop,nop,TS val 278166301 ecr 278167769], length 1044
1527815195.391989 IP (tos 0x0, ttl 64, id 18141, offset 0, flags [DF], proto TCP (6), length 1096)
    rpi36.lan.46656 > rpi33.lan.49740: Flags [P.], cksum 0x5055 (correct), seq 9397:10441, ack 9396, win 1332, options [nop,nop,TS val 278167780 ecr 278167769], length 1044
1527815195.395495 IP (tos 0x0, ttl 64, id 54006, offset 0, flags [DF], proto TCP (6), length 1096)
    rpi37.lan.46656 > rpi33.lan.57588: Flags [P.], cksum 0xa597 (correct), seq 10440:11484, ack 8353, win 1332, options [nop,nop,TS val 278167765 ecr 278167770], length 1044
1527815195.395618 IP (tos 0x0, ttl 64, id 60025, offset 0, flags [DF], proto TCP (6), length 52)
    rpi33.lan.57588 > rpi37.lan.46656: Flags [.], cksum 0x8485 (incorrect -> 0x8992), ack 11484, win 1323, options [nop,nop,TS val 278167781 ecr 278167765], length 0
1527815195.397165 IP (tos 0x0, ttl 64, id 60026, offset 0, flags [DF], proto TCP (6), length 1096)
    rpi33.lan.57588 > rpi37.lan.46656: Flags [P.], cksum 0x8899 (incorrect -> 0x2c28), seq 8353:9397, ack 11484, win 1324, options [nop,nop,TS val 278167781 ecr 278167765], length 1044
1527815195.397580 IP (tos 0x0, ttl 64, id 63084, offset 0, flags [DF], proto TCP (6), length 1096)
    rpi33.lan.49740 > rpi36.lan.46656: Flags [P.], cksum 0x8898 (incorrect -> 0x2952), seq 9396:10440, ack 10441, win 1324, options [nop,nop,TS val 278167781 ecr 278167780], length 1044
1527815195.397962 IP (tos 0x0, ttl 64, id 54007, offset 0, flags [DF], proto TCP (6), length 52)
    rpi37.lan.46656 > rpi33.lan.57588: Flags [.], cksum 0x8576 (correct), ack 9397, win 1331, options [nop,nop,TS val 278167765 ecr 278167781], length 0
1527815195.398345 IP (tos 0x0, ttl 64, id 40022, offset 0, flags [DF], proto TCP (6), length 1096)
    rpi33.lan.43980 > rpi35.lan.46656: Flags [P.], cksum 0x8897 (incorrect -> 0x9172), seq 9396:10440, ack 10441, win 1324, options [nop,nop,TS val 278167781 ecr 278166301], length 1044
1527815195.398370 IP (tos 0x0, ttl 64, id 18142, offset 0, flags [DF], proto TCP (6), length 52)
    rpi36.lan.46656 > rpi33.lan.49740: Flags [.], cksum 0xe559 (correct), ack 10440, win 1331, options [nop,nop,TS val 278167781 ecr 278167781], length 0
1527815195.399026 IP (tos 0x0, ttl 64, id 10376, offset 0, flags [DF], proto TCP (6), length 1096)
    rpi33.lan.46656 > rpi34.lan.50462: Flags [P.], cksum 0xbee9 (correct), seq 9397:10441, ack 9396, win 1332, options [nop,nop,TS val 278167781 ecr 278167780], length 1044
1527815195.399153 IP (tos 0x0, ttl 64, id 9842, offset 0, flags [DF], proto TCP (6), length 52)
    rpi35.lan.46656 > rpi33.lan.43980: Flags [.], cksum 0xb5c4 (correct), ack 10440, win 1331, options [nop,nop,TS val 278166303 ecr 278167781], length 0
1527815195.405092 IP (tos 0x0, ttl 64, id 46782, offset 0, flags [DF], proto TCP (6), length 1096)
    rpi34.lan.50462 > rpi33.lan.46656: Flags [P.], cksum 0x5fab (correct), seq 9396:10440, ack 10441, win 1324, options [nop,nop,TS val 278167790 ecr 278167781], length 1044
1527815195.405269 IP (tos 0x0, ttl 64, id 10377, offset 0, flags [DF], proto TCP (6), length 52)
    rpi33.lan.46656 > rpi34.lan.50462: Flags [.], cksum 0x8482 (incorrect -> 0xd0d4), ack 10440, win 1331, options [nop,nop,TS val 278167782 ecr 278167790], length 0
1527815195.484293 IP (tos 0x0, ttl 64, id 9843, offset 0, flags [DF], proto TCP (6), length 1096)
    rpi35.lan.46656 > rpi33.lan.43980: Flags [P.], cksum 0xcc37 (correct), seq 10441:11485, ack 10440, win 1332, options [nop,nop,TS val 278166311 ecr 278167781], length 1044
1527815195.498399 IP (tos 0x0, ttl 64, id 63085, offset 0, flags [DF], proto TCP (6), length 1096)
    rpi33.lan.49740 > rpi36.lan.46656: Flags [P.], cksum 0x8898 (incorrect -> 0xc34c), seq 10440:11484, ack 10441, win 1324, options [nop,nop,TS val 278167791 ecr 278167781], length 1044
1527815195.498765 IP (tos 0x0, ttl 64, id 60027, offset 0, flags [DF], proto TCP (6), length 1096)
    rpi33.lan.57588 > rpi37.lan.46656: Flags [P.], cksum 0x8899 (incorrect -> 0x2eed), seq 9397:10441, ack 11484, win 1324, options [nop,nop,TS val 278167791 ecr 278167765], length 1044
1527815195.499347 IP (tos 0x0, ttl 64, id 18143, offset 0, flags [DF], proto TCP (6), length 52)
    rpi36.lan.46656 > rpi33.lan.49740: Flags [.], cksum 0xe131 (correct), ack 11484, win 1331, options [nop,nop,TS val 278167791 ecr 278167791], length 0
1527815195.499633 IP (tos 0x0, ttl 64, id 54008, offset 0, flags [DF], proto TCP (6), length 52)
    rpi37.lan.46656 > rpi33.lan.57588: Flags [.], cksum 0x814e (correct), ack 10441, win 1331, options [nop,nop,TS val 278167775 ecr 278167791], length 0
1527815195.510057 IP (tos 0x0, ttl 64, id 18144, offset 0, flags [DF], proto TCP (6), length 1096)
    rpi36.lan.46656 > rpi33.lan.49740: Flags [P.], cksum 0xbed6 (correct), seq 10441:11485, ack 11484, win 1332, options [nop,nop,TS val 278167792 ecr 278167791], length 1044
1527815195.510739 IP (tos 0x0, ttl 64, id 54009, offset 0, flags [DF], proto TCP (6), length 1096)
    rpi37.lan.46656 > rpi33.lan.57588: Flags [P.], cksum 0x6c97 (correct), seq 11484:12528, ack 10441, win 1332, options [nop,nop,TS val 278167776 ecr 278167791], length 1044
1527815195.512474 IP (tos 0x0, ttl 64, id 46783, offset 0, flags [DF], proto TCP (6), length 1096)
    rpi34.lan.50462 > rpi33.lan.46656: Flags [P.], cksum 0x8fe3 (correct), seq 10440:11484, ack 10441, win 1324, options [nop,nop,TS val 278167801 ecr 278167782], length 1044
1527815195.512559 IP (tos 0x0, ttl 64, id 10378, offset 0, flags [DF], proto TCP (6), length 52)
    rpi33.lan.46656 > rpi34.lan.50462: Flags [.], cksum 0x8482 (incorrect -> 0xccab), ack 11484, win 1331, options [nop,nop,TS val 278167792 ecr 278167801], length 0
1527815195.524548 IP (tos 0x0, ttl 64, id 40023, offset 0, flags [DF], proto TCP (6), length 52)
    rpi33.lan.43980 > rpi35.lan.46656: Flags [.], cksum 0x8483 (incorrect -> 0xb1a2), ack 11485, win 1324, options [nop,nop,TS val 278167794 ecr 278166311], length 0
1527815195.554544 IP (tos 0x0, ttl 64, id 60028, offset 0, flags [DF], proto TCP (6), length 52)
