1527814942.180452 IP (tos 0x0, ttl 64, id 52678, offset 0, flags [DF], proto TCP (6), length 1096)
    rpi37.lan.46656 > rpi33.lan.57588: Flags [P.], cksum 0xd579 (correct), seq 886824430:886825474, ack 3677497537, win 1332, options [nop,nop,TS val 278142443 ecr 278142269], length 1044
1527814942.180587 IP (tos 0x0, ttl 64, id 58773, offset 0, flags [DF], proto TCP (6), length 52)
    rpi33.lan.57588 > rpi37.lan.46656: Flags [.], cksum 0x8485 (incorrect -> 0xde1d), ack 1044, win 1323, options [nop,nop,TS val 278142459 ecr 278142443], length 0
1527814942.286849 IP (tos 0x0, ttl 64, id 45486, offset 0, flags [DF], proto TCP (6), length 1096)
    rpi34.lan.50462 > rpi33.lan.46656: Flags [P.], cksum 0x56ff (correct), seq 1113962427:1113963471, ack 2415721248, win 1324, options [nop,nop,TS val 278142478 ecr 278142274], length 1044
1527814942.287014 IP (tos 0x0, ttl 64, id 9079, offset 0, flags [DF], proto TCP (6), length 52)
    rpi33.lan.46656 > rpi34.lan.50462: Flags [.], cksum 0x8482 (incorrect -> 0x8b40), ack 1044, win 1331, options [nop,nop,TS val 278142470 ecr 278142478], length 0
1527814942.287732 IP (tos 0x0, ttl 64, id 16801, offset 0, flags [DF], proto TCP (6), length 1096)
    rpi36.lan.46656 > rpi33.lan.49740: Flags [P.], cksum 0x665d (correct), seq 1465547937:1465548981, ack 570974467, win 1332, options [nop,nop,TS val 278142470 ecr 278142274], length 1044
1527814942.287815 IP (tos 0x0, ttl 64, id 61828, offset 0, flags [DF], proto TCP (6), length 52)
    rpi33.lan.49740 > rpi36.lan.46656: Flags [.], cksum 0x8484 (incorrect -> 0xbc57), ack 1044, win 1323, options [nop,nop,TS val 278142470 ecr 278142470], length 0
1527814942.288565 IP (tos 0x0, ttl 64, id 61829, offset 0, flags [DF], proto TCP (6), length 1096)
    rpi33.lan.49740 > rpi36.lan.46656: Flags [P.], cksum 0x8898 (incorrect -> 0x7e8e), seq 1:1045, ack 1044, win 1324, options [nop,nop,TS val 278142470 ecr 278142470], length 1044
1527814942.288602 IP (tos 0x0, ttl 64, id 58774, offset 0, flags [DF], proto TCP (6), length 1096)
    rpi33.lan.57588 > rpi37.lan.46656: Flags [P.], cksum 0x8899 (incorrect -> 0x498a), seq 1:1045, ack 1044, win 1324, options [nop,nop,TS val 278142470 ecr 278142443], length 1044
1527814942.288620 IP (tos 0x0, ttl 64, id 38788, offset 0, flags [DF], proto TCP (6), length 1096)
    rpi33.lan.43980 > rpi35.lan.46656: Flags [P.], cksum 0x8897 (incorrect -> 0x7545), seq 1149339597:1149340641, ack 241706489, win 1324, options [nop,nop,TS val 278142470 ecr 278140791], length 1044
1527814942.289067 IP (tos 0x0, ttl 64, id 9080, offset 0, flags [DF], proto TCP (6), length 1096)
    rpi33.lan.46656 > rpi34.lan.50462: Flags [P.], cksum 0x1254 (correct), seq 1:1045, ack 1044, win 1332, options [nop,nop,TS val 278142470 ecr 278142478], length 1044
1527814942.289448 IP (tos 0x0, ttl 64, id 52679, offset 0, flags [DF], proto TCP (6), length 52)
    rpi37.lan.46656 > rpi33.lan.57588: Flags [.], cksum 0xd9eb (correct), ack 1045, win 1331, options [nop,nop,TS val 278142454 ecr 278142470], length 0
1527814942.289839 IP (tos 0x0, ttl 64, id 45487, offset 0, flags [DF], proto TCP (6), length 52)
    rpi34.lan.50462 > rpi33.lan.46656: Flags [.], cksum 0x8733 (correct), ack 1045, win 1323, options [nop,nop,TS val 278142479 ecr 278142470], length 0
1527814942.290538 IP (tos 0x0, ttl 64, id 8507, offset 0, flags [DF], proto TCP (6), length 1096)
    rpi35.lan.46656 > rpi33.lan.43980: Flags [P.], cksum 0x72ae (correct), seq 1:1045, ack 1044, win 1332, options [nop,nop,TS val 278140992 ecr 278142470], length 1044
1527814942.290604 IP (tos 0x0, ttl 64, id 38789, offset 0, flags [DF], proto TCP (6), length 52)
    rpi33.lan.43980 > rpi35.lan.46656: Flags [.], cksum 0x8483 (incorrect -> 0x2ae2), ack 1045, win 1323, options [nop,nop,TS val 278142470 ecr 278140992], length 0
1527814942.337211 IP (tos 0x0, ttl 64, id 16802, offset 0, flags [DF], proto TCP (6), length 52)
    rpi36.lan.46656 > rpi33.lan.49740: Flags [.], cksum 0xb835 (correct), ack 1045, win 1332, options [nop,nop,TS val 278142475 ecr 278142470], length 0
1527814944.184310 IP (tos 0x0, ttl 64, id 52680, offset 0, flags [DF], proto TCP (6), length 1096)
    rpi37.lan.46656 > rpi33.lan.57588: Flags [P.], cksum 0x5b4b (correct), seq 1044:2088, ack 1045, win 1332, options [nop,nop,TS val 278142644 ecr 278142470], length 1044
1527814944.184474 IP (tos 0x0, ttl 64, id 58775, offset 0, flags [DF], proto TCP (6), length 52)
    rpi33.lan.57588 > rpi37.lan.46656: Flags [.], cksum 0x8485 (incorrect -> 0xd464), ack 2088, win 1323, options [nop,nop,TS val 278142659 ecr 278142644], length 0
1527814944.290397 IP (tos 0x0, ttl 64, id 45488, offset 0, flags [DF], proto TCP (6), length 1096)
    rpi34.lan.50462 > rpi33.lan.46656: Flags [P.], cksum 0x5463 (correct), seq 1044:2088, ack 1045, win 1324, options [nop,nop,TS val 278142679 ecr 278142470], length 1044
1527814944.291369 IP (tos 0x0, ttl 64, id 16803, offset 0, flags [DF], proto TCP (6), length 1096)
    rpi36.lan.46656 > rpi33.lan.49740: Flags [P.], cksum 0xc51b (correct), seq 1044:2088, ack 1045, win 1332, options [nop,nop,TS val 278142670 ecr 278142470], length 1044
1527814944.292427 IP (tos 0x0, ttl 64, id 58776, offset 0, flags [DF], proto TCP (6), length 1096)
    rpi33.lan.57588 > rpi37.lan.46656: Flags [P.], cksum 0x8899 (incorrect -> 0x5019), seq 1045:2089, ack 2088, win 1324, options [nop,nop,TS val 278142670 ecr 278142644], length 1044
1527814944.292472 IP (tos 0x0, ttl 64, id 9081, offset 0, flags [DF], proto TCP (6), length 1096)
    rpi33.lan.46656 > rpi34.lan.50462: Flags [P.], cksum 0xfed1 (correct), seq 1045:2089, ack 2088, win 1332, options [nop,nop,TS val 278142670 ecr 278142679], length 1044
1527814944.292491 IP (tos 0x0, ttl 64, id 61830, offset 0, flags [DF], proto TCP (6), length 1096)
    rpi33.lan.49740 > rpi36.lan.46656: Flags [P.], cksum 0x8898 (incorrect -> 0x6012), seq 1045:2089, ack 2088, win 1324, options [nop,nop,TS val 278142670 ecr 278142670], length 1044
1527814944.292633 IP (tos 0x0, ttl 64, id 38790, offset 0, flags [DF], proto TCP (6), length 1096)
    rpi33.lan.43980 > rpi35.lan.46656: Flags [P.], cksum 0x8897 (incorrect -> 0xc53d), seq 1044:2088, ack 1045, win 1324, options [nop,nop,TS val 278142670 ecr 278140992], length 1044
1527814944.293212 IP (tos 0x0, ttl 64, id 52681, offset 0, flags [DF], proto TCP (6), length 52)
    rpi37.lan.46656 > rpi33.lan.57588: Flags [.], cksum 0xd032 (correct), ack 2089, win 1331, options [nop,nop,TS val 278142655 ecr 278142670], length 0
1527814944.293214 IP (tos 0x0, ttl 64, id 45489, offset 0, flags [DF], proto TCP (6), length 52)
    rpi34.lan.50462 > rpi33.lan.46656: Flags [.], cksum 0x7d7b (correct), ack 2089, win 1323, options [nop,nop,TS val 278142679 ecr 278142670], length 0
1527814944.293383 IP (tos 0x0, ttl 64, id 16804, offset 0, flags [DF], proto TCP (6), length 52)
    rpi36.lan.46656 > rpi33.lan.49740: Flags [.], cksum 0xae83 (correct), ack 2089, win 1331, options [nop,nop,TS val 278142670 ecr 278142670], length 0
1527814944.293939 IP (tos 0x0, ttl 64, id 8508, offset 0, flags [DF], proto TCP (6), length 1096)
    rpi35.lan.46656 > rpi33.lan.43980: Flags [P.], cksum 0x618f (correct), seq 1045:2089, ack 2088, win 1331, options [nop,nop,TS val 278141192 ecr 278142670], length 1044
1527814944.294003 IP (tos 0x0, ttl 64, id 38791, offset 0, flags [DF], proto TCP (6), length 52)
    rpi33.lan.43980 > rpi35.lan.46656: Flags [.], cksum 0x8483 (incorrect -> 0x212a), ack 2089, win 1323, options [nop,nop,TS val 278142670 ecr 278141192], length 0
1527814946.187467 IP (tos 0x0, ttl 64, id 52682, offset 0, flags [DF], proto TCP (6), length 1096)
    rpi37.lan.46656 > rpi33.lan.57588: Flags [P.], cksum 0xfe6f (correct), seq 2088:3132, ack 2089, win 1332, options [nop,nop,TS val 278142844 ecr 278142670], length 1044
1527814946.187628 IP (tos 0x0, ttl 64, id 58777, offset 0, flags [DF], proto TCP (6), length 52)
    rpi33.lan.57588 > rpi37.lan.46656: Flags [.], cksum 0x8485 (incorrect -> 0xcaab), ack 3132, win 1323, options [nop,nop,TS val 278142860 ecr 278142844], length 0
1527814946.293551 IP (tos 0x0, ttl 64, id 45490, offset 0, flags [DF], proto TCP (6), length 1096)
    rpi34.lan.50462 > rpi33.lan.46656: Flags [P.], cksum 0xc1c7 (correct), seq 2088:3132, ack 2089, win 1324, options [nop,nop,TS val 278142879 ecr 278142670], length 1044
1527814946.294622 IP (tos 0x0, ttl 64, id 16805, offset 0, flags [DF], proto TCP (6), length 1096)
    rpi36.lan.46656 > rpi33.lan.49740: Flags [P.], cksum 0x56f0 (correct), seq 2088:3132, ack 2089, win 1332, options [nop,nop,TS val 278142870 ecr 278142670], length 1044
1527814946.297035 IP (tos 0x0, ttl 64, id 9082, offset 0, flags [DF], proto TCP (6), length 1096)
    rpi33.lan.46656 > rpi34.lan.50462: Flags [P.], cksum 0x8165 (correct), seq 2089:3133, ack 3132, win 1332, options [nop,nop,TS val 278142871 ecr 278142879], length 1044
1527814946.297347 IP (tos 0x0, ttl 64, id 8509, offset 0, flags [DF], proto TCP (6), length 1096)
    rpi35.lan.46656 > rpi33.lan.43980: Flags [P.], cksum 0xe8e9 (correct), seq 2089:3133, ack 2088, win 1332, options [nop,nop,TS val 278141392 ecr 278142670], length 1044
1527814946.297418 IP (tos 0x0, ttl 64, id 38792, offset 0, flags [DF], proto TCP (6), length 52)
    rpi33.lan.43980 > rpi35.lan.46656: Flags [.], cksum 0x8483 (incorrect -> 0x1b85), ack 3133, win 1323, options [nop,nop,TS val 278142871 ecr 278141392], length 0
1527814946.297701 IP (tos 0x0, ttl 64, id 38793, offset 0, flags [DF], proto TCP (6), length 1096)
    rpi33.lan.43980 > rpi35.lan.46656: Flags [P.], cksum 0x8897 (incorrect -> 0x3295), seq 2088:3132, ack 3133, win 1324, options [nop,nop,TS val 278142871 ecr 278141392], length 1044
1527814946.297834 IP (tos 0x0, ttl 64, id 45491, offset 0, flags [DF], proto TCP (6), length 52)
    rpi34.lan.50462 > rpi33.lan.46656: Flags [.], cksum 0x73c1 (correct), ack 3133, win 1323, options [nop,nop,TS val 278142880 ecr 278142871], length 0
1527814946.298495 IP (tos 0x0, ttl 64, id 61831, offset 0, flags [DF], proto TCP (6), length 1096)
    rpi33.lan.49740 > rpi36.lan.46656: Flags [P.], cksum 0x8898 (incorrect -> 0x98ed), seq 2089:3133, ack 3132, win 1324, options [nop,nop,TS val 278142871 ecr 278142870], length 1044
1527814946.298801 IP (tos 0x0, ttl 64, id 58778, offset 0, flags [DF], proto TCP (6), length 1096)
    rpi33.lan.57588 > rpi37.lan.46656: Flags [P.], cksum 0x8899 (incorrect -> 0xe8a1), seq 2089:3133, ack 3132, win 1324, options [nop,nop,TS val 278142871 ecr 278142844], length 1044
1527814946.299267 IP (tos 0x0, ttl 64, id 16806, offset 0, flags [DF], proto TCP (6), length 52)
    rpi36.lan.46656 > rpi33.lan.49740: Flags [.], cksum 0xa4c9 (correct), ack 3133, win 1331, options [nop,nop,TS val 278142871 ecr 278142871], length 0
1527814946.299559 IP (tos 0x0, ttl 64, id 52683, offset 0, flags [DF], proto TCP (6), length 52)
    rpi37.lan.46656 > rpi33.lan.57588: Flags [.], cksum 0xc679 (correct), ack 3133, win 1331, options [nop,nop,TS val 278142855 ecr 278142871], length 0
1527814946.347425 IP (tos 0x0, ttl 64, id 8510, offset 0, flags [DF], proto TCP (6), length 52)
    rpi35.lan.46656 > rpi33.lan.43980: Flags [.], cksum 0x1762 (correct), ack 3132, win 1332, options [nop,nop,TS val 278141398 ecr 278142871], length 0
1527814948.190572 IP (tos 0x0, ttl 64, id 52684, offset 0, flags [DF], proto TCP (6), length 1096)
    rpi37.lan.46656 > rpi33.lan.57588: Flags [P.], cksum 0xf61f (correct), seq 3132:4176, ack 3133, win 1332, options [nop,nop,TS val 278143044 ecr 278142871], length 1044
1527814948.190723 IP (tos 0x0, ttl 64, id 58779, offset 0, flags [DF], proto TCP (6), length 52)
    rpi33.lan.57588 > rpi37.lan.46656: Flags [.], cksum 0x8485 (incorrect -> 0xc0f3), ack 4176, win 1323, options [nop,nop,TS val 278143060 ecr 278143044], length 0
1527814948.297245 IP (tos 0x0, ttl 64, id 45492, offset 0, flags [DF], proto TCP (6), length 1096)
    rpi34.lan.50462 > rpi33.lan.46656: Flags [P.], cksum 0xdd67 (correct), seq 3132:4176, ack 3133, win 1324, options [nop,nop,TS val 278143079 ecr 278142871], length 1044
1527814948.298121 IP (tos 0x0, ttl 64, id 16807, offset 0, flags [DF], proto TCP (6), length 1096)
    rpi36.lan.46656 > rpi33.lan.49740: Flags [P.], cksum 0x3d42 (correct), seq 3132:4176, ack 3133, win 1332, options [nop,nop,TS val 278143071 ecr 278142871], length 1044
1527814948.300524 IP (tos 0x0, ttl 64, id 38794, offset 0, flags [DF], proto TCP (6), length 1096)
    rpi33.lan.43980 > rpi35.lan.46656: Flags [P.], cksum 0x8897 (incorrect -> 0xd767), seq 3132:4176, ack 3133, win 1324, options [nop,nop,TS val 278143071 ecr 278141398], length 1044
1527814948.300570 IP (tos 0x0, ttl 64, id 61832, offset 0, flags [DF], proto TCP (6), length 1096)
    rpi33.lan.49740 > rpi36.lan.46656: Flags [P.], cksum 0x8898 (incorrect -> 0x2796), seq 3133:4177, ack 4176, win 1324, options [nop,nop,TS val 278143071 ecr 278143071], length 1044
1527814948.300837 IP (tos 0x0, ttl 64, id 58780, offset 0, flags [DF], proto TCP (6), length 1096)
    rpi33.lan.57588 > rpi37.lan.46656: Flags [P.], cksum 0x8899 (incorrect -> 0xc801), seq 3133:4177, ack 4176, win 1324, options [nop,nop,TS val 278143071 ecr 278143044], length 1044
1527814948.300946 IP (tos 0x0, ttl 64, id 8511, offset 0, flags [DF], proto TCP (6), length 1096)
    rpi35.lan.46656 > rpi33.lan.43980: Flags [P.], cksum 0x4cdf (correct), seq 3133:4177, ack 3132, win 1332, options [nop,nop,TS val 278141593 ecr 278142871], length 1044
1527814948.301041 IP (tos 0x0, ttl 64, id 9083, offset 0, flags [DF], proto TCP (6), length 1096)
    rpi33.lan.46656 > rpi34.lan.50462: Flags [P.], cksum 0xb5f5 (correct), seq 3133:4177, ack 4176, win 1332, options [nop,nop,TS val 278143071 ecr 278143079], length 1044
1527814948.301358 IP (tos 0x0, ttl 64, id 8512, offset 0, flags [DF], proto TCP (6), length 52)
    rpi35.lan.46656 > rpi33.lan.43980: Flags [.], cksum 0x0db0 (correct), ack 4176, win 1331, options [nop,nop,TS val 278141593 ecr 278143071], length 0
1527814948.301360 IP (tos 0x0, ttl 64, id 16808, offset 0, flags [DF], proto TCP (6), length 52)
    rpi36.lan.46656 > rpi33.lan.49740: Flags [.], cksum 0x9b11 (correct), ack 4177, win 1331, options [nop,nop,TS val 278143071 ecr 278143071], length 0
1527814948.301611 IP (tos 0x0, ttl 64, id 52685, offset 0, flags [DF], proto TCP (6), length 52)
    rpi37.lan.46656 > rpi33.lan.57588: Flags [.], cksum 0xbcc1 (correct), ack 4177, win 1331, options [nop,nop,TS val 278143055 ecr 278143071], length 0
1527814948.301821 IP (tos 0x0, ttl 64, id 45493, offset 0, flags [DF], proto TCP (6), length 52)
    rpi34.lan.50462 > rpi33.lan.46656: Flags [.], cksum 0x6a09 (correct), ack 4177, win 1323, options [nop,nop,TS val 278143080 ecr 278143071], length 0
1527814948.344497 IP (tos 0x0, ttl 64, id 38795, offset 0, flags [DF], proto TCP (6), length 52)
    rpi33.lan.43980 > rpi35.lan.46656: Flags [.], cksum 0x8483 (incorrect -> 0x0db2), ack 4177, win 1324, options [nop,nop,TS val 278143076 ecr 278141593], length 0
1527814950.194299 IP (tos 0x0, ttl 64, id 52686, offset 0, flags [DF], proto TCP (6), length 1096)
    rpi37.lan.46656 > rpi33.lan.57588: Flags [P.], cksum 0x42a7 (correct), seq 4176:5220, ack 4177, win 1332, options [nop,nop,TS val 278143245 ecr 278143071], length 1044
1527814950.194440 IP (tos 0x0, ttl 64, id 58781, offset 0, flags [DF], proto TCP (6), length 52)
    rpi33.lan.57588 > rpi37.lan.46656: Flags [.], cksum 0x8485 (incorrect -> 0xb73a), ack 5220, win 1323, options [nop,nop,TS val 278143260 ecr 278143245], length 0
1527814950.300326 IP (tos 0x0, ttl 64, id 45494, offset 0, flags [DF], proto TCP (6), length 1096)
    rpi34.lan.50462 > rpi33.lan.46656: Flags [P.], cksum 0x8d14 (correct), seq 4176:5220, ack 4177, win 1324, options [nop,nop,TS val 278143280 ecr 278143071], length 1044
1527814950.301564 IP (tos 0x0, ttl 64, id 16809, offset 0, flags [DF], proto TCP (6), length 1096)
    rpi36.lan.46656 > rpi33.lan.49740: Flags [P.], cksum 0xd5f0 (correct), seq 4176:5220, ack 4177, win 1332, options [nop,nop,TS val 278143271 ecr 278143071], length 1044
1527814950.303556 IP (tos 0x0, ttl 64, id 9084, offset 0, flags [DF], proto TCP (6), length 1096)
    rpi33.lan.46656 > rpi34.lan.50462: Flags [P.], cksum 0x8a26 (correct), seq 4177:5221, ack 5220, win 1332, options [nop,nop,TS val 278143271 ecr 278143280], length 1044
1527814950.303596 IP (tos 0x0, ttl 64, id 61833, offset 0, flags [DF], proto TCP (6), length 1096)
    rpi33.lan.49740 > rpi36.lan.46656: Flags [P.], cksum 0x8898 (incorrect -> 0xd24a), seq 4177:5221, ack 5220, win 1324, options [nop,nop,TS val 278143271 ecr 278143271], length 1044
1527814950.303906 IP (tos 0x0, ttl 64, id 58782, offset 0, flags [DF], proto TCP (6), length 1096)
    rpi33.lan.57588 > rpi37.lan.46656: Flags [P.], cksum 0x8899 (incorrect -> 0x8b4b), seq 4177:5221, ack 5220, win 1324, options [nop,nop,TS val 278143271 ecr 278143245], length 1044
1527814950.303949 IP (tos 0x0, ttl 64, id 38796, offset 0, flags [DF], proto TCP (6), length 1096)
    rpi33.lan.43980 > rpi35.lan.46656: Flags [P.], cksum 0x8897 (incorrect -> 0xee82), seq 4176:5220, ack 4177, win 1324, options [nop,nop,TS val 278143271 ecr 278141593], length 1044
1527814950.304543 IP (tos 0x0, ttl 64, id 45495, offset 0, flags [DF], proto TCP (6), length 52)
    rpi34.lan.50462 > rpi33.lan.46656: Flags [.], cksum 0x6051 (correct), ack 5221, win 1323, options [nop,nop,TS val 278143280 ecr 278143271], length 0
1527814950.304545 IP (tos 0x0, ttl 64, id 8513, offset 0, flags [DF], proto TCP (6), length 1096)
    rpi35.lan.46656 > rpi33.lan.43980: Flags [P.], cksum 0x0e51 (correct), seq 4177:5221, ack 4176, win 1332, options [nop,nop,TS val 278141793 ecr 278143076], length 1044
1527814950.304700 IP (tos 0x0, ttl 64, id 38797, offset 0, flags [DF], proto TCP (6), length 52)
    rpi33.lan.43980 > rpi35.lan.46656: Flags [.], cksum 0x8483 (incorrect -> 0x03ff), ack 5221, win 1323, options [nop,nop,TS val 278143272 ecr 278141793], length 0
1527814950.304547 IP (tos 0x0, ttl 64, id 16810, offset 0, flags [DF], proto TCP (6), length 52)
    rpi36.lan.46656 > rpi33.lan.49740: Flags [.], cksum 0x9159 (correct), ack 5221, win 1331, options [nop,nop,TS val 278143271 ecr 278143271], length 0
1527814950.304819 IP (tos 0x0, ttl 64, id 52687, offset 0, flags [DF], proto TCP (6), length 52)
    rpi37.lan.46656 > rpi33.lan.57588: Flags [.], cksum 0xb308 (correct), ack 5221, win 1331, options [nop,nop,TS val 278143256 ecr 278143271], length 0
1527814950.304820 IP (tos 0x0, ttl 64, id 8514, offset 0, flags [DF], proto TCP (6), length 52)
    rpi35.lan.46656 > rpi33.lan.43980: Flags [.], cksum 0x03f8 (correct), ack 5220, win 1331, options [nop,nop,TS val 278141793 ecr 278143271], length 0
1527814952.197626 IP (tos 0x0, ttl 64, id 52688, offset 0, flags [DF], proto TCP (6), length 1096)
    rpi37.lan.46656 > rpi33.lan.57588: Flags [P.], cksum 0xcd9f (correct), seq 5220:6264, ack 5221, win 1332, options [nop,nop,TS val 278143445 ecr 278143271], length 1044
1527814952.197719 IP (tos 0x0, ttl 64, id 58783, offset 0, flags [DF], proto TCP (6), length 52)
    rpi33.lan.57588 > rpi37.lan.46656: Flags [.], cksum 0x8485 (incorrect -> 0xad81), ack 6264, win 1323, options [nop,nop,TS val 278143461 ecr 278143445], length 0
1527814952.303752 IP (tos 0x0, ttl 64, id 9085, offset 0, flags [DF], proto TCP (6), length 1096)
    rpi33.lan.46656 > rpi34.lan.50462: Flags [P.], cksum 0x947f (correct), seq 5221:6265, ack 5220, win 1332, options [nop,nop,TS val 278143471 ecr 278143280], length 1044
1527814952.303835 IP (tos 0x0, ttl 64, id 38798, offset 0, flags [DF], proto TCP (6), length 1096)
    rpi33.lan.43980 > rpi35.lan.46656: Flags [P.], cksum 0x8897 (incorrect -> 0xc02e), seq 5220:6264, ack 5221, win 1324, options [nop,nop,TS val 278143471 ecr 278141793], length 1044
1527814952.303981 IP (tos 0x0, ttl 64, id 61834, offset 0, flags [DF], proto TCP (6), length 1096)
    rpi33.lan.49740 > rpi36.lan.46656: Flags [P.], cksum 0x8898 (incorrect -> 0x687c), seq 5221:6265, ack 5220, win 1324, options [nop,nop,TS val 278143471 ecr 278143271], length 1044
1527814952.303981 IP (tos 0x0, ttl 64, id 45496, offset 0, flags [DF], proto TCP (6), length 1096)
    rpi34.lan.50462 > rpi33.lan.46656: Flags [P.], cksum 0x3f35 (correct), seq 5220:6264, ack 5221, win 1324, options [nop,nop,TS val 278143480 ecr 278143271], length 1044
1527814952.304166 IP (tos 0x0, ttl 64, id 58784, offset 0, flags [DF], proto TCP (6), length 1096)
    rpi33.lan.57588 > rpi37.lan.46656: Flags [P.], cksum 0x8899 (incorrect -> 0x9ed5), seq 5221:6265, ack 6264, win 1324, options [nop,nop,TS val 278143471 ecr 278143445], length 1044
1527814952.304845 IP (tos 0x0, ttl 64, id 45497, offset 0, flags [DF], proto TCP (6), length 52)
    rpi34.lan.50462 > rpi33.lan.46656: Flags [.], cksum 0x5699 (correct), ack 6265, win 1323, options [nop,nop,TS val 278143480 ecr 278143471], length 0
1527814952.304847 IP (tos 0x0, ttl 64, id 16811, offset 0, flags [DF], proto TCP (6), length 1096)
    rpi36.lan.46656 > rpi33.lan.49740: Flags [P.], cksum 0x0afa (correct), seq 5220:6264, ack 5221, win 1332, options [nop,nop,TS val 278143471 ecr 278143271], length 1044
1527814952.304850 IP (tos 0x0, ttl 64, id 8515, offset 0, flags [DF], proto TCP (6), length 52)
    rpi35.lan.46656 > rpi33.lan.43980: Flags [.], cksum 0xfe53 (correct), ack 6264, win 1331, options [nop,nop,TS val 278141993 ecr 278143471], length 0
1527814952.304852 IP (tos 0x0, ttl 64, id 16812, offset 0, flags [DF], proto TCP (6), length 52)
    rpi36.lan.46656 > rpi33.lan.49740: Flags [.], cksum 0x87a1 (correct), ack 6265, win 1331, options [nop,nop,TS val 278143471 ecr 278143471], length 0
1527814952.304854 IP (tos 0x0, ttl 64, id 52689, offset 0, flags [DF], proto TCP (6), length 52)
    rpi37.lan.46656 > rpi33.lan.57588: Flags [.], cksum 0xa950 (correct), ack 6265, win 1331, options [nop,nop,TS val 278143456 ecr 278143471], length 0
1527814952.307813 IP (tos 0x0, ttl 64, id 8516, offset 0, flags [DF], proto TCP (6), length 1096)
    rpi35.lan.46656 > rpi33.lan.43980: Flags [P.], cksum 0x9fb5 (correct), seq 5221:6265, ack 6264, win 1332, options [nop,nop,TS val 278141993 ecr 278143471], length 1044
1527814952.307928 IP (tos 0x0, ttl 64, id 38799, offset 0, flags [DF], proto TCP (6), length 52)
    rpi33.lan.43980 > rpi35.lan.46656: Flags [.], cksum 0x8483 (incorrect -> 0xfa46), ack 6265, win 1323, options [nop,nop,TS val 278143472 ecr 278141993], length 0
1527814952.344520 IP (tos 0x0, ttl 64, id 9086, offset 0, flags [DF], proto TCP (6), length 52)
    rpi33.lan.46656 > rpi34.lan.50462: Flags [.], cksum 0x8482 (incorrect -> 0x568b), ack 6264, win 1332, options [nop,nop,TS val 278143476 ecr 278143480], length 0
1527814952.354498 IP (tos 0x0, ttl 64, id 61835, offset 0, flags [DF], proto TCP (6), length 52)
    rpi33.lan.49740 > rpi36.lan.46656: Flags [.], cksum 0x8484 (incorrect -> 0x87a2), ack 6264, win 1324, options [nop,nop,TS val 278143477 ecr 278143471], length 0
1527814954.201647 IP (tos 0x0, ttl 64, id 52690, offset 0, flags [DF], proto TCP (6), length 1096)
    rpi37.lan.46656 > rpi33.lan.57588: Flags [P.], cksum 0x517a (correct), seq 6264:7308, ack 6265, win 1332, options [nop,nop,TS val 278143645 ecr 278143471], length 1044
1527814954.201752 IP (tos 0x0, ttl 64, id 58785, offset 0, flags [DF], proto TCP (6), length 52)
    rpi33.lan.57588 > rpi37.lan.46656: Flags [.], cksum 0x8485 (incorrect -> 0xa3c9), ack 7308, win 1323, options [nop,nop,TS val 278143661 ecr 278143645], length 0
1527814954.307006 IP (tos 0x0, ttl 64, id 45498, offset 0, flags [DF], proto TCP (6), length 1096)
    rpi34.lan.50462 > rpi33.lan.46656: Flags [P.], cksum 0x176b (correct), seq 6264:7308, ack 6265, win 1324, options [nop,nop,TS val 278143680 ecr 278143476], length 1044
1527814954.307101 IP (tos 0x0, ttl 64, id 9087, offset 0, flags [DF], proto TCP (6), length 52)
    rpi33.lan.46656 > rpi34.lan.50462: Flags [.], cksum 0x8482 (incorrect -> 0x50ec), ack 7308, win 1331, options [nop,nop,TS val 278143672 ecr 278143680], length 0
1527814954.307851 IP (tos 0x0, ttl 64, id 9088, offset 0, flags [DF], proto TCP (6), length 1096)
    rpi33.lan.46656 > rpi34.lan.50462: Flags [P.], cksum 0xbe2e (correct), seq 6265:7309, ack 7308, win 1332, options [nop,nop,TS val 278143672 ecr 278143680], length 1044
1527814954.307898 IP (tos 0x0, ttl 64, id 38800, offset 0, flags [DF], proto TCP (6), length 1096)
    rpi33.lan.43980 > rpi35.lan.46656: Flags [P.], cksum 0x8897 (incorrect -> 0x44c8), seq 6264:7308, ack 6265, win 1324, options [nop,nop,TS val 278143672 ecr 278141993], length 1044
1527814954.307916 IP (tos 0x0, ttl 64, id 61836, offset 0, flags [DF], proto TCP (6), length 1096)
    rpi33.lan.49740 > rpi36.lan.46656: Flags [P.], cksum 0x8898 (incorrect -> 0xac56), seq 6265:7309, ack 6264, win 1324, options [nop,nop,TS val 278143672 ecr 278143471], length 1044
1527814954.308067 IP (tos 0x0, ttl 64, id 58786, offset 0, flags [DF], proto TCP (6), length 1096)
    rpi33.lan.57588 > rpi37.lan.46656: Flags [P.], cksum 0x8899 (incorrect -> 0xb13d), seq 6265:7309, ack 7308, win 1324, options [nop,nop,TS val 278143672 ecr 278143645], length 1044
1527814954.308339 IP (tos 0x0, ttl 64, id 16813, offset 0, flags [DF], proto TCP (6), length 1096)
    rpi36.lan.46656 > rpi33.lan.49740: Flags [P.], cksum 0x7825 (correct), seq 6264:7308, ack 6265, win 1332, options [nop,nop,TS val 278143672 ecr 278143477], length 1044
1527814954.308426 IP (tos 0x0, ttl 64, id 61837, offset 0, flags [DF], proto TCP (6), length 52)
    rpi33.lan.49740 > rpi36.lan.46656: Flags [.], cksum 0x8484 (incorrect -> 0x7def), ack 7308, win 1323, options [nop,nop,TS val 278143672 ecr 278143672], length 0
1527814954.308651 IP (tos 0x0, ttl 64, id 45499, offset 0, flags [DF], proto TCP (6), length 52)
    rpi34.lan.50462 > rpi33.lan.46656: Flags [.], cksum 0x4cdf (correct), ack 7309, win 1323, options [nop,nop,TS val 278143681 ecr 278143672], length 0
1527814954.308870 IP (tos 0x0, ttl 64, id 16814, offset 0, flags [DF], proto TCP (6), length 52)
    rpi36.lan.46656 > rpi33.lan.49740: Flags [.], cksum 0x7de7 (correct), ack 7309, win 1331, options [nop,nop,TS val 278143672 ecr 278143672], length 0
1527814954.308871 IP (tos 0x0, ttl 64, id 52691, offset 0, flags [DF], proto TCP (6), length 52)
    rpi37.lan.46656 > rpi33.lan.57588: Flags [.], cksum 0x9f97 (correct), ack 7309, win 1331, options [nop,nop,TS val 278143656 ecr 278143672], length 0
1527814954.311710 IP (tos 0x0, ttl 64, id 8517, offset 0, flags [DF], proto TCP (6), length 1096)
    rpi35.lan.46656 > rpi33.lan.43980: Flags [P.], cksum 0xe785 (correct), seq 6265:7309, ack 7308, win 1332, options [nop,nop,TS val 278142194 ecr 278143672], length 1044
1527814954.311776 IP (tos 0x0, ttl 64, id 38801, offset 0, flags [DF], proto TCP (6), length 52)
    rpi33.lan.43980 > rpi35.lan.46656: Flags [.], cksum 0x8483 (incorrect -> 0xf08d), ack 7309, win 1323, options [nop,nop,TS val 278143672 ecr 278142194], length 0
1527814956.108242 IP (tos 0x0, ttl 64, id 45500, offset 0, flags [DF], proto TCP (6), length 1096)
    rpi34.lan.50462 > rpi33.lan.46656: Flags [P.], cksum 0x6fbb (correct), seq 7308:8352, ack 7309, win 1324, options [nop,nop,TS val 278143861 ecr 278143672], length 1044
1527814956.154518 IP (tos 0x0, ttl 64, id 9089, offset 0, flags [DF], proto TCP (6), length 52)
    rpi33.lan.46656 > rpi34.lan.50462: Flags [.], cksum 0x8482 (incorrect -> 0x4755), ack 8352, win 1332, options [nop,nop,TS val 278143857 ecr 278143861], length 0
1527814956.204801 IP (tos 0x0, ttl 64, id 52692, offset 0, flags [DF], proto TCP (6), length 1096)
    rpi37.lan.46656 > rpi33.lan.57588: Flags [P.], cksum 0x5354 (correct), seq 7308:8352, ack 7309, win 1332, options [nop,nop,TS val 278143846 ecr 278143672], length 1044
1527814956.204887 IP (tos 0x0, ttl 64, id 58787, offset 0, flags [DF], proto TCP (6), length 52)
    rpi33.lan.57588 > rpi37.lan.46656: Flags [.], cksum 0x8485 (incorrect -> 0x9a0f), ack 8352, win 1323, options [nop,nop,TS val 278143862 ecr 278143846], length 0
1527814956.310796 IP (tos 0x0, ttl 64, id 45501, offset 0, flags [DF], proto TCP (6), length 1096)
    rpi34.lan.50462 > rpi33.lan.46656: Flags [P.], cksum 0x503e (correct), seq 8352:9396, ack 7309, win 1324, options [nop,nop,TS val 278143881 ecr 278143857], length 1044
1527814956.310935 IP (tos 0x0, ttl 64, id 9090, offset 0, flags [DF], proto TCP (6), length 52)
    rpi33.lan.46656 > rpi34.lan.50462: Flags [.], cksum 0x8482 (incorrect -> 0x431f), ack 9396, win 1331, options [nop,nop,TS val 278143872 ecr 278143881], length 0
1527814956.311878 IP (tos 0x0, ttl 64, id 16815, offset 0, flags [DF], proto TCP (6), length 1096)
    rpi36.lan.46656 > rpi33.lan.49740: Flags [P.], cksum 0x7cda (correct), seq 7308:8352, ack 7309, win 1332, options [nop,nop,TS val 278143872 ecr 278143672], length 1044
1527814956.311969 IP (tos 0x0, ttl 64, id 61838, offset 0, flags [DF], proto TCP (6), length 52)
    rpi33.lan.49740 > rpi36.lan.46656: Flags [.], cksum 0x8484 (incorrect -> 0x784b), ack 8352, win 1323, options [nop,nop,TS val 278143872 ecr 278143872], length 0
1527814956.314561 IP (tos 0x0, ttl 64, id 8518, offset 0, flags [DF], proto TCP (6), length 1096)
    rpi35.lan.46656 > rpi33.lan.43980: Flags [P.], cksum 0xe420 (correct), seq 7309:8353, ack 7308, win 1332, options [nop,nop,TS val 278142394 ecr 278143672], length 1044
1527814956.314646 IP (tos 0x0, ttl 64, id 38802, offset 0, flags [DF], proto TCP (6), length 52)
    rpi33.lan.43980 > rpi35.lan.46656: Flags [.], cksum 0x8483 (incorrect -> 0xeae8), ack 8353, win 1323, options [nop,nop,TS val 278143873 ecr 278142394], length 0
1527814956.314736 IP (tos 0x0, ttl 64, id 9091, offset 0, flags [DF], proto TCP (6), length 1096)
    rpi33.lan.46656 > rpi34.lan.50462: Flags [P.], cksum 0x82ee (correct), seq 7309:8353, ack 9396, win 1332, options [nop,nop,TS val 278143873 ecr 278143881], length 1044
1527814956.315216 IP (tos 0x0, ttl 64, id 38803, offset 0, flags [DF], proto TCP (6), length 1096)
    rpi33.lan.43980 > rpi35.lan.46656: Flags [P.], cksum 0x8897 (incorrect -> 0x8c19), seq 7308:8352, ack 8353, win 1324, options [nop,nop,TS val 278143873 ecr 278142394], length 1044
1527814956.315254 IP (tos 0x0, ttl 64, id 61839, offset 0, flags [DF], proto TCP (6), length 1096)
    rpi33.lan.49740 > rpi36.lan.46656: Flags [P.], cksum 0x8898 (incorrect -> 0x99fe), seq 7309:8353, ack 8352, win 1324, options [nop,nop,TS val 278143873 ecr 278143872], length 1044
1527814956.315370 IP (tos 0x0, ttl 64, id 58788, offset 0, flags [DF], proto TCP (6), length 1096)
    rpi33.lan.57588 > rpi37.lan.46656: Flags [P.], cksum 0x8899 (incorrect -> 0x5e75), seq 7309:8353, ack 8352, win 1324, options [nop,nop,TS val 278143873 ecr 278143846], length 1044
1527814956.315514 IP (tos 0x0, ttl 64, id 45502, offset 0, flags [DF], proto TCP (6), length 52)
    rpi34.lan.50462 > rpi33.lan.46656: Flags [.], cksum 0x3f12 (correct), ack 8353, win 1323, options [nop,nop,TS val 278143881 ecr 278143873], length 0
1527814956.316073 IP (tos 0x0, ttl 64, id 16816, offset 0, flags [DF], proto TCP (6), length 52)
    rpi36.lan.46656 > rpi33.lan.49740: Flags [.], cksum 0x742e (correct), ack 8353, win 1331, options [nop,nop,TS val 278143872 ecr 278143873], length 0
1527814956.316074 IP (tos 0x0, ttl 64, id 52693, offset 0, flags [DF], proto TCP (6), length 52)
    rpi37.lan.46656 > rpi33.lan.57588: Flags [.], cksum 0x95dd (correct), ack 8353, win 1331, options [nop,nop,TS val 278143857 ecr 278143873], length 0
1527814956.357423 IP (tos 0x0, ttl 64, id 8519, offset 0, flags [DF], proto TCP (6), length 52)
    rpi35.lan.46656 > rpi33.lan.43980: Flags [.], cksum 0xe6c6 (correct), ack 8352, win 1332, options [nop,nop,TS val 278142399 ecr 278143873], length 0
1527814957.713010 IP (tos 0x0, ttl 64, id 45503, offset 0, flags [DF], proto TCP (6), length 1096)
    rpi34.lan.50462 > rpi33.lan.46656: Flags [P.], cksum 0xbd5e (correct), seq 9396:10440, ack 8353, win 1324, options [nop,nop,TS val 278144021 ecr 278143873], length 1044
1527814957.713734 IP (tos 0x0, ttl 64, id 9092, offset 0, flags [DF], proto TCP (6), length 1096)
    rpi33.lan.46656 > rpi34.lan.50462: Flags [P.], cksum 0xcc38 (correct), seq 8353:9397, ack 10440, win 1332, options [nop,nop,TS val 278144012 ecr 278144021], length 1044
1527814957.714000 IP (tos 0x0, ttl 64, id 9093, offset 0, flags [DF], proto TCP (6), length 1096)
    rpi33.lan.46656 > rpi34.lan.50462: Flags [P.], cksum 0xa73e (correct), seq 9397:10441, ack 10440, win 1332, options [nop,nop,TS val 278144012 ecr 278144021], length 1044
1527814957.714569 IP (tos 0x0, ttl 64, id 45504, offset 0, flags [DF], proto TCP (6), length 52)
    rpi34.lan.50462 > rpi33.lan.46656: Flags [.], cksum 0x35d3 (correct), ack 9397, win 1323, options [nop,nop,TS val 278144021 ecr 278144012], length 0
1527814957.714756 IP (tos 0x0, ttl 64, id 45505, offset 0, flags [DF], proto TCP (6), length 52)
    rpi34.lan.50462 > rpi33.lan.46656: Flags [.], cksum 0x31bf (correct), ack 10441, win 1323, options [nop,nop,TS val 278144021 ecr 278144012], length 0
1527814957.715716 IP (tos 0x0, ttl 64, id 45506, offset 0, flags [DF], proto TCP (6), length 1096)
    rpi34.lan.50462 > rpi33.lan.46656: Flags [P.], cksum 0x069c (correct), seq 10440:11484, ack 10441, win 1324, options [nop,nop,TS val 278144021 ecr 278144012], length 1044
1527814957.764509 IP (tos 0x0, ttl 64, id 9094, offset 0, flags [DF], proto TCP (6), length 52)
    rpi33.lan.46656 > rpi34.lan.50462: Flags [.], cksum 0x8482 (incorrect -> 0x2d9c), ack 11484, win 1332, options [nop,nop,TS val 278144018 ecr 278144021], length 0
1527814958.207964 IP (tos 0x0, ttl 64, id 52694, offset 0, flags [DF], proto TCP (6), length 1096)
    rpi37.lan.46656 > rpi33.lan.57588: Flags [P.], cksum 0x619b (correct), seq 8352:9396, ack 8353, win 1332, options [nop,nop,TS val 278144046 ecr 278143873], length 1044
1527814958.208116 IP (tos 0x0, ttl 64, id 58789, offset 0, flags [DF], proto TCP (6), length 52)
    rpi33.lan.57588 > rpi37.lan.46656: Flags [.], cksum 0x8485 (incorrect -> 0x9057), ack 9396, win 1323, options [nop,nop,TS val 278144062 ecr 278144046], length 0
1527814958.313946 IP (tos 0x0, ttl 64, id 45507, offset 0, flags [DF], proto TCP (6), length 1096)
    rpi34.lan.50462 > rpi33.lan.46656: Flags [P.], cksum 0x273c (correct), seq 11484:12528, ack 10441, win 1324, options [nop,nop,TS val 278144081 ecr 278144018], length 1044
1527814958.314026 IP (tos 0x0, ttl 64, id 9095, offset 0, flags [DF], proto TCP (6), length 52)
    rpi33.lan.46656 > rpi34.lan.50462: Flags [.], cksum 0x8482 (incorrect -> 0x2917), ack 12528, win 1331, options [nop,nop,TS val 278144072 ecr 278144081], length 0
1527814958.315247 IP (tos 0x0, ttl 64, id 16817, offset 0, flags [DF], proto TCP (6), length 1096)
    rpi36.lan.46656 > rpi33.lan.49740: Flags [P.], cksum 0x4834 (correct), seq 8352:9396, ack 8353, win 1332, options [nop,nop,TS val 278144072 ecr 278143873], length 1044
1527814958.316838 IP (tos 0x0, ttl 64, id 9096, offset 0, flags [DF], proto TCP (6), length 1096)
    rpi33.lan.46656 > rpi34.lan.50462: Flags [P.], cksum 0x9eba (correct), seq 10441:11485, ack 12528, win 1332, options [nop,nop,TS val 278144073 ecr 278144081], length 1044
1527814958.317052 IP (tos 0x0, ttl 64, id 61840, offset 0, flags [DF], proto TCP (6), length 1096)
    rpi33.lan.49740 > rpi36.lan.46656: Flags [P.], cksum 0x8898 (incorrect -> 0x325a), seq 8353:9397, ack 9396, win 1324, options [nop,nop,TS val 278144073 ecr 278144072], length 1044
1527814958.317154 IP (tos 0x0, ttl 64, id 58790, offset 0, flags [DF], proto TCP (6), length 1096)
    rpi33.lan.57588 > rpi37.lan.46656: Flags [P.], cksum 0x8899 (incorrect -> 0xc284), seq 8353:9397, ack 9396, win 1324, options [nop,nop,TS val 278144073 ecr 278144046], length 1044
1527814958.317283 IP (tos 0x0, ttl 64, id 38804, offset 0, flags [DF], proto TCP (6), length 1096)
    rpi33.lan.43980 > rpi35.lan.46656: Flags [P.], cksum 0x8897 (incorrect -> 0x2b8e), seq 8352:9396, ack 8353, win 1324, options [nop,nop,TS val 278144073 ecr 278142399], length 1044
1527814958.317837 IP (tos 0x0, ttl 64, id 16818, offset 0, flags [DF], proto TCP (6), length 52)
    rpi36.lan.46656 > rpi33.lan.49740: Flags [.], cksum 0x6a75 (correct), ack 9397, win 1331, options [nop,nop,TS val 278144073 ecr 278144073], length 0
1527814958.317839 IP (tos 0x0, ttl 64, id 52695, offset 0, flags [DF], proto TCP (6), length 52)
    rpi37.lan.46656 > rpi33.lan.57588: Flags [.], cksum 0x8c25 (correct), ack 9397, win 1331, options [nop,nop,TS val 278144057 ecr 278144073], length 0
1527814958.318325 IP (tos 0x0, ttl 64, id 8520, offset 0, flags [DF], proto TCP (6), length 1096)
    rpi35.lan.46656 > rpi33.lan.43980: Flags [P.], cksum 0xdf92 (correct), seq 8353:9397, ack 8352, win 1332, options [nop,nop,TS val 278142595 ecr 278143873], length 1044
1527814958.318328 IP (tos 0x0, ttl 64, id 8521, offset 0, flags [DF], proto TCP (6), length 52)
    rpi35.lan.46656 > rpi33.lan.43980: Flags [.], cksum 0xdd13 (correct), ack 9396, win 1331, options [nop,nop,TS val 278142595 ecr 278144073], length 0
1527814958.364505 IP (tos 0x0, ttl 64, id 38805, offset 0, flags [DF], proto TCP (6), length 52)
    rpi33.lan.43980 > rpi35.lan.46656: Flags [.], cksum 0x8483 (incorrect -> 0xdd15), ack 9397, win 1324, options [nop,nop,TS val 278144078 ecr 278142595], length 0
1527814958.367521 IP (tos 0x0, ttl 64, id 45508, offset 0, flags [DF], proto TCP (6), length 52)
    rpi34.lan.50462 > rpi33.lan.46656: Flags [.], cksum 0x2503 (correct), ack 11485, win 1324, options [nop,nop,TS val 278144087 ecr 278144073], length 0
1527814960.211526 IP (tos 0x0, ttl 64, id 52696, offset 0, flags [DF], proto TCP (6), length 1096)
    rpi37.lan.46656 > rpi33.lan.57588: Flags [P.], cksum 0x13db (correct), seq 9396:10440, ack 9397, win 1332, options [nop,nop,TS val 278144246 ecr 278144073], length 1044
1527814960.211700 IP (tos 0x0, ttl 64, id 58791, offset 0, flags [DF], proto TCP (6), length 52)
    rpi33.lan.57588 > rpi37.lan.46656: Flags [.], cksum 0x8485 (incorrect -> 0x869f), ack 10440, win 1323, options [nop,nop,TS val 278144262 ecr 278144246], length 0
1527814960.317447 IP (tos 0x0, ttl 64, id 61841, offset 0, flags [DF], proto TCP (6), length 1096)
    rpi33.lan.49740 > rpi36.lan.46656: Flags [P.], cksum 0x8898 (incorrect -> 0x6e4b), seq 9397:10441, ack 9396, win 1324, options [nop,nop,TS val 278144273 ecr 278144073], length 1044
1527814960.317513 IP (tos 0x0, ttl 64, id 58792, offset 0, flags [DF], proto TCP (6), length 1096)
    rpi33.lan.57588 > rpi37.lan.46656: Flags [P.], cksum 0x8899 (incorrect -> 0xac52), seq 9397:10441, ack 10440, win 1324, options [nop,nop,TS val 278144273 ecr 278144246], length 1044
1527814960.317535 IP (tos 0x0, ttl 64, id 45509, offset 0, flags [DF], proto TCP (6), length 1096)
    rpi34.lan.50462 > rpi33.lan.46656: Flags [P.], cksum 0xb259 (correct), seq 12528:13572, ack 11485, win 1324, options [nop,nop,TS val 278144281 ecr 278144073], length 1044
1527814960.317825 IP (tos 0x0, ttl 64, id 38806, offset 0, flags [DF], proto TCP (6), length 1096)
    rpi33.lan.43980 > rpi35.lan.46656: Flags [P.], cksum 0x8897 (incorrect -> 0xce29), seq 9396:10440, ack 9397, win 1324, options [nop,nop,TS val 278144273 ecr 278142595], length 1044
1527814960.317855 IP (tos 0x0, ttl 64, id 9097, offset 0, flags [DF], proto TCP (6), length 1096)
    rpi33.lan.46656 > rpi34.lan.50462: Flags [P.], cksum 0x7653 (correct), seq 11485:12529, ack 13572, win 1332, options [nop,nop,TS val 278144273 ecr 278144281], length 1044
1527814960.318325 IP (tos 0x0, ttl 64, id 16819, offset 0, flags [DF], proto TCP (6), length 52)
    rpi36.lan.46656 > rpi33.lan.49740: Flags [.], cksum 0x64d1 (correct), ack 10441, win 1331, options [nop,nop,TS val 278144273 ecr 278144273], length 0
1527814960.318327 IP (tos 0x0, ttl 64, id 52697, offset 0, flags [DF], proto TCP (6), length 52)
