1527814251.429609 IP (tos 0x0, ttl 64, id 4668, offset 0, flags [DF], proto TCP (6), length 1096)
    rpi35.lan.46656 > rpi33.lan.43980: Flags [P.], cksum 0x622f (correct), seq 239544365:239545409, ack 1147205661, win 1332, options [nop,nop,TS val 278071906 ecr 278073264], length 1044
1527814251.429785 IP (tos 0x0, ttl 64, id 35122, offset 0, flags [DF], proto TCP (6), length 52)
    rpi33.lan.43980 > rpi35.lan.46656: Flags [.], cksum 0x8483 (incorrect -> 0xd871), ack 1044, win 1323, options [nop,nop,TS val 278073384 ecr 278071906], length 0
1527814251.430005 IP (tos 0x0, ttl 64, id 35123, offset 0, flags [DF], proto TCP (6), length 1096)
    rpi33.lan.43980 > rpi35.lan.46656: Flags [P.], cksum 0x8897 (incorrect -> 0x2015), seq 1:1045, ack 1044, win 1324, options [nop,nop,TS val 278073384 ecr 278071906], length 1044
1527814251.430556 IP (tos 0x0, ttl 64, id 35124, offset 0, flags [DF], proto TCP (6), length 1096)
    rpi33.lan.43980 > rpi35.lan.46656: Flags [P.], cksum 0x8897 (incorrect -> 0xd0a1), seq 1045:2089, ack 1044, win 1324, options [nop,nop,TS val 278073384 ecr 278071906], length 1044
1527814251.431363 IP (tos 0x0, ttl 64, id 4669, offset 0, flags [DF], proto TCP (6), length 52)
    rpi35.lan.46656 > rpi33.lan.43980: Flags [.], cksum 0xd040 (correct), ack 2089, win 1332, options [nop,nop,TS val 278071906 ecr 278073384], length 0
1527814251.431744 IP (tos 0x0, ttl 64, id 4670, offset 0, flags [DF], proto TCP (6), length 1096)
    rpi35.lan.46656 > rpi33.lan.43980: Flags [P.], cksum 0xc259 (correct), seq 1044:2088, ack 2089, win 1332, options [nop,nop,TS val 278071906 ecr 278073384], length 1044
1527814251.474496 IP (tos 0x0, ttl 64, id 35125, offset 0, flags [DF], proto TCP (6), length 52)
    rpi33.lan.43980 > rpi35.lan.46656: Flags [.], cksum 0x8483 (incorrect -> 0xcc2f), ack 2088, win 1324, options [nop,nop,TS val 278073389 ecr 278071906], length 0
1527814252.216638 IP (tos 0x0, ttl 64, id 41664, offset 0, flags [DF], proto TCP (6), length 1096)
    rpi34.lan.50462 > rpi33.lan.46656: Flags [P.], cksum 0x4f5f (correct), seq 1111836843:1111837887, ack 2413568520, win 1324, options [nop,nop,TS val 278073471 ecr 278073263], length 1044
1527814252.224132 IP (tos 0x0, ttl 64, id 35126, offset 0, flags [DF], proto TCP (6), length 1096)
    rpi33.lan.43980 > rpi35.lan.46656: Flags [P.], cksum 0x8897 (incorrect -> 0xb641), seq 2089:3133, ack 2088, win 1324, options [nop,nop,TS val 278073463 ecr 278071906], length 1044
1527814252.224184 IP (tos 0x0, ttl 64, id 55154, offset 0, flags [DF], proto TCP (6), length 1096)
    rpi33.lan.57588 > rpi37.lan.46656: Flags [P.], cksum 0x8899 (incorrect -> 0x5b75), seq 3675395965:3675397009, ack 884579830, win 1324, options [nop,nop,TS val 278073463 ecr 278073248], length 1044
1527814252.224203 IP (tos 0x0, ttl 64, id 58186, offset 0, flags [DF], proto TCP (6), length 1096)
    rpi33.lan.49740 > rpi36.lan.46656: Flags [P.], cksum 0x8898 (incorrect -> 0x390e), seq 568866631:568867675, ack 1463287677, win 1324, options [nop,nop,TS val 278073463 ecr 278073265], length 1044
1527814252.224596 IP (tos 0x0, ttl 64, id 5294, offset 0, flags [DF], proto TCP (6), length 1096)
    rpi33.lan.46656 > rpi34.lan.50462: Flags [P.], cksum 0x88c3 (correct), seq 1:1045, ack 1044, win 1332, options [nop,nop,TS val 278073464 ecr 278073471], length 1044
1527814252.225410 IP (tos 0x0, ttl 64, id 41665, offset 0, flags [DF], proto TCP (6), length 52)
    rpi34.lan.50462 > rpi33.lan.46656: Flags [.], cksum 0xeabb (correct), ack 1045, win 1323, options [nop,nop,TS val 278073472 ecr 278073464], length 0
1527814252.233482 IP (tos 0x0, ttl 64, id 48691, offset 0, flags [DF], proto TCP (6), length 1096)
    rpi37.lan.46656 > rpi33.lan.57588: Flags [P.], cksum 0x8073 (correct), seq 1:1045, ack 1044, win 1332, options [nop,nop,TS val 278073449 ecr 278073463], length 1044
1527814252.233560 IP (tos 0x0, ttl 64, id 55155, offset 0, flags [DF], proto TCP (6), length 52)
    rpi33.lan.57588 > rpi37.lan.46656: Flags [.], cksum 0x8485 (incorrect -> 0x468f), ack 1045, win 1323, options [nop,nop,TS val 278073464 ecr 278073449], length 0
1527814252.233682 IP (tos 0x0, ttl 64, id 4671, offset 0, flags [DF], proto TCP (6), length 1096)
    rpi35.lan.46656 > rpi33.lan.43980: Flags [P.], cksum 0x0ef8 (correct), seq 2088:3132, ack 3133, win 1332, options [nop,nop,TS val 278071986 ecr 278073463], length 1044
1527814252.233741 IP (tos 0x0, ttl 64, id 35127, offset 0, flags [DF], proto TCP (6), length 52)
    rpi33.lan.43980 > rpi35.lan.46656: Flags [.], cksum 0x8483 (incorrect -> 0xc36d), ack 3132, win 1323, options [nop,nop,TS val 278073464 ecr 278071986], length 0
1527814252.241359 IP (tos 0x0, ttl 64, id 12802, offset 0, flags [DF], proto TCP (6), length 1096)
    rpi36.lan.46656 > rpi33.lan.49740: Flags [P.], cksum 0xf412 (correct), seq 1:1045, ack 1044, win 1332, options [nop,nop,TS val 278073465 ecr 278073463], length 1044
1527814252.241451 IP (tos 0x0, ttl 64, id 58187, offset 0, flags [DF], proto TCP (6), length 52)
    rpi33.lan.49740 > rpi36.lan.46656: Flags [.], cksum 0x8484 (incorrect -> 0x7a82), ack 1045, win 1323, options [nop,nop,TS val 278073465 ecr 278073465], length 0
1527814254.220002 IP (tos 0x0, ttl 64, id 41666, offset 0, flags [DF], proto TCP (6), length 1096)
    rpi34.lan.50462 > rpi33.lan.46656: Flags [P.], cksum 0xbe7a (correct), seq 1044:2088, ack 1045, win 1324, options [nop,nop,TS val 278073672 ecr 278073464], length 1044
1527814254.226762 IP (tos 0x0, ttl 64, id 5295, offset 0, flags [DF], proto TCP (6), length 1096)
    rpi33.lan.46656 > rpi34.lan.50462: Flags [P.], cksum 0x7d36 (correct), seq 1045:2089, ack 2088, win 1332, options [nop,nop,TS val 278073664 ecr 278073672], length 1044
1527814254.226826 IP (tos 0x0, ttl 64, id 55156, offset 0, flags [DF], proto TCP (6), length 1096)
    rpi33.lan.57588 > rpi37.lan.46656: Flags [P.], cksum 0x8899 (incorrect -> 0x44e1), seq 1044:2088, ack 1045, win 1324, options [nop,nop,TS val 278073664 ecr 278073449], length 1044
1527814254.226878 IP (tos 0x0, ttl 64, id 58188, offset 0, flags [DF], proto TCP (6), length 1096)
    rpi33.lan.49740 > rpi36.lan.46656: Flags [P.], cksum 0x8898 (incorrect -> 0x3266), seq 1044:2088, ack 1045, win 1324, options [nop,nop,TS val 278073664 ecr 278073465], length 1044
1527814254.227085 IP (tos 0x0, ttl 64, id 35128, offset 0, flags [DF], proto TCP (6), length 1096)
    rpi33.lan.43980 > rpi35.lan.46656: Flags [P.], cksum 0x8897 (incorrect -> 0xf765), seq 3133:4177, ack 3132, win 1324, options [nop,nop,TS val 278073664 ecr 278071986], length 1044
1527814254.227583 IP (tos 0x0, ttl 64, id 41667, offset 0, flags [DF], proto TCP (6), length 52)
    rpi34.lan.50462 > rpi33.lan.46656: Flags [.], cksum 0xe103 (correct), ack 2089, win 1323, options [nop,nop,TS val 278073672 ecr 278073664], length 0
1527814254.236770 IP (tos 0x0, ttl 64, id 4672, offset 0, flags [DF], proto TCP (6), length 1096)
    rpi35.lan.46656 > rpi33.lan.43980: Flags [P.], cksum 0x873e (correct), seq 3132:4176, ack 4177, win 1332, options [nop,nop,TS val 278072186 ecr 278073664], length 1044
1527814254.236848 IP (tos 0x0, ttl 64, id 35129, offset 0, flags [DF], proto TCP (6), length 52)
    rpi33.lan.43980 > rpi35.lan.46656: Flags [.], cksum 0x8483 (incorrect -> 0xb9b4), ack 4176, win 1323, options [nop,nop,TS val 278073665 ecr 278072186], length 0
1527814254.236968 IP (tos 0x0, ttl 64, id 48692, offset 0, flags [DF], proto TCP (6), length 1096)
    rpi37.lan.46656 > rpi33.lan.57588: Flags [P.], cksum 0xc732 (correct), seq 1045:2089, ack 2088, win 1332, options [nop,nop,TS val 278073649 ecr 278073664], length 1044
1527814254.237026 IP (tos 0x0, ttl 64, id 55157, offset 0, flags [DF], proto TCP (6), length 52)
    rpi33.lan.57588 > rpi37.lan.46656: Flags [.], cksum 0x8485 (incorrect -> 0x3cd6), ack 2089, win 1323, options [nop,nop,TS val 278073665 ecr 278073649], length 0
1527814254.244575 IP (tos 0x0, ttl 64, id 12803, offset 0, flags [DF], proto TCP (6), length 1096)
    rpi36.lan.46656 > rpi33.lan.49740: Flags [P.], cksum 0x682f (correct), seq 1045:2089, ack 2088, win 1332, options [nop,nop,TS val 278073665 ecr 278073664], length 1044
1527814254.244665 IP (tos 0x0, ttl 64, id 58189, offset 0, flags [DF], proto TCP (6), length 52)
    rpi33.lan.49740 > rpi36.lan.46656: Flags [.], cksum 0x8484 (incorrect -> 0x70c9), ack 2089, win 1323, options [nop,nop,TS val 278073666 ecr 278073665], length 0
1527814256.223311 IP (tos 0x0, ttl 64, id 41668, offset 0, flags [DF], proto TCP (6), length 1096)
    rpi34.lan.50462 > rpi33.lan.46656: Flags [P.], cksum 0x6ce6 (correct), seq 2088:3132, ack 2089, win 1324, options [nop,nop,TS val 278073872 ecr 278073664], length 1044
1527814256.229508 IP (tos 0x0, ttl 64, id 35130, offset 0, flags [DF], proto TCP (6), length 1096)
    rpi33.lan.43980 > rpi35.lan.46656: Flags [P.], cksum 0x8897 (incorrect -> 0x4c22), seq 4177:5221, ack 4176, win 1324, options [nop,nop,TS val 278073864 ecr 278072186], length 1044
1527814256.229556 IP (tos 0x0, ttl 64, id 55158, offset 0, flags [DF], proto TCP (6), length 1096)
    rpi33.lan.57588 > rpi37.lan.46656: Flags [P.], cksum 0x8899 (incorrect -> 0x2979), seq 2088:3132, ack 2089, win 1324, options [nop,nop,TS val 278073864 ecr 278073649], length 1044
1527814256.229574 IP (tos 0x0, ttl 64, id 5296, offset 0, flags [DF], proto TCP (6), length 1096)
    rpi33.lan.46656 > rpi34.lan.50462: Flags [P.], cksum 0x20fc (correct), seq 2089:3133, ack 3132, win 1332, options [nop,nop,TS val 278073864 ecr 278073872], length 1044
1527814256.229621 IP (tos 0x0, ttl 64, id 58190, offset 0, flags [DF], proto TCP (6), length 1096)
    rpi33.lan.49740 > rpi36.lan.46656: Flags [P.], cksum 0x8898 (incorrect -> 0x022f), seq 2088:3132, ack 2089, win 1324, options [nop,nop,TS val 278073864 ecr 278073665], length 1044
1527814256.230518 IP (tos 0x0, ttl 64, id 41669, offset 0, flags [DF], proto TCP (6), length 52)
    rpi34.lan.50462 > rpi33.lan.46656: Flags [.], cksum 0xd74a (correct), ack 3133, win 1323, options [nop,nop,TS val 278073873 ecr 278073864], length 0
1527814256.240210 IP (tos 0x0, ttl 64, id 48693, offset 0, flags [DF], proto TCP (6), length 1096)
    rpi37.lan.46656 > rpi33.lan.57588: Flags [P.], cksum 0xb41e (correct), seq 2089:3133, ack 3132, win 1332, options [nop,nop,TS val 278073849 ecr 278073864], length 1044
1527814256.240287 IP (tos 0x0, ttl 64, id 55159, offset 0, flags [DF], proto TCP (6), length 52)
    rpi33.lan.57588 > rpi37.lan.46656: Flags [.], cksum 0x8485 (incorrect -> 0x331e), ack 3133, win 1323, options [nop,nop,TS val 278073865 ecr 278073849], length 0
1527814256.240609 IP (tos 0x0, ttl 64, id 4673, offset 0, flags [DF], proto TCP (6), length 1096)
    rpi35.lan.46656 > rpi33.lan.43980: Flags [P.], cksum 0xd8ee (correct), seq 4176:5220, ack 5221, win 1332, options [nop,nop,TS val 278072387 ecr 278073864], length 1044
1527814256.240669 IP (tos 0x0, ttl 64, id 35131, offset 0, flags [DF], proto TCP (6), length 52)
    rpi33.lan.43980 > rpi35.lan.46656: Flags [.], cksum 0x8483 (incorrect -> 0xaffb), ack 5220, win 1323, options [nop,nop,TS val 278073865 ecr 278072387], length 0
1527814256.247765 IP (tos 0x0, ttl 64, id 12804, offset 0, flags [DF], proto TCP (6), length 1096)
    rpi36.lan.46656 > rpi33.lan.49740: Flags [P.], cksum 0x1480 (correct), seq 2089:3133, ack 3132, win 1332, options [nop,nop,TS val 278073866 ecr 278073864], length 1044
1527814256.247858 IP (tos 0x0, ttl 64, id 58191, offset 0, flags [DF], proto TCP (6), length 52)
    rpi33.lan.49740 > rpi36.lan.46656: Flags [.], cksum 0x8484 (incorrect -> 0x6710), ack 3133, win 1323, options [nop,nop,TS val 278073866 ecr 278073866], length 0
1527814258.227350 IP (tos 0x0, ttl 64, id 41670, offset 0, flags [DF], proto TCP (6), length 1096)
    rpi34.lan.50462 > rpi33.lan.46656: Flags [P.], cksum 0xe450 (correct), seq 3132:4176, ack 3133, win 1324, options [nop,nop,TS val 278074072 ecr 278073864], length 1044
1527814258.235749 IP (tos 0x0, ttl 64, id 55160, offset 0, flags [DF], proto TCP (6), length 1096)
    rpi33.lan.57588 > rpi37.lan.46656: Flags [P.], cksum 0x8899 (incorrect -> 0xab5d), seq 3132:4176, ack 3133, win 1324, options [nop,nop,TS val 278074065 ecr 278073849], length 1044
1527814258.235806 IP (tos 0x0, ttl 64, id 58192, offset 0, flags [DF], proto TCP (6), length 1096)
    rpi33.lan.49740 > rpi36.lan.46656: Flags [P.], cksum 0x8898 (incorrect -> 0xa21e), seq 3132:4176, ack 3133, win 1324, options [nop,nop,TS val 278074065 ecr 278073866], length 1044
1527814258.235824 IP (tos 0x0, ttl 64, id 5297, offset 0, flags [DF], proto TCP (6), length 1096)
    rpi33.lan.46656 > rpi34.lan.50462: Flags [P.], cksum 0xea0a (correct), seq 3133:4177, ack 4176, win 1332, options [nop,nop,TS val 278074065 ecr 278074072], length 1044
1527814258.236255 IP (tos 0x0, ttl 64, id 35132, offset 0, flags [DF], proto TCP (6), length 1096)
    rpi33.lan.43980 > rpi35.lan.46656: Flags [P.], cksum 0x8897 (incorrect -> 0xb350), seq 5221:6265, ack 5220, win 1324, options [nop,nop,TS val 278074065 ecr 278072387], length 1044
1527814258.236771 IP (tos 0x0, ttl 64, id 41671, offset 0, flags [DF], proto TCP (6), length 52)
    rpi34.lan.50462 > rpi33.lan.46656: Flags [.], cksum 0xcd91 (correct), ack 4177, win 1323, options [nop,nop,TS val 278074073 ecr 278074065], length 0
1527814258.243618 IP (tos 0x0, ttl 64, id 48694, offset 0, flags [DF], proto TCP (6), length 1096)
    rpi37.lan.46656 > rpi33.lan.57588: Flags [P.], cksum 0xe135 (correct), seq 3133:4177, ack 4176, win 1332, options [nop,nop,TS val 278074050 ecr 278074065], length 1044
1527814258.243687 IP (tos 0x0, ttl 64, id 55161, offset 0, flags [DF], proto TCP (6), length 52)
    rpi33.lan.57588 > rpi37.lan.46656: Flags [.], cksum 0x8485 (incorrect -> 0x2965), ack 4177, win 1323, options [nop,nop,TS val 278074065 ecr 278074050], length 0
1527814258.243976 IP (tos 0x0, ttl 64, id 4674, offset 0, flags [DF], proto TCP (6), length 1096)
    rpi35.lan.46656 > rpi33.lan.43980: Flags [P.], cksum 0xbf37 (correct), seq 5220:6264, ack 6265, win 1332, options [nop,nop,TS val 278072587 ecr 278074065], length 1044
1527814258.244038 IP (tos 0x0, ttl 64, id 35133, offset 0, flags [DF], proto TCP (6), length 52)
    rpi33.lan.43980 > rpi35.lan.46656: Flags [.], cksum 0x8483 (incorrect -> 0xa643), ack 6264, win 1323, options [nop,nop,TS val 278074065 ecr 278072587], length 0
1527814258.251472 IP (tos 0x0, ttl 64, id 12805, offset 0, flags [DF], proto TCP (6), length 1096)
    rpi36.lan.46656 > rpi33.lan.49740: Flags [P.], cksum 0x9aec (correct), seq 3133:4177, ack 4176, win 1332, options [nop,nop,TS val 278074066 ecr 278074065], length 1044
1527814258.251540 IP (tos 0x0, ttl 64, id 58193, offset 0, flags [DF], proto TCP (6), length 52)
    rpi33.lan.49740 > rpi36.lan.46656: Flags [.], cksum 0x8484 (incorrect -> 0x5d58), ack 4177, win 1323, options [nop,nop,TS val 278074066 ecr 278074066], length 0
1527814260.230374 IP (tos 0x0, ttl 64, id 41672, offset 0, flags [DF], proto TCP (6), length 1096)
    rpi34.lan.50462 > rpi33.lan.46656: Flags [P.], cksum 0xa2df (correct), seq 4176:5220, ack 4177, win 1324, options [nop,nop,TS val 278074273 ecr 278074065], length 1044
1527814260.239124 IP (tos 0x0, ttl 64, id 5298, offset 0, flags [DF], proto TCP (6), length 1096)
    rpi33.lan.46656 > rpi34.lan.50462: Flags [P.], cksum 0xfe6a (correct), seq 4177:5221, ack 5220, win 1332, options [nop,nop,TS val 278074265 ecr 278074273], length 1044
1527814260.239448 IP (tos 0x0, ttl 64, id 58194, offset 0, flags [DF], proto TCP (6), length 1096)
    rpi33.lan.49740 > rpi36.lan.46656: Flags [P.], cksum 0x8898 (incorrect -> 0x74ce), seq 4176:5220, ack 4177, win 1324, options [nop,nop,TS val 278074265 ecr 278074066], length 1044
1527814260.239485 IP (tos 0x0, ttl 64, id 35134, offset 0, flags [DF], proto TCP (6), length 1096)
    rpi33.lan.43980 > rpi35.lan.46656: Flags [P.], cksum 0x8897 (incorrect -> 0x5a5e), seq 6265:7309, ack 6264, win 1324, options [nop,nop,TS val 278074265 ecr 278072587], length 1044
1527814260.239508 IP (tos 0x0, ttl 64, id 55162, offset 0, flags [DF], proto TCP (6), length 1096)
    rpi33.lan.57588 > rpi37.lan.46656: Flags [P.], cksum 0x8899 (incorrect -> 0x3ac3), seq 4176:5220, ack 4177, win 1324, options [nop,nop,TS val 278074265 ecr 278074050], length 1044
1527814260.239973 IP (tos 0x0, ttl 64, id 41673, offset 0, flags [DF], proto TCP (6), length 52)
    rpi34.lan.50462 > rpi33.lan.46656: Flags [.], cksum 0xc3d8 (correct), ack 5221, win 1323, options [nop,nop,TS val 278074274 ecr 278074265], length 0
1527814260.246895 IP (tos 0x0, ttl 64, id 48695, offset 0, flags [DF], proto TCP (6), length 1096)
    rpi37.lan.46656 > rpi33.lan.57588: Flags [P.], cksum 0x0808 (correct), seq 4177:5221, ack 5220, win 1332, options [nop,nop,TS val 278074250 ecr 278074265], length 1044
1527814260.246966 IP (tos 0x0, ttl 64, id 55163, offset 0, flags [DF], proto TCP (6), length 52)
    rpi33.lan.57588 > rpi37.lan.46656: Flags [.], cksum 0x8485 (incorrect -> 0x1fac), ack 5221, win 1323, options [nop,nop,TS val 278074266 ecr 278074250], length 0
1527814260.247574 IP (tos 0x0, ttl 64, id 4675, offset 0, flags [DF], proto TCP (6), length 1096)
    rpi35.lan.46656 > rpi33.lan.43980: Flags [P.], cksum 0xd924 (correct), seq 6264:7308, ack 7309, win 1332, options [nop,nop,TS val 278072787 ecr 278074265], length 1044
1527814260.247653 IP (tos 0x0, ttl 64, id 35135, offset 0, flags [DF], proto TCP (6), length 52)
    rpi33.lan.43980 > rpi35.lan.46656: Flags [.], cksum 0x8483 (incorrect -> 0x9c8a), ack 7308, win 1323, options [nop,nop,TS val 278074266 ecr 278072787], length 0
1527814260.254919 IP (tos 0x0, ttl 64, id 12806, offset 0, flags [DF], proto TCP (6), length 1096)
    rpi36.lan.46656 > rpi33.lan.49740: Flags [P.], cksum 0xef27 (correct), seq 4177:5221, ack 5220, win 1332, options [nop,nop,TS val 278074266 ecr 278074265], length 1044
1527814260.254989 IP (tos 0x0, ttl 64, id 58195, offset 0, flags [DF], proto TCP (6), length 52)
    rpi33.lan.49740 > rpi36.lan.46656: Flags [.], cksum 0x8484 (incorrect -> 0x539f), ack 5221, win 1323, options [nop,nop,TS val 278074267 ecr 278074266], length 0
1527814262.233892 IP (tos 0x0, ttl 64, id 41674, offset 0, flags [DF], proto TCP (6), length 1096)
    rpi34.lan.50462 > rpi33.lan.46656: Flags [P.], cksum 0x212c (correct), seq 5220:6264, ack 5221, win 1324, options [nop,nop,TS val 278074473 ecr 278074265], length 1044
1527814262.242534 IP (tos 0x0, ttl 64, id 5299, offset 0, flags [DF], proto TCP (6), length 1096)
    rpi33.lan.46656 > rpi34.lan.50462: Flags [P.], cksum 0x883f (correct), seq 5221:6265, ack 6264, win 1332, options [nop,nop,TS val 278074465 ecr 278074473], length 1044
1527814262.242899 IP (tos 0x0, ttl 64, id 55164, offset 0, flags [DF], proto TCP (6), length 1096)
    rpi33.lan.57588 > rpi37.lan.46656: Flags [P.], cksum 0x8899 (incorrect -> 0xf015), seq 5220:6264, ack 5221, win 1324, options [nop,nop,TS val 278074465 ecr 278074250], length 1044
1527814262.243146 IP (tos 0x0, ttl 64, id 35136, offset 0, flags [DF], proto TCP (6), length 1096)
    rpi33.lan.43980 > rpi35.lan.46656: Flags [P.], cksum 0x8897 (incorrect -> 0xfec6), seq 7309:8353, ack 7308, win 1324, options [nop,nop,TS val 278074465 ecr 278072787], length 1044
1527814262.243361 IP (tos 0x0, ttl 64, id 41675, offset 0, flags [DF], proto TCP (6), length 52)
    rpi34.lan.50462 > rpi33.lan.46656: Flags [.], cksum 0xba20 (correct), ack 6265, win 1323, options [nop,nop,TS val 278074474 ecr 278074465], length 0
1527814262.243491 IP (tos 0x0, ttl 64, id 58196, offset 0, flags [DF], proto TCP (6), length 1096)
    rpi33.lan.49740 > rpi36.lan.46656: Flags [P.], cksum 0x8898 (incorrect -> 0x72e8), seq 5220:6264, ack 5221, win 1324, options [nop,nop,TS val 278074465 ecr 278074266], length 1044
1527814262.250591 IP (tos 0x0, ttl 64, id 4676, offset 0, flags [DF], proto TCP (6), length 1096)
    rpi35.lan.46656 > rpi33.lan.43980: Flags [P.], cksum 0x2fa8 (correct), seq 7308:8352, ack 8353, win 1332, options [nop,nop,TS val 278072988 ecr 278074465], length 1044
1527814262.250663 IP (tos 0x0, ttl 64, id 35137, offset 0, flags [DF], proto TCP (6), length 52)
    rpi33.lan.43980 > rpi35.lan.46656: Flags [.], cksum 0x8483 (incorrect -> 0x92d1), ack 8352, win 1323, options [nop,nop,TS val 278074466 ecr 278072988], length 0
1527814262.250801 IP (tos 0x0, ttl 64, id 48696, offset 0, flags [DF], proto TCP (6), length 1096)
    rpi37.lan.46656 > rpi33.lan.57588: Flags [P.], cksum 0xd9f1 (correct), seq 5221:6265, ack 6264, win 1332, options [nop,nop,TS val 278074450 ecr 278074465], length 1044
1527814262.250858 IP (tos 0x0, ttl 64, id 55165, offset 0, flags [DF], proto TCP (6), length 52)
    rpi33.lan.57588 > rpi37.lan.46656: Flags [.], cksum 0x8485 (incorrect -> 0x15f4), ack 6265, win 1323, options [nop,nop,TS val 278074466 ecr 278074450], length 0
1527814262.258082 IP (tos 0x0, ttl 64, id 12807, offset 0, flags [DF], proto TCP (6), length 1096)
    rpi36.lan.46656 > rpi33.lan.49740: Flags [P.], cksum 0x6510 (correct), seq 5221:6265, ack 6264, win 1332, options [nop,nop,TS val 278074467 ecr 278074465], length 1044
1527814262.258168 IP (tos 0x0, ttl 64, id 58197, offset 0, flags [DF], proto TCP (6), length 52)
    rpi33.lan.49740 > rpi36.lan.46656: Flags [.], cksum 0x8484 (incorrect -> 0x49e6), ack 6265, win 1323, options [nop,nop,TS val 278074467 ecr 278074467], length 0
1527814263.026698 IP (tos 0x0, ttl 64, id 12808, offset 0, flags [DF], proto TCP (6), length 1096)
    rpi36.lan.46656 > rpi33.lan.49740: Flags [P.], cksum 0xdbb2 (correct), seq 6265:7309, ack 6264, win 1332, options [nop,nop,TS val 278074543 ecr 278074467], length 1044
1527814263.026827 IP (tos 0x0, ttl 64, id 58198, offset 0, flags [DF], proto TCP (6), length 52)
    rpi33.lan.49740 > rpi36.lan.46656: Flags [.], cksum 0x8484 (incorrect -> 0x4539), ack 7309, win 1323, options [nop,nop,TS val 278074544 ecr 278074543], length 0
1527814263.027499 IP (tos 0x0, ttl 64, id 58199, offset 0, flags [DF], proto TCP (6), length 1096)
    rpi33.lan.49740 > rpi36.lan.46656: Flags [P.], cksum 0x8898 (incorrect -> 0xdcf3), seq 6264:7308, ack 7309, win 1324, options [nop,nop,TS val 278074544 ecr 278074543], length 1044
1527814263.027919 IP (tos 0x0, ttl 64, id 58200, offset 0, flags [DF], proto TCP (6), length 1096)
    rpi33.lan.49740 > rpi36.lan.46656: Flags [P.], cksum 0x8898 (incorrect -> 0x5ca7), seq 7308:8352, ack 7309, win 1324, options [nop,nop,TS val 278074544 ecr 278074543], length 1044
1527814263.028744 IP (tos 0x0, ttl 64, id 12809, offset 0, flags [DF], proto TCP (6), length 52)
    rpi36.lan.46656 > rpi33.lan.49740: Flags [.], cksum 0x3d07 (correct), ack 8352, win 1332, options [nop,nop,TS val 278074544 ecr 278074544], length 0
1527814263.029350 IP (tos 0x0, ttl 64, id 12810, offset 0, flags [DF], proto TCP (6), length 1096)
    rpi36.lan.46656 > rpi33.lan.49740: Flags [P.], cksum 0xe45d (correct), seq 7309:8353, ack 8352, win 1332, options [nop,nop,TS val 278074544 ecr 278074544], length 1044
1527814263.074518 IP (tos 0x0, ttl 64, id 58201, offset 0, flags [DF], proto TCP (6), length 52)
    rpi33.lan.49740 > rpi36.lan.46656: Flags [.], cksum 0x8484 (incorrect -> 0x38f6), ack 8353, win 1324, options [nop,nop,TS val 278074549 ecr 278074544], length 0
1527814264.237460 IP (tos 0x0, ttl 64, id 41676, offset 0, flags [DF], proto TCP (6), length 1096)
    rpi34.lan.50462 > rpi33.lan.46656: Flags [P.], cksum 0xd322 (correct), seq 6264:7308, ack 6265, win 1324, options [nop,nop,TS val 278074673 ecr 278074465], length 1044
1527814264.246214 IP (tos 0x0, ttl 64, id 58202, offset 0, flags [DF], proto TCP (6), length 1096)
    rpi33.lan.49740 > rpi36.lan.46656: Flags [P.], cksum 0x8898 (incorrect -> 0x79ad), seq 8352:9396, ack 8353, win 1324, options [nop,nop,TS val 278074666 ecr 278074544], length 1044
1527814264.246271 IP (tos 0x0, ttl 64, id 35138, offset 0, flags [DF], proto TCP (6), length 1096)
    rpi33.lan.43980 > rpi35.lan.46656: Flags [P.], cksum 0x8897 (incorrect -> 0xd8a7), seq 8353:9397, ack 8352, win 1324, options [nop,nop,TS val 278074666 ecr 278072988], length 1044
1527814264.246290 IP (tos 0x0, ttl 64, id 5300, offset 0, flags [DF], proto TCP (6), length 1096)
    rpi33.lan.46656 > rpi34.lan.50462: Flags [P.], cksum 0x33f2 (correct), seq 6265:7309, ack 7308, win 1332, options [nop,nop,TS val 278074666 ecr 278074673], length 1044
1527814264.246679 IP (tos 0x0, ttl 64, id 55166, offset 0, flags [DF], proto TCP (6), length 1096)
    rpi33.lan.57588 > rpi37.lan.46656: Flags [P.], cksum 0x8899 (incorrect -> 0x447b), seq 6264:7308, ack 6265, win 1324, options [nop,nop,TS val 278074666 ecr 278074450], length 1044
1527814264.247228 IP (tos 0x0, ttl 64, id 41677, offset 0, flags [DF], proto TCP (6), length 52)
    rpi34.lan.50462 > rpi33.lan.46656: Flags [.], cksum 0xb067 (correct), ack 7309, win 1323, options [nop,nop,TS val 278074674 ecr 278074666], length 0
1527814264.253793 IP (tos 0x0, ttl 64, id 48697, offset 0, flags [DF], proto TCP (6), length 1096)
    rpi37.lan.46656 > rpi33.lan.57588: Flags [P.], cksum 0x89db (correct), seq 6265:7309, ack 7308, win 1332, options [nop,nop,TS val 278074651 ecr 278074666], length 1044
1527814264.253864 IP (tos 0x0, ttl 64, id 55167, offset 0, flags [DF], proto TCP (6), length 52)
    rpi33.lan.57588 > rpi37.lan.46656: Flags [.], cksum 0x8485 (incorrect -> 0x0c3b), ack 7309, win 1323, options [nop,nop,TS val 278074666 ecr 278074651], length 0
1527814264.254103 IP (tos 0x0, ttl 64, id 4677, offset 0, flags [DF], proto TCP (6), length 1096)
    rpi35.lan.46656 > rpi33.lan.43980: Flags [P.], cksum 0xa4c6 (correct), seq 8352:9396, ack 9397, win 1332, options [nop,nop,TS val 278073188 ecr 278074666], length 1044
1527814264.254175 IP (tos 0x0, ttl 64, id 35139, offset 0, flags [DF], proto TCP (6), length 52)
    rpi33.lan.43980 > rpi35.lan.46656: Flags [.], cksum 0x8483 (incorrect -> 0x8919), ack 9396, win 1323, options [nop,nop,TS val 278074666 ecr 278073188], length 0
1527814264.261304 IP (tos 0x0, ttl 64, id 12811, offset 0, flags [DF], proto TCP (6), length 1096)
    rpi36.lan.46656 > rpi33.lan.49740: Flags [P.], cksum 0xface (correct), seq 8353:9397, ack 9396, win 1332, options [nop,nop,TS val 278074667 ecr 278074666], length 1044
1527814264.261373 IP (tos 0x0, ttl 64, id 58203, offset 0, flags [DF], proto TCP (6), length 52)
    rpi33.lan.49740 > rpi36.lan.46656: Flags [.], cksum 0x8484 (incorrect -> 0x2fde), ack 9397, win 1323, options [nop,nop,TS val 278074667 ecr 278074667], length 0
1527814266.241095 IP (tos 0x0, ttl 64, id 41678, offset 0, flags [DF], proto TCP (6), length 1096)
    rpi34.lan.50462 > rpi33.lan.46656: Flags [P.], cksum 0x4ecc (correct), seq 7308:8352, ack 7309, win 1324, options [nop,nop,TS val 278074874 ecr 278074666], length 1044
1527814266.246444 IP (tos 0x0, ttl 64, id 5301, offset 0, flags [DF], proto TCP (6), length 1096)
    rpi33.lan.46656 > rpi34.lan.50462: Flags [P.], cksum 0x68d1 (correct), seq 7309:8353, ack 8352, win 1332, options [nop,nop,TS val 278074866 ecr 278074874], length 1044
1527814266.246489 IP (tos 0x0, ttl 64, id 58204, offset 0, flags [DF], proto TCP (6), length 1096)
    rpi33.lan.49740 > rpi36.lan.46656: Flags [P.], cksum 0x8898 (incorrect -> 0x2f3e), seq 9396:10440, ack 9397, win 1324, options [nop,nop,TS val 278074866 ecr 278074667], length 1044
1527814266.246871 IP (tos 0x0, ttl 64, id 55168, offset 0, flags [DF], proto TCP (6), length 1096)
    rpi33.lan.57588 > rpi37.lan.46656: Flags [P.], cksum 0x8899 (incorrect -> 0x6978), seq 7308:8352, ack 7309, win 1324, options [nop,nop,TS val 278074866 ecr 278074651], length 1044
1527814266.246900 IP (tos 0x0, ttl 64, id 35140, offset 0, flags [DF], proto TCP (6), length 1096)
    rpi33.lan.43980 > rpi35.lan.46656: Flags [P.], cksum 0x8897 (incorrect -> 0xd1d8), seq 9397:10441, ack 9396, win 1324, options [nop,nop,TS val 278074866 ecr 278073188], length 1044
1527814266.247275 IP (tos 0x0, ttl 64, id 41679, offset 0, flags [DF], proto TCP (6), length 52)
    rpi34.lan.50462 > rpi33.lan.46656: Flags [.], cksum 0xa6af (correct), ack 8353, win 1323, options [nop,nop,TS val 278074874 ecr 278074866], length 0
1527814266.257190 IP (tos 0x0, ttl 64, id 48698, offset 0, flags [DF], proto TCP (6), length 1096)
    rpi37.lan.46656 > rpi33.lan.57588: Flags [P.], cksum 0x378d (correct), seq 7309:8353, ack 8352, win 1332, options [nop,nop,TS val 278074851 ecr 278074866], length 1044
1527814266.257274 IP (tos 0x0, ttl 64, id 55169, offset 0, flags [DF], proto TCP (6), length 52)
    rpi33.lan.57588 > rpi37.lan.46656: Flags [.], cksum 0x8485 (incorrect -> 0x0282), ack 8353, win 1323, options [nop,nop,TS val 278074867 ecr 278074851], length 0
1527814266.257803 IP (tos 0x0, ttl 64, id 4678, offset 0, flags [DF], proto TCP (6), length 1096)
    rpi35.lan.46656 > rpi33.lan.43980: Flags [P.], cksum 0xb793 (correct), seq 9396:10440, ack 10441, win 1332, options [nop,nop,TS val 278073388 ecr 278074866], length 1044
1527814266.257879 IP (tos 0x0, ttl 64, id 35141, offset 0, flags [DF], proto TCP (6), length 52)
    rpi33.lan.43980 > rpi35.lan.46656: Flags [.], cksum 0x8483 (incorrect -> 0x7f60), ack 10440, win 1323, options [nop,nop,TS val 278074867 ecr 278073388], length 0
1527814266.264934 IP (tos 0x0, ttl 64, id 12812, offset 0, flags [DF], proto TCP (6), length 1096)
    rpi36.lan.46656 > rpi33.lan.49740: Flags [P.], cksum 0xf84f (correct), seq 9397:10441, ack 10440, win 1332, options [nop,nop,TS val 278074867 ecr 278074866], length 1044
1527814266.264997 IP (tos 0x0, ttl 64, id 58205, offset 0, flags [DF], proto TCP (6), length 52)
    rpi33.lan.49740 > rpi36.lan.46656: Flags [.], cksum 0x8484 (incorrect -> 0x2625), ack 10441, win 1323, options [nop,nop,TS val 278074868 ecr 278074867], length 0
1527814268.245002 IP (tos 0x0, ttl 64, id 41680, offset 0, flags [DF], proto TCP (6), length 1096)
    rpi34.lan.50462 > rpi33.lan.46656: Flags [P.], cksum 0x0579 (correct), seq 8352:9396, ack 8353, win 1324, options [nop,nop,TS val 278075074 ecr 278074866], length 1044
1527814268.249893 IP (tos 0x0, ttl 64, id 35142, offset 0, flags [DF], proto TCP (6), length 1096)
    rpi33.lan.43980 > rpi35.lan.46656: Flags [P.], cksum 0x8897 (incorrect -> 0xe7c0), seq 10441:11485, ack 10440, win 1324, options [nop,nop,TS val 278075066 ecr 278073388], length 1044
1527814268.249958 IP (tos 0x0, ttl 64, id 5302, offset 0, flags [DF], proto TCP (6), length 1096)
    rpi33.lan.46656 > rpi34.lan.50462: Flags [P.], cksum 0xcad9 (correct), seq 8353:9397, ack 9396, win 1332, options [nop,nop,TS val 278075066 ecr 278075074], length 1044
1527814268.250309 IP (tos 0x0, ttl 64, id 58206, offset 0, flags [DF], proto TCP (6), length 1096)
    rpi33.lan.49740 > rpi36.lan.46656: Flags [P.], cksum 0x8898 (incorrect -> 0xa73a), seq 10440:11484, ack 10441, win 1324, options [nop,nop,TS val 278075066 ecr 278074867], length 1044
1527814268.250338 IP (tos 0x0, ttl 64, id 55170, offset 0, flags [DF], proto TCP (6), length 1096)
    rpi33.lan.57588 > rpi37.lan.46656: Flags [P.], cksum 0x8899 (incorrect -> 0x7946), seq 8352:9396, ack 8353, win 1324, options [nop,nop,TS val 278075066 ecr 278074851], length 1044
1527814268.250810 IP (tos 0x0, ttl 64, id 41681, offset 0, flags [DF], proto TCP (6), length 52)
    rpi34.lan.50462 > rpi33.lan.46656: Flags [.], cksum 0x9cf6 (correct), ack 9397, win 1323, options [nop,nop,TS val 278075075 ecr 278075066], length 0
1527814268.260587 IP (tos 0x0, ttl 64, id 48699, offset 0, flags [DF], proto TCP (6), length 1096)
    rpi37.lan.46656 > rpi33.lan.57588: Flags [P.], cksum 0xb12f (correct), seq 8353:9397, ack 9396, win 1332, options [nop,nop,TS val 278075051 ecr 278075066], length 1044
1527814268.260680 IP (tos 0x0, ttl 64, id 55171, offset 0, flags [DF], proto TCP (6), length 52)
    rpi33.lan.57588 > rpi37.lan.46656: Flags [.], cksum 0x8485 (incorrect -> 0xf8c9), ack 9397, win 1323, options [nop,nop,TS val 278075067 ecr 278075051], length 0
1527814268.260901 IP (tos 0x0, ttl 64, id 4679, offset 0, flags [DF], proto TCP (6), length 1096)
    rpi35.lan.46656 > rpi33.lan.43980: Flags [P.], cksum 0x5764 (correct), seq 10440:11484, ack 11485, win 1332, options [nop,nop,TS val 278073589 ecr 278075066], length 1044
1527814268.260963 IP (tos 0x0, ttl 64, id 35143, offset 0, flags [DF], proto TCP (6), length 52)
    rpi33.lan.43980 > rpi35.lan.46656: Flags [.], cksum 0x8483 (incorrect -> 0x75a7), ack 11484, win 1323, options [nop,nop,TS val 278075067 ecr 278073589], length 0
1527814268.268120 IP (tos 0x0, ttl 64, id 12813, offset 0, flags [DF], proto TCP (6), length 1096)
    rpi36.lan.46656 > rpi33.lan.49740: Flags [P.], cksum 0xedca (correct), seq 10441:11485, ack 11484, win 1332, options [nop,nop,TS val 278075068 ecr 278075066], length 1044
1527814268.268210 IP (tos 0x0, ttl 64, id 58207, offset 0, flags [DF], proto TCP (6), length 52)
    rpi33.lan.49740 > rpi36.lan.46656: Flags [.], cksum 0x8484 (incorrect -> 0x1c6c), ack 11485, win 1323, options [nop,nop,TS val 278075068 ecr 278075068], length 0
1527814270.248201 IP (tos 0x0, ttl 64, id 41682, offset 0, flags [DF], proto TCP (6), length 1096)
    rpi34.lan.50462 > rpi33.lan.46656: Flags [P.], cksum 0x1017 (correct), seq 9396:10440, ack 9397, win 1324, options [nop,nop,TS val 278075275 ecr 278075066], length 1044
1527814270.253606 IP (tos 0x0, ttl 64, id 5303, offset 0, flags [DF], proto TCP (6), length 1096)
    rpi33.lan.46656 > rpi34.lan.50462: Flags [P.], cksum 0x136c (correct), seq 9397:10441, ack 10440, win 1332, options [nop,nop,TS val 278075266 ecr 278075275], length 1044
1527814270.253723 IP (tos 0x0, ttl 64, id 35144, offset 0, flags [DF], proto TCP (6), length 1096)
    rpi33.lan.43980 > rpi35.lan.46656: Flags [P.], cksum 0x8897 (incorrect -> 0x881f), seq 11485:12529, ack 11484, win 1324, options [nop,nop,TS val 278075266 ecr 278073589], length 1044
1527814270.253806 IP (tos 0x0, ttl 64, id 58208, offset 0, flags [DF], proto TCP (6), length 1096)
    rpi33.lan.49740 > rpi36.lan.46656: Flags [P.], cksum 0x8898 (incorrect -> 0xb753), seq 11484:12528, ack 11485, win 1324, options [nop,nop,TS val 278075266 ecr 278075068], length 1044
1527814270.254045 IP (tos 0x0, ttl 64, id 55172, offset 0, flags [DF], proto TCP (6), length 1096)
    rpi33.lan.57588 > rpi37.lan.46656: Flags [P.], cksum 0x8899 (incorrect -> 0x56f3), seq 9396:10440, ack 9397, win 1324, options [nop,nop,TS val 278075266 ecr 278075051], length 1044
1527814270.254453 IP (tos 0x0, ttl 64, id 41683, offset 0, flags [DF], proto TCP (6), length 52)
    rpi34.lan.50462 > rpi33.lan.46656: Flags [.], cksum 0x933e (correct), ack 10441, win 1323, options [nop,nop,TS val 278075275 ecr 278075266], length 0
1527814270.264427 IP (tos 0x0, ttl 64, id 48700, offset 0, flags [DF], proto TCP (6), length 1096)
    rpi37.lan.46656 > rpi33.lan.57588: Flags [P.], cksum 0x99e8 (correct), seq 9397:10441, ack 10440, win 1332, options [nop,nop,TS val 278075252 ecr 278075266], length 1044
1527814270.264522 IP (tos 0x0, ttl 64, id 55173, offset 0, flags [DF], proto TCP (6), length 52)
    rpi33.lan.57588 > rpi37.lan.46656: Flags [.], cksum 0x8485 (incorrect -> 0xef10), ack 10441, win 1323, options [nop,nop,TS val 278075267 ecr 278075252], length 0
1527814270.264661 IP (tos 0x0, ttl 64, id 4680, offset 0, flags [DF], proto TCP (6), length 1096)
    rpi35.lan.46656 > rpi33.lan.43980: Flags [P.], cksum 0x9fcf (correct), seq 11484:12528, ack 12529, win 1332, options [nop,nop,TS val 278073789 ecr 278075266], length 1044
1527814270.264723 IP (tos 0x0, ttl 64, id 35145, offset 0, flags [DF], proto TCP (6), length 52)
    rpi33.lan.43980 > rpi35.lan.46656: Flags [.], cksum 0x8483 (incorrect -> 0x6bee), ack 12528, win 1323, options [nop,nop,TS val 278075268 ecr 278073789], length 0
1527814270.271560 IP (tos 0x0, ttl 64, id 12814, offset 0, flags [DF], proto TCP (6), length 1096)
    rpi36.lan.46656 > rpi33.lan.49740: Flags [P.], cksum 0xea72 (correct), seq 11485:12529, ack 12528, win 1332, options [nop,nop,TS val 278075268 ecr 278075266], length 1044
1527814270.271655 IP (tos 0x0, ttl 64, id 58209, offset 0, flags [DF], proto TCP (6), length 52)
    rpi33.lan.49740 > rpi36.lan.46656: Flags [.], cksum 0x8484 (incorrect -> 0x12b4), ack 12529, win 1323, options [nop,nop,TS val 278075268 ecr 278075268], length 0
1527814272.251700 IP (tos 0x0, ttl 64, id 41684, offset 0, flags [DF], proto TCP (6), length 1096)
    rpi34.lan.50462 > rpi33.lan.46656: Flags [P.], cksum 0x8e6a (correct), seq 10440:11484, ack 10441, win 1324, options [nop,nop,TS val 278075475 ecr 278075266], length 1044
1527814272.258307 IP (tos 0x0, ttl 64, id 58210, offset 0, flags [DF], proto TCP (6), length 1096)
    rpi33.lan.49740 > rpi36.lan.46656: Flags [P.], cksum 0x8898 (incorrect -> 0x5d72), seq 12528:13572, ack 12529, win 1324, options [nop,nop,TS val 278075467 ecr 278075268], length 1044
1527814272.258367 IP (tos 0x0, ttl 64, id 55174, offset 0, flags [DF], proto TCP (6), length 1096)
    rpi33.lan.57588 > rpi37.lan.46656: Flags [P.], cksum 0x8899 (incorrect -> 0x4ef1), seq 10440:11484, ack 10441, win 1324, options [nop,nop,TS val 278075467 ecr 278075252], length 1044
1527814272.258562 IP (tos 0x0, ttl 64, id 5304, offset 0, flags [DF], proto TCP (6), length 1096)
    rpi33.lan.46656 > rpi34.lan.50462: Flags [P.], cksum 0x0230 (correct), seq 10441:11485, ack 11484, win 1332, options [nop,nop,TS val 278075467 ecr 278075475], length 1044
1527814272.258599 IP (tos 0x0, ttl 64, id 35146, offset 0, flags [DF], proto TCP (6), length 1096)
    rpi33.lan.43980 > rpi35.lan.46656: Flags [P.], cksum 0x8897 (incorrect -> 0x023a), seq 12529:13573, ack 12528, win 1324, options [nop,nop,TS val 278075467 ecr 278073789], length 1044
1527814272.259378 IP (tos 0x0, ttl 64, id 41685, offset 0, flags [DF], proto TCP (6), length 52)
    rpi34.lan.50462 > rpi33.lan.46656: Flags [.], cksum 0x8984 (correct), ack 11485, win 1323, options [nop,nop,TS val 278075476 ecr 278075467], length 0
1527814272.267400 IP (tos 0x0, ttl 64, id 48701, offset 0, flags [DF], proto TCP (6), length 1096)
    rpi37.lan.46656 > rpi33.lan.57588: Flags [P.], cksum 0x343f (correct), seq 10441:11485, ack 11484, win 1332, options [nop,nop,TS val 278075452 ecr 278075467], length 1044
1527814272.267469 IP (tos 0x0, ttl 64, id 55175, offset 0, flags [DF], proto TCP (6), length 52)
    rpi33.lan.57588 > rpi37.lan.46656: Flags [.], cksum 0x8485 (incorrect -> 0xe557), ack 11485, win 1323, options [nop,nop,TS val 278075468 ecr 278075452], length 0
1527814272.268011 IP (tos 0x0, ttl 64, id 4681, offset 0, flags [DF], proto TCP (6), length 1096)
    rpi35.lan.46656 > rpi33.lan.43980: Flags [P.], cksum 0x404c (correct), seq 12528:13572, ack 13573, win 1332, options [nop,nop,TS val 278073990 ecr 278075467], length 1044
1527814272.268080 IP (tos 0x0, ttl 64, id 35147, offset 0, flags [DF], proto TCP (6), length 52)
    rpi33.lan.43980 > rpi35.lan.46656: Flags [.], cksum 0x8483 (incorrect -> 0x6235), ack 13572, win 1323, options [nop,nop,TS val 278075468 ecr 278073990], length 0
1527814272.275133 IP (tos 0x0, ttl 64, id 12815, offset 0, flags [DF], proto TCP (6), length 1096)
    rpi36.lan.46656 > rpi33.lan.49740: Flags [P.], cksum 0xb155 (correct), seq 12529:13573, ack 13572, win 1332, options [nop,nop,TS val 278075468 ecr 278075467], length 1044
1527814272.275239 IP (tos 0x0, ttl 64, id 58211, offset 0, flags [DF], proto TCP (6), length 52)
    rpi33.lan.49740 > rpi36.lan.46656: Flags [.], cksum 0x8484 (incorrect -> 0x08fb), ack 13573, win 1323, options [nop,nop,TS val 278075469 ecr 278075468], length 0
1527814274.254808 IP (tos 0x0, ttl 64, id 41686, offset 0, flags [DF], proto TCP (6), length 1096)
    rpi34.lan.50462 > rpi33.lan.46656: Flags [P.], cksum 0x2780 (correct), seq 11484:12528, ack 11485, win 1324, options [nop,nop,TS val 278075675 ecr 278075467], length 1044
1527814274.261180 IP (tos 0x0, ttl 64, id 35148, offset 0, flags [DF], proto TCP (6), length 1096)
