1527814469.854859 IP (tos 0x0, ttl 64, id 42331, offset 0, flags [DF], proto TCP (6), length 1096)
    rpi34.lan.50462 > rpi33.lan.46656: Flags [P.], cksum 0x49e9 (correct), seq 1112218947:1112219991, ack 2413970460, win 1324, options [nop,nop,TS val 278095235 ecr 278095033], length 1044
1527814469.855032 IP (tos 0x0, ttl 64, id 5967, offset 0, flags [DF], proto TCP (6), length 52)
    rpi33.lan.46656 > rpi34.lan.50462: Flags [.], cksum 0x8482 (incorrect -> 0x4e09), ack 1044, win 1331, options [nop,nop,TS val 278095227 ecr 278095235], length 0
1527814469.857171 IP (tos 0x0, ttl 64, id 13464, offset 0, flags [DF], proto TCP (6), length 1096)
    rpi36.lan.46656 > rpi33.lan.49740: Flags [P.], cksum 0xf4e8 (correct), seq 1463707365:1463708409, ack 569257087, win 1332, options [nop,nop,TS val 278095226 ecr 278095027], length 1044
1527814469.857845 IP (tos 0x0, ttl 64, id 55805, offset 0, flags [DF], proto TCP (6), length 1096)
    rpi33.lan.57588 > rpi37.lan.46656: Flags [P.], cksum 0x8899 (incorrect -> 0x6d29), seq 3675790597:3675791641, ack 885001606, win 1324, options [nop,nop,TS val 278095227 ecr 278095012], length 1044
1527814469.857884 IP (tos 0x0, ttl 64, id 35800, offset 0, flags [DF], proto TCP (6), length 1096)
    rpi33.lan.43980 > rpi35.lan.46656: Flags [P.], cksum 0x8897 (incorrect -> 0xcd78), seq 1147598205:1147599249, ack 239954657, win 1324, options [nop,nop,TS val 278095227 ecr 278093549], length 1044
1527814469.858112 IP (tos 0x0, ttl 64, id 58870, offset 0, flags [DF], proto TCP (6), length 1096)
    rpi33.lan.49740 > rpi36.lan.46656: Flags [P.], cksum 0x8898 (incorrect -> 0x6abd), seq 1:1045, ack 1044, win 1324, options [nop,nop,TS val 278095227 ecr 278095226], length 1044
1527814469.858138 IP (tos 0x0, ttl 64, id 5968, offset 0, flags [DF], proto TCP (6), length 1096)
    rpi33.lan.46656 > rpi34.lan.50462: Flags [P.], cksum 0x9732 (correct), seq 1:1045, ack 1044, win 1332, options [nop,nop,TS val 278095227 ecr 278095235], length 1044
1527814469.858872 IP (tos 0x0, ttl 64, id 13465, offset 0, flags [DF], proto TCP (6), length 52)
    rpi36.lan.46656 > rpi33.lan.49740: Flags [.], cksum 0x73c9 (correct), ack 1045, win 1331, options [nop,nop,TS val 278095227 ecr 278095227], length 0
1527814469.868733 IP (tos 0x0, ttl 64, id 5329, offset 0, flags [DF], proto TCP (6), length 1096)
    rpi35.lan.46656 > rpi33.lan.43980: Flags [P.], cksum 0xb475 (correct), seq 1:1045, ack 1044, win 1332, options [nop,nop,TS val 278093750 ecr 278095227], length 1044
1527814469.868801 IP (tos 0x0, ttl 64, id 35801, offset 0, flags [DF], proto TCP (6), length 52)
    rpi33.lan.43980 > rpi35.lan.46656: Flags [.], cksum 0x8483 (incorrect -> 0xe994), ack 1045, win 1323, options [nop,nop,TS val 278095228 ecr 278093750], length 0
1527814469.875608 IP (tos 0x0, ttl 64, id 49410, offset 0, flags [DF], proto TCP (6), length 1096)
    rpi37.lan.46656 > rpi33.lan.57588: Flags [P.], cksum 0x1b81 (correct), seq 1:1045, ack 1044, win 1332, options [nop,nop,TS val 278095213 ecr 278095227], length 1044
1527814469.875679 IP (tos 0x0, ttl 64, id 55806, offset 0, flags [DF], proto TCP (6), length 52)
    rpi33.lan.57588 > rpi37.lan.46656: Flags [.], cksum 0x8485 (incorrect -> 0x2761), ack 1045, win 1323, options [nop,nop,TS val 278095229 ecr 278095213], length 0
1527814469.907630 IP (tos 0x0, ttl 64, id 42332, offset 0, flags [DF], proto TCP (6), length 52)
    rpi34.lan.50462 > rpi33.lan.46656: Flags [.], cksum 0x49f6 (correct), ack 1045, win 1324, options [nop,nop,TS val 278095241 ecr 278095227], length 0
1527814471.858247 IP (tos 0x0, ttl 64, id 42333, offset 0, flags [DF], proto TCP (6), length 1096)
    rpi34.lan.50462 > rpi33.lan.46656: Flags [P.], cksum 0x225d (correct), seq 1044:2088, ack 1045, win 1324, options [nop,nop,TS val 278095436 ecr 278095227], length 1044
1527814471.860597 IP (tos 0x0, ttl 64, id 13466, offset 0, flags [DF], proto TCP (6), length 1096)
    rpi36.lan.46656 > rpi33.lan.49740: Flags [P.], cksum 0x6c7c (correct), seq 1044:2088, ack 1045, win 1332, options [nop,nop,TS val 278095427 ecr 278095227], length 1044
1527814471.862658 IP (tos 0x0, ttl 64, id 5969, offset 0, flags [DF], proto TCP (6), length 1096)
    rpi33.lan.46656 > rpi34.lan.50462: Flags [P.], cksum 0xa830 (correct), seq 1045:2089, ack 2088, win 1332, options [nop,nop,TS val 278095427 ecr 278095436], length 1044
1527814471.862785 IP (tos 0x0, ttl 64, id 58871, offset 0, flags [DF], proto TCP (6), length 1096)
    rpi33.lan.49740 > rpi36.lan.46656: Flags [P.], cksum 0x8898 (incorrect -> 0xbebc), seq 1045:2089, ack 2088, win 1324, options [nop,nop,TS val 278095427 ecr 278095427], length 1044
1527814471.862964 IP (tos 0x0, ttl 64, id 35802, offset 0, flags [DF], proto TCP (6), length 1096)
    rpi33.lan.43980 > rpi35.lan.46656: Flags [P.], cksum 0x8897 (incorrect -> 0x474f), seq 1044:2088, ack 1045, win 1324, options [nop,nop,TS val 278095427 ecr 278093750], length 1044
1527814471.863132 IP (tos 0x0, ttl 64, id 55807, offset 0, flags [DF], proto TCP (6), length 1096)
    rpi33.lan.57588 > rpi37.lan.46656: Flags [P.], cksum 0x8899 (incorrect -> 0xa4f1), seq 1044:2088, ack 1045, win 1324, options [nop,nop,TS val 278095427 ecr 278095213], length 1044
1527814471.863438 IP (tos 0x0, ttl 64, id 42334, offset 0, flags [DF], proto TCP (6), length 52)
    rpi34.lan.50462 > rpi33.lan.46656: Flags [.], cksum 0x4044 (correct), ack 2089, win 1323, options [nop,nop,TS val 278095436 ecr 278095427], length 0
1527814471.863441 IP (tos 0x0, ttl 64, id 13467, offset 0, flags [DF], proto TCP (6), length 52)
    rpi36.lan.46656 > rpi33.lan.49740: Flags [.], cksum 0x6a11 (correct), ack 2089, win 1331, options [nop,nop,TS val 278095427 ecr 278095427], length 0
1527814471.872088 IP (tos 0x0, ttl 64, id 5330, offset 0, flags [DF], proto TCP (6), length 1096)
    rpi35.lan.46656 > rpi33.lan.43980: Flags [P.], cksum 0xb56e (correct), seq 1045:2089, ack 2088, win 1332, options [nop,nop,TS val 278093950 ecr 278095427], length 1044
1527814471.872158 IP (tos 0x0, ttl 64, id 35803, offset 0, flags [DF], proto TCP (6), length 52)
    rpi33.lan.43980 > rpi35.lan.46656: Flags [.], cksum 0x8483 (incorrect -> 0xdfdc), ack 2089, win 1323, options [nop,nop,TS val 278095428 ecr 278093950], length 0
1527814471.879071 IP (tos 0x0, ttl 64, id 49411, offset 0, flags [DF], proto TCP (6), length 1096)
    rpi37.lan.46656 > rpi33.lan.57588: Flags [P.], cksum 0xcc01 (correct), seq 1045:2089, ack 2088, win 1332, options [nop,nop,TS val 278095413 ecr 278095427], length 1044
1527814471.879147 IP (tos 0x0, ttl 64, id 55808, offset 0, flags [DF], proto TCP (6), length 52)
    rpi33.lan.57588 > rpi37.lan.46656: Flags [.], cksum 0x8485 (incorrect -> 0x1da9), ack 2089, win 1323, options [nop,nop,TS val 278095429 ecr 278095413], length 0
1527814473.861593 IP (tos 0x0, ttl 64, id 42335, offset 0, flags [DF], proto TCP (6), length 1096)
    rpi34.lan.50462 > rpi33.lan.46656: Flags [P.], cksum 0xa8d1 (correct), seq 2088:3132, ack 2089, win 1324, options [nop,nop,TS val 278095636 ecr 278095427], length 1044
1527814473.864059 IP (tos 0x0, ttl 64, id 13468, offset 0, flags [DF], proto TCP (6), length 1096)
    rpi36.lan.46656 > rpi33.lan.49740: Flags [P.], cksum 0xaec0 (correct), seq 2088:3132, ack 2089, win 1332, options [nop,nop,TS val 278095627 ecr 278095427], length 1044
1527814473.865794 IP (tos 0x0, ttl 64, id 58872, offset 0, flags [DF], proto TCP (6), length 1096)
    rpi33.lan.49740 > rpi36.lan.46656: Flags [P.], cksum 0x8898 (incorrect -> 0xb88f), seq 2089:3133, ack 3132, win 1324, options [nop,nop,TS val 278095628 ecr 278095627], length 1044
1527814473.865839 IP (tos 0x0, ttl 64, id 35804, offset 0, flags [DF], proto TCP (6), length 1096)
    rpi33.lan.43980 > rpi35.lan.46656: Flags [P.], cksum 0x8897 (incorrect -> 0x1ab9), seq 2088:3132, ack 2089, win 1324, options [nop,nop,TS val 278095628 ecr 278093950], length 1044
1527814473.866078 IP (tos 0x0, ttl 64, id 5970, offset 0, flags [DF], proto TCP (6), length 1096)
    rpi33.lan.46656 > rpi34.lan.50462: Flags [P.], cksum 0xa340 (correct), seq 2089:3133, ack 3132, win 1332, options [nop,nop,TS val 278095628 ecr 278095636], length 1044
1527814473.866208 IP (tos 0x0, ttl 64, id 55809, offset 0, flags [DF], proto TCP (6), length 1096)
    rpi33.lan.57588 > rpi37.lan.46656: Flags [P.], cksum 0x8899 (incorrect -> 0xb4e8), seq 2088:3132, ack 2089, win 1324, options [nop,nop,TS val 278095628 ecr 278095413], length 1044
1527814473.866584 IP (tos 0x0, ttl 64, id 13469, offset 0, flags [DF], proto TCP (6), length 52)
    rpi36.lan.46656 > rpi33.lan.49740: Flags [.], cksum 0x6058 (correct), ack 3133, win 1331, options [nop,nop,TS val 278095627 ecr 278095628], length 0
1527814473.866911 IP (tos 0x0, ttl 64, id 42336, offset 0, flags [DF], proto TCP (6), length 52)
    rpi34.lan.50462 > rpi33.lan.46656: Flags [.], cksum 0x368b (correct), ack 3133, win 1323, options [nop,nop,TS val 278095636 ecr 278095628], length 0
1527814473.875648 IP (tos 0x0, ttl 64, id 5331, offset 0, flags [DF], proto TCP (6), length 1096)
    rpi35.lan.46656 > rpi33.lan.43980: Flags [P.], cksum 0x2843 (correct), seq 2089:3133, ack 3132, win 1332, options [nop,nop,TS val 278094150 ecr 278095628], length 1044
1527814473.875717 IP (tos 0x0, ttl 64, id 35805, offset 0, flags [DF], proto TCP (6), length 52)
    rpi33.lan.43980 > rpi35.lan.46656: Flags [.], cksum 0x8483 (incorrect -> 0xd623), ack 3133, win 1323, options [nop,nop,TS val 278095629 ecr 278094150], length 0
1527814473.882643 IP (tos 0x0, ttl 64, id 49412, offset 0, flags [DF], proto TCP (6), length 1096)
    rpi37.lan.46656 > rpi33.lan.57588: Flags [P.], cksum 0xa222 (correct), seq 2089:3133, ack 3132, win 1332, options [nop,nop,TS val 278095614 ecr 278095628], length 1044
1527814473.882711 IP (tos 0x0, ttl 64, id 55810, offset 0, flags [DF], proto TCP (6), length 52)
    rpi33.lan.57588 > rpi37.lan.46656: Flags [.], cksum 0x8485 (incorrect -> 0x13f0), ack 3133, win 1323, options [nop,nop,TS val 278095629 ecr 278095614], length 0
1527814475.865295 IP (tos 0x0, ttl 64, id 42337, offset 0, flags [DF], proto TCP (6), length 1096)
    rpi34.lan.50462 > rpi33.lan.46656: Flags [P.], cksum 0x9140 (correct), seq 3132:4176, ack 3133, win 1324, options [nop,nop,TS val 278095836 ecr 278095628], length 1044
1527814475.867452 IP (tos 0x0, ttl 64, id 13470, offset 0, flags [DF], proto TCP (6), length 1096)
    rpi36.lan.46656 > rpi33.lan.49740: Flags [P.], cksum 0x24b7 (correct), seq 3132:4176, ack 3133, win 1332, options [nop,nop,TS val 278095827 ecr 278095628], length 1044
1527814475.868044 IP (tos 0x0, ttl 64, id 58873, offset 0, flags [DF], proto TCP (6), length 1096)
    rpi33.lan.49740 > rpi36.lan.46656: Flags [P.], cksum 0x8898 (incorrect -> 0x68fc), seq 3133:4177, ack 4176, win 1324, options [nop,nop,TS val 278095828 ecr 278095827], length 1044
1527814475.868084 IP (tos 0x0, ttl 64, id 35806, offset 0, flags [DF], proto TCP (6), length 1096)
    rpi33.lan.43980 > rpi35.lan.46656: Flags [P.], cksum 0x8897 (incorrect -> 0xf4ff), seq 3132:4176, ack 3133, win 1324, options [nop,nop,TS val 278095828 ecr 278094150], length 1044
1527814475.868454 IP (tos 0x0, ttl 64, id 5971, offset 0, flags [DF], proto TCP (6), length 1096)
    rpi33.lan.46656 > rpi34.lan.50462: Flags [P.], cksum 0x8fe3 (correct), seq 3133:4177, ack 4176, win 1332, options [nop,nop,TS val 278095828 ecr 278095836], length 1044
1527814475.868481 IP (tos 0x0, ttl 64, id 55811, offset 0, flags [DF], proto TCP (6), length 1096)
    rpi33.lan.57588 > rpi37.lan.46656: Flags [P.], cksum 0x8899 (incorrect -> 0x69ad), seq 3132:4176, ack 3133, win 1324, options [nop,nop,TS val 278095828 ecr 278095614], length 1044
1527814475.868821 IP (tos 0x0, ttl 64, id 13471, offset 0, flags [DF], proto TCP (6), length 52)
    rpi36.lan.46656 > rpi33.lan.49740: Flags [.], cksum 0x569f (correct), ack 4177, win 1331, options [nop,nop,TS val 278095828 ecr 278095828], length 0
1527814475.869231 IP (tos 0x0, ttl 64, id 42338, offset 0, flags [DF], proto TCP (6), length 52)
    rpi34.lan.50462 > rpi33.lan.46656: Flags [.], cksum 0x2cd2 (correct), ack 4177, win 1323, options [nop,nop,TS val 278095837 ecr 278095828], length 0
1527814475.879317 IP (tos 0x0, ttl 64, id 5332, offset 0, flags [DF], proto TCP (6), length 1096)
    rpi35.lan.46656 > rpi33.lan.43980: Flags [P.], cksum 0x64fb (correct), seq 3133:4177, ack 4176, win 1332, options [nop,nop,TS val 278094351 ecr 278095828], length 1044
1527814475.879386 IP (tos 0x0, ttl 64, id 35807, offset 0, flags [DF], proto TCP (6), length 52)
    rpi33.lan.43980 > rpi35.lan.46656: Flags [.], cksum 0x8483 (incorrect -> 0xcc6a), ack 4177, win 1323, options [nop,nop,TS val 278095829 ecr 278094351], length 0
1527814475.886388 IP (tos 0x0, ttl 64, id 49413, offset 0, flags [DF], proto TCP (6), length 1096)
    rpi37.lan.46656 > rpi33.lan.57588: Flags [P.], cksum 0x3e60 (correct), seq 3133:4177, ack 4176, win 1332, options [nop,nop,TS val 278095814 ecr 278095828], length 1044
1527814475.886465 IP (tos 0x0, ttl 64, id 55812, offset 0, flags [DF], proto TCP (6), length 52)
    rpi33.lan.57588 > rpi37.lan.46656: Flags [.], cksum 0x8485 (incorrect -> 0x0a37), ack 4177, win 1323, options [nop,nop,TS val 278095830 ecr 278095814], length 0
1527814476.108711 IP (tos 0x0, ttl 64, id 42339, offset 0, flags [DF], proto TCP (6), length 1096)
    rpi34.lan.50462 > rpi33.lan.46656: Flags [P.], cksum 0xd2e8 (correct), seq 4176:5220, ack 4177, win 1324, options [nop,nop,TS val 278095861 ecr 278095828], length 1044
1527814476.154491 IP (tos 0x0, ttl 64, id 5972, offset 0, flags [DF], proto TCP (6), length 52)
    rpi33.lan.46656 > rpi34.lan.50462: Flags [.], cksum 0x8482 (incorrect -> 0x2880), ack 5220, win 1332, options [nop,nop,TS val 278095857 ecr 278095861], length 0
1527814477.713209 IP (tos 0x0, ttl 64, id 42340, offset 0, flags [DF], proto TCP (6), length 1096)
    rpi34.lan.50462 > rpi33.lan.46656: Flags [P.], cksum 0x854e (correct), seq 5220:6264, ack 4177, win 1324, options [nop,nop,TS val 278096021 ecr 278095857], length 1044
1527814477.713308 IP (tos 0x0, ttl 64, id 5973, offset 0, flags [DF], proto TCP (6), length 52)
    rpi33.lan.46656 > rpi34.lan.50462: Flags [.], cksum 0x8482 (incorrect -> 0x2332), ack 6264, win 1331, options [nop,nop,TS val 278096012 ecr 278096021], length 0
1527814477.713941 IP (tos 0x0, ttl 64, id 5974, offset 0, flags [DF], proto TCP (6), length 1096)
    rpi33.lan.46656 > rpi34.lan.50462: Flags [P.], cksum 0x6c7e (correct), seq 4177:5221, ack 6264, win 1332, options [nop,nop,TS val 278096012 ecr 278096021], length 1044
1527814477.714382 IP (tos 0x0, ttl 64, id 5975, offset 0, flags [DF], proto TCP (6), length 1096)
    rpi33.lan.46656 > rpi34.lan.50462: Flags [P.], cksum 0xbb0d (correct), seq 5221:6265, ack 6264, win 1332, options [nop,nop,TS val 278096012 ecr 278096021], length 1044
1527814477.714720 IP (tos 0x0, ttl 64, id 42341, offset 0, flags [DF], proto TCP (6), length 52)
    rpi34.lan.50462 > rpi33.lan.46656: Flags [.], cksum 0x1f26 (correct), ack 5221, win 1323, options [nop,nop,TS val 278096021 ecr 278096012], length 0
1527814477.715120 IP (tos 0x0, ttl 64, id 42342, offset 0, flags [DF], proto TCP (6), length 52)
    rpi34.lan.50462 > rpi33.lan.46656: Flags [.], cksum 0x1b12 (correct), ack 6265, win 1323, options [nop,nop,TS val 278096021 ecr 278096012], length 0
1527814477.715779 IP (tos 0x0, ttl 64, id 42343, offset 0, flags [DF], proto TCP (6), length 1096)
    rpi34.lan.50462 > rpi33.lan.46656: Flags [P.], cksum 0x2f1b (correct), seq 6264:7308, ack 6265, win 1324, options [nop,nop,TS val 278096021 ecr 278096012], length 1044
1527814477.764507 IP (tos 0x0, ttl 64, id 5976, offset 0, flags [DF], proto TCP (6), length 52)
    rpi33.lan.46656 > rpi34.lan.50462: Flags [.], cksum 0x8482 (incorrect -> 0x16ef), ack 7308, win 1332, options [nop,nop,TS val 278096018 ecr 278096021], length 0
1527814477.868532 IP (tos 0x0, ttl 64, id 42344, offset 0, flags [DF], proto TCP (6), length 1096)
    rpi34.lan.50462 > rpi33.lan.46656: Flags [P.], cksum 0x8228 (correct), seq 7308:8352, ack 6265, win 1324, options [nop,nop,TS val 278096037 ecr 278096018], length 1044
1527814477.868671 IP (tos 0x0, ttl 64, id 5977, offset 0, flags [DF], proto TCP (6), length 52)
    rpi33.lan.46656 > rpi34.lan.50462: Flags [.], cksum 0x8482 (incorrect -> 0x12c2), ack 8352, win 1331, options [nop,nop,TS val 278096028 ecr 278096037], length 0
1527814477.870693 IP (tos 0x0, ttl 64, id 13472, offset 0, flags [DF], proto TCP (6), length 1096)
    rpi36.lan.46656 > rpi33.lan.49740: Flags [P.], cksum 0x2fb5 (correct), seq 4176:5220, ack 4177, win 1332, options [nop,nop,TS val 278096028 ecr 278095828], length 1044
1527814477.874082 IP (tos 0x0, ttl 64, id 5978, offset 0, flags [DF], proto TCP (6), length 1096)
    rpi33.lan.46656 > rpi34.lan.50462: Flags [P.], cksum 0xd9fb (correct), seq 6265:7309, ack 8352, win 1332, options [nop,nop,TS val 278096028 ecr 278096037], length 1044
1527814477.874429 IP (tos 0x0, ttl 64, id 55813, offset 0, flags [DF], proto TCP (6), length 1096)
    rpi33.lan.57588 > rpi37.lan.46656: Flags [P.], cksum 0x8899 (incorrect -> 0x76f9), seq 4176:5220, ack 4177, win 1324, options [nop,nop,TS val 278096028 ecr 278095814], length 1044
1527814477.874714 IP (tos 0x0, ttl 64, id 35808, offset 0, flags [DF], proto TCP (6), length 1096)
    rpi33.lan.43980 > rpi35.lan.46656: Flags [P.], cksum 0x8897 (incorrect -> 0xe1a1), seq 4176:5220, ack 4177, win 1324, options [nop,nop,TS val 278096029 ecr 278094351], length 1044
1527814477.874917 IP (tos 0x0, ttl 64, id 58874, offset 0, flags [DF], proto TCP (6), length 1096)
    rpi33.lan.49740 > rpi36.lan.46656: Flags [P.], cksum 0x8898 (incorrect -> 0xf7bd), seq 4177:5221, ack 5220, win 1324, options [nop,nop,TS val 278096029 ecr 278096028], length 1044
1527814477.875688 IP (tos 0x0, ttl 64, id 13473, offset 0, flags [DF], proto TCP (6), length 52)
    rpi36.lan.46656 > rpi33.lan.49740: Flags [.], cksum 0x4ce6 (correct), ack 5221, win 1331, options [nop,nop,TS val 278096028 ecr 278096029], length 0
1527814477.882424 IP (tos 0x0, ttl 64, id 5333, offset 0, flags [DF], proto TCP (6), length 1096)
    rpi35.lan.46656 > rpi33.lan.43980: Flags [P.], cksum 0xa0b0 (correct), seq 4177:5221, ack 5220, win 1332, options [nop,nop,TS val 278094551 ecr 278096029], length 1044
1527814477.882499 IP (tos 0x0, ttl 64, id 35809, offset 0, flags [DF], proto TCP (6), length 52)
    rpi33.lan.43980 > rpi35.lan.46656: Flags [.], cksum 0x8483 (incorrect -> 0xc2b2), ack 5221, win 1323, options [nop,nop,TS val 278096029 ecr 278094551], length 0
1527814477.889089 IP (tos 0x0, ttl 64, id 49414, offset 0, flags [DF], proto TCP (6), length 1096)
    rpi37.lan.46656 > rpi33.lan.57588: Flags [P.], cksum 0x02d9 (correct), seq 4177:5221, ack 5220, win 1332, options [nop,nop,TS val 278096014 ecr 278096028], length 1044
1527814477.889175 IP (tos 0x0, ttl 64, id 55814, offset 0, flags [DF], proto TCP (6), length 52)
    rpi33.lan.57588 > rpi37.lan.46656: Flags [.], cksum 0x8485 (incorrect -> 0x007f), ack 5221, win 1323, options [nop,nop,TS val 278096030 ecr 278096014], length 0
1527814477.917642 IP (tos 0x0, ttl 64, id 42345, offset 0, flags [DF], proto TCP (6), length 52)
    rpi34.lan.50462 > rpi33.lan.46656: Flags [.], cksum 0x0eb0 (correct), ack 7309, win 1324, options [nop,nop,TS val 278096042 ecr 278096028], length 0
1527814479.872147 IP (tos 0x0, ttl 64, id 42346, offset 0, flags [DF], proto TCP (6), length 1096)
    rpi34.lan.50462 > rpi33.lan.46656: Flags [P.], cksum 0xf3ae (correct), seq 8352:9396, ack 7309, win 1324, options [nop,nop,TS val 278096237 ecr 278096028], length 1044
1527814479.874012 IP (tos 0x0, ttl 64, id 13474, offset 0, flags [DF], proto TCP (6), length 1096)
    rpi36.lan.46656 > rpi33.lan.49740: Flags [P.], cksum 0x1ff3 (correct), seq 5220:6264, ack 5221, win 1332, options [nop,nop,TS val 278096228 ecr 278096029], length 1044
1527814479.878132 IP (tos 0x0, ttl 64, id 35810, offset 0, flags [DF], proto TCP (6), length 1096)
    rpi33.lan.43980 > rpi35.lan.46656: Flags [P.], cksum 0x8897 (incorrect -> 0x0268), seq 5220:6264, ack 5221, win 1324, options [nop,nop,TS val 278096229 ecr 278094551], length 1044
1527814479.878448 IP (tos 0x0, ttl 64, id 55815, offset 0, flags [DF], proto TCP (6), length 1096)
    rpi33.lan.57588 > rpi37.lan.46656: Flags [P.], cksum 0x8899 (incorrect -> 0x2c46), seq 5220:6264, ack 5221, win 1324, options [nop,nop,TS val 278096229 ecr 278096014], length 1044
1527814479.878724 IP (tos 0x0, ttl 64, id 5979, offset 0, flags [DF], proto TCP (6), length 1096)
    rpi33.lan.46656 > rpi34.lan.50462: Flags [P.], cksum 0xb4ef (correct), seq 7309:8353, ack 9396, win 1332, options [nop,nop,TS val 278096229 ecr 278096237], length 1044
1527814479.879025 IP (tos 0x0, ttl 64, id 58875, offset 0, flags [DF], proto TCP (6), length 1096)
    rpi33.lan.49740 > rpi36.lan.46656: Flags [P.], cksum 0x8898 (incorrect -> 0x1bed), seq 5221:6265, ack 6264, win 1324, options [nop,nop,TS val 278096229 ecr 278096228], length 1044
1527814479.879514 IP (tos 0x0, ttl 64, id 42347, offset 0, flags [DF], proto TCP (6), length 52)
    rpi34.lan.50462 > rpi33.lan.46656: Flags [.], cksum 0x04fc (correct), ack 8353, win 1323, options [nop,nop,TS val 278096238 ecr 278096229], length 0
1527814479.879795 IP (tos 0x0, ttl 64, id 13475, offset 0, flags [DF], proto TCP (6), length 52)
    rpi36.lan.46656 > rpi33.lan.49740: Flags [.], cksum 0x432d (correct), ack 6265, win 1331, options [nop,nop,TS val 278096229 ecr 278096229], length 0
1527814479.886197 IP (tos 0x0, ttl 64, id 5334, offset 0, flags [DF], proto TCP (6), length 1096)
    rpi35.lan.46656 > rpi33.lan.43980: Flags [P.], cksum 0x87fc (correct), seq 5221:6265, ack 6264, win 1332, options [nop,nop,TS val 278094751 ecr 278096229], length 1044
1527814479.886302 IP (tos 0x0, ttl 64, id 35811, offset 0, flags [DF], proto TCP (6), length 52)
    rpi33.lan.43980 > rpi35.lan.46656: Flags [.], cksum 0x8483 (incorrect -> 0xb8f9), ack 6265, win 1323, options [nop,nop,TS val 278096230 ecr 278094751], length 0
1527814479.892756 IP (tos 0x0, ttl 64, id 49415, offset 0, flags [DF], proto TCP (6), length 1096)
    rpi37.lan.46656 > rpi33.lan.57588: Flags [P.], cksum 0x1972 (correct), seq 5221:6265, ack 6264, win 1332, options [nop,nop,TS val 278096215 ecr 278096229], length 1044
1527814479.892955 IP (tos 0x0, ttl 64, id 55816, offset 0, flags [DF], proto TCP (6), length 52)
    rpi33.lan.57588 > rpi37.lan.46656: Flags [.], cksum 0x8485 (incorrect -> 0xf6c5), ack 6265, win 1323, options [nop,nop,TS val 278096230 ecr 278096215], length 0
1527814480.119338 IP (tos 0x0, ttl 64, id 58876, offset 0, flags [DF], proto TCP (6), length 1096)
    rpi33.lan.49740 > rpi36.lan.46656: Flags [P.], cksum 0x8898 (incorrect -> 0xf03c), seq 6265:7309, ack 6264, win 1324, options [nop,nop,TS val 278096253 ecr 278096229], length 1044
1527814480.119621 IP (tos 0x0, ttl 64, id 5980, offset 0, flags [DF], proto TCP (6), length 1096)
    rpi33.lan.46656 > rpi34.lan.50462: Flags [P.], cksum 0x121f (correct), seq 8353:9397, ack 9396, win 1332, options [nop,nop,TS val 278096253 ecr 278096238], length 1044
1527814480.119935 IP (tos 0x0, ttl 64, id 55817, offset 0, flags [DF], proto TCP (6), length 1096)
    rpi33.lan.57588 > rpi37.lan.46656: Flags [P.], cksum 0x8899 (incorrect -> 0x1e01), seq 6264:7308, ack 6265, win 1324, options [nop,nop,TS val 278096253 ecr 278096215], length 1044
1527814480.120142 IP (tos 0x0, ttl 64, id 35812, offset 0, flags [DF], proto TCP (6), length 1096)
    rpi33.lan.43980 > rpi35.lan.46656: Flags [P.], cksum 0x8897 (incorrect -> 0x0885), seq 6264:7308, ack 6265, win 1324, options [nop,nop,TS val 278096253 ecr 278094751], length 1044
1527814480.120263 IP (tos 0x0, ttl 64, id 13476, offset 0, flags [DF], proto TCP (6), length 52)
    rpi36.lan.46656 > rpi33.lan.49740: Flags [.], cksum 0x3ee9 (correct), ack 7309, win 1331, options [nop,nop,TS val 278096253 ecr 278096253], length 0
1527814480.120465 IP (tos 0x0, ttl 64, id 42348, offset 0, flags [DF], proto TCP (6), length 52)
    rpi34.lan.50462 > rpi33.lan.46656: Flags [.], cksum 0x00b8 (correct), ack 9397, win 1323, options [nop,nop,TS val 278096262 ecr 278096253], length 0
1527814480.162010 IP (tos 0x0, ttl 64, id 49416, offset 0, flags [DF], proto TCP (6), length 52)
    rpi37.lan.46656 > rpi33.lan.57588: Flags [.], cksum 0xf276 (correct), ack 7308, win 1332, options [nop,nop,TS val 278096242 ecr 278096253], length 0
1527814480.167682 IP (tos 0x0, ttl 64, id 5335, offset 0, flags [DF], proto TCP (6), length 52)
    rpi35.lan.46656 > rpi33.lan.43980: Flags [.], cksum 0xb4a8 (correct), ack 7308, win 1332, options [nop,nop,TS val 278094780 ecr 278096253], length 0
1527814480.225069 IP (tos 0x0, ttl 64, id 13477, offset 0, flags [DF], proto TCP (6), length 1096)
    rpi36.lan.46656 > rpi33.lan.49740: Flags [P.], cksum 0x9d59 (correct), seq 6264:7308, ack 7309, win 1332, options [nop,nop,TS val 278096263 ecr 278096253], length 1044
1527814480.226053 IP (tos 0x0, ttl 64, id 42349, offset 0, flags [DF], proto TCP (6), length 1096)
    rpi34.lan.50462 > rpi33.lan.46656: Flags [P.], cksum 0xd63b (correct), seq 9396:10440, ack 9397, win 1324, options [nop,nop,TS val 278096272 ecr 278096253], length 1044
1527814480.226754 IP (tos 0x0, ttl 64, id 5336, offset 0, flags [DF], proto TCP (6), length 1096)
    rpi35.lan.46656 > rpi33.lan.43980: Flags [P.], cksum 0x3574 (correct), seq 6265:7309, ack 7308, win 1332, options [nop,nop,TS val 278094785 ecr 278096253], length 1044
1527814480.226843 IP (tos 0x0, ttl 64, id 35813, offset 0, flags [DF], proto TCP (6), length 52)
    rpi33.lan.43980 > rpi35.lan.46656: Flags [.], cksum 0x8483 (incorrect -> 0xb08d), ack 7309, win 1323, options [nop,nop,TS val 278096264 ecr 278094785], length 0
1527814480.226940 IP (tos 0x0, ttl 64, id 49417, offset 0, flags [DF], proto TCP (6), length 1096)
    rpi37.lan.46656 > rpi33.lan.57588: Flags [P.], cksum 0x886a (correct), seq 6265:7309, ack 7308, win 1332, options [nop,nop,TS val 278096248 ecr 278096253], length 1044
1527814480.226994 IP (tos 0x0, ttl 64, id 55818, offset 0, flags [DF], proto TCP (6), length 52)
    rpi33.lan.57588 > rpi37.lan.46656: Flags [.], cksum 0x8485 (incorrect -> 0xee5a), ack 7309, win 1323, options [nop,nop,TS val 278096264 ecr 278096248], length 0
1527814480.234788 IP (tos 0x0, ttl 64, id 5981, offset 0, flags [DF], proto TCP (6), length 1096)
    rpi33.lan.46656 > rpi34.lan.50462: Flags [P.], cksum 0xb09b (correct), seq 9397:10441, ack 10440, win 1332, options [nop,nop,TS val 278096265 ecr 278096272], length 1044
1527814480.235036 IP (tos 0x0, ttl 64, id 58877, offset 0, flags [DF], proto TCP (6), length 1096)
    rpi33.lan.49740 > rpi36.lan.46656: Flags [P.], cksum 0x8898 (incorrect -> 0xcbbb), seq 7309:8353, ack 7308, win 1324, options [nop,nop,TS val 278096265 ecr 278096263], length 1044
1527814480.235067 IP (tos 0x0, ttl 64, id 5982, offset 0, flags [DF], proto TCP (6), length 1096)
    rpi33.lan.46656 > rpi34.lan.50462: Flags [P.], cksum 0x777f (correct), seq 10441:11485, ack 10440, win 1332, options [nop,nop,TS val 278096265 ecr 278096272], length 1044
1527814480.235225 IP (tos 0x0, ttl 64, id 58878, offset 0, flags [DF], proto TCP (6), length 1096)
    rpi33.lan.49740 > rpi36.lan.46656: Flags [P.], cksum 0x8898 (incorrect -> 0x4d32), seq 8353:9397, ack 7308, win 1324, options [nop,nop,TS val 278096265 ecr 278096263], length 1044
1527814480.235525 IP (tos 0x0, ttl 64, id 35814, offset 0, flags [DF], proto TCP (6), length 1096)
    rpi33.lan.43980 > rpi35.lan.46656: Flags [P.], cksum 0x8897 (incorrect -> 0x65a0), seq 7308:8352, ack 7309, win 1324, options [nop,nop,TS val 278096265 ecr 278094785], length 1044
1527814480.235639 IP (tos 0x0, ttl 64, id 42350, offset 0, flags [DF], proto TCP (6), length 52)
    rpi34.lan.50462 > rpi33.lan.46656: Flags [.], cksum 0xf878 (correct), ack 10441, win 1323, options [nop,nop,TS val 278096273 ecr 278096265], length 0
1527814480.235684 IP (tos 0x0, ttl 64, id 35815, offset 0, flags [DF], proto TCP (6), length 1096)
    rpi33.lan.43980 > rpi35.lan.46656: Flags [P.], cksum 0x8897 (incorrect -> 0x3245), seq 8352:9396, ack 7309, win 1324, options [nop,nop,TS val 278096265 ecr 278094785], length 1044
1527814480.235860 IP (tos 0x0, ttl 64, id 13478, offset 0, flags [DF], proto TCP (6), length 52)
    rpi36.lan.46656 > rpi33.lan.49740: Flags [.], cksum 0x36aa (correct), ack 8353, win 1331, options [nop,nop,TS val 278096264 ecr 278096265], length 0
1527814480.235891 IP (tos 0x0, ttl 64, id 55819, offset 0, flags [DF], proto TCP (6), length 1096)
    rpi33.lan.57588 > rpi37.lan.46656: Flags [P.], cksum 0x8899 (incorrect -> 0x8fab), seq 7308:8352, ack 7309, win 1324, options [nop,nop,TS val 278096265 ecr 278096248], length 1044
1527814480.235862 IP (tos 0x0, ttl 64, id 42351, offset 0, flags [DF], proto TCP (6), length 52)
    rpi34.lan.50462 > rpi33.lan.46656: Flags [.], cksum 0xf464 (correct), ack 11485, win 1323, options [nop,nop,TS val 278096273 ecr 278096265], length 0
1527814480.236004 IP (tos 0x0, ttl 64, id 13479, offset 0, flags [DF], proto TCP (6), length 52)
    rpi36.lan.46656 > rpi33.lan.49740: Flags [.], cksum 0x3296 (correct), ack 9397, win 1331, options [nop,nop,TS val 278096264 ecr 278096265], length 0
1527814480.236050 IP (tos 0x0, ttl 64, id 55820, offset 0, flags [DF], proto TCP (6), length 1096)
    rpi33.lan.57588 > rpi37.lan.46656: Flags [P.], cksum 0x8899 (incorrect -> 0x85e2), seq 8352:9396, ack 7309, win 1324, options [nop,nop,TS val 278096265 ecr 278096248], length 1044
1527814480.236297 IP (tos 0x0, ttl 64, id 5337, offset 0, flags [DF], proto TCP (6), length 52)
    rpi35.lan.46656 > rpi33.lan.43980: Flags [.], cksum 0xac6f (correct), ack 8352, win 1331, options [nop,nop,TS val 278094786 ecr 278096265], length 0
1527814480.236454 IP (tos 0x0, ttl 64, id 5338, offset 0, flags [DF], proto TCP (6), length 52)
    rpi35.lan.46656 > rpi33.lan.43980: Flags [.], cksum 0xa85b (correct), ack 9396, win 1331, options [nop,nop,TS val 278094786 ecr 278096265], length 0
1527814480.236677 IP (tos 0x0, ttl 64, id 49418, offset 0, flags [DF], proto TCP (6), length 52)
    rpi37.lan.46656 > rpi33.lan.57588: Flags [.], cksum 0xea3c (correct), ack 8352, win 1331, options [nop,nop,TS val 278096249 ecr 278096265], length 0
1527814480.236819 IP (tos 0x0, ttl 64, id 49419, offset 0, flags [DF], proto TCP (6), length 52)
    rpi37.lan.46656 > rpi33.lan.57588: Flags [.], cksum 0xe628 (correct), ack 9396, win 1331, options [nop,nop,TS val 278096249 ecr 278096265], length 0
1527814480.413056 IP (tos 0x0, ttl 64, id 49420, offset 0, flags [DF], proto TCP (6), length 1096)
    rpi37.lan.46656 > rpi33.lan.57588: Flags [P.], cksum 0xe9df (correct), seq 7309:8353, ack 9396, win 1332, options [nop,nop,TS val 278096267 ecr 278096265], length 1044
1527814480.414100 IP (tos 0x0, ttl 64, id 13480, offset 0, flags [DF], proto TCP (6), length 1096)
    rpi36.lan.46656 > rpi33.lan.49740: Flags [P.], cksum 0x7ee4 (correct), seq 7308:8352, ack 9397, win 1332, options [nop,nop,TS val 278096282 ecr 278096265], length 1044
1527814480.414309 IP (tos 0x0, ttl 64, id 5339, offset 0, flags [DF], proto TCP (6), length 1096)
    rpi35.lan.46656 > rpi33.lan.43980: Flags [P.], cksum 0x549e (correct), seq 7309:8353, ack 9396, win 1332, options [nop,nop,TS val 278094804 ecr 278096265], length 1044
1527814480.447825 IP (tos 0x0, ttl 64, id 42352, offset 0, flags [DF], proto TCP (6), length 1096)
    rpi34.lan.50462 > rpi33.lan.46656: Flags [P.], cksum 0xb20f (correct), seq 10440:11484, ack 11485, win 1324, options [nop,nop,TS val 278096294 ecr 278096265], length 1044
1527814480.454541 IP (tos 0x0, ttl 64, id 58879, offset 0, flags [DF], proto TCP (6), length 52)
    rpi33.lan.49740 > rpi36.lan.46656: Flags [.], cksum 0x8484 (incorrect -> 0x2e61), ack 8352, win 1324, options [nop,nop,TS val 278096287 ecr 278096282], length 0
1527814480.454591 IP (tos 0x0, ttl 64, id 35816, offset 0, flags [DF], proto TCP (6), length 52)
    rpi33.lan.43980 > rpi35.lan.46656: Flags [.], cksum 0x8483 (incorrect -> 0xa426), ack 8353, win 1324, options [nop,nop,TS val 278096287 ecr 278094804], length 0
1527814480.454671 IP (tos 0x0, ttl 64, id 55821, offset 0, flags [DF], proto TCP (6), length 52)
    rpi33.lan.57588 > rpi37.lan.46656: Flags [.], cksum 0x8485 (incorrect -> 0xe1f3), ack 8353, win 1324, options [nop,nop,TS val 278096287 ecr 278096267], length 0
1527814480.494482 IP (tos 0x0, ttl 64, id 5983, offset 0, flags [DF], proto TCP (6), length 52)
    rpi33.lan.46656 > rpi34.lan.50462: Flags [.], cksum 0x8482 (incorrect -> 0xf018), ack 11484, win 1332, options [nop,nop,TS val 278096291 ecr 278096294], length 0
1527814480.527321 IP (tos 0x0, ttl 64, id 13481, offset 0, flags [DF], proto TCP (6), length 1096)
    rpi36.lan.46656 > rpi33.lan.49740: Flags [P.], cksum 0xa018 (correct), seq 8352:9396, ack 9397, win 1332, options [nop,nop,TS val 278096293 ecr 278096287], length 1044
1527814480.527462 IP (tos 0x0, ttl 64, id 58880, offset 0, flags [DF], proto TCP (6), length 52)
    rpi33.lan.49740 > rpi36.lan.46656: Flags [.], cksum 0x8484 (incorrect -> 0x2a3c), ack 9396, win 1323, options [nop,nop,TS val 278096294 ecr 278096293], length 0
1527814480.527563 IP (tos 0x0, ttl 64, id 5340, offset 0, flags [DF], proto TCP (6), length 1096)
    rpi35.lan.46656 > rpi33.lan.43980: Flags [P.], cksum 0xa689 (correct), seq 8353:9397, ack 9396, win 1332, options [nop,nop,TS val 278094815 ecr 278096287], length 1044
1527814480.527620 IP (tos 0x0, ttl 64, id 35817, offset 0, flags [DF], proto TCP (6), length 52)
    rpi33.lan.43980 > rpi35.lan.46656: Flags [.], cksum 0x8483 (incorrect -> 0xa001), ack 9397, win 1323, options [nop,nop,TS val 278096294 ecr 278094815], length 0
1527814480.528232 IP (tos 0x0, ttl 64, id 49421, offset 0, flags [DF], proto TCP (6), length 1096)
    rpi37.lan.46656 > rpi33.lan.57588: Flags [P.], cksum 0xe6e1 (correct), seq 8353:9397, ack 9396, win 1332, options [nop,nop,TS val 278096278 ecr 278096287], length 1044
1527814480.528293 IP (tos 0x0, ttl 64, id 55822, offset 0, flags [DF], proto TCP (6), length 52)
    rpi33.lan.57588 > rpi37.lan.46656: Flags [.], cksum 0x8485 (incorrect -> 0xddce), ack 9397, win 1323, options [nop,nop,TS val 278096294 ecr 278096278], length 0
1527814480.528868 IP (tos 0x0, ttl 64, id 35818, offset 0, flags [DF], proto TCP (6), length 1096)
    rpi33.lan.43980 > rpi35.lan.46656: Flags [P.], cksum 0x8897 (incorrect -> 0xce68), seq 9396:10440, ack 9397, win 1324, options [nop,nop,TS val 278096294 ecr 278094815], length 1044
1527814480.529267 IP (tos 0x0, ttl 64, id 58881, offset 0, flags [DF], proto TCP (6), length 1096)
    rpi33.lan.49740 > rpi36.lan.46656: Flags [P.], cksum 0x8898 (incorrect -> 0x855e), seq 9397:10441, ack 9396, win 1324, options [nop,nop,TS val 278096294 ecr 278096293], length 1044
1527814480.529455 IP (tos 0x0, ttl 64, id 5984, offset 0, flags [DF], proto TCP (6), length 1096)
    rpi33.lan.46656 > rpi34.lan.50462: Flags [P.], cksum 0x5688 (correct), seq 11485:12529, ack 11484, win 1332, options [nop,nop,TS val 278096294 ecr 278096294], length 1044
1527814480.529629 IP (tos 0x0, ttl 64, id 5341, offset 0, flags [DF], proto TCP (6), length 52)
    rpi35.lan.46656 > rpi33.lan.43980: Flags [.], cksum 0x9be4 (correct), ack 10440, win 1331, options [nop,nop,TS val 278094816 ecr 278096294], length 0
1527814480.529707 IP (tos 0x0, ttl 64, id 55823, offset 0, flags [DF], proto TCP (6), length 1096)
    rpi33.lan.57588 > rpi37.lan.46656: Flags [P.], cksum 0x8899 (incorrect -> 0xd3c0), seq 9396:10440, ack 9397, win 1324, options [nop,nop,TS val 278096294 ecr 278096278], length 1044
1527814480.530045 IP (tos 0x0, ttl 64, id 13482, offset 0, flags [DF], proto TCP (6), length 52)
    rpi36.lan.46656 > rpi33.lan.49740: Flags [.], cksum 0x261f (correct), ack 10441, win 1331, options [nop,nop,TS val 278096294 ecr 278096294], length 0
1527814480.530251 IP (tos 0x0, ttl 64, id 42353, offset 0, flags [DF], proto TCP (6), length 52)
    rpi34.lan.50462 > rpi33.lan.46656: Flags [.], cksum 0xec01 (correct), ack 12529, win 1323, options [nop,nop,TS val 278096303 ecr 278096294], length 0
1527814480.530482 IP (tos 0x0, ttl 64, id 49422, offset 0, flags [DF], proto TCP (6), length 52)
    rpi37.lan.46656 > rpi33.lan.57588: Flags [.], cksum 0xd9b2 (correct), ack 10440, win 1331, options [nop,nop,TS val 278096278 ecr 278096294], length 0
1527814480.550725 IP (tos 0x0, ttl 64, id 42354, offset 0, flags [DF], proto TCP (6), length 1096)
    rpi34.lan.50462 > rpi33.lan.46656: Flags [P.], cksum 0xf79a (correct), seq 11484:12528, ack 12529, win 1324, options [nop,nop,TS val 278096305 ecr 278096294], length 1044
1527814480.550891 IP (tos 0x0, ttl 64, id 5985, offset 0, flags [DF], proto TCP (6), length 52)
    rpi33.lan.46656 > rpi34.lan.50462: Flags [.], cksum 0x8482 (incorrect -> 0xe7e1), ack 12528, win 1331, options [nop,nop,TS val 278096296 ecr 278096305], length 0
1527814480.632050 IP (tos 0x0, ttl 64, id 49423, offset 0, flags [DF], proto TCP (6), length 1096)
    rpi37.lan.46656 > rpi33.lan.57588: Flags [P.], cksum 0x6b42 (correct), seq 9397:10441, ack 10440, win 1332, options [nop,nop,TS val 278096288 ecr 278096294], length 1044
1527814480.640636 IP (tos 0x0, ttl 64, id 13483, offset 0, flags [DF], proto TCP (6), length 1096)
    rpi36.lan.46656 > rpi33.lan.49740: Flags [P.], cksum 0xc066 (correct), seq 9396:10440, ack 10441, win 1332, options [nop,nop,TS val 278096305 ecr 278096294], length 1044
1527814480.642198 IP (tos 0x0, ttl 64, id 5342, offset 0, flags [DF], proto TCP (6), length 1096)
    rpi35.lan.46656 > rpi33.lan.43980: Flags [P.], cksum 0x31ed (correct), seq 9397:10441, ack 10440, win 1332, options [nop,nop,TS val 278094827 ecr 278096294], length 1044
1527814480.643065 IP (tos 0x0, ttl 64, id 55824, offset 0, flags [DF], proto TCP (6), length 1096)
    rpi33.lan.57588 > rpi37.lan.46656: Flags [P.], cksum 0x8899 (incorrect -> 0x38ee), seq 10440:11484, ack 10441, win 1324, options [nop,nop,TS val 278096305 ecr 278096288], length 1044
1527814480.643378 IP (tos 0x0, ttl 64, id 58882, offset 0, flags [DF], proto TCP (6), length 1096)
    rpi33.lan.49740 > rpi36.lan.46656: Flags [P.], cksum 0x8898 (incorrect -> 0x9f4b), seq 10441:11485, ack 10440, win 1324, options [nop,nop,TS val 278096305 ecr 278096305], length 1044
1527814480.643495 IP (tos 0x0, ttl 64, id 35819, offset 0, flags [DF], proto TCP (6), length 1096)
    rpi33.lan.43980 > rpi35.lan.46656: Flags [P.], cksum 0x8897 (incorrect -> 0x94bf), seq 10440:11484, ack 10441, win 1324, options [nop,nop,TS val 278096305 ecr 278094827], length 1044
1527814480.643653 IP (tos 0x0, ttl 64, id 5986, offset 0, flags [DF], proto TCP (6), length 1096)
    rpi33.lan.46656 > rpi34.lan.50462: Flags [P.], cksum 0x8623 (correct), seq 12529:13573, ack 12528, win 1332, options [nop,nop,TS val 278096305 ecr 278096305], length 1044
1527814480.643891 IP (tos 0x0, ttl 64, id 49424, offset 0, flags [DF], proto TCP (6), length 52)
    rpi37.lan.46656 > rpi33.lan.57588: Flags [.], cksum 0xd173 (correct), ack 11484, win 1331, options [nop,nop,TS val 278096290 ecr 278096305], length 0
1527814480.644256 IP (tos 0x0, ttl 64, id 5343, offset 0, flags [DF], proto TCP (6), length 52)
    rpi35.lan.46656 > rpi33.lan.43980: Flags [.], cksum 0x93a6 (correct), ack 11484, win 1331, options [nop,nop,TS val 278094827 ecr 278096305], length 0
1527814480.644258 IP (tos 0x0, ttl 64, id 13484, offset 0, flags [DF], proto TCP (6), length 52)
    rpi36.lan.46656 > rpi33.lan.49740: Flags [.], cksum 0x1de1 (correct), ack 11485, win 1331, options [nop,nop,TS val 278096305 ecr 278096305], length 0
1527814480.657045 IP (tos 0x0, ttl 64, id 42355, offset 0, flags [DF], proto TCP (6), length 1096)
    rpi34.lan.50462 > rpi33.lan.46656: Flags [P.], cksum 0xd826 (correct), seq 12528:13572, ack 13573, win 1324, options [nop,nop,TS val 278096315 ecr 278096305], length 1044
