1527815098.667759 IP (tos 0x0, ttl 64, id 17412, offset 0, flags [DF], proto TCP (6), length 1096)
    rpi36.lan.46656 > rpi33.lan.49740: Flags [P.], cksum 0xed7b (correct), seq 1465910205:1465911249, ack 571327339, win 1332, options [nop,nop,TS val 278158108 ecr 278157908], length 1044
1527815098.668945 IP (tos 0x0, ttl 64, id 9127, offset 0, flags [DF], proto TCP (6), length 1096)
    rpi35.lan.46656 > rpi33.lan.43980: Flags [P.], cksum 0x1af3 (correct), seq 242071889:242072933, ack 1149687249, win 1332, options [nop,nop,TS val 278156630 ecr 278157908], length 1044
1527815098.669240 IP (tos 0x0, ttl 64, id 53290, offset 0, flags [DF], proto TCP (6), length 1096)
    rpi37.lan.46656 > rpi33.lan.57588: Flags [P.], cksum 0x8964 (correct), seq 887190874:887191918, ack 3677829529, win 1332, options [nop,nop,TS val 278158092 ecr 278157908], length 1044
1527815098.676201 IP (tos 0x0, ttl 64, id 62416, offset 0, flags [DF], proto TCP (6), length 1096)
    rpi33.lan.49740 > rpi36.lan.46656: Flags [P.], cksum 0x8898 (incorrect -> 0x49df), seq 1:1045, ack 1044, win 1324, options [nop,nop,TS val 278158109 ecr 278158108], length 1044
1527815098.676243 IP (tos 0x0, ttl 64, id 39371, offset 0, flags [DF], proto TCP (6), length 1096)
    rpi33.lan.43980 > rpi35.lan.46656: Flags [P.], cksum 0x8897 (incorrect -> 0x44ce), seq 1:1045, ack 1044, win 1324, options [nop,nop,TS val 278158109 ecr 278156630], length 1044
1527815098.676260 IP (tos 0x0, ttl 64, id 59350, offset 0, flags [DF], proto TCP (6), length 1096)
    rpi33.lan.57588 > rpi37.lan.46656: Flags [P.], cksum 0x8899 (incorrect -> 0x2b9a), seq 1:1045, ack 1044, win 1324, options [nop,nop,TS val 278158109 ecr 278158092], length 1044
1527815098.676447 IP (tos 0x0, ttl 64, id 9699, offset 0, flags [DF], proto TCP (6), length 1096)
    rpi33.lan.46656 > rpi34.lan.50462: Flags [P.], cksum 0x9f9f (correct), seq 2416079340:2416080384, ack 1114329915, win 1332, options [nop,nop,TS val 278158109 ecr 278157917], length 1044
1527815098.676986 IP (tos 0x0, ttl 64, id 17413, offset 0, flags [DF], proto TCP (6), length 52)
    rpi36.lan.46656 > rpi33.lan.49740: Flags [.], cksum 0x547f (correct), ack 1045, win 1331, options [nop,nop,TS val 278158108 ecr 278158109], length 0
1527815098.676988 IP (tos 0x0, ttl 64, id 9128, offset 0, flags [DF], proto TCP (6), length 52)
    rpi35.lan.46656 > rpi33.lan.43980: Flags [.], cksum 0xcf45 (correct), ack 1045, win 1331, options [nop,nop,TS val 278156630 ecr 278158109], length 0
1527815098.677185 IP (tos 0x0, ttl 64, id 53291, offset 0, flags [DF], proto TCP (6), length 52)
    rpi37.lan.46656 > rpi33.lan.57588: Flags [.], cksum 0xb76e (correct), ack 1045, win 1331, options [nop,nop,TS val 278158093 ecr 278158109], length 0
1527815098.679306 IP (tos 0x0, ttl 64, id 46079, offset 0, flags [DF], proto TCP (6), length 1096)
    rpi34.lan.50462 > rpi33.lan.46656: Flags [P.], cksum 0xe8af (correct), seq 1:1045, ack 1044, win 1324, options [nop,nop,TS val 278158118 ecr 278158109], length 1044
1527815098.679377 IP (tos 0x0, ttl 64, id 9700, offset 0, flags [DF], proto TCP (6), length 52)
    rpi33.lan.46656 > rpi34.lan.50462: Flags [.], cksum 0x8482 (incorrect -> 0xfaa5), ack 1045, win 1331, options [nop,nop,TS val 278158109 ecr 278158118], length 0
1527815100.670917 IP (tos 0x0, ttl 64, id 17414, offset 0, flags [DF], proto TCP (6), length 1096)
    rpi36.lan.46656 > rpi33.lan.49740: Flags [P.], cksum 0xce46 (correct), seq 1044:2088, ack 1045, win 1332, options [nop,nop,TS val 278158308 ecr 278158109], length 1044
1527815100.672273 IP (tos 0x0, ttl 64, id 53292, offset 0, flags [DF], proto TCP (6), length 1096)
    rpi37.lan.46656 > rpi33.lan.57588: Flags [P.], cksum 0xb6b9 (correct), seq 1044:2088, ack 1045, win 1332, options [nop,nop,TS val 278158293 ecr 278158109], length 1044
1527815100.672653 IP (tos 0x0, ttl 64, id 9129, offset 0, flags [DF], proto TCP (6), length 1096)
    rpi35.lan.46656 > rpi33.lan.43980: Flags [P.], cksum 0x5a25 (correct), seq 1044:2088, ack 1045, win 1332, options [nop,nop,TS val 278156830 ecr 278158109], length 1044
1527815100.681677 IP (tos 0x0, ttl 64, id 9701, offset 0, flags [DF], proto TCP (6), length 1096)
    rpi33.lan.46656 > rpi34.lan.50462: Flags [P.], cksum 0x346f (correct), seq 1044:2088, ack 1045, win 1332, options [nop,nop,TS val 278158309 ecr 278158118], length 1044
1527815100.681729 IP (tos 0x0, ttl 64, id 39372, offset 0, flags [DF], proto TCP (6), length 1096)
    rpi33.lan.43980 > rpi35.lan.46656: Flags [P.], cksum 0x8897 (incorrect -> 0xe9b1), seq 1045:2089, ack 2088, win 1324, options [nop,nop,TS val 278158309 ecr 278156830], length 1044
1527815100.681792 IP (tos 0x0, ttl 64, id 62417, offset 0, flags [DF], proto TCP (6), length 1096)
    rpi33.lan.49740 > rpi36.lan.46656: Flags [P.], cksum 0x8898 (incorrect -> 0x4eb3), seq 1045:2089, ack 2088, win 1324, options [nop,nop,TS val 278158309 ecr 278158308], length 1044
1527815100.681909 IP (tos 0x0, ttl 64, id 59351, offset 0, flags [DF], proto TCP (6), length 1096)
    rpi33.lan.57588 > rpi37.lan.46656: Flags [P.], cksum 0x8899 (incorrect -> 0x99ed), seq 1045:2089, ack 2088, win 1324, options [nop,nop,TS val 278158309 ecr 278158293], length 1044
1527815100.682587 IP (tos 0x0, ttl 64, id 9130, offset 0, flags [DF], proto TCP (6), length 52)
    rpi35.lan.46656 > rpi33.lan.43980: Flags [.], cksum 0xc58c (correct), ack 2089, win 1331, options [nop,nop,TS val 278156831 ecr 278158309], length 0
1527815100.682589 IP (tos 0x0, ttl 64, id 17415, offset 0, flags [DF], proto TCP (6), length 52)
    rpi36.lan.46656 > rpi33.lan.49740: Flags [.], cksum 0x4ac6 (correct), ack 2089, win 1331, options [nop,nop,TS val 278158309 ecr 278158309], length 0
1527815100.682856 IP (tos 0x0, ttl 64, id 46080, offset 0, flags [DF], proto TCP (6), length 1096)
    rpi34.lan.50462 > rpi33.lan.46656: Flags [P.], cksum 0x55a0 (correct), seq 1045:2089, ack 1044, win 1324, options [nop,nop,TS val 278158318 ecr 278158109], length 1044
1527815100.682928 IP (tos 0x0, ttl 64, id 9702, offset 0, flags [DF], proto TCP (6), length 52)
    rpi33.lan.46656 > rpi34.lan.50462: Flags [.], cksum 0x8482 (incorrect -> 0xf0ed), ack 2089, win 1331, options [nop,nop,TS val 278158309 ecr 278158318], length 0
1527815100.682858 IP (tos 0x0, ttl 64, id 53293, offset 0, flags [DF], proto TCP (6), length 52)
    rpi37.lan.46656 > rpi33.lan.57588: Flags [.], cksum 0xadb5 (correct), ack 2089, win 1331, options [nop,nop,TS val 278158294 ecr 278158309], length 0
1527815100.727467 IP (tos 0x0, ttl 64, id 46081, offset 0, flags [DF], proto TCP (6), length 52)
    rpi34.lan.50462 > rpi33.lan.46656: Flags [.], cksum 0xf0ef (correct), ack 2088, win 1324, options [nop,nop,TS val 278158323 ecr 278158309], length 0
1527815102.674412 IP (tos 0x0, ttl 64, id 17416, offset 0, flags [DF], proto TCP (6), length 1096)
    rpi36.lan.46656 > rpi33.lan.49740: Flags [P.], cksum 0x6e59 (correct), seq 2088:3132, ack 2089, win 1332, options [nop,nop,TS val 278158508 ecr 278158309], length 1044
1527815102.675729 IP (tos 0x0, ttl 64, id 53294, offset 0, flags [DF], proto TCP (6), length 1096)
    rpi37.lan.46656 > rpi33.lan.57588: Flags [P.], cksum 0xcd9b (correct), seq 2088:3132, ack 2089, win 1332, options [nop,nop,TS val 278158493 ecr 278158309], length 1044
1527815102.675998 IP (tos 0x0, ttl 64, id 9131, offset 0, flags [DF], proto TCP (6), length 1096)
    rpi35.lan.46656 > rpi33.lan.43980: Flags [P.], cksum 0x64b6 (correct), seq 2088:3132, ack 2089, win 1332, options [nop,nop,TS val 278157030 ecr 278158309], length 1044
1527815102.681682 IP (tos 0x0, ttl 64, id 62418, offset 0, flags [DF], proto TCP (6), length 1096)
    rpi33.lan.49740 > rpi36.lan.46656: Flags [P.], cksum 0x8898 (incorrect -> 0x51e8), seq 2089:3133, ack 3132, win 1324, options [nop,nop,TS val 278158509 ecr 278158508], length 1044
1527815102.681729 IP (tos 0x0, ttl 64, id 59352, offset 0, flags [DF], proto TCP (6), length 1096)
    rpi33.lan.57588 > rpi37.lan.46656: Flags [P.], cksum 0x8899 (incorrect -> 0x71f5), seq 2089:3133, ack 3132, win 1324, options [nop,nop,TS val 278158509 ecr 278158493], length 1044
1527815102.681754 IP (tos 0x0, ttl 64, id 9703, offset 0, flags [DF], proto TCP (6), length 1096)
    rpi33.lan.46656 > rpi34.lan.50462: Flags [P.], cksum 0xd0a7 (correct), seq 2088:3132, ack 2089, win 1332, options [nop,nop,TS val 278158509 ecr 278158323], length 1044
1527815102.681926 IP (tos 0x0, ttl 64, id 39373, offset 0, flags [DF], proto TCP (6), length 1096)
    rpi33.lan.43980 > rpi35.lan.46656: Flags [P.], cksum 0x8897 (incorrect -> 0xe91c), seq 2089:3133, ack 3132, win 1324, options [nop,nop,TS val 278158509 ecr 278157030], length 1044
1527815102.682457 IP (tos 0x0, ttl 64, id 17417, offset 0, flags [DF], proto TCP (6), length 52)
    rpi36.lan.46656 > rpi33.lan.49740: Flags [.], cksum 0x410e (correct), ack 3133, win 1331, options [nop,nop,TS val 278158509 ecr 278158509], length 0
1527815102.682460 IP (tos 0x0, ttl 64, id 53295, offset 0, flags [DF], proto TCP (6), length 52)
    rpi37.lan.46656 > rpi33.lan.57588: Flags [.], cksum 0xa3fd (correct), ack 3133, win 1331, options [nop,nop,TS val 278158494 ecr 278158509], length 0
1527815102.682659 IP (tos 0x0, ttl 64, id 46082, offset 0, flags [DF], proto TCP (6), length 52)
    rpi34.lan.50462 > rpi33.lan.46656: Flags [.], cksum 0xeb51 (correct), ack 3132, win 1323, options [nop,nop,TS val 278158518 ecr 278158509], length 0
1527815102.682660 IP (tos 0x0, ttl 64, id 9132, offset 0, flags [DF], proto TCP (6), length 52)
    rpi35.lan.46656 > rpi33.lan.43980: Flags [.], cksum 0xbbd4 (correct), ack 3133, win 1331, options [nop,nop,TS val 278157031 ecr 278158509], length 0
1527815102.686356 IP (tos 0x0, ttl 64, id 46083, offset 0, flags [DF], proto TCP (6), length 1096)
    rpi34.lan.50462 > rpi33.lan.46656: Flags [P.], cksum 0xe2ba (correct), seq 2089:3133, ack 3132, win 1324, options [nop,nop,TS val 278158518 ecr 278158509], length 1044
1527815102.686424 IP (tos 0x0, ttl 64, id 9704, offset 0, flags [DF], proto TCP (6), length 52)
    rpi33.lan.46656 > rpi34.lan.50462: Flags [.], cksum 0x8482 (incorrect -> 0xe734), ack 3133, win 1331, options [nop,nop,TS val 278158510 ecr 278158518], length 0
1527815103.026222 IP (tos 0x0, ttl 64, id 17418, offset 0, flags [DF], proto TCP (6), length 1096)
    rpi36.lan.46656 > rpi33.lan.49740: Flags [P.], cksum 0xc687 (correct), seq 3132:4176, ack 3133, win 1332, options [nop,nop,TS val 278158543 ecr 278158509], length 1044
1527815103.027053 IP (tos 0x0, ttl 64, id 62419, offset 0, flags [DF], proto TCP (6), length 1096)
    rpi33.lan.49740 > rpi36.lan.46656: Flags [P.], cksum 0x8898 (incorrect -> 0x5d00), seq 3133:4177, ack 4176, win 1324, options [nop,nop,TS val 278158544 ecr 278158543], length 1044
1527815103.027838 IP (tos 0x0, ttl 64, id 17419, offset 0, flags [DF], proto TCP (6), length 52)
    rpi36.lan.46656 > rpi33.lan.49740: Flags [.], cksum 0x38a0 (correct), ack 4177, win 1331, options [nop,nop,TS val 278158544 ecr 278158544], length 0
1527815103.028007 IP (tos 0x0, ttl 64, id 62420, offset 0, flags [DF], proto TCP (6), length 1096)
    rpi33.lan.49740 > rpi36.lan.46656: Flags [P.], cksum 0x8898 (incorrect -> 0x3a54), seq 4177:5221, ack 4176, win 1324, options [nop,nop,TS val 278158544 ecr 278158544], length 1044
1527815103.028749 IP (tos 0x0, ttl 64, id 17420, offset 0, flags [DF], proto TCP (6), length 52)
    rpi36.lan.46656 > rpi33.lan.49740: Flags [.], cksum 0x348c (correct), ack 5221, win 1331, options [nop,nop,TS val 278158544 ecr 278158544], length 0
1527815103.029456 IP (tos 0x0, ttl 64, id 17421, offset 0, flags [DF], proto TCP (6), length 1096)
    rpi36.lan.46656 > rpi33.lan.49740: Flags [P.], cksum 0x1d74 (correct), seq 4176:5220, ack 5221, win 1332, options [nop,nop,TS val 278158544 ecr 278158544], length 1044
1527815103.074515 IP (tos 0x0, ttl 64, id 62421, offset 0, flags [DF], proto TCP (6), length 52)
    rpi33.lan.49740 > rpi36.lan.46656: Flags [.], cksum 0x8484 (incorrect -> 0x307a), ack 5220, win 1324, options [nop,nop,TS val 278158549 ecr 278158544], length 0
1527815104.677788 IP (tos 0x0, ttl 64, id 17422, offset 0, flags [DF], proto TCP (6), length 1096)
    rpi36.lan.46656 > rpi33.lan.49740: Flags [P.], cksum 0x7d6d (correct), seq 5220:6264, ack 5221, win 1332, options [nop,nop,TS val 278158709 ecr 278158549], length 1044
1527815104.677975 IP (tos 0x0, ttl 64, id 62422, offset 0, flags [DF], proto TCP (6), length 52)
    rpi33.lan.49740 > rpi36.lan.46656: Flags [.], cksum 0x8484 (incorrect -> 0x2b22), ack 6264, win 1323, options [nop,nop,TS val 278158709 ecr 278158709], length 0
1527815104.679075 IP (tos 0x0, ttl 64, id 9133, offset 0, flags [DF], proto TCP (6), length 1096)
    rpi35.lan.46656 > rpi33.lan.43980: Flags [P.], cksum 0xd487 (correct), seq 3132:4176, ack 3133, win 1332, options [nop,nop,TS val 278157231 ecr 278158509], length 1044
1527815104.679299 IP (tos 0x0, ttl 64, id 53296, offset 0, flags [DF], proto TCP (6), length 1096)
    rpi37.lan.46656 > rpi33.lan.57588: Flags [P.], cksum 0x0c97 (correct), seq 3132:4176, ack 3133, win 1332, options [nop,nop,TS val 278158693 ecr 278158509], length 1044
1527815104.689649 IP (tos 0x0, ttl 64, id 46084, offset 0, flags [DF], proto TCP (6), length 1096)
    rpi34.lan.50462 > rpi33.lan.46656: Flags [P.], cksum 0xd8eb (correct), seq 3133:4177, ack 3132, win 1324, options [nop,nop,TS val 278158719 ecr 278158510], length 1044
1527815104.689807 IP (tos 0x0, ttl 64, id 9705, offset 0, flags [DF], proto TCP (6), length 52)
    rpi33.lan.46656 > rpi34.lan.50462: Flags [.], cksum 0x8482 (incorrect -> 0xe18f), ack 4177, win 1331, options [nop,nop,TS val 278158710 ecr 278158719], length 0
1527815104.693437 IP (tos 0x0, ttl 64, id 59353, offset 0, flags [DF], proto TCP (6), length 1096)
    rpi33.lan.57588 > rpi37.lan.46656: Flags [P.], cksum 0x8899 (incorrect -> 0x818b), seq 3133:4177, ack 4176, win 1324, options [nop,nop,TS val 278158710 ecr 278158693], length 1044
1527815104.693502 IP (tos 0x0, ttl 64, id 62423, offset 0, flags [DF], proto TCP (6), length 1096)
    rpi33.lan.49740 > rpi36.lan.46656: Flags [P.], cksum 0x8898 (incorrect -> 0xd248), seq 5221:6265, ack 6264, win 1324, options [nop,nop,TS val 278158710 ecr 278158709], length 1044
1527815104.693522 IP (tos 0x0, ttl 64, id 39374, offset 0, flags [DF], proto TCP (6), length 1096)
    rpi33.lan.43980 > rpi35.lan.46656: Flags [P.], cksum 0x8897 (incorrect -> 0x745b), seq 3133:4177, ack 4176, win 1324, options [nop,nop,TS val 278158710 ecr 278157231], length 1044
1527815104.693980 IP (tos 0x0, ttl 64, id 9706, offset 0, flags [DF], proto TCP (6), length 1096)
    rpi33.lan.46656 > rpi34.lan.50462: Flags [P.], cksum 0x5b73 (correct), seq 3132:4176, ack 4177, win 1332, options [nop,nop,TS val 278158710 ecr 278158719], length 1044
1527815104.694228 IP (tos 0x0, ttl 64, id 53297, offset 0, flags [DF], proto TCP (6), length 52)
    rpi37.lan.46656 > rpi33.lan.57588: Flags [.], cksum 0x9a43 (correct), ack 4177, win 1331, options [nop,nop,TS val 278158695 ecr 278158710], length 0
1527815104.694406 IP (tos 0x0, ttl 64, id 9134, offset 0, flags [DF], proto TCP (6), length 52)
    rpi35.lan.46656 > rpi33.lan.43980: Flags [.], cksum 0xb21a (correct), ack 4177, win 1331, options [nop,nop,TS val 278157232 ecr 278158710], length 0
1527815104.737188 IP (tos 0x0, ttl 64, id 17423, offset 0, flags [DF], proto TCP (6), length 52)
    rpi36.lan.46656 > rpi33.lan.49740: Flags [.], cksum 0x26fe (correct), ack 6265, win 1332, options [nop,nop,TS val 278158715 ecr 278158710], length 0
1527815104.737480 IP (tos 0x0, ttl 64, id 46085, offset 0, flags [DF], proto TCP (6), length 52)
    rpi34.lan.50462 > rpi33.lan.46656: Flags [.], cksum 0xdd7d (correct), ack 4176, win 1324, options [nop,nop,TS val 278158724 ecr 278158710], length 0
1527815104.988119 IP (tos 0x0, ttl 64, id 62424, offset 0, flags [DF], proto TCP (6), length 1096)
    rpi33.lan.49740 > rpi36.lan.46656: Flags [P.], cksum 0x8898 (incorrect -> 0x1c8f), seq 6265:7309, ack 6264, win 1324, options [nop,nop,TS val 278158740 ecr 278158715], length 1044
1527815104.988306 IP (tos 0x0, ttl 64, id 9707, offset 0, flags [DF], proto TCP (6), length 1096)
    rpi33.lan.46656 > rpi34.lan.50462: Flags [P.], cksum 0xcc17 (correct), seq 4176:5220, ack 4177, win 1332, options [nop,nop,TS val 278158740 ecr 278158724], length 1044
1527815104.988516 IP (tos 0x0, ttl 64, id 59354, offset 0, flags [DF], proto TCP (6), length 1096)
    rpi33.lan.57588 > rpi37.lan.46656: Flags [P.], cksum 0x8899 (incorrect -> 0x6dc9), seq 4177:5221, ack 4176, win 1324, options [nop,nop,TS val 278158740 ecr 278158695], length 1044
1527815104.988543 IP (tos 0x0, ttl 64, id 39375, offset 0, flags [DF], proto TCP (6), length 1096)
    rpi33.lan.43980 > rpi35.lan.46656: Flags [P.], cksum 0x8897 (incorrect -> 0x387c), seq 4177:5221, ack 4176, win 1324, options [nop,nop,TS val 278158740 ecr 278157232], length 1044
1527815104.988997 IP (tos 0x0, ttl 64, id 17424, offset 0, flags [DF], proto TCP (6), length 52)
    rpi36.lan.46656 > rpi33.lan.49740: Flags [.], cksum 0x22b4 (correct), ack 7309, win 1331, options [nop,nop,TS val 278158740 ecr 278158740], length 0
1527815104.989151 IP (tos 0x0, ttl 64, id 46086, offset 0, flags [DF], proto TCP (6), length 52)
    rpi34.lan.50462 > rpi33.lan.46656: Flags [.], cksum 0xd933 (correct), ack 5220, win 1323, options [nop,nop,TS val 278158749 ecr 278158740], length 0
1527815104.989348 IP (tos 0x0, ttl 64, id 53298, offset 0, flags [DF], proto TCP (6), length 52)
    rpi37.lan.46656 > rpi33.lan.57588: Flags [.], cksum 0x95f4 (correct), ack 5221, win 1331, options [nop,nop,TS val 278158724 ecr 278158740], length 0
1527815104.989349 IP (tos 0x0, ttl 64, id 9135, offset 0, flags [DF], proto TCP (6), length 52)
    rpi35.lan.46656 > rpi33.lan.43980: Flags [.], cksum 0xadca (correct), ack 5221, win 1331, options [nop,nop,TS val 278157262 ecr 278158740], length 0
1527815105.094238 IP (tos 0x0, ttl 64, id 17425, offset 0, flags [DF], proto TCP (6), length 1096)
    rpi36.lan.46656 > rpi33.lan.49740: Flags [P.], cksum 0x5d49 (correct), seq 6264:7308, ack 7309, win 1332, options [nop,nop,TS val 278158750 ecr 278158740], length 1044
1527815105.094914 IP (tos 0x0, ttl 64, id 46087, offset 0, flags [DF], proto TCP (6), length 1096)
    rpi34.lan.50462 > rpi33.lan.46656: Flags [P.], cksum 0xc57e (correct), seq 4177:5221, ack 5220, win 1324, options [nop,nop,TS val 278158759 ecr 278158740], length 1044
1527815105.095107 IP (tos 0x0, ttl 64, id 53299, offset 0, flags [DF], proto TCP (6), length 1096)
    rpi37.lan.46656 > rpi33.lan.57588: Flags [P.], cksum 0xe84a (correct), seq 4176:5220, ack 5221, win 1332, options [nop,nop,TS val 278158735 ecr 278158740], length 1044
1527815105.097078 IP (tos 0x0, ttl 64, id 9136, offset 0, flags [DF], proto TCP (6), length 1096)
    rpi35.lan.46656 > rpi33.lan.43980: Flags [P.], cksum 0x6538 (correct), seq 4176:5220, ack 5221, win 1332, options [nop,nop,TS val 278157272 ecr 278158740], length 1044
1527815105.134524 IP (tos 0x0, ttl 64, id 62425, offset 0, flags [DF], proto TCP (6), length 52)
    rpi33.lan.49740 > rpi36.lan.46656: Flags [.], cksum 0x8484 (incorrect -> 0x1e8e), ack 7308, win 1324, options [nop,nop,TS val 278158755 ecr 278158750], length 0
1527815105.144488 IP (tos 0x0, ttl 64, id 39376, offset 0, flags [DF], proto TCP (6), length 52)
    rpi33.lan.43980 > rpi35.lan.46656: Flags [.], cksum 0x8483 (incorrect -> 0xa9a3), ack 5220, win 1324, options [nop,nop,TS val 278158756 ecr 278157272], length 0
1527815105.144513 IP (tos 0x0, ttl 64, id 9708, offset 0, flags [DF], proto TCP (6), length 52)
    rpi33.lan.46656 > rpi34.lan.50462: Flags [.], cksum 0x8482 (incorrect -> 0xd4fc), ack 5221, win 1332, options [nop,nop,TS val 278158756 ecr 278158759], length 0
1527815105.144548 IP (tos 0x0, ttl 64, id 59355, offset 0, flags [DF], proto TCP (6), length 52)
    rpi33.lan.57588 > rpi37.lan.46656: Flags [.], cksum 0x8485 (incorrect -> 0x91cc), ack 5220, win 1324, options [nop,nop,TS val 278158756 ecr 278158735], length 0
1527815105.199375 IP (tos 0x0, ttl 64, id 17426, offset 0, flags [DF], proto TCP (6), length 1096)
    rpi36.lan.46656 > rpi33.lan.49740: Flags [P.], cksum 0x19b4 (correct), seq 7308:8352, ack 7309, win 1332, options [nop,nop,TS val 278158761 ecr 278158755], length 1044
1527815105.199454 IP (tos 0x0, ttl 64, id 62426, offset 0, flags [DF], proto TCP (6), length 52)
    rpi33.lan.49740 > rpi36.lan.46656: Flags [.], cksum 0x8484 (incorrect -> 0x1a6a), ack 8352, win 1323, options [nop,nop,TS val 278158761 ecr 278158761], length 0
1527815105.199565 IP (tos 0x0, ttl 64, id 17427, offset 0, flags [DF], proto TCP (6), length 1096)
    rpi36.lan.46656 > rpi33.lan.49740: Flags [P.], cksum 0x64f3 (correct), seq 8352:9396, ack 7309, win 1332, options [nop,nop,TS val 278158761 ecr 278158755], length 1044
1527815105.199623 IP (tos 0x0, ttl 64, id 62427, offset 0, flags [DF], proto TCP (6), length 52)
    rpi33.lan.49740 > rpi36.lan.46656: Flags [.], cksum 0x8484 (incorrect -> 0x1656), ack 9396, win 1323, options [nop,nop,TS val 278158761 ecr 278158761], length 0
1527815105.233932 IP (tos 0x0, ttl 64, id 9137, offset 0, flags [DF], proto TCP (6), length 1096)
    rpi35.lan.46656 > rpi33.lan.43980: Flags [P.], cksum 0x79b3 (correct), seq 5220:6264, ack 5221, win 1332, options [nop,nop,TS val 278157286 ecr 278158756], length 1044
1527815105.234100 IP (tos 0x0, ttl 64, id 39377, offset 0, flags [DF], proto TCP (6), length 52)
    rpi33.lan.43980 > rpi35.lan.46656: Flags [.], cksum 0x8483 (incorrect -> 0xa57a), ack 6264, win 1323, options [nop,nop,TS val 278158764 ecr 278157286], length 0
1527815105.257417 IP (tos 0x0, ttl 64, id 46088, offset 0, flags [DF], proto TCP (6), length 1096)
    rpi34.lan.50462 > rpi33.lan.46656: Flags [P.], cksum 0xd002 (correct), seq 5221:6265, ack 5220, win 1324, options [nop,nop,TS val 278158775 ecr 278158756], length 1044
1527815105.257540 IP (tos 0x0, ttl 64, id 9709, offset 0, flags [DF], proto TCP (6), length 52)
    rpi33.lan.46656 > rpi34.lan.50462: Flags [.], cksum 0x8482 (incorrect -> 0xd0ce), ack 6265, win 1331, options [nop,nop,TS val 278158767 ecr 278158775], length 0
1527815105.300695 IP (tos 0x0, ttl 64, id 17428, offset 0, flags [DF], proto TCP (6), length 1096)
    rpi36.lan.46656 > rpi33.lan.49740: Flags [P.], cksum 0xe793 (correct), seq 9396:10440, ack 7309, win 1332, options [nop,nop,TS val 278158771 ecr 278158761], length 1044
1527815105.300872 IP (tos 0x0, ttl 64, id 62428, offset 0, flags [DF], proto TCP (6), length 52)
    rpi33.lan.49740 > rpi36.lan.46656: Flags [.], cksum 0x8484 (incorrect -> 0x122e), ack 10440, win 1323, options [nop,nop,TS val 278158771 ecr 278158771], length 0
1527815105.365982 IP (tos 0x0, ttl 64, id 9138, offset 0, flags [DF], proto TCP (6), length 1096)
    rpi35.lan.46656 > rpi33.lan.43980: Flags [P.], cksum 0xba48 (correct), seq 6264:7308, ack 5221, win 1332, options [nop,nop,TS val 278157299 ecr 278158764], length 1044
1527815105.366163 IP (tos 0x0, ttl 64, id 39378, offset 0, flags [DF], proto TCP (6), length 52)
    rpi33.lan.43980 > rpi35.lan.46656: Flags [.], cksum 0x8483 (incorrect -> 0xa14b), ack 7308, win 1323, options [nop,nop,TS val 278158778 ecr 278157299], length 0
1527815105.366269 IP (tos 0x0, ttl 64, id 9139, offset 0, flags [DF], proto TCP (6), length 1096)
    rpi35.lan.46656 > rpi33.lan.43980: Flags [P.], cksum 0xf8a5 (correct), seq 7308:8352, ack 5221, win 1332, options [nop,nop,TS val 278157299 ecr 278158764], length 1044
1527815105.366335 IP (tos 0x0, ttl 64, id 39379, offset 0, flags [DF], proto TCP (6), length 52)
    rpi33.lan.43980 > rpi35.lan.46656: Flags [.], cksum 0x8483 (incorrect -> 0x9d37), ack 8352, win 1323, options [nop,nop,TS val 278158778 ecr 278157299], length 0
1527815105.373090 IP (tos 0x0, ttl 64, id 46089, offset 0, flags [DF], proto TCP (6), length 1096)
    rpi34.lan.50462 > rpi33.lan.46656: Flags [P.], cksum 0xf4ce (correct), seq 6265:7309, ack 5220, win 1324, options [nop,nop,TS val 278158787 ecr 278158767], length 1044
1527815105.373280 IP (tos 0x0, ttl 64, id 9710, offset 0, flags [DF], proto TCP (6), length 52)
    rpi33.lan.46656 > rpi34.lan.50462: Flags [.], cksum 0x8482 (incorrect -> 0xcca3), ack 7309, win 1331, options [nop,nop,TS val 278158778 ecr 278158787], length 0
1527815105.373368 IP (tos 0x0, ttl 64, id 46090, offset 0, flags [DF], proto TCP (6), length 1096)
    rpi34.lan.50462 > rpi33.lan.46656: Flags [P.], cksum 0x4f79 (correct), seq 7309:8353, ack 5220, win 1324, options [nop,nop,TS val 278158787 ecr 278158767], length 1044
1527815105.373422 IP (tos 0x0, ttl 64, id 9711, offset 0, flags [DF], proto TCP (6), length 52)
    rpi33.lan.46656 > rpi34.lan.50462: Flags [.], cksum 0x8482 (incorrect -> 0xc88f), ack 8353, win 1331, options [nop,nop,TS val 278158778 ecr 278158787], length 0
1527815105.380220 IP (tos 0x0, ttl 64, id 59356, offset 0, flags [DF], proto TCP (6), length 1096)
    rpi33.lan.57588 > rpi37.lan.46656: Flags [P.], cksum 0x8899 (incorrect -> 0xc8c9), seq 5221:6265, ack 5220, win 1324, options [nop,nop,TS val 278158779 ecr 278158735], length 1044
1527815105.380474 IP (tos 0x0, ttl 64, id 59357, offset 0, flags [DF], proto TCP (6), length 1096)
    rpi33.lan.57588 > rpi37.lan.46656: Flags [P.], cksum 0x8899 (incorrect -> 0xc5b5), seq 6265:7309, ack 5220, win 1324, options [nop,nop,TS val 278158779 ecr 278158735], length 1044
1527815105.380768 IP (tos 0x0, ttl 64, id 9712, offset 0, flags [DF], proto TCP (6), length 1096)
    rpi33.lan.46656 > rpi34.lan.50462: Flags [P.], cksum 0x9896 (correct), seq 5220:6264, ack 8353, win 1332, options [nop,nop,TS val 278158779 ecr 278158787], length 1044
1527815105.380937 IP (tos 0x0, ttl 64, id 9713, offset 0, flags [DF], proto TCP (6), length 1096)
    rpi33.lan.46656 > rpi34.lan.50462: Flags [P.], cksum 0xb0f7 (correct), seq 6264:7308, ack 8353, win 1332, options [nop,nop,TS val 278158779 ecr 278158787], length 1044
1527815105.381069 IP (tos 0x0, ttl 64, id 53300, offset 0, flags [DF], proto TCP (6), length 52)
    rpi37.lan.46656 > rpi33.lan.57588: Flags [.], cksum 0x8d7e (correct), ack 6265, win 1331, options [nop,nop,TS val 278158763 ecr 278158779], length 0
1527815105.381231 IP (tos 0x0, ttl 64, id 53301, offset 0, flags [DF], proto TCP (6), length 52)
    rpi37.lan.46656 > rpi33.lan.57588: Flags [.], cksum 0x896a (correct), ack 7309, win 1331, options [nop,nop,TS val 278158763 ecr 278158779], length 0
1527815105.381298 IP (tos 0x0, ttl 64, id 62429, offset 0, flags [DF], proto TCP (6), length 1096)
    rpi33.lan.49740 > rpi36.lan.46656: Flags [P.], cksum 0x8898 (incorrect -> 0x61c1), seq 7309:8353, ack 10440, win 1324, options [nop,nop,TS val 278158779 ecr 278158771], length 1044
1527815105.381387 IP (tos 0x0, ttl 64, id 39380, offset 0, flags [DF], proto TCP (6), length 1096)
    rpi33.lan.43980 > rpi35.lan.46656: Flags [P.], cksum 0x8897 (incorrect -> 0x992a), seq 5221:6265, ack 8352, win 1324, options [nop,nop,TS val 278158779 ecr 278157299], length 1044
1527815105.381558 IP (tos 0x0, ttl 64, id 39381, offset 0, flags [DF], proto TCP (6), length 1096)
    rpi33.lan.43980 > rpi35.lan.46656: Flags [P.], cksum 0x8897 (incorrect -> 0x088a), seq 6265:7309, ack 8352, win 1324, options [nop,nop,TS val 278158779 ecr 278157299], length 1044
1527815105.381733 IP (tos 0x0, ttl 64, id 46091, offset 0, flags [DF], proto TCP (6), length 52)
    rpi34.lan.50462 > rpi33.lan.46656: Flags [.], cksum 0xc481 (correct), ack 6264, win 1323, options [nop,nop,TS val 278158788 ecr 278158779], length 0
1527815105.381735 IP (tos 0x0, ttl 64, id 46092, offset 0, flags [DF], proto TCP (6), length 52)
    rpi34.lan.50462 > rpi33.lan.46656: Flags [.], cksum 0xc06d (correct), ack 7308, win 1323, options [nop,nop,TS val 278158788 ecr 278158779], length 0
1527815105.382230 IP (tos 0x0, ttl 64, id 17429, offset 0, flags [DF], proto TCP (6), length 52)
    rpi36.lan.46656 > rpi33.lan.49740: Flags [.], cksum 0x0e02 (correct), ack 8353, win 1331, options [nop,nop,TS val 278158779 ecr 278158779], length 0
1527815105.382232 IP (tos 0x0, ttl 64, id 9140, offset 0, flags [DF], proto TCP (6), length 52)
    rpi35.lan.46656 > rpi33.lan.43980: Flags [.], cksum 0x9918 (correct), ack 6265, win 1331, options [nop,nop,TS val 278157301 ecr 278158779], length 0
1527815105.382398 IP (tos 0x0, ttl 64, id 9141, offset 0, flags [DF], proto TCP (6), length 52)
    rpi35.lan.46656 > rpi33.lan.43980: Flags [.], cksum 0x9504 (correct), ack 7309, win 1331, options [nop,nop,TS val 278157301 ecr 278158779], length 0
1527815105.443961 IP (tos 0x0, ttl 64, id 53302, offset 0, flags [DF], proto TCP (6), length 1096)
    rpi37.lan.46656 > rpi33.lan.57588: Flags [P.], cksum 0x3ea9 (correct), seq 5220:6264, ack 7309, win 1332, options [nop,nop,TS val 278158770 ecr 278158779], length 1044
1527815105.444167 IP (tos 0x0, ttl 64, id 59358, offset 0, flags [DF], proto TCP (6), length 52)
    rpi33.lan.57588 > rpi37.lan.46656: Flags [.], cksum 0x8485 (incorrect -> 0x8551), ack 6264, win 1323, options [nop,nop,TS val 278158785 ecr 278158770], length 0
1527815105.444257 IP (tos 0x0, ttl 64, id 53303, offset 0, flags [DF], proto TCP (6), length 1096)
    rpi37.lan.46656 > rpi33.lan.57588: Flags [P.], cksum 0x54e9 (correct), seq 6264:7308, ack 7309, win 1332, options [nop,nop,TS val 278158770 ecr 278158779], length 1044
1527815105.444308 IP (tos 0x0, ttl 64, id 59359, offset 0, flags [DF], proto TCP (6), length 52)
    rpi33.lan.57588 > rpi37.lan.46656: Flags [.], cksum 0x8485 (incorrect -> 0x813d), ack 7308, win 1323, options [nop,nop,TS val 278158785 ecr 278158770], length 0
1527815105.479978 IP (tos 0x0, ttl 64, id 17430, offset 0, flags [DF], proto TCP (6), length 1096)
    rpi36.lan.46656 > rpi33.lan.49740: Flags [P.], cksum 0x0e8e (correct), seq 10440:11484, ack 8353, win 1332, options [nop,nop,TS val 278158789 ecr 278158779], length 1044
1527815105.480086 IP (tos 0x0, ttl 64, id 62430, offset 0, flags [DF], proto TCP (6), length 52)
    rpi33.lan.49740 > rpi36.lan.46656: Flags [.], cksum 0x8484 (incorrect -> 0x09e2), ack 11484, win 1323, options [nop,nop,TS val 278158789 ecr 278158789], length 0
1527815105.481058 IP (tos 0x0, ttl 64, id 46093, offset 0, flags [DF], proto TCP (6), length 1096)
    rpi34.lan.50462 > rpi33.lan.46656: Flags [P.], cksum 0x6f4d (correct), seq 8353:9397, ack 7308, win 1324, options [nop,nop,TS val 278158798 ecr 278158779], length 1044
1527815105.482861 IP (tos 0x0, ttl 64, id 62431, offset 0, flags [DF], proto TCP (6), length 1096)
    rpi33.lan.49740 > rpi36.lan.46656: Flags [P.], cksum 0x8898 (incorrect -> 0x20e7), seq 8353:9397, ack 11484, win 1324, options [nop,nop,TS val 278158789 ecr 278158789], length 1044
1527815105.483172 IP (tos 0x0, ttl 64, id 9714, offset 0, flags [DF], proto TCP (6), length 1096)
    rpi33.lan.46656 > rpi34.lan.50462: Flags [P.], cksum 0x773b (correct), seq 7308:8352, ack 9397, win 1332, options [nop,nop,TS val 278158789 ecr 278158798], length 1044
1527815105.483706 IP (tos 0x0, ttl 64, id 17431, offset 0, flags [DF], proto TCP (6), length 52)
    rpi36.lan.46656 > rpi33.lan.49740: Flags [.], cksum 0x05c6 (correct), ack 9397, win 1331, options [nop,nop,TS val 278158789 ecr 278158789], length 0
1527815105.483809 IP (tos 0x0, ttl 64, id 39382, offset 0, flags [DF], proto TCP (6), length 1096)
    rpi33.lan.43980 > rpi35.lan.46656: Flags [P.], cksum 0x8897 (incorrect -> 0x5a91), seq 7309:8353, ack 8352, win 1324, options [nop,nop,TS val 278158789 ecr 278157301], length 1044
1527815105.483946 IP (tos 0x0, ttl 64, id 46094, offset 0, flags [DF], proto TCP (6), length 52)
    rpi34.lan.50462 > rpi33.lan.46656: Flags [.], cksum 0xb831 (correct), ack 8352, win 1323, options [nop,nop,TS val 278158798 ecr 278158789], length 0
1527815105.484578 IP (tos 0x0, ttl 64, id 9142, offset 0, flags [DF], proto TCP (6), length 52)
    rpi35.lan.46656 > rpi33.lan.43980: Flags [.], cksum 0x90dc (correct), ack 8353, win 1331, options [nop,nop,TS val 278157311 ecr 278158789], length 0
1527815105.487380 IP (tos 0x0, ttl 64, id 59360, offset 0, flags [DF], proto TCP (6), length 1096)
    rpi33.lan.57588 > rpi37.lan.46656: Flags [P.], cksum 0x8899 (incorrect -> 0x8f09), seq 7309:8353, ack 7308, win 1324, options [nop,nop,TS val 278158790 ecr 278158770], length 1044
1527815105.488139 IP (tos 0x0, ttl 64, id 53304, offset 0, flags [DF], proto TCP (6), length 52)
    rpi37.lan.46656 > rpi33.lan.57588: Flags [.], cksum 0x7d18 (correct), ack 8353, win 1331, options [nop,nop,TS val 278158774 ecr 278158790], length 0
1527815105.590090 IP (tos 0x0, ttl 64, id 46095, offset 0, flags [DF], proto TCP (6), length 1096)
    rpi34.lan.50462 > rpi33.lan.46656: Flags [P.], cksum 0x2308 (correct), seq 9397:10441, ack 8352, win 1324, options [nop,nop,TS val 278158809 ecr 278158789], length 1044
1527815105.593450 IP (tos 0x0, ttl 64, id 17432, offset 0, flags [DF], proto TCP (6), length 1096)
    rpi36.lan.46656 > rpi33.lan.49740: Flags [P.], cksum 0x6b1e (correct), seq 11484:12528, ack 9397, win 1332, options [nop,nop,TS val 278158800 ecr 278158789], length 1044
1527815105.593651 IP (tos 0x0, ttl 64, id 53305, offset 0, flags [DF], proto TCP (6), length 1096)
    rpi37.lan.46656 > rpi33.lan.57588: Flags [P.], cksum 0x3860 (correct), seq 7308:8352, ack 8353, win 1332, options [nop,nop,TS val 278158785 ecr 278158790], length 1044
1527815105.593732 IP (tos 0x0, ttl 64, id 59361, offset 0, flags [DF], proto TCP (6), length 52)
    rpi33.lan.57588 > rpi37.lan.46656: Flags [.], cksum 0x8485 (incorrect -> 0x78f7), ack 8352, win 1323, options [nop,nop,TS val 278158800 ecr 278158785], length 0
1527815105.595468 IP (tos 0x0, ttl 64, id 9143, offset 0, flags [DF], proto TCP (6), length 1096)
    rpi35.lan.46656 > rpi33.lan.43980: Flags [P.], cksum 0xa42f (correct), seq 8352:9396, ack 8353, win 1332, options [nop,nop,TS val 278157322 ecr 278158789], length 1044
1527815105.598125 IP (tos 0x0, ttl 64, id 62432, offset 0, flags [DF], proto TCP (6), length 1096)
    rpi33.lan.49740 > rpi36.lan.46656: Flags [P.], cksum 0x8898 (incorrect -> 0x4bbc), seq 9397:10441, ack 12528, win 1324, options [nop,nop,TS val 278158801 ecr 278158800], length 1044
1527815105.598202 IP (tos 0x0, ttl 64, id 39383, offset 0, flags [DF], proto TCP (6), length 1096)
    rpi33.lan.43980 > rpi35.lan.46656: Flags [P.], cksum 0x8897 (incorrect -> 0x054d), seq 8353:9397, ack 9396, win 1324, options [nop,nop,TS val 278158801 ecr 278157322], length 1044
1527815105.598224 IP (tos 0x0, ttl 64, id 9715, offset 0, flags [DF], proto TCP (6), length 1096)
    rpi33.lan.46656 > rpi34.lan.50462: Flags [P.], cksum 0x5457 (correct), seq 8352:9396, ack 10441, win 1332, options [nop,nop,TS val 278158801 ecr 278158809], length 1044
1527815105.598518 IP (tos 0x0, ttl 64, id 59362, offset 0, flags [DF], proto TCP (6), length 1096)
    rpi33.lan.57588 > rpi37.lan.46656: Flags [P.], cksum 0x8899 (incorrect -> 0xdbf6), seq 8353:9397, ack 8352, win 1324, options [nop,nop,TS val 278158801 ecr 278158785], length 1044
1527815105.599020 IP (tos 0x0, ttl 64, id 17433, offset 0, flags [DF], proto TCP (6), length 52)
    rpi36.lan.46656 > rpi33.lan.49740: Flags [.], cksum 0xfd85 (correct), ack 10441, win 1331, options [nop,nop,TS val 278158801 ecr 278158801], length 0
1527815105.599188 IP (tos 0x0, ttl 64, id 9144, offset 0, flags [DF], proto TCP (6), length 52)
    rpi35.lan.46656 > rpi33.lan.43980: Flags [.], cksum 0x889c (correct), ack 9397, win 1331, options [nop,nop,TS val 278157323 ecr 278158801], length 0
1527815105.599191 IP (tos 0x0, ttl 64, id 46096, offset 0, flags [DF], proto TCP (6), length 52)
    rpi34.lan.50462 > rpi33.lan.46656: Flags [.], cksum 0xaff1 (correct), ack 9396, win 1323, options [nop,nop,TS val 278158810 ecr 278158801], length 0
1527815105.599192 IP (tos 0x0, ttl 64, id 53306, offset 0, flags [DF], proto TCP (6), length 52)
    rpi37.lan.46656 > rpi33.lan.57588: Flags [.], cksum 0x74da (correct), ack 9397, win 1331, options [nop,nop,TS val 278158785 ecr 278158801], length 0
1527815105.695348 IP (tos 0x0, ttl 64, id 46097, offset 0, flags [DF], proto TCP (6), length 1096)
    rpi34.lan.50462 > rpi33.lan.46656: Flags [P.], cksum 0x98d2 (correct), seq 10441:11485, ack 9396, win 1324, options [nop,nop,TS val 278158819 ecr 278158801], length 1044
1527815105.702149 IP (tos 0x0, ttl 64, id 53307, offset 0, flags [DF], proto TCP (6), length 1096)
    rpi37.lan.46656 > rpi33.lan.57588: Flags [P.], cksum 0xb921 (correct), seq 8352:9396, ack 9397, win 1332, options [nop,nop,TS val 278158796 ecr 278158801], length 1044
1527815105.706437 IP (tos 0x0, ttl 64, id 17434, offset 0, flags [DF], proto TCP (6), length 1096)
    rpi36.lan.46656 > rpi33.lan.49740: Flags [P.], cksum 0x4a6d (correct), seq 12528:13572, ack 10441, win 1332, options [nop,nop,TS val 278158811 ecr 278158801], length 1044
1527815105.708418 IP (tos 0x0, ttl 64, id 9145, offset 0, flags [DF], proto TCP (6), length 1096)
    rpi35.lan.46656 > rpi33.lan.43980: Flags [P.], cksum 0x51c2 (correct), seq 9396:10440, ack 9397, win 1332, options [nop,nop,TS val 278157334 ecr 278158801], length 1044
1527815105.710037 IP (tos 0x0, ttl 64, id 62433, offset 0, flags [DF], proto TCP (6), length 1096)
    rpi33.lan.49740 > rpi36.lan.46656: Flags [P.], cksum 0x8898 (incorrect -> 0xdcd3), seq 10441:11485, ack 13572, win 1324, options [nop,nop,TS val 278158812 ecr 278158811], length 1044
1527815105.710105 IP (tos 0x0, ttl 64, id 39384, offset 0, flags [DF], proto TCP (6), length 1096)
    rpi33.lan.43980 > rpi35.lan.46656: Flags [P.], cksum 0x8897 (incorrect -> 0xf58f), seq 9397:10441, ack 10440, win 1323, options [nop,nop,TS val 278158812 ecr 278157334], length 1044
1527815105.710252 IP (tos 0x0, ttl 64, id 9716, offset 0, flags [DF], proto TCP (6), length 1096)
    rpi33.lan.46656 > rpi34.lan.50462: Flags [P.], cksum 0x8992 (correct), seq 9396:10440, ack 11485, win 1332, options [nop,nop,TS val 278158812 ecr 278158819], length 1044
1527815105.710416 IP (tos 0x0, ttl 64, id 59363, offset 0, flags [DF], proto TCP (6), length 1096)
    rpi33.lan.57588 > rpi37.lan.46656: Flags [P.], cksum 0x8899 (incorrect -> 0xf3ae), seq 9397:10441, ack 9396, win 1324, options [nop,nop,TS val 278158812 ecr 278158796], length 1044
1527815105.710878 IP (tos 0x0, ttl 64, id 17435, offset 0, flags [DF], proto TCP (6), length 52)
    rpi36.lan.46656 > rpi33.lan.49740: Flags [.], cksum 0xf547 (correct), ack 11485, win 1331, options [nop,nop,TS val 278158812 ecr 278158812], length 0
1527815105.711072 IP (tos 0x0, ttl 64, id 9146, offset 0, flags [DF], proto TCP (6), length 52)
    rpi35.lan.46656 > rpi33.lan.43980: Flags [.], cksum 0x805e (correct), ack 10441, win 1331, options [nop,nop,TS val 278157334 ecr 278158812], length 0
1527815105.711074 IP (tos 0x0, ttl 64, id 46098, offset 0, flags [DF], proto TCP (6), length 52)
    rpi34.lan.50462 > rpi33.lan.46656: Flags [.], cksum 0xa7b3 (correct), ack 10440, win 1323, options [nop,nop,TS val 278158821 ecr 278158812], length 0
1527815105.711211 IP (tos 0x0, ttl 64, id 53308, offset 0, flags [DF], proto TCP (6), length 52)
    rpi37.lan.46656 > rpi33.lan.57588: Flags [.], cksum 0x6c9c (correct), ack 10441, win 1331, options [nop,nop,TS val 278158796 ecr 278158812], length 0
1527815105.798490 IP (tos 0x0, ttl 64, id 46099, offset 0, flags [DF], proto TCP (6), length 1096)
    rpi34.lan.50462 > rpi33.lan.46656: Flags [P.], cksum 0x87ab (correct), seq 11485:12529, ack 10440, win 1324, options [nop,nop,TS val 278158830 ecr 278158812], length 1044
1527815105.808194 IP (tos 0x0, ttl 64, id 17436, offset 0, flags [DF], proto TCP (6), length 1096)
    rpi36.lan.46656 > rpi33.lan.49740: Flags [P.], cksum 0x66eb (correct), seq 13572:14616, ack 11485, win 1332, options [nop,nop,TS val 278158822 ecr 278158812], length 1044
1527815105.808409 IP (tos 0x0, ttl 64, id 53309, offset 0, flags [DF], proto TCP (6), length 1096)
