1527815014.994156 IP (tos 0x0, ttl 64, id 62064, offset 0, flags [DF], proto TCP (6), length 1096)
    rpi33.lan.49740 > rpi36.lan.46656: Flags [P.], cksum 0x8898 (incorrect -> 0x213d), seq 571113319:571114363, ack 1465689921, win 1324, options [nop,nop,TS val 278149740 ecr 278149542], length 1044
1527815014.994221 IP (tos 0x0, ttl 64, id 9320, offset 0, flags [DF], proto TCP (6), length 1096)
    rpi33.lan.46656 > rpi34.lan.50462: Flags [P.], cksum 0xfb2c (correct), seq 2415869496:2415870540, ack 1114104411, win 1332, options [nop,nop,TS val 278149740 ecr 278149551], length 1044
1527815014.994748 IP (tos 0x0, ttl 64, id 59006, offset 0, flags [DF], proto TCP (6), length 1096)
    rpi33.lan.57588 > rpi37.lan.46656: Flags [P.], cksum 0x8899 (incorrect -> 0x350c), seq 3677626993:3677628037, ack 886965370, win 1324, options [nop,nop,TS val 278149741 ecr 278149526], length 1044
1527815014.994780 IP (tos 0x0, ttl 64, id 39008, offset 0, flags [DF], proto TCP (6), length 1096)
    rpi33.lan.43980 > rpi35.lan.46656: Flags [P.], cksum 0x8897 (incorrect -> 0xcad4), seq 1149475317:1149476361, ack 241846385, win 1324, options [nop,nop,TS val 278149741 ecr 278148062], length 1044
1527815014.997098 IP (tos 0x0, ttl 64, id 8731, offset 0, flags [DF], proto TCP (6), length 1096)
    rpi35.lan.46656 > rpi33.lan.43980: Flags [P.], cksum 0x53c0 (correct), seq 1:1045, ack 1044, win 1332, options [nop,nop,TS val 278148262 ecr 278149741], length 1044
1527815014.997217 IP (tos 0x0, ttl 64, id 39009, offset 0, flags [DF], proto TCP (6), length 52)
    rpi33.lan.43980 > rpi35.lan.46656: Flags [.], cksum 0x8483 (incorrect -> 0xbd70), ack 1045, win 1323, options [nop,nop,TS val 278149741 ecr 278148262], length 0
1527815015.006368 IP (tos 0x0, ttl 64, id 52903, offset 0, flags [DF], proto TCP (6), length 1096)
    rpi37.lan.46656 > rpi33.lan.57588: Flags [P.], cksum 0x4a63 (correct), seq 1:1045, ack 1044, win 1332, options [nop,nop,TS val 278149726 ecr 278149741], length 1044
1527815015.006482 IP (tos 0x0, ttl 64, id 59007, offset 0, flags [DF], proto TCP (6), length 52)
    rpi33.lan.57588 > rpi37.lan.46656: Flags [.], cksum 0x8485 (incorrect -> 0x80e3), ack 1045, win 1323, options [nop,nop,TS val 278149742 ecr 278149726], length 0
1527815015.012371 IP (tos 0x0, ttl 64, id 17026, offset 0, flags [DF], proto TCP (6), length 1096)
    rpi36.lan.46656 > rpi33.lan.49740: Flags [P.], cksum 0x7934 (correct), seq 1:1045, ack 1044, win 1332, options [nop,nop,TS val 278149742 ecr 278149740], length 1044
1527815015.012466 IP (tos 0x0, ttl 64, id 62065, offset 0, flags [DF], proto TCP (6), length 52)
    rpi33.lan.49740 > rpi36.lan.46656: Flags [.], cksum 0x8484 (incorrect -> 0x366b), ack 1045, win 1323, options [nop,nop,TS val 278149742 ecr 278149742], length 0
1527815015.015552 IP (tos 0x0, ttl 64, id 45717, offset 0, flags [DF], proto TCP (6), length 1096)
    rpi34.lan.50462 > rpi33.lan.46656: Flags [P.], cksum 0xcb7a (correct), seq 1:1045, ack 1044, win 1324, options [nop,nop,TS val 278149751 ecr 278149740], length 1044
1527815015.015643 IP (tos 0x0, ttl 64, id 9321, offset 0, flags [DF], proto TCP (6), length 52)
    rpi33.lan.46656 > rpi34.lan.50462: Flags [.], cksum 0x8482 (incorrect -> 0xe09d), ack 1045, win 1331, options [nop,nop,TS val 278149743 ecr 278149751], length 0
1527815016.108443 IP (tos 0x0, ttl 64, id 45718, offset 0, flags [DF], proto TCP (6), length 1096)
    rpi34.lan.50462 > rpi33.lan.46656: Flags [P.], cksum 0xc690 (correct), seq 1045:2089, ack 1044, win 1324, options [nop,nop,TS val 278149861 ecr 278149743], length 1044
1527815016.108595 IP (tos 0x0, ttl 64, id 9322, offset 0, flags [DF], proto TCP (6), length 52)
    rpi33.lan.46656 > rpi34.lan.50462: Flags [.], cksum 0x8482 (incorrect -> 0xdbae), ack 2089, win 1331, options [nop,nop,TS val 278149852 ecr 278149861], length 0
1527815016.997337 IP (tos 0x0, ttl 64, id 39010, offset 0, flags [DF], proto TCP (6), length 1096)
    rpi33.lan.43980 > rpi35.lan.46656: Flags [P.], cksum 0x8897 (incorrect -> 0x5af6), seq 1044:2088, ack 1045, win 1324, options [nop,nop,TS val 278149941 ecr 278148262], length 1044
1527815016.997394 IP (tos 0x0, ttl 64, id 62066, offset 0, flags [DF], proto TCP (6), length 1096)
    rpi33.lan.49740 > rpi36.lan.46656: Flags [P.], cksum 0x8898 (incorrect -> 0xacab), seq 1044:2088, ack 1045, win 1324, options [nop,nop,TS val 278149941 ecr 278149742], length 1044
1527815016.997419 IP (tos 0x0, ttl 64, id 59008, offset 0, flags [DF], proto TCP (6), length 1096)
    rpi33.lan.57588 > rpi37.lan.46656: Flags [P.], cksum 0x8899 (incorrect -> 0xa84d), seq 1044:2088, ack 1045, win 1324, options [nop,nop,TS val 278149941 ecr 278149726], length 1044
1527815016.997660 IP (tos 0x0, ttl 64, id 9323, offset 0, flags [DF], proto TCP (6), length 1096)
    rpi33.lan.46656 > rpi34.lan.50462: Flags [P.], cksum 0x236d (correct), seq 1044:2088, ack 2089, win 1332, options [nop,nop,TS val 278149941 ecr 278149861], length 1044
1527815017.000753 IP (tos 0x0, ttl 64, id 8732, offset 0, flags [DF], proto TCP (6), length 1096)
    rpi35.lan.46656 > rpi33.lan.43980: Flags [P.], cksum 0x8b75 (correct), seq 1045:2089, ack 2088, win 1332, options [nop,nop,TS val 278148463 ecr 278149941], length 1044
1527815017.000853 IP (tos 0x0, ttl 64, id 39011, offset 0, flags [DF], proto TCP (6), length 52)
    rpi33.lan.43980 > rpi35.lan.46656: Flags [.], cksum 0x8483 (incorrect -> 0xb3b7), ack 2089, win 1323, options [nop,nop,TS val 278149941 ecr 278148463], length 0
1527815017.009939 IP (tos 0x0, ttl 64, id 52904, offset 0, flags [DF], proto TCP (6), length 1096)
    rpi37.lan.46656 > rpi33.lan.57588: Flags [P.], cksum 0x6847 (correct), seq 1045:2089, ack 2088, win 1332, options [nop,nop,TS val 278149926 ecr 278149941], length 1044
1527815017.010070 IP (tos 0x0, ttl 64, id 59009, offset 0, flags [DF], proto TCP (6), length 52)
    rpi33.lan.57588 > rpi37.lan.46656: Flags [.], cksum 0x8485 (incorrect -> 0x772b), ack 2089, win 1323, options [nop,nop,TS val 278149942 ecr 278149926], length 0
1527815017.015765 IP (tos 0x0, ttl 64, id 17027, offset 0, flags [DF], proto TCP (6), length 1096)
    rpi36.lan.46656 > rpi33.lan.49740: Flags [P.], cksum 0x5a85 (correct), seq 1045:2089, ack 2088, win 1332, options [nop,nop,TS val 278149942 ecr 278149941], length 1044
1527815017.015866 IP (tos 0x0, ttl 64, id 62067, offset 0, flags [DF], proto TCP (6), length 52)
    rpi33.lan.49740 > rpi36.lan.46656: Flags [.], cksum 0x8484 (incorrect -> 0x2cb2), ack 2089, win 1323, options [nop,nop,TS val 278149943 ecr 278149942], length 0
1527815017.018864 IP (tos 0x0, ttl 64, id 45719, offset 0, flags [DF], proto TCP (6), length 1096)
    rpi34.lan.50462 > rpi33.lan.46656: Flags [P.], cksum 0xf7ff (correct), seq 2089:3133, ack 2088, win 1324, options [nop,nop,TS val 278149952 ecr 278149941], length 1044
1527815017.018948 IP (tos 0x0, ttl 64, id 9324, offset 0, flags [DF], proto TCP (6), length 52)
    rpi33.lan.46656 > rpi34.lan.50462: Flags [.], cksum 0x8482 (incorrect -> 0xd2d0), ack 3133, win 1331, options [nop,nop,TS val 278149943 ecr 278149952], length 0
1527815017.712959 IP (tos 0x0, ttl 64, id 45720, offset 0, flags [DF], proto TCP (6), length 1096)
    rpi34.lan.50462 > rpi33.lan.46656: Flags [P.], cksum 0xceb0 (correct), seq 3133:4177, ack 2088, win 1324, options [nop,nop,TS val 278150021 ecr 278149943], length 1044
1527815017.713058 IP (tos 0x0, ttl 64, id 9325, offset 0, flags [DF], proto TCP (6), length 52)
    rpi33.lan.46656 > rpi34.lan.50462: Flags [.], cksum 0x8482 (incorrect -> 0xce32), ack 4177, win 1331, options [nop,nop,TS val 278150012 ecr 278150021], length 0
1527815017.713674 IP (tos 0x0, ttl 64, id 9326, offset 0, flags [DF], proto TCP (6), length 1096)
    rpi33.lan.46656 > rpi34.lan.50462: Flags [P.], cksum 0x50a3 (correct), seq 2088:3132, ack 4177, win 1332, options [nop,nop,TS val 278150012 ecr 278150021], length 1044
1527815017.714090 IP (tos 0x0, ttl 64, id 9327, offset 0, flags [DF], proto TCP (6), length 1096)
    rpi33.lan.46656 > rpi34.lan.50462: Flags [P.], cksum 0x9ba3 (correct), seq 3132:4176, ack 4177, win 1332, options [nop,nop,TS val 278150012 ecr 278150021], length 1044
1527815017.714915 IP (tos 0x0, ttl 64, id 45721, offset 0, flags [DF], proto TCP (6), length 52)
    rpi34.lan.50462 > rpi33.lan.46656: Flags [.], cksum 0xc611 (correct), ack 4176, win 1324, options [nop,nop,TS val 278150021 ecr 278150012], length 0
1527815017.715534 IP (tos 0x0, ttl 64, id 45722, offset 0, flags [DF], proto TCP (6), length 1096)
    rpi34.lan.50462 > rpi33.lan.46656: Flags [P.], cksum 0x0646 (correct), seq 4177:5221, ack 4176, win 1324, options [nop,nop,TS val 278150021 ecr 278150012], length 1044
1527815017.764498 IP (tos 0x0, ttl 64, id 9328, offset 0, flags [DF], proto TCP (6), length 52)
    rpi33.lan.46656 > rpi34.lan.50462: Flags [.], cksum 0x8482 (incorrect -> 0xc1ef), ack 5221, win 1332, options [nop,nop,TS val 278150018 ecr 278150021], length 0
1527815019.003134 IP (tos 0x0, ttl 64, id 9329, offset 0, flags [DF], proto TCP (6), length 1096)
    rpi33.lan.46656 > rpi34.lan.50462: Flags [P.], cksum 0xd5f6 (correct), seq 4176:5220, ack 5221, win 1332, options [nop,nop,TS val 278150141 ecr 278150021], length 1044
1527815019.003203 IP (tos 0x0, ttl 64, id 39012, offset 0, flags [DF], proto TCP (6), length 1096)
    rpi33.lan.43980 > rpi35.lan.46656: Flags [P.], cksum 0x8897 (incorrect -> 0x40ab), seq 2088:3132, ack 2089, win 1324, options [nop,nop,TS val 278150141 ecr 278148463], length 1044
1527815019.003422 IP (tos 0x0, ttl 64, id 62068, offset 0, flags [DF], proto TCP (6), length 1096)
    rpi33.lan.49740 > rpi36.lan.46656: Flags [P.], cksum 0x8898 (incorrect -> 0x1965), seq 2088:3132, ack 2089, win 1324, options [nop,nop,TS val 278150141 ecr 278149942], length 1044
1527815019.003745 IP (tos 0x0, ttl 64, id 59010, offset 0, flags [DF], proto TCP (6), length 1096)
    rpi33.lan.57588 > rpi37.lan.46656: Flags [P.], cksum 0x8899 (incorrect -> 0xe735), seq 2088:3132, ack 2089, win 1324, options [nop,nop,TS val 278150141 ecr 278149926], length 1044
1527815019.003936 IP (tos 0x0, ttl 64, id 8733, offset 0, flags [DF], proto TCP (6), length 1096)
    rpi35.lan.46656 > rpi33.lan.43980: Flags [P.], cksum 0xf409 (correct), seq 2089:3133, ack 2088, win 1332, options [nop,nop,TS val 278148663 ecr 278149941], length 1044
1527815019.004048 IP (tos 0x0, ttl 64, id 39013, offset 0, flags [DF], proto TCP (6), length 52)
    rpi33.lan.43980 > rpi35.lan.46656: Flags [.], cksum 0x8483 (incorrect -> 0xa9ff), ack 3133, win 1323, options [nop,nop,TS val 278150141 ecr 278148663], length 0
1527815019.013377 IP (tos 0x0, ttl 64, id 52905, offset 0, flags [DF], proto TCP (6), length 1096)
    rpi37.lan.46656 > rpi33.lan.57588: Flags [P.], cksum 0xf531 (correct), seq 2089:3133, ack 3132, win 1332, options [nop,nop,TS val 278150127 ecr 278150141], length 1044
1527815019.013493 IP (tos 0x0, ttl 64, id 59011, offset 0, flags [DF], proto TCP (6), length 52)
    rpi33.lan.57588 > rpi37.lan.46656: Flags [.], cksum 0x8485 (incorrect -> 0x6d72), ack 3133, win 1323, options [nop,nop,TS val 278150142 ecr 278150127], length 0
1527815019.019565 IP (tos 0x0, ttl 64, id 17028, offset 0, flags [DF], proto TCP (6), length 1096)
    rpi36.lan.46656 > rpi33.lan.49740: Flags [P.], cksum 0xea89 (correct), seq 2089:3133, ack 3132, win 1332, options [nop,nop,TS val 278150143 ecr 278150141], length 1044
1527815019.019672 IP (tos 0x0, ttl 64, id 62069, offset 0, flags [DF], proto TCP (6), length 52)
    rpi33.lan.49740 > rpi36.lan.46656: Flags [.], cksum 0x8484 (incorrect -> 0x22f9), ack 3133, win 1323, options [nop,nop,TS val 278150143 ecr 278150143], length 0
1527815019.022079 IP (tos 0x0, ttl 64, id 45723, offset 0, flags [DF], proto TCP (6), length 1096)
    rpi34.lan.50462 > rpi33.lan.46656: Flags [P.], cksum 0xd1e1 (correct), seq 5221:6265, ack 5220, win 1324, options [nop,nop,TS val 278150152 ecr 278150141], length 1044
1527815019.022173 IP (tos 0x0, ttl 64, id 9330, offset 0, flags [DF], proto TCP (6), length 52)
    rpi33.lan.46656 > rpi34.lan.50462: Flags [.], cksum 0x8482 (incorrect -> 0xb8c8), ack 6265, win 1331, options [nop,nop,TS val 278150143 ecr 278150152], length 0
1527815019.047389 IP (tos 0x0, ttl 64, id 8734, offset 0, flags [DF], proto TCP (6), length 52)
    rpi35.lan.46656 > rpi33.lan.43980: Flags [.], cksum 0xa9f1 (correct), ack 3132, win 1332, options [nop,nop,TS val 278148668 ecr 278150141], length 0
1527815021.004121 IP (tos 0x0, ttl 64, id 62070, offset 0, flags [DF], proto TCP (6), length 1096)
    rpi33.lan.49740 > rpi36.lan.46656: Flags [P.], cksum 0x8898 (incorrect -> 0x72dd), seq 3132:4176, ack 3133, win 1324, options [nop,nop,TS val 278150341 ecr 278150143], length 1044
1527815021.004162 IP (tos 0x0, ttl 64, id 9331, offset 0, flags [DF], proto TCP (6), length 1096)
    rpi33.lan.46656 > rpi34.lan.50462: Flags [P.], cksum 0x3744 (correct), seq 5220:6264, ack 6265, win 1332, options [nop,nop,TS val 278150341 ecr 278150152], length 1044
1527815021.004597 IP (tos 0x0, ttl 64, id 39014, offset 0, flags [DF], proto TCP (6), length 1096)
    rpi33.lan.43980 > rpi35.lan.46656: Flags [P.], cksum 0x8897 (incorrect -> 0x11bd), seq 3132:4176, ack 3133, win 1324, options [nop,nop,TS val 278150342 ecr 278148668], length 1044
1527815021.004637 IP (tos 0x0, ttl 64, id 59012, offset 0, flags [DF], proto TCP (6), length 1096)
    rpi33.lan.57588 > rpi37.lan.46656: Flags [P.], cksum 0x8899 (incorrect -> 0xf1e0), seq 3132:4176, ack 3133, win 1324, options [nop,nop,TS val 278150342 ecr 278150127], length 1044
1527815021.005493 IP (tos 0x0, ttl 64, id 8735, offset 0, flags [DF], proto TCP (6), length 52)
    rpi35.lan.46656 > rpi33.lan.43980: Flags [.], cksum 0xa452 (correct), ack 4176, win 1331, options [nop,nop,TS val 278148863 ecr 278150342], length 0
1527815021.007428 IP (tos 0x0, ttl 64, id 8736, offset 0, flags [DF], proto TCP (6), length 1096)
    rpi35.lan.46656 > rpi33.lan.43980: Flags [P.], cksum 0x2923 (correct), seq 3133:4177, ack 4176, win 1332, options [nop,nop,TS val 278148863 ecr 278150342], length 1044
1527815021.007499 IP (tos 0x0, ttl 64, id 39015, offset 0, flags [DF], proto TCP (6), length 52)
    rpi33.lan.43980 > rpi35.lan.46656: Flags [.], cksum 0x8483 (incorrect -> 0xa046), ack 4177, win 1323, options [nop,nop,TS val 278150342 ecr 278148863], length 0
1527815021.016575 IP (tos 0x0, ttl 64, id 52906, offset 0, flags [DF], proto TCP (6), length 1096)
    rpi37.lan.46656 > rpi33.lan.57588: Flags [P.], cksum 0x7240 (correct), seq 3133:4177, ack 4176, win 1332, options [nop,nop,TS val 278150327 ecr 278150342], length 1044
1527815021.016680 IP (tos 0x0, ttl 64, id 59013, offset 0, flags [DF], proto TCP (6), length 52)
    rpi33.lan.57588 > rpi37.lan.46656: Flags [.], cksum 0x8485 (incorrect -> 0x63b9), ack 4177, win 1323, options [nop,nop,TS val 278150343 ecr 278150327], length 0
1527815021.022507 IP (tos 0x0, ttl 64, id 17029, offset 0, flags [DF], proto TCP (6), length 1096)
    rpi36.lan.46656 > rpi33.lan.49740: Flags [P.], cksum 0xa128 (correct), seq 3133:4177, ack 4176, win 1332, options [nop,nop,TS val 278150343 ecr 278150341], length 1044
1527815021.022608 IP (tos 0x0, ttl 64, id 62071, offset 0, flags [DF], proto TCP (6), length 52)
    rpi33.lan.49740 > rpi36.lan.46656: Flags [.], cksum 0x8484 (incorrect -> 0x1941), ack 4177, win 1323, options [nop,nop,TS val 278150343 ecr 278150343], length 0
1527815021.025517 IP (tos 0x0, ttl 64, id 45724, offset 0, flags [DF], proto TCP (6), length 1096)
    rpi34.lan.50462 > rpi33.lan.46656: Flags [P.], cksum 0x7afe (correct), seq 6265:7309, ack 6264, win 1324, options [nop,nop,TS val 278150352 ecr 278150341], length 1044
1527815021.025606 IP (tos 0x0, ttl 64, id 9332, offset 0, flags [DF], proto TCP (6), length 52)
    rpi33.lan.46656 > rpi34.lan.50462: Flags [.], cksum 0x8482 (incorrect -> 0xaf0f), ack 7309, win 1331, options [nop,nop,TS val 278150344 ecr 278150352], length 0
1527815023.010300 IP (tos 0x0, ttl 64, id 39016, offset 0, flags [DF], proto TCP (6), length 1096)
    rpi33.lan.43980 > rpi35.lan.46656: Flags [P.], cksum 0x8897 (incorrect -> 0x88b2), seq 4176:5220, ack 4177, win 1324, options [nop,nop,TS val 278150542 ecr 278148863], length 1044
1527815023.010372 IP (tos 0x0, ttl 64, id 59014, offset 0, flags [DF], proto TCP (6), length 1096)
    rpi33.lan.57588 > rpi37.lan.46656: Flags [P.], cksum 0x8899 (incorrect -> 0x732e), seq 4176:5220, ack 4177, win 1324, options [nop,nop,TS val 278150542 ecr 278150327], length 1044
1527815023.010391 IP (tos 0x0, ttl 64, id 9333, offset 0, flags [DF], proto TCP (6), length 1096)
    rpi33.lan.46656 > rpi34.lan.50462: Flags [P.], cksum 0x0241 (correct), seq 6264:7308, ack 7309, win 1332, options [nop,nop,TS val 278150542 ecr 278150352], length 1044
1527815023.010409 IP (tos 0x0, ttl 64, id 62072, offset 0, flags [DF], proto TCP (6), length 1096)
    rpi33.lan.49740 > rpi36.lan.46656: Flags [P.], cksum 0x8898 (incorrect -> 0xcb9a), seq 4176:5220, ack 4177, win 1324, options [nop,nop,TS val 278150542 ecr 278150343], length 1044
1527815023.010870 IP (tos 0x0, ttl 64, id 8737, offset 0, flags [DF], proto TCP (6), length 1096)
    rpi35.lan.46656 > rpi33.lan.43980: Flags [P.], cksum 0x3ae7 (correct), seq 4177:5221, ack 4176, win 1332, options [nop,nop,TS val 278149064 ecr 278150342], length 1044
1527815023.010977 IP (tos 0x0, ttl 64, id 39017, offset 0, flags [DF], proto TCP (6), length 52)
    rpi33.lan.43980 > rpi35.lan.46656: Flags [.], cksum 0x8483 (incorrect -> 0x968d), ack 5221, win 1323, options [nop,nop,TS val 278150542 ecr 278149064], length 0
1527815023.019840 IP (tos 0x0, ttl 64, id 52907, offset 0, flags [DF], proto TCP (6), length 1096)
    rpi37.lan.46656 > rpi33.lan.57588: Flags [P.], cksum 0xc46f (correct), seq 4177:5221, ack 5220, win 1332, options [nop,nop,TS val 278150527 ecr 278150542], length 1044
1527815023.019959 IP (tos 0x0, ttl 64, id 59015, offset 0, flags [DF], proto TCP (6), length 52)
    rpi33.lan.57588 > rpi37.lan.46656: Flags [.], cksum 0x8485 (incorrect -> 0x5a01), ack 5221, win 1323, options [nop,nop,TS val 278150543 ecr 278150527], length 0
1527815023.026066 IP (tos 0x0, ttl 64, id 17030, offset 0, flags [DF], proto TCP (6), length 1096)
    rpi36.lan.46656 > rpi33.lan.49740: Flags [P.], cksum 0x7793 (correct), seq 4177:5221, ack 5220, win 1332, options [nop,nop,TS val 278150543 ecr 278150542], length 1044
1527815023.026162 IP (tos 0x0, ttl 64, id 62073, offset 0, flags [DF], proto TCP (6), length 52)
    rpi33.lan.49740 > rpi36.lan.46656: Flags [.], cksum 0x8484 (incorrect -> 0x0f88), ack 5221, win 1323, options [nop,nop,TS val 278150544 ecr 278150543], length 0
1527815023.029125 IP (tos 0x0, ttl 64, id 45725, offset 0, flags [DF], proto TCP (6), length 1096)
    rpi34.lan.50462 > rpi33.lan.46656: Flags [P.], cksum 0x43c1 (correct), seq 7309:8353, ack 7308, win 1324, options [nop,nop,TS val 278150553 ecr 278150542], length 1044
1527815023.029232 IP (tos 0x0, ttl 64, id 9334, offset 0, flags [DF], proto TCP (6), length 52)
    rpi33.lan.46656 > rpi34.lan.50462: Flags [.], cksum 0x8482 (incorrect -> 0xa556), ack 8353, win 1331, options [nop,nop,TS val 278150544 ecr 278150553], length 0
1527815023.057377 IP (tos 0x0, ttl 64, id 8738, offset 0, flags [DF], proto TCP (6), length 52)
    rpi35.lan.46656 > rpi33.lan.43980: Flags [.], cksum 0x967f (correct), ack 5220, win 1332, options [nop,nop,TS val 278149069 ecr 278150542], length 0
1527815025.011108 IP (tos 0x0, ttl 64, id 62074, offset 0, flags [DF], proto TCP (6), length 1096)
    rpi33.lan.49740 > rpi36.lan.46656: Flags [P.], cksum 0x8898 (incorrect -> 0x4e05), seq 5220:6264, ack 5221, win 1324, options [nop,nop,TS val 278150742 ecr 278150543], length 1044
1527815025.011154 IP (tos 0x0, ttl 64, id 39018, offset 0, flags [DF], proto TCP (6), length 1096)
    rpi33.lan.43980 > rpi35.lan.46656: Flags [P.], cksum 0x8897 (incorrect -> 0x161f), seq 5220:6264, ack 5221, win 1324, options [nop,nop,TS val 278150742 ecr 278149069], length 1044
1527815025.011172 IP (tos 0x0, ttl 64, id 9335, offset 0, flags [DF], proto TCP (6), length 1096)
    rpi33.lan.46656 > rpi34.lan.50462: Flags [P.], cksum 0xc294 (correct), seq 7308:8352, ack 8353, win 1332, options [nop,nop,TS val 278150742 ecr 278150553], length 1044
1527815025.011380 IP (tos 0x0, ttl 64, id 59016, offset 0, flags [DF], proto TCP (6), length 1096)
    rpi33.lan.57588 > rpi37.lan.46656: Flags [P.], cksum 0x8899 (incorrect -> 0x7691), seq 5220:6264, ack 5221, win 1324, options [nop,nop,TS val 278150742 ecr 278150527], length 1044
1527815025.012036 IP (tos 0x0, ttl 64, id 8739, offset 0, flags [DF], proto TCP (6), length 52)
    rpi35.lan.46656 > rpi33.lan.43980: Flags [.], cksum 0x90e1 (correct), ack 6264, win 1331, options [nop,nop,TS val 278149264 ecr 278150742], length 0
1527815025.014138 IP (tos 0x0, ttl 64, id 8740, offset 0, flags [DF], proto TCP (6), length 1096)
    rpi35.lan.46656 > rpi33.lan.43980: Flags [P.], cksum 0x2804 (correct), seq 5221:6265, ack 6264, win 1332, options [nop,nop,TS val 278149264 ecr 278150742], length 1044
1527815025.014207 IP (tos 0x0, ttl 64, id 39019, offset 0, flags [DF], proto TCP (6), length 52)
    rpi33.lan.43980 > rpi35.lan.46656: Flags [.], cksum 0x8483 (incorrect -> 0x8cd5), ack 6265, win 1323, options [nop,nop,TS val 278150742 ecr 278149264], length 0
1527815025.023359 IP (tos 0x0, ttl 64, id 52908, offset 0, flags [DF], proto TCP (6), length 1096)
    rpi37.lan.46656 > rpi33.lan.57588: Flags [P.], cksum 0xd474 (correct), seq 5221:6265, ack 6264, win 1332, options [nop,nop,TS val 278150728 ecr 278150742], length 1044
1527815025.023453 IP (tos 0x0, ttl 64, id 59017, offset 0, flags [DF], proto TCP (6), length 52)
    rpi33.lan.57588 > rpi37.lan.46656: Flags [.], cksum 0x8485 (incorrect -> 0x5048), ack 6265, win 1323, options [nop,nop,TS val 278150743 ecr 278150728], length 0
1527815025.029222 IP (tos 0x0, ttl 64, id 17031, offset 0, flags [DF], proto TCP (6), length 1096)
    rpi36.lan.46656 > rpi33.lan.49740: Flags [P.], cksum 0xcc0c (correct), seq 5221:6265, ack 6264, win 1332, options [nop,nop,TS val 278150744 ecr 278150742], length 1044
1527815025.029321 IP (tos 0x0, ttl 64, id 62075, offset 0, flags [DF], proto TCP (6), length 52)
    rpi33.lan.49740 > rpi36.lan.46656: Flags [.], cksum 0x8484 (incorrect -> 0x05cf), ack 6265, win 1323, options [nop,nop,TS val 278150744 ecr 278150744], length 0
1527815025.032472 IP (tos 0x0, ttl 64, id 45726, offset 0, flags [DF], proto TCP (6), length 1096)
    rpi34.lan.50462 > rpi33.lan.46656: Flags [P.], cksum 0x70a8 (correct), seq 8353:9397, ack 8352, win 1324, options [nop,nop,TS val 278150753 ecr 278150742], length 1044
1527815025.032561 IP (tos 0x0, ttl 64, id 9336, offset 0, flags [DF], proto TCP (6), length 52)
    rpi33.lan.46656 > rpi34.lan.50462: Flags [.], cksum 0x8482 (incorrect -> 0x9b9e), ack 9397, win 1331, options [nop,nop,TS val 278150744 ecr 278150753], length 0
1527815027.017277 IP (tos 0x0, ttl 64, id 62076, offset 0, flags [DF], proto TCP (6), length 1096)
    rpi33.lan.49740 > rpi36.lan.46656: Flags [P.], cksum 0x8898 (incorrect -> 0x9c48), seq 6264:7308, ack 6265, win 1324, options [nop,nop,TS val 278150943 ecr 278150744], length 1044
1527815027.017341 IP (tos 0x0, ttl 64, id 59018, offset 0, flags [DF], proto TCP (6), length 1096)
    rpi33.lan.57588 > rpi37.lan.46656: Flags [P.], cksum 0x8899 (incorrect -> 0xfb36), seq 6264:7308, ack 6265, win 1324, options [nop,nop,TS val 278150943 ecr 278150728], length 1044
1527815027.017359 IP (tos 0x0, ttl 64, id 9337, offset 0, flags [DF], proto TCP (6), length 1096)
    rpi33.lan.46656 > rpi34.lan.50462: Flags [P.], cksum 0x28cd (correct), seq 8352:9396, ack 9397, win 1332, options [nop,nop,TS val 278150943 ecr 278150753], length 1044
1527815027.017519 IP (tos 0x0, ttl 64, id 8741, offset 0, flags [DF], proto TCP (6), length 1096)
    rpi35.lan.46656 > rpi33.lan.43980: Flags [P.], cksum 0x435f (correct), seq 6265:7309, ack 6264, win 1332, options [nop,nop,TS val 278149464 ecr 278150742], length 1044
1527815027.017579 IP (tos 0x0, ttl 64, id 39020, offset 0, flags [DF], proto TCP (6), length 1096)
    rpi33.lan.43980 > rpi35.lan.46656: Flags [P.], cksum 0x8897 (incorrect -> 0xd6e7), seq 6264:7308, ack 6265, win 1324, options [nop,nop,TS val 278150943 ecr 278149264], length 1044
1527815027.017669 IP (tos 0x0, ttl 64, id 39021, offset 0, flags [DF], proto TCP (6), length 52)
    rpi33.lan.43980 > rpi35.lan.46656: Flags [.], cksum 0x8483 (incorrect -> 0x831c), ack 7309, win 1323, options [nop,nop,TS val 278150943 ecr 278149464], length 0
1527815027.026625 IP (tos 0x0, ttl 64, id 52909, offset 0, flags [DF], proto TCP (6), length 1096)
    rpi37.lan.46656 > rpi33.lan.57588: Flags [P.], cksum 0xa497 (correct), seq 6265:7309, ack 7308, win 1332, options [nop,nop,TS val 278150928 ecr 278150943], length 1044
1527815027.026727 IP (tos 0x0, ttl 64, id 59019, offset 0, flags [DF], proto TCP (6), length 52)
    rpi33.lan.57588 > rpi37.lan.46656: Flags [.], cksum 0x8485 (incorrect -> 0x468f), ack 7309, win 1323, options [nop,nop,TS val 278150944 ecr 278150928], length 0
1527815027.032939 IP (tos 0x0, ttl 64, id 17032, offset 0, flags [DF], proto TCP (6), length 1096)
    rpi36.lan.46656 > rpi33.lan.49740: Flags [P.], cksum 0x69c6 (correct), seq 6265:7309, ack 7308, win 1332, options [nop,nop,TS val 278150944 ecr 278150943], length 1044
1527815027.033041 IP (tos 0x0, ttl 64, id 62077, offset 0, flags [DF], proto TCP (6), length 52)
    rpi33.lan.49740 > rpi36.lan.46656: Flags [.], cksum 0x8484 (incorrect -> 0xfc16), ack 7309, win 1323, options [nop,nop,TS val 278150944 ecr 278150944], length 0
1527815027.036028 IP (tos 0x0, ttl 64, id 45727, offset 0, flags [DF], proto TCP (6), length 1096)
    rpi34.lan.50462 > rpi33.lan.46656: Flags [P.], cksum 0x77b0 (correct), seq 9397:10441, ack 9396, win 1324, options [nop,nop,TS val 278150953 ecr 278150943], length 1044
1527815027.036118 IP (tos 0x0, ttl 64, id 9338, offset 0, flags [DF], proto TCP (6), length 52)
    rpi33.lan.46656 > rpi34.lan.50462: Flags [.], cksum 0x8482 (incorrect -> 0x91e5), ack 10441, win 1331, options [nop,nop,TS val 278150945 ecr 278150953], length 0
1527815027.067395 IP (tos 0x0, ttl 64, id 8742, offset 0, flags [DF], proto TCP (6), length 52)
    rpi35.lan.46656 > rpi33.lan.43980: Flags [.], cksum 0x830d (correct), ack 7308, win 1332, options [nop,nop,TS val 278149470 ecr 278150943], length 0
1527815029.017969 IP (tos 0x0, ttl 64, id 62078, offset 0, flags [DF], proto TCP (6), length 1096)
    rpi33.lan.49740 > rpi36.lan.46656: Flags [P.], cksum 0x8898 (incorrect -> 0xecde), seq 7308:8352, ack 7309, win 1324, options [nop,nop,TS val 278151143 ecr 278150944], length 1044
1527815029.018035 IP (tos 0x0, ttl 64, id 39022, offset 0, flags [DF], proto TCP (6), length 1096)
    rpi33.lan.43980 > rpi35.lan.46656: Flags [P.], cksum 0x8897 (incorrect -> 0x1b64), seq 7308:8352, ack 7309, win 1324, options [nop,nop,TS val 278151143 ecr 278149470], length 1044
1527815029.018052 IP (tos 0x0, ttl 64, id 9339, offset 0, flags [DF], proto TCP (6), length 1096)
    rpi33.lan.46656 > rpi34.lan.50462: Flags [P.], cksum 0x4d60 (correct), seq 9396:10440, ack 10441, win 1332, options [nop,nop,TS val 278151143 ecr 278150953], length 1044
1527815029.018255 IP (tos 0x0, ttl 64, id 59020, offset 0, flags [DF], proto TCP (6), length 1096)
    rpi33.lan.57588 > rpi37.lan.46656: Flags [P.], cksum 0x8899 (incorrect -> 0x5a32), seq 7308:8352, ack 7309, win 1324, options [nop,nop,TS val 278151143 ecr 278150928], length 1044
1527815029.018999 IP (tos 0x0, ttl 64, id 8743, offset 0, flags [DF], proto TCP (6), length 52)
    rpi35.lan.46656 > rpi33.lan.43980: Flags [.], cksum 0x7d6f (correct), ack 8352, win 1331, options [nop,nop,TS val 278149665 ecr 278151143], length 0
1527815029.021361 IP (tos 0x0, ttl 64, id 8744, offset 0, flags [DF], proto TCP (6), length 1096)
    rpi35.lan.46656 > rpi33.lan.43980: Flags [P.], cksum 0x5e7a (correct), seq 7309:8353, ack 8352, win 1332, options [nop,nop,TS val 278149665 ecr 278151143], length 1044
1527815029.021429 IP (tos 0x0, ttl 64, id 39023, offset 0, flags [DF], proto TCP (6), length 52)
    rpi33.lan.43980 > rpi35.lan.46656: Flags [.], cksum 0x8483 (incorrect -> 0x7963), ack 8353, win 1323, options [nop,nop,TS val 278151143 ecr 278149665], length 0
1527815029.030461 IP (tos 0x0, ttl 64, id 52910, offset 0, flags [DF], proto TCP (6), length 1096)
    rpi37.lan.46656 > rpi33.lan.57588: Flags [P.], cksum 0x00ad (correct), seq 7309:8353, ack 8352, win 1332, options [nop,nop,TS val 278151128 ecr 278151143], length 1044
1527815029.030569 IP (tos 0x0, ttl 64, id 59021, offset 0, flags [DF], proto TCP (6), length 52)
    rpi33.lan.57588 > rpi37.lan.46656: Flags [.], cksum 0x8485 (incorrect -> 0x3cd7), ack 8353, win 1323, options [nop,nop,TS val 278151144 ecr 278151128], length 0
1527815029.036100 IP (tos 0x0, ttl 64, id 17033, offset 0, flags [DF], proto TCP (6), length 1096)
    rpi36.lan.46656 > rpi33.lan.49740: Flags [P.], cksum 0x7519 (correct), seq 7309:8353, ack 8352, win 1332, options [nop,nop,TS val 278151144 ecr 278151143], length 1044
1527815029.036201 IP (tos 0x0, ttl 64, id 62079, offset 0, flags [DF], proto TCP (6), length 52)
    rpi33.lan.49740 > rpi36.lan.46656: Flags [.], cksum 0x8484 (incorrect -> 0xf25d), ack 8353, win 1323, options [nop,nop,TS val 278151145 ecr 278151144], length 0
1527815029.040366 IP (tos 0x0, ttl 64, id 45728, offset 0, flags [DF], proto TCP (6), length 1096)
    rpi34.lan.50462 > rpi33.lan.46656: Flags [P.], cksum 0x05c0 (correct), seq 10441:11485, ack 10440, win 1324, options [nop,nop,TS val 278151154 ecr 278151143], length 1044
1527815029.040453 IP (tos 0x0, ttl 64, id 9340, offset 0, flags [DF], proto TCP (6), length 52)
    rpi33.lan.46656 > rpi34.lan.50462: Flags [.], cksum 0x8482 (incorrect -> 0x882c), ack 11485, win 1331, options [nop,nop,TS val 278151145 ecr 278151154], length 0
1527815031.023668 IP (tos 0x0, ttl 64, id 9341, offset 0, flags [DF], proto TCP (6), length 1096)
    rpi33.lan.46656 > rpi34.lan.50462: Flags [P.], cksum 0x9c06 (correct), seq 10440:11484, ack 11485, win 1332, options [nop,nop,TS val 278151343 ecr 278151154], length 1044
1527815031.023721 IP (tos 0x0, ttl 64, id 62080, offset 0, flags [DF], proto TCP (6), length 1096)
    rpi33.lan.49740 > rpi36.lan.46656: Flags [P.], cksum 0x8898 (incorrect -> 0xdf35), seq 8352:9396, ack 8353, win 1324, options [nop,nop,TS val 278151343 ecr 278151144], length 1044
1527815031.023740 IP (tos 0x0, ttl 64, id 59022, offset 0, flags [DF], proto TCP (6), length 1096)
    rpi33.lan.57588 > rpi37.lan.46656: Flags [P.], cksum 0x8899 (incorrect -> 0x28df), seq 8352:9396, ack 8353, win 1324, options [nop,nop,TS val 278151343 ecr 278151128], length 1044
1527815031.023758 IP (tos 0x0, ttl 64, id 39024, offset 0, flags [DF], proto TCP (6), length 1096)
    rpi33.lan.43980 > rpi35.lan.46656: Flags [P.], cksum 0x8897 (incorrect -> 0x4f5c), seq 8352:9396, ack 8353, win 1324, options [nop,nop,TS val 278151343 ecr 278149665], length 1044
1527815031.024591 IP (tos 0x0, ttl 64, id 8745, offset 0, flags [DF], proto TCP (6), length 1096)
    rpi35.lan.46656 > rpi33.lan.43980: Flags [P.], cksum 0x3193 (correct), seq 8353:9397, ack 8352, win 1332, options [nop,nop,TS val 278149865 ecr 278151143], length 1044
1527815031.024697 IP (tos 0x0, ttl 64, id 39025, offset 0, flags [DF], proto TCP (6), length 52)
    rpi33.lan.43980 > rpi35.lan.46656: Flags [.], cksum 0x8483 (incorrect -> 0x6faa), ack 9397, win 1323, options [nop,nop,TS val 278151344 ecr 278149865], length 0
1527815031.033987 IP (tos 0x0, ttl 64, id 52911, offset 0, flags [DF], proto TCP (6), length 1096)
    rpi37.lan.46656 > rpi33.lan.57588: Flags [P.], cksum 0x10d0 (correct), seq 8353:9397, ack 9396, win 1332, options [nop,nop,TS val 278151329 ecr 278151343], length 1044
1527815031.034096 IP (tos 0x0, ttl 64, id 59023, offset 0, flags [DF], proto TCP (6), length 52)
    rpi33.lan.57588 > rpi37.lan.46656: Flags [.], cksum 0x8485 (incorrect -> 0x331e), ack 9397, win 1323, options [nop,nop,TS val 278151344 ecr 278151329], length 0
1527815031.039537 IP (tos 0x0, ttl 64, id 17034, offset 0, flags [DF], proto TCP (6), length 1096)
    rpi36.lan.46656 > rpi33.lan.49740: Flags [P.], cksum 0xd94c (correct), seq 8353:9397, ack 9396, win 1332, options [nop,nop,TS val 278151345 ecr 278151343], length 1044
1527815031.039634 IP (tos 0x0, ttl 64, id 62081, offset 0, flags [DF], proto TCP (6), length 52)
    rpi33.lan.49740 > rpi36.lan.46656: Flags [.], cksum 0x8484 (incorrect -> 0xe8a4), ack 9397, win 1323, options [nop,nop,TS val 278151345 ecr 278151345], length 0
1527815031.045871 IP (tos 0x0, ttl 64, id 45729, offset 0, flags [DF], proto TCP (6), length 1096)
    rpi34.lan.50462 > rpi33.lan.46656: Flags [P.], cksum 0xcbf5 (correct), seq 11485:12529, ack 11484, win 1324, options [nop,nop,TS val 278151354 ecr 278151343], length 1044
1527815031.045995 IP (tos 0x0, ttl 64, id 9342, offset 0, flags [DF], proto TCP (6), length 52)
    rpi33.lan.46656 > rpi34.lan.50462: Flags [.], cksum 0x8482 (incorrect -> 0x7e73), ack 12529, win 1331, options [nop,nop,TS val 278151346 ecr 278151354], length 0
1527815031.067373 IP (tos 0x0, ttl 64, id 8746, offset 0, flags [DF], proto TCP (6), length 52)
    rpi35.lan.46656 > rpi33.lan.43980: Flags [.], cksum 0x6f9d (correct), ack 9396, win 1332, options [nop,nop,TS val 278149870 ecr 278151343], length 0
1527815031.429261 IP (tos 0x0, ttl 64, id 8747, offset 0, flags [DF], proto TCP (6), length 1096)
    rpi35.lan.46656 > rpi33.lan.43980: Flags [P.], cksum 0x666b (correct), seq 9397:10441, ack 9396, win 1332, options [nop,nop,TS val 278149906 ecr 278151343], length 1044
1527815031.429403 IP (tos 0x0, ttl 64, id 39026, offset 0, flags [DF], proto TCP (6), length 52)
    rpi33.lan.43980 > rpi35.lan.46656: Flags [.], cksum 0x8483 (incorrect -> 0x6b45), ack 10441, win 1323, options [nop,nop,TS val 278151384 ecr 278149906], length 0
1527815031.429994 IP (tos 0x0, ttl 64, id 39027, offset 0, flags [DF], proto TCP (6), length 1096)
    rpi33.lan.43980 > rpi35.lan.46656: Flags [P.], cksum 0x8897 (incorrect -> 0x0793), seq 9396:10440, ack 10441, win 1324, options [nop,nop,TS val 278151384 ecr 278149906], length 1044
1527815031.430247 IP (tos 0x0, ttl 64, id 39028, offset 0, flags [DF], proto TCP (6), length 1096)
    rpi33.lan.43980 > rpi35.lan.46656: Flags [P.], cksum 0x8897 (incorrect -> 0xe080), seq 10440:11484, ack 10441, win 1324, options [nop,nop,TS val 278151384 ecr 278149906], length 1044
1527815031.430783 IP (tos 0x0, ttl 64, id 8748, offset 0, flags [DF], proto TCP (6), length 52)
    rpi35.lan.46656 > rpi33.lan.43980: Flags [.], cksum 0x6729 (correct), ack 10440, win 1331, options [nop,nop,TS val 278149906 ecr 278151384], length 0
1527815031.431016 IP (tos 0x0, ttl 64, id 8749, offset 0, flags [DF], proto TCP (6), length 52)
    rpi35.lan.46656 > rpi33.lan.43980: Flags [.], cksum 0x6315 (correct), ack 11484, win 1331, options [nop,nop,TS val 278149906 ecr 278151384], length 0
1527815031.431823 IP (tos 0x0, ttl 64, id 8750, offset 0, flags [DF], proto TCP (6), length 1096)
    rpi35.lan.46656 > rpi33.lan.43980: Flags [P.], cksum 0xa590 (correct), seq 10441:11485, ack 11484, win 1332, options [nop,nop,TS val 278149906 ecr 278151384], length 1044
1527815031.474509 IP (tos 0x0, ttl 64, id 39029, offset 0, flags [DF], proto TCP (6), length 52)
    rpi33.lan.43980 > rpi35.lan.46656: Flags [.], cksum 0x8483 (incorrect -> 0x5f03), ack 11485, win 1324, options [nop,nop,TS val 278151389 ecr 278149906], length 0
1527815033.023619 IP (tos 0x0, ttl 64, id 9343, offset 0, flags [DF], proto TCP (6), length 1096)
    rpi33.lan.46656 > rpi34.lan.50462: Flags [P.], cksum 0x05a0 (correct), seq 11484:12528, ack 12529, win 1332, options [nop,nop,TS val 278151543 ecr 278151354], length 1044
1527815033.023692 IP (tos 0x0, ttl 64, id 39030, offset 0, flags [DF], proto TCP (6), length 1096)
    rpi33.lan.43980 > rpi35.lan.46656: Flags [P.], cksum 0x8897 (incorrect -> 0x2389), seq 11484:12528, ack 11485, win 1324, options [nop,nop,TS val 278151543 ecr 278149906], length 1044
1527815033.023811 IP (tos 0x0, ttl 64, id 59024, offset 0, flags [DF], proto TCP (6), length 1096)
    rpi33.lan.57588 > rpi37.lan.46656: Flags [P.], cksum 0x8899 (incorrect -> 0x0850), seq 9396:10440, ack 9397, win 1324, options [nop,nop,TS val 278151543 ecr 278151329], length 1044
1527815033.023846 IP (tos 0x0, ttl 64, id 62082, offset 0, flags [DF], proto TCP (6), length 1096)
    rpi33.lan.49740 > rpi36.lan.46656: Flags [P.], cksum 0x8898 (incorrect -> 0x4605), seq 9396:10440, ack 9397, win 1324, options [nop,nop,TS val 278151543 ecr 278151345], length 1044
1527815033.027988 IP (tos 0x0, ttl 64, id 8751, offset 0, flags [DF], proto TCP (6), length 1096)
    rpi35.lan.46656 > rpi33.lan.43980: Flags [P.], cksum 0xa5b9 (correct), seq 11485:12529, ack 12528, win 1332, options [nop,nop,TS val 278150066 ecr 278151543], length 1044
1527815033.028098 IP (tos 0x0, ttl 64, id 39031, offset 0, flags [DF], proto TCP (6), length 52)
    rpi33.lan.43980 > rpi35.lan.46656: Flags [.], cksum 0x8483 (incorrect -> 0x55a1), ack 12529, win 1323, options [nop,nop,TS val 278151544 ecr 278150066], length 0
1527815033.037710 IP (tos 0x0, ttl 64, id 52912, offset 0, flags [DF], proto TCP (6), length 1096)
    rpi37.lan.46656 > rpi33.lan.57588: Flags [P.], cksum 0xed4d (correct), seq 9397:10441, ack 10440, win 1332, options [nop,nop,TS val 278151529 ecr 278151543], length 1044
1527815033.037792 IP (tos 0x0, ttl 64, id 59025, offset 0, flags [DF], proto TCP (6), length 52)
    rpi33.lan.57588 > rpi37.lan.46656: Flags [.], cksum 0x8485 (incorrect -> 0x2965), ack 10441, win 1323, options [nop,nop,TS val 278151545 ecr 278151529], length 0
1527815033.042845 IP (tos 0x0, ttl 64, id 17035, offset 0, flags [DF], proto TCP (6), length 1096)
    rpi36.lan.46656 > rpi33.lan.49740: Flags [P.], cksum 0x9610 (correct), seq 9397:10441, ack 10440, win 1332, options [nop,nop,TS val 278151545 ecr 278151543], length 1044
1527815033.042912 IP (tos 0x0, ttl 64, id 62083, offset 0, flags [DF], proto TCP (6), length 52)
    rpi33.lan.49740 > rpi36.lan.46656: Flags [.], cksum 0x8484 (incorrect -> 0xdeec), ack 10441, win 1323, options [nop,nop,TS val 278151545 ecr 278151545], length 0
1527815033.048530 IP (tos 0x0, ttl 64, id 45730, offset 0, flags [DF], proto TCP (6), length 1096)
    rpi34.lan.50462 > rpi33.lan.46656: Flags [P.], cksum 0x9a63 (correct), seq 12529:13573, ack 12528, win 1324, options [nop,nop,TS val 278151555 ecr 278151543], length 1044
1527815033.048629 IP (tos 0x0, ttl 64, id 9344, offset 0, flags [DF], proto TCP (6), length 52)
    rpi33.lan.46656 > rpi34.lan.50462: Flags [.], cksum 0x8482 (incorrect -> 0x74ba), ack 13573, win 1331, options [nop,nop,TS val 278151546 ecr 278151555], length 0
1527815034.924741 IP (tos 0x0, ttl 64, id 39032, offset 0, flags [DF], proto TCP (6), length 1096)
    rpi33.lan.43980 > rpi35.lan.46656: Flags [P.], cksum 0x8897 (incorrect -> 0x7495), seq 12528:13572, ack 12529, win 1324, options [nop,nop,TS val 278151734 ecr 278150066], length 1044
1527815034.924822 IP (tos 0x0, ttl 64, id 62084, offset 0, flags [DF], proto TCP (6), length 1096)
    rpi33.lan.49740 > rpi36.lan.46656: Flags [P.], cksum 0x8898 (incorrect -> 0x01e1), seq 10440:11484, ack 10441, win 1324, options [nop,nop,TS val 278151734 ecr 278151545], length 1044
1527815034.924843 IP (tos 0x0, ttl 64, id 9345, offset 0, flags [DF], proto TCP (6), length 1096)
    rpi33.lan.46656 > rpi34.lan.50462: Flags [P.], cksum 0x0599 (correct), seq 12528:13572, ack 13573, win 1332, options [nop,nop,TS val 278151734 ecr 278151555], length 1044
1527815034.924859 IP (tos 0x0, ttl 64, id 59026, offset 0, flags [DF], proto TCP (6), length 1096)
    rpi33.lan.57588 > rpi37.lan.46656: Flags [P.], cksum 0x8899 (incorrect -> 0x1edd), seq 10440:11484, ack 10441, win 1324, options [nop,nop,TS val 278151734 ecr 278151529], length 1044
