1527814402.688288 IP (tos 0x0, ttl 64, id 41983, offset 0, flags [DF], proto TCP (6), length 1096)
    rpi34.lan.50462 > rpi33.lan.46656: Flags [P.], cksum 0x5323 (correct), seq 1112025807:1112026851, ack 2413772100, win 1324, options [nop,nop,TS val 278088519 ecr 278088314], length 1044
1527814402.688452 IP (tos 0x0, ttl 64, id 5628, offset 0, flags [DF], proto TCP (6), length 52)
    rpi33.lan.46656 > rpi34.lan.50462: Flags [.], cksum 0x8482 (incorrect -> 0x7bd4), ack 1044, win 1331, options [nop,nop,TS val 278088510 ecr 278088519], length 0
1527814402.711953 IP (tos 0x0, ttl 64, id 4976, offset 0, flags [DF], proto TCP (6), length 1096)
    rpi35.lan.46656 > rpi33.lan.43980: Flags [P.], cksum 0x916b (correct), seq 239745857:239746901, ack 1147404021, win 1332, options [nop,nop,TS val 278087034 ecr 278088314], length 1044
1527814402.726553 IP (tos 0x0, ttl 64, id 49049, offset 0, flags [DF], proto TCP (6), length 1096)
    rpi37.lan.46656 > rpi33.lan.57588: Flags [P.], cksum 0x4397 (correct), seq 884788630:884789674, ack 3675597457, win 1332, options [nop,nop,TS val 278088498 ecr 278088314], length 1044
1527814402.731424 IP (tos 0x0, ttl 64, id 5629, offset 0, flags [DF], proto TCP (6), length 1096)
    rpi33.lan.46656 > rpi34.lan.50462: Flags [P.], cksum 0x61a4 (correct), seq 1:1045, ack 1044, win 1332, options [nop,nop,TS val 278088514 ecr 278088519], length 1044
1527814402.731653 IP (tos 0x0, ttl 64, id 35465, offset 0, flags [DF], proto TCP (6), length 1096)
    rpi33.lan.43980 > rpi35.lan.46656: Flags [P.], cksum 0x8897 (incorrect -> 0xec99), seq 1:1045, ack 1044, win 1324, options [nop,nop,TS val 278088514 ecr 278087034], length 1044
1527814402.731684 IP (tos 0x0, ttl 64, id 55478, offset 0, flags [DF], proto TCP (6), length 1096)
    rpi33.lan.57588 > rpi37.lan.46656: Flags [P.], cksum 0x8899 (incorrect -> 0x17c2), seq 1:1045, ack 1044, win 1324, options [nop,nop,TS val 278088514 ecr 278088498], length 1044
1527814402.731702 IP (tos 0x0, ttl 64, id 58540, offset 0, flags [DF], proto TCP (6), length 1096)
    rpi33.lan.49740 > rpi36.lan.46656: Flags [P.], cksum 0x8898 (incorrect -> 0xd98c), seq 569061859:569062903, ack 1463490213, win 1324, options [nop,nop,TS val 278088514 ecr 278088316], length 1044
1527814402.732209 IP (tos 0x0, ttl 64, id 41984, offset 0, flags [DF], proto TCP (6), length 52)
    rpi34.lan.50462 > rpi33.lan.46656: Flags [.], cksum 0x77c0 (correct), ack 1045, win 1323, options [nop,nop,TS val 278088523 ecr 278088514], length 0
1527814402.732431 IP (tos 0x0, ttl 64, id 4977, offset 0, flags [DF], proto TCP (6), length 52)
    rpi35.lan.46656 > rpi33.lan.43980: Flags [.], cksum 0x442f (correct), ack 1045, win 1331, options [nop,nop,TS val 278087036 ecr 278088514], length 0
1527814402.732433 IP (tos 0x0, ttl 64, id 49050, offset 0, flags [DF], proto TCP (6), length 52)
    rpi37.lan.46656 > rpi33.lan.57588: Flags [.], cksum 0x8e38 (correct), ack 1045, win 1331, options [nop,nop,TS val 278088499 ecr 278088514], length 0
1527814402.761522 IP (tos 0x0, ttl 64, id 13094, offset 0, flags [DF], proto TCP (6), length 1096)
    rpi36.lan.46656 > rpi33.lan.49740: Flags [P.], cksum 0x1ac8 (correct), seq 1:1045, ack 1044, win 1332, options [nop,nop,TS val 278088517 ecr 278088514], length 1044
1527814402.761600 IP (tos 0x0, ttl 64, id 58541, offset 0, flags [DF], proto TCP (6), length 52)
    rpi33.lan.49740 > rpi36.lan.46656: Flags [.], cksum 0x8484 (incorrect -> 0xf31f), ack 1045, win 1323, options [nop,nop,TS val 278088517 ecr 278088517], length 0
1527814404.691365 IP (tos 0x0, ttl 64, id 41985, offset 0, flags [DF], proto TCP (6), length 1096)
    rpi34.lan.50462 > rpi33.lan.46656: Flags [P.], cksum 0x413e (correct), seq 1044:2088, ack 1045, win 1324, options [nop,nop,TS val 278088719 ecr 278088514], length 1044
1527814404.691530 IP (tos 0x0, ttl 64, id 5630, offset 0, flags [DF], proto TCP (6), length 52)
    rpi33.lan.46656 > rpi34.lan.50462: Flags [.], cksum 0x8482 (incorrect -> 0x721c), ack 2088, win 1331, options [nop,nop,TS val 278088710 ecr 278088719], length 0
1527814404.715647 IP (tos 0x0, ttl 64, id 4978, offset 0, flags [DF], proto TCP (6), length 1096)
    rpi35.lan.46656 > rpi33.lan.43980: Flags [P.], cksum 0x6fcc (correct), seq 1044:2088, ack 1045, win 1332, options [nop,nop,TS val 278087234 ecr 278088514], length 1044
1527814404.729991 IP (tos 0x0, ttl 64, id 49051, offset 0, flags [DF], proto TCP (6), length 1096)
    rpi37.lan.46656 > rpi33.lan.57588: Flags [P.], cksum 0x7f69 (correct), seq 1044:2088, ack 1045, win 1332, options [nop,nop,TS val 278088698 ecr 278088514], length 1044
1527814404.734979 IP (tos 0x0, ttl 64, id 5631, offset 0, flags [DF], proto TCP (6), length 1096)
    rpi33.lan.46656 > rpi34.lan.50462: Flags [P.], cksum 0x3a1c (correct), seq 1045:2089, ack 2088, win 1332, options [nop,nop,TS val 278088715 ecr 278088719], length 1044
1527814404.735072 IP (tos 0x0, ttl 64, id 58542, offset 0, flags [DF], proto TCP (6), length 1096)
    rpi33.lan.49740 > rpi36.lan.46656: Flags [P.], cksum 0x8898 (incorrect -> 0x1756), seq 1044:2088, ack 1045, win 1324, options [nop,nop,TS val 278088715 ecr 278088517], length 1044
1527814404.735375 IP (tos 0x0, ttl 64, id 55479, offset 0, flags [DF], proto TCP (6), length 1096)
    rpi33.lan.57588 > rpi37.lan.46656: Flags [P.], cksum 0x8899 (incorrect -> 0x114e), seq 1045:2089, ack 2088, win 1324, options [nop,nop,TS val 278088715 ecr 278088698], length 1044
1527814404.735615 IP (tos 0x0, ttl 64, id 35466, offset 0, flags [DF], proto TCP (6), length 1096)
    rpi33.lan.43980 > rpi35.lan.46656: Flags [P.], cksum 0x8897 (incorrect -> 0x2a93), seq 1045:2089, ack 2088, win 1324, options [nop,nop,TS val 278088715 ecr 278087234], length 1044
1527814404.735747 IP (tos 0x0, ttl 64, id 41986, offset 0, flags [DF], proto TCP (6), length 52)
    rpi34.lan.50462 > rpi33.lan.46656: Flags [.], cksum 0x6e07 (correct), ack 2089, win 1323, options [nop,nop,TS val 278088723 ecr 278088715], length 0
1527814404.736143 IP (tos 0x0, ttl 64, id 49052, offset 0, flags [DF], proto TCP (6), length 52)
    rpi37.lan.46656 > rpi33.lan.57588: Flags [.], cksum 0x847f (correct), ack 2089, win 1331, options [nop,nop,TS val 278088699 ecr 278088715], length 0
1527814404.736380 IP (tos 0x0, ttl 64, id 4979, offset 0, flags [DF], proto TCP (6), length 52)
    rpi35.lan.46656 > rpi33.lan.43980: Flags [.], cksum 0x3a76 (correct), ack 2089, win 1331, options [nop,nop,TS val 278087236 ecr 278088715], length 0
1527814404.765057 IP (tos 0x0, ttl 64, id 13095, offset 0, flags [DF], proto TCP (6), length 1096)
    rpi36.lan.46656 > rpi33.lan.49740: Flags [P.], cksum 0x67fb (correct), seq 1045:2089, ack 2088, win 1332, options [nop,nop,TS val 278088717 ecr 278088715], length 1044
1527814404.765152 IP (tos 0x0, ttl 64, id 58543, offset 0, flags [DF], proto TCP (6), length 52)
    rpi33.lan.49740 > rpi36.lan.46656: Flags [.], cksum 0x8484 (incorrect -> 0xe966), ack 2089, win 1323, options [nop,nop,TS val 278088718 ecr 278088717], length 0
1527814406.694942 IP (tos 0x0, ttl 64, id 41987, offset 0, flags [DF], proto TCP (6), length 1096)
    rpi34.lan.50462 > rpi33.lan.46656: Flags [P.], cksum 0x96f3 (correct), seq 2088:3132, ack 2089, win 1324, options [nop,nop,TS val 278088919 ecr 278088715], length 1044
1527814406.695112 IP (tos 0x0, ttl 64, id 5632, offset 0, flags [DF], proto TCP (6), length 52)
    rpi33.lan.46656 > rpi34.lan.50462: Flags [.], cksum 0x8482 (incorrect -> 0x6863), ack 3132, win 1331, options [nop,nop,TS val 278088911 ecr 278088919], length 0
1527814406.718608 IP (tos 0x0, ttl 64, id 4980, offset 0, flags [DF], proto TCP (6), length 1096)
    rpi35.lan.46656 > rpi33.lan.43980: Flags [P.], cksum 0x2e06 (correct), seq 2088:3132, ack 2089, win 1332, options [nop,nop,TS val 278087435 ecr 278088715], length 1044
1527814406.733557 IP (tos 0x0, ttl 64, id 49053, offset 0, flags [DF], proto TCP (6), length 1096)
    rpi37.lan.46656 > rpi33.lan.57588: Flags [P.], cksum 0x3379 (correct), seq 2088:3132, ack 2089, win 1332, options [nop,nop,TS val 278088899 ecr 278088715], length 1044
1527814406.736308 IP (tos 0x0, ttl 64, id 35467, offset 0, flags [DF], proto TCP (6), length 1096)
    rpi33.lan.43980 > rpi35.lan.46656: Flags [P.], cksum 0x8897 (incorrect -> 0x2ec6), seq 2089:3133, ack 3132, win 1324, options [nop,nop,TS val 278088915 ecr 278087435], length 1044
1527814406.736356 IP (tos 0x0, ttl 64, id 58544, offset 0, flags [DF], proto TCP (6), length 1096)
    rpi33.lan.49740 > rpi36.lan.46656: Flags [P.], cksum 0x8898 (incorrect -> 0x78f2), seq 2088:3132, ack 2089, win 1324, options [nop,nop,TS val 278088915 ecr 278088717], length 1044
1527814406.736577 IP (tos 0x0, ttl 64, id 5633, offset 0, flags [DF], proto TCP (6), length 1096)
    rpi33.lan.46656 > rpi34.lan.50462: Flags [P.], cksum 0xf5eb (correct), seq 2089:3133, ack 3132, win 1332, options [nop,nop,TS val 278088915 ecr 278088919], length 1044
1527814406.736604 IP (tos 0x0, ttl 64, id 55480, offset 0, flags [DF], proto TCP (6), length 1096)
    rpi33.lan.57588 > rpi37.lan.46656: Flags [P.], cksum 0x8899 (incorrect -> 0x79b6), seq 2089:3133, ack 3132, win 1324, options [nop,nop,TS val 278088915 ecr 278088899], length 1044
1527814406.737105 IP (tos 0x0, ttl 64, id 4981, offset 0, flags [DF], proto TCP (6), length 52)
    rpi35.lan.46656 > rpi33.lan.43980: Flags [.], cksum 0x30be (correct), ack 3133, win 1331, options [nop,nop,TS val 278087436 ecr 278088915], length 0
1527814406.737345 IP (tos 0x0, ttl 64, id 41988, offset 0, flags [DF], proto TCP (6), length 52)
    rpi34.lan.50462 > rpi33.lan.46656: Flags [.], cksum 0x644f (correct), ack 3133, win 1323, options [nop,nop,TS val 278088923 ecr 278088915], length 0
1527814406.737347 IP (tos 0x0, ttl 64, id 49054, offset 0, flags [DF], proto TCP (6), length 52)
    rpi37.lan.46656 > rpi33.lan.57588: Flags [.], cksum 0x7ac7 (correct), ack 3133, win 1331, options [nop,nop,TS val 278088899 ecr 278088915], length 0
1527814406.769124 IP (tos 0x0, ttl 64, id 13096, offset 0, flags [DF], proto TCP (6), length 1096)
    rpi36.lan.46656 > rpi33.lan.49740: Flags [P.], cksum 0x92c7 (correct), seq 2089:3133, ack 3132, win 1332, options [nop,nop,TS val 278088918 ecr 278088915], length 1044
1527814406.769212 IP (tos 0x0, ttl 64, id 58545, offset 0, flags [DF], proto TCP (6), length 52)
    rpi33.lan.49740 > rpi36.lan.46656: Flags [.], cksum 0x8484 (incorrect -> 0xdfad), ack 3133, win 1323, options [nop,nop,TS val 278088918 ecr 278088918], length 0
1527814408.698328 IP (tos 0x0, ttl 64, id 41989, offset 0, flags [DF], proto TCP (6), length 1096)
    rpi34.lan.50462 > rpi33.lan.46656: Flags [P.], cksum 0x4751 (correct), seq 3132:4176, ack 3133, win 1324, options [nop,nop,TS val 278089120 ecr 278088915], length 1044
1527814408.698526 IP (tos 0x0, ttl 64, id 5634, offset 0, flags [DF], proto TCP (6), length 52)
    rpi33.lan.46656 > rpi34.lan.50462: Flags [.], cksum 0x8482 (incorrect -> 0x5eaa), ack 4176, win 1331, options [nop,nop,TS val 278089111 ecr 278089120], length 0
1527814408.721818 IP (tos 0x0, ttl 64, id 4982, offset 0, flags [DF], proto TCP (6), length 1096)
    rpi35.lan.46656 > rpi33.lan.43980: Flags [P.], cksum 0x276a (correct), seq 3132:4176, ack 3133, win 1332, options [nop,nop,TS val 278087635 ecr 278088915], length 1044
1527814408.737180 IP (tos 0x0, ttl 64, id 49055, offset 0, flags [DF], proto TCP (6), length 1096)
    rpi37.lan.46656 > rpi33.lan.57588: Flags [P.], cksum 0xaf7c (correct), seq 3132:4176, ack 3133, win 1332, options [nop,nop,TS val 278089099 ecr 278088915], length 1044
1527814408.743542 IP (tos 0x0, ttl 64, id 5635, offset 0, flags [DF], proto TCP (6), length 1096)
    rpi33.lan.46656 > rpi34.lan.50462: Flags [P.], cksum 0x8a17 (correct), seq 3133:4177, ack 4176, win 1332, options [nop,nop,TS val 278089115 ecr 278089120], length 1044
1527814408.743587 IP (tos 0x0, ttl 64, id 35468, offset 0, flags [DF], proto TCP (6), length 1096)
    rpi33.lan.43980 > rpi35.lan.46656: Flags [P.], cksum 0x8897 (incorrect -> 0x0b34), seq 3133:4177, ack 4176, win 1324, options [nop,nop,TS val 278089115 ecr 278087635], length 1044
1527814408.743755 IP (tos 0x0, ttl 64, id 58546, offset 0, flags [DF], proto TCP (6), length 1096)
    rpi33.lan.49740 > rpi36.lan.46656: Flags [P.], cksum 0x8898 (incorrect -> 0x4ce0), seq 3132:4176, ack 3133, win 1324, options [nop,nop,TS val 278089115 ecr 278088918], length 1044
1527814408.743992 IP (tos 0x0, ttl 64, id 55481, offset 0, flags [DF], proto TCP (6), length 1096)
    rpi33.lan.57588 > rpi37.lan.46656: Flags [P.], cksum 0x8899 (incorrect -> 0x770d), seq 3133:4177, ack 4176, win 1324, options [nop,nop,TS val 278089115 ecr 278089099], length 1044
1527814408.744333 IP (tos 0x0, ttl 64, id 41990, offset 0, flags [DF], proto TCP (6), length 52)
    rpi34.lan.50462 > rpi33.lan.46656: Flags [.], cksum 0x5a96 (correct), ack 4177, win 1323, options [nop,nop,TS val 278089124 ecr 278089115], length 0
1527814408.744335 IP (tos 0x0, ttl 64, id 4983, offset 0, flags [DF], proto TCP (6), length 52)
    rpi35.lan.46656 > rpi33.lan.43980: Flags [.], cksum 0x2705 (correct), ack 4177, win 1331, options [nop,nop,TS val 278087637 ecr 278089115], length 0
1527814408.744764 IP (tos 0x0, ttl 64, id 49056, offset 0, flags [DF], proto TCP (6), length 52)
    rpi37.lan.46656 > rpi33.lan.57588: Flags [.], cksum 0x710e (correct), ack 4177, win 1331, options [nop,nop,TS val 278089100 ecr 278089115], length 0
1527814408.772086 IP (tos 0x0, ttl 64, id 13097, offset 0, flags [DF], proto TCP (6), length 1096)
    rpi36.lan.46656 > rpi33.lan.49740: Flags [P.], cksum 0x411a (correct), seq 3133:4177, ack 4176, win 1332, options [nop,nop,TS val 278089118 ecr 278089115], length 1044
1527814408.772176 IP (tos 0x0, ttl 64, id 58547, offset 0, flags [DF], proto TCP (6), length 52)
    rpi33.lan.49740 > rpi36.lan.46656: Flags [.], cksum 0x8484 (incorrect -> 0xd5f5), ack 4177, win 1323, options [nop,nop,TS val 278089118 ecr 278089118], length 0
1527814410.701907 IP (tos 0x0, ttl 64, id 41991, offset 0, flags [DF], proto TCP (6), length 1096)
    rpi34.lan.50462 > rpi33.lan.46656: Flags [P.], cksum 0x282d (correct), seq 4176:5220, ack 4177, win 1324, options [nop,nop,TS val 278089320 ecr 278089115], length 1044
1527814410.702074 IP (tos 0x0, ttl 64, id 5636, offset 0, flags [DF], proto TCP (6), length 52)
    rpi33.lan.46656 > rpi34.lan.50462: Flags [.], cksum 0x8482 (incorrect -> 0x54f2), ack 5220, win 1331, options [nop,nop,TS val 278089311 ecr 278089320], length 0
1527814410.725656 IP (tos 0x0, ttl 64, id 4984, offset 0, flags [DF], proto TCP (6), length 1096)
    rpi35.lan.46656 > rpi33.lan.43980: Flags [P.], cksum 0xc610 (correct), seq 4176:5220, ack 4177, win 1332, options [nop,nop,TS val 278087835 ecr 278089115], length 1044
1527814410.740372 IP (tos 0x0, ttl 64, id 49057, offset 0, flags [DF], proto TCP (6), length 1096)
    rpi37.lan.46656 > rpi33.lan.57588: Flags [P.], cksum 0x457a (correct), seq 4176:5220, ack 4177, win 1332, options [nop,nop,TS val 278089299 ecr 278089115], length 1044
1527814410.747152 IP (tos 0x0, ttl 64, id 58548, offset 0, flags [DF], proto TCP (6), length 1096)
    rpi33.lan.49740 > rpi36.lan.46656: Flags [P.], cksum 0x8898 (incorrect -> 0x44de), seq 4176:5220, ack 4177, win 1324, options [nop,nop,TS val 278089316 ecr 278089118], length 1044
1527814410.747290 IP (tos 0x0, ttl 64, id 55482, offset 0, flags [DF], proto TCP (6), length 1096)
    rpi33.lan.57588 > rpi37.lan.46656: Flags [P.], cksum 0x8899 (incorrect -> 0x82de), seq 4177:5221, ack 5220, win 1324, options [nop,nop,TS val 278089316 ecr 278089299], length 1044
1527814410.747402 IP (tos 0x0, ttl 64, id 5637, offset 0, flags [DF], proto TCP (6), length 1096)
    rpi33.lan.46656 > rpi34.lan.50462: Flags [P.], cksum 0xf266 (correct), seq 4177:5221, ack 5220, win 1332, options [nop,nop,TS val 278089316 ecr 278089320], length 1044
1527814410.747524 IP (tos 0x0, ttl 64, id 35469, offset 0, flags [DF], proto TCP (6), length 1096)
    rpi33.lan.43980 > rpi35.lan.46656: Flags [P.], cksum 0x8897 (incorrect -> 0x9958), seq 4177:5221, ack 5220, win 1324, options [nop,nop,TS val 278089316 ecr 278087835], length 1044
1527814410.748073 IP (tos 0x0, ttl 64, id 49058, offset 0, flags [DF], proto TCP (6), length 52)
    rpi37.lan.46656 > rpi33.lan.57588: Flags [.], cksum 0x6755 (correct), ack 5221, win 1331, options [nop,nop,TS val 278089300 ecr 278089316], length 0
1527814410.748076 IP (tos 0x0, ttl 64, id 41992, offset 0, flags [DF], proto TCP (6), length 52)
    rpi34.lan.50462 > rpi33.lan.46656: Flags [.], cksum 0x50dc (correct), ack 5221, win 1323, options [nop,nop,TS val 278089325 ecr 278089316], length 0
1527814410.748315 IP (tos 0x0, ttl 64, id 4985, offset 0, flags [DF], proto TCP (6), length 52)
    rpi35.lan.46656 > rpi33.lan.43980: Flags [.], cksum 0x1d4b (correct), ack 5221, win 1331, options [nop,nop,TS val 278087838 ecr 278089316], length 0
1527814410.775409 IP (tos 0x0, ttl 64, id 13098, offset 0, flags [DF], proto TCP (6), length 1096)
    rpi36.lan.46656 > rpi33.lan.49740: Flags [P.], cksum 0x0a7b (correct), seq 4177:5221, ack 5220, win 1332, options [nop,nop,TS val 278089318 ecr 278089316], length 1044
1527814410.775495 IP (tos 0x0, ttl 64, id 58549, offset 0, flags [DF], proto TCP (6), length 52)
    rpi33.lan.49740 > rpi36.lan.46656: Flags [.], cksum 0x8484 (incorrect -> 0xcc3c), ack 5221, win 1323, options [nop,nop,TS val 278089319 ecr 278089318], length 0
1527814412.705251 IP (tos 0x0, ttl 64, id 41993, offset 0, flags [DF], proto TCP (6), length 1096)
    rpi34.lan.50462 > rpi33.lan.46656: Flags [P.], cksum 0x959b (correct), seq 5220:6264, ack 5221, win 1324, options [nop,nop,TS val 278089520 ecr 278089316], length 1044
1527814412.705437 IP (tos 0x0, ttl 64, id 5638, offset 0, flags [DF], proto TCP (6), length 52)
    rpi33.lan.46656 > rpi34.lan.50462: Flags [.], cksum 0x8482 (incorrect -> 0x4b39), ack 6264, win 1331, options [nop,nop,TS val 278089512 ecr 278089520], length 0
1527814412.729004 IP (tos 0x0, ttl 64, id 4986, offset 0, flags [DF], proto TCP (6), length 1096)
    rpi35.lan.46656 > rpi33.lan.43980: Flags [P.], cksum 0x7546 (correct), seq 5220:6264, ack 5221, win 1332, options [nop,nop,TS val 278088036 ecr 278089316], length 1044
1527814412.743813 IP (tos 0x0, ttl 64, id 49059, offset 0, flags [DF], proto TCP (6), length 1096)
    rpi37.lan.46656 > rpi33.lan.57588: Flags [P.], cksum 0x57d9 (correct), seq 5220:6264, ack 5221, win 1332, options [nop,nop,TS val 278089500 ecr 278089316], length 1044
1527814412.751017 IP (tos 0x0, ttl 64, id 5639, offset 0, flags [DF], proto TCP (6), length 1096)
    rpi33.lan.46656 > rpi34.lan.50462: Flags [P.], cksum 0xb2c5 (correct), seq 5221:6265, ack 6264, win 1332, options [nop,nop,TS val 278089516 ecr 278089520], length 1044
1527814412.751090 IP (tos 0x0, ttl 64, id 58550, offset 0, flags [DF], proto TCP (6), length 1096)
    rpi33.lan.49740 > rpi36.lan.46656: Flags [P.], cksum 0x8898 (incorrect -> 0x264c), seq 5220:6264, ack 5221, win 1324, options [nop,nop,TS val 278089516 ecr 278089318], length 1044
1527814412.751277 IP (tos 0x0, ttl 64, id 35470, offset 0, flags [DF], proto TCP (6), length 1096)
    rpi33.lan.43980 > rpi35.lan.46656: Flags [P.], cksum 0x8897 (incorrect -> 0x65e5), seq 5221:6265, ack 6264, win 1324, options [nop,nop,TS val 278089516 ecr 278088036], length 1044
1527814412.751617 IP (tos 0x0, ttl 64, id 55483, offset 0, flags [DF], proto TCP (6), length 1096)
    rpi33.lan.57588 > rpi37.lan.46656: Flags [P.], cksum 0x8899 (incorrect -> 0x5385), seq 5221:6265, ack 6264, win 1324, options [nop,nop,TS val 278089516 ecr 278089500], length 1044
1527814412.751832 IP (tos 0x0, ttl 64, id 41994, offset 0, flags [DF], proto TCP (6), length 52)
    rpi34.lan.50462 > rpi33.lan.46656: Flags [.], cksum 0x4724 (correct), ack 6265, win 1323, options [nop,nop,TS val 278089525 ecr 278089516], length 0
1527814412.752048 IP (tos 0x0, ttl 64, id 4987, offset 0, flags [DF], proto TCP (6), length 52)
    rpi35.lan.46656 > rpi33.lan.43980: Flags [.], cksum 0x1393 (correct), ack 6265, win 1331, options [nop,nop,TS val 278088038 ecr 278089516], length 0
1527814412.752380 IP (tos 0x0, ttl 64, id 49060, offset 0, flags [DF], proto TCP (6), length 52)
    rpi37.lan.46656 > rpi33.lan.57588: Flags [.], cksum 0x5d9c (correct), ack 6265, win 1331, options [nop,nop,TS val 278089501 ecr 278089516], length 0
1527814412.778870 IP (tos 0x0, ttl 64, id 13099, offset 0, flags [DF], proto TCP (6), length 1096)
    rpi36.lan.46656 > rpi33.lan.49740: Flags [P.], cksum 0xbd3a (correct), seq 5221:6265, ack 6264, win 1332, options [nop,nop,TS val 278089519 ecr 278089516], length 1044
1527814412.779063 IP (tos 0x0, ttl 64, id 58551, offset 0, flags [DF], proto TCP (6), length 52)
    rpi33.lan.49740 > rpi36.lan.46656: Flags [.], cksum 0x8484 (incorrect -> 0xc283), ack 6265, win 1323, options [nop,nop,TS val 278089519 ecr 278089519], length 0
1527814413.498004 IP (tos 0x0, ttl 64, id 5640, offset 0, flags [DF], proto TCP (6), length 1096)
    rpi33.lan.46656 > rpi34.lan.50462: Flags [P.], cksum 0x460e (correct), seq 6265:7309, ack 6264, win 1332, options [nop,nop,TS val 278089591 ecr 278089525], length 1044
1527814413.498464 IP (tos 0x0, ttl 64, id 58552, offset 0, flags [DF], proto TCP (6), length 1096)
    rpi33.lan.49740 > rpi36.lan.46656: Flags [P.], cksum 0x8898 (incorrect -> 0x1895), seq 6264:7308, ack 6265, win 1324, options [nop,nop,TS val 278089591 ecr 278089519], length 1044
1527814413.498511 IP (tos 0x0, ttl 64, id 35471, offset 0, flags [DF], proto TCP (6), length 1096)
    rpi33.lan.43980 > rpi35.lan.46656: Flags [P.], cksum 0x8897 (incorrect -> 0xe548), seq 6265:7309, ack 6264, win 1324, options [nop,nop,TS val 278089591 ecr 278088038], length 1044
1527814413.498862 IP (tos 0x0, ttl 64, id 55484, offset 0, flags [DF], proto TCP (6), length 1096)
    rpi33.lan.57588 > rpi37.lan.46656: Flags [P.], cksum 0x8899 (incorrect -> 0x66d9), seq 6265:7309, ack 6264, win 1324, options [nop,nop,TS val 278089591 ecr 278089501], length 1044
1527814413.498951 IP (tos 0x0, ttl 64, id 41995, offset 0, flags [DF], proto TCP (6), length 52)
    rpi34.lan.50462 > rpi33.lan.46656: Flags [.], cksum 0x427a (correct), ack 7309, win 1323, options [nop,nop,TS val 278089600 ecr 278089591], length 0
1527814413.499394 IP (tos 0x0, ttl 64, id 4988, offset 0, flags [DF], proto TCP (6), length 52)
    rpi35.lan.46656 > rpi33.lan.43980: Flags [.], cksum 0x0ee9 (correct), ack 7309, win 1331, options [nop,nop,TS val 278088113 ecr 278089591], length 0
1527814413.499728 IP (tos 0x0, ttl 64, id 49061, offset 0, flags [DF], proto TCP (6), length 52)
    rpi37.lan.46656 > rpi33.lan.57588: Flags [.], cksum 0x58f3 (correct), ack 7309, win 1331, options [nop,nop,TS val 278089575 ecr 278089591], length 0
1527814413.547479 IP (tos 0x0, ttl 64, id 13100, offset 0, flags [DF], proto TCP (6), length 52)
    rpi36.lan.46656 > rpi33.lan.49740: Flags [.], cksum 0xbdd1 (correct), ack 7308, win 1332, options [nop,nop,TS val 278089596 ecr 278089591], length 0
1527814413.604535 IP (tos 0x0, ttl 64, id 41996, offset 0, flags [DF], proto TCP (6), length 1096)
    rpi34.lan.50462 > rpi33.lan.46656: Flags [P.], cksum 0xa136 (correct), seq 6264:7308, ack 7309, win 1324, options [nop,nop,TS val 278089610 ecr 278089591], length 1044
1527814413.604756 IP (tos 0x0, ttl 64, id 5641, offset 0, flags [DF], proto TCP (6), length 52)
    rpi33.lan.46656 > rpi34.lan.50462: Flags [.], cksum 0x8482 (incorrect -> 0x3e49), ack 7308, win 1331, options [nop,nop,TS val 278089602 ecr 278089610], length 0
1527814413.604810 IP (tos 0x0, ttl 64, id 4989, offset 0, flags [DF], proto TCP (6), length 1096)
    rpi35.lan.46656 > rpi33.lan.43980: Flags [P.], cksum 0xabc8 (correct), seq 6264:7308, ack 7309, win 1332, options [nop,nop,TS val 278088123 ecr 278089591], length 1044
1527814413.604987 IP (tos 0x0, ttl 64, id 49062, offset 0, flags [DF], proto TCP (6), length 1096)
    rpi37.lan.46656 > rpi33.lan.57588: Flags [P.], cksum 0x4468 (correct), seq 6264:7308, ack 7309, win 1332, options [nop,nop,TS val 278089586 ecr 278089591], length 1044
1527814413.605300 IP (tos 0x0, ttl 64, id 13101, offset 0, flags [DF], proto TCP (6), length 1096)
    rpi36.lan.46656 > rpi33.lan.49740: Flags [P.], cksum 0x6c6f (correct), seq 6265:7309, ack 7308, win 1332, options [nop,nop,TS val 278089601 ecr 278089591], length 1044
1527814413.605355 IP (tos 0x0, ttl 64, id 58553, offset 0, flags [DF], proto TCP (6), length 52)
    rpi33.lan.49740 > rpi36.lan.46656: Flags [.], cksum 0x8484 (incorrect -> 0xb9b6), ack 7309, win 1323, options [nop,nop,TS val 278089602 ecr 278089601], length 0
1527814413.654525 IP (tos 0x0, ttl 64, id 55485, offset 0, flags [DF], proto TCP (6), length 52)
    rpi33.lan.57588 > rpi37.lan.46656: Flags [.], cksum 0x8485 (incorrect -> 0x54cb), ack 7308, win 1324, options [nop,nop,TS val 278089607 ecr 278089586], length 0
1527814413.654625 IP (tos 0x0, ttl 64, id 35472, offset 0, flags [DF], proto TCP (6), length 52)
    rpi33.lan.43980 > rpi35.lan.46656: Flags [.], cksum 0x8483 (incorrect -> 0x0ac2), ack 7308, win 1324, options [nop,nop,TS val 278089607 ecr 278088123], length 0
1527814413.696157 IP (tos 0x0, ttl 64, id 5642, offset 0, flags [DF], proto TCP (6), length 1096)
    rpi33.lan.46656 > rpi34.lan.50462: Flags [P.], cksum 0xb776 (correct), seq 7309:8353, ack 7308, win 1332, options [nop,nop,TS val 278089611 ecr 278089610], length 1044
1527814413.696281 IP (tos 0x0, ttl 64, id 55486, offset 0, flags [DF], proto TCP (6), length 1096)
    rpi33.lan.57588 > rpi37.lan.46656: Flags [P.], cksum 0x8899 (incorrect -> 0xc201), seq 7309:8353, ack 7308, win 1324, options [nop,nop,TS val 278089611 ecr 278089586], length 1044
1527814413.696423 IP (tos 0x0, ttl 64, id 35473, offset 0, flags [DF], proto TCP (6), length 1096)
    rpi33.lan.43980 > rpi35.lan.46656: Flags [P.], cksum 0x8897 (incorrect -> 0x773e), seq 7309:8353, ack 7308, win 1324, options [nop,nop,TS val 278089611 ecr 278088123], length 1044
1527814413.696652 IP (tos 0x0, ttl 64, id 58554, offset 0, flags [DF], proto TCP (6), length 1096)
    rpi33.lan.49740 > rpi36.lan.46656: Flags [P.], cksum 0x8898 (incorrect -> 0x96d0), seq 7308:8352, ack 7309, win 1324, options [nop,nop,TS val 278089611 ecr 278089601], length 1044
1527814413.697029 IP (tos 0x0, ttl 64, id 49063, offset 0, flags [DF], proto TCP (6), length 52)
    rpi37.lan.46656 > rpi33.lan.57588: Flags [.], cksum 0x50a3 (correct), ack 8353, win 1331, options [nop,nop,TS val 278089595 ecr 278089611], length 0
1527814413.697032 IP (tos 0x0, ttl 64, id 41997, offset 0, flags [DF], proto TCP (6), length 52)
    rpi34.lan.50462 > rpi33.lan.46656: Flags [.], cksum 0x3a2b (correct), ack 8353, win 1323, options [nop,nop,TS val 278089619 ecr 278089611], length 0
1527814413.697200 IP (tos 0x0, ttl 64, id 4990, offset 0, flags [DF], proto TCP (6), length 52)
    rpi35.lan.46656 > rpi33.lan.43980: Flags [.], cksum 0x069a (correct), ack 8353, win 1331, options [nop,nop,TS val 278088132 ecr 278089611], length 0
1527814413.697478 IP (tos 0x0, ttl 64, id 13102, offset 0, flags [DF], proto TCP (6), length 52)
    rpi36.lan.46656 > rpi33.lan.49740: Flags [.], cksum 0xb587 (correct), ack 8352, win 1331, options [nop,nop,TS val 278089611 ecr 278089611], length 0
1527814413.717612 IP (tos 0x0, ttl 64, id 49064, offset 0, flags [DF], proto TCP (6), length 1096)
    rpi37.lan.46656 > rpi33.lan.57588: Flags [P.], cksum 0xc856 (correct), seq 7308:8352, ack 8353, win 1332, options [nop,nop,TS val 278089597 ecr 278089611], length 1044
1527814413.717683 IP (tos 0x0, ttl 64, id 55487, offset 0, flags [DF], proto TCP (6), length 52)
    rpi33.lan.57588 > rpi37.lan.46656: Flags [.], cksum 0x8485 (incorrect -> 0x4c93), ack 8352, win 1323, options [nop,nop,TS val 278089613 ecr 278089597], length 0
1527814413.717808 IP (tos 0x0, ttl 64, id 49065, offset 0, flags [DF], proto TCP (6), length 1096)
    rpi37.lan.46656 > rpi33.lan.57588: Flags [P.], cksum 0xd394 (correct), seq 8352:9396, ack 8353, win 1332, options [nop,nop,TS val 278089597 ecr 278089611], length 1044
1527814413.717863 IP (tos 0x0, ttl 64, id 55488, offset 0, flags [DF], proto TCP (6), length 52)
    rpi33.lan.57588 > rpi37.lan.46656: Flags [.], cksum 0x8485 (incorrect -> 0x487f), ack 9396, win 1323, options [nop,nop,TS val 278089613 ecr 278089597], length 0
1527814413.802282 IP (tos 0x0, ttl 64, id 41998, offset 0, flags [DF], proto TCP (6), length 1096)
    rpi34.lan.50462 > rpi33.lan.46656: Flags [P.], cksum 0xedce (correct), seq 7308:8352, ack 8353, win 1324, options [nop,nop,TS val 278089630 ecr 278089611], length 1044
1527814413.802504 IP (tos 0x0, ttl 64, id 5643, offset 0, flags [DF], proto TCP (6), length 52)
    rpi33.lan.46656 > rpi34.lan.50462: Flags [.], cksum 0x8482 (incorrect -> 0x35fa), ack 8352, win 1331, options [nop,nop,TS val 278089621 ecr 278089630], length 0
1527814413.802619 IP (tos 0x0, ttl 64, id 41999, offset 0, flags [DF], proto TCP (6), length 1096)
    rpi34.lan.50462 > rpi33.lan.46656: Flags [P.], cksum 0x1123 (correct), seq 8352:9396, ack 8353, win 1324, options [nop,nop,TS val 278089630 ecr 278089611], length 1044
1527814413.802677 IP (tos 0x0, ttl 64, id 5644, offset 0, flags [DF], proto TCP (6), length 52)
    rpi33.lan.46656 > rpi34.lan.50462: Flags [.], cksum 0x8482 (incorrect -> 0x31e6), ack 9396, win 1331, options [nop,nop,TS val 278089621 ecr 278089630], length 0
1527814413.802621 IP (tos 0x0, ttl 64, id 13103, offset 0, flags [DF], proto TCP (6), length 1096)
    rpi36.lan.46656 > rpi33.lan.49740: Flags [P.], cksum 0x1af2 (correct), seq 7309:8353, ack 8352, win 1332, options [nop,nop,TS val 278089621 ecr 278089611], length 1044
1527814413.802808 IP (tos 0x0, ttl 64, id 58555, offset 0, flags [DF], proto TCP (6), length 52)
    rpi33.lan.49740 > rpi36.lan.46656: Flags [.], cksum 0x8484 (incorrect -> 0xb167), ack 8353, win 1323, options [nop,nop,TS val 278089621 ecr 278089621], length 0
1527814413.802875 IP (tos 0x0, ttl 64, id 4991, offset 0, flags [DF], proto TCP (6), length 1096)
    rpi35.lan.46656 > rpi33.lan.43980: Flags [P.], cksum 0xd6ec (correct), seq 7308:8352, ack 8353, win 1332, options [nop,nop,TS val 278088143 ecr 278089611], length 1044
1527814413.802929 IP (tos 0x0, ttl 64, id 35474, offset 0, flags [DF], proto TCP (6), length 52)
    rpi33.lan.43980 > rpi35.lan.46656: Flags [.], cksum 0x8483 (incorrect -> 0x0279), ack 8352, win 1323, options [nop,nop,TS val 278089621 ecr 278088143], length 0
1527814413.803022 IP (tos 0x0, ttl 64, id 4992, offset 0, flags [DF], proto TCP (6), length 1096)
    rpi35.lan.46656 > rpi33.lan.43980: Flags [P.], cksum 0x8690 (correct), seq 8352:9396, ack 8353, win 1332, options [nop,nop,TS val 278088143 ecr 278089611], length 1044
1527814413.803077 IP (tos 0x0, ttl 64, id 35475, offset 0, flags [DF], proto TCP (6), length 52)
    rpi33.lan.43980 > rpi35.lan.46656: Flags [.], cksum 0x8483 (incorrect -> 0xfe64), ack 9396, win 1323, options [nop,nop,TS val 278089621 ecr 278088143], length 0
1527814413.818607 IP (tos 0x0, ttl 64, id 49066, offset 0, flags [DF], proto TCP (6), length 1096)
    rpi37.lan.46656 > rpi33.lan.57588: Flags [P.], cksum 0x4d04 (correct), seq 9396:10440, ack 8353, win 1332, options [nop,nop,TS val 278089607 ecr 278089613], length 1044
1527814413.818758 IP (tos 0x0, ttl 64, id 55489, offset 0, flags [DF], proto TCP (6), length 52)
    rpi33.lan.57588 > rpi37.lan.46656: Flags [.], cksum 0x8485 (incorrect -> 0x4457), ack 10440, win 1323, options [nop,nop,TS val 278089623 ecr 278089607], length 0
1527814413.830004 IP (tos 0x0, ttl 64, id 35476, offset 0, flags [DF], proto TCP (6), length 1096)
    rpi33.lan.43980 > rpi35.lan.46656: Flags [P.], cksum 0x8897 (incorrect -> 0xb1c2), seq 8353:9397, ack 9396, win 1324, options [nop,nop,TS val 278089624 ecr 278088143], length 1044
1527814413.830214 IP (tos 0x0, ttl 64, id 35477, offset 0, flags [DF], proto TCP (6), length 1096)
    rpi33.lan.43980 > rpi35.lan.46656: Flags [P.], cksum 0x8897 (incorrect -> 0xab2d), seq 9397:10441, ack 9396, win 1324, options [nop,nop,TS val 278089624 ecr 278088143], length 1044
1527814413.830963 IP (tos 0x0, ttl 64, id 4993, offset 0, flags [DF], proto TCP (6), length 52)
    rpi35.lan.46656 > rpi33.lan.43980: Flags [.], cksum 0xfa42 (correct), ack 9397, win 1331, options [nop,nop,TS val 278088146 ecr 278089624], length 0
1527814413.830966 IP (tos 0x0, ttl 64, id 4994, offset 0, flags [DF], proto TCP (6), length 52)
    rpi35.lan.46656 > rpi33.lan.43980: Flags [.], cksum 0xf62e (correct), ack 10441, win 1331, options [nop,nop,TS val 278088146 ecr 278089624], length 0
1527814413.901595 IP (tos 0x0, ttl 64, id 5645, offset 0, flags [DF], proto TCP (6), length 1096)
    rpi33.lan.46656 > rpi34.lan.50462: Flags [P.], cksum 0xc2e0 (correct), seq 8353:9397, ack 9396, win 1332, options [nop,nop,TS val 278089631 ecr 278089630], length 1044
1527814413.901800 IP (tos 0x0, ttl 64, id 5646, offset 0, flags [DF], proto TCP (6), length 1096)
    rpi33.lan.46656 > rpi34.lan.50462: Flags [P.], cksum 0xfd70 (correct), seq 9397:10441, ack 9396, win 1332, options [nop,nop,TS val 278089631 ecr 278089630], length 1044
1527814413.902635 IP (tos 0x0, ttl 64, id 42000, offset 0, flags [DF], proto TCP (6), length 52)
    rpi34.lan.50462 > rpi33.lan.46656: Flags [.], cksum 0x2dc6 (correct), ack 9397, win 1323, options [nop,nop,TS val 278089640 ecr 278089631], length 0
1527814413.902638 IP (tos 0x0, ttl 64, id 42001, offset 0, flags [DF], proto TCP (6), length 52)
    rpi34.lan.50462 > rpi33.lan.46656: Flags [.], cksum 0x29b2 (correct), ack 10441, win 1323, options [nop,nop,TS val 278089640 ecr 278089631], length 0
1527814413.904479 IP (tos 0x0, ttl 64, id 58556, offset 0, flags [DF], proto TCP (6), length 1096)
    rpi33.lan.49740 > rpi36.lan.46656: Flags [P.], cksum 0x8898 (incorrect -> 0xc2b4), seq 8352:9396, ack 8353, win 1324, options [nop,nop,TS val 278089631 ecr 278089621], length 1044
1527814413.904710 IP (tos 0x0, ttl 64, id 58557, offset 0, flags [DF], proto TCP (6), length 1096)
    rpi33.lan.49740 > rpi36.lan.46656: Flags [P.], cksum 0x8898 (incorrect -> 0x0605), seq 9396:10440, ack 8353, win 1324, options [nop,nop,TS val 278089632 ecr 278089621], length 1044
1527814413.904944 IP (tos 0x0, ttl 64, id 58558, offset 0, flags [DF], proto TCP (6), length 1096)
    rpi33.lan.49740 > rpi36.lan.46656: Flags [P.], cksum 0x8898 (incorrect -> 0xbd23), seq 10440:11484, ack 8353, win 1324, options [nop,nop,TS val 278089632 ecr 278089621], length 1044
1527814413.904971 IP (tos 0x0, ttl 64, id 55490, offset 0, flags [DF], proto TCP (6), length 1096)
    rpi33.lan.57588 > rpi37.lan.46656: Flags [P.], cksum 0x8899 (incorrect -> 0x21ca), seq 8353:9397, ack 10440, win 1324, options [nop,nop,TS val 278089632 ecr 278089607], length 1044
1527814413.905449 IP (tos 0x0, ttl 64, id 13104, offset 0, flags [DF], proto TCP (6), length 52)
    rpi36.lan.46656 > rpi33.lan.49740: Flags [.], cksum 0xad37 (correct), ack 9396, win 1331, options [nop,nop,TS val 278089631 ecr 278089631], length 0
1527814413.905452 IP (tos 0x0, ttl 64, id 13105, offset 0, flags [DF], proto TCP (6), length 52)
    rpi36.lan.46656 > rpi33.lan.49740: Flags [.], cksum 0xa922 (correct), ack 10440, win 1331, options [nop,nop,TS val 278089631 ecr 278089632], length 0
1527814413.905695 IP (tos 0x0, ttl 64, id 13106, offset 0, flags [DF], proto TCP (6), length 52)
    rpi36.lan.46656 > rpi33.lan.49740: Flags [.], cksum 0xa50e (correct), ack 11484, win 1331, options [nop,nop,TS val 278089631 ecr 278089632], length 0
1527814413.914807 IP (tos 0x0, ttl 64, id 4995, offset 0, flags [DF], proto TCP (6), length 1096)
    rpi35.lan.46656 > rpi33.lan.43980: Flags [P.], cksum 0xfd57 (correct), seq 9396:10440, ack 10441, win 1332, options [nop,nop,TS val 278088154 ecr 278089624], length 1044
1527814413.922671 IP (tos 0x0, ttl 64, id 42002, offset 0, flags [DF], proto TCP (6), length 1096)
    rpi34.lan.50462 > rpi33.lan.46656: Flags [P.], cksum 0x3597 (correct), seq 9396:10440, ack 10441, win 1324, options [nop,nop,TS val 278089642 ecr 278089631], length 1044
1527814413.922816 IP (tos 0x0, ttl 64, id 5647, offset 0, flags [DF], proto TCP (6), length 52)
    rpi33.lan.46656 > rpi34.lan.50462: Flags [.], cksum 0x8482 (incorrect -> 0x2592), ack 10440, win 1331, options [nop,nop,TS val 278089633 ecr 278089642], length 0
1527814413.933369 IP (tos 0x0, ttl 64, id 35478, offset 0, flags [DF], proto TCP (6), length 1096)
    rpi33.lan.43980 > rpi35.lan.46656: Flags [P.], cksum 0x8897 (incorrect -> 0x7b67), seq 10441:11485, ack 10440, win 1324, options [nop,nop,TS val 278089634 ecr 278088154], length 1044
1527814413.934271 IP (tos 0x0, ttl 64, id 4996, offset 0, flags [DF], proto TCP (6), length 52)
    rpi35.lan.46656 > rpi33.lan.43980: Flags [.], cksum 0xedf2 (correct), ack 11485, win 1331, options [nop,nop,TS val 278088156 ecr 278089634], length 0
1527814413.952040 IP (tos 0x0, ttl 64, id 49067, offset 0, flags [DF], proto TCP (6), length 52)
    rpi37.lan.46656 > rpi33.lan.57588: Flags [.], cksum 0x4023 (correct), ack 9397, win 1332, options [nop,nop,TS val 278089621 ecr 278089632], length 0
1527814413.979363 IP (tos 0x0, ttl 64, id 13107, offset 0, flags [DF], proto TCP (6), length 1096)
    rpi36.lan.46656 > rpi33.lan.49740: Flags [P.], cksum 0xded7 (correct), seq 8353:9397, ack 11484, win 1332, options [nop,nop,TS val 278089639 ecr 278089632], length 1044
1527814413.979468 IP (tos 0x0, ttl 64, id 58559, offset 0, flags [DF], proto TCP (6), length 52)
    rpi33.lan.49740 > rpi36.lan.46656: Flags [.], cksum 0x8484 (incorrect -> 0xa0f3), ack 9397, win 1323, options [nop,nop,TS val 278089639 ecr 278089639], length 0
1527814413.979581 IP (tos 0x0, ttl 64, id 13108, offset 0, flags [DF], proto TCP (6), length 1096)
    rpi36.lan.46656 > rpi33.lan.49740: Flags [P.], cksum 0xe482 (correct), seq 9397:10441, ack 11484, win 1332, options [nop,nop,TS val 278089639 ecr 278089632], length 1044
1527814413.979630 IP (tos 0x0, ttl 64, id 58560, offset 0, flags [DF], proto TCP (6), length 52)
    rpi33.lan.49740 > rpi36.lan.46656: Flags [.], cksum 0x8484 (incorrect -> 0x9cdf), ack 10441, win 1323, options [nop,nop,TS val 278089639 ecr 278089639], length 0
1527814413.979877 IP (tos 0x0, ttl 64, id 13109, offset 0, flags [DF], proto TCP (6), length 1096)
    rpi36.lan.46656 > rpi33.lan.49740: Flags [P.], cksum 0xf29c (correct), seq 10441:11485, ack 11484, win 1332, options [nop,nop,TS val 278089639 ecr 278089632], length 1044
1527814413.979927 IP (tos 0x0, ttl 64, id 58561, offset 0, flags [DF], proto TCP (6), length 52)
    rpi33.lan.49740 > rpi36.lan.46656: Flags [.], cksum 0x8484 (incorrect -> 0x98cb), ack 11485, win 1323, options [nop,nop,TS val 278089639 ecr 278089639], length 0
1527814414.003237 IP (tos 0x0, ttl 64, id 5648, offset 0, flags [DF], proto TCP (6), length 1096)
    rpi33.lan.46656 > rpi34.lan.50462: Flags [P.], cksum 0x74d5 (correct), seq 10441:11485, ack 10440, win 1332, options [nop,nop,TS val 278089641 ecr 278089642], length 1044
1527814414.011058 IP (tos 0x0, ttl 64, id 49068, offset 0, flags [DF], proto TCP (6), length 1096)
    rpi37.lan.46656 > rpi33.lan.57588: Flags [P.], cksum 0xc581 (correct), seq 10440:11484, ack 9397, win 1332, options [nop,nop,TS val 278089626 ecr 278089632], length 1044
1527814414.011225 IP (tos 0x0, ttl 64, id 55491, offset 0, flags [DF], proto TCP (6), length 52)
    rpi33.lan.57588 > rpi37.lan.46656: Flags [.], cksum 0x8485 (incorrect -> 0x3c09), ack 11484, win 1323, options [nop,nop,TS val 278089642 ecr 278089626], length 0
1527814414.016930 IP (tos 0x0, ttl 64, id 4997, offset 0, flags [DF], proto TCP (6), length 1096)
    rpi35.lan.46656 > rpi33.lan.43980: Flags [P.], cksum 0x07ec (correct), seq 10440:11484, ack 11485, win 1332, options [nop,nop,TS val 278088164 ecr 278089634], length 1044
1527814414.029329 IP (tos 0x0, ttl 64, id 42003, offset 0, flags [DF], proto TCP (6), length 1096)
